{"currently_reading":[{"Id":"Currently Reading, Started Wed 12-31-2025","Started On":"2025-12-31","Book":{"Title":"The Tainted Cup","Cover":[{"id":"attoD3xRHPGuwcv5W","width":987,"height":1500,"url":"https://v5.airtableusercontent.com/v3/u/49/49/1768197600000/HGISZMMD_hIRaGskLgYZWA/46r2CjvvfqYgq5Cq4UA71Nq-nd57rn9pVfIE2D17-5ELsMt-xIhMqvQq4oHJII1Cww-TuC-0Qh4Bm5X3GeMKEKEIzRu7b3dyg9ltBpPmA6hh3l39TXsJdrHlKGTXDX80_ageqrHSpcRGz382ngFsmQ/BzAY--HIm0A5JgOwKlVOQMXPoe4C3PH-oRrqvT4h-BI","filename":"150247395.jpg","size":272026,"type":"image/jpeg","thumbnails":{"small":{"url":"https://v5.airtableusercontent.com/v3/u/49/49/1768197600000/jOYYmKD8FMJ6WfMSsyJAvw/85JonBy5OgZSX9wjfPsAn3WQ6Vn3Uf-WTyFMEkEJ5HWwcm5mWqtmHzlKNzvCnkdFLGalJEwHDIuxvFwIeWE-b9mzKKwKQelUdZmyqKWoo4wGURrfeKf7hEGikR182L2c-KcoYafZib1Apx1jTm_epw/C-7nFKYd2vx8KEtX3wnm3ttWOIqfUZEY476lgZ83p9Y","width":24,"height":36},"large":{"url":"https://v5.airtableusercontent.com/v3/u/49/49/1768197600000/rQCQEdxpwmSLj0rkKa-nqA/5XyuNJ8zyPqYfC_wnMvwt2SRqNkvt9iTadmxB4Vn9Y7ektRskDZs6ZHKOuvLHzNIq1pG1pqoUWfU_CNXurvz3VPkzyy1fHDL_Pl2pZjmUQ1hUSuLXc9pyNJGm1kc3amkdB_kqUahoRxpuPnRFKpL_w/_Ezylq8mK7R42RYiHY54No1nhlaH9XHsXWD6DaMXoz4","width":512,"height":778},"full":{"url":"https://v5.airtableusercontent.com/v3/u/49/49/1768197600000/tsy20EcHkEynZbMJfiCfpA/n9jOpZGZfb4js4QYELYXAWkdnx6HLufs3ad6Gg7yMkyRyt0XnlvsJ68vY_HLanJSTRtYBQUuiaHsC3hXPSCpzSQEVfe15CM0DNb3d16MLoLzCF2McWULPmSdGyrESK1sBWvf2mkY_to2m1or1ZjBOg/AWE1IsKTq_LT43fts5lH8prkimH_KBkhmpyqnhOF1Fk","width":987,"height":1500}}}],"Authors":"Robert Jackson Bennett","Series":"Shadow of the Leviathan","Series Number":1,"Readings":["recGAky7JVPSChz2n"],"Date Added":"2025-04-21","Genres":["fantasy"],"Author Background":["by-men"],"Number of Pages":410},"Read In Year":"Not Yet Finished","Page Count":[410]}],"by_year":[["2026",{"readings":[{"Id":"Sat 11-15-2025 to Sun 01-11-2026","Started On":"2025-11-15","Finished On":"2026-01-11","Book":{"Title":"Quit","Cover":[{"id":"attfvBoBqUw9qJLcp","width":1696,"height":2560,"url":"https://v5.airtableusercontent.com/v3/u/49/49/1768197600000/KEU8ELDNxR2AUr4Ny57Xbw/VMif8M2rzSdbWTnlwMAtzsR4Vm0kvvYr1299cln0fAxB_lVEAu7QyTdX5jbXRiAEe9XhXezyLbejyynnLs2RUkZCPDnhsnGyagFjtziSn4jqrnvl4TwxmyH8psL7wiFEvaYmK4jTiXDY2O0igTJi9Q/Ftjm8RCcYA8X6DbCbk_bQyZOmkzVca0OipxjE4H0Plk","filename":"60097435.jpg","size":131634,"type":"image/jpeg","thumbnails":{"small":{"url":"https://v5.airtableusercontent.com/v3/u/49/49/1768197600000/UHrJxgeYQEPOBRgmtXehhg/YPgvffXCEGt54_bEOhE8Di1VbBS8WbsWcY2jKkFLTRhC-QC-FjEoIObBPf3ruBlg2rT5TlWzm-4Z0eW9nB21gqx_MI-Ce29ca7WCr0ad64q3igIeu_5_WnifgK7sgvrQhyHwx-Mad3fN17JE81H9cg/AQ85Lgiv8SY8qp0UCmgIGR6NX1C980uUCQFYAbV4ZNw","width":24,"height":36},"large":{"url":"https://v5.airtableusercontent.com/v3/u/49/49/1768197600000/jHwSGnGQmqkJ2WC3kjnmKQ/570efw86vY_ED0mxoTgWhUvO0am6QCljSPuK19USFa1L_K6BUulNg9J05FSQJWcRiIVtF5S2rJ_zpMadBCTT_GCZGMiz4IQW3NYVSNTKCxHsUhZxpxTCuaFJLfMZF_uUwgbasxdcKviiX0iwO36KZQ/UHhPzRRRmfDstkU1t6dK3sIhQfmTy6TpMkR_KEJgtVg","width":512,"height":773},"full":{"url":"https://v5.airtableusercontent.com/v3/u/49/49/1768197600000/kLl3PFr4iZXzqPNMBP6flg/gnKsaWmbx_6hRjkVV70BQIwoBENbTInYPeaDyMmRwLg4-o8AO7zEz4mkVWkX2cLWZO8iwEOZJi6eeP4JMbBKUzZT7tAtzLBlfgdqKtq2jXxjawoLWrNQ3O8m_huyComo8IU_Pqy1PuRXAnUmExtbdQ/6D_h9H52ZxG_RpXsfMrny21kZjePMMYVrBIwC5vR36o","width":1696,"height":2560}}}],"Authors":"Annie Duke","Readings":["rec2w3xfLJTBE4PgW"],"Date Added":"2023-11-04","Genres":["nonfiction"],"Author Background":["by-women"],"Number of Pages":336},"Rating":2,"Read In Year":"2026","Page Count":[336]}],"stats":{"Author Background":{"by-women":1},"Genres":{"nonfiction":1}}}],["2025",{"readings":[{"Id":"Sun 06-01-2025 to Wed 06-18-2025","Started On":"2025-06-01","Finished On":"2025-06-18","Book":{"Title":"Rivers of London","Cover":[{"id":"attRt6Cee4oDVLISG","width":293,"height":475,"url":"https://v5.airtableusercontent.com/v3/u/49/49/1768197600000/0ZluxAmcl3nwotHGmVQOtA/ubHOqZGGgO_yFGO8PaH1nW5QxEUjha90fSzuZfecoZ-HUvpoGu4JMYeJuQ-fOn5hSlvOUSy7JXaGM_fAFw1fPT1BnhjvVPCj4YUqBDC0GKizMs8kddaOvJxueufHem-fUowhbvfoSCG0odHHkxM-5w/pZLBeJX6gwHaUWXJri4UHF1XDar7jynyp4626VfzfPo","filename":"9317452.jpg","size":121122,"type":"image/jpeg","thumbnails":{"small":{"url":"https://v5.airtableusercontent.com/v3/u/49/49/1768197600000/wwx2RP0IpfQowElTy0lNcA/Bi_q4xIiwdKMjW4BIKFTnPFiQ-0m579sVgeAE9k_cOr93rdQulr7beV83uAanIUmoaRqMpuC63Z7VFR0BcFqKcqYKmaA_iOn0jBeeMvUchvRrhQu_FIQ2RIT-6t3_aNKcEzegIdXHHztwEwCi_CsPA/BOsdnXK_XQtqYx4ZWhGoc14B0wlT6fyWv55uMP1NXmE","width":22,"height":36},"large":{"url":"https://v5.airtableusercontent.com/v3/u/49/49/1768197600000/E08Y2uhlZIGVn1edhk15ag/jGJvKir9XwvnxPqA0N5hB-SV9XA-zUlMUm0VLQbAyTu1_EJ-iUnUxzHvMVYbZHkt82ArBSktowICXl9uCnPe-W8MOyOGvTTj6sAakAOqT7rBwG7bJ0-OG_TV06ULrxSDLOL6p5OuSkT2xVfgW-eGWA/rBmdgjEwcS16zyx8RoA2_tFp9nAP3cNF7Rnrs8GF7Ak","width":293,"height":475},"full":{"url":"https://v5.airtableusercontent.com/v3/u/49/49/1768197600000/AXeMj7B6t65HSGsVXBJD_w/mrrODL_nF3tS9hGTw_EI6-4eoVuXHmgklEObNL0GmSLxFOzZsBZf1aer6mLeZu7ESZBM-YEVSAk0lEAQ7ME7RtpdnyLPl8jDSwgw0Lv2PSbqApppwrgE9aer2HPfFnRzc9UNO1TDpy2DZgzayH48DA/QdLx6enTGQE1YN8sN7KGIBmLKEFG2NWk9jOSTCObTr4","width":3000,"height":3000}}}],"Authors":"Ben Aaronovitch","Series":"Rivers of London","Series Number":1,"Recommended By":"HighlanderAjax","Readings":["rec02tVpf3R7Qco2E"],"Date Added":"2023-09-30","Genres":["fantasy"],"Author Background":["by-men"],"Number of Pages":392},"Rating":3,"Read In Year":"2025","Page Count":[392]},{"Id":"Wed 07-30-2025 to Mon 08-11-2025","Started On":"2025-07-30","Finished On":"2025-08-11","Book":{"Title":"Abundance","Cover":[{"id":"attZtVk9YWVMooq3p","width":331,"height":500,"url":"https://v5.airtableusercontent.com/v3/u/49/49/1768197600000/Vy5eadxRWGYF_YMN03L1Zg/Z7uhdpfjn_X4phTMIluObCiF8C6FrkHTYL-DXD83dtTKcY5u8fg90d9ZksTsxx3runlU_1wi3wzBBrHGzgtQPHuXJ-M5HiRkdahVO70cKh_41qx7Pf_ZRoa3l9iaes0EcHMkD1KW0D3RbUBfgpRhMw/qXWWGuB15xyO2VWIhc-vSwq5DrxdjKmtesTlzB0BMRU","filename":"176444106.jpg","size":27880,"type":"image/jpeg","thumbnails":{"small":{"url":"https://v5.airtableusercontent.com/v3/u/49/49/1768197600000/Y1ivFzMHPLsCb8CVtTsikg/NA7vr0QN09QM6GVuCtJWmt7roXkQD650s7IDdfPn-3kr08xN6AyoQBwvijZON2aJEal0FcVCeLIeblrytOnquNkqDNOWJEyokToF3w6Z2v_ndhFWWJJ6as_BjLThzwRQNJk-jjo8m5e4_UGP-gdV0A/aRu3bImZDgoNfDJI8bQsS7XrlER032hiPke5ODQ5tiA","width":24,"height":36},"large":{"url":"https://v5.airtableusercontent.com/v3/u/49/49/1768197600000/QNJHUQNJHCCZIfP-jWriJw/inpxOywX4OXRHWF2nuJXjlcMx243LJS2AZTPxYC7K4tOjtrnJ1aGYOlngrNS7TB1lVcuYheT1-XcKJMAP3aiau9glIOvgMNPKoFujpWRoy0K2GR6GkzKyTzGe8cf6UD6Z6ATaql-pLxtrTXYkxBUqQ/e7kbmc12FIijrdCR9FOCi0m5w9lv59O8DSXrhmLSWmc","width":331,"height":500},"full":{"url":"https://v5.airtableusercontent.com/v3/u/49/49/1768197600000/x_-nEOb8crnzUcK1Qhoi_Q/vr-tV9dCSxGI1WUn8ZBao_GaYUqkPsTRkeuvJSjccbVQybDOe1QsbFd3_v50o9NGt9Ll_Epx0bSfYhXFecpisarTAeUBUztVpUln9am0XcZ6ogfbw0jTCqoMXIC1qG404nL4cb-Ji1U-r56HZKD_CQ/3FALgA9hhiq6Qkfmus5QXB5WwXEQjSTjRpW6jvKc1rM","width":331,"height":500}}}],"Authors":"Ezra Klein","Readings":["rec19DT5vtLGuN86b"],"Date Added":"2025-04-15","Genres":["nonfiction"],"Author Background":["by-men"],"Number of Pages":304},"Rating":4,"Read In Year":"2025","Page Count":[304]},{"Id":"Sun 01-19-2025 to Mon 02-03-2025","Started On":"2025-01-19","Finished On":"2025-02-03","Book":{"Title":"Selene Shade: Resurrectionist for Hire","Cover":[{"id":"attCNMekWnfcFXdBg","width":1286,"height":2048,"url":"https://v5.airtableusercontent.com/v3/u/49/49/1768197600000/h8nltDErtVUvvaD-fz8bGg/bjmT0onVrpAyabKnwdNr0JCw0VCzU4p43BIuXWrfsTwvd4TOHoDSyDHiVYE_ZLpptCu2OoOi8DwRjbpvaUu1RG0SbN8m_KJfSCKnyq7vsFd04etaogGpmsmy52m8ynbYoi5cKcXH_MT6D7DK1otVuw/rkbkBpha2iNVNKhRYbiEhcjHtf_87AxAhdpYhTKHlQs","filename":"205307192.jpg","size":1070944,"type":"image/jpeg","thumbnails":{"small":{"url":"https://v5.airtableusercontent.com/v3/u/49/49/1768197600000/pZvqNjWljKRWMdbevEKy3w/q8RFAW6CLapFLxpY9D5yby0tTuB1KP3dERihpeHocY3kog4KI_NL23oOfq05s-4uw24cZDJdoZq16aTl7KwbdfAU0CXw5ZsdSBsdZoIGuvDnjF_A1gkigbiShZnQ41Vh8D8TPMy_UNkaM_xouzAnYw/Ip0d8SrADWOK93faQoW0XJvVivXzR_ba_pelsC3Lga4","width":23,"height":36},"large":{"url":"https://v5.airtableusercontent.com/v3/u/49/49/1768197600000/yvMVFNCJBfveOjp7B8HJtQ/1XyxcgMoMAyPPXVOheomwtKjveNXkbu4utnA8bhGiT_lecaUXDw-aM5RIoU_3pIYQULoj7CLq-4amO1JjROtH-muK2lYpoBI3XuAUJf2_Nw20qtkRB-PGXhBLj73SOEgpdrGRn-gr9dUiVl_FN_hwg/bTUCVj4pCUUZDzajzgUQ0Af2vFkBNP8k7fZRODXaqA8","width":512,"height":815},"full":{"url":"https://v5.airtableusercontent.com/v3/u/49/49/1768197600000/pqVuPB-TlLRKOYGVJUgtoQ/kb328Zn2tHxAw1-5MrpaWwpBdCY7dRgUuJ6Ccuk2BIEIE6htiupHfRN7rT1HlLqPET99CtYYgqYOFjc9u5PordQMimIGVsUVXoDwdgnsMTyaGtrObsuV-XovU3gFGm0tSHdGcVNz3zRPIJtbFSrh9g/1O1jidAJJpNhiuwXLRqVq3ZRZyd4QxsyCwpDZhmZp1U","width":1286,"height":2048}}}],"Authors":"Victoria Dalpe","Recommended By":"Lianne","Readings":["rec3SZzDnYSOTBHPV"],"Date Added":"2024-12-25","Genres":["fantasy"],"Author Background":["by-women"],"Number of Pages":278},"Rating":3,"Read In Year":"2025","Page Count":[278]},{"Id":"Mon 12-01-2025 to Tue 12-30-2025","Started On":"2025-12-01","Finished On":"2025-12-30","Book":{"Title":"The Stars Now Unclaimed","Cover":[{"id":"attOhxjfY8Iew2NBG","width":200,"height":300,"url":"https://v5.airtableusercontent.com/v3/u/49/49/1768197600000/N_g5h007TPsWYvXIjpWCFQ/zqjS0arQAgToxsOwLvmhueq8KZMe-fUG0psD0t3IIzBkyAiW0vCKy55NC0ObNvb5k3Q0Ok-FN1MqXkM8O7nktBnPzFd5rQBcQrCBulCqkNZ9jZm8kJctnMGcfgovF0biniS4_7SRyDZ1VzTgmIFtQw/KenJgRAbik_wTweKfD0tyZ7TDzs6mV4RnCMyHAG-xzY","filename":"35612392._SY300_.jpg","size":20908,"type":"image/jpeg","thumbnails":{"small":{"url":"https://v5.airtableusercontent.com/v3/u/49/49/1768197600000/hmJa8EHKhsjIDZ0ZMTBVFQ/itXPD1mQgZJ5F5soe6NYqSFmuNSHpr_NOVfM0DGe74XsSgi-VmGNT9ovmDqJU27dS3JNq8-hJsJJP64eBZ33lfbs8fgAjg1W8Kwb6qS5dUS4C4OjK488oS3afXjbo-puzX0ss46i2QpxYBcuxExVzg/-H_W4aefVqjFI36TB08VRuEiAGtVuyMwx8s0e3mCbS8","width":24,"height":36},"large":{"url":"https://v5.airtableusercontent.com/v3/u/49/49/1768197600000/o8hDmlMNSw2vazyORYxUeA/TI96bpoerkBkOM92o9pglGdZDUAN_YejIMHG8DmWig09uKN77huqAS4jOz9NFc3buX6NV1SyrtYB8x57ndlVFm22IdVRXVMPT2m4hV1snaRDNFnOUaH4im6xH_cElBYQGciCiFdMj2__rd4JDxTzbw/d2Qfuex5azDg-nzj73Bid3SQU0sBQEpsvjPkSLAAgXU","width":200,"height":300},"full":{"url":"https://v5.airtableusercontent.com/v3/u/49/49/1768197600000/33EbZ_TTznuGrFkEQj_3vg/bh8XL8xl86UR8CfEbOmppmlh3PkL_uy02bNgGBU68KwUPQ1AkNkkxPhseBG0PV35zW_0IEgc1xS-86ZOsbt11EOvuuV-oLchAHvpD6ORCvwi4GIjEEVq2x-DG_xNb06j57nT9-knNnAg63_F5F-QGw/lR-0tuEJLW-lgf47FHfWC6s6tKjOBr8j2khaiVM6-Mc","width":3000,"height":3000}}}],"Authors":"Drew   Williams","Readings":["rec5CBoOTU92gCavy"],"Date Added":"2020-01-19","ISBN":"1250186110","ISBN13":"9781250186119","Genres":["sci-fi"],"Author Background":["by-men"],"Number of Pages":447},"Rating":3,"Read In Year":"2025","Page Count":[447]},{"Id":"Sun 08-24-2025 to Sun 09-14-2025","Started On":"2025-08-24","Finished On":"2025-09-14","Book":{"Title":"Dead Man's Hand","Cover":[{"id":"attDN9KU2xWzJreBp","width":740,"height":1117,"url":"https://v5.airtableusercontent.com/v3/u/49/49/1768197600000/Fuj6yemf_8orfOF-VG1h1A/rwdILeXAKhzuQz2EK1LxL5S3liC2_fZPk-eLaTgLqBxU6DfAK0lI-7u8KTQ8ZTI3OXdn9lt-F7wFr2_x8Tbee_2Kp2UiPeORPt-HqCLAM7t5E79aWNuYKJ2XKPYsvF6d1zErLiAsd6FLkN6AVMxhGg/aC92FpWJvo-1lpvZOqSnEJUe9yhMSKP6PDWu4SMjD1s","filename":"60097440.jpg","size":696332,"type":"image/jpeg","thumbnails":{"small":{"url":"https://v5.airtableusercontent.com/v3/u/49/49/1768197600000/bjquCut7i8YTDW4lr5OwgQ/QvHG_KEM-9GU5_YlGfLqRzgEYPknSaYw4FHpCulxmGvGojL7d4CmXbQtnTLs-GoXd4rA35hbBqRPtqhPMW1-aQV9-8AXsN3tyt9IzIWfQ2Z94dzynxhk4FHcigvKVR4t3u6vVHXDyZYnc_dTo8WQYA/C2blMPLCHg4F1dQ33FrGtmzg_L8gnB-Db3xJuZEKJ5M","width":24,"height":36},"large":{"url":"https://v5.airtableusercontent.com/v3/u/49/49/1768197600000/3spvlfyEhDCfsXRmCmLX4g/wXmLsfhHCrOxRLEnYY16C7R_t8PRIAcmd6xx8empd3DZm8MQPxI5CoGyu7TBmG3GAJxB-2W0XTXntA0e5MK_MERH9WQfxQOubfcq09n_ddXFEZEv6NBtteZVb6Nfsd1Fkg1EIzhw9o2tyMBH7TlUBg/QJLQyvw5wj4kB3gabjozZDxUYdaKKCKZLHe5DVI-Xjs","width":512,"height":773},"full":{"url":"https://v5.airtableusercontent.com/v3/u/49/49/1768197600000/Mb7_GkKNOeZ106uGZmT9Yg/DW1rdctfLxemh73Pv8t26nQA5nBy1j1w78OSp4A7VRP2XARHLgdyfUbg8b4QX-6l7mAjdRtAPsNAtnxAb3thrG_u-Ms8KWY7x8Jplt-dYRjzpm-9cSKc5rSTzj5s1KlgFLA7HUf7oXe-kguRcKvUNA/VTAFDbJ7DRIh9C78uLmphKWkOJ9D6g0inLOEoTtlCFo","width":740,"height":1117}}}],"Authors":"James J. Butcher","Series":"The Unorthodox Chronicles","Series Number":1,"Recommended By":"HighlanderAjax","Readings":["rec89QUJZGPBLJRj8"],"Date Added":"2024-01-02","Genres":["fantasy"],"Author Background":["by-men"],"Number of Pages":373},"Rating":3,"Read In Year":"2025","Page Count":[373]},{"Id":"Sat 11-08-2025 to Sun 11-30-2025","Started On":"2025-11-08","Finished On":"2025-11-30","Book":{"Title":"Come Together","Cover":[{"id":"attHW7xYNvLC7a92O","width":300,"height":456,"url":"https://v5.airtableusercontent.com/v3/u/49/49/1768197600000/izdz7Ey8JDimPZYpflWffw/Fu8D6429_epyVldgOFTOCE7-tTEPCKbSTyIWiSj0ZCmOJzWFBVZ7GG0rIcCULG8jYj09GXE-uaCHZi3eyKvoFCcOvlWeN25W4LTNF4vC74DKN5GLAz9b8uPRvSn6aIbhRc3mFUxzHE9QL8PTWczY-QtkU-XMrUmT3KtSULv_by8-fVWn4_usNUjRKvsUWlJ1/3CrOa9elHbM8ooCPChsJL0m4PrYhnPtEqEzACogBWSA","filename":"zg1g5fp95hwmxuqfyqcz4fh9rtl5.jpg","size":20085,"type":"image/jpeg","thumbnails":{"small":{"url":"https://v5.airtableusercontent.com/v3/u/49/49/1768197600000/JPG4uRw29h4YKd3yjw5Msg/3Cf3nl_pFKL87F0bC8XxvRzuTI9SOIPB7QQKzl25Kstd36zKScDiLdhLWLmjRIMBhMtFLgfSwowpf04f9T2FSyCdfUFb4WjqgV82HQmD-bEj4DSGQiU_49_IuYKrXPOhkJbXgYUfHxHgOPr7YkDgcg/SNgCGc7JRlydH0ajv8AVpYvdIJSq4K3o5upePiGC5lY","width":24,"height":36},"large":{"url":"https://v5.airtableusercontent.com/v3/u/49/49/1768197600000/HJLUDlg138dgCuYgGx16ww/8iLb0CbYoZsMY_O5-i8VttEkTdGkCuBg571ZAByWPk0AdM-FsOQ7-0biBflGILcRuOLyXjjgBe9Kd11ahuMhzkwinRzdt2wg-M6dnSBRXk_CFVCNH0nswayhAF9Dbn22S9TV8xE651-EzxjxJdljDw/wogZUrggP76Hc684gxeQ7Ygfjp9kWaomrnytPKk146M","width":300,"height":456},"full":{"url":"https://v5.airtableusercontent.com/v3/u/49/49/1768197600000/uQvCy10Zv8PykM2wP9nn3g/IjGQTO7N6CJoDtHI2b-bqvFOXlES45rssp8oeiHAoNEaYMFhK79ONEm5ivSqaLJdGZCqdpHlxLRvpxmZFmJLtkYAQ4QBVIgnGcJoCAj_3skiquyKrpCIVLWuRYESPhl2ByLTDTtsIPyhXns8iTqzzQ/Kij_0Uldg1u-U5emp4X4vDFxb_LNI8eOTQQ60Rbc1IQ","width":300,"height":456}}}],"Authors":"Emily Nagoski","Readings":["recDsCCNPkisLoHXm"],"Date Added":"2025-11-11","Genres":["nonfiction"],"Author Background":["by-women","by-lgbtq-author"],"Number of Pages":368},"Rating":4,"Read In Year":"2025","Page Count":[368]},{"Id":"Wed 08-13-2025 to Thu 09-25-2025","Started On":"2025-08-13","Finished On":"2025-09-25","Book":{"Title":"How to Be Perfect","Cover":[{"id":"att1hBkRoqMirEkxI","width":1400,"height":2125,"url":"https://v5.airtableusercontent.com/v3/u/49/49/1768197600000/juEZbW8wveQfuZX6Z-es4A/-mVTeSbfMEQyPGPwHr3cscA3rqPM9h6xb5BzXMpy9Mup3RyE6fT_tBipoYiuTRMAnsfAK1wFWBqe3wzpNHzRSfD4A1V9Jj2Al4WlbMiipDHS0geAM4D2ITAoI4Jl3kxY3QnWEK8APGWdu4mIgLlDig/hNOIsUHKDq5hNJKauZBjvr1Q80ZkZQ15HdUK-YFESuw","filename":"58484901.jpg","size":127067,"type":"image/jpeg","thumbnails":{"small":{"url":"https://v5.airtableusercontent.com/v3/u/49/49/1768197600000/qXQ5pokhu54-UyQ-klzOOQ/cRF3OawT6NjEwI5KBQabA-ajapcGcxS4MST5aiJhf3jt35R7rKZuBw8Q9nMZqIDU-hVYKmNG5GVP89qLObM6WR0kRl2IIsCOn9mur3xc7ky0VZLmSSLNK3aHe22z7qv2KBlwJpR7mFWLNjvNHb8Fdw/fC3wbHqCdxaC0kuz6G_XFL_6MlKzMPtTJUIaeOEyx2o","width":24,"height":36},"large":{"url":"https://v5.airtableusercontent.com/v3/u/49/49/1768197600000/4BwAGERbtYPmnr5sfndM9w/9zCXqzKpSGeuFbN8I1lrutJUJ829LPvWGj-7F5JzqdomaJeCerbKVXjswWdvbPCJJkhW_TlMGrZrs1CCSjdaw_hkg75rodzwzzyrOnBdpYwNYyvtfLYwv4eFFjTw9KujkfJsfl9YjfPNR38sZUmpoQ/Ti6ePdAzrGJJ2NqQmgsqgnDTdL6__eDppHaw25kDhQU","width":512,"height":777},"full":{"url":"https://v5.airtableusercontent.com/v3/u/49/49/1768197600000/TkUwpr6Dye1crT56jd6mew/RlMpySx7TEeFi-goK14F8KaB-Rp2Qb3xQ9ueLoa9YcxbkT6JqhD6axp7yhUKYPkTPoVgbb8Z9fVxv2EwGKTGNpQ1JrhegS4kqRrOzn9pIqhJ5Df1mB6QySGt23Hxb0w0CCpLwYVcmqZfUa19YG6eww/2t8LcFdQ3dusqVwubCyujWMa7Bp-NC4XyLPyg92HEFs","width":1400,"height":2125}}}],"Authors":"Michael Schur","Recommended By":"BetterThanT-1","Readings":["recG4dGoW3VvvgTbA"],"Date Added":"2025-05-28","Genres":["nonfiction"],"Author Background":["by-men"],"Number of Pages":304},"Rating":4,"Read In Year":"2025","Page Count":[304]},{"Id":"Thu 06-19-2025 to Sat 07-19-2025","Started On":"2025-06-19","Finished On":"2025-07-19","Book":{"Title":"The Folded Sky","Cover":[{"id":"attbUxUi0OfOcT1MJ","width":333,"height":500,"url":"https://v5.airtableusercontent.com/v3/u/49/49/1768197600000/tgb_PNC4gVPoNNnQt-OvZA/qOebve4XN7qaV2H5g3D0mmZKSbx-r_hmDuyy3JwamqfLkVN7UOA0XxQ1mVOx7G1m3uJEXIiJCYksjoP9WLLuVvPxVQnbvmgrg4lPi5nYKdpsxC8UB6ZPZPk_qna767ZzuZ9CGn0anC7lrvLkT7nvoA/ihD2i0n_2HOWsoq3_2GXYjXaFmtb4q74BJT5olZj5XQ","filename":"220195781.jpg","size":35519,"type":"image/jpeg","thumbnails":{"small":{"url":"https://v5.airtableusercontent.com/v3/u/49/49/1768197600000/fktrYjw11FsaWathN_sc0g/o-wrik_kZ-R8iF-RRefijluVAEAKSYLmyF72-xHvOZUNkbCPnkhrgdTWlAILNfMZx3Z6zzZMtm6i2lLQaWnm3eRI07BTMrUXRHfYqkq5f9hjSMjt2_G1RuWdAh72FeZwTiY7TJK7JcgjVk6GJJEyFg/pyn-UaCvQDpTAM4WNAoi9dx_YhttShvesNfDemGatUY","width":24,"height":36},"large":{"url":"https://v5.airtableusercontent.com/v3/u/49/49/1768197600000/AMfucLGh0VgkVu7T7kr6ng/lO6w_-JMYWWYxhOKItFwB2R1x-5KkAjsWmXZ7vrYvwbJTQmE3z5pSRyQXKUG9cOnjbAINXbybm0Do_yIHUDjXNcKm_CWW_hjXL59MxbeBx38qservgfl1uNkL4zU7baONAoBFFcu2NLAZX5c3lWxoA/hAKYJ8_WtKfizwejuOg2XN8uEgmFFSr1FBkiUzjdj9c","width":333,"height":500},"full":{"url":"https://v5.airtableusercontent.com/v3/u/49/49/1768197600000/7KPsX61OdhR2v7b6tt6L2A/csImMalcImFB8pSbC07paCQkfOs03VqW9pngjhGWxkp1dJw7j9xz7QmnYsGCulnaUUgNzhYwVYEzagY0Cm6beKkZolF_KvqRzQbRPjke7pXMUnwSkhDaeBGoEkC1v3IFZBivzUGhWWm650-DXWpVkg/sXVeiefPEO4tM6eUYJvqYM5DkmyDRPuUSZiK4TciBFQ","width":333,"height":500}}}],"Authors":"Elizabeth Bear","Series":"White Space","Series Number":3,"Readings":["recHdE35gpauebGch"],"Date Added":"2025-06-01","Genres":["sci-fi"],"Author Background":["by-women","by-lgbtq-author"],"Number of Pages":496},"Rating":4,"Read In Year":"2025","Page Count":[496]},{"Id":"Sat 10-04-2025 to Mon 11-10-2025","Started On":"2025-10-04","Finished On":"2025-11-10","Book":{"Title":"How Minds Change","Cover":[{"id":"att6Lx7NiUscyh6Am","width":265,"height":400,"url":"https://v5.airtableusercontent.com/v3/u/49/49/1768197600000/9u3cptt2VGKJcGt9tFobNA/9tcfpx0gXmwj1E_tbhlWNmriX-fTdVOPzpXhTROX-uFDU_hjezW2qDqWniGb74CdlIYARQY7sEnpdRT5FVV24JmqP-5DqK72XZHc2t65cirv24MQi3HTRvl3DrQ5L9OS7SlmnWIh9kbhykC39UEuqQ/lmFBzwzs9n2zF3zlGcMy8ZIOY5il1vUCS_vthPCaxEc","filename":"57933312.jpg","size":108081,"type":"image/jpeg","thumbnails":{"small":{"url":"https://v5.airtableusercontent.com/v3/u/49/49/1768197600000/j3rhDuQAigJV7O93k8gaYg/SpeGVmzxlItaYXWyEyCYRNnqYzgs3DM3CUa22CFFtmnn5VSkCpjTw8eU7r8lU07piodzlWEScQ8w81d4_3lDsptorb2oP0PYrzDYSBCM5BK3aQePmbNFAWXCqyak6KsChIuxNswup2dEWLVThphVLQ/9v6LLUGFX_TlQX09b-YLaolKLFxh2nYdnnjhOKodNqM","width":24,"height":36},"large":{"url":"https://v5.airtableusercontent.com/v3/u/49/49/1768197600000/PU-hbbi55ymXiMCHmdlb0Q/hgnpdgTjeLpXtbGysM7R3cSLL0ELsCJCl7e5oglKKv0heXf9CyJwcuRVhClhmyFQEhhN7sb_A3w9VcH71HBFzy_QtCcCHyMURg_bAhfk9GBBbYcUYuIkiS9Lq9UZ5hP-SeVYeTR0lMd-rfr-TzuXbw/G3Dcirsa1v4GsG1i-N7yB9moumMQqavqo7SSoEF2CZs","width":265,"height":400},"full":{"url":"https://v5.airtableusercontent.com/v3/u/49/49/1768197600000/veo56Mxkkog-Cqggr_oSXg/ZJWSgTlNstH8BKV4ioC5ZPkX8ZzpxtzFRabOBMZtGeiSG7BStajVLMkP9DilsrYnNZaGxxC2mqgLrnYPfcwwyluOAT4EqDRTEt8xT2z2xH_0lKwgFNNsuC-bupI5EUFdzSg46KWKHI_uVCjhuZBdfA/Pd66OkgKuxKFWQNWW5j__gG3vFMfmV88MHa9mGIaT1Q","width":265,"height":400}}}],"Authors":"David McRaney","Readings":["recIBIm8cRc6YcM7A"],"Date Added":"2023-12-26","Genres":["nonfiction"],"Author Background":["by-men"],"Number of Pages":352},"Rating":4,"Read In Year":"2025","Page Count":[352]},{"Id":"Sat 10-25-2025 to Tue 11-04-2025","Started On":"2025-10-25","Finished On":"2025-11-04","Book":{"Title":"A Physical Education","Cover":[{"id":"att32l2iakpF5NOPS","width":331,"height":500,"url":"https://v5.airtableusercontent.com/v3/u/49/49/1768197600000/UF9it9YhS5bXsPpDaxSeGA/hCUY9jnEe8wWEslH6oWMlqAWq3LWcURuhvrsD0xJN9NHJXQ131vd-GbDx8oA9lA666oJ5yLMScYZ49ALym4_8OwdxoptEJbSCqESpMVb1gtfPBcROpz3jnPkq_7AfcmyzWhtsXNf9tfekHUy-DAObg/a6Orw8tuWdUEor4p-b8tA-N8PcWebssE_JUKpJ8epvg","filename":"214458226.jpg","size":30170,"type":"image/jpeg","thumbnails":{"small":{"url":"https://v5.airtableusercontent.com/v3/u/49/49/1768197600000/1nTYg54U07zPrRKNOO5_LA/sQy1S9Y23aKetj6-2Q_sXrxvq1LCv102MpmjF04MfUYlkYICc2varaJSkbfPJCRkIcc2JVsvDAzL26FyPexshb70FYUp-7C-wmHP5GgarwjeF3wyDC03pAz3JAbWqOBXWQerooFym33Y6LvfFQuQnw/KByPRJJ1B8EcQuSgT6rOQ8W212lCh9QuzAtR6LTrOb8","width":24,"height":36},"large":{"url":"https://v5.airtableusercontent.com/v3/u/49/49/1768197600000/B-SpxoIvKH-fxtPn9Md_RA/OyxBYW-1bPdMs7iuM37vNMl3kUm_4t0xGhGZ9djExDetEjw3PFBPeqAASCwYOsfoRvKf4DkSYCbViT_ks94ts8pU7xogSxTVFd_MwDsDTo4U68HZ-_Eh-kHEIqXb3WPSyWJFm6qncVHuKuB6dPn-lg/vAdJTARYmWLRtmyu25mqiYZzv4rhdSnsIuPCEN9srbE","width":331,"height":500},"full":{"url":"https://v5.airtableusercontent.com/v3/u/49/49/1768197600000/w1uD1AooeSPRnJs0JiSETg/wJ9ZcJH59NDr1XpZR58YUbMy-2ppNYVtk21d4moYTR0RD00nZ4T1MA-XjJW64TMYb8SxTMfgjqoCbZ_5PkXFGiOvuoHMputZbozBAaIwan2pEL9B3qZFffwy9Tr7NlBmyqlIhpG7lhnuXBV5G0P4Eg/BSEumu45Y-D91kodgPcwRQqmAJ5MCeYb6iUPVUkERdo","width":331,"height":500}}}],"Authors":"Casey Johnston","Readings":["recII4BU52ltPai9j"],"Date Added":"2025-05-15","Genres":["nonfiction"],"Author Background":["by-women"],"Number of Pages":272},"Rating":4,"Read In Year":"2025","Page Count":[272]},{"Id":"Thu 04-10-2025 to Mon 04-21-2025","Started On":"2025-04-10","Finished On":"2025-04-21","Book":{"Title":"Mort","Cover":[{"id":"attwHfYPLrsPG8zBe","width":287,"height":475,"url":"https://v5.airtableusercontent.com/v3/u/49/49/1768197600000/0r9urHzA6zWTJiGqzYhrZA/MykPVxVxH8Qd1TnjmjA7BNoSDaB4crQid4EiHxHCxfP0LHflMV5tzJdZihaYOlONwYy3QV1xdwt0jshdRI8BFcNBLJ3SoH4k1x348QqrEhz2ZSu_dZ4tQiOoFwk67fh2bcaez7Q3LX0zo49lEy8Vlg/PNMfNAfSyTO0sjq8w1DOC2ZjmLK-Q9shWWWtGLwCXI8","filename":"386372.jpg","size":27218,"type":"image/jpeg","thumbnails":{"small":{"url":"https://v5.airtableusercontent.com/v3/u/49/49/1768197600000/PjLEksqkuIsndV7o10bLCQ/t9LFG5iYuYSIK8izENSVwWiu2zfGOzN_MFvM81X0HVF65hLIpvsuqbzoYoiFL2HhMuKkZm8JqVix1eU18jPKT45yw9ZekS4VHo6FXPnO_REJgX-C7vz__4MQ8jfo9Sf0I3ixcGWrpl3n_VrNu59ONw/T9VI-33AQj1brvL4rriQs8UUO05zh3DR-aeeP_ZeWGs","width":22,"height":36},"large":{"url":"https://v5.airtableusercontent.com/v3/u/49/49/1768197600000/iO3Rb4pJOHaa0kqQVVZZIQ/mptmZxrj_R6m7YjhYTsMwj7uX9ky5rDmI6DtlI2BVlNXiKW1vIMeC3UB-2dxu8DzlNyxv7bPRsOMznSHlD5ULX3K3oinwzSMQyipAwVFyswgo_g8NXUUkGFkFHSGzASJ1h9C9jHUUYnHEHCOrp4Hrg/mjAcJXZRHVdxv6pSgV2Lo8biIY30BHa-vuL_UDS3P7A","width":287,"height":475},"full":{"url":"https://v5.airtableusercontent.com/v3/u/49/49/1768197600000/KRoSqyBEYF285ia0ZL9yPw/5vRDjgvt4XZAIsu7EjeG3foHKS0jbnfK_rAFoxKWxpddgmg82lZHbBiuFpJBlZ5Dieg5bdk0UiDUF_tEjgcMGjBCKm-kWHJDlHlevVnWCp7dmZJPEsLaVpwxjkmf2mgV1t7iqTxYxJRzHaILRgDEzg/dY99TBlyyG-apXLeXyjmxCIGsDyAA5LF-6Tb3xgfHHk","width":287,"height":475}}}],"Authors":"Terry Pratchett","Series":"Discworld","Series Number":4,"Recommended By":"Lianne","Readings":["recLFpZNpMnK9gleh"],"Date Added":"2024-12-25","Genres":["fantasy"],"Author Background":["by-men"],"Number of Pages":243},"Rating":4,"Read In Year":"2025","Page Count":[243]},{"Id":"Sun 07-27-2025 to Sun 08-24-2025","Started On":"2025-07-27","Finished On":"2025-08-24","Book":{"Title":"Shroud","Cover":[{"id":"attT8PeaqO14KNZly","width":1200,"height":1846,"url":"https://v5.airtableusercontent.com/v3/u/49/49/1768197600000/Mp6ydB9j8c9hxAtCipn_Yw/MZhoeIul42n9F8ImW4lqQSd38vQYR5tQMWti74wVKqbRtXZ8MAFtNSNmIw47AzHW8dHFGLlUj9BxcN3HT69yVFSlwPu5s2omu-QNt4b7VdhHyZYRpUF0aH4EvBGIxNQ6-plGcPyl88qAgm8lpJH9_Q/3tC9uVmIXcm7_EYKYyXc-p0A_WfudAWpnR0kTgjrKzE","filename":"210384823.jpg","size":747822,"type":"image/jpeg","thumbnails":{"small":{"url":"https://v5.airtableusercontent.com/v3/u/49/49/1768197600000/qDxSrjtEg-lrDhyaiACAAA/DuZXgcmkeKP8s_nufJLLlyaKymO6OWRKpzaBuhjLJNbTFp1sRUu3KARg8UMsyYZVnRCzj-ldEInUhxOCQUEf1CQJdqFtswuyjDawymUK-oqNSYsizBJNRsNbl65L320VYUavVyh4y3vQWyHKQBioGQ/zruzOUm1qXb5aJYv80NITDp88ZWlggoQhjKWKyuuQ8Q","width":23,"height":35},"large":{"url":"https://v5.airtableusercontent.com/v3/u/49/49/1768197600000/KRJ3LfnLZ5cuBtJn08pzmQ/fhLTlkZxqL1oKdh1R2xt9DvneS9gxfVE22X0lRkbwUHaPqLwb3PMeN0QxYk38SICtQMNREj5xEn1aJo3wuZ37QnVfOH1R1VEgW53MpIq6wfcqGwAp53elxpnXzEkf_YBhlT3fk3upTu4oF8fFGFsyA/EPoxyySRMuCNU2jaBOrbfF1TEoCVpTgfEzP59p4WLzk","width":512,"height":788},"full":{"url":"https://v5.airtableusercontent.com/v3/u/49/49/1768197600000/m8KPq0WKlTYCk1G1qRVA0Q/na_BQXJHhHTLmTRWDIdPZSkIz4swODXIJjTOYDGuy0TCh5dgOlvrJ2YkAiVmZurmQCwQPAFyQGbcM-A6WAq-GsJ-xwvLe-PyfST3gUpHUv4BaOVReIE8eio-WJm5p-1x696WLRFWUgacUApJdllreA/gv9rswhwrYMs1bxrckaJ4ZFcB6EE7t6-3vgODJpRwUI","width":1200,"height":1846}}}],"Authors":"Adrian Tchaikovsky","Readings":["recNl9xW814PIg2k6"],"Date Added":"2025-06-20","Genres":["sci-fi"],"Author Background":["by-men"],"Number of Pages":436},"Rating":4,"Read In Year":"2025","Page Count":[436]},{"Id":"Wed 12-18-2024 to Sat 01-18-2025","Started On":"2024-12-18","Finished On":"2025-01-18","Book":{"Title":"Breaking Hel","Cover":[{"id":"attDZZKmxyCBCbgRr","width":976,"height":1500,"url":"https://v5.airtableusercontent.com/v3/u/49/49/1768197600000/G1JTkTj_XSAS085itzn5Vw/HxYcfQAqf2zuDPkXUitOyGBbzkocSV1OeWe0jEVSLQzSmc21vhY9Fb3xEIEOZDnsJEj22GUb8WXWq98RGc8VoPfpR0M-Rp0IaPP4RJi2xIHsiQGcvw4BbYbW-UXaWuo0Fbx7BFt9qB7R49C2F0Ef0w/AYf8d7YGjjzUWNw6nqWVsQRowZ7c8-9_nD39qDVCP3w","filename":"173404024.jpg","size":376779,"type":"image/jpeg","thumbnails":{"small":{"url":"https://v5.airtableusercontent.com/v3/u/49/49/1768197600000/F4wtLDKTtByC867n-ohkZQ/nduSs-38p_oJToI_7b5rGi5o9e2cuz1ZVZG4hepfMv3nSZG5yQYbMXLadU2nF4FCQpwIiOTKPL7cD3BaEH5tVEItUmNpVUoEuG7JvYEKGOtgWf05TXxrr38afdeTDIcmxYH87XkS6ycMt-oOGUt1NQ/X1P06PFSjzSeSry3to8OTyeRH76SoJAr-NVAik2FKdI","width":23,"height":35},"large":{"url":"https://v5.airtableusercontent.com/v3/u/49/49/1768197600000/7PouXxFYfqTwSBkafZLjzA/zo8S1s9SVLb273trMefvbA-rj0gzLKa6IXDgAKdVMrnz2jEJ1jXTg5_Yd0vSHQPSuKF-ll5Kyv9VGMmXX8R6r8PG_Vw8ra7_2rPEp2DrkGgi0NHY1sKpsNJWJwqgD4hh03LONKvFav6OdmDP5yWvRA/ew_4_4JNGwVeKCdpKZWmUgaGM-v_qh7Fda4WZMDjpk0","width":512,"height":787},"full":{"url":"https://v5.airtableusercontent.com/v3/u/49/49/1768197600000/V1DxqVLK-ZzWSh-r4liHcw/-O4b4nZf8sThmVkKFak5UuFxqH0LUJhL96GX7EPKOEsRaQJCqBztdh7kXrTpFRAhQwbsryUs7F9c0G93Cm-er3SKhPVWL0YMf-Wf0WvG7eNswvX495yEv7qaleUztTY3njteC1IBHo356p1ghIFTbQ/1zPzxCMCh44Ms_wN838I7aVRQ57SQdz36gSncpSG9e8","width":976,"height":1500}}}],"Authors":"Miles  Cameron","Series":"The Age of Bronze","Series Number":3,"Readings":["recVpMBfsLUkVvD8t"],"Date Added":"2024-11-08","Genres":["fantasy"],"Author Background":["by-men"],"Number of Pages":400},"Rating":3,"Read In Year":"2025","Page Count":[400]},{"Id":"Fri 09-19-2025 to Fri 10-24-2025","Started On":"2025-09-19","Finished On":"2025-10-24","Book":{"Title":"House of Open Wounds","Cover":[{"id":"atty1QnX6zCQoMe2m","width":951,"height":1500,"url":"https://v5.airtableusercontent.com/v3/u/49/49/1768197600000/UCTmDvAi4X5OAZ4R_JDEtw/t0iloVFA6kYtmG4ZVVTKgCNlLuX1vxTSLeLgLPF0obValKVwH-d8hN9uhDYV7h5U15lXX-UeSt7JS_q4wxrmYBi2A28rc7YE7xPSCpdcdZ1hYywAIuunmmrn-z12_RdTqnkehgVg-zAlXMNC7-rLvA/Xspxn1r4YiN-wL-scOKNbiOL3lD1cIgpPuGcO2ywp_I","filename":"150254281.jpg","size":522932,"type":"image/jpeg","thumbnails":{"small":{"url":"https://v5.airtableusercontent.com/v3/u/49/49/1768197600000/YuWvpe7xfLhz25Ga_mYd_Q/Zo6zsCCwhBZLbWkyNN9XJBNr_EXPA7duK5xrAfe1YGpwbnU_eqV9AeAF0-YIzxtnQPg5ogA8zXV54I_uD04bNM0CIX3fKgYiGbH9kh27vVXzYerekxCqmWZPeqeIiiOmuJBbfRp-jqA5ZgZLkNbt0A/Ibf7TiiQZ7YpdtXTFMqcRJETbHYF-fvQS-x7WClAPzI","width":23,"height":36},"large":{"url":"https://v5.airtableusercontent.com/v3/u/49/49/1768197600000/7NXhOTpqyEqbUeHkyFuJWg/dIcY6r7L4zBndBXgd48VXQwhWw-gV9Myd4o3DZHIuiLTwt0IkCx67mQbTXNS_swdh_EG-Fo06LnvM--4t2PahMMRyJV79U7SW1memOilEwwB9ZSxou5kGjmglPViqlmumFifHsQp_P6C3VG4-YOzfA/Q3yfG2b6y_2TEfnQdi9n1novw1r_IPlzQPAxz96sWhk","width":512,"height":808},"full":{"url":"https://v5.airtableusercontent.com/v3/u/49/49/1768197600000/mjQkMYtWEq0--9Y_jrd9Pg/QFCrTbBmbfKhY8_eJRrCUX9VpLx27llm6s1Mdjt9YPybDjk7yoSWwP2e3h9xoBM9j72h7mz8ukCSwgwiaMzmVQZwMWl_DfE_Y8PSdoIhYFjshaYPDLArLsMpBokrwiFJO1h0h9FVfkx-FQI819_gDw/vW_x_F3UtzZ5fW6BTS6o_i-1j7-5sbtZYTK5jIH7A54","width":951,"height":1500}}}],"Authors":"Adrian Tchaikovsky","Series":"The Tyrant Philosophers","Series Number":2,"Readings":["recXL0368CWrbG2CG"],"Date Added":"2025-09-21","Genres":["fantasy"],"Author Background":["by-men"],"Number of Pages":608},"Rating":3,"Read In Year":"2025","Page Count":[608]},{"Id":"Mon 02-17-2025 to Wed 04-02-2025","Started On":"2025-02-17","Finished On":"2025-04-02","Book":{"Title":"City of Last Chances","Cover":[{"id":"attsnZBuFt5oUfimK","width":1600,"height":2458,"url":"https://v5.airtableusercontent.com/v3/u/49/49/1768197600000/sTgldkWZTkkmyTNx5_9Y_w/_BRFYPYIC2Im2-jdUc4NbpGx0Zbu4k59mNwAE4_TuNgaTtr1oxQcJajx46UWS-iGiLmKEvasUpc1pl1EEA4-4l2mI5kkIwCbMrAmRZsYBAaO7t0oAFL2awQScfZj5nCTP6e2kzdoshAYXZ9IXdK9bg/jqbTGwsvgj36m96ivHzscd-uhYLL3yQUSaTNgomSJeY","filename":"60147395.jpg","size":1031777,"type":"image/jpeg","thumbnails":{"small":{"url":"https://v5.airtableusercontent.com/v3/u/49/49/1768197600000/4iKdtgYzxvsuPVK2tmEeMA/hRZGgVCTTRd8QtdyRFaLaotnM5GtFDEtGClh4ozTvssV1txyEMJqC1F8Ui2hH_5kqyJmBEpvBiQNKCAwfX68CcA4eSYx29lJwe4laDmvj-g1TxsIiFA9Po-WF9G5M8ZY65bDJkpgZgHNyqkKuOMmtw/vB5fxw8RdAkQ2Hq_hyhR3zsSqLNc7VmVkkGmioFUYfA","width":23,"height":35},"large":{"url":"https://v5.airtableusercontent.com/v3/u/49/49/1768197600000/rtTL34_yL7YEMnrMt6FCSw/yRGZQhFqBShF7sMYVuyiz8qUVHL-n1LgXAFeTSyBazSWjJKGeNynwf0VIIdY06gkUo8tKv_dgrHC7MP-WJPMgfMf7coOZXj386fbmAigGW_yvZtKBoVhONZeuJZ57IeDq6LoQelN-YTCr-KKc-zxMw/xd2krj8EuiSN3uFJWJaipICjrxdRLdUN1m1f9ir6MOE","width":512,"height":787},"full":{"url":"https://v5.airtableusercontent.com/v3/u/49/49/1768197600000/IptiNyD83PFj99eFbsj6vQ/-OnDh42bulc05GkgXZw1XPWLqZ-NSZ_LHgz_AcRSl172KNCWfekXnhZLiDQm6-H7e1yJeLlhaThUqwSIDEOekG2V327-XXfNjkMLGtLsYtCEdD6mcF3hdVKQq7Ju3chSkGQCrhRLHFqFJ8PybV2KEQ/VUsllulcwJb-munehfw2SXNTJ-zPLVXJbkUc001AWKQ","width":1600,"height":2458}}}],"Authors":"Adrian Tchaikovsky","Series":"The Tyrant Philosophers","Series Number":1,"Readings":["recgF03XC2x0b9LFY"],"Date Added":"2025-02-25","Genres":["fantasy"],"Author Background":["by-men"],"Number of Pages":500},"Rating":4,"Read In Year":"2025","Page Count":[500]},{"Id":"Wed 04-23-2025 to Thu 05-08-2025","Started On":"2025-04-23","Finished On":"2025-05-08","Book":{"Title":"Blood of the Old Kings","Cover":[{"id":"attEyzbSHZBa5b8Om","width":900,"height":1391,"url":"https://v5.airtableusercontent.com/v3/u/49/49/1768197600000/bnGEOZD9M3FQRVtYBetVew/sQ6LTJwBpHGR1CNic1edYhlLcZf5YyXz0bkvJ6UKZfjY_12CuSNNVWsuPPT4jRguHnsWcbpA9JjOhQpVKqWuC7ddcELeYfwNYDKiWD-NEirg20D4fJz1wIhCVRAjF7NKtkhbW7iZtT6RcVPapbyEKg/0AawARUrMpNAMKQL2GgpaEEI-eOszsi5s1mb858aONs","filename":"203579293.jpg","size":165375,"type":"image/jpeg","thumbnails":{"small":{"url":"https://v5.airtableusercontent.com/v3/u/49/49/1768197600000/Pe1MLQXb21DpZM7vaHhc1Q/Fdj__shVyTfoF34R0UyjtaDyzkpEcpJ6--7vzSeapk6djgZb5Yf_YoTu7_x6tfdCpfYxOMHpatoW2u2tdfG9QArCQzTwgq7u1TviCwtRq9ckwQSWrSsngScKc_avlu29LCxVo-iiV5RoMdiptbJ3ww/HMcb96-T5eIOWZ0a9-yPnlsof8l1A4WLryF-1_HYnfw","width":23,"height":35},"large":{"url":"https://v5.airtableusercontent.com/v3/u/49/49/1768197600000/YgzvGK-AzhAz8C10eCq_WQ/4XCQNVCRGSBdtPgz96LaQxixZV53IgsrhTGX4EDyxMR2FxBBV3Hn72i6eIgbsuOCi1OEvt_IN0qMq1-qEqgYFoD_vWcQDwvbE1b9L-dJ2je62fHjH5VM9-MTG3hI7sgnbxR47TX6F_4yGh31RUqryA/Jvi8GgWrg5OHXJX37kipNyIz-aMxu_FuTEGCldCHyTY","width":512,"height":791},"full":{"url":"https://v5.airtableusercontent.com/v3/u/49/49/1768197600000/HYxb-2dJyru8YdTGg60Y0g/_iQf5dque90G3qDYduGnjnbElFndFVu0AbKIGxcoShAfZCkl7_hfSGLKLyVxJhqo8SFUs7yI3mo1yn0y27b_ybkauf_uz4AmrGJHSZPDGNqM0bDPy_t4YHZSoteIiuiNAzi0ndVcb-9G_LYtaoM-nA/Fd_m9STQ_YWPnzBWWWoxJZHz6Tn89s3A01mgSqnj6-Y","width":900,"height":1391}}}],"Authors":"Sung-Il Kim","Readings":["recpc3YlH8CTsrag5"],"Date Added":"2024-10-13","Genres":["fantasy"],"Author Background":["by-people-of-color","by-men"],"Number of Pages":368},"Rating":2,"Read In Year":"2025","Page Count":[368]},{"Id":"Fri 05-09-2025 to Thu 05-29-2025","Started On":"2025-05-09","Finished On":"2025-05-29","Book":{"Title":"The Mountain in the Sea","Cover":[{"id":"attW2u31kn7x5nQOQ","width":740,"height":1135,"url":"https://v5.airtableusercontent.com/v3/u/49/49/1768197600000/Ab6l3wBv8XypDGbXrhUG9Q/AUpOeqDv4lLRXsCTeZtanTtJUAi1JIeoEpc6vX2BVNQvbAjIvf7LFCEP2JRt5nLfDLdRBkw9mP2zRqQM2L2O1H9RQE7Q8E66WpKLjW1W72dkPYZ8bLUDSDSYOBR6GaBaQReqVLiVXsW6G8CqcQmyXQ/CsN43n4_qFvJnxjafZ2Mit1Rl_ckXM9DUiE9rulZvDw","filename":"59808603.jpg","size":491518,"type":"image/png","thumbnails":{"small":{"url":"https://v5.airtableusercontent.com/v3/u/49/49/1768197600000/Q0tN4bruLFnNkNKE6yICYw/3T91ocdYe6rjDu9p_pyBDq_tcZv37xTBDSU9OB-p2ufbZl3OysZqjlKmK6Q04cDRrT4Kkn10KUHFc0TQjM76yHx07Gwhzx_GKpffEDzuuT2iuQCHHha0f5Nf6OWzRS5p-DkIUGkmVd1baCcyJdNe3A/A3CrWkrEZSG_P-a8hAX9-T9cvgWuDypxjaQVoJXbe-o","width":23,"height":35},"large":{"url":"https://v5.airtableusercontent.com/v3/u/49/49/1768197600000/eGe3IY0nE5AiD6eAsZmkKg/9SLopCydUawxFERBxqfLRdRhEzpgQ6kVndjYUTfa7kWSE7DfTMBVgs0cvO5t3iZyqzxln9y-zWt0z-mNlYDuld-QFDaK0C2j_7SBnnZ9zTwqc2Gm5ncAUSh8XkaKRb1Ar6kTLvBFcyTjqqZ99aR6Xg/xpkJUljtSXVXUu7MyEDrKK1SGI-g33ApRTfSvCwqwps","width":512,"height":785},"full":{"url":"https://v5.airtableusercontent.com/v3/u/49/49/1768197600000/792Z8F4E51nRAJcGeC2BZA/wITlucpwE9AbnKYgmjxSfGav05xfhEZPdW4VyutdJrH4vL6X6DZY2NUexq4QmNOWbjPCeu6Co6069m256WSRVaASnvXTEHhEz3zFr6GXxdctIcmZx-j71umpy59j-f_oRNiflVebmnoe0lq48CcPnw/-ihzgKvjn2ms0dZDhiflevegWrGfWuEygF5kLqpTxzs","width":740,"height":1135}}}],"Authors":"Ray Nayler","Recommended By":"Andrew Liptak","Readings":["recskeIOzs0oTxAyQ"],"Date Added":"2024-01-20","Genres":["sci-fi"],"Author Background":["by-men"],"Number of Pages":456},"Rating":4,"Read In Year":"2025","Page Count":[456]},{"Id":"Tue 02-04-2025 to Sun 02-16-2025","Started On":"2025-02-04","Finished On":"2025-02-16","Book":{"Title":"The New Topping Book","Cover":[{"id":"attQRqmUCuRwA9PfC","width":313,"height":475,"url":"https://v5.airtableusercontent.com/v3/u/49/49/1768197600000/N0aoK8sYWYhCnzWczudQ3g/1ImOPteh1ucDy2r2AX_1VntjF6enpFx2InIx1eCM15vm_Q2UI44zAScypX4HfLQZXdrbSQpmK09IyScxU8Y7ZmW-EDbVx0y6K4ChKMkyhxGtT8tl4pzw5GBBzbhXErjsa2tx5-0G9kZIObkdsbOVXQ/5dXt33TB6szYEnzlTyddCv5fBeNAZJK4yqLQ0UidP2w","filename":"503943.jpg","size":27893,"type":"image/jpeg","thumbnails":{"small":{"url":"https://v5.airtableusercontent.com/v3/u/49/49/1768197600000/t55ACeTIWig1mIgyaMtWXw/OpWHB436Vi_3J-lVRvjaB0izn_etoe8UIF6QKBxyeUg12_70gO6VC7EQtH5-JHu47OuK7SwzVEgyS6gfkz2dcuYndgouV8Dmo8Gh5xt4E4Be33EqZUHkZ6FHPWYUB0jPHA5A9EdlKc0va4FTjEt3GA/-XaW0z22QZQJoc8RH25lBJ3xA_Kf6IPEjfWrw7XjZ3k","width":24,"height":36},"large":{"url":"https://v5.airtableusercontent.com/v3/u/49/49/1768197600000/JRWSDkB5kKxnc4lV-i4WXw/EBPYAv-F1Au6mG-MWGJq706stQ8vmGxUgycr2xc24JUG5DsUr9kIVcqRiKQQB8H4cR6lGV2iNu20Q5o50Ab4C6zitxQCCB2Txa4M6k8C58khhOA_AhYfIe3K6FaVbVIZgiVg8NJYeqMZjYfLz1QK4g/rZsNyKJ4x6A7UuZ1qgX7jiy0aOhB3W31--TKZxHjAjE","width":313,"height":475},"full":{"url":"https://v5.airtableusercontent.com/v3/u/49/49/1768197600000/V_AV2_Fjjv0Bwx5ppXeFpw/egNgwb3z4_e08xVmuw_VOg28raag9MvE2HAe-xg7a9c92hrfwMggEJEAv4ITnjsnXzCJBAi0SReXrXaCt4yYrm0wq3OEfZMo3d0InahezsJzk5dLdsya7QerGjhmBD6ujXjmyWSH4uTpK8LZN7hPNw/s1fPaVHuFEbuT3GmXTDX27tww0PZwkafYsvEM4bZBNs","width":313,"height":475}}}],"Authors":"Dossie Easton, Janet W Hardy","Recommended By":"Multiamory Discord","Readings":["recwj5xssyFeIliSD"],"Date Added":"2025-01-18","Genres":["nonfiction"],"Author Background":["by-women","by-lgbtq-author"],"Number of Pages":221},"Rating":4,"Read In Year":"2025","Page Count":[221]}],"stats":{"Author Background":{"by-men":13,"by-women":5,"by-lgbtq-author":3,"by-people-of-color":1},"Genres":{"fantasy":8,"nonfiction":6,"sci-fi":4}}}],["2024",{"readings":[{"Id":"Fri 05-17-2024 to Wed 06-05-2024","Started On":"2024-05-17","Finished On":"2024-06-05","Book":{"Title":"The Shadow of the Gods","Cover":[{"id":"attsZmKWw6UWGOWVD","width":1807,"height":2835,"url":"https://v5.airtableusercontent.com/v3/u/49/49/1768197600000/NJ0y-EWZ5CWdkRCgzJXKCw/qvGxzNUoXpNkuyYM0ci2rGuRj4D41-04STwBsWiDARJkiPknzi39lyvMzlv9UzNSrNOdquJfhu_rKlTSSxzrcPQ_VwV0F1eeMxrMw2hUh3CT7d56ba3iZsP4uJ-lYzgeM0Vj9PhkwzUKwCpM6G1sgA/1jdLaQih4z4hkjhjqlnumtXw0y0ldeQrb6OWaRtwyJQ","filename":"52694527._X0_.jpg","size":2476487,"type":"image/jpeg","thumbnails":{"small":{"url":"https://v5.airtableusercontent.com/v3/u/49/49/1768197600000/JDksJ-bd-u3y_uHuqd_KzQ/or21Gll53PuJ8ENArccPeULVLIII1Jzw9Lyt8kQCv9GofCYAfQCuYKJfXdVFWj2BZbeRJ7LJFK3fvvpqhQS2LXInFIRPlwSqIGpizhxzjqIfyacLYw_C71iE9W50U_ZTYjEqSwBLL-qvqpqTFsJs0g/WdetDChBlB0swJ2qZEYw1Me8KvvApiIcfj8BpMXc7Ak","width":23,"height":36},"large":{"url":"https://v5.airtableusercontent.com/v3/u/49/49/1768197600000/q2w5i48KRcnHmlB9JbrjZg/U4ny9VwASiwKvBSE8Mcs_f4_3b5u5K4HBmqHUDMr_XVCY511pduktjZ4upkEcSMV3F5a7kB5izA057pubRg3CCrGDNVJ2ounk4Gxpd0Bm55sJI8UnP673qf1zTmUyqPHQB2fMZH7Myu4UZkKVYSj1g/aN2__s9Y-RR_oIu0T8Z5XXLAo7y8taBnVjYNz_tmDFQ","width":512,"height":803},"full":{"url":"https://v5.airtableusercontent.com/v3/u/49/49/1768197600000/MVLQBn2oq4qi85BiNZ7dAQ/Rsw0e5VPJKSbuwx6jTy7AyKwHMqGTmYfwBclyhyV1cGXbxcKwkvX2jV9zOWQRH2pH3Wr9ducUvN1droAxR4RcVvduDWBRSy4hnWYkuqPBXVzyfCHIplXws0Z4LfhsG_U3w72APmX0K8SupuTFmxThw/cWf0De5VAijzFnp7w2WThN8XBkrPk9YEM7Nr1O7_jkY","width":3000,"height":3000}}}],"Authors":"John Gwynne","Series":"Bloodsworn Saga","Series Number":1,"Readings":["rec1UKy611tleWw4K"],"Date Added":"2022-02-26","ISBN13":"9780356514185","Genres":["fantasy"],"Author Background":["by-men"],"Number of Pages":496},"Rating":3,"Read In Year":"2024","Page Count":[496]},{"Id":"Tue 01-30-2024 to Sat 02-17-2024","Started On":"2024-01-30","Finished On":"2024-02-17","Book":{"Title":"The Olympian Affair","Cover":[{"id":"attmB8gWxtQjRSOzS","width":331,"height":499,"url":"https://v5.airtableusercontent.com/v3/u/49/49/1768197600000/G4X3yyCcBq-vEknc0xxI2Q/e_Re79UCEVKkWSthLc5F_X-_APXD7wSpp2CEsKExeH--hJp0IPIx--Pn_IybkLPqcxIRxXvmocn1jadEcT5NEDJEhUz8RXNGUfYsi-ikt7p5inB8TPN0QC-3n1t-epWBEWzEVG_oTcb8TqZFis0LHA/YP_Zil7ppxUEstWh0f-ODiGCEWj53dERkVSekSsXz_s","filename":"26860699.jpg","size":42646,"type":"image/jpeg","thumbnails":{"small":{"url":"https://v5.airtableusercontent.com/v3/u/49/49/1768197600000/GlHjVL8Wqk4fj567Kjdx8w/vqm83TdnEPScuqZljv577QLO56eFTmCx1UcCj6KYoHCipWfbKmdQ0nB8A_XNRzrbWTGQIwyhoDV2rxjdEvRvwwMhmZSJRPUJ_0-rFekcHV2CTUIZO9FGJ2cjrFk_U3ydOxU9M-EPwzFXtQ7QyZ3bkw/-p79SQQ1l5rGfyUWMAlKZr08hzxmq01UXYRfFnjUfTo","width":24,"height":36},"large":{"url":"https://v5.airtableusercontent.com/v3/u/49/49/1768197600000/UU6sZPq7dcnR1JvjH3uc3A/ezQynK8mUhZ5ElPtUAM9xvQk6nj6pQjtv2fscgSrTjFGFUXDbHA8y6gMQ1PoCxdKixYS2EXcXFRqUoTLjwn2XzzkBbpCESotgY_bv_BW09dxOSLtbcsOVArm20FiRObVfBUFDJ8T3xdeeYspY1BPDQ/JDF-6nn_deMDGQvZnPvGQ8TTGbhb3LxNqYMZ3D4Oa-4","width":331,"height":499},"full":{"url":"https://v5.airtableusercontent.com/v3/u/49/49/1768197600000/cHl-bPG9CmAhZd_9tL3qrA/rTFCrzMaUUE0cVQ7auS6l8hqzuV2lXFV0zUk8YO53nb7THwbbdeBN54dCUuUxitd9-5jie1vrtAtND9CyB8-W4mxW9ExP6fge2-poMR1qa1duz63Nr-BgTYF3x3Swjuvj9M5c4mMhKr8v0QwlHgU5A/GYgBDgjiVeny2NNtkxxqEV7qxCJk12SgkrcnFvZmPMw","width":331,"height":499}}}],"Authors":"Jim Butcher","Series":"The Cinder Spires","Series Number":2,"Readings":["rec4TcpBr9OFssCyB"],"Date Added":"2024-01-30","Genres":["fantasy"],"Author Background":["by-men"],"Number of Pages":610},"Rating":4,"Read In Year":"2024","Page Count":[610]},{"Id":"Tue 04-02-2024 to Sun 04-14-2024","Started On":"2024-04-02","Finished On":"2024-04-14","Book":{"Title":"Storming Heaven","Cover":[{"id":"attGvd9iZrzJb98YQ","width":325,"height":500,"url":"https://v5.airtableusercontent.com/v3/u/49/49/1768197600000/7dQ4weHTk7dJ6r2LhbSapg/6P_cGe1cIz1jQUKv73Fz3EeM83q3bT0155F2R7gqq7-vHVlyi3x4r1BFDx1ForES40Cifh95DuSIKFwtiUnn20olQcKfSXhIw_NG56ZA_JNGo7aSQRTo9zEu9-OovRPL4HXnb1Rt8BWAlL9ciRO8cw/v8RdxUpyDTzTzqOU-YON5F8sJ-duoccLJYQf9NjIw9s","filename":"123841926.jpg","size":75694,"type":"image/jpeg","thumbnails":{"small":{"url":"https://v5.airtableusercontent.com/v3/u/49/49/1768197600000/aCa2T0-IU1dEQFRrA2oN-A/-xK_i5HgC_XHSJvjfpcHlVVV5IndPrW-sg9cSVbRrPnjFNEJi_ecOdeb42iyhaYujY9H95C7PB7NpkmhZtDkIpwrLOiwMJq8l0s8SkiTatTihPEkNmiE11SLttBlLX1-cD8RXcRLQ40sZNQe_iPrFw/G7owXrWfcsSQou-S9eF_qeRSYM33NxHHA1Z1LcIwKXM","width":23,"height":35},"large":{"url":"https://v5.airtableusercontent.com/v3/u/49/49/1768197600000/bZb45CM-rz5SOVR8f3_IFA/nAw0K8ovLohq5_uHOAHd1vHfeM9dfyjCysQ28zfPpuKyqJVaYoZeX6KGF5A-8m2DQScxYFbHeh2hzQU_pq51X1U2uOTRMY-9-0zPNYqpo750SVzDynclFEI_NFmK1x4Tytgv4SzsBkkzSPINkRNvPg/VuBCaMzEY0wYeAK2y17B2-kcO2zlkQcBRrkYux2ne_g","width":325,"height":500},"full":{"url":"https://v5.airtableusercontent.com/v3/u/49/49/1768197600000/kuOIQo48sAV6lCM62UYevg/YplML7hiEdWimKiggXrM8epSToMLTE7KHJqyFdS1skFbb1HpYb3fKg0MONhlFvc97X0b3k7fzmRGN9dUt9AAU5QWvSUN7GYCsvIXY79M_LEtxjbh5U2PMdaeES1wjbrqesvJ8UjAG4dXGVao90F0JA/ARQ6e6mXAtt4L0489Bo4l7o5Z1HPnkooIEtqXsv8Wok","width":325,"height":500}}}],"Authors":"Miles  Cameron","Series":"The Age of Bronze","Series Number":2,"Readings":["rec6DJdSyb7ZwqYch"],"Date Added":"2024-04-02","Genres":["fantasy"],"Author Background":["by-men"],"Number of Pages":494},"Rating":4,"Read In Year":"2024","Page Count":[494]},{"Id":"Wed 01-17-2024 to Sat 01-27-2024","Started On":"2024-01-17","Finished On":"2024-01-27","Book":{"Title":"The Palace Job","Cover":[{"id":"attXBz5kCkD7726H0","width":660,"height":975,"url":"https://v5.airtableusercontent.com/v3/u/49/49/1768197600000/gSLF0BaODES-miS3wJo7XA/MIO3EU6gYpytLG7wJB_IDHE9nNbDQY9YGpmYbmRGp9YEdOuYfuRow2u2bVUx5jlcbVM5_HSmNPEwESLbGF1W9J-Iz7w5eAo7SELTbzs-JAkXtCWS4z5yQWLuhDIK_tUYQt2OtuktppPlPm6UIwOlAA/uVinvZPlc1wo7PSH2Z09WkOy_MHNyMfOkS9v1hbd9BE","filename":"18318648.jpg","size":182219,"type":"image/jpeg","thumbnails":{"small":{"url":"https://v5.airtableusercontent.com/v3/u/49/49/1768197600000/dO5pOkfI84cpLnbAPVfEhg/t898hDrm5NsWXN2ZE9mflkzDcCO78o1uR6S2yZVIby1q2KkgHn5v1mjhHSH70rk9-OpzPqr9PLnLGc9kaYftFpdb_LbAzRlUZKV0-BTX_4itqy-Ij6lo9Y5BK7YqnFaSna41T1TXj-fg4T8gXw7Jgg/7Zx70eK_PDGkbiSFDenI25CUzfo8VoUOk88NHMxZS8w","width":24,"height":35},"large":{"url":"https://v5.airtableusercontent.com/v3/u/49/49/1768197600000/irs56Z70HKzf5GRZOZ85yg/v2SKFn2zfuDKnrhr86a1FSMdDfqeR9O1HcRsxwNrmJXMEBbOiszn_k5yfVenr6rDt1q6G4GslAcubQMvzyJbBtCdoQ9gt87ViQkA9UUEYeTZ5TUGSIPS8KyMQWqLTFa86mVYulQluWtkdIHBPfB5Mw/Z0lo5sybZRrOuSERWC2lcrAJbb5kXG_cTuj60hDzNTE","width":512,"height":756},"full":{"url":"https://v5.airtableusercontent.com/v3/u/49/49/1768197600000/LW09ntlSkDTtCP873BzRrQ/PHJ2wH8FWrpXUdmg9i5n5Je1Z5sWAUTC2EC8oOQPgiIPzJMFXA5d-k85oFbuY6Td4LVkRIokG4fbG1KXb8BCqb27frZ4glHaRTaGLrUBVTo1UlOQY4qG3EYkSUcFeYY_fpxmxUYmyzrgB4igAOHSBg/-wrsUFvGuVm4a64cSSvbMx54ReM1CyHzlETjkAF2-eY","width":660,"height":975}}}],"Authors":"Patrick Weekes","Series":"Rogues of the Republic","Series Number":1,"Readings":["rec7M6qCIeHjqjSRv"],"Date Added":"2023-12-11","Genres":["fantasy"],"Author Background":["by-non-binary-authors","by-lgbtq-author"],"Number of Pages":438},"Rating":3,"Read In Year":"2024","Page Count":[438]},{"Id":"Fri 01-05-2024 to Tue 01-16-2024","Started On":"2024-01-05","Finished On":"2024-01-16","Book":{"Title":"Against All Gods","Cover":[{"id":"att2m8oweTEncvY9H","width":260,"height":400,"url":"https://v5.airtableusercontent.com/v3/u/49/49/1768197600000/Mn51Nw3nXGSw46uKt3MBiQ/mULYbxmNy1KQOh_5NGXGZDuiJyELfQmwuBcgFdPYxxMloJ1Yhg9j9nKlKArkVqYHpM6fDFJoMOUAxvR5lxNjvZsF556IMCeGavt81PuHZGE1S8Om_Nl7eWFL1DZoLJRSbAcPY4WV5g34-tMV5eWaog/6bW8LgVWEHeLZR40njzSkGNX40nGmRjGh7-0IQ7_ins","filename":"59348054.jpg","size":117708,"type":"image/jpeg","thumbnails":{"small":{"url":"https://v5.airtableusercontent.com/v3/u/49/49/1768197600000/_cBbc9fYbKClgC-subn_1Q/t8TJ0y0_n2FFYyRpzrXoTwSrOJVmNWCGZWIN7z0yOeGyNxApkwhcse_bh0ObBCuPP-HAFrkkRIyJTsSbb-uKNPdwbZZ987vG5f7wmKaQs-pvEICR5R9wf_XHjC0J4V1RznBvRSTfVZEIvHxfnqqUaQ/GZhUuG-hQdcVHcmTB8hOLVpStpM2L32yYdBgtmiQiHM","width":23,"height":36},"large":{"url":"https://v5.airtableusercontent.com/v3/u/49/49/1768197600000/fH7tgbnZBAby5AWc8gpwyw/v2JBlBily4HztoNMvLrlZZ3bqX6WjEgg38LcFVPpcxhd8MIi860wPKNUcd3drVwAFAziViaW4ZH8jFYMIc0F86MYC_myqS1yJg8kvc6WTjcWWClG3w4YCKZk_H9xjJUk9OsEmoWR4NPO5mkAni_yoQ/DzN5LOgsv4WXwJnE8Y7RXfMr30svbeWUDL6rQQnGyP0","width":260,"height":400},"full":{"url":"https://v5.airtableusercontent.com/v3/u/49/49/1768197600000/Gc20zHf0cyZ8U_KG0HAvGA/-sOI3jr35HqTK3argXELMeR9vohXwIULf9dmkw1OoRuiIlID1xTyPugl4hR7tzUG_asjh73Z3Fh9mmJt5_lp5Eu-osdm0NL-zb4DUTQ7PAmiK3GYFvGUEgkZ69ofyR1q8CW2QE4dIApWhjbTLzR7XA/DL_aPFwIBXRObXbZEUb32PTMcs_6BZPh3GFlpsbvAoI","width":3000,"height":3000}}}],"Authors":"Miles  Cameron","Series":"The Age of Bronze","Series Number":1,"Recommended By":"Highlander Ajax","Readings":["recEu24j8C4bDapX6"],"Date Added":"2023-09-14","Genres":["fantasy"],"Author Background":["by-men"],"Number of Pages":496},"Rating":4,"Read In Year":"2024","Page Count":[496]},{"Id":"Sat 10-19-2024 to Sun 11-17-2024","Started On":"2024-10-19","Finished On":"2024-11-17","Book":{"Title":"Meditations for Mortals","Cover":[{"id":"attbOuiFz0DY0BAj4","width":326,"height":500,"url":"https://v5.airtableusercontent.com/v3/u/49/49/1768197600000/JmeqoSV-xzdxGwotWJ6Ozw/WoI0sd8WGa9KpKV5iaVyG5ylOiCMbcO67YTdBmsricGZqIbBb2SOG5DB9Nd56v9Q1RfoAvf6GE--tNcmULtKtHme9LvHt_NWfXcpIjLEjNaK76QdAVQrM9g4l1IMah0fczUctkeZwNxiwBsbHIUJvA/EBnmRj9QeC87q46-1F5GDiIjNiUKqiagPjMgpXhPIlI","filename":"205363955.jpg","size":29694,"type":"image/jpeg","thumbnails":{"small":{"url":"https://v5.airtableusercontent.com/v3/u/49/49/1768197600000/DrfoALVJxL48KGHypCv-Mw/QQvinz-MtNaHOVxmc9cWADf7z7GKWe_y4zNSh57h8scNLqlz12j27vKfJ4zVB69lHzNv7ufh2HColVxhL0JczPGVJ_xbjUTkxEvwhrYzVPHNqCmMJAqVsyxUcFjqpHYmeP1GCmIC3jCqCAsVWennsQ/7Ld266RKdTKYbqe6SXeOu8G_ecc79Wjysq9H6V48B-k","width":23,"height":35},"large":{"url":"https://v5.airtableusercontent.com/v3/u/49/49/1768197600000/Kmiqz50S9laCpJc3Wl3bcw/RJbCuQCX1S_Gb3nBL00CtyWScoMBSu3a9YA7nW7DdoIU-vVMdzhzQXrW6V4d257VLbjFo1KktClBMlJ-q_PkfiuVL2QiUtYAcMDSBKX8MFqhA1LOMOKNt5Wrfc8IoEnNRst5CArtkQsxFW1onK-BkA/GgZ8PnpNXAtbIUri6R2xgkFu3tgg2xsWd6_9GvrceTU","width":326,"height":500},"full":{"url":"https://v5.airtableusercontent.com/v3/u/49/49/1768197600000/TEKlL8PvFIlDumZu_pqX3w/JUUV7-A2-DcxsCu6-fKDe2T9neUpFgOqEIcrOvk1Gb6xMgfYCCh5T_V4FkB_EDki-cjnQyVxxz6AM2uhuqKtctc9a8nRkUBqM8MZeBcaAn_89to_5shr0tiqOZE97Qw5qa77EMcsf0K0R9_5l6B1NA/rQJ27ZdZzxgAqheMQaHwifKyJAO1tofK12uf35zBACc","width":326,"height":500}}}],"Authors":"Oliver Burkeman","Readings":["recGGPITm97tQ23Uh"],"Date Added":"2024-07-13","Genres":["nonfiction"],"Author Background":["by-men"],"Number of Pages":208},"Rating":4,"Read In Year":"2024","Page Count":[208]},{"Id":"Sat 02-17-2024 to Thu 03-14-2024","Started On":"2024-02-17","Finished On":"2024-03-14","Book":{"Title":"Some Desperate Glory","Cover":[{"id":"attH7QV8nza0jGZuJ","width":1613,"height":2475,"url":"https://v5.airtableusercontent.com/v3/u/49/49/1768197600000/PFUaReEgtOvWP0asiOfUHA/mHn4ZD3y2-K2tf-LMQ8yyzL17kp-Md8yJeVK0be9rFK0YNSIGp4RI0qnrbMI5A95m8jja8Sj_Cq6cbssXFgHv8VmSFgrWSw8SwQwycMuNat2Q22UEFFaPeTrCSJoEpSjeGhh5VGPwwfENl0OTQ43XA/O81Rvo99OXwP9f6ju9v6PkuVDM9cIZtBgvNJg_aQdBs","filename":"58388343.jpg","size":193107,"type":"image/jpeg","thumbnails":{"small":{"url":"https://v5.airtableusercontent.com/v3/u/49/49/1768197600000/XS8xzRkX721jYWwetUw-yQ/40e16H5X8KqJX6xR1oVs176qfqE7TOjQS-opGSsCO4HN-vIRpGM1_P1JW-goNYuKSXks8GGhnVB_WbUqAT_a7uRwiPMG4ceLep9HMCy9Z_pyiI0I_TFqgLgkjA3UtyEXBRUKiEAgyvIlqaOHv2Pucw/CkH8njE4fve5OvYoSHmgyWerAiAkx2JkSuZ_7JXd7iE","width":23,"height":36},"large":{"url":"https://v5.airtableusercontent.com/v3/u/49/49/1768197600000/7kq04roQx1qORJZYho3tsw/csLPQl2OH_3h2N-rZSXhPPJFClWCEevse4uA_zevVvADFJSG0V6K4p6ABILfDiata0pFkoLZ-zBL9iF9xf0qcnATRk5dhFnk1YDuVgaGQDTZExXo27ihdQ29a1EGMIBw-lu8OFNMXok7Sc4O7IHSbg/ie_w8q_8q-MJhr7osGEUg8_0wBoJT-JFfZAnDebrhEs","width":512,"height":786},"full":{"url":"https://v5.airtableusercontent.com/v3/u/49/49/1768197600000/I0AM0djWaCxJr5wjVA4sww/GjzPJ_17-EjbEzVErmj3OOsqIQGHgA2zzLaImAt3EfyliS5bT3ElX7G_qU-F-5_0RwmyKBqPVlXt59sopBmbHI0qNrGoTrDzhejH3wnyk0T_zKrUX-8Z5sHsKwiPmSgMZlV9udg0g99ouLAOMPKc3g/tAdPx0F31E57CxKQ6eZ_JRCdXldQNxMA2_WRhgF8xOY","width":3000,"height":3000}}}],"Authors":"Emily Tesh","Readings":["recHjIuQEo4nKkT5T"],"Date Added":"2023-04-16","Genres":["sci-fi"],"Author Background":["by-women"],"Number of Pages":448},"Rating":3,"Read In Year":"2024","Page Count":[448]},{"Id":"Tue 08-06-2024 to Sun 08-25-2024","Started On":"2024-08-06","Finished On":"2024-08-25","Book":{"Title":"Deep Black","Cover":[{"id":"attGhytEa1KchtliL","width":325,"height":500,"url":"https://v5.airtableusercontent.com/v3/u/49/49/1768197600000/pWztvLyLK7xxBofBlh9_Cw/Vn2n2pwEjhMwIYK8EZwGL_mStLHVlPiXxSPDbLsmMf_-W7sbeByeyrXpQjFcja5fLBoCq3_RYafVUzNwcyb-3MP3CkBh9oAPB0r7QPsvYwQCjkZmh43qC4xET2Uu7a5PgC8hTmqcXD4xMfLndfNnHQ/Tj-XrFHoELCAeKZ0jRP74cJ9XxMW9w8OPMncwmuBYUo","filename":"198267816.jpg","size":29716,"type":"image/jpeg","thumbnails":{"small":{"url":"https://v5.airtableusercontent.com/v3/u/49/49/1768197600000/LoJhxG8gHdFCEHBikjUShg/cRzIOvGviCuMRszUNlBnHEwPJ3tY1JSMhfiw2NxTg12iAGZnAOHz7lLFc8rgYzr1eIv6P5Bxhr5EC8XnQrEO6JxS8DCiQ9S6YIkTI95xtcqsJd_XoSDXd7hDEg3_4VB54Xlhj5Cr0PeLMJRIwp-AvA/DGwtvoBNVNRxX39mxqR_GYL49eUJjTDOMHallv1T9VQ","width":23,"height":35},"large":{"url":"https://v5.airtableusercontent.com/v3/u/49/49/1768197600000/3wavNxvxxvva4mu3hcAbxQ/WCMMK2feBTqjjdaSuDlzkXaHoG1L2NM6-wQXSRpc6KoI6mzin3jpsHTVohRpikMRQJHP8Q5Uk9msn3O7jS_DT5mNayeE1QEwNWIeh5qCuHgYS-xCDBhv7f_GD0jlyLVYvnKgzU6AqhZyg3j5CnFudw/bw5pcqIYlCTkmOx8IqYzxrDKOD7GyMJtqvRMp4zXoOQ","width":325,"height":500},"full":{"url":"https://v5.airtableusercontent.com/v3/u/49/49/1768197600000/J-uAJE2Kxl-t6KU7aAXrRg/Y9Rdm5EzCNhmMlec2BPFgjVGqhawUD6FWpnbr73qyw4wWgQ-LVe4a5kItZ4gD3M_XvFd355-7S8VfeB2Q3frPZPcasak3fQhygsMykHOLhDWaGzmBFzlGeUW4ytaKH8Q89vp8vbzZstiXFDu8f_D9A/uVbuRZ2cgGDMWaBZo5ZkfuAiXfVYe7Y4A8zXdeOuqBQ","width":325,"height":500}}}],"Authors":"Miles  Cameron","Series":"Arcana Imperii","Series Number":2,"Readings":["recJOxgBtWveDZ2Ra"],"Date Added":"2024-07-27","Genres":["sci-fi"],"Author Background":["by-men"],"Number of Pages":510},"Rating":4,"Read In Year":"2024","Page Count":[510]},{"Id":"Sat 03-23-2024 to Mon 04-01-2024","Started On":"2024-03-23","Finished On":"2024-04-01","Book":{"Title":"Leviathan Falls","Cover":[{"id":"attcz2RjnSaxEWBvf","width":597,"height":917,"url":"https://v5.airtableusercontent.com/v3/u/49/49/1768197600000/6qDC6lxP9-WB_scJp6DdEw/UCKs-wsAWB-BGmBoX8HtPEAM3HPaa72I7RUhuUo4NtMEe2iWQFnol_u0mAwyj8LVm0K01Um9ICcutkOM8dSs9wJqHXcAxfX75Vl3HvjBfFOFvS_CLpuHQ2CU7OYmNf3HMg39Cp354xO4b3MdFBt_xA/_L_NOfGPvTJXTBJAc8UsX41SAP9Zf4T992TpQ2TDrbI","filename":"28335699.jpg","size":743923,"type":"image/png","thumbnails":{"small":{"url":"https://v5.airtableusercontent.com/v3/u/49/49/1768197600000/24f8omgC39YMRe3bxDxhYg/G0Xi938ckMPaPS98xuQuzhz37dKJZc23qu1XaylDL0z1ldWtNxfymKIBd_CQK0wdApui2E-YVsSlUb93ZaKBJ3RYtw8Qr5yyd6nws5Iqdvy2dVWJ0L4jLkj9kisqStHqDdr41jhbZWyBqr4O32DSrQ/hn2OYUh0IbAUtqDA8CXw_UvrSQN57tOhYcktH3AKqYg","width":23,"height":35},"large":{"url":"https://v5.airtableusercontent.com/v3/u/49/49/1768197600000/KoWljfk_vUaw5rwxd-cDqA/zclmlvM2AvpBY186JKVrjoyqAGbxt11Vez4f1vWBVNCGpJOAevLt8DZE16avcBz__dv8-zpgZ10NICr7L-emKBNpMEz4lDDoO_1vsyK0OcqFasek23BPa7pB6RmTsVFNBXQ7GucjsMvaeYq3BaS7tA/Ln_hBTLc3vF11UzFjdGhYK4ulWoEyX0zS0qbV61hO6k","width":512,"height":786},"full":{"url":"https://v5.airtableusercontent.com/v3/u/49/49/1768197600000/Ozo_FeFYnsPYpzJjr7jSXg/d0qLAsqJWeEgTz6vAR5mFhVQ7QbclGAFXcRbceC3bf06qxmPJMH2ucElBvyre-SHorsSsUrm9KCeCPKlBjd-_stQyAjAR5d0XwrTxcdjjqvvGtmDL6CXRW5-ECHXXJRMAsPAGQIcpHTqSZlhGG095Q/TpXOune63fpPfrKJ6UKQJgx9-xjgaQ9zv1EVGi3QBlA","width":597,"height":917}}}],"Authors":"James S.A. Corey","Series":"The Expanse","Series Number":9,"Readings":["recKYWbtpCcybzMrX"],"Date Added":"2024-03-23","Genres":["sci-fi"],"Author Background":["by-men"],"Number of Pages":528},"Rating":4,"Read In Year":"2024","Page Count":[528]},{"Id":"Wed 06-05-2024 to Sun 06-09-2024","Started On":"2024-06-05","Finished On":"2024-06-09","Book":{"Title":"Opening Up","Cover":[{"id":"att9IbX5nHX9kr6vG","width":306,"height":475,"url":"https://v5.airtableusercontent.com/v3/u/49/49/1768197600000/qFkYlI0z53hUfrC3uf24cw/37-Q5CRDQIQIf1bc7h-AOBv9DO6cL2Zn6myLCCC-BqFkp1AUdGrO7SwsttAIJcbi2IDkXNkW7jS6fwErEuQBt9IN4G6lLgr3EqEd3TOD3QT6xYdfVaWLpkmioe_820u9A21LSOxP8Qx71zz4ZYiFVA/7rMJrquByRHk05pKulKnibhz7uuaRwOE9bhsB8jDB34","filename":"1128665.jpg","size":76359,"type":"image/jpeg","thumbnails":{"small":{"url":"https://v5.airtableusercontent.com/v3/u/49/49/1768197600000/1hdaTdv-ItNH4zjTe7mtEA/T31-OC5pWG83Azn5W0RkAEw4Uk_Ec4W_SMV6PLo_WL2j6l7byPX0lwUAlvHMvQcK71ErcT1UzZvufSOpXy_1fMLJS1b7GoB6cfgso6OjKsYhrEPWCQ9nFg67Sh-KO25SDyqz8o7oKbQOll1vaq4vcw/1VwbnxAxoxU81tH-6-AadaWTjVLLx9pw9vKDxpjI0tA","width":23,"height":36},"large":{"url":"https://v5.airtableusercontent.com/v3/u/49/49/1768197600000/xecR7bHXOO_8IJImKgUz4Q/YixjJrX0BLkTH6KC5o0aL8cypP_YucJj6f3NQUB_oe0ZJw63FISWIajnvxwICFwmK8J4rxUXk07kz3AvNZf8o-7NYGx3WM1dkqj66egVhcV9zArMCN4eFaXFVWBd0WAh-mEkO0SWSlYjpL1tONxubQ/r07LOAfH7S51bOPEMFO-PysfSq_CBWFhISCg8HixPus","width":306,"height":475},"full":{"url":"https://v5.airtableusercontent.com/v3/u/49/49/1768197600000/GEcyZqTdEvqSEr03YkLOOA/U7HPtGSJj-e1d9jWrdsnQW8CR4nZ4Asa3NdFjXTxWVMKnL47hvrUM1z-J6QlIRaZil60QE6I318Fh5zWCl9IytXGiyv4leU0sFdkNKRVtQudNTWCYAeakzkyqI0TO4zOYtuR5BB851lc-YBQ1yQoyw/f5NLZjgqlxWwv25mw8zc_-eGx9WHH1Qly1rSB9DsHxM","width":306,"height":475}}}],"Authors":"Tristan Taormino","Readings":["recMM1YCoamaUR8TL"],"Date Added":"2024-06-02","Genres":["nonfiction"],"Author Background":["by-lgbtq-author","by-women"],"Number of Pages":346},"Rating":4,"Read In Year":"2024","Page Count":[346]},{"Id":"Sun 11-24-2024 to Tue 12-17-2024","Started On":"2024-11-24","Finished On":"2024-12-17","Book":{"Title":"Alien Clay","Cover":[{"id":"attSwpyflpZR0deXX","width":325,"height":500,"url":"https://v5.airtableusercontent.com/v3/u/49/49/1768197600000/LlOOfKfm131-zibLnqquUw/ltvZe5zWSJ6GW5mY_bMBCij0NzAMwYUXkBN-SqtNWC5K0-c9BHrcNVH5ii8g0SIIPkWBSVFniInIytwIJAVeCQYUFR321FxOTjri-oRg8Wh2BeUWBWM9x_djb4XCJi2m/w4Dg22-NlxUAhGECt1U1Pnm-LYHtuor2FKt6AxDCRkc","filename":"","size":53323,"type":"image/jpeg","thumbnails":{"small":{"url":"https://v5.airtableusercontent.com/v3/u/49/49/1768197600000/-xVnT_IUQn1v_IzrghTsZQ/V1T6gXJKlCyQC6Nb55Q5wdTFYOtkv2Va7AD6J_Rh5zWGgzlzfNI25P4_JDo6WhKM-X5dKRXeyiEZ9EkrdkxjMcXxdJDJCirbuImK5oeul3sQ0YOpKSydInHTuR1q1HYWeHy1l9Pjg147PCGsJ5ripg/hTvmeGVPAKzSi7atdSKEqd6HF1mN2ATIecOwbZ1PrCg","width":23,"height":35},"large":{"url":"https://v5.airtableusercontent.com/v3/u/49/49/1768197600000/FavF_L3e3_In8hrvtxahtA/eCqGTH8kyM6PduyaX-RyvXFtvTX_xlngp_FOx7klOGJXlgaBZkipkO131P59CaSDA0XSYBDdhwIQ6rHbXpw3YrCSKmxxSLFvspOTVfOZYzcRUpZULhlFOoC8IGxu0QEpTqNNqyiMIAl_WgsobA8XKg/TCcngxiGNXQYj_g7c4zh-rbVAY_LhChWED3Zxp2FRzo","width":325,"height":500},"full":{"url":"https://v5.airtableusercontent.com/v3/u/49/49/1768197600000/Hoh2p9isskH2rU3_-MHEbQ/cWzdZ_x0XbHkceRP0r2vdm8iZ2v23r0C-OvBaEcL1soI7LOW45uuJPPvnYMXP6PH-Dwt9YHpn9chf9Kkn7Iy4SmubcZo_As1pBSHZ6MFWosKGpysgeoxoJwLj1ZVdZ4gVaK7MFGZWr9PMsOiHTT-HQ/wMRhMhcuW9fqbfSiPwI34fw8GzYcp6Bx9_ZaFFrI1c4","width":325,"height":500}}}],"Authors":"Adrian Tchaikovsky","Readings":["recMleOAqRbmXwSE6"],"Date Added":"2024-03-30","Genres":["sci-fi"],"Author Background":["by-men"],"Number of Pages":396},"Rating":4,"Read In Year":"2024","Page Count":[396]},{"Id":"Mon 09-02-2024 to Thu 09-12-2024","Started On":"2024-09-02","Finished On":"2024-09-12","Book":{"Title":"Polysecure","Cover":[{"id":"attv23dp04YsL2ZWQ","width":657,"height":1000,"url":"https://v5.airtableusercontent.com/v3/u/49/49/1768197600000/2RQVvtCor66wwxN-GTh78w/jy-j9fh9bhWogUMQofznt9liyOVgSrycxGS-M-8irmxwNd-l91dY7wWQ5aY3GRnJH5v1V9EAwIwHg7xkX-j4bQtiNmM44Cnk6kCCoCQNovp0jQACSO-UNwfO94_Ob8lUUP-hcVhpKjBQLY2MyCm6Tg/0IkbbfuY9gucuJPipXsSsnDAU4hJm7FIyqxAeZex7dI","filename":"52569124.jpg","size":340577,"type":"image/jpeg","thumbnails":{"small":{"url":"https://v5.airtableusercontent.com/v3/u/49/49/1768197600000/8AHFdJrECBqgV8qU-4OCBw/jjpzEl94nSle-gg8-Dgrg3_R2V7wCg98AU-VTCPYBDvhZba95uwhXupBKNjwh15D53chAo18eHabUE6HxToQaA-g31V47xrG9xKBHE857A0fFjBlSp_vpOM0nduZyp4G_cSaAikZwHk4Cr9-MmwUcw/fnz_5S7qHdAEyD6zX-8L7MBP_ejSxUr1g7Ewkj9kZoA","width":24,"height":36},"large":{"url":"https://v5.airtableusercontent.com/v3/u/49/49/1768197600000/O8DjRgt4QuPqpx2n7F5ekA/jnUVp7ME-_oEJzsCNR3WFbWSY_gq1__CxBOPvGVtefpeSDeU_k7Ujrf3YwOrPfQdB23dlf1o66s8iQT3XKHTbfRUM-AABtc1OiUsEfdR2Rq0nsvAQW2Bfnx98NlqEA-0sAJTpa5PuDO_Dyk9ByN2bw/rHXFQ0IQs-aqeA8tYLI3pu2ncxT7oedBQMKMCbxSmj0","width":512,"height":779},"full":{"url":"https://v5.airtableusercontent.com/v3/u/49/49/1768197600000/1VXqYhohedkhAKYiR40ydg/TUue7SdAANorXNSAdTaxcL3MS99jmnSWQVtXtEJN8vnrE1dsdwYmOZnsj9iunZJAYO6jjRVkzuskEreOKrCzWZ6Ty9Tff6M862i5oxhIl-QHXucbyd2arjXM0ZHThgM4Nz7skFIMBoEWFanFiwRD9w/8au7eFpeuR7w7-bw_1xsQh2Vk84bGSYiAxDNtFJQWfM","width":657,"height":1000}}}],"Authors":"Jessica Fern","Readings":["recUZmA0Jdgi7Kea6"],"Date Added":"2024-07-28","Genres":["nonfiction"],"Author Background":["by-women"],"Number of Pages":268},"Read In Year":"2024","Page Count":[268]},{"Id":"Tue 06-25-2024 to Thu 07-25-2024","Started On":"2024-06-25","Finished On":"2024-07-25","Book":{"Title":"Wicked Problems","Cover":[{"id":"attDMOvt8P1Ag3GUE","width":1500,"height":2302,"url":"https://v5.airtableusercontent.com/v3/u/49/49/1768197600000/dlP3S5RnEZg2PVqmJfu1yg/1kAiuBBducARx-i15PdHxTm6gOxv8yriLDGP_5YgxUL7duZhQVxzzzDyR7Ocon7CkrNr7ai1c827_UYE6uG15feVx2avht9CaPkqVCpHwrBVz5ZkZOB-qzJwwvzqrSUf-JEwjRHgFszN8T2O1zemCg/qEdYP0JvS_jXAINqV9Pmn6vq90-cZxcSw-mRS2J2HKQ","filename":"127280414.jpg","size":806356,"type":"image/jpeg","thumbnails":{"small":{"url":"https://v5.airtableusercontent.com/v3/u/49/49/1768197600000/voafQ1wOOOOjhDBZcmsVnA/n7sg5z3ieuEDoesJwCzuCnt5iImiAMhacheyy2B2wNQ9IGOypFcW5UAtpKS5GbBlVhvm87Nhpw-bojQjRcvMlnKKf-rEvC3379FDoCo04b9AkV4Fs6s2ohH17rvxBzQhlq7rbgaLEaM4LG5nnKyl1w/W-VH-oOkY-8tRdb85ENzkbHTTz0HBUs9GfdunsvK_D0","width":23,"height":35},"large":{"url":"https://v5.airtableusercontent.com/v3/u/49/49/1768197600000/kcALCdf1YufeCTyw-xAOQg/MsUCjtTgIThkWLMufvY371m7vjRTNTtZn35TM5URDgFb1AJeFVLUgmaML4-0d376PabnEQDZ_RdPrtz6RAEDMVykV_HIcgbko5nhC05IjBp37ptB102f_uHlnyokiteZifcXEdGgcXuKyDgpSWOYZg/IwhtxMslytWN-jcuxKUZx_BdsygIHS4k4-YlgUkSwfo","width":512,"height":786},"full":{"url":"https://v5.airtableusercontent.com/v3/u/49/49/1768197600000/ocjRyAE9Tkt3EnNxvRWlWA/2oOpjaIz99TNTFReOv349nGqZF6LVXC9sPIhF9ldHSBirbdjhl9N_kTn8QcKhDK7zwPknM_W5PgPme-9prD-UyK7nTrHfk8gwOrjxXbtb7Hoe4YFLDHxLflOF1RF0GInrfSEdiVwOh-UVRe-Z-SioQ/PuZPk9H6vWAqNc7oI1dl-Z9OPwyuLt9HATbNRB3DQeM","width":1500,"height":2302}}}],"Authors":"Max Gladstone","Series":"The Craft Wars","Series Number":2,"Readings":["recXuPp12Q47O3EkD"],"Date Added":"2024-06-23","Genres":["fantasy"],"Author Background":["by-men"],"Number of Pages":464},"Rating":4,"Read In Year":"2024","Page Count":[464]},{"Id":"Sat 06-15-2024 to Thu 06-20-2024","Started On":"2024-06-15","Finished On":"2024-06-20","Book":{"Title":"The Ethical Slut","Cover":[{"id":"attzoMMZrPbyxiNg3","width":333,"height":500,"url":"https://v5.airtableusercontent.com/v3/u/49/49/1768197600000/-UrskUCXba8VSBgt6BD43g/JOCakx28wQdXRccd1vBs5XYqyfrJwhRt-nfqAZ2cXJwqvShy864SOW4J60usQGZpsPHUbVDA22MFppcDz1JV0galdBp9_JE261iv8mg1Xu5DOC0WN-t2VGLVJpWzn3aHqv9jSy9ltCguXx-l3Rr2fw/tdt6c96WFOGD4pK7xHzv1usvIf14_rm3KOjPBR1Nx0I","filename":"33814856.jpg","size":30934,"type":"image/jpeg","thumbnails":{"small":{"url":"https://v5.airtableusercontent.com/v3/u/49/49/1768197600000/z_58i6lJf25AXwkhHdSsfQ/Yh-jxLX6E7QOtjpNSlnapTGci7EVHqNh4d7DLZ2Ld3VJoIviF2wUuWWvpSJVCTdgS_uG5DyPcN9g0_hqBe0fPmIraQ7OR1wevVQNqjCH1DXdzHvqKzI7ZE2E40khmWFaQm8Xszu5JsBjku2s7vCJIg/-H3BQ5z_gw9yufvlCWRCMcTANBUMZ1QpZFL8nioScEA","width":24,"height":36},"large":{"url":"https://v5.airtableusercontent.com/v3/u/49/49/1768197600000/sto39vuX7SN68bQ9Qcll5g/jt_W8QSdoGcKOH5P_NE2WoxKAgj2a2zkjYavair814FGYliWJ_baT4Ij6XrGDNIjW4dFdtnRT2Zgc2BEaCYWBp6QfCcc-ecu6Jn3scIi13olFO_cScFJx9Wd5joEybE7QiCgGJe1WOJ-CJt46e0q-w/452mAs79ErvXdRKwA2mo4IXHdKZsmQ2iAnGwBPQorMY","width":333,"height":500},"full":{"url":"https://v5.airtableusercontent.com/v3/u/49/49/1768197600000/O4RtDlTOXWg0vbf3e1A4Qw/JC0VHzCx1_LFbgfgLKJZzWRlriPfsWrPMcmRhA5rHTEvu1ZgC_M4Vs8LV8yTyBTUVdZSzBDGl2rDfUYxWdxCyt5FpKdzksBkliKYkKZRbeqE7RdEtoYKeRmFCV_9qFC8NP8WzVje9ClXIQ3SSmOoUw/ClKsX56XF6OKcuHM17Tny3ZpFd92VFqfq7Xy4oLSemg","width":333,"height":500}}}],"Authors":"Janet M Hardy and Dossie Easton","Readings":["reca9wdt5CloGK1q3"],"Date Added":"2024-06-02","Genres":["nonfiction"],"Author Background":["by-women","by-lgbtq-author"],"Number of Pages":320},"Rating":4,"Read In Year":"2024","Page Count":[320]},{"Id":"Wed 10-30-2024 to Sat 11-23-2024","Started On":"2024-10-30","Finished On":"2024-11-23","Book":{"Title":"Polywise","Cover":[{"id":"attZiZlryfi4yspXL","width":656,"height":1000,"url":"https://v5.airtableusercontent.com/v3/u/49/49/1768197600000/hFvYvYbRPQ_RYIiGo0rHfg/tw4oZSBubxdobqVmzzy01s6NyHC_S2iokufKiS2JV4kMp6FV6q8ZxaMM_2cCV9wwvXDOgVQg2a1_247MvDAbtiuNY7N8CAcP2HDBx-aA6CJwFXtV_loFFOa6878nLZ19v6WKZ8leu-56rIrE6JzloQ/TDPGJ41e3W97cD_0awW6pL_KgJaOLDAkPMP2VOIrADY","filename":"62998140.jpg","size":368241,"type":"image/jpeg","thumbnails":{"small":{"url":"https://v5.airtableusercontent.com/v3/u/49/49/1768197600000/ycEmW2yCcfO02VWwhiu0Aw/eO2jaD0xqzzL3AzlYfhRVjUmWzD_wFPPTgzVnOgsph-liGhBx_vCI7UHYyj3JutthYywnqHRUsfIsNNR_L8lsTr76BqHSeg2cB0OC8by7hQVXMc94lZ9WVvlQ00VBSrRdl8mV2bLR6x36eXQG4hO9A/Hz3pE9QVKL_gRDxGsct0vb_hrKAbCvc5JB0ECeAOD9s","width":24,"height":36},"large":{"url":"https://v5.airtableusercontent.com/v3/u/49/49/1768197600000/99scV3Sr4XZ1J5PsnIciFg/dgi0UDTaEeVs5hAmf2M_INTdpNBr5ZJMpzN9zRe8HsQjKJXmXS5oSGd1XI0rJG_e6VTz-Y7DsPrBswOhnK821BB71iZ0D5suK1H_WUe1uBVkp7UjgV90hI1MqmpAjeLQqZ71viuLju01nQAarm3F5A/9vXmLeUxkvjsUqbmlM3-e-BGeDilwRAAviHxmgmXT-E","width":512,"height":780},"full":{"url":"https://v5.airtableusercontent.com/v3/u/49/49/1768197600000/e_0g3ycHVECyagVBoG7Idw/xAFVBpqCE5K6RNtDH_8XXMHcSl3yw1k5vn5F-Unn8aaCUWtwWKGTn4Rz0f2BNnecOCcU16cRre5TV288eeRz-GLq5ieYsz8GRhjWFWhmiYRmWdLfbLkSStB7qDdsZWmJz97gfUG6iX12GiNmqaYFSA/-mXPN6eKzIxhdeq2dtK_3plb4kYuXsDyHHWxiW4tPRM","width":656,"height":1000}}}],"Authors":"Jessica Fern","Readings":["receosAvcBLMdnzRK"],"Date Added":"2024-09-12","Genres":["nonfiction"],"Author Background":["by-women"],"Number of Pages":336},"Rating":4,"Read In Year":"2024","Page Count":[336]},{"Id":"Sun 02-18-2024 to Wed 03-06-2024","Started On":"2024-02-18","Finished On":"2024-03-06","Book":{"Title":"Gaia's Garden","Cover":[{"id":"attUJ8BgN0XA6dFPq","width":318,"height":398,"url":"https://v5.airtableusercontent.com/v3/u/49/49/1768197600000/JiFIf5d8jDhriJ7IAFvcww/Hf8e64nd8JEEjvTqM6I2b-5vvU0g1ql1ttkpMmjSrGoZEETzwRgsZNRUvF-sszco1bYIwEUukIXKyzjg5WGJ-Q-dF4vsI01PNvnIDcy6JkLQr9pTnwY0xIJjDHPr19_zhfF557rCNKvGuCSi9nHikQ/dlNSm0xnpCwvXS6Jangp5IwWdzZ0T4EpVIfEJwpN-IM","filename":"136542.jpg","size":51467,"type":"image/jpeg","thumbnails":{"small":{"url":"https://v5.airtableusercontent.com/v3/u/49/49/1768197600000/iU184YPCF0cSz_2vtEBpbg/Bkqnp-DmIbntPcmKQK7yH9ivWMqe47T1PHKVzbCiV6kLcw4fikZaVPMMJpS6FNmbsWBPfosKdOZkeRzvblJCZfDpFijGFuQcS1tDX_zf7H2l7bUTmUnfg6NoTX6tdnq-qfWPopVhhvrQukfoqwzUfA/_NGh3PUUgTpJHk6QXL8J8ZcRq1rVo4ribqfoZVXvRjg","width":29,"height":36},"large":{"url":"https://v5.airtableusercontent.com/v3/u/49/49/1768197600000/eHKk0Nd88GBouWhxV3JINA/uiKJljQczx3xGbVeOLruVey4pnRmGXmtlcc8VE7ji1yt2ZFx0M6dqgGo2oc_kcWWQZROv0lVmTV28n12O9-hpCytpT5q4dtGkcEFmhpih-fBSNs6W9AiX7Xj71xNTedgSCO7m4Ruwjls2i3cl91s9Q/akD6b2m6i4GoPZcZKhhcHU_NhcSBaaqs68hg_5KFfp0","width":318,"height":398},"full":{"url":"https://v5.airtableusercontent.com/v3/u/49/49/1768197600000/AfUEJZVwOhFa_aWQE_CcBw/qcmJhfkRNUxVL7S2Myh0NX-jBDWknd79YEtF4FzEY2L4nwCNeDJsEGS_Ulq2PI-SR_6a1Ben56OyK5z3w2YZc6SFtxXPisMqGIevBCOXuxThVDChQmhQzEzUmLOB4xDNhlmtu7MubmQaoL1AB9sOyw/LXm7VsF10Y-axY5ztIy5vBAsaX44W2ivG27EGsRz-2w","width":318,"height":398}}}],"Authors":"Toby Hemenway","Readings":["recgsnR0v5HL0CJ4j"],"Date Added":"2024-01-27","Genres":["nonfiction"],"Author Background":["by-men"],"Number of Pages":240},"Rating":5,"Read In Year":"2024","Page Count":[240]},{"Id":"Fri 09-13-2024 to Fri 10-18-2024","Started On":"2024-09-13","Finished On":"2024-10-18","Book":{"Title":"The Sky on Fire","Cover":[{"id":"attNRqbTVLC9UdCyJ","width":987,"height":1500,"url":"https://v5.airtableusercontent.com/v3/u/49/49/1768197600000/s30Y8AjpUf9AjJHbXOCFGA/xUUKa49P-2lR088cer0lnH_nlN3f4vrIBl7baSmKZ4w3TpgjkuFDPQnloWKKz8Qk_tYl-NuThWdsx8VBXTL3JQXs0Xdtl-3y1sWYqKB7ONcD1R8MpkSHq4kR0Q6R6n4P_XgkPogZ686WIiLKBiyKfw/1jMd1f1apUgeXUBnGiqEYqLyj8PclP9yRw2OVJXOnuo","filename":"195790718.jpg","size":246830,"type":"image/jpeg","thumbnails":{"small":{"url":"https://v5.airtableusercontent.com/v3/u/49/49/1768197600000/jVB6_prYU3XUE992xDuYgA/Tp7LRh5vu8eC5-fBUihMHLsZqUUScZ6bfmH2M3BzapXJzjP1zjhB2aF4YQtS9AmBvX4uoncC-CZyIUy4GHb2keJDYqWc4QacKOIKh4FHQGbRICEchBzuKxgNXBTX6oU9ZuqfPISm5L-yNFrofUtLTg/gy0Pk0VLJyQ4Ci0smN-C8Pojqp5wJv06HYyht5jIpbw","width":24,"height":36},"large":{"url":"https://v5.airtableusercontent.com/v3/u/49/49/1768197600000/_tq8SNQ5rOopdeq37gFqQg/LWgw4JHJd7PJmHFNMXbQMS9zIPbO8MyCD4KDgwx8exId6Lt4xZ5CaGT0x-Lr7qGqFgIoGpFlR9nJl5B_gpY84-V7_3fl7xJ64LcqZII6IJxW-m5uqs4R62GkPKQP_oXV9SgkDbzNwjnjYUYaEG3ZNw/ll17YOYjrTewDcZvQO5G5YdfPiGGbZtQOBJ01BoB_9E","width":512,"height":778},"full":{"url":"https://v5.airtableusercontent.com/v3/u/49/49/1768197600000/NUq1463Us6-4oH_YC0nWiw/R23jrl21B33JQLvPnkf2cbX6RFB1oz48CQWn9lczL_NTUNUGAZ5zOTslEXIqwpcdvdP2CTV50GZ1meWCqE2KSgyv6s_hFJ10yk6qF_yWx98ibuDmkeA5MMY7NE-ScMX4R3QwuZKno_cw2394ohJTtA/NssZJUzHnix5buQ0nep5_Yoj01T6HmzJGVLE4quCVpo","width":987,"height":1500}}}],"Authors":"Jenn Lyons","Readings":["rechebAxPWfQcRMAU"],"Date Added":"2024-07-14","Genres":["fantasy"],"Author Background":["by-women"],"Number of Pages":448},"Rating":3,"Read In Year":"2024","Page Count":[448]},{"Id":"Sun 06-09-2024 to Sun 06-23-2024","Started On":"2024-06-09","Finished On":"2024-06-23","Book":{"Title":"Necrobane","Cover":[{"id":"attKjAGZCk9rhI5IC","width":995,"height":1500,"url":"https://v5.airtableusercontent.com/v3/u/49/49/1768197600000/NrPfl7NCunXWpnzyFmtpvQ/X0mvn7MEKLzH7iG5v-pYerdbOTS91eeOWFnppPFxT4oGB3nsiHiCP0m4buxZnLN8ZgtXofCVZ3xQtO-6JgdqUB9V5v9s03MZIyydjqhJKtc13ytmn1viyC4qhnSWAPSa0tjdeLv3UQpyfycAOg1H6Q/8Lj44s3TfdOXmoy86-zRgzQ2NdKXTmlIjp6OICNsEok","filename":"127280163.jpg","size":181962,"type":"image/jpeg","thumbnails":{"small":{"url":"https://v5.airtableusercontent.com/v3/u/49/49/1768197600000/h1DprfGG7-VN5As80-X8ew/jHbNCqp39ZgQSVJ9Ih7OFL1uxhfBJmbirCL41iKUGhAA7F5QGV-zXRlXCx8RmH2ma-YVNYSR_C_UfO8LrWCzL4ijEjHdBEPg2fKTgHWmmHQqLTcj-EHVF_redzFLUKxou55e0Q7rhh44Jxm-1CTScg/4sqL4Y0LcNj16HnJTloGM48M_lp1Qc6X7rLDF_8IObQ","width":24,"height":36},"large":{"url":"https://v5.airtableusercontent.com/v3/u/49/49/1768197600000/6zZDi3mPw7L7v_-as9qo2w/hCCiichvCxfVgpQ9ziWSWdPE09DSEyHEYQp6YabsZV5n65uULJGzzo8a2Mm_k-wP1l5C792m5DnhLAzqjxaF3G_iMs2G1B97ZeTONsRMuDHe6t7xu1lWyXDYurAnUaf1LJL2KII9SNUCgCcUBg7Rsg/szj3d3I6rwnhlYDhqgrC6BUjirTaLmQ-wMDs7BjgZrg","width":512,"height":772},"full":{"url":"https://v5.airtableusercontent.com/v3/u/49/49/1768197600000/_wPecqh5toj3F_tuuy6olA/D4ovf12is8RvqmeFXHgvwFLCBAYm34qyXbUzOi2g-rwCZYFQOyrD8ZIrWaAXkuBxYry4W331xPsz2TYa8LNXDnV4HzBKt7eja0UjjRULfuukMsva3qielv6-2pPrp1Wmt_n08LH7XOGyaSXWESeAOw/ckHRHtMHfDvkg3XlmFxUrabR7GNiRq9l9BItu3AsNak","width":995,"height":1500}}}],"Authors":"Daniel M. Ford","Series":"The Warden","Series Number":2,"Readings":["recho55gSXVDL6Nfj"],"Date Added":"2024-03-23","Genres":["fantasy"],"Author Background":["by-men"],"Number of Pages":304},"Rating":3,"Read In Year":"2024","Page Count":[304]},{"Id":"Fri 03-15-2024 to Fri 03-22-2024","Started On":"2024-03-15","Finished On":"2024-03-22","Book":{"Title":"Filterworld","Cover":[{"id":"attFMJPBss5ILhaJr","width":268,"height":400,"url":"https://v5.airtableusercontent.com/v3/u/49/49/1768197600000/ZeleNL1jw8_52OzJK-qahQ/uA6E2yGYCKhM4Ettt_RGVrHKDxG-y9wK5s62IgglOLUGGepgcWIXt6PRSlJTcM_OjF7duM0jG7l6iEFbF15NUQsDBUls6hGT4ONfNxMUM1Q5uMwDvprO1FyQRoHpBL6aoO0SIi4_yR_1bZzA9zi3tw/Spr8sqzo26A44B8Ag5o59n7P4udoL2wLQxvUprm2X0I","filename":"134119018.jpg","size":95988,"type":"image/jpeg","thumbnails":{"small":{"url":"https://v5.airtableusercontent.com/v3/u/49/49/1768197600000/yHvYM4mQPJ1x9NnmFMDsVA/4pz1Rw2t4akizm2n1ZvnSjgjwz7x6K3Ory8KzbEPNekFaTirCPuQa_T6O29k24xUb2F69V6E9fKmzjWPYXV7fVcx3ds818nQ5IFRMlb5oL1C3bpURQ6iW9mVmyCvmrXeeY9mcKa9-LFCJ1jcLBfvZw/RgJ3Bjx4tivlil0N-NhvrIAqsCX3U2TTTzsuXOWaMe8","width":24,"height":36},"large":{"url":"https://v5.airtableusercontent.com/v3/u/49/49/1768197600000/f9_CNrTHlrtW9SBRRFs7vw/DNBQCBVR8TF2-SVFtxnvZSc7I26273OPJb6u2ijOLF8xaEIlCzRtjw67kXX02WL5TkKxBZnn7i98cml9qPeRxKJrLeDyvBIvrynU0FE0tbHHhwYMhjgfrVVV4Na05OjQq-2DR-kBFO3zRNW5NVQSNA/sI5eJeIL9eBLAU9tZyx-G32tZvxR3b6lhGogd4GAmCE","width":268,"height":400},"full":{"url":"https://v5.airtableusercontent.com/v3/u/49/49/1768197600000/lmh00wCA-3EMoQQ3GpYE_g/e-2x65mOK7bQeQK_joTEvt4fb_EkbbFqVm_E4cT6xp9BqOecFxbytYY3INBT7zy_qSSLMHulYKzEymToj3mPJcXZ6iHcIhUiDApMyus-Qsp_aOJGGMyfRHLtYKySEUS3LeDuFpFr8u6-_NYG5s4mvw/1hwPM9HkxHxxQSyqabr50sX3uRQVLnmQgMidrdT4zc8","width":268,"height":400}}}],"Authors":"Kyle Chayka","Recommended By":"Decoder","Readings":["recjaDpYoYZt3AMPx"],"Date Added":"2024-03-14","Genres":["nonfiction"],"Author Background":["by-men"],"Number of Pages":290},"Rating":2,"Read In Year":"2024","Page Count":[290]},{"Id":"Sun 04-21-2024 to Thu 05-02-2024","Started On":"2024-04-21","Finished On":"2024-05-02","Book":{"Title":"Cascade Failure","Cover":[{"id":"attx0BFBaYxVJ6Ei1","width":261,"height":400,"url":"https://v5.airtableusercontent.com/v3/u/49/49/1768197600000/_3IgHTJCOF6TO00ZpOg1ww/S2J6YF6__wirRVTqd_m1kbJRlHTUvwuEUykfcxNcd2sXmbl7W_3YiaFntY8FqGKri9i0KAU1PnaQGkamU9RD7myPNCrKLXP3ywBi6GAZR1PwiFqKQEGXVEuKgcOsbg6ljrn6PEUPncQGDpdqUwfTSg/ifc8SgifJFmv4w6jer2sAyCZvo5RSr0-TH0zCmUvEoc","filename":"127280776.jpg","size":103095,"type":"image/jpeg","thumbnails":{"small":{"url":"https://v5.airtableusercontent.com/v3/u/49/49/1768197600000/mtpq4x8MLnkKyl1uwmT9ZA/E4DSR69JRjCGTw5jREh7FAIR5YJm5cztIEnTIFyF9wG05Wt0nonjXQ4pzhl6CAaenbziGzGrMmImw3dPNXBtHCNjSOZ0jHMERN1cjfpRxRBx6uqRT6jKiFmmuHxopJ1RoYRIPHaUBGyJ7laWH6v19w/5Y2_niWfwHSfZ4gvFRg-8Bzbo5WXct8KAwsQyzoQF-M","width":23,"height":35},"large":{"url":"https://v5.airtableusercontent.com/v3/u/49/49/1768197600000/n0TR1NI91ADsGIZz0Qdx_A/01xyh0Gc_BHcU_jnLehny9EP3Fa5v0MvhCLUJkFAFEobnEW0CbH-gLlS-_EeBvG-Op5GLWSsbtLCtWqsLi6gb_V9jLEv5LablPTKrJsFEsbIkpZrFhuPd0jBcq5RGoUGtgoukNNxtdeadZTH0i_4PQ/fh-FiuIu32T7Ow8nOUHVqpVBYigb-AfqFBW1s5AQg0g","width":261,"height":400},"full":{"url":"https://v5.airtableusercontent.com/v3/u/49/49/1768197600000/t57gVL6mb4mxw_UggqR-MQ/kRDeHhFL4UN5jqgHIJj0ued2bnEPgB8wHfU1o0x0nta1O1xg9gkiyBTAyx8KaWVuJtM08Z8My1E6Ts5XBPSMtPM55UQomZsid4qHIQenKqA13V1VQFEAAIuZGdXUiOVksLnT4Kk0Ia_VELo5j8-c1w/GYpHFpYNROQCoKwykq6ykZ6lNnD5WEFNN-iE6MW5hOQ","width":261,"height":400}}}],"Authors":"L.M. Sagas","Series":"Ambit's Run","Series Number":1,"Recommended By":"Transfer Orbit","Readings":["recp71Z9KToQmbw9x"],"Date Added":"2024-03-23","Genres":["sci-fi"],"Author Background":["by-women"],"Number of Pages":416},"Rating":2,"Read In Year":"2024","Page Count":[416]},{"Id":"Thu 05-02-2024 to Thu 05-16-2024","Started On":"2024-05-02","Finished On":"2024-05-16","Book":{"Title":"Dead Country","Cover":[{"id":"attv9n4fd4iIQtZsW","width":1100,"height":1688,"url":"https://v5.airtableusercontent.com/v3/u/49/49/1768197600000/t9NADPSrXJ0vQPeo9wcZUQ/HNOOldJUY0cnwSaGAvxDTG9FX-PHV4qqVy9pTrSdGnSeuxmaO6CU9TCiQUm20NavQq5UKEBzZONC0mKqDclOYuLFPftZzafWEX2BO68T5Kc9ABhiLEQgsqI7zSyFXDlQMCBxqkC-OqRaXf2EO5Aw8Q/aaOaQvgFflcyk6rCoWgoALYf10aBeyqZNo-pKfAmwmI","filename":"60784301.jpg","size":2719847,"type":"image/png","thumbnails":{"small":{"url":"https://v5.airtableusercontent.com/v3/u/49/49/1768197600000/zHMjZJw4yAiCz_b3xfmg1g/6LGLt59txSn7EmXfdml3G6N_kIpol3e3PgBhRq9j6_rfSr4N9nJa7hBYEHs5yIghvJ5-16Lh9f00vy2h2qrrymhZrWRcMaBPyK10e_LKvGoVwGvofLuVJ0BrBnuTSBypY5155xRFQSiwI75cz5aj4g/SrnAcSq8Q7z6UmpZch-W3FKMzrhHwkUB5g5b3JS-zNY","width":23,"height":35},"large":{"url":"https://v5.airtableusercontent.com/v3/u/49/49/1768197600000/08zxkekCN_GnhXVm1MHbDg/mjQQno-vKoFsIZzY9OPeWxcHhPanDgrK5AxY6TMY0e0QCet3HrNZUALwi5fXJvWJ-e4TNnx1HkKtbzftVzoFBGZZIrebswAD1XLSjkf08ikhlyKynykMfooDkVLTybOOqATA1XIZcf_KUrUxmQsuZQ/Zt-9beUpXiLsNUNZ_p1B67uiOdUcqVEf08BVYbhlPm4","width":512,"height":786},"full":{"url":"https://v5.airtableusercontent.com/v3/u/49/49/1768197600000/YbO8MxjixbQpQi7mbXvrUQ/5VnZA5SvnwbFEbY_i_QHFgcLwb01Wzx08fXspGptaCD62_22WbDNxJX2P7CXsCUgWuwr2cQjIjO_n4uCc7TeaO-FglRES5Qwpfz3cxRNYY-COw-Zy-jJ52NlkMBzyKb8PldEAulLwpn7BwLnqh3l3g/3o2E7bUR42M27pDZcxf6AFk_I_wO2BxvdEb_ulRHNhg","width":1100,"height":1688}}}],"Authors":"Max Gladstone","Series":"The Craft Wars","Series Number":1,"Readings":["recqIwUXSCoHDtbj0"],"Date Added":"2024-04-13","Genres":["fantasy"],"Author Background":["by-men"],"Number of Pages":239},"Rating":4,"Read In Year":"2024","Page Count":[239]},{"Id":"Sun 04-14-2024 to Sat 04-20-2024","Started On":"2024-04-14","Finished On":"2024-04-20","Book":{"Title":"Why We're Polarized","Cover":[{"id":"attsecOUyABdio9sf","width":313,"height":475,"url":"https://v5.airtableusercontent.com/v3/u/49/49/1768197600000/ZqHpeTEMe527ZmKTb_NsaA/x8tG1i1qQjyIE-1tVEwklUU6CsTlTz19Y2uJtRkuyd3wM5FbWFMSZFV9nfAR-Ic80N-V5D51daXy3f2G7pheABd0BVu_ypJMr_LE34hVJ5fgYVwm2ojC3DbcEVDnolWx8f7gTX32M3RQZidE5477TZFmsTvSaYErcvqfMd2LGGI/WnViriFcuO9kQX4-4B6jtZqdifmSzAV0UXVOA61f6HM","filename":"52655150__SX318_SY475_.jpg","size":11122,"type":"image/jpeg","thumbnails":{"small":{"url":"https://v5.airtableusercontent.com/v3/u/49/49/1768197600000/Thl9dq0Slu4q9pKGqvI_sA/TQ-0urba-TCaGryEuoLukZE0iLnFnkPmjvhpv6pTxPiUmVUYAMSTZhhUcnV5UpLqG_wnxVjaRyEmffot7TeNW3SvoFdlWhGRJ_wCvCtpsrtANoyWb6i0tI9rUuEIKcbQPeulmRgk3sz7v6sXxQmFKQ/QITgAE-kRmT_vIh5sAiLkOYYipqs6NFEukokrqLRg5s","width":24,"height":36},"large":{"url":"https://v5.airtableusercontent.com/v3/u/49/49/1768197600000/JLZTO_HkBefaoAKJ5H8ycA/2YVmcfXKkkK6O2eYzirMm2TIbCVkxer7LPOpHEd3yyTSgKjkvATxWB4sZf6O4Lg5Cxg5r-JCWlFuoDKNP14MM9s-MZ_w4DPrO6cYTRoV-Z89XBsip-TUaUQCM0oMKelEKY0hGKMN53-ZMFUn9zkoFw/VWaIVs51A-awT0KZYEeOKu085TZh9oLewjjKfQgQor0","width":313,"height":475},"full":{"url":"https://v5.airtableusercontent.com/v3/u/49/49/1768197600000/b4jqeo4sepKqXXC38xcYJA/qGPqUwCdoOxJJT0S0yd7PaxFo7xGjDuuBaa57w1jVPuRB6NuT-lFOkJYXQT6yOCWaYQGm7l5EGpoA6JkHgiHRork3oXRCp1NY4gVkaXTVkQZPV48J1RURTWoXyZUQokE07d_ngbu2UDAr2oTw-8feg/RlwsWy1MwK4419p1q4GsrRryphml8plmcrQQiOTsX_I","width":3000,"height":3000}}}],"Authors":"Ezra Klein","Readings":["recqe8vcMqOEbanPH"],"Date Added":"2020-04-23","Genres":["nonfiction"],"Author Background":["by-men"]},"Rating":5,"Read In Year":"2024"},{"Id":"Sat 01-27-2024 to Mon 01-29-2024","Started On":"2024-01-27","Finished On":"2024-01-29","Book":{"Title":"Warriorborn","Cover":[{"id":"attAq0kKgVyo20Biq","width":1707,"height":2560,"url":"https://v5.airtableusercontent.com/v3/u/49/49/1768197600000/17zwaEDKxrlETqXcn5ABnA/gqz3VFtBOdJRxpZOmWL88FB6HhUHpUBQWUd2XBGOT48KPDzqku6PYYRbxAw9rCc5FD61_2wnsw4SRm94XE1-mLN5Tflw-axcCTY5reu-xqvMFzboP8H784Wk0dBiydU4eu6Io1GayIjbX07mz52Fdw/9PY1Run2jMMiDbT-u9QFYQTBGXfUNEqvT5sIXPluAYM","filename":"195463561.jpg","size":542741,"type":"image/jpeg","thumbnails":{"small":{"url":"https://v5.airtableusercontent.com/v3/u/49/49/1768197600000/jqbszGAqCNHuAdTegyzrxA/7cAiYfcxK-cDfqc0q60rvziLXyYunGD1zFzXAaXQopBSUZv9ZXuCTFkg07PS1wi_v39t6lnXQgouFCmkE6KGTAv-te1AbK6trvjJ6Ek1Br7pq7DJ2lECIIKuolsLtujG7UEurDAerzqSmMm2ksw0UA/lqOge8TLzZqwAMV5hXw3DWU1yCxsamcm_GYRuslygpM","width":24,"height":36},"large":{"url":"https://v5.airtableusercontent.com/v3/u/49/49/1768197600000/Yil-Ho1o-JIEe-n5uuHU8Q/eJknwUqnK0H8xYyMQCbQQjb4Y5CdEDfj5SDpZOaBmqMBwSw5jFeYubxnmYS763Qyxapv_VNHcKUcgtbVnb2RUyHmgxwwbsp4oCGjKuM6tKnzAoBSbJ8qcm9RUQ7LAKgJRvzW14suGP8WVe5-3Oyr7g/8UsMNdOULXQ7EoIcHdQyD1Y1jlPB_07AZbJp-q-bD4Q","width":512,"height":768},"full":{"url":"https://v5.airtableusercontent.com/v3/u/49/49/1768197600000/Xc8Pfa_GM1ZjpPYdAxREhA/n4luNSkyRdESnnbm2E1gpjbwD0bN4CvC2Lucs__BHGNcWsVst6IOZcQH0AKg9Zjb0cPFBd249Lxa1glTwzc_63A_Dq9JoZ3DgM9RKSFOLVDFU4lGSEvMfF61uiXzGqoVTM_ni6X3O1a0K36t9plQtA/TFq9pxmAMfVCGVubEDvReP7PmPgHVvXSl0EOvQslIZU","width":1707,"height":2560}}}],"Authors":"Jim Butcher","Series":"The Cinder Spires","Series Number":1,"Readings":["recrQ09TF4MOUAwpJ"],"Date Added":"2023-12-26","Genres":["fantasy"],"Author Background":["by-men"],"Number of Pages":146},"Rating":4,"Read In Year":"2024","Page Count":[146]},{"Id":"Tue 12-26-2023 to Fri 01-05-2024","Started On":"2023-12-26","Finished On":"2024-01-05","Book":{"Title":"The Warden","Cover":[{"id":"attTxbW7IxrH4EtVd","width":263,"height":400,"url":"https://v5.airtableusercontent.com/v3/u/49/49/1768197600000/c2suALC-MZcaEVdLvsaL5w/azNIhg0yhv4KWEVUgiRa2TV-Cic1qrtge9zSbE4HP7mp6sKHZhdkDCZo9HDeHDhf69gnxa8SQnqujcgDmalCJmwG1ANJbjLXVz_1ApbIKCz9WbhWpsJmEKVrf-wgZlF4-v02B-kwMPl6GyE6p4koRw/XkXLUAckxpH8UCpOFtNgVI4sAheiEkODYcibTHKS6Co","filename":"60784419.jpg","size":89260,"type":"image/jpeg","thumbnails":{"small":{"url":"https://v5.airtableusercontent.com/v3/u/49/49/1768197600000/clH2cMHzkkFfX_7eWOXyRA/3JTLfkQumgqn6nN1l88pEuskmRqJmp9DAJfIeCe01hl2Cu2CdFL0MDjv1J2Wame9DGolhJgzScZchIk_91LYV6Y0OZrkKPlcSNg-ol4Xc-_VgT5TUOU7o06TvnXDeNMfJaDkuBiThbHy1eeRBIrquw/4F-Nfd43qqtDhAe7rgVByCeTzv_GpEVrKUZr0o_0hnw","width":24,"height":36},"large":{"url":"https://v5.airtableusercontent.com/v3/u/49/49/1768197600000/gw49OCbqlRw0xQn9_KTV6g/NIjfneMvwUFnafhQ_Adu7-0G_Dkl6CQJYiIcIEyhktH6gbvapgd_kcfVUfCsnix4dIWdeyK14GT3kfxqpHzgfebo3_ITxDJvrqt6XEuvs1oHYeO3zjdjjl_XWaiHCeod58igdqMp5v4v3ftoEAxnmQ/YlM_UOV-3pKeSwr3NARduY7n1VkFgJOr8AU8fRw-srI","width":263,"height":400},"full":{"url":"https://v5.airtableusercontent.com/v3/u/49/49/1768197600000/eW6jGflBpUzGHtVmRAhNlQ/Vznws5qdmQttS53b7_OJWF65rolEb3qAlwnU-Tgl2UaKwyhBRD3UXodr81LZfas3G9af6WOAFbSWTRo2mC9Xysahcu3sHsV0YH6SkwO0hfz09t-_-Pd7ixDnu0Kz-_wVgO87ZGk_L5JxNbgmxx7EFA/tWgVJ52Z4pcm83LYnN53dzHjp30U3pmO_zXpHj1ni3c","width":3000,"height":3000}}}],"Authors":"Daniel M. Ford","Series":"The Warden","Series Number":1,"Recommended By":"Andrew Liptak's newsletter","Readings":["rectCQzMezUOcMS4z"],"Date Added":"2023-04-21","Genres":["fantasy"],"Author Background":["by-men"],"Number of Pages":320},"Rating":3,"Read In Year":"2024","Page Count":[320]},{"Id":"Sun 08-25-2024 to Tue 09-03-2024","Started On":"2024-08-25","Finished On":"2024-09-03","Book":{"Title":"How to Become the Dark Lord and Die Trying","Cover":[{"id":"attxYeOvJIy3k4Vp1","width":1706,"height":2560,"url":"https://v5.airtableusercontent.com/v3/u/49/49/1768197600000/Kkh3G7oE1H6uSO3t1_8ZyA/N8KV5yJPOPDbYEFH9kRy0aggGK_xY_tNUHFOBmatNqrzjTi9BnydB95ulZynP0DUQiRdGDuJNpyy_KemVpPuel-_6T-xxIcayjbsp_3kJ0R68SOB6nwxGbteNhvNejiKuRPoAuyfyHnZKOieFNfSFA/8hx3o0VVBAhxWKy9jVZ9gzckoFI0IHanYhMTTHnJzsA","filename":"198493860.jpg","size":625717,"type":"image/jpeg","thumbnails":{"small":{"url":"https://v5.airtableusercontent.com/v3/u/49/49/1768197600000/q9strgQ2-Bv9kIli40w4rg/_ZR7Msm3bSv0wIV4T1T3aKSowU40gxpCGIY8gIfnNl7Cll8a8J9gfylUqqgjqOCU14Zi7dfNTaPZPED9eZIAe1CUHgsSsCo9XN5TQ25nrA8KqZxlY_e6uMZvQj7X1mwDmMhBzsBfwMADPWMy_a7ePg/62Ll-qvKBRScaeBaMKZqjZTgB-RQICWEDoy8K3G3B-I","width":24,"height":36},"large":{"url":"https://v5.airtableusercontent.com/v3/u/49/49/1768197600000/qNTwJxZ9O536crSpHpq20A/6AF9Ogey8Va6eu8S0pcyTAP5cpLXV1wNgO2LHD6rIvfr_TCqBkt1H-djaBcw-Nb5PP7irNDwsU56xsW69nGpim0DZGXfrabVnyFL4pWX_Eu2nRpCvj-VT7GTA9-D4o9YN_p9QBc-g60iDuPOK3p6sA/Mg1l2CqdQgV_aUsSctgQHrq6k2Z0U3ErUeAQKWwfXCA","width":512,"height":768},"full":{"url":"https://v5.airtableusercontent.com/v3/u/49/49/1768197600000/9yErwxzRCBZB3QbONEXMiQ/YXz8pAqtqjCnJgq5NB5hUpHzASmrKr3V9V1ZZ4P_blfv1uz7nBbxA6RvTDCvOdcNDwOhLXeOc9HJAR1woXMH4MVU0W0U6rJjM4ITqhRM1wmmGvNqQGDdIzetZkIkuYCMtfo3hCFPF-TX74DSbonLhA/Cev-5eonw_G71lOFvgDSsIbpZbVxi2zQbZUaONqO8ac","width":1706,"height":2560}}}],"Authors":"Django Wexler","Series":"Dark Lord Davi","Series Number":1,"Readings":["recyJxIxfLsraQVom"],"Date Added":"2024-06-15","Genres":["fantasy"],"Author Background":["by-men"],"Number of Pages":432},"Rating":4,"Read In Year":"2024","Page Count":[432]}],"stats":{"Author Background":{"by-men":17,"by-non-binary-authors":1,"by-lgbtq-author":3,"by-women":7},"Genres":{"fantasy":12,"nonfiction":8,"sci-fi":5}}}],["2023",{"readings":[{"Id":"Mon 01-02-2023 to Sun 01-22-2023","Started On":"2023-01-02","Finished On":"2023-01-22","Book":{"Title":"Kelso's Shrug Book","Cover":[{"id":"attQiacbpSkTPCXeO","width":318,"height":391,"url":"https://v5.airtableusercontent.com/v3/u/49/49/1768197600000/XnvdQ4ORMlzZm0HkfTnXRQ/2EDplplrqX5ZCdzM7dZV5zNj3ZECqza9mcMOcBhsFg7naZHr4dmJRIvWH4yPL43SHOJQdOqJ5x1bGVK3LJJiTWE7_ezOfFgAzpTDlv3dtsuNzb8Cj6JtkIMaDVeocePiNeEsWbvZ4id_gi42R1KYXA/z-fXdJAkDwhsvkTISmy22Us4yWF3VygvqlqZHWwV7KI","filename":"1088055.jpg","size":38129,"type":"image/jpeg","thumbnails":{"small":{"url":"https://v5.airtableusercontent.com/v3/u/49/49/1768197600000/ZMlLhyulYPXMLe8N4Hub9g/L3YsFgRJA3a9aeN3rLMEYMziCJPsFwc7CflwMSLq2nDshrk5PDkBbjJDz0qIVb5-_mnir40vTNQpwSBds7uy6ykl5uJpAqzC_-75L_yaSbRT8ZK-SmD7qqdYON64XTHr5e6QM-eo__drlXjkKAkaxA/cK97oIc1wt_sG0sgpLPmjdZ7MBqiJnyASrzPc0I3MgQ","width":29,"height":36},"large":{"url":"https://v5.airtableusercontent.com/v3/u/49/49/1768197600000/G6guOP7SEydMGiTD_PfT4g/POrmuq3rupVPj2uCgd61PWkXiF3UnZL21eEiObYf2npACqQKP9MdGQOaHLIbtlbDjymrqTJNnn3cYicZRoIzih525Gv4-mfxIgZeXowhpIHS3gaczlCo3WrPLmQ2QHjX_fiiG9B7P83Hf1w1xojFHQ/ly9lTy5lAOhPSHsOQAq-oWotynfiZezq4l1-Zk-KmBQ","width":318,"height":391},"full":{"url":"https://v5.airtableusercontent.com/v3/u/49/49/1768197600000/mEE956FWIb_qoiyGJO_xnw/T4aDHECP-iKdrhVH2Fb9CBwt73lP0ogcfd2nx_21AC5cowgDmUrOYroJYcCuMhm_XS-oM5968xDXHQSVJg3yqQExNXAveDyYibuM_jkZG70tIqGWsJUtcQQJlo9F9FMOloevRRDOD7xsQCPTGNyTFw/qegR6xk8gEbi0bq4PdxVb14Vuq4j42SRQwWILC_n0Ac","width":3000,"height":3000}}}],"Authors":"Paul Kelso","Recommended By":"reddit","Readings":["rec3Iv5JVtJtCgFux"],"Date Added":"2022-11-15","ISBN":"1587361167","ISBN13":"9781587361166","Genres":["fitness"],"Author Background":["by-men"],"Number of Pages":80},"Read In Year":"2023","Page Count":[80]},{"Id":"Thu 10-26-2023 to Mon 11-20-2023","Started On":"2023-10-26","Finished On":"2023-11-20","Book":{"Title":"The Aeronaut's Windlass","Cover":[{"id":"attl5KOOFTMZTW7gM","width":198,"height":300,"url":"https://v5.airtableusercontent.com/v3/u/49/49/1768197600000/PHqu_NdXpUCIAaxpUCk3Dg/vjErmZXodSZykk2zUlX7CCCFw4wRDsrBandditm3Vb4GXiowja2AzQDmTCTDaZatx9_TO-RV5zqFVEcEAY1b9qoeOwD0xfBLDmg4X80KtnnRqALRpGcEMnCB71bSNTN8WELY44rxuwZDEWT_qtRLhg/KLjpi3oiSFrMtnW-TyctvpMlVqulqw1q95iEA5jPD8w","filename":"24876258._SY300_.jpg","size":21615,"type":"image/jpeg","thumbnails":{"small":{"url":"https://v5.airtableusercontent.com/v3/u/49/49/1768197600000/91VKKrKGDqoCHLzlqob9Uw/z28m1DgbnVhznON-Wd1QEz5N7sW9V-RqakxeClsEalgM9jh0aqwYwax6VVgBR8KoMcFcaptlUTTki_ahVFu3w2vvjQEEU4G-saNpSqZ2yR03aYtT0bgA7U3cbkiMumqwVK4ZeEwtZLlDqqwRSeTeJw/Uz0At53XJ51nKrHEFYDpNYPOnDMzJ6d8KwOl4JMYrwU","width":24,"height":36},"large":{"url":"https://v5.airtableusercontent.com/v3/u/49/49/1768197600000/qLGlzf-Ap5h_obIDGJ5Ujg/hzrNgoVFLY3kslzz-8cRGf3pSCI46sDV708jGBduA0mLFwgcQpQNHFGomtucBnNrBK8feBgt_evIC8wHjF6ijp2jQaP-6rpWn9Z7ttIjmobd0SEFQN5AbhizOeWNjAoUi3XPfprl1ieZ7LUa1iiF7g/9AFkspLHDhQYY27xRvURARcbZVBC-1mJPzyPI468hGE","width":198,"height":300},"full":{"url":"https://v5.airtableusercontent.com/v3/u/49/49/1768197600000/-jJIB6fFGjOQGAVw2htdrg/wmMLI02OYOrI9oaN4iZT_RAIWxUj-c7HXJ2VqHbGQt6ENQoBfyst7YSx4GX9l9RJgXSUDiZhQfmlppWahA7AarCxUqYCx2CE_zvB7bhwBthwTscP4updtys7ZEW0YtNwc7ly0syfVKGItM75C2-2yw/HXrIIXf9X2IiW5WH5T7V1tdFRvo_NaWJ5N_FmdQxqsM","width":3000,"height":3000}}}],"Authors":"Jim Butcher","Series":"The Cinder Spires","Series Number":1,"Readings":["rechEvpRul59QCQtA","rec3x1xDPrljWQFNf"],"Date Added":"2020-01-19","ISBN":"0451466802","ISBN13":"9780451466808","Genres":["fantasy"],"Author Background":["by-men"],"Number of Pages":630},"Rating":4,"Read In Year":"2023","Page Count":[630]},{"Id":"Thu 08-24-2023 to Thu 08-31-2023","Started On":"2023-08-24","Finished On":"2023-08-31","Book":{"Title":"Rose/House","Cover":[{"id":"attH1EIYLbOqGVswP","width":1400,"height":2100,"url":"https://v5.airtableusercontent.com/v3/u/49/49/1768197600000/100Cg1AYil7NxM7_X1q61g/ioYT18tXf6DbliwoCjiRGYozEvtlYXU_RDE_M0y3LtIZAvIzphwCK7gRMyexh_drr8FnE8WHbhQj0idpImZ7kLt1nbr4YGszfPCcsJcNbILjNKrJGNv_QA_-3YuS7lu6aNKF2IMUdDGoX8yN0h3tGg/B96QnC8-SvN7ld3ivgsveFOVZex-W6eMAJpjMIK_Im0","filename":"136241569.jpg","size":360035,"type":"image/jpeg","thumbnails":{"small":{"url":"https://v5.airtableusercontent.com/v3/u/49/49/1768197600000/0leUTrlbogoGDrO1C6TTQA/atrVW0iWZF1icFa7-ZCsiCUvs-dn6P2IA-3ac7QzYZBVEwKaw4TDw302ENlZ9ed44lvVVhtRUvDvCV1-g4iWq_qIyCu-tahYE1ylRViV2z_CV3uuF29WdJhT4yCCRVIpnIJuBzTd-an7jWplf8c4Hw/7pfOy7v1n6hrh6O61iVjd_lgStMGr2rHuFbvY4r4A3M","width":24,"height":36},"large":{"url":"https://v5.airtableusercontent.com/v3/u/49/49/1768197600000/GP5l_wGeODLeMsnHeZll6w/_VK8wR0lyQjl87jfJgOCTeRQJtapz88wdWm6Q5hBBXL7DitSIWvTV085H3Vu1qQJj8-asmi_r7JPnKoIIB5A-SIVrEsNvRRfvnbrcnqmkWYrMeDyHn6rsBTXN9FHMHV0qdYJXTbErV1_3BwyQr6uWg/BbmT0CTz5MmdoqJU9VkI6Xk_mWPbLcvV7qSnARLtgR8","width":512,"height":768},"full":{"url":"https://v5.airtableusercontent.com/v3/u/49/49/1768197600000/2yDtmnKoogvMalLBmnCDCg/M5mwDwSA5o1WSG8erMq59VFJEjbtv8CiRSv0ZAU3qL93TBvJHgvA-vOZ2BiK2-7M44UYThdnbuS3POHJ4bczCHdTUCzXv50Q1YzbF59jgYcozCOyUCqFFuQuQ8NgyD5r9zV66nXaVhNHCiUoLGYx1Q/X_KfIj2rWmSvyPpTDqil6btpr39gtNSjXleUA-jesgY","width":3000,"height":3000}}}],"Authors":"Arkady Martine","Recommended By":"Transfer Orbit","Readings":["rec6mlzgDhfZZIFBc"],"Date Added":"2023-07-28","Genres":["sci-fi"],"Author Background":["by-women","by-lgbtq-author"],"Number of Pages":110},"Rating":3,"Read In Year":"2023","Page Count":[110]},{"Id":"Thu 02-23-2023 to Fri 03-10-2023","Started On":"2023-02-23","Finished On":"2023-03-10","Book":{"Title":"The Twenty-Six Words That Created the Internet","Cover":[{"id":"att0lLKByUYH6v9mH","width":313,"height":475,"url":"https://v5.airtableusercontent.com/v3/u/49/49/1768197600000/Z4GWhIisoSI0KyRAVJKCdw/bFoTMAkxU-UjFEUCUPQ3lu-It7OH8DEsFrgxsCCPeEbD1Fb2CaxYWdqhp3Q1W7z7hK1iTOHlSebBQ-3HDCwCaA_Fu-qB-RTpWajSAbQ7xlWKZ25Wm7LvvzxXQ-hZUqr6D-YUEpD2zwSxgEUzid8xAQ/3es895Uf5D9QIm8e9oLFAhQiGRmhwuSHWE1jYxxA-lQ","filename":"42366965._X0_.jpg","size":30316,"type":"image/jpeg","thumbnails":{"small":{"url":"https://v5.airtableusercontent.com/v3/u/49/49/1768197600000/JwkRw37z0BeTVDxNQhglpg/p46HzDxqRpgKe4ffGoekCFsWHt5n12ZGsg9Ai_nxHywpyAf_jK1rVlnGb6z4kki1-VXPLaT4ZuZUjgG7wI6FNkjm0o7ieitncLUe5o50FwVyCDi39YH2UkNO6uen1ayrRDRjlsPHAEzdq-J3k_8g5Q/Re6vbBqbKXlIARc412auHOZeWHkH6xK4MuhN9uzkyug","width":24,"height":36},"large":{"url":"https://v5.airtableusercontent.com/v3/u/49/49/1768197600000/5hkjTdODKKb_JPYXQWfqrA/JG0gXSWONn9uCuKTUBD3hmNQMzk6gryUyapjL5DK1UGatmjM2ofymYDlyuxy9OTiErDmBxDP-xNldlh26IncIwDMJv7smTnz4SSvDyo7NBKE2RjUq8gIg3Sow8N5BSyd3OM1hOwpDQwD0w12bSetpQ/eYlfLkfvcI8fmbZUT2kgCoZXQkSTI1tZhJBGe9vGgdk","width":313,"height":475},"full":{"url":"https://v5.airtableusercontent.com/v3/u/49/49/1768197600000/hci2YNc5bvrKRUTEcI62lw/cIH6jgnN6kyQsBKqzjXuRYthF7Lj38idptJ2IWNHDSs65dS3f6Zfh4_LnkvGhGz6ExJi0PfqYD4GOURZOzw2eMGnDBy8ZZHsnf2Qm50gqEM3gbkLH84WEEZZwNaXTqtvnkeZdWAPSj3S254PQxGvUQ/5wDtDz1qdIl8js70oTJBi46Ljope5l4CDmqpvl-CExo","width":3000,"height":3000}}}],"Authors":"Jeff Kosseff","Readings":["rec7uZUgpiQrVUNyG"],"Date Added":"2021-01-10","ISBN13":"9781501714412","Genres":["nonfiction"],"Author Background":["by-men"],"Number of Pages":328},"Rating":3,"Read In Year":"2023","Page Count":[328]},{"Id":"Sat 07-15-2023 to Mon 07-31-2023","Started On":"2023-07-15","Finished On":"2023-07-31","Book":{"Title":"Caliban's War","Cover":[{"id":"attAyxd3sPedVcpIS","width":188,"height":300,"url":"https://v5.airtableusercontent.com/v3/u/49/49/1768197600000/DR71wj2TA8G5-bPI9mMTBA/YnBkDNrIgIXo_yHzCJ8z-4sdvntxEu_-b-RqjvPHbVDdqzUFneX1UFsrSrwUk7bBTxGnJd8VTQLYkYKT4Fn1D9V1Pxta5S1A5Nz4QO4A_xc1qewDPBMgK54WdkyIl1FPr8cXm1Cz_lOl40QxmcHFNA/KMMbYriT0OIb3_SKfX7MZBn5EaBPy3g7FUQdeH4zvCc","filename":"12591698._SY300_.jpg","size":20865,"type":"image/jpeg","thumbnails":{"small":{"url":"https://v5.airtableusercontent.com/v3/u/49/49/1768197600000/r-2d0sWPiFPLb464V1bJ5Q/VVwAuwzFVqecpru9FvOnCBtYSdwyjGtMypYmJnQwVGiEpOo-ThwQJJ7X7IPfUB-DgZCWbqWmYUACAGUHISzTEvr_PDVNjnSmhVi42CaZt6ZCV3y8TmI-gLsBn0icKxelDL9xPEroyjNw1kEIN0Y65g/TEgK-Ts2l2q-FSjSfaBcQnvAdpYL2vkVHFtqgT5RJxc","width":23,"height":36},"large":{"url":"https://v5.airtableusercontent.com/v3/u/49/49/1768197600000/ZCElK44K79kaTNRROA-Elw/vUNdNVXQceIK7lFTr9qEaxc3KRE3076AcdXQTnqbWUotVkAAS7wBlibwi0t-KPQNh1qXtP7jJsgOmObAU_xag4fKfy4Wm7TI895LeKI8k5cej_tXgRozO3MnF390AJVkz_PrgMwlPSphW5L4umNG2w/eo18x76DAsFxDZuAXdLzmjm1SnF0pjFi4MRquIiaoJ8","width":188,"height":300},"full":{"url":"https://v5.airtableusercontent.com/v3/u/49/49/1768197600000/PL-KLEKdnp2bkMOWBhqsag/jahSC_7ddwdJp-ty71susy6omXO2Rmdiew9god41Od4aDEtSLmE1Wukv6n5Ui6nF2tjZ-hw7yO_2K_Pk0OrD4ckF5XA4rIdas54jU-cUYOk0zgqZm6nDSa1yZmWgVzgwvbIHHk4Ac-3l_Ml13ZzWAA/Jb8aDqVBUCC_fjlSuPkk9vMmN01AQM1a5R2x3fJJklY","width":3000,"height":3000}}}],"Authors":"James S.A. Corey","Series":"The Expanse","Series Number":2,"Readings":["rec61CdnObfbZ65H1","rec8nobiUkYSZdY8r"],"Date Added":"2020-01-19","ISBN":"1841499900","ISBN13":"9781841499901","Genres":["sci-fi"],"Author Background":["by-men"],"Number of Pages":595},"Rating":4,"Read In Year":"2023","Page Count":[595]},{"Id":"Wed 05-03-2023 to Wed 05-03-2023","Started On":"2023-05-03","Finished On":"2023-05-03","Book":{"Title":"Elements of Kotlin Coroutines","Cover":[{"id":"attj70rT29wYLrq11","width":137,"height":177,"url":"https://v5.airtableusercontent.com/v3/u/49/49/1768197600000/rv0NefR5SmEF_meeQl6Dhg/-KBRUxJhR_Mbos_5mx8UW11aFBIk45S6t4lsdObLrhXuPQXAc8Mel_JfgTDaHpsYSAds4skE2tfDde_Ytp9DUuUVws2bUrTkDiPorhFnAuoZ8AIAb8OycYR4xenDSuyQRt1x2gZfwCpHKjKwNRDoRQ/V7e8h-X2veo_zOshSheicosa6g0W1A-Rrs5ZXVZag7I","filename":"51171222.jpg","size":16068,"type":"image/jpeg","thumbnails":{"small":{"url":"https://v5.airtableusercontent.com/v3/u/49/49/1768197600000/W0X3WDmYym1NPzp32tw9fw/g3UmW7LIvtbuSA8FWFGpJqY0ZbbQigvM4W8qz0zmg-8I3CqpSb8-qUf7BmvrbT3ORZZqYajc7zSYuFpupQSbbUQ-jgF9HXioTDa4T-QbzTicIbj1kTJtG7UqGszwFkdODJrdlbmgtnnnCnj_5_piyA/tUI4kVRU2JqePcd7CKMmjCGl2YyrCpElJSJ76qdQEIQ","width":28,"height":36},"large":{"url":"https://v5.airtableusercontent.com/v3/u/49/49/1768197600000/ECkHiMYCvgJeBzYTsQytaQ/lX0zXlVLQF7S2Sq8Qjl6_5GnIc2GX8gEDYNtNixBGHFsjMLF6E56kdLhcLGERJSUQO3Jv-buAyLouZuAuwusVHGNq-lDI6522xok5zhsgafiSSdwIOKNJDOMNnUo7TahB2Nzg_gMXrVNx6gP-5FJfg/GyUxOr98pgfKFDNeFKI2lDECMgQ8nS_Qfmqox4rNQzo","width":137,"height":177},"full":{"url":"https://v5.airtableusercontent.com/v3/u/49/49/1768197600000/ur0DVleYhZFNB66G174cRA/Kjq-WNHXTNmmt9FzUVuph-iOLV5yG3T8tzy85cEck6suTj-_UjQ39kdw_mguI8peKnnTRFTCu2bJnH9SM-0vMaaCsnrhYQfm2kCrnACsevbvQwA-NKRWANWYgZtXLE_jZ8Ug5FHpOQVJX4Ez0PzNTw/-FRGkZLGjdAU7kil8IDWC3SYszE5BQvaPsir0noJsIM","width":3000,"height":3000}}}],"Authors":"Mark L. Murphy","Readings":["rec9VlgaJgc7Js2n4"],"Date Added":"2023-05-03","Genres":["tech"],"Author Background":["by-men"],"Number of Pages":155},"Rating":4,"Read In Year":"2023","Page Count":[155]},{"Id":"Sun 02-12-2023 to Thu 02-23-2023","Started On":"2023-02-12","Finished On":"2023-02-23","Book":{"Title":"Children of Memory","Cover":[{"id":"attiR4i3Dib2JuOnY","width":1843,"height":2835,"url":"https://v5.airtableusercontent.com/v3/u/49/49/1768197600000/IJTY9IBk-Qvgolzp5jmsUg/ILr3ngTCL_pQaFEu6VFYULU1m9ueQERyrrazUMOIWY7TjKgj73z9J7dN0aJx-45uV-9paHGs5ZIotw6SJaIoN65oDWuRMPdfZKZewnRvzoPOtJ4c1L8R4aiVWFsYNWJF9V6bucpJcopDEe5Y5kqe2A/bpPZMKiJqb1TIBXzxHKbF2y6-ExWvHnQhEI1SOJRw3w","filename":"61304925._X0_.jpg","size":1489249,"type":"image/jpeg","thumbnails":{"small":{"url":"https://v5.airtableusercontent.com/v3/u/49/49/1768197600000/uBXMAEw4jn8o1naJGIPVXg/qAlBi8euOlxHVFCb_mQH_XBkB4ehJtRnOZEDaQ71vMxUPeQiZkcKD8qdxaYYLSrKW4VNx093PMarlmJlg5jXD4239qcDEsRhqfzqFvuOfzqq9xNrAEBI2Y4_MOJnpAGJ1kz0AkbZIVU8vSTDHHRmbg/CDL1rmbgTDs-S6EfqxK5tnQ79k4cJgEbxA15mpihk1c","width":23,"height":36},"large":{"url":"https://v5.airtableusercontent.com/v3/u/49/49/1768197600000/_iZr3G3HWJBdipV42ePTsA/pXdc0YNhAzN4sMecyRLO36HXRj0EYxuwwp0Gy1Gr-N4BvqJ61FvSpn8j86a165Beot4YR3nM48EiKflqGhYLtnqzLogJAw0A7sBQPHlZVvKRFDBroVZCl7v9tJZ2Wg7luJV_DuQJ4dSuB5hyqZRAgQ/brC8Sz-0jBoiXle8GbW9_fBg9aZc-fAOWVj7Q-yp6rs","width":512,"height":788},"full":{"url":"https://v5.airtableusercontent.com/v3/u/49/49/1768197600000/U5te0ifRqb0rXMLtjldoKQ/srZ4l34kyHB687dpSykSq74ivk5cHRFe-IwvZZw9H1-PLXjW4YMThvbDlpJZokFjMDP-Dj_0y7FUsuTBpNIchF_C6InThgo0cN_1GVWuUn_Q5Vu1TADxK4u2SiqyFyCRMyEjSutniyOYVN0c95N1zA/Y6w1q_VGVLPCotTY125Ua4QqeoQMdAvCGhW20gXkB50","width":3000,"height":3000}}}],"Authors":"Adrian Tchaikovsky","Series":"Children of Time","Series Number":3,"Readings":["recB4zerJl7poge5E"],"Date Added":"2023-01-01","ISBN13":"9781529087178","Genres":["sci-fi"],"Author Background":["by-men"],"Number of Pages":480},"Rating":4,"Read In Year":"2023","Page Count":[480]},{"Id":"Fri 06-02-2023 to Fri 06-02-2023","Started On":"2023-06-02","Finished On":"2023-06-02","Book":{"Title":"Knee Ability Zero","Cover":[{"id":"attKH3t4zPxm4ieh9","width":1000,"height":1500,"url":"https://v5.airtableusercontent.com/v3/u/49/49/1768197600000/NrOP5ILghPg6h_FcHk1o3w/qF0v55dFEAWyvE29uL6nQ2-KKMYLMJYYeQ4PdNmUAIHSVwxdAcfugzr_O0-OKAtk87_HRzqOi5OYQGZQBjWDfOrVB6aES7ZjLWy6_tZwndsxV7yUAFn5OLdkh3C6hqMvafZiIBpydNmGk3H41BL9ww/R4cmwrdkaOn0KWEZVGHzVaTrPVCjrkqJhjVnRvI5Cb8","filename":"59563188.jpg","size":106887,"type":"image/jpeg","thumbnails":{"small":{"url":"https://v5.airtableusercontent.com/v3/u/49/49/1768197600000/R25Q5pAeNgqgQlKYQG1iYg/K4tKgmrV74eJQKtVE2Uw7XI_dk5tbf4RgOarAH1bgTzvbM-BmuBrgRLmk0rD98Qc-WzQE83jFwYVUGPrUscrLY0BJbeuCVqrAsR-p_YwbWdG__bBEo10zgkyWX0CoTP5lBavxDnknrQJtY7D0MvzOw/k51rLiGrbZAfYqZHhYTEzslprTQZzRWpb3yZoBW2CaY","width":24,"height":36},"large":{"url":"https://v5.airtableusercontent.com/v3/u/49/49/1768197600000/vIUrMAGNOl0Lt1LdkVb-zQ/PE6KpJy_BWYe7XC_n9n6v5K3v5OCx22yy_e9JbHRakeoLX6bCvJ6xCoTRH7x42XnMRAt_P9nPgJixejSOkDB6LVsK9dbMr7-G5rGerJ93YKKS9etxhuVOKF-mzu9ft4DzANUXXXAsPIhopX89XsaIg/LT3p218H8PAeV4XN1ykZMSrSuQXERei00ZsE6CcbeBU","width":512,"height":768},"full":{"url":"https://v5.airtableusercontent.com/v3/u/49/49/1768197600000/QljY_gWZTMIKWgK_EvARjw/Ieakn57v78YHsSxFoYy7Mq6IsvwQHUpi697lYIS9BagmHzfmO6vGnUifCJi8P7a8-BqFKZaYs02OwcHBkdIZLuVKE7TESySv5RIOXXAHzLDsCm1NUYDudtZ7DBz45gHv60_II29YVKKCLsyMMqlTBw/2TsQyNPjD3K4BD-yYscQ6GKDt-Lg_jGmhFcAsRBBP0o","width":3000,"height":3000}}}],"Authors":"Ben Patrick","Readings":["recGuC0ONWPZvIIx6"],"Date Added":"2023-05-27","Genres":["fitness"],"Author Background":["by-men"],"Number of Pages":98},"Read In Year":"2023","Page Count":[98]},{"Id":"Fri 05-05-2023 to Sat 05-27-2023","Started On":"2023-05-05","Finished On":"2023-05-27","Book":{"Title":"Lords of Uncreation","Cover":[{"id":"attLqs5MYEgxHpRvH","width":1664,"height":2560,"url":"https://v5.airtableusercontent.com/v3/u/49/49/1768197600000/Iwlbnu9V5zv5FhsLS18TvA/vCKLYh_rH6OkOl_SKosAU3kaHyjHEqvW-O5cwYwc4hiwmdzpfLUTPA67NCxOjA4F-5P_A81BWahhCJIcYlprMAhJYkqXcO3fYTh6iRFhG84s3xPgT07l8mn6tN7rwMKf7KQsMpNOAJQPUSq_XNNrAA/K-Hs2c7XI-WWwSQmqisrkIh1J5DlXVpfT7daUTaC5bE","filename":"62315578._X0_.jpg","size":3273880,"type":"image/jpeg","thumbnails":{"small":{"url":"https://v5.airtableusercontent.com/v3/u/49/49/1768197600000/WAjYMe3NVF6b3TXYLLGhZg/OOg1IJN_nsiCRuiiUbJK-ZwefqyHu3372MxXiIBOhVB8RKQF39vlnPdWvfHV0FtbQP1L3uMQ1aStUioRDpHUK9IX9cOcz7qxoSVb287Ilts-8sp9Y1WYqXvj_bQ0rd6iihtAJDCqe-WL1cTfvHyP0Q/x0esfqK6CcADTEyKgNd_CQEqdcU3o1ZZJqZzdhEkyEI","width":23,"height":36},"large":{"url":"https://v5.airtableusercontent.com/v3/u/49/49/1768197600000/K1sJ8O1s4sTlfmZ4_6-OdQ/MILZoMzjxUHIp7feMQdtn3j9VQMoLl5BoeW6p0DQsIWohNGzheB627gl_PBRYom4RW-5nRjk77l0WrHeByZ_Y1h-h77NKj7x0S1uVoUPIckTMXZHR9IjANI4EX78XioDdmo0I-TwuMdm3S1qdLiG2A/WSFMAWdVDVVZHLUUkRaOGKme7_fldZnbLM87k_swEfA","width":512,"height":788},"full":{"url":"https://v5.airtableusercontent.com/v3/u/49/49/1768197600000/FgZp3k4Cg3hfaX8X--S5vg/EgIk-xczxf_ekLOKAjAjLa7WtD74NGrGe_o0PlV-0yApt4_fxHmfJrIDKjMfaXr0_YHpvg48EWPIF7lcMQpezX53KGQz5vB1lk7G9Gjd-If0zOAnD6KAXIq0LBZpHjd_k2S0ebLYxO1uqhLzwgKBkA/4XlHQ2mrpvGo9URbWYOIfb6_FcNn6_cvqrcWM6HTpWs","width":3000,"height":3000}}}],"Authors":"Adrian Tchaikovsky","Series":"The Final Architecture","Series Number":3,"Readings":["recHREs2cRsZYj4ij"],"Date Added":"2023-01-01","ISBN13":"9781668628102","Genres":["sci-fi"],"Author Background":["by-men"],"Number of Pages":613},"Rating":5,"Read In Year":"2023","Page Count":[613]},{"Id":"Sun 04-16-2023 to Sun 05-14-2023","Started On":"2023-04-16","Finished On":"2023-05-14","Book":{"Title":"God, Human, Animal, Machine: Technology, Metaphor, and the Search for Meaning","Cover":[{"id":"att6WN8Cy3aZVwHgF","width":1678,"height":2560,"url":"https://v5.airtableusercontent.com/v3/u/49/49/1768197600000/Lr_A4THf0GfqwePT8uyRrg/ZVWulFNSPn_povaKeiikusf0pUCDizm9dNtI7kHShwWZVgTBvwunxCLLER0Hv9gCR3bnTYX9bxiSBcbtN8Gzd5Bcxwik8XK1bJ_Ir-sqi7faR1-VThwpp_Znowh-tSDTRlCwgUy8E2OHJCpjrw-75A/MRhVbygoIPNFI9JKFc17nTr1cFqQaUEbBkOLHFUP-Vs","filename":"58790242.jpeg","size":344247,"type":"image/jpeg","thumbnails":{"small":{"url":"https://v5.airtableusercontent.com/v3/u/49/49/1768197600000/W_kHettVWWzC4YhFhozChQ/PJZhLfGYZGL2g6P1KJeoVVDX_P5EPBNUNEa2Yjg0djwA5KVVbfv1ubAMRo_-yILTIxCCpIdgGkBd1FIxpNeGFS2rvU1ux5wqxTemX7aDpRtaWvcMYQAV3TGV38aB55EKi_JIT9WdU-P3D3zp8ogfmQ/4WC-b3Bn4rQU3N2pb6k_sT-2keWSKzjioGkh-SIoe5E","width":24,"height":36},"large":{"url":"https://v5.airtableusercontent.com/v3/u/49/49/1768197600000/59QeUVygx1NKsjSIhKoBUg/8CkrjGKrlfUiSigxDY-Ug_eo7t7CLXH_gQoBPoFgc5jv7x5NC-ZFdOW5Gy_vK64rMqPmzjAOq36sXBz6ZETMw-x9vmiZbCPX0Aylivey-cyFVTHf59Cxk0MBRpRv0_DQVKi_3wV085CzlBrSbBL6YA/e1pFyVvFn0jxoRLNguF9uD5tWLpACTxi3b3GUB15hwE","width":512,"height":781},"full":{"url":"https://v5.airtableusercontent.com/v3/u/49/49/1768197600000/k1Ph4Ui5Myvxxt_2YfrVkw/EW4N0pr3oFscNVKSOQkGLNuSLt1BzHql4Z7523nzMIK1bdxDyNkLOOeE68dOEZbFjvw2epo1SRjJJaDI971CYjqOAP7neVw6SnZrtRuKRi7RJ7jJGbA3ZsCG0RPM9TJa4aCbeN3HgcesykroGnaDIA/i46ZFLdXYt9msF-sd0nKzyID1fRi9dkpcGm9oJRSMYg","width":3000,"height":3000}}}],"Authors":"Meghan O'Gieblyn","Recommended By":"Ezra Klein","Readings":["recJRiC7bbqsj558f"],"Date Added":"2023-03-19","Genres":["tech"],"Author Background":["by-women"],"Number of Pages":273},"Rating":4,"Read In Year":"2023","Page Count":[273]},{"Id":"Fri 03-10-2023 to Sun 03-26-2023","Started On":"2023-03-10","Finished On":"2023-03-26","Book":{"Title":"Full Fathom Five","Cover":[{"id":"att7pLg81F05wjVsG","width":300,"height":448,"url":"https://v5.airtableusercontent.com/v3/u/49/49/1768197600000/N2Rkzdpk2U7tsHH-lKQNhw/edD9BrKSsqN2x_o7r27XMpChWBI4r2CpaufG9pKqYvmh24y2aQSO3aoHq0Oh3GvFLR-cJkJdgTgK27Td7HBEqGM_BueKiub7yeCGYN8AD-ohXST861Wsrqn9GHqIB8dRoYdHhFNRExQ1plXoyMGs3w/dXoY3S87M2YuYCrjy_fmbUORJ7iQuscs2_BCzcftRNE","filename":"16148208._SX300_.jpg","size":28533,"type":"image/jpeg","thumbnails":{"small":{"url":"https://v5.airtableusercontent.com/v3/u/49/49/1768197600000/f8R-gOteOJ-c2cS-pjT2Sw/32tOfcgbssCFHFM9aK1BbB2RxJkSizyOSmrx7ztWUhtqQZrytnn4ra24SZLc3QRP80qDg2KI7QiCTUf0ZwzgAcJ58WGy-ehY7sqU2WFAGHca_9J5EQDsTZ11VRAFWzxy6-6YMW3pWJOgUDvW6QjhYg/tBYZc5_Vgypp3gzErI8eo8ByBOFo8wN7aI_YHvdwi-M","width":24,"height":36},"large":{"url":"https://v5.airtableusercontent.com/v3/u/49/49/1768197600000/Dk3ScsT5AqQqRLGeB-w4LA/ohni0PemJlgvazmjIQRgPxdXDUl9_XFHEkeMqHhLXyLbPhv8e7P8YXYtQv_8mvxxd3PpdgzC54hEwvWRAQKHmGt4-0dCl7tOITP_5EW-UF0EwefTEqPZazhxjmbAvSQaSEKltq4-kvNVvyppnc1PAg/aPH8-eCSBZ_FB5h8vaIGWiybmOLfWMvvs8Igh-ccJQE","width":300,"height":448},"full":{"url":"https://v5.airtableusercontent.com/v3/u/49/49/1768197600000/u9n98Q9WQUui2umx1koPuQ/Velx3VdlhrMXll23ezyfTIt7PsShq9U-zXLmmFN1kKuAD0wB24I9FiOmMkV_6VodZSdQF51AIpadBtHRxdthHBBH2eGS2smb8T8ij_Sn2dbSTE0qz1yNaHdcqHvLoo-uZlA2apxuBGtXtW28ojZu9A/0Ar9SUuP55DeEGztz3_r0HCl1b3jfZV0PxmyjlRxj3Q","width":3000,"height":3000}}}],"Authors":"Max Gladstone","Series":"Craft Sequence","Series Number":3,"Readings":["recOGfRAqIhVBhvjU"],"Date Added":"2020-01-19","ISBN":"0765335743","ISBN13":"9780765335746","Genres":["fantasy"],"Author Background":["by-men"],"Number of Pages":382},"Rating":4,"Read In Year":"2023","Page Count":[382]},{"Id":"Tue 08-01-2023 to Wed 08-23-2023","Started On":"2023-08-01","Finished On":"2023-08-23","Book":{"Title":"Four Roads Cross","Cover":[{"id":"attlex33iLYfuEeGz","width":740,"height":1106,"url":"https://v5.airtableusercontent.com/v3/u/49/49/1768197600000/P3BGznEjzUETNVwaKZ0pmg/P-Lngw24W78hx5UgWd3TyWgRB0FhvO8wBubU_cZV0pKL59DsLxi-n3IguMeGy_OQQFPJ_1rsPhlPKcqQ499oCpB883HYHJOrzabn634HnBbVrpDwtSwxeQyKXSw-Cah2hi3DdnQVi_tRzkCyAWHPRQ/ftR1l8vNIsy1jpvfo4XS4J7hAN7Jh56AlwPM9LjFMyU","filename":"26114222.jpg","size":203658,"type":"image/jpeg","thumbnails":{"small":{"url":"https://v5.airtableusercontent.com/v3/u/49/49/1768197600000/RMJO0I-y-_j8DQaSwFTzyw/3iRUiwcfrj8cCcXzvu_uonDMZlRBMwlTtDgFuZJPdO9wx2TbsyAYTyb74tNrQP81NyuYhvYsy-iKmc7pY5tH12Xoe-RkqMfmbN0SirlWUpWQxyu66UPJF5NXuMT9nJB66PH2KcPFyzgkMaZ2H1uhOg/mxEPMr22-1kcOS-pCq_LuTj7MENbmhIttO2cKP7EClU","width":24,"height":36},"large":{"url":"https://v5.airtableusercontent.com/v3/u/49/49/1768197600000/3pNs3kH5xrEur33i2qnW9Q/hZXrp0N6JeB0KhpC3zWxi34LZvmk0iqp4O_2nrFcmIKxiw973TWF2Tl3-Ub4LyVWt7Qednk2jowKkFexapVIzzV3KBrqrIQWgi9ma3Nq8M6VCUbWlxQWXPC08Kwh7d8WIzrruwbY8Rj2z3ZO_JMMUg/1mF0ka7YwxezGjj1e7ohMWU6miNm3jp0ZKBDg7ro74Q","width":512,"height":765},"full":{"url":"https://v5.airtableusercontent.com/v3/u/49/49/1768197600000/4rDbrci-MU3azd_B2FCWdg/V__JxRdKfS2-ktryj42xQ8xiuWSrsm8VfcGIXk_5uO_wt1BGykhEioEe_UFTvLM8nJiYsZ_GxJA7hnSlDWC4Ks2h5BysfJP1bBr72Atb3rqlox90yTQM496ws709-2EZymdyYUMy9fOan-tuTKtc-g/VVGm1JRQuqhLG1TWgnIuud4aVxg0y1dVBeZnVSvsleg","width":3000,"height":3000}}}],"Authors":"Max Gladstone","Series":"Craft Sequence","Series Number":5,"Readings":["recTOAI8cAfdkaT9y"],"Date Added":"2023-06-20","Genres":["fantasy"],"Author Background":["by-men"],"Number of Pages":416},"Rating":4,"Read In Year":"2023","Page Count":[416]},{"Id":"Mon 01-23-2023 to Sat 02-04-2023","Started On":"2023-01-23","Finished On":"2023-02-04","Book":{"Title":"Artifact Space","Cover":[{"id":"attS7PlJR0gQLVNXt","width":649,"height":1000,"url":"https://v5.airtableusercontent.com/v3/u/49/49/1768197600000/9FvlqsY6FvkIJIarYytjIw/a1s5pNqqnf3q6EBBjdgKZKKvo8clsbC0kJLPG3z78UZ-Srl5bu6T-mgXwBQiPtAFC2CC5drHSF1S18eUsUtW5eB6o2ppe-yNzCuW4H4LbJtDrI_-viImAUuM0vlZu4G-Pthc_YSikdY9LxNRiSdeFQ/Y4hR62yEot3BqGzdW1y6wez9r6sXprrmaAdABwd5vO0","filename":"58518946._X0_.jpg","size":80282,"type":"image/jpeg","thumbnails":{"small":{"url":"https://v5.airtableusercontent.com/v3/u/49/49/1768197600000/7otBrIOJS4byxAjWsFxx1g/81IYJaF2fSvW4-tQuNwefgLYk1kXQc5W4ShP6pWUN22RP-iqqcJpfhXxCgPk7wV9p32YAIXmzt0mB1G57lRZ-SzKXKOtc_s6jXzciKbnuHWpiaFPM4_1x1uOT47PwveU-pMH6RiLA9NnBJmJNrmhIw/Rw9pUK0zqzDry1aS0x4q9FFpQboWO5pgAc3rAXbGiYw","width":23,"height":36},"large":{"url":"https://v5.airtableusercontent.com/v3/u/49/49/1768197600000/9T4Z5rF6UjZ9Kn4e-kQNeQ/hsTUpniCP57XWrajqG3wfNVGrtD1hGuiP87Gub97a0PnJpsyOfBx7aS71FL56sqdQK6WFpCdBchqwRXU2npNf7Je3R7DIhQZFXtFXz-v3f721zb1nNsm2jMEySdnP5ZrIOhYsGq8cahRZFttleUR6w/9_TEgp-OVHWZpE-vsDif6VtALmDDy-swbw8wZOqKsao","width":512,"height":789},"full":{"url":"https://v5.airtableusercontent.com/v3/u/49/49/1768197600000/qHcBWHQT75QkrEIFyvkafw/SRjOM59lQx43WqoZ4NrVA2_zfJsyu3Ju9pyRXWlgXXuLj5h_PkAYglEERX_GtDSu1ewhxnPCESD7X7tUF1RVq538UIMImMRf_SvkmbJqRWcTMmuGEUP-jdHe12CVD03oIrUiQPiVM1FIBTgCxm7Wnw/3ngzukX8S0sd0L9JKOJVrfTGjikvs8MeBqHnXaYe6tw","width":3000,"height":3000}}}],"Authors":"Miles  Cameron","Series":"Arcana Imperii","Series Number":1,"Recommended By":"Reddit","Readings":["recWUhGz8lRYEQyii"],"Date Added":"2022-11-11","ISBN13":"9781473232600","Genres":["sci-fi"],"Author Background":["by-men"],"Number of Pages":576},"Rating":5,"Read In Year":"2023","Page Count":[576]},{"Id":"Fri 11-24-2023 to Sun 12-24-2023","Started On":"2023-11-24","Finished On":"2023-12-24","Book":{"Title":"The Doors of Eden","Cover":[{"id":"attjFHTTVSQ8LwOKX","width":1664,"height":2560,"url":"https://v5.airtableusercontent.com/v3/u/49/49/1768197600000/MPMNiVS6sxp9TThUI8Y4tw/3-IQ5OH6klsfKtgQM8RfP2iEKJzufY0WSUEp8e_bcJkgSmzTCU2RRZUSrBBYcGtDg0U5j5fGq3SZF9ybGwswRNxcWtEYmrgNEyT6q-uvXvo6Jwb4hRStgYQBbL1Ah1tfBZHunZ2c6D7fl0e1XcCBXw/TivfNxjAsBtExJhBPFJItJH2VXldkLA_In3FXzo0ywc","filename":"48767565._X0_.jpg","size":1073980,"type":"image/jpeg","thumbnails":{"small":{"url":"https://v5.airtableusercontent.com/v3/u/49/49/1768197600000/HLmMcB3MrhvR58gQeP6Vow/MY-2zQ1-YbH136TGwjTlu-kbx-2vkZ0_Peon_Q6-HZ7zPkgXjqMKtN_73voedWU_3zTOVKneDsixDkI9lQQuIO-mZ9X46PCUHwy6pnPM3kSI7Gk6MUrI36vAwFtcYbyyEXYHoFCtKCekG_LLy0yM4w/FsbVVTLH9tRCcFIW4fQ-a9TJDpowVxZeaz6gu359pl0","width":23,"height":36},"large":{"url":"https://v5.airtableusercontent.com/v3/u/49/49/1768197600000/nbqTldkcMWgQduRYSfNh1g/1jiRzJDEzAuwp3NVBIXJ2xBbVloPOjGOewhNEQ89baHd54xTuVETMH_6ySRQfrKPXBTy8Sky-UsxgSjTdPJcjZtrdoG_0P3qJ0lAD4lzauVXNkiEbLEkpHiXW27NY26pXi7qIC7tHZtIA5hLI3Ca9A/Os7KJJRiiQHvNlgfgMcFCPqnybmMsT-fHyWOt5y-Nfo","width":512,"height":788},"full":{"url":"https://v5.airtableusercontent.com/v3/u/49/49/1768197600000/U76CaaOfn4FAabytFiURRg/XhSr_3D00BWPf3PCTCkeHei_f40SJXIq2Y_b03A210ZOD3E5H_cV1j4Ur_P9kzIwtyFAeHkA-B05eww63_tOStizzX8feRonncdhe_6gyZPvwtjaZJ8Z24Km-9K3TB3Z50afR3IIXykArjs3ByNz0g/y0xJ8ZZO-mJg4sMsTrQQ41HfrL8uRBOGV9Ezu9JFHlc","width":3000,"height":3000}}}],"Authors":"Adrian Tchaikovsky","Readings":["recZylryxXmSVwmU8"],"Date Added":"2021-07-30","ISBN13":"9781509865888","Genres":["sci-fi"],"Author Background":["by-men"],"Number of Pages":608},"Rating":5,"Read In Year":"2023","Page Count":[608]},{"Id":"Fri 12-30-2022 to Mon 01-02-2023","Started On":"2022-12-30","Finished On":"2023-01-02","Book":{"Title":"Rosemary and Rue","Cover":[{"id":"attrG4SFQZa0u38gs","width":295,"height":475,"url":"https://v5.airtableusercontent.com/v3/u/49/49/1768197600000/51BJNR8_mncBB-Eobs9cuQ/UJQu7zDuhL8uWaeP9vRPJkjEy9_JYV0hoHjiX2ROvJpHPB59sd1iJXaIZ3S6or3bw273xYzx3SLEAPeExuXwb2pdsmAqKOvlAr1kT6Cn2IK4EErPGfTf6DZjXTZz282ggJo17pFIKbpeMcnV-G9THQ/B0Muzt05NWMExnQYuvyZRYauNqhtcslq90zKU__Ckqs","filename":"6294549.jpg","size":40439,"type":"image/jpeg","thumbnails":{"small":{"url":"https://v5.airtableusercontent.com/v3/u/49/49/1768197600000/P5CfqxzG1mjtUF5eHuS7qg/O3BRjy7Le2lg7uqUEg6vLaotpSGf2V-MaasKuXBm88Wa_ZpHXwqhewCmJ3TSVPUKNIhEMFbrEb8DmVfhPJkly3VTfXWE-wSXBcgRxE2fnCHY8zmt7NnkyWmY85Rw9JG7Z2dvT22owJ3damh3i1CGAQ/rLt4f9kPgnlaaJLqWkXXqHvOb_UDiGZv0mW38V2rptQ","width":22,"height":36},"large":{"url":"https://v5.airtableusercontent.com/v3/u/49/49/1768197600000/ernT-IykVnJ0YMLcCWawow/JzWrWvK5fca2AbQBJzH7LVxACWmKsa5yeehwJy8DeoN4aGhMd_iCx-e7Y0IK0XomS746BZaA6JNLV2b15V_zIQVa271LlSzJL2C-ja-e9k94Z7jwLQsRmTXbPQfnKjZI0cPhr2GSJvqsu2AgzuPviQ/KacCYmX9meoENdFc-Tit0xGM3PBRxS3pIuUYlLUg56A","width":295,"height":475},"full":{"url":"https://v5.airtableusercontent.com/v3/u/49/49/1768197600000/T4tix4r5dslqNy-F3JtROQ/z-pb26Scl5Vkbyq0Axf7JdSXHCb6rihjV9e0NGrXv_57tHQbMJfCZpoFMaToxnMEZHR0G2rMmBdCjvER_qzAMaAmnF0zyk101pro_-SyXLHnbG4JZGmj-xfBL8jxGvHaeXIjmU3MTL1UrH7hHcRwFQ/7YkWFWUEoSOtQtJmc24AnfenRCM2nuNFaw29YRvUcak","width":3000,"height":3000}}}],"Authors":"Seanan McGuire","Series":"October Daye","Series Number":1,"Readings":["recahnR4vAShDsbjl"],"Date Added":"2022-12-31","ISBN13":"9780756405717","Genres":["fantasy"],"Author Background":["by-women","by-lgbtq-author"],"Number of Pages":346},"Rating":3,"Read In Year":"2023","Page Count":[346]},{"Id":"Sat 05-27-2023 to Tue 06-20-2023","Started On":"2023-05-27","Finished On":"2023-06-20","Book":{"Title":"Last First Snow","Cover":[{"id":"attnuA51VQmyrw0rc","width":317,"height":475,"url":"https://v5.airtableusercontent.com/v3/u/49/49/1768197600000/13o43Dgnrqo6RLWEABNBKQ/7S4YJzA2GoCU6ZGQ_r8s4impdS2iDZ9gVkwD_gIngDwWK5Aau4BSnTJvNh7_sleiSBhI-pg8HN7j08Su9P7hvQt5oz9d8uRs3i7I6ogEqrLsa7OwiU7clH-vPWhGbe5VCsrfDR1kfRE2jQt6X3oIBg/8qYn3MZC0iUi1GAFtxzZMI4qKcgE8u8pMtyaUG22b5M","filename":"23168830.jpg","size":114987,"type":"image/jpeg","thumbnails":{"small":{"url":"https://v5.airtableusercontent.com/v3/u/49/49/1768197600000/ibHn__2kk9LdpT2aGHE7DA/buwx9jptYFf5aUqTB4UCYOCnk88TPTlFDig-QU1gdwIjWpEwfPrdLUy9DPwKIa-CT79ypVqj2QaTq_NAMrxMjlY_opM_uIE51IlaU-HgElfeXMX0-8tyrKMm32gIm3Gyq1NlHVpnPKN44UYP1vfSuA/eoyqb5Y0CQm1u5yBXlkwnWYv_1yaOhBtwKdwPfn-sWo","width":24,"height":36},"large":{"url":"https://v5.airtableusercontent.com/v3/u/49/49/1768197600000/lzfL9GtL_eGNMnfK1dWaOQ/UBClo5nv2c3Xtuw-5Gt-eeY8dVmzSaiKXgbm7fh7kjZn6oChBb1T9MXoRjBbFLrDkgPjzVU-uxNmUVgxJcQSWoJly7zgaJompa8qpgfhnQwbw3PAEsNCav_YCi1tvEwNMyCj30eSGp67F7YkV1symA/3kFG_n-MtM7Zm3Iw_PJRw7pa--kqgBOAYlb6vGS7saU","width":317,"height":475},"full":{"url":"https://v5.airtableusercontent.com/v3/u/49/49/1768197600000/c3KjIet7ha1vAXDW1oIrIw/2i98rKTdKE-16_wISOr-s-BfaT0sxcWuFSAkPfFD54tD-foBJnYtQZd-aFseSrhsguLNaUN3dCrbalmSY-5EtnCpzgNONtX7-_yypbTY2Mwk8c94X75p6BxvJuu7cGQOaafiJcTFoMJvzVOcPrt2fg/Ll67-bi5CNAsoOqEnE1WJ-OnTNlmUeJYEHGQc8oOZ3I","width":3000,"height":3000}}}],"Authors":"Max Gladstone","Series":"Craft Sequence","Series Number":4,"Readings":["recbruzEv04Ah2AOk"],"Date Added":"2023-05-28","Genres":["fantasy"],"Author Background":["by-men"],"Number of Pages":384},"Rating":4,"Read In Year":"2023","Page Count":[384]},{"Id":"Sun 04-16-2023 to Thu 05-04-2023","Started On":"2023-04-16","Finished On":"2023-05-04","Book":{"Title":"The Nine","Cover":[{"id":"attxBdrOHvafbF7db","width":300,"height":444,"url":"https://v5.airtableusercontent.com/v3/u/49/49/1768197600000/CJDgj7VoroM2IMGBhe1ODg/Q15AFcUGwhZfkFf0vsKbtaADNBBZ0R25RUUkFfzeVFL4zGA55zoUW2Krq7Vh1ukGToagP919R0tliS-9KPQfI3j5WEnRHErg-W4-qRKuAkcNrrVTDsLja8xlrDsy6DHBXokHc9xLxo5LtqJ4vGyYUA/M_sarVA8XUm2c94f39426I9_jme95vUwMEkhcNy6eOw","filename":"34437448._SX300_.jpg","size":26667,"type":"image/jpeg","thumbnails":{"small":{"url":"https://v5.airtableusercontent.com/v3/u/49/49/1768197600000/HA0K_MJ8KE6RourM40funA/uC5sz1NK23QkXpzw4nRe3tFL7-2mxNXlnLm84E-IWpr35MLvBj9bMwRQSdRGCXbBMNhdC3H5nfQPQF5X5TZQMMOsybur9MUoy0e-ASRQru9zifruEXP29JoyC5mrjg16uKXHSBcjyvoCI9pLJzRMYQ/U4BCFTe2pRBv9nLF-qlvI84zu0NrlkvtZAP47iNkHzM","width":24,"height":36},"large":{"url":"https://v5.airtableusercontent.com/v3/u/49/49/1768197600000/mlSaRPmIfr0G2xx3kDI9iA/ZzNczJ4OY4nGr45h5tz2MjF8JNaML0Y6hCklwiwp8zMz3Kf7aUH3V98koYVieayM6cb2uHf15cs-3q0G-dlXHi4iEp_Zt39fJoy6YP_u0j4Q0MByQIKM9LO2vfTDt9LkyrQU6mrECjft37CnS_PnAA/3enPW9T3H5U_cAAlxiiKhf78Bt44nzWl23laeabWXxM","width":300,"height":444},"full":{"url":"https://v5.airtableusercontent.com/v3/u/49/49/1768197600000/5AiXHOZpsHo_7rjrZvm3Mg/uXasV0KeQ44iHp3pCw25suSU_et8h5wR03xgUdjZHTQn2O9Qj0BpD3OSSm5eVk42BuYCYAeDURb0xLQ4aLqKKDdZL_jKLefI89KzBxaH_Z87Y8NE_jCSNqRnWPrtdMI4dRiu46QTG4ATADjDKXFsOw/bFeFaPQZwsNnY5ribsAaIp_O1rpVCk0FFz53j3MHCPk","width":3000,"height":3000}}}],"Authors":"Tracy Townsend","Series":"Thieves of Fate","Series Number":1,"Readings":["recmIMsZg47MHhG0h"],"Date Added":"2020-01-19","ISBN":"1633883418","ISBN13":"9781633883413","Genres":["fantasy"],"Author Background":["by-women"],"Number of Pages":367},"Rating":3,"Read In Year":"2023","Page Count":[367]},{"Id":"Sun 06-25-2023 to Sat 07-15-2023","Started On":"2023-06-25","Finished On":"2023-07-15","Book":{"Title":"Leviathan Wakes","Cover":[{"id":"attQF74aAM9iejRTd","width":196,"height":300,"url":"https://v5.airtableusercontent.com/v3/u/49/49/1768197600000/-zepEtwlirj-L9ghCFjGFA/IUjZhqqExW5ltamWrtm2zkjgiUW-wJZGIyhgyoflAgQPFqwsu8a0yf9fDEb16GRl1pNgWwYyQFzn-N4v5JVZyHzRarqjeqi2ufBVSNLq7z0iX5bRDLtP4DtlyxgsO53n5iWjVCK8cYRTPeXmjfs-4A/dBHuXYmgrYcUMypJ0w6QfmY7p0WHA21TEhwGwttgMcg","filename":"8855321._SY300_.jpg","size":19639,"type":"image/jpeg","thumbnails":{"small":{"url":"https://v5.airtableusercontent.com/v3/u/49/49/1768197600000/ggaoUpzNsfrT5spkRoVRQw/jrgdHiz5DkCha_SQ5PQH8Z-FKtNwGbeeAm6Uhq-BAeSV4I9f8_qMGom5ogVRBkQ04JsIoMGpWQnRm3b33wVVNB4rijqfjvARZIrF_ao-XJX-UlnNXhXoHh-BNk6ojA6mPkKiE5l-yTbijEaAriMCSA/4zUDBFEW9AgMX-JnbwYbx70DhssNklU40zkNAi3WZhM","width":24,"height":36},"large":{"url":"https://v5.airtableusercontent.com/v3/u/49/49/1768197600000/sZY3scPrRWrJ_FRjXQ2ezA/BeCw_rlB4kYUMpsUgA_412i7vHCdHYEr-GWVRkHcXwxf0w5-X0802vrUCeS6knEZ7ut04O7CjJvsRtBLBE5BV5hWllEZgEEbrpIMh7tKieXWn957vvTaxExQQn_vo-LyhPj3gUq1UrYi_8jHA7__xg/ciI4NaXHk5R9Kp9tWu7AyqDUwfcqnC4nXSz-HnT7gV4","width":196,"height":300},"full":{"url":"https://v5.airtableusercontent.com/v3/u/49/49/1768197600000/1JK7phYr61Kiuegw5tbiGA/K2daPlx1r3gxTngexCY9oCZZPoH_9C_eYdkYm58mfTZ1vqOQEmy-1-e0qLJd-ICDeDHYXo896z6Cz15Ttvh36qUozznYn7DHwXGnPYRl6P_20NnpzN33XuCgV9EyhMXJ5s9OevT5I9T2P3O1uyQ3IQ/SUkzrUtu5sVLtEOEhWrdDXTUUo_wKU6sdULtie82Q0w","width":3000,"height":3000}}}],"Authors":"James S.A. Corey","Series":"The Expanse","Series Number":1,"Readings":["rec3zBgA3QReR9iss","recsJWgr3WmHK746K"],"Date Added":"2020-01-19","ISBN":"1841499889","ISBN13":"9781841499888","Genres":["sci-fi"],"Author Background":["by-men"],"Number of Pages":561},"Rating":5,"Read In Year":"2023","Page Count":[561]},{"Id":"Thu 01-12-2023 to Sat 01-21-2023","Started On":"2023-01-12","Finished On":"2023-01-21","Book":{"Title":"Three Parts Dead","Cover":[{"id":"attPn7r6hjosVnQ8J","width":198,"height":300,"url":"https://v5.airtableusercontent.com/v3/u/49/49/1768197600000/01klZhMSymqPdpT1CtbMig/DAsDJ9hMtIXsIRpcmYbpOTdrtTtg0PdZd256dZ7E0lykwCdLlJsePijXT9gWIhwo-6pJhbpfBNtGewgC-fpU4g8O_EnnkrgcSNVBd1Lh6sv0wrFfSFdEij_61lTwxtX1bZ9ku1_wKWnzGhNAzwrxOQ/sKScN8YufNviFcSuEGZDK5EBmzrsoEDepXUK27vJ1Oo","filename":"13539191._SY300_.jpg","size":15964,"type":"image/jpeg","thumbnails":{"small":{"url":"https://v5.airtableusercontent.com/v3/u/49/49/1768197600000/PxQeAFMoz8kUouGM5hqQ5Q/atoxjtSgAhAiKgzAKc5q8V8uHpLdAfyX3Jfp9yCjvKZwbAhbB3lVndQJfb2R0vv4KDXx_GnVpTqzS045upzESwPK22gL7f1AIi8RcgSfp0-LBJBT3zxF81VgAXKYgHhUjLKrEycCV_LQV-oL0j8pAw/jAQhZDYwOze5BUV6N8f1IzWMNmS4RQGPXZIgiYrHF8k","width":24,"height":36},"large":{"url":"https://v5.airtableusercontent.com/v3/u/49/49/1768197600000/iunysqhdBZ_EsIJzP7Ce1A/1vdRYRt2BLh4JLHpS4LQbbUSHKfPq0hMHd-fljxQnj2dJ2FKHgCnz3nl99v9HexxABMivbw-nsQwIhH5faiToPWb0eI-fk89s-2Pj7UGhVaTAB2DBbR4o8_cSW8PAR8IUmCT_lNxnFu_ax_MmG8eAg/79Ub_xdNnae7UrS-wVTz6ewojMTKVYFn_4EfT2LetdA","width":198,"height":300},"full":{"url":"https://v5.airtableusercontent.com/v3/u/49/49/1768197600000/UzrkdWOdVxV8vGdB8FCKYg/fFfAOcKYjmgmzyzpF0NoD2wxjCC0VyuYBdS_6Pb97ltajyqUJUp0fb0taUQVbxisSuQTOwTXY5y1Sdcben8fIzD7OggHB8DhQN-Yd3diRG0nGaUKIBfs5sccojrTuxjunwmerUV98qF8bahVdh3MbQ/Bsee9m8QbRFZ69GjpreyiOKLv1GtY0V-KBZC23fuo4A","width":3000,"height":3000}}}],"Authors":"Max Gladstone","Series":"Craft Sequence","Series Number":1,"Readings":["recl29dOVK9DWS59o","recsgFMdKDAwAmymA"],"Date Added":"2020-01-19","ISBN":"0765333104","ISBN13":"9780765333100","Genres":["fantasy"],"Author Background":["by-men"],"Number of Pages":336},"Rating":4,"Read In Year":"2023","Page Count":[336]},{"Id":"Sat 02-04-2023 to Sat 02-11-2023","Started On":"2023-02-04","Finished On":"2023-02-11","Book":{"Title":"Two Serpents Rise","Cover":[{"id":"attPhmyOeVSjQ98jj","width":300,"height":448,"url":"https://v5.airtableusercontent.com/v3/u/49/49/1768197600000/ESl3teIxELvfen9jpz-mDw/khrMDglVKRKGcoT6JlJtwQpko2tLRtG4Dt8VVqltj7GIC-ndX4llN9BifkU46pHWq8EpMyQ5iMMJzjyU5qy00PhLi8U26HEEh5KLxKkhTNi3wZ35gqDoJ13DL3NOnNsWK9ER3d3Kasu6NxI32DxhOw/3741I9kgUntmVKMzMUEPgFYlq4O2hhEUWiDJZ2d6WLw","filename":"16059411._SX300_.jpg","size":27952,"type":"image/jpeg","thumbnails":{"small":{"url":"https://v5.airtableusercontent.com/v3/u/49/49/1768197600000/TQ7CoJtAQCqHGqKHEcBG2A/OJy_am5ul4zSsa8rtd88el0A2VmElfGzZnL6bXeIySqZNMBwJCCoCMygrkrtc0nAq94F2BMui07_wiezpj7EZcV__6b-TfAKWQEp2x8J4DOgXcyuY_MEeAEQZ_6CqZCZ9ykvTgRId9-v-GvUfGZNbA/L6tjCRSSYIrv0PnHgrXnOgCZkvt1fic1Nu-1cJeEM5M","width":24,"height":36},"large":{"url":"https://v5.airtableusercontent.com/v3/u/49/49/1768197600000/hlFeSfmxPntN53V8ioJXJQ/LZwhvJYvW09jzVxvwTx0f7kO2RT2yEBdmdHHFbVPe8ljyeBjvzw0y3P4RWTAL1XVQ-1fx_qDshcYu-ilvNVEbRJhNC63HeQCII4R8yLWteV-vrDJ2eqiqukcxs67Cw-O72dcG144M50j0x7Bea_eJg/uRcNGj5ZWgyqWtdFcTtf9PAvU69SwROpiwYCjE7e_m4","width":300,"height":448},"full":{"url":"https://v5.airtableusercontent.com/v3/u/49/49/1768197600000/36J3rNkFYE7KRDQOzzctng/zbX-YE95d6xQLBh3PK3YqG9oBxosrXwq4ogbNM40WMsqDFW_N7bNMGGEmA6IdFyc5DGdo5u9KnSpS1j-WwvI2teNA0vcyzTZsRdaqPKk8j4yFYbsd4Fy9FOBTeaAzYA_nBuiz8MVjWc7iP6VdOqbPA/sPqE9NeS_hC8qevCjrMvgHNHb5v8UWj0O4dcG62ZHuc","width":3000,"height":3000}}}],"Authors":"Max Gladstone","Series":"Craft Sequence","Series Number":2,"Readings":["rec6SRhyIAXx3nCoS","recshCxwGUY8LkhwB"],"Date Added":"2020-01-19","ISBN":"0765333120","ISBN13":"9780765333124","Genres":["fantasy"],"Author Background":["by-men"],"Number of Pages":347},"Rating":4,"Read In Year":"2023","Page Count":[347]},{"Id":"Fri 09-22-2023 to Wed 10-25-2023","Started On":"2023-09-22","Finished On":"2023-10-25","Book":{"Title":"The Ruin of Angels","Cover":[{"id":"attyg3m48hUATRDR5","width":1500,"height":2400,"url":"https://v5.airtableusercontent.com/v3/u/49/49/1768197600000/lI3ulRiZZOOsB0GsMeXqrw/A-J1q6yx1frAomSxicaLKp27MAYY1wucrMiKtEDxlh5XA4JN3T0TyQ4ZnfukayGFkja2ghJWwDvYwR2LwMebiKz_ko4dG5yxjU99OxfQ4vrUm6kjdoxO_qEQVUShkvuhA_yT_FHwejCEr5wHJfbyOg/rXEa8cvrkEZnMioI_sRFwzmaxIO0kr3ZtdMJLCyUNb4","filename":"31433704.jpg","size":2718304,"type":"image/jpeg","thumbnails":{"small":{"url":"https://v5.airtableusercontent.com/v3/u/49/49/1768197600000/e5GUFAmQ9R8q5V6uJJGbng/-1WR_8KNbLfwUjAdffzmeCfGcDBhkZwpK4ZTVSXyAjL7nw8v_lQJfbf1Nb2KZ8UtTbnZpny6X1JOG7-V91Rb3SyEHXGFVlW3mhLCLTQHlX2lUNTlhSRBdfQyk97pfrKMY2Ygnug3CoqkDHyuJLO3ng/1dBY3jpqyh7PvW9cfpCbbay8QZ4cePegIrvo5oTu6vw","width":23,"height":36},"large":{"url":"https://v5.airtableusercontent.com/v3/u/49/49/1768197600000/X8tL9HfOCJCd0cAxLTxmyg/y4C6HDhzGUpNiGeASw1QgnPo7Exwef9jtbiHso2TwDxx2QxasSiv1o2KqvB2LqR3xN-aDyRmNOFJFsuZUv-85YeVV8J9_ib73LeykzJguEiK_s-08kVMVN-lsMScD6qhbTgE2AhO3z-fRWPnugy9fw/PVgZE0VCe7z0iWaOauzH53CgUSJIqYcBvLGVgPNLAwg","width":512,"height":819},"full":{"url":"https://v5.airtableusercontent.com/v3/u/49/49/1768197600000/rK58YAmQGFFo6QD7iLLvdw/zXdZVhgyYkhJdidVb2STcQA6Oz8Gre0LG3lBgHh70py8rGxo34SBHujW6T89flx04Xk818FOH9CPvDObBT6xwVfexPB-DqUM1i5OPrA1y_AnpQ3dKf8PHPokc_HpILHzcjvc1lvxQeR5duNLvSp07Q/79twhVqd4sVgmKlu3ZxDwgXukrt91LuVrXZxOw2RTEw","width":3000,"height":3000}}}],"Authors":"Max Gladstone","Series":"Craft Sequence","Series Number":6,"Readings":["rectC4fwnHUwMa9KZ"],"Date Added":"2023-09-23","Genres":["fantasy"],"Author Background":["by-men"],"Number of Pages":576},"Rating":4,"Read In Year":"2023","Page Count":[576]},{"Id":"Fri 09-01-2023 to Fri 09-22-2023","Started On":"2023-09-01","Finished On":"2023-09-22","Book":{"Title":"Abaddon's Gate","Cover":[{"id":"attzubXy4vIpbtubg","width":193,"height":300,"url":"https://v5.airtableusercontent.com/v3/u/49/49/1768197600000/SgL7XAFKBtXp2wElesP8Pw/Tfd7SxERst_mZVYR_TVGGGN68LUAHhdv2vO3Fab8Y0d05QD84LpG2q3s2mEfe4dEmyOgzM1AIFsrppDDE6YhdpLgbXedpiMXysstrYoUkjun5flQg-vMsoY4ihuwfjrlid2xfMLtPghPYOy3kIebIg/9ALvVSYkv-EFwq2-Mvtq-l9qrHGOWI12Oofkn0OVfNY","filename":"12591719._SY300_.jpg","size":21274,"type":"image/jpeg","thumbnails":{"small":{"url":"https://v5.airtableusercontent.com/v3/u/49/49/1768197600000/j6LwjbT5A0zBRoJ8ltsQEA/EW5Jj3wm5TNe725Fd-rygpT5OPTRsh1OP6-OPZ6AB63YQJie0TXdv2H2X4b6bK3DTRTBLuJAxkkXbGVBmTat3xKZTCgVpA6bts2Kp_UcpO-WxfnXG9hbfSobNuTX3j69Cg-KCw5tWZ-qYdZSRznWuA/xdet3bDhcRikdgd54YPVof1VUdqUwKyrj2kA_x3-A88","width":23,"height":36},"large":{"url":"https://v5.airtableusercontent.com/v3/u/49/49/1768197600000/IchyVLXEau6-1JyaG1LYEQ/Qjayu4rVJPljwNAazdGBRs1qY1k7H-Df3yei2184pmRuRP9roiOwKYlJeYxlrK0J6LxgFU5LJOWs4s3g-i8PnEluFVZdRF-RyS2rOXN6PBj4WS_RphvnmpkB2UJ9QIUq5dEy3MyMzVFl1PnBk2bS-A/XwhposTliVe9QB1FW6rEPbeTfsdNKt4BOBcKHClBdIg","width":193,"height":300},"full":{"url":"https://v5.airtableusercontent.com/v3/u/49/49/1768197600000/640spIOU79zIvcMygzAEQA/9BhswU0_xkl9E1vjstIMG01UAF6UBaz0bTwuNW92UBv98A3iRsdBWq3mcJjFelZiAbqFwjSb8xO27aRm1pL3rnkxZgKWTVsm1VkmifSv-J6fb0ZgP01FtBiyjlllLrG7KGQHN23tVEXZ7jbr3Zao2Q/m3j1i7UOuGL06fUmhHw-NKkjZc7lbX7ixUmav2XCi-w","width":3000,"height":3000}}}],"Authors":"James S.A. Corey","Series":"Expanse","Series Number":3,"Readings":["recU0VqvzgSVNqjD0","recupbewORHcXS89N"],"Date Added":"2020-01-19","ISBN":"1841499927","ISBN13":"9781841499925","Genres":["sci-fi"],"Author Background":["by-men"],"Number of Pages":539},"Rating":4,"Read In Year":"2023","Page Count":[539]},{"Id":"Mon 03-27-2023 to Sat 04-15-2023","Started On":"2023-03-27","Finished On":"2023-04-15","Book":{"Title":"Emperor of Ruin","Cover":[{"id":"attKVLaFB6I9wrSBt","width":224,"height":346,"url":"https://v5.airtableusercontent.com/v3/u/49/49/1768197600000/1JwMjuOHBiDQyK665nfLJA/Fu-t1l0J3UXPNSqjPhz8UhIszjGsJChgnvsrm6TS-tp363cYF9Jx2omiXegCSRGuwm2CxY4ZTEP9J7TtWr-Bx8TfRGyLpI_DaIBMlxbFf99CJ8WWarCCoIylNd362B-fLAOYTdRQHnhQS8n97vrPSg/iYeV9IZ9aPT1s2bsxBYBxpklvx7GRdZvP2Eqf7j8_M0","filename":"61411169.jpg","size":25250,"type":"image/jpeg","thumbnails":{"small":{"url":"https://v5.airtableusercontent.com/v3/u/49/49/1768197600000/JB_Ts5y3MjYdfLyy5Z2-GA/bR7c5PmXqW4RtNeAbfVRmOb6qXPBhdJohZzY10ptcE2D2czav-Z3hJHODIjVZNcpzJQxb2OFQ9fsa2F7VQuuGgxRcP45r9sbsC9G7wLLQ8FdGvnfdGGUSNeZAK0HHzdhjACm8k6Un7lS4U495UYoLA/oRj6yHoKd8mR1hyJwzW85619tBMxzqSt4S8g3It0pog","width":23,"height":36},"large":{"url":"https://v5.airtableusercontent.com/v3/u/49/49/1768197600000/3wqphL0fZfLj7XaAAzUwDQ/Cz3hLtUA42Y8h3aGUGzsxVMq1iFwcAFq2FGvYJ9MKqn4J3EPpgvbqX33TUQ2GqrWBqN2qzSbX5R4Y6PqQGhP7hNjG3GoYSKlFX7aYSTMmxNAhBTHnYTzBCeyWW0N3pl20JhcMpmMnEOxhKTpwR75qg/sHbYga6S59vyFwc_2JyOtWfhKfUImHCE3rCZiJEDW18","width":224,"height":346},"full":{"url":"https://v5.airtableusercontent.com/v3/u/49/49/1768197600000/ruFQPPmMwKJ5fx39MxZmiQ/uyhNbW4eVlgsCCmxERp-8cfEeuLgPcVkN3L42EMnbb7YwEsEsyHifT7p-CG_3ODlEE2MTS_AybCupE6jp3scucfV3LScAUcm4Y2mU3Zho1eHODkvXGCkKqDHjColsFyvxv7fG6U_Q1a7vVT1RFzDIA/waOXt4J_D3b-SOc0G2drnJrzQj9YC9zZOWyCJamQctY","width":3000,"height":3000}}}],"Authors":"Django Wexler","Series":"Burningblade & Silvereye","Series Number":3,"Readings":["recxfdgiWyvB9CGhU"],"Date Added":"2023-02-04","Genres":["fantasy"],"Author Background":["by-men"],"Number of Pages":512},"Rating":3,"Read In Year":"2023","Page Count":[512]}],"stats":{"Author Background":{"by-men":19,"by-women":4,"by-lgbtq-author":2},"Genres":{"fitness":2,"fantasy":10,"sci-fi":8,"nonfiction":1,"tech":2}}}],["2022",{"readings":[{"Id":"Wed 10-26-2022 to Sun 11-06-2022","Started On":"2022-10-26","Finished On":"2022-11-06","Book":{"Title":"The Staff Engineer's Path","Cover":[{"id":"attxNY9uN2VHHWy8H","width":317,"height":475,"url":"https://v5.airtableusercontent.com/v3/u/49/49/1768197600000/CvunqOuVSpZV524zeKWpCA/Qcq5T4lEi3xejpREk9-6H2UdWQsmUsun6VIi_f-V-LBLQd-Y51kPORGB8pHfD-Q3Zxb-gV4m--43eDcDdIvzHUoZG8yiXyGRF2aGf7QfItX4YkDVYIGAzli84WA5RxxcjsDUUfReBKkiboJN_AlPWA/kV5yHlcNLwd0HUTKuEva5w3c58jAatuW0s0ZBqRiFnw","filename":"62675348__SY475_.jpg","size":27006,"type":"image/jpeg","thumbnails":{"small":{"url":"https://v5.airtableusercontent.com/v3/u/49/49/1768197600000/BtnAHzPBQJE9HL96I77GHQ/SwEgSS3106r600M9sRpDJox9uebNL2HZcBfAjJ-b8pXUyq6kDm8YQSfP48w_q_hlzOhcf_yY3b7qyrXlD8weyPwxkSgYnSeeCSyPJg95hYz8zS00Bfa0UwHcaDcR9z9fXDcRUj3i_J2ZFGuQUnl6uQ/I3a8RPy58KC8_jcPu68PK8aDFm0J2IbhaL3LVjpIb14","width":24,"height":36},"large":{"url":"https://v5.airtableusercontent.com/v3/u/49/49/1768197600000/0s2sqV627DPgbsa6BTzT3w/lwgLJFDgPH8P4Nj4s7Lt9HjDbaPhTdh6CZ-UQZ9wHKmLfP2reNSTgOo_9kjCVtVlliCN8B1M6IIOAtCtmakVkiL0z7UyOvAf6R7lRxwh2Y1zy79h7ScRLxMaUL3cgb0cl32HrXUFvLKeZiEfx5lfzw/cly5V7DOGPUPAxdJnu24GO9wXC6e2FY2zpeYduz2rn8","width":317,"height":475},"full":{"url":"https://v5.airtableusercontent.com/v3/u/49/49/1768197600000/JkU5nbXS9dWpqPtSuDB3qA/KlnVbpBK6iJcVuoV7vsS_W7L6xmbsQxrs4rTC26a92cI9Ho0NuAg_gYAp6Yq4Bw_3vBMgxzzJBIiOtX18N4IiOd7AjrUyDCtnLzkl73voRTcIDX6MX0GyX3CnTWokcyiDgEEVVGKMHH4EjXZ35veow/RXT6gBLY2QWS1lcFtRwCD5my9EEMrzRlhWe53qrq9XQ","width":3000,"height":3000}}}],"Authors":"Tanya Reilly","Readings":["rec0k6Vj4bkBX1Eid"],"Date Added":"2022-10-23","ISBN":"1098118731","ISBN13":"978-1098118730","Genres":["tech"],"Author Background":["by-women"],"Number of Pages":356},"Rating":5,"Read In Year":"2022","Page Count":[356]},{"Id":"Tue 06-28-2022 to Sun 07-03-2022","Started On":"2022-06-28","Finished On":"2022-07-03","Book":{"Title":"Four Thousand Weeks: Time Management for Mortals","Cover":[{"id":"attnHoX01pZhlLpcR","width":1612,"height":2475,"url":"https://v5.airtableusercontent.com/v3/u/49/49/1768197600000/f3EDNV2xn2L3NmeLE9Y8QQ/wAsCKkUpu6D8mESVUEvGHF2zc1nJJxnDIhF4MfQAAaeqAIrKUJ1pey-71XSbPulzOGKJNmo6NOBPyOUBNV3R6CGK1cyIDPAblbmwqD6yNvLPjZqJlBJBFUi4tDlFfUWXNSZTuO9Mlzmw9mQJs0kIlQ/KXlUfWusQBmDj4QaYiH62BDGrJZC-gLp2r310OLkJyY","filename":"54785515._X0_.jpg","size":504336,"type":"image/jpeg","thumbnails":{"small":{"url":"https://v5.airtableusercontent.com/v3/u/49/49/1768197600000/tJ8amH7YNVuf-0l0NJujGQ/KVleoK8QpCmypaszoIXCahUimPREBa4T2FWNidIlPN3-Tf18IKi0otQSrKcjdrur0h718gGgie3EX427cAfvcLLn2E98xWF54rUTx8w4iCCgAaymo-zggBi5v8AbEtpb0n99Jh4C0EjL4SCkXX3UQg/pyEWTcrNddbUfQXfwOXknAyzVhsZG-F4QaGs4SPeXio","width":23,"height":36},"large":{"url":"https://v5.airtableusercontent.com/v3/u/49/49/1768197600000/zImTezwWBLEOE_n1JVc6KA/b70soUydMQgmmIe9v90cUqYhiyaD6F8K-NyxEQG2dSGZbCfdM23HTLGmYwbrpGNuD6PfQokzFGyI-68rPFGeAr4fdDsRFjI7uXfqSsMmgoXm-7Cat_HfwRU4dJRfg-XVVkUTx8qEote0Ha73DH4hMg/q9Ur5h65a_wvj6gJ97cEjpN8j1TahoVbx_GMbjtsi1Y","width":512,"height":786},"full":{"url":"https://v5.airtableusercontent.com/v3/u/49/49/1768197600000/ZdY1YpbIYidVVDVyXu0i-g/wJQYmIiA8NXEtgqTXbMHj2zNoItc3BttDawAd_HgHrDTeFA1SNtfDeQ-LQrY81ouyGiaIv-PYB4Loq9AMB84taydNtQikv3FXbmrHRCCungxoCeby5NKB0dXZg4gQL82icmKAAd7821L1uzf7374fw/KJ8GBnK5fgMm1WQ9fC3QL431gtE991_wRthSvPocIds","width":3000,"height":3000}}}],"Authors":"Oliver Burkeman","Readings":["rec1CBLNmwnvtYe8N"],"Date Added":"2022-06-23","ISBN13":"9780374159122","Genres":["nonfiction"],"Author Background":["by-men"],"Number of Pages":288},"Rating":4,"Read In Year":"2022","Page Count":[288]},{"Id":"Sun 11-13-2022 to Tue 11-15-2022","Started On":"2022-11-13","Finished On":"2022-11-15","Book":{"Title":"Make Time: How to Focus on What Matters Every Day","Cover":[{"id":"attkToCU4TTHCmG2D","width":255,"height":400,"url":"https://v5.airtableusercontent.com/v3/u/49/49/1768197600000/XtKPBxZBVHecCkzdp9sZ7g/sHE2weaTgMnzHEii8pYSSVvT1B190txqGZflqewYoswaYOwqze_NMu_Lr3dx73VQJawOtcfLqgJZXJSnIyub22nk7USeDYFnU9EDXSP4R48jN1Hp4enx4c_rWhCAWlQjFLmP2VLNVNrtHb-TqhZZZg/xwVbeq2i0io8vZRQcqb6_G5Y5rNn6QC2YRnZcxZyg4s","filename":"37880811.jpg","size":18374,"type":"image/jpeg","thumbnails":{"small":{"url":"https://v5.airtableusercontent.com/v3/u/49/49/1768197600000/m3J1I-rsvqcI0UbK3n9TOA/olMu503bHsSsliIHld_i8fdaP20bmblae2N-YqVk4oEl1bzPO6FEHJxE4PU2lfvZ-ux8XiZuC8-jmIBZWfuaNLqa85hJuUgKDjPwTZXZ2O0E4_KIdhSnqiVvI1wtPTtiLNhUrertoC-gnxfcjlhGCw/Tjr2qA8I03QFNQXum-_Y_5L2CTcWOP7YDequsRLn1UA","width":23,"height":36},"large":{"url":"https://v5.airtableusercontent.com/v3/u/49/49/1768197600000/ZWxV-k-MrTdaKoM6DL7qJw/jSqFBBklffXsYHUOe6IxqrDFD6PLtJ_ROymtwTNXDp9W0tjTqPYkSN8IiqgBGIdHZkscTt9YutUnhW1C2cz84DJavoxF9yd-vrlckjXXHsiBFDCiXSRvMu-uI-9In1OJvH6BHtEFpBiA9ptpymyyuQ/w2_Tm_DVDe12YHo877Jf5OW3u_GG0B5Uil1m6KhO7i0","width":255,"height":400},"full":{"url":"https://v5.airtableusercontent.com/v3/u/49/49/1768197600000/IpTd8_Scq8dXxz4EKJ2Y0Q/0dAjHQAgDgnVWWEnEAzhpPfTM3cx6BMuVLb5_pBvxMnRjWYff1x-YIJ6YIbcNJoWEEWmYO1mnK8elFBsmnescBbYKIi5mdZW949CQJxivkt5HoN-jwgXCkGaN9lJa-3Ri5yFnlY_jzZtxb6ddF5cUw/zF8h2z6_4SUAF0_JzpKg8GAaSJFIkPwsekpkt4xBkfE","width":3000,"height":3000}}}],"Authors":"Jake Knapp and John Zeratsky","Readings":["rec2CHTraJnKiRV5I"],"Date Added":"2022-11-12","ISBN13":"9780525572428","Genres":["nonfiction"],"Author Background":["by-men"],"Number of Pages":287},"Rating":3,"Read In Year":"2022","Page Count":[287]},{"Id":"Thu 01-27-2022 to Wed 02-09-2022","Started On":"2022-01-27","Finished On":"2022-02-09","Book":{"Title":"Magic Binds","Cover":[{"id":"attZgikW0WRyQD1yH","width":314,"height":475,"url":"https://v5.airtableusercontent.com/v3/u/49/49/1768197600000/GyVDue34ZsFCiRk1DqIGrw/-tScWsudicT8Wbv199aKsetjOroXNrngalNgbHH2E8CthEakbdIQL-o5AoIMlpTWbAMLjqGkG97_8fxD3pkymwtGTzK7-Tr9NHhAjCd4qanGjIyri7nvdoZesVnbw1UccyI5bmCRYVlNs7Qwjv0mVw/woiwSvlDqyYHjx4oQJX-vuivLw3zUqcURncG9MZIPys","filename":"17333174.jpg","size":71936,"type":"image/jpeg","thumbnails":{"small":{"url":"https://v5.airtableusercontent.com/v3/u/49/49/1768197600000/czDewLcxdQmFr4HqzPuisw/U21rdcAGRi4rAJUygj-hTyffAspEnelFw9tnFzZ1oMr5STNBF4X6BmFr1xBJNsO1Q0QCrywaOCd9oU76FdtCFIBmWXgJTt1jWc-MU78fJCDwb3yWR1kaqYsMzcj0_c8CvQSyxLgCMN0QeLZB35hkRw/zgLMOgQ577uT1CAdYquUll3cibkxX-RgxQH_GVXs_s8","width":24,"height":36},"large":{"url":"https://v5.airtableusercontent.com/v3/u/49/49/1768197600000/dhR4azikjcY4eUjywgMgMw/-3tgixoVVH3yIv7sBw0hg2FH6YnWotlEhsmu_Uukr7m8riAF2IY_jV8eQTHQASSOeaMeqW-dVGdGsbVrwehxzjhmCf2010H5ezaL9NpoVHuP8se8wkYl3FR-qVEpYwCQ4MIZ4jAyLrBwXlY0Z-PY3A/EeJFDNqJLgljPndYzDZ0tRqi6W2rdk0dKcGGQf2xbOM","width":314,"height":475},"full":{"url":"https://v5.airtableusercontent.com/v3/u/49/49/1768197600000/BwyBNSM43p34L-zLQY_t5Q/mKyvGtIivqITEGDiXej-IUc7nmopd2UxWqpVzka6jCm18dlr207A0xNHElKZfI5_40yzue_RwtXtpvxOIT8Os1NDB7lpYNSHdUX_vxRuX8KNoHeMETBVSja_SwF40wwjO4JsVTtaTY6WCIqyBs60Gw/_zWe_SvNMlKDgYhZS-AwWaPubMY_rrQFL_5wHav4eUI","width":3000,"height":3000}}}],"Authors":"Ilona Andrews","Series":"Kate Daniels","Series Number":9,"Readings":["rec2a8SEva99tk2P4"],"Date Added":"2022-02-07","ISBN13":"9780425270691","Genres":["fantasy"],"Author Background":["by-men","by-women"],"Number of Pages":328},"Rating":3,"Read In Year":"2022","Page Count":[328]},{"Id":"Wed 03-23-2022 to Wed 04-06-2022","Started On":"2022-03-23","Finished On":"2022-04-06","Book":{"Title":"White Trash Warlock","Cover":[{"id":"attANDly5i8fn7Emf","width":640,"height":1024,"url":"https://v5.airtableusercontent.com/v3/u/49/49/1768197600000/mFfRkWLam-wT0Gh_g77MKw/U2Kv8Ew0vGlQ770cQFp3nNO6ISIfFi1pzbUDZ1LleBWQLwZFpjh67iikg5ahaIiCmnsk5a4jYI8aJgktk2Kzz-HnrDBTSV6GN680mbgerrXGzUgjccFA8X2oqk1a6cwXn2q9w4JNZVV5vvX8Gytiog/i6gE7iAP0H-HSF031B-C53VikSmOAjY2AbEVbZFzYo4","filename":"53255694.jpg","size":211319,"type":"image/jpeg","thumbnails":{"small":{"url":"https://v5.airtableusercontent.com/v3/u/49/49/1768197600000/hQmXprBhTyXACnzilCF--Q/OJAm4BpMJVVJu6XSsNhcJQtElMSFYCNQw5sUTCztW6mGEo_ZDNIzbv5MGZfOfxuivbNJyIHoBUoSyTFCuaQdMgh2PKRa7TEnIC8sRnyG6wYN1OdVP1BWRu5nell4i3frL1VPHNDtKhUvGeE5Ba6Dyw/VNBtmvRHOTRK9R_FNZO3D3KAli1INMlFj5gEBsHlHKU","width":23,"height":36},"large":{"url":"https://v5.airtableusercontent.com/v3/u/49/49/1768197600000/1DEbzVWMvSWvu8tBOaBWkg/8akJjb0MOzSIRbu7aAsndjx9ui1ije0_QP8B0c189DcOBemiR_G3jxnz37nxWoIvQ4zD2x5kOmETUp6x6ouXG8G_Vcl05ErJy1c_DBn17TUBJUX467unuLs3HRxYE3fXpDj_xpcZlnT0bplDIAJCcQ/6pd3vIr1PvJ9mlTYkmTNPXda43rAGXavuPK5omNLjOk","width":512,"height":819},"full":{"url":"https://v5.airtableusercontent.com/v3/u/49/49/1768197600000/hhxRK3qaGdtEH-9nWeH1Nw/uVCoxcDlyMAVb29lm1atLGlyQsSwmgwxiGjCTGUhqgcy0ayQItDzlq9CSyk5o1e0TDbIh069afFXfwn_DGastTgNot72_O7Ii3WDSieuf_pg6FaAyfwjwPrAZz6lV6J3BqBaayBr1_YyDOihD-yN4A/w5i2qDmjnS3prlEE7lHAtUW0iLi4gEcrgNxvJXOyutA","width":3000,"height":3000}}}],"Authors":"David R. Slayton","Series":"Adam Binder","Series Number":1,"Readings":["rec2vrVREm8SxuJao"],"Date Added":"2022-02-19","ISBN13":"9781094067964","Genres":["fantasy"],"Author Background":["by-men","by-lgbtq-author"],"Number of Pages":320},"Rating":3,"Read In Year":"2022","Page Count":[320]},{"Id":"Mon 05-30-2022 to Tue 06-07-2022","Started On":"2022-05-30","Finished On":"2022-06-07","Book":{"Title":"Unwinding Anxiety","Cover":[{"id":"attH0Pphd850g1cgi","width":265,"height":400,"url":"https://v5.airtableusercontent.com/v3/u/49/49/1768197600000/-w_1pFXH47jedpeiKfWHMw/-b8vn8OrTZjHpHpLZVserym-KmZxgAhB1P3sg4qZZqWzwxgYq_-tDoXK4LOW4MrQsCqNbiZGTFbAwP02hTj0hLQZZHYRxhWQjn_PrIDeAmkWdvr0DjR-6lsBc9W2B4b-1LVLUTgLM1vKGndFdPTOJg/_nf9LLPnOJ3MEkBL7EM0TYuT_gi6HNZmBDdy7NAN3tU","filename":"55628986.jpg","size":93309,"type":"image/jpeg","thumbnails":{"small":{"url":"https://v5.airtableusercontent.com/v3/u/49/49/1768197600000/9asyMoIIRXi2Urk48VQWHA/eNi1thfTepdqnmXwD2NQt5WsjXvbR-uKR6r5HKEdR2yNokGROj8t5aCv7VnTe5PP0WfDcWQ7Bo7OfoDA8jz1uKAmV9ywc6Paoi7ac27cNZhx99NGYK4WnGlYo0MMsGIOVyFGw_ZjTEGmFbJEvOiePQ/S8jiJWHjEay6pzWUEshLtZ_DNx5RV-OSL_yj7oJcsiw","width":24,"height":36},"large":{"url":"https://v5.airtableusercontent.com/v3/u/49/49/1768197600000/c-Jjr1W-K5Pvl3ZL2ORuDA/N3ofR5wCLbL95X9gro54sHeJ03qPbejbpVQOOKGuyyURRua8N_qPad4x91v_j0Kph-1joKI7uXvOm5CmFGvEcx6vfQTDrxYcQiDd2lnOHr36aycez8dfyppo-S0jFi_ATGY6-ne33SZQEXIlD4QsRA/ObYLbhn8MXxX5pJWSTSuEFzZqVfXPWrHNgo8OsbvHuA","width":265,"height":400},"full":{"url":"https://v5.airtableusercontent.com/v3/u/49/49/1768197600000/h5YdCkaxwzlORsuoNH-tcA/ezimHVDq35gPQB-DVLFc6G74CWhH7Bt5vspZVXCquuISD6BD4LAQJ8Dh0caRTZIhRdn6HdG1aKsazIQyu08svI3rBj0jyQqryrAELiRTNoFs0wYO7_WuZ_HrEdFMG3breR--5FQkQ3ICKnm138-tvA/ZLY7XYm9Hf65YRY-0yahHEA350EMJ1kuYa3iC9ViWJQ","width":3000,"height":3000}}}],"Authors":"Judson Brewer","Readings":["rec7YWSFgZxYQ5KnS"],"Date Added":"2021-05-01","ISBN13":"9780593330449","Genres":["nonfiction"],"Author Background":["by-men"],"Number of Pages":304},"Read In Year":"2022","Page Count":[304]},{"Id":"Sun 11-06-2022 to Mon 11-07-2022","Started On":"2022-11-06","Finished On":"2022-11-07","Book":{"Title":"Tactical Barbell: Green Protocol","Cover":[{"id":"attUviPObdsrd2yyg","width":1707,"height":2560,"url":"https://v5.airtableusercontent.com/v3/u/49/49/1768197600000/j65j1G2x5oOv_qRVCPkyGQ/1fKvfZtu0uD6CR_O2XiIud3A8WopteFaaTeUmEBlMku6Hgo3xpgomXWiwyY3S986xtE8Rf_rtfXx3qdlg7BOMY8R58ojPJK_D2AggM5zPAdVsceS8Adxa2mp6kdjJ9zDlLCQycr6SmKsIsf0iJyk9w/1yAVIeH52aVAkUfT223pTaXiR3TrGKZ49QCfiXw30bQ","filename":"61091101.jpeg","size":120739,"type":"image/jpeg","thumbnails":{"small":{"url":"https://v5.airtableusercontent.com/v3/u/49/49/1768197600000/SQpIdboFMK529zXwKwRX3w/LBoU-ZlykgSLZXy74ZxD4_68KgtBDv-aV07TIh_nuIAeseP3m8k6w3YigFzslZT76RMqq1uvxUW0ApwBzR6descojOPM6wAsdVcxpy96DOPKu3QC47TcPPOW4n5ygl_dsvLFRztPeGF9u23q6uzL3Q/L3VADIhXVTc3gl3K0eDRvRPUw5BWL3wVZ-WWVSd3t5Y","width":24,"height":36},"large":{"url":"https://v5.airtableusercontent.com/v3/u/49/49/1768197600000/xQJSvYBxj90m2HLfAigstg/lskWjrTUsnS2SVpTqsL8P5n0Mv0Dyng_mbwm0j2hPp1RXCRM45wrTwWknuGSHWylhaRNoE4Kw3RFdhpMq8KY1sqwXlV0DeQN46_ny10LNbZh1pmxbZUjoR14elhM_E_IW7bGXlpmqQc53797yBx38g/_vEymawjXJISqZ-WfX_FSPA5RMstXrPAo-gpoDtcFqg","width":512,"height":768},"full":{"url":"https://v5.airtableusercontent.com/v3/u/49/49/1768197600000/sBA-UwBbAReCq5WrjIoX4A/tQ9wuJ_mfr5dcyUrJfZzEeayhIZEBGB9MQmCI2cLf-5-i3TdDuhx2yU658_yqp87A-wlLq8bgrzbRORVAV3w2AD9h72I1bgDaHG4bggEfzP6FrqspryXpzt65HMFQk7BUWmw05zNab9LiLS76aGvgg/9a48lBCPWYIO4-HPX7GpFwLHTBICnhTSq5TqQ4f91fs","width":3000,"height":3000}}}],"Authors":"K Black","Readings":["recAnyRC6HiagrmnM"],"Date Added":"2022-11-08","Genres":["fitness"],"Author Background":["by-men"],"Number of Pages":198},"Read In Year":"2022","Page Count":[198]},{"Id":"Mon 05-09-2022 to Mon 05-30-2022","Started On":"2022-05-09","Finished On":"2022-05-30","Book":{"Title":"The Dread Wyrm","Cover":[{"id":"att38qrw4fCOmlFSc","width":267,"height":400,"url":"https://v5.airtableusercontent.com/v3/u/49/49/1768197600000/rFjohReTizfmvjMi4usD2Q/d9OavmITK4F9oU62kFgrC61yxrMhiveQdqWx8o25UPq4C6SLNv_OIjBMpUc6cJJ6N_ny-H4dBo9vKgEAV-f9kV7pMeyp9_QxRORdwjzuroNhQtjfWPhOF_zMlr9VvX0eG5j5UNXSQ2O-oroI7yJEzQ/27rQJLpP__PiI-asVFfnLxrcf_XXmD8qIx8iSYkZsso","filename":"25746659.jpg","size":31573,"type":"image/jpeg","thumbnails":{"small":{"url":"https://v5.airtableusercontent.com/v3/u/49/49/1768197600000/DZYUBPb3KhCoQ9xcfW0yug/hyiWGrFsI69MDi6P8ius4qP239r2Eu4uCIJotrIDAw-u5j7YS-umhWDNaOS0dJhcTliZy4Z8A0okNNqE4B_riToOiar-O81buFSAbdjIyekc7H9LKBFdS1oQXFZrq5VmBXQhvc6i1cForvdCghyFJg/RAgDd6lKpWbHGZOhmIm0C-IgeIbLou7Y6r78gaht6iw","width":24,"height":36},"large":{"url":"https://v5.airtableusercontent.com/v3/u/49/49/1768197600000/nFIeSPczdjs-wW09EfqE4A/PjlNgq9Y8UHrDzMEJloVUe2Rqz-kFcN5amtWx6bTbmsZbbYfqQ2bvRNjCJwdG3Q2vdN7GrakyLtd2-FuarkMmpN3Ytal6piBULciolsvMjSDVdNAJCDt9ICOy3lvW5o2ySlr48O4gmZ-fKwiWloFUA/yxf11iA_514mtsOmLhrxX4l1kV-ICyrnm3dP_1R_At8","width":267,"height":400},"full":{"url":"https://v5.airtableusercontent.com/v3/u/49/49/1768197600000/LehRaotNWIOV1jkM7al5eA/W8W7YrA2u0wQv5uKO6GHO9CR65KTbHnNrZhVHxfgu-KaSX7_Mj47msF52N8nBtnugi_oTZT2DJMotQ5IrFyphntrWIXMm-2HVv3tSw7p4t6qyUQ8y0ttIMbi7Ef4VE9iQXGu54nZB4ktXO6NjfcCtA/9y1XLSpMl-IQ7vc-FxASERc8sQW_KEQ9vkc48CXJarQ","width":3000,"height":3000}}}],"Authors":"Miles  Cameron","Series":"The Traitor Son Cycle","Series Number":3,"Readings":["recBmTnH8JA9PUKHs"],"Date Added":"2022-05-09","ISBN13":"9780316212304","Genres":["fantasy"],"Author Background":["by-men"],"Number of Pages":608},"Rating":3,"Read In Year":"2022","Page Count":[608]},{"Id":"Mon 11-07-2022 to Thu 12-01-2022","Started On":"2022-11-07","Finished On":"2022-12-01","Book":{"Title":"Shards of Earth","Cover":[{"id":"attoV6HGcl3Av7vbT","width":260,"height":400,"url":"https://v5.airtableusercontent.com/v3/u/49/49/1768197600000/5Jz8P7Ja6Zaolw3VMcWaKQ/fxoRXIDKxcTbaNEcBJuBsJC7ONgglsa4f4my-Atti4_PYzJiJD3Oclad6zaYhBgzC9IArqQZf-wp4CBJJ3D2wEFzbD79dq_TuMwic_Iarz2pLxCAn9-ab7Gd8r6IZmu143czN1_he2V-9uFz-9i40g/PqAj816yBC5oKKeG6ezvK4CSDgeK7HuFTyj_1wKVEt8","filename":"53019456.jpg","size":92472,"type":"image/jpeg","thumbnails":{"small":{"url":"https://v5.airtableusercontent.com/v3/u/49/49/1768197600000/QoX_2FU6m-5Gua_pJra6ig/6HPz0zbpoBoBmxSWvw_S-oIK2bL08d3d3vDQPUhAC6HYzKlAfF1f071LwkddrhLH6JjB1lVvggcWmL6CqlHdBvxYp3QnvDXPY9G65fPKcCVR7253dn6mwwuBVJ_oWdGbZxF_CiPplSQudXTOlBA83A/2IlVXdYuJ-k9w7z7sAZpwitgJEbt2AQslBqJB0KD9tA","width":23,"height":36},"large":{"url":"https://v5.airtableusercontent.com/v3/u/49/49/1768197600000/wyb6oFitHMLzQtYklMedbg/EAeTL4ByZgA3FDJL_yLlSJt9imngp43uCf27ZOfMmurRXDg5bWCuzp6qLfa5j9UrzPl5fVD4G3VuKpMEauFS7NcrXaFQn0ikBn2BUJvjT8IVWIqPbjn4j-Z1Ou30N8Sy__cBaIb5XMI5B7HH5trFDQ/_s55Htvgn37a4dwfqpbR7oFoGqvSesRVeiAh_nOopXM","width":260,"height":400},"full":{"url":"https://v5.airtableusercontent.com/v3/u/49/49/1768197600000/l_aMbQgcYSvt2fM6F8BWuw/DvFiJ_x4utfDtc_AMe02yMn-95oS3POjwAO786Tjl6sFU1sb8PSayUTe1Vs53ql9QAT9Ja4On4uJ6xwc8pkA7wgYfrgNKoynS7QzoM1oY4TVQ_yZwG-UNjXAqYzamr_iYXCrtYu3DKV_MOnId4JVwA/1o0gfVnrlZQY5dt2Ct82MMR1CLWqpqC7k24LX_LYF5M","width":3000,"height":3000}}}],"Authors":"Adrian Tchaikovsky","Series":"The Final Architecture","Series Number":1,"Readings":["recD6GkyY30m15ZCJ"],"Date Added":"2021-08-03","ISBN13":"9780316705851","Genres":["sci-fi"],"Author Background":["by-men"],"Number of Pages":560},"Rating":5,"Read In Year":"2022","Page Count":[560]},{"Id":"Thu 08-18-2022 to Sun 09-04-2022","Started On":"2022-08-18","Finished On":"2022-09-04","Book":{"Title":"The Discord of Gods","Cover":[{"id":"attvkIvbGj9pgQn4N","width":658,"height":1000,"url":"https://v5.airtableusercontent.com/v3/u/49/49/1768197600000/8Mswq26Hsw4KMxeIG8Tryg/aQZm4FYiVcHLbKoObnFg-ymswwWBCKx3WBr9S3BVNuxUt51jF_s_doiZazIOeUM4xNmlFrRjxNcd0hwmwus6v99wRhvH1FSImJLHCZndsNER18-BLyKi3VgoqsZ2W1OFiHmLMaFf7cdkgTmpZYIxFg/yqae7nlVFOfNtOS5VRZL070j8a2qmYLvLkd15LOALxw","filename":"57693290.jpg","size":470597,"type":"image/jpeg","thumbnails":{"small":{"url":"https://v5.airtableusercontent.com/v3/u/49/49/1768197600000/OXl8-7fvjsR_MOjPaLmGmQ/aHipRW01GNqunCM_t14CL9xFJ2_O3Kx0Pi47YNZ3PRa7CLFHE3KrQt24V-q4zX6g5AaDR8qAfLyUvflQrgcdmM1UXuUFuRrqEa6wIbmCcOnZIjvwKYPse3sY63dnOcsSrGohb_hXbhA0uoVcDyJLgw/tTi4K-IYkLwQZK49DdUtL6XlKbhad8VMTa8IC7wNno4","width":24,"height":36},"large":{"url":"https://v5.airtableusercontent.com/v3/u/49/49/1768197600000/5VdqbK-HcqHbdHSZVqwVmA/T9O7rJDjIiR3ZEgXHcmaurvE6PuPNkq-SztmkNNHEnAxhAL5Cav7xexX3ldaL8y2LOCpxjODlqvFenuX7nlBLeayjh_aaVfzdvgNhB8nX9mfPEaUWmrTsfCqmq6xy4DJDnVNtg_yLBW48hGMGIF9vQ/I1bUIzh-UdSujgujx4F5SUDDrBkcIIETS1-jvp0mnIQ","width":512,"height":778},"full":{"url":"https://v5.airtableusercontent.com/v3/u/49/49/1768197600000/m_gre_j396GrEegJShwyMg/ExmJ-b_oiRv2-NtsYU0fTKn01I-k1s3qPMw2ZMwYizRH-MSSoaK8SYmbdHqKwo4nrcaPSjNN3P0zXOn9oYLJ3VHaORfshYmlztGeMzWm2dZuWFQOAd_OhGfWOxGQJttcRgDpMFDynprosxbt8IXe5A/FZxMV5QydgkR2Uzy2GAnjC3mW8L6KwwiO3n78DRoUrw","width":3000,"height":3000}}}],"Authors":"Jenn Lyons","Series":"A Chorus of Dragons","Series Number":5,"Readings":["recDrpMNa19Te8ypb"],"Date Added":"2022-08-16","ISBN":"9781250175687","Genres":["fantasy"],"Author Background":["by-women"],"Number of Pages":512},"Rating":4,"Read In Year":"2022","Page Count":[512]},{"Id":"Mon 01-17-2022 to Wed 01-26-2022","Started On":"2022-01-17","Finished On":"2022-01-26","Book":{"Title":"Magic Shifts","Cover":[{"id":"att4CYjnmSu2oeCoz","width":315,"height":475,"url":"https://v5.airtableusercontent.com/v3/u/49/49/1768197600000/PCaGmH9K1t5NDYFPMkwAdg/nHK22E3ir1duXkK3YPwpfSC0IIaxMuhOMRjI7WECvIaeznSG5fKs1UPjkFu1oZEJjiw94XUSytra7HWmA3_5FHp5iANAC_7bAva1JgkShJrQjs6HZQ5glHMBsM2EbQIUuf_28EdSsDUI8NrJzEa-Eg/m1zJ1iEFGzVo_x2rvD7CpL3PXvnzQ8XOiWK-rvbwUJE","filename":"17333171.jpg","size":44414,"type":"image/jpeg","thumbnails":{"small":{"url":"https://v5.airtableusercontent.com/v3/u/49/49/1768197600000/iDpU2c3IXWCWJsv4xIm9xg/J0YS97DTgbOHwQupPvhfN7y41m_UhfonKLP_ScmWJmBoIF-AhAFiYqZfyVWGNHGOzAYX8O_2OgumMIl86kIYscGZ43r16lJm3_WktjEVuqamcvTsAJUO5RC7yj42DN1BYmZ0CHHdu3S5tm98PpNYJw/93LgG2X4QLxap8IcClkEPH8d_f7z3R-GzaMNcDitCnM","width":24,"height":36},"large":{"url":"https://v5.airtableusercontent.com/v3/u/49/49/1768197600000/TsaG-eyCcgih9BCaW4Q8aA/N6F0UUSPYHg-IYg9beXzCQN_7Eh1-q-s1waZlkgTK0WpjYX2ryWlzaaZC8OIdQ-2-xCYEec3kQRGo7hcnfQU-kfiIyW3tbF-HmRHGMtM2rKXiX8Q4wyOA00qkm82QFsY9-BhE6swuBg0OCKBGPuauw/E5t0D8K1sbn0mpBUgubl6KKy3NV8mXzJO-fkoLPztgQ","width":315,"height":475},"full":{"url":"https://v5.airtableusercontent.com/v3/u/49/49/1768197600000/iaqC0SODi9tv0iBf0k-UFw/I-aeS80nUQA4UyEVzRIBYLKquLoEV-q9Sk2AhWTKmiahi0QzKNX1JiLowdofzd6P7XjrrzD2D68z0nuZf8uoYtUZb98UMVwU2H4bd9MIlzSqjy2sj3RgY-qYmiipvd8Os-INLm7RkIjpw-Cm0w3ifQ/es1cYXhSiRPMX2Paug6rZTzSpacv8-xS8HcO9svGbAQ","width":3000,"height":3000}}}],"Authors":"Ilona Andrews","Series":"Kate Daniels","Series Number":8,"Readings":["recFI2ZhF76WkWqRz"],"Date Added":"2021-12-21","ISBN13":"9780425270677","Genres":["fantasy"],"Author Background":["by-women","by-men"],"Number of Pages":342},"Rating":3,"Read In Year":"2022","Page Count":[342]},{"Id":"Sun 09-04-2022 to Sun 09-18-2022","Started On":"2022-09-04","Finished On":"2022-09-18","Book":{"Title":"The Widow's House","Cover":[{"id":"attfrnmrYlajiaGCH","width":257,"height":400,"url":"https://v5.airtableusercontent.com/v3/u/49/49/1768197600000/6G5RllGOJBgj5tbIfbWbGQ/nBOLLLivI2mgG-8tDjiqCv19Iom6e9bbuJlcxg7rQEz79VCfGuFhkKqxbJTUCwYSLAR9SiNZ2LzrRfARqOVQdIBK04yY_ATw-SmQ6TEXf8mKTHotDeJ78C2R1V-QTXWhVN4achsYCdQygj5q1ICQtA/SE_hlnMwYvxB8D2hCWByeR6JmbZ_hww43yglJlW4g9I","filename":"18458800.jpg","size":44021,"type":"image/jpeg","thumbnails":{"small":{"url":"https://v5.airtableusercontent.com/v3/u/49/49/1768197600000/A-Kn6sIo75xtVXoWSM3M2A/hkrWUE2wTJZ_4kmX8yHqXrMd9iS3HyEZISQqLEnnDKCKnxlZBwWMeaMYWg6mFvc9tKwc9PKZDsdj5Gq-fmNeNpBgnMSk7QtC-JXPKVrCmN4YvHNGQsjjjplw6XiooifnkUK_mrL2LujZn8PtPWv-BQ/alEq6DeYcHGHbnXlUnlgUfWUaCleG6ArPR8nwXUyzqo","width":23,"height":36},"large":{"url":"https://v5.airtableusercontent.com/v3/u/49/49/1768197600000/ArfKtTNN8gSV1w2RrMOqPQ/Zif8llwLK6ouRfpnIf8KsKpMYb2Ktz2yl0zNml5qdhZFgLLIT5wms_fQwQtb_eTTfMaokXfJaEnoHOOIw8LyvEqtVD14Vx9-r9kiVZVhl99hIBHGuuIxTuFq5DNHb6wYD-ogrFJdI1bp2LV1H8bs3Q/Wl27n7CTxBNv5e5YlNgciyZoWuLXVdHEk1C8udTP6FU","width":257,"height":400},"full":{"url":"https://v5.airtableusercontent.com/v3/u/49/49/1768197600000/PaTDKaT0kynkqwnohpwh9g/Q5MYDqLGCrK_aTZJroTBLmoWYtUUIwEfj-wpbppODwymoZ6Ahx4rwhv4-bUAzIenQF8Ir4remMAtFiJKw9AbzBW-dOqQm2KGU9uEwj6Ug8nZ_YzRnpEwFp-M1q0VPjgm71ljg3hrYkHuYJFhypB0_Q/7SK8KCjnNCNADZg1WcSGeozJU7Ln1_1DC8XGtOVv7ig","width":3000,"height":3000}}}],"Authors":"Daniel Abraham","Series":"The Dagger and the Coin","Series Number":4,"Readings":["recJdDfVIcTpmvJhy"],"Date Added":"2022-09-05","ISBN":"031620398X","ISBN13":"9780316203982","Genres":["fantasy"],"Author Background":["by-men"],"Number of Pages":495},"Rating":4,"Read In Year":"2022","Page Count":[495]},{"Id":"Tue 08-02-2022 to Fri 08-12-2022","Started On":"2022-08-02","Finished On":"2022-08-12","Book":{"Title":"The Origin of Storms","Cover":[{"id":"attUcYED1sutldk0x","width":938,"height":1425,"url":"https://v5.airtableusercontent.com/v3/u/49/49/1768197600000/B4-qg_O3cf3MbyrZU0v12A/l5Cg3vUGSqvBoLxLuWwEgynISciCRjjiDaZ9U7d_8JcLldiDRGcpE6FfuvxfVxwLfvI_DLIbCDMxP_w5sfrcbO7yakxI95eDlBjjN7LL4CThVPUrHVRXB-kG6THCh15vlGY_P1ZVfdrmaIh95StAeQ/fXKdoch5fMU2vpoDlIQIDiv4UgLaS8_IqwHpXxSXTiE","filename":"58724951.jpg","size":307065,"type":"image/jpeg","thumbnails":{"small":{"url":"https://v5.airtableusercontent.com/v3/u/49/49/1768197600000/W9kmcpc5h6PEcISR0H-m0g/GRwcf6D824cIPaJXqXZEWu4H8QpPu3qO2AWvZgMYkawbCyIYs-Zp9BI7Ywof7fDEC4tJ0BoxLODGSi8Gh1j8Vc5h4zhOHcQB3Z0WQ6Eb9Y8QD8RcbvqS1rDzSxkuQ4vy82U65LmwH3cKGW0wpggJmQ/3XMcLpNoPMyJOkkyTUAKCsMDjO4AEb_ZRz7um1vJnC4","width":24,"height":36},"large":{"url":"https://v5.airtableusercontent.com/v3/u/49/49/1768197600000/BRqcUyOilw3yd-qxMj1pjA/z9l8PkYc_wY02_eb41FaZNspXJvXneia2Ejxtji-W8OfcRZOkALA-hQCkJX47gTNsq33Ez-TvkFp96mnmOOLrrgFYcnqeNXBcFBtY3CcsGKbwLSJ_CAXkCNVNbGBxYto8v7Hbi_C3Yy_ucyGeggcuA/krwMDpIPQX-GfGusjqTLSV2iZ-GwulKd1tAwZ4F8YOw","width":512,"height":778},"full":{"url":"https://v5.airtableusercontent.com/v3/u/49/49/1768197600000/9qAE_cnuet8HZ1fee0JSDg/UJ6rk16xyd5m7i7Jb4Tz7ekLn44IXD4sU6_ZAHHfH8z4uw5uCqjYvLhyJqNKnAx8fJkR1nFEOfKIB993CQjwXEQ4qu7VXgKQ_JmqQk5Pi-FvkkSGUJGFDxsb_2ndf_cKl9L-IIQuD9VT7C5nqTu8Ew/fZIWj3Uv1V0bWQAWrcEkh9ajnyEkVtXQpjIjFjexuCs","width":3000,"height":3000}}}],"Authors":"Elizabeth Bear","Series":"Lotus Kingdoms","Series Number":3,"Readings":["recKjgy4Fq8rRuwxU"],"Date Added":"2022-06-28","ISBN13":"9780765380173","Genres":["fantasy"],"Author Background":["by-women","by-lgbtq-author"],"Number of Pages":384},"Rating":4,"Read In Year":"2022","Page Count":[384]},{"Id":"Sun 04-10-2022 to Sun 05-08-2022","Started On":"2022-04-10","Finished On":"2022-05-08","Book":{"Title":"The Fell Sword","Cover":[{"id":"attmcwUPWDHqN5pSi","width":307,"height":475,"url":"https://v5.airtableusercontent.com/v3/u/49/49/1768197600000/TvKabWUFHwTSL1AjW-PvPA/PpYSX2y0qGYxsrx6VNUONBBpIGSyM75VHpGDXM4YPQhMidNZ3S3rmKkfAC2HdUnpf6ZXHxiMwLNcFIqe0bp2434bfF2TLNDRrx7vryQ9PVaTvvP1WhL0o7CdNr0higjYS-Q95D8gTOyw6q5T4MFwqQ/oH0_aG6MqnFMcPjQOwlTGOiUnaz23R5sUUcOgJ7RCTg","filename":"17737893.jpg","size":38784,"type":"image/jpeg","thumbnails":{"small":{"url":"https://v5.airtableusercontent.com/v3/u/49/49/1768197600000/NfgOSUJEYrXGL6zm6y81vg/sUx1SaNek7YGKwrsORCnO-V_5MKqTa0kVoOfhVVQAiJi8oLtelmvPZBUe3FznQ4KG2bmudtn7KicRmTQ4Jx5IvmgzeVBeuqFQEwbAiGjeiZgh0a-7hLUkKRZOvdr9ucD7zslBn-pPVQG2xd2iCEncw/9rYMPflfpixIdnXkH0x5wVuru6ZJtBVUelxJwD9Gs8U","width":23,"height":36},"large":{"url":"https://v5.airtableusercontent.com/v3/u/49/49/1768197600000/voQ3iBXFiSwAoDQ4of56dQ/LmBeUjQMykr5IxsZbcJV1nIy2GwNvDf5yTnDIJKWiK-5g7Hjb0ZpslBHq50jCE8yAIM88vYnMm-o-yN9Itl1Q2n8d84fVTO9R3xbY-OER9XZDZdIw1S6vzNveoON0BHVVVBvvb1KcgtB0lBu9J1YYQ/hRQZOuSmawv7YsQ6on_6CSdC6YiTKU44oPSZif5zx3E","width":307,"height":475},"full":{"url":"https://v5.airtableusercontent.com/v3/u/49/49/1768197600000/rnnD65aJSd_ncBQjcS7ntg/FoArgKoaFgamJstYflRiHF0rSjxaP3LGVonHP009Ar8YRE-w25He2Dzk7K6liDbKMA5LHONJTkV5zLrOKUOeawfsa7v4FUX6QQqeI4XmoWBqw-FWx8e4AaPDgpR683wMgysH2NRk5ZzHiJxFMUO7rA/8fy4iPc5j-hHEpSUg2MEjZ_0-3hZ9RR4FOxa3NmXo-I","width":3000,"height":3000}}}],"Authors":"Miles  Cameron","Series":"The Traitor Son Cycle","Series Number":2,"Readings":["recNBrrKQM2mLAb17"],"Date Added":"2022-04-13","ISBN13":"9781407247199","Genres":["fantasy"],"Author Background":["by-men"],"Number of Pages":606},"Rating":3,"Read In Year":"2022","Page Count":[606]},{"Id":"Wed 03-16-2022 to Tue 03-22-2022","Started On":"2022-03-16","Finished On":"2022-03-22","Book":{"Title":"Escape from Yokai Land","Cover":[{"id":"att5PUODUjBXxGaK9","width":331,"height":500,"url":"https://v5.airtableusercontent.com/v3/u/49/49/1768197600000/_LkMWXplvBaXxZS2ALmwxw/NY2NUozUd2Xgjl4-TsVtfVP9YCA2lhJpl_vZsZuVfhnUilATVg13EtOigwobWJG5W-l4vAOokiGrYl8cfSAgQwcRAFPUQXQdCQwYLlr9Tmi9dsqsWu4QvTOSDP9nxGaMfaODShCi86_PI6JXBr01zQ/K8s_Cj2jdr1CZvslj5KiLn1URmjjpD8mbSaBBTtZdTg","filename":"55315501._X0_.jpg","size":36908,"type":"image/jpeg","thumbnails":{"small":{"url":"https://v5.airtableusercontent.com/v3/u/49/49/1768197600000/zz61nyUOAazwmErNtTw0OA/bfrhN76nv-lXOaknDHy_H5gAPDb2wAv2NDKKpZJ9xaK1y8iCs9TyCHAymZHaj2ZQIuRq1XXUCBhR8GLCencofFw_yjwnIwpuq1odQ0EiEDoFPbPHKCQs5eGT2_CMZHN6_6luSjDnbyJy8ypMw-6QGA/9V9TeYmMSbmPKNfnBM6_-L2wZFvIuO2KhVFiReKF-Rw","width":24,"height":36},"large":{"url":"https://v5.airtableusercontent.com/v3/u/49/49/1768197600000/s3Wpi9oBuaDa5CAZtSLx-w/nUwrKqRrkNKT9glHky3QGMnTP5YTZ12ysqpy6yalr9YfRdaee4-zihnYBWa1NZ9T_89C_dhSeNXD0eXlUpTmmmAZuXYBgYITpjheemdyX1jI_xPSbx5OP5e8KZ_MqbEZulfHUZ7T_u8wk-_041913g/SDo3d2ns8oWvTHPrxnzU-qENSw_6_bU7JYf229b3k5o","width":331,"height":500},"full":{"url":"https://v5.airtableusercontent.com/v3/u/49/49/1768197600000/Yt9urLrdpGDYmGr_1xHorA/RC953H8W0U-agD9CIzgoNhw7B9bMAiom1AXN28HuS9PwcHeUpXXsbz8QJB66O_mtpRjwRXpzitA-NJWBpFtf8cj-J9_xLM2GL0gl8WqI6PPjIXUzC5kDGrbBTEGOpjeye1phf7_75Vqu0o9MhtxttA/OsKkjOMeFEOdCG3E_Vb6ufF0b2UFgyROCslockVcE6g","width":3000,"height":3000}}}],"Authors":"Charles Stross","Readings":["recOgpdhX9IZr4zV5"],"Date Added":"2022-03-21","ISBN13":"9781250805706","Genres":["fantasy"],"Author Background":["by-men","by-lgbtq-author"],"Number of Pages":96},"Rating":3,"Read In Year":"2022","Page Count":[96]},{"Id":"Sun 07-17-2022 to Tue 08-02-2022","Started On":"2022-07-17","Finished On":"2022-08-02","Book":{"Title":"The Red-Stained Wings","Cover":[{"id":"attPjlWqmRhvvZkAX","width":198,"height":300,"url":"https://v5.airtableusercontent.com/v3/u/49/49/1768197600000/r6KDX8DrS7hBLJxl0QsEAw/RXrz9w_ugugIl4DjVtbrUa7x_-bsbWFYGlFJVmATrRaQlvZRAHY91TPKkdQUp6AlI_2BHjWxfzIJgsUAC00FEDkM7PxaMrGgi2YeOzElyp9q2uZT5nNlAdqXv4R3tTszIgq_v2-agPhEq5U45d56hg/38WQ2Pyw-O9-KhIL6KC6ublUUAZZVpFzy_m7PN8U7HE","filename":"41555952._SY300_.jpg","size":17724,"type":"image/jpeg","thumbnails":{"small":{"url":"https://v5.airtableusercontent.com/v3/u/49/49/1768197600000/5Hzoh7WlSUo4reBLXkQDCA/JW1PMnWk8BXObLBxJ-jlVdJpoqTpGYE1RLz8cDmE1JtGlGWKjpNyRDPk1H1nFtqthJq3f3amWbAzxy2-1Xqeo3HJVBkRwIzYS8X-2xmTE2_MbB9z8P6qbape-UOV68TTh8x8OqjG5GeV8YIMEfQS3w/O2Upl3rTcT74CfjR3qCpEll6RGLUDLqiH3pGBknoK7c","width":24,"height":36},"large":{"url":"https://v5.airtableusercontent.com/v3/u/49/49/1768197600000/wxDO60vyXvoq3I58kSbLxw/WkgbQxsNztCQFkrH0a9w-m9Bcm2Wn8cyuKIOaCPFwzYnzm_r0Z7lmg_qaVrdnulAtxbIuAAZD5Mae5UExzFnZ8BP4ShtwuSX1n4zf7KuYkozUGrhbAHoHIox6BcIaZVkPsoOWJD6LXq7KUX309dzjA/V6XNVMRnp2447lLBvrqIMn1gW4-yZfmaFOtEx5bJPGk","width":198,"height":300},"full":{"url":"https://v5.airtableusercontent.com/v3/u/49/49/1768197600000/qFEYZ9_g99GLT5yM0BhX5Q/57TYRbAQEhfxOo46ob5a4yWDWqwjkBf_OwxFBMZ-9bCyxlmG7c0nqoT5Qu5T-q8nW9eTYWjsycF1CujQMIugOXdEQ7iuYQekUQVL8xpCahUeDzTiAWulfbsIcac3NH9J8KXbLMgbWxZJ9Lt4TJnmuw/AgpcRlTnN4ELkN0qEUQktKmaw9PfI8W8wwTOhNNQUis","width":3000,"height":3000}}}],"Authors":"Elizabeth Bear","Series":"Lotus Kingdoms","Series Number":2,"Readings":["recTDCRcf7l7ZMMYj","recP3BO4FBxOCrGUW"],"Date Added":"2020-01-19","ISBN":"0765380153","ISBN13":"9780765380159","Genres":["fantasy"],"Author Background":["by-women","by-lgbtq-author"],"Number of Pages":384},"Rating":4,"Read In Year":"2022","Page Count":[384]},{"Id":"Thu 02-17-2022 to Sat 02-26-2022","Started On":"2022-02-17","Finished On":"2022-02-26","Book":{"Title":"Magic Triumphs","Cover":[{"id":"attxzlP7xK7nYxb5b","width":314,"height":475,"url":"https://v5.airtableusercontent.com/v3/u/49/49/1768197600000/2pdlGY98gSENoulU405TXQ/NQcYOCeYaIV2FKrB0FqOLmBCotzOnCI3k368jlAMo5WQDl-n0a9OKAM6G0FOrji9O6RmX-82SxYxy_DUUmUksJ5wfBm4Ct_nVVnLlwNQj0XactUEtj0SsBqx7ZPVoP81qPNxwHAq7LRNAE92Jxgudw/gpvaK1U4_ctlsBooSVxF4eeu_xNKhx5Nisb_Y8THnFs","filename":"17333180.jpg","size":82313,"type":"image/jpeg","thumbnails":{"small":{"url":"https://v5.airtableusercontent.com/v3/u/49/49/1768197600000/ZRSKMc3mij6ryagLDCNZVw/M5So9J4keEUC0gFzclkExoE73xGRFcREVziTEuJTbC_FFfkH2brJz5N7VK2uMCXS7DgnlzwCgKZCrypxPUS904M1TIou38D11YHHY5ixuHhXQl51ypRc0I2WM4HDF2yBapDmjGNF3OOPlidB3KHdfw/uWZ6VCrlRGTHJGiuBye_kIamvYWgXSkNg4Kb6FZObK4","width":24,"height":36},"large":{"url":"https://v5.airtableusercontent.com/v3/u/49/49/1768197600000/kJdatsPMXF2UQVWnToGbgg/qudOINpv2TM__5LjiAd5MSmSOq-DkY-d9c0y5d6fR-JSWjw_7QH-bMZCtPUhvbEhtIiJYo9B3-UDfg0rivn-5cYeyxEHKNcVESPCXn9zmNKMTNVCh-c9VZoc1CUuOWjTZ4xwp0ZaeEMXo4aKs1BCHQ/6M735ErRKNNOBrnfNvTU5mATd9PV-WRG5cCTwsLNMQg","width":314,"height":475},"full":{"url":"https://v5.airtableusercontent.com/v3/u/49/49/1768197600000/uPe8p9lWonxJluzdOeYb6w/5jf7qwj0IGS4bt_fo2MjBLI1BJxeEM4JJuONxbklmxlLdlzdtZ9jWRhTfhTH29H5iQ3Cai9maZypko4gG9-ycjZQ22gAX2HohbRh_DXYz4ZEbmfm95BrHhhhosT50S8ZRe42x-7hGyEEzkqw0hoGjg/49VUllWlM7wqG8bttLZH1faLTU4wl0Z-qv8FQewHDy4","width":3000,"height":3000}}}],"Authors":"Ilona Andrews","Series":"Kate Daniels","Series Number":10,"Readings":["recSO0RLgvaOemSSb"],"Date Added":"2022-02-07","ISBN13":"9780425270714","Genres":["fantasy"],"Author Background":["by-women","by-men"],"Number of Pages":327},"Rating":2,"Read In Year":"2022","Page Count":[327]},{"Id":"Mon 10-10-2022 to Tue 10-25-2022","Started On":"2022-10-10","Finished On":"2022-10-25","Book":{"Title":"In the Shadow of Lightning","Cover":[{"id":"attzbzDXvOxJnLoFl","width":1684,"height":2560,"url":"https://v5.airtableusercontent.com/v3/u/49/49/1768197600000/RIF-1GSdTZw7A2jHxVa3Bw/H9vqftr4vDIW2Jr7xDXCOy_YWGxpwqwRIcg7Zxmyk-_3N2cKP923Px1yGEqh-XHLpmYcma3-6MKTEoHBVluiP6f1ykSuykO9fGA8IHGBB2yxBDcQr4vgjLfDRccpHlb_ISel7kewiDQryxJ-AUKcJw/fgCsRN6U11WbI8iDlXPAgA3yG5LwhQRGfpIAxJwVPVo","filename":"58724872.jpg","size":738921,"type":"image/jpeg","thumbnails":{"small":{"url":"https://v5.airtableusercontent.com/v3/u/49/49/1768197600000/H35CNs_iBJJmyFqCkKxarg/5I4w5o32Ur5NuNMkIvHbpg66z16PDw14DSB_XDdlt0-0qGaEz_Drt5xUtm6R1hhfk-a7ldBsbzoa7G1Py5YbH75KY0-kxzb6lTqt67_6qUSFiRFQtDGyk9p6f6NPQiDuftxusRR4lCvofcyqQneumw/qDpbSChHCXW9cleoLpYKTiFXPJA6d15kWklYvSa7m_k","width":24,"height":36},"large":{"url":"https://v5.airtableusercontent.com/v3/u/49/49/1768197600000/shm0p2kVF4oPFgAea3VknA/sJUFDqrYO39oRM2k6rjt1nCigTFoj8Y7W6wX-e0d0Xp3aG18aENuzEiFJ2hEuBvQAMpr99OvzCQVVImt_7aMOYrsXxwa1xF7Q_1LpQAudY6_0Uq046MdFPqkt-LQMCZS_Tj-vD1qaSm437igb241TA/QbPgUf37XugIU-Jg81oRQToF9xH7GHkxuF33czku680","width":512,"height":778},"full":{"url":"https://v5.airtableusercontent.com/v3/u/49/49/1768197600000/1pe6JxNMP9eHeKrfkB6npw/gK8YVNRPvEOCguwgjPOJHUcALvQ2z9BSkc2SdY3NAY2I_mwTno1-exNuG31JNC4M1w23G0NU12gtr7wc02lQoqiRDhPpB0zEQju1ah-y5cU8clnpi9Y9_zOHP2lk9yaxXs7HAiX4P7lKGMcYqmxt2g/dbfbIH_3MPuISb5kNVWXJmB3XvjVEdrZPtAJEBi0gbM","width":3000,"height":3000}}}],"Authors":"Brian  McClellan","Series":"Glass Immortals","Series Number":1,"Readings":["recVRUnq6wwlTHW88"],"Date Added":"2022-06-23","ISBN13":"9781250755698","Genres":["fantasy"],"Author Background":["by-men"],"Number of Pages":576},"Rating":4,"Read In Year":"2022","Page Count":[576]},{"Id":"Wed 03-02-2022 to Tue 03-15-2022","Started On":"2022-03-02","Finished On":"2022-03-15","Book":{"Title":"Quantum of Nightmares","Cover":[{"id":"attFgrkoPcrUXoip0","width":257,"height":400,"url":"https://v5.airtableusercontent.com/v3/u/49/49/1768197600000/cF_COxK_ohAO4RpLWiAQLQ/ixC4YjrerF845G2e3Eqd8Z7ni9WDowT98b0m7aqqaNKYhyMn3LjE9M18NQtHa6oH4CnHOTVpuDEtheyez480ohE9XWDFosQH3TD2PlStHTFGJhG5N8d3tcAL8h0HVJdIQjc40GdlnDhUSnhd_yRpNA/I3b9GBT41Z_TyoXMruO_55p2P7aeLiHGjSQDvcsN4xY","filename":"58532243.jpg","size":95837,"type":"image/jpeg","thumbnails":{"small":{"url":"https://v5.airtableusercontent.com/v3/u/49/49/1768197600000/InLZanG1AKON9kwCRkoJng/hYDUveVq9TUWjW7xiRVXTiSTGRsuN9V1I2MWvwcKBVoUMRiOJOgRXZPuYBIy7zWEp4da-LQkdGBeeEW6db5sb-zFtHQH6xB5eW3xfAofZHxcqxwLhHtafmqGZe1LkmkByf6ZKWweG5_feonkKcfZmg/G51CQAfNVfcW4iS8R0rT2_pojuMUFPliSA5RBQa9ERE","width":23,"height":36},"large":{"url":"https://v5.airtableusercontent.com/v3/u/49/49/1768197600000/0w2jVEelZu852loLULViDw/84YvaseRPD9gn7Rn2ePmK5f2eywo6SapCv5_StOMnprqq8gX2FeWId60bD7JniZDiA0StVkR4VLhMiwCk4-ZAjlhKN4lexUlODRzcB2nEwZ-XKpsJzHmIuoP4G_77z9wccacoRSwSwZUWLLgiW-HqQ/4Hru7wcUYYKygWBavIs7f6RIcQ-K7WKVsQrsISxU6tI","width":257,"height":400},"full":{"url":"https://v5.airtableusercontent.com/v3/u/49/49/1768197600000/UaPvcIMoREzPhUsnzSBz6g/qII0hfumHFma9Hx8NWqnbjpH5qErJWJANRxcp1uhjSPuyycqLO246tynrrqBJPRPRfcJu3P00xj1foc1xOmy7Fy_Az7jHiDhYmGP1zsftS-_WKThsB3W5zcXOuspBBsFBJxRBnCorSuZtFtZgV6THw/H-rlJYmoaaTappcKWocLehRlMmdnRAUT_LXZKoUTFs0","width":3000,"height":3000}}}],"Authors":"Charles Stross","Series":"Dead Lies Dreaming","Series Number":2,"Readings":["recbGyHlYGtp6RuRC"],"Date Added":"2022-01-11","ISBN13":"9781250839374","Genres":["fantasy"],"Author Background":["by-men","by-lgbtq-author"],"Number of Pages":368},"Rating":3,"Read In Year":"2022","Page Count":[368]},{"Id":"Thu 06-09-2022 to Sun 06-26-2022","Started On":"2022-06-09","Finished On":"2022-06-26","Book":{"Title":"The Tyrant's Law","Cover":[{"id":"attIHDMny9Pmp594y","width":303,"height":475,"url":"https://v5.airtableusercontent.com/v3/u/49/49/1768197600000/Pd9SZfiGGAI7CJQHFbWP4Q/iNWfSYEfR6wghwgPVd5moG9p38N2jak-c8bsYGwKsfbkAP0Zs_sLcdGR93zHX-hnjR2t5ljkUq6mLWDsuDye5ZAjaNwe60iBZaWQOVmQ2s-vzo19V60Gd4vwfOHlB5KFYRITIwkVAuDfXJl-iDT2nA/o4lmzBm75nVmAnZL7oiLIEu6eeQy0251otXGCIVwlbs","filename":"15790816.jpg","size":75762,"type":"image/jpeg","thumbnails":{"small":{"url":"https://v5.airtableusercontent.com/v3/u/49/49/1768197600000/vl30g4-FvbOxNxpJ0wuGVQ/4_3pXmTmcBy6UUFiCB90DzDB22euR3F9cTBtgrR-D9Em_4NkuRczrszQ1vuH6wVFunj1dEs8Ck0wJ_3qJ7I8a0KQm-EUiYTfJrvE2N3GPuA3xU9C7DYCy2ih9Ybk8dWpdePnh1AOgZpRyKbHA9Hg6w/nYs7Lh5zC8E3IM8m3EuAB3i18vGFPiRpbCoJUNNLQ_Q","width":23,"height":36},"large":{"url":"https://v5.airtableusercontent.com/v3/u/49/49/1768197600000/hHH2849wk9XCmSw0nJetPg/JSkuxAmbS1tqlaG-BCBWh2H2l9o4C3lKgtyLON16YpMhHPWPHrrV-9g4c6cuDZXwPnfsBMRewgdxWsPJGvDIragZJ5CQ32PRgmqim5t6Nh1StqmZNrMtCxnrFGtq01riSn44qYLEY3HXy8vNG7X12Q/rUV14o8o1G74Fzwq9aO2YG5mQu5KsIiK52E7nm4QF_E","width":303,"height":475},"full":{"url":"https://v5.airtableusercontent.com/v3/u/49/49/1768197600000/krvhvALkuRowfDFMgheJnQ/__BimxLxgShVSAbymszr_H5wASkLZFbTrnCY2PbB---EIyEr5LJFlFk_mDKFZ_STZE5cv5mWDJXHWmpA1adtxgvc544P8WHcEnw4jh2_d4A89fPRTqxY2I9XtoTz4N55G4sMXo7E0c5909PfXulfWA/HG0ghe0Jnm7OXrhB88xDQBjBhjLpyfHxI0HI7Xsd49g","width":3000,"height":3000}}}],"Authors":"Daniel Abraham","Series":"The Dagger and the Coin","Series Number":3,"Readings":["recbJAimxUFxXPGMH"],"Date Added":"2022-06-11","ISBN13":"9780316080705","Genres":["fantasy"],"Author Background":["by-men"],"Number of Pages":497},"Rating":4,"Read In Year":"2022","Page Count":[497]},{"Id":"Sun 07-03-2022 to Sun 07-17-2022","Started On":"2022-07-03","Finished On":"2022-07-17","Book":{"Title":"The Stone in the Skull","Cover":[{"id":"attNcGeJIVIFA0cEY","width":198,"height":300,"url":"https://v5.airtableusercontent.com/v3/u/49/49/1768197600000/w8OGp42SI5F7cpcXo74ODQ/NJhCy0LPgnFzUoqC2gBVjNSMbpqdaYm984s8NDJ8CLViD9nDzyCZOx7yIRYhtkLt74YYL3NQ4sr1dxbrfaqQQ5leZ73Wf_tmCnTPwYWxqZfqhkAe29G7tdg9HHt-kRIynmxonGXLhzPereNu6KmV8g/HxArZI0HUUTFX6RS1KT0y8_r4qCiD7nvnTweKXRbH_I","filename":"33517549._SY300_.jpg","size":16621,"type":"image/jpeg","thumbnails":{"small":{"url":"https://v5.airtableusercontent.com/v3/u/49/49/1768197600000/RywTZQ8KjaojXmIaB4jBWw/Or2l0BSBGR3X4I0k2XXewFYOehe9snpzmAXLbtgclDRDYH-PTRVZT4p9vNRqpQGpGK8SyRNM77Ru0d9gX-kPnhUZzUL344_zDJADiZFK4cRQ0ZwR4hL9igIn5t96J9cFLoCxDuJl2nBX8Dy0Ij7xBg/8aTomAInJ547XxgkafsTtYfDTrQ1xwmlv2z0WXOwHys","width":24,"height":36},"large":{"url":"https://v5.airtableusercontent.com/v3/u/49/49/1768197600000/LunqR9gugw1zToH0PHEZbQ/8e2VpabKwEoojNpXUVCN_4fOGZKcvEqfgNkHxFiTWZ1DLzNfeH6cquZc5zq9WZ1U9s8mYNpAbada-gpGL0GbedkJlhp152JnuMaf4Z17rvRPCk-lN-jRfhlJ6nSB7HFrj_uN9SI1sfjwXx2VmvpCUg/ROq3aGYWesRVmpHfJfbHdPePags88UsQdc2yUvbm_QA","width":198,"height":300},"full":{"url":"https://v5.airtableusercontent.com/v3/u/49/49/1768197600000/iIlOUpgWiHuhMe8YwWijPg/NNxXqhpOZ46lwq24-TuYCm5JtbqCc2aJ63SqYx7zRo0bjBOdJoJKKWXb-4ZSW_--7rBl5Zuy2aCSh0Ts5MKN9jdhjkB8UWynhHSZOZKowJt4H4MfjzrlgB84n1inb1cWu8OQ9-Ek5_Nu8dC0NNmyiw/sKXHEj2uczfI0Em10dX2TzAgJ3VTBMgrLEbla3D4faA","width":3000,"height":3000}}}],"Authors":"Elizabeth Bear","Series":"Lotus Kingdoms","Series Number":1,"Readings":["recqYqo380ZPJij5a","receW2r7bVqo1mH9X"],"Date Added":"2020-01-19","ISBN":"0765380137","ISBN13":"9780765380135","Genres":["fantasy"],"Author Background":["by-women","by-lgbtq-author"],"Number of Pages":367},"Rating":4,"Read In Year":"2022","Page Count":[367]},{"Id":"Mon 12-20-2021 to Sun 01-16-2022","Started On":"2021-12-20","Finished On":"2022-01-16","Book":{"Title":"The King's Blood","Cover":[{"id":"attWWWLt6oqebLZkw","width":196,"height":300,"url":"https://v5.airtableusercontent.com/v3/u/49/49/1768197600000/OUSuhxnoLZ-HikRLfbVAwQ/r42Wosl4as3YSU75L3etvbp6URS_x-1onuUQALjPdrgqCJFS7jxx4iTzhzjNJ-swhTJ_dEMGOY9VPQPms6joOskVA5Djv6XZYUAZ3aM6aM0nO44F7UX4CC-9nLa9RFbC_-jkXnt9tEwX0-OpNaS0yg/NLyJ0AjuSAEL4DCSQl1elDz4xxso3hhG8h-6UyQfh-Q","filename":"12759057._SY300_.jpg","size":18707,"type":"image/jpeg","thumbnails":{"small":{"url":"https://v5.airtableusercontent.com/v3/u/49/49/1768197600000/Ih-Vq2A_fMZY8dF0CQQBiA/xPC6Oc7z6VgMaqe9t5lKUAZVx2Xhd91ZwHol_IMZyduWCmHLy4XKSvw6jCC9ktq2y_aq8gDVGkGILDKrD7IfFzEPDqtfFdaUq0WSl2VeR8_Lmx0afD7VJlx8w4drJed-Wr0xPnFeYLWmGp9r5S2k4g/WSi4lP_QMkBUmXZ12tvuiIpNKe56RxadyHFi3b55Xbk","width":24,"height":36},"large":{"url":"https://v5.airtableusercontent.com/v3/u/49/49/1768197600000/k8i9OFkppTmX2vLaTsNhQg/04fMdpcQ5YfjG7nbrv4jYP97UOBbiyWZPMi-FjwV5iBufKKECaLfduglEXoIGcBtFHtDeY4dK09QJtKg3CGVDEufRNpeaSlG9UBysEL1BTHU4uXUJgrnWhmf1fnlzhCmBc_Xf91IMtXXBwXC5FEsPg/5em-QM3tskU8z0LUWweoiZIcK3KAQbLygdF9HqyrMAU","width":196,"height":300},"full":{"url":"https://v5.airtableusercontent.com/v3/u/49/49/1768197600000/_0C0FWEy1_l6FVS1NFKY4A/zS8W5FwyEgyr22F0JL0R44Vx5c7wSWCi_cze1yrqC4Rh2_sFutoOUn_bpld3YFhh_1YCEihBtcPpxIzi47ovezTwq4_RJ8BIINVPuIZdJrvRARmgOuSm73yZdH7qtCX495KeJIED8Zi5f3zR5stZfQ/LdGas8IiOJ0zM1glFUdtDwtm_0ls_h7z1vEny_pfBXI","width":3000,"height":3000}}}],"Authors":"Daniel Abraham","Series":"The Dagger and the Coin","Series Number":2,"Readings":["recjdS54N6pm7l4I9"],"Date Added":"2020-01-19","ISBN":"1841498890","ISBN13":"9781841498898","Genres":["fantasy"],"Author Background":["by-men"],"Number of Pages":501},"Rating":4,"Read In Year":"2022","Page Count":[501]},{"Id":"Fri 12-02-2022 to Wed 12-14-2022","Started On":"2022-12-02","Finished On":"2022-12-14","Book":{"Title":"The Lost Metal","Cover":[{"id":"attO0WXa002NAS4U0","width":1684,"height":2560,"url":"https://v5.airtableusercontent.com/v3/u/49/49/1768197600000/h_-YPc86_YUd0HjM7GIOpw/3SxkhxfjK4EmgdzirLzuxA0MOJ4DY984wmnZwvgv-4ilS1AYjMMBWy9TR0U8F4MrLH_HtWUzVSmuAimqnmyWMUGn9KnPE1Ehkwzzvy7SFM2Sz8eGH8T-XkoJ8s9S6sU87-b5U9uw5MPzmnSCcx-0DQ/RpV6TorgTp7Mgdc4OBIV8z8TpXwmWERL9ICFc6wAA_M","filename":"23947089.jpg","size":529712,"type":"image/jpeg","thumbnails":{"small":{"url":"https://v5.airtableusercontent.com/v3/u/49/49/1768197600000/9h_mh6x0VJty1rQpy3Zbag/_ynKga4x4baPaPoNLCqL4ejTk9xTXvm-vpRBuosqQKXw1bQOIX98Xf_GA-K9qvx-9Viej5J6rdR7xPahHipJx_vrn4nk1CjFnutAkFrhrEBAVxeXysLVaCvxaheqIp_cDRBTm6WrfU1hCVckAkTQJg/4e5SkEmuEvxqBmsW7w8pAaIOZRMXyu0rUDl-sBKLQ_8","width":24,"height":36},"large":{"url":"https://v5.airtableusercontent.com/v3/u/49/49/1768197600000/1gFlBQ_JU6GypEwEowcDtg/FOHUSrPr9bU_qa4WfAaSXeVQp8z3eLhPe1U40QGvfezg115e8i3Q7qYxFiWFi9A0OGwb3pUmW37Re5FNf72nYrBO4CY1U1fSvlVNWWScyRdhtzDuhCbEuOE9ju_Cbhjf05mLqW5Mt1Q-KIQuEx9gUA/66nr_Tb87d1X26clTXZhtHvJiaxSk_RHH0o5vJSpjsQ","width":512,"height":778},"full":{"url":"https://v5.airtableusercontent.com/v3/u/49/49/1768197600000/8C1QbcWN55I4IUwGIwikGw/q2Dq9s0KTil2Em40XJPNJpOOiTzUhlGO-B76jqumNAYpLp2w8k5bKVjiE2u7339m2syU7U4E4AqtNRMQSTtC4GBXkNuwV-LpCQpf-BGky-EYDTgbH5Pew8zkRU8tifutJAZ4oEMl3ullEqcd1hTnRg/TtW7241W7bAdNznxkffQxb3ntmssDB9LtSMSHhQR0TM","width":3000,"height":3000}}}],"Authors":"Brandon Sanderson","Series":"Mistborn","Series Number":7,"Readings":["recngE2NKjgEqK6Ep"],"Date Added":"2022-09-02","ISBN":"0765391198","ISBN13":"9780765391193","Genres":["fantasy"],"Author Background":["by-men"],"Number of Pages":464},"Rating":4,"Read In Year":"2022","Page Count":[464]},{"Id":"Fri 08-12-2022 to Wed 08-17-2022","Started On":"2022-08-12","Finished On":"2022-08-17","Book":{"Title":"The Power of Fun: How to Feel Alive Again","Cover":[{"id":"attaV5cd3cWup9iUl","width":264,"height":400,"url":"https://v5.airtableusercontent.com/v3/u/49/49/1768197600000/rbImalkvp6E2aTHwEKLZ5w/heZ7SxMmTI5aitN0r8Ii5ZND6TvjvQCcA6GpCmyjj2WspOfaJERPUwaRtnhOIsCkjqdhzSQ3hnA2GJitZXTpwvnyrtsQyLpV2d6cdZFh30-wNRcTviUR_3U0Vyen8UBuvljxUQKg3feVnxWmcRWB-w/k4BYU119CAyYF29L_rbj0elo048L8Zw4g0zaz6mWztU","filename":"57569793.jpg","size":171592,"type":"image/jpeg","thumbnails":{"small":{"url":"https://v5.airtableusercontent.com/v3/u/49/49/1768197600000/4dkUZinaphdNtAPz0kBa8w/agz_YjIQ6UYMmR3nvutix-LIXQoZGHXMDWrsRH9CG71-4aZWx2acjHYbLC_GCTbC7kZWviT6anHefUCfrTCDWIZpcPnIVsTjlUklSIdhVa62IRws53u3mok969p477OkXTYjL8pcJC_LPBCbT5FzFQ/gj5TjZK_I20pCDiZsIBIeP83OgaCp3nqz0E281WvbXE","width":24,"height":36},"large":{"url":"https://v5.airtableusercontent.com/v3/u/49/49/1768197600000/rPcoHEldpyTq-zU2xgMNRg/lADAAK8cciIPmn_FrFHFiaOkUJMzXw2-446J4c-C3p3pJ6vshAa23SA5wUh58GV7v2JHa_MPtuEU4NA0ljKqQPT_thtE36QOu-AVFhrZkLI8m7G1IhwVdOFjCUiHSYH4ViS3VWc4CnLKPlXaA22-SA/2u9O3FB4SlQ1sYsTkxyM_Ut7RrbtLPrgBLhdK9rx64I","width":264,"height":400},"full":{"url":"https://v5.airtableusercontent.com/v3/u/49/49/1768197600000/d78WoOftFQBXTUGlRJRSIQ/3ZNATp9D7R2tY5WqgyucxsalDEc1IV9IwO3Dn8xfUp_UPFtBUbvKYdJ6PM-tYEdoTFfet-JvEi_WaNp7yAfhHGvsHHAQxGeC1uGUzeMm-pin4X9V2PrVxwoteJCosjJS6gCPU6zQRASRuIx4AZ-NDw/gcue25hoMLb5ArunksejmDXoY9j9eJKGFA3ihce9Dvw","width":3000,"height":3000}}}],"Authors":"Catherine Price","Readings":["recpsURKAseTrlwsg"],"Date Added":"2022-08-04","ISBN13":"9780593241400","Genres":["nonfiction"],"Author Background":["by-women"],"Number of Pages":352},"Rating":2,"Read In Year":"2022","Page Count":[352]},{"Id":"Sun 09-18-2022 to Mon 10-10-2022","Started On":"2022-09-18","Finished On":"2022-10-10","Book":{"Title":"The Spider's War","Cover":[{"id":"atto1D1N2tGO5gAbo","width":318,"height":464,"url":"https://v5.airtableusercontent.com/v3/u/49/49/1768197600000/AI3n2yEv4Uub0VI_w9M5Gw/fiH_s4GBbBm9_UQ75lEFAmrJGg1G9Wbr7quIKj0knTqGvTOyGeepA3QEzdfxu81BFj1plaCNdBCfbkX6Xn8XJ6WqIZqHybb_twFQ03htO38cHDd0HM_cmXTSDAXlQdMgHXeFfUDdePVx4M-o-yuz3Q/RNMxsaXl72H9iv6-36lnxM33kAJ3E700ttwf5O9FWyc","filename":"20404905.jpg","size":56655,"type":"image/jpeg","thumbnails":{"small":{"url":"https://v5.airtableusercontent.com/v3/u/49/49/1768197600000/ssxIWC294nxD_muSLB1GmA/eMrZPbubHFBOOTOOCuAIfIoAfAJwjsjPWVGk2ETDLh9Evuybm65G4kdLizyoT8oksLDkuk1uwAUzJpYuUuCHo0R8MnyOv4JNdsNdVNtszx4E3-Y5E_KGOkMfb4d2SRBFmXAdQIUTpuPnotBMntBOEw/p5OMvA7RDp1cR61FV7Yt-dYflvNw9jiq7ycx1IGPEXM","width":25,"height":36},"large":{"url":"https://v5.airtableusercontent.com/v3/u/49/49/1768197600000/r2-Sjb93GCWOY4J93KLHdw/VC2W8WDs54KcV0vep63O0SWVt0WDCpcvoKNw5L4KudOWf3_fp3j68AEjQWQbRSyUAqLCfuUAwBoXzgNRR6rWk_nmtS7S7E9UO7Qa7Pgl5YoRop2ENk5gs4ymN9EdDoeWT1OJAsJAbjiVk-3KazzMTg/0soDKZYkFRK4SkUJ_Etcert-l0ZO9b8RBTZYxdvCkhY","width":318,"height":464},"full":{"url":"https://v5.airtableusercontent.com/v3/u/49/49/1768197600000/J-2mnT0i6ML2rwlTsKgOBQ/frehNZOdWO2Saxz5LwIfx1ap1zgVCpEW9jhKYezRPxxDlMLXSQC3_1oVECUciKs_KUKrRpYda3yRHsBfg5kHdqPiqUqaPf6NaizlbLCcE1j0Zpt-m8oVuaLfygryyAphLdeYEdWJde9ZsNKkyaR7kQ/hAw-uOJoMj9j7KbL2Ne5iOms8_V-D1Po-Khctl4dkOs","width":3000,"height":3000}}}],"Authors":"Daniel Abraham","Series":"The Dagger and the Coin","Series Number":5,"Readings":["recv68Zz8wzWMECUZ"],"Date Added":"2022-09-05","ISBN":"0316204056","ISBN13":"9780316204057","Genres":["fantasy"],"Author Background":["by-men"],"Number of Pages":492},"Rating":5,"Read In Year":"2022","Page Count":[492]},{"Id":"Fri 02-11-2022 to Wed 02-16-2022","Started On":"2022-02-11","Finished On":"2022-02-16","Book":{"Title":" There Is No Antimemetics Division ","Cover":[{"id":"attS2tkUlGHrNAi6t","width":286,"height":475,"url":"https://v5.airtableusercontent.com/v3/u/49/49/1768197600000/Baj2HDbaq4mC2kE-Npw61A/vAp33e86E7NUOtKoppnUzwKE-gMGeTe4l-Vcmwjv6tOKVGXw-AYiG8SAZ6MiyVE_-bV6tmHnw0_Q5C4n2k0vIkaED8Ch7Rl-66uqfy08FaV-kJukYZ0_ELzVPIS6Zo3iy_e2FQlrkOHHzLg3_t3Akg/WjLrrdn_WWpjgLPRsDq9gu9i2ZI4E82nBx6yy78PA4U","filename":"57834742__SY475_.jpg","size":12909,"type":"image/jpeg","thumbnails":{"small":{"url":"https://v5.airtableusercontent.com/v3/u/49/49/1768197600000/Jvw17GPguwcFXif90BZHng/kfCiJt72p8QbiSnhwijyxQWb3CG8Gbtb10BfjJ1iom1l44XSLDXwfPOdKQh365vLQhtUCiDoM2Socm5KIbTL6tlJvVAo4qF-PGbG3pXH5rfUId2H2T4r75f0n447PyUgXVCratK1-J9WibFh8-tTWA/aaKjH3iMniAgYFZd8R2vRtW8twXKoNT5PDGvd4xxxYE","width":22,"height":36},"large":{"url":"https://v5.airtableusercontent.com/v3/u/49/49/1768197600000/eKoO983yY-4gUsNptjsIcQ/VSU8kLZGx7nemAWNaA4y7ZeLfwnWZg-qpjNz7alRXOe8SXnzFrggg1dt3REi1MfZuXyn1RnTODOikpwoB_CvSa2aAi8d3L-jUpa6CVr_hcQ7a386zC3dMS-ZPctEMmWZ8M00GojQ0ZNU8Z0f-vEI6A/XHE8ZVUhOXOt3eqcGAv0-MLGCa9Cn9yRm37aIRvqrG4","width":286,"height":475},"full":{"url":"https://v5.airtableusercontent.com/v3/u/49/49/1768197600000/wUIB-feVOM6VTTQiqrbx1w/97mAXVit2tZVLIg7vTdcM2Y2LUXJUJs6D7myxO8mz1ufb0cmG08qeFcxlRMYUyV8cbyI0qiW9tDP3M3I18uId19sIdQBs87Ok5o4RtU5gx4KIvAdDZQT3WE4yfKUXgf-yeWh9YeNTpmRTa021CP_hg/0QBd4FuM90T0lv_TCYNbe-MtK3F4OLGTdYrTVZTC71Q","width":3000,"height":3000}}}],"Authors":"qntm","Readings":["recw2yvp5SrEcFRMJ"],"Date Added":"2022-02-10","ISBN13":"9798721503788","Genres":["sci-fi"],"Number of Pages":227},"Rating":4,"Read In Year":"2022","Page Count":[227]},{"Id":"Thu 12-15-2022 to Wed 12-28-2022","Started On":"2022-12-15","Finished On":"2022-12-28","Book":{"Title":"Eyes of the Void","Cover":[{"id":"att7YOF1zYLpzLxAv","width":258,"height":400,"url":"https://v5.airtableusercontent.com/v3/u/49/49/1768197600000/YntLBB1F1Vs4ox5QtlTKYw/-DvV4--1Nnddte8C4lslVfg-JTtt-uB3RYR5DMpucxnjkGe47slCrxqSQYEObkQ1CbnSVJmC5mq73E32jGOtC-ZQq7b_S4DSvLgMG8RudC_cJ8s9oa-i_2H4kQZadmiPsRNH4tjyn9oO8Q5b1Q3J7w/FPt-y_9C57_Nm5XNKgUW6d2aAT5Urg-R1jeYurLdHEI","filename":"58950737.jpg","size":97314,"type":"image/jpeg","thumbnails":{"small":{"url":"https://v5.airtableusercontent.com/v3/u/49/49/1768197600000/pdehA0cfHNBaBd3pm_o29A/oC7TiEMhJGGyg1D3PkMBhOYQSBul1S-Ibg_L1n4K-OpONIvQLGYSqQSpTvnMDgBxu70zakBrB2day8slsSlM82gqxaOVSIsFVWEZU93ro35H293ExSvwHCSskZVk9f0mPkyK6udqeI65W00bOe8OJA/0sHMqs0PLfvBsQFLNKxWG7v9b4aDST1lcHK2L4WA7Nk","width":23,"height":36},"large":{"url":"https://v5.airtableusercontent.com/v3/u/49/49/1768197600000/lV5ccsGcWoybvGnx-N7mCw/75Y3By0eCz69uwmjKZsaONdtAN92BLGNEMQHFTgqkIHdB-hHsCd0C5BmQe0YQKxf3GkghPgF0FOe6fNPSE3zD0eBmxT63Xkeh8M9ff_TcP_WLXpNdn_H6de2CCEJg1xM3PF_L5_dGJJlJmoh73T9OA/bYeKhZHob8y4HZ3StrU-hfcoPWtYhCiefc0L4yyzKTE","width":258,"height":400},"full":{"url":"https://v5.airtableusercontent.com/v3/u/49/49/1768197600000/Czea16dhB2QmCfB9hxXjnw/tLYbgktp3Uhr6jE0n8RfQ2REQNLl_KlHyUsJdaYLDbn5I6sqvcaYnDgobizVNUmikow6-AIMhxc-znwIDT_IO6cqpmIjyNsnI4M6pvyrXZfSFgdE45gnRsW_CaF2QGlzi6Q450dzxeqg-mu-FHjhMA/wnGT_Z2E0Lcc0YgfX0CIC7BZ5ej7Q4rIlHQCUbzxyzg","width":3000,"height":3000}}}],"Authors":"Adrian Tchaikovsky","Series":"The Final Architecture","Series Number":2,"Readings":["recxlnTdDPWOaeqVD"],"Date Added":"2022-12-16","ISBN13":"9780316705875","Genres":["sci-fi"],"Author Background":["by-men"],"Number of Pages":595},"Rating":5,"Read In Year":"2022","Page Count":[595]}],"stats":{"Author Background":{"by-women":9,"by-men":20,"by-lgbtq-author":6},"Genres":{"tech":1,"nonfiction":4,"fantasy":18,"fitness":1,"sci-fi":3}}}],["2021",{"readings":[{"Id":"Sat 01-16-2021 to Sun 07-04-2021","Started On":"2021-01-16","Finished On":"2021-07-04","Book":{"Title":"The Swift Programming Language","Cover":[{"id":"attrNl3Zv9XXGUEeO","width":290,"height":462,"url":"https://v5.airtableusercontent.com/v3/u/49/49/1768197600000/fhroD34ZdeRivJf69dlbwA/GP2G1XTHMQ0nc_pZbldEZ_gnaaFY0fVw2FnbJbUmFBbSUgql-zdSJCMi5rv6NyNydLSqKjlu2Q_nQcxuALiEqxwoEe7TYcAluSTzFTyp7dyeS79IYVsClA48PNp_IUmKd-hLYy_KCkZmtER_CXmPEhDvQ66x79T5yhPRkGE0dXs/Hx_UCQT36V5p1ub82Xl5DEnF1ij-1WaM0ZHxqoOG6q8","filename":"51957046__SX318_SY475_.jpg","size":22647,"type":"image/jpeg","thumbnails":{"small":{"url":"https://v5.airtableusercontent.com/v3/u/49/49/1768197600000/1qMpaYMbIc5h3PZiit6vAA/dWbQzI9-pKmuuM8vGI2GgGn-X0PO1AbWMVFv3ZCdE0XJ5pJ8WqkqLabYcVa1IaqMtFpGOrmxGFi5KpD90HR0v9Cv9Oaf92RHu6m1QF7N_qTUZ-rqUZmVu7dfuVFQ7qSycdgl46dJAExghAonern0UQ/WhjT0LO7krKkvbbJU2v6MyrEna0Gk_vIIlSyyKocnz4","width":23,"height":36},"large":{"url":"https://v5.airtableusercontent.com/v3/u/49/49/1768197600000/pJX5kfZvFanjwxL5FITYCA/C36fJoDu1UYiYxR3EMDaqZUOgGvRNaY-Ugz9sGjN2Jnfv0xy1QOaLdNSRuDtyLIUaNQwDaa9yhzgX5_71xi94-5h4z9KP4JFhCHaAn2iR1y0nbTyZvOjM9fHWnmRSsVqh_w7NfjEtX28cIYkqw3SXQ/IjEpSi2xwsSojXasF0hU3zLf4w2jYuiTOPfs8cheoKQ","width":290,"height":462},"full":{"url":"https://v5.airtableusercontent.com/v3/u/49/49/1768197600000/zK-Rlv1KrQxcWu1GYjE8XQ/nAsHAOwOFa7o--Tzw-IBAgWHo-JqzkPMcxH6vo_0TqeyxyCdD1SJwVk3eMDmz4THeYrA10JiEyQDRXwjtpX3RZ8a29juoAvWyyOsgfTR5mSN6z1w8ulbELyEQjqvhv9snlDvdKaHVYoJehtdGD_rQg/Q8316EHsC1j1F8nBavp0H3Q1Os5dxTj7M6MMg9ZfKu0","width":3000,"height":3000}}}],"Authors":"Apple Inc","Readings":["rec0HHwFX34plsNOn"],"Date Added":"2021-01-04","Genres":["tech"],"Number of Pages":882},"Read In Year":"2021","Page Count":[882]},{"Id":"Thu 01-07-2021 to Mon 01-11-2021","Started On":"2021-01-07","Finished On":"2021-01-11","Book":{"Title":"Swearing Is Good for You: The Amazing Science of Bad Language","Cover":[{"id":"atttDvvRnqrr9Bx4D","width":198,"height":300,"url":"https://v5.airtableusercontent.com/v3/u/49/49/1768197600000/-AS05blInkglO-X3tBOQug/3E40_a2f7hPcV-XJIM2sersaYDjEg12noFp_-4_cg--gl2q9o4yVD0X5HeI-tYp4BYCFAvd9zth2fUs18B3QD18QdEbIWvl4Z6wJgBftmQEFX_z2MlVWfnw7eRIKt5YPF67WblE6gEvWrEhR2HDKrg/8Nd783EPYqBZpWTkIP6uEe-WcsAualCBG6-fPTkpcxQ","filename":"35187212._SY300_.jpg","size":7133,"type":"image/jpeg","thumbnails":{"small":{"url":"https://v5.airtableusercontent.com/v3/u/49/49/1768197600000/yJD7VeXbvLBybrDGXnwKbA/LElL5DTjKDHeLD5JNcl2jxaVSeC7ns8cAugyoHeKfnhFrLzi6oUR7PzzXNnuZaGmpvNEoTPDtUO_TtUq3Fz5qZSZYXS_sl-Er81OYt-bxiDF6DaXF3WwyrkMAQKSjDKKwB6yBKfsd76Qc6DcqHkofg/KsoGk4318os5x_kOUYLw4GhMgKwPAZwKhxi7aROa5j4","width":24,"height":36},"large":{"url":"https://v5.airtableusercontent.com/v3/u/49/49/1768197600000/iZCrNgA6kza32aKjAh1OqQ/8NWZY5iP4m_Ynar4ymjBAfu1jcDyKeSNtTio3LxZ7K07h9rkpjAz8x7IR1EqNBKIbLBJ2FvAZnYEVU-AYuvoc8dzdjkhOIe6k_gajUuwFVknGmHxM5_14eDwKE6WXfz9G6-VjFjjGm1f0SLPHDYYMg/cHH7RQIFsPZ31kTzVZOhDZi37sk5ZM_bG0950l1JeFo","width":198,"height":300},"full":{"url":"https://v5.airtableusercontent.com/v3/u/49/49/1768197600000/UYp6w26O_bbGCGVkyHD-Tw/hsoVRDJn9eLGYHqQ_y7jMVd5am4GhPKCQRACBk5m9FmlKe_LaEz3zdu3QOK1fXtPG5_zDthkOtjzuiGdVZK-Ac6rwzbaCVNrT6mYBzzYG2kzD4m08XXBaSHyrZHKrlV6uhOhCrV3nl6aaPTYNEbJCg/hNVYbUhPlW48Iv-V0qVJU6ydvT5krplTDfbXyseHbjU","width":3000,"height":3000}}}],"Authors":"Emma Byrne","Readings":["rec33J9V8xmgXfZWZ"],"Date Added":"2020-01-19","ISBN":"1324000287","ISBN13":"9781324000280","Genres":["nonfiction"],"Author Background":["by-women"],"Number of Pages":240},"Rating":3,"Read In Year":"2021","Page Count":[240]},{"Id":"Tue 07-20-2021 to Fri 07-30-2021","Started On":"2021-07-20","Finished On":"2021-07-30","Book":{"Title":"The Cloud Roads","Cover":[{"id":"attEsKC4uHsMm8wO1","width":316,"height":475,"url":"https://v5.airtableusercontent.com/v3/u/49/49/1768197600000/5-OivOrguHAAq1K4JmsM9g/cX5W8WkRZvz9i34MjGs2RQN1_sO9b-xuMJo4ee5edhkwvVItmPnZVXWGnBPbFHKFpqb84zdkmR-i7z-n0KtehfAu5it8Njw3-eXKUeM6Y4b7Ph-f15mqH-YaU4Q4GtpDeXBa1EP92kf0i_PU2s0dsQ/pLFxbIhgN57AK-wYFSYS8GO1SOiPZlTdOkX0We80j7E","filename":"9461562.jpg","size":93210,"type":"image/jpeg","thumbnails":{"small":{"url":"https://v5.airtableusercontent.com/v3/u/49/49/1768197600000/bEq7m6IZUUpboL8w3MgiQA/z37eL8yzx-ed_2X6Ds8xVeClpgqUXJCnJ5ErcIT7WLKm4I58czWR5_V_oa5xDnn0E9TJrUFyrczPumXBXgHSpWNo1YwAbR4Ej98U_d-QSGaFZ2fJZkVR5iSlZMKMEKMANkorfvbS7kKWJkLmd9n9rQ/CbyL_wCJ5Gp4klM4slm8kid6I6Q0LSDrvTfi0gcd0RE","width":24,"height":36},"large":{"url":"https://v5.airtableusercontent.com/v3/u/49/49/1768197600000/mRndKF1OzpwcEiTwshpEPw/oFtbpPenLamNLwZxAVIOcu9yTxDklpB0gPAX6WGCfbXpdlyieBWFyhRe6WkZMH1f2rBtblXwL2nW0RONTs0gppN51ENy8Th05WDu2-riVP9wQBUiM9KRp_glSCj39CujJsrJiEVn-5FCFF5VfuNJww/UcKUhZljCslPTi9NCvVCk5dduU0iHysSP5Frba8lzmc","width":316,"height":475},"full":{"url":"https://v5.airtableusercontent.com/v3/u/49/49/1768197600000/wrhjTEoL6lpHXn1tH-Y8Pg/7uPxNwwz8T0HnBvRR-1t2w6kgQdjmHNfflStSTuG4az4KLGcVxtjsCwVC8bKJmIl4V7hxIVSEWXc2gzZ5GWOztqLHZZbCDoSYCxONC469MZyPjqNHSm7TimYpzWu2gP4WxW0BgP8T_TvZHFtCK1Hrg/dpf04UdhZeb668FS7MUKJqUJivhx5LObg3KIS_R58ek","width":3000,"height":3000}}}],"Authors":"Martha Wells","Series":"The Books of the Raksura","Series Number":1,"Readings":["rec40vdckVcgnWVm3"],"Date Added":"2020-07-12","ISBN13":"9781597802161","Genres":["fantasy"],"Author Background":["by-women"],"Number of Pages":278},"Rating":3,"Read In Year":"2021","Page Count":[278]},{"Id":"Sat 04-17-2021 to Sun 05-02-2021","Started On":"2021-04-17","Finished On":"2021-05-02","Book":{"Title":"The Wolf of Oren-Yaro","Cover":[{"id":"attYzAi43wLSiuzum","width":486,"height":750,"url":"https://v5.airtableusercontent.com/v3/u/49/49/1768197600000/fjaBRciIM1qjbQ2ViRiDig/0nD3H2U4-uXBoSFN0eoDKz3buJawIUF0587jsBvebb7EVgRjUcoK23AA4wGoK4_SnNfapEYOuzqmsIBiraGaHyfkxfL7WuiFfSpvHhmo0zM5XuyjeI00lzLYV9xylYPCQJoWl1HwuqgvcHukpvFknA/KOyjlRe5y0w9FL39EMYVfLm07OEhK_0XLpTcRVf7DBY","filename":"46207682.jpg","size":81042,"type":"image/jpeg","thumbnails":{"small":{"url":"https://v5.airtableusercontent.com/v3/u/49/49/1768197600000/UOpagEkcUA9xg1o2nztzsA/C06XWNUkQZGSxYyuGB_POylccxDCCaXsGX9wwcKahgfP3FltRVg3ToekWaX8eWn5GX2i5BAQwrBcWpwJzxXV-FKzu-xMdEK9FnOHwJtfTyIzlDTm1bC3EdhsFhSdT9qqBs77rO3P6J6zsTHIqwSOCQ/mDbqosuPn4jFI3q5xGh32A5BYviyBjf-zg8Y_KXoeZ0","width":23,"height":36},"large":{"url":"https://v5.airtableusercontent.com/v3/u/49/49/1768197600000/fFYPSwHxWLzCsUEgMPC6pg/lyoYMt6U5u9HSSQISVi4tSu14GcFTykhIggY3zuKkMCmquO-vhvVYIdTvXeYb06qyfUP7989-Ma4rAlKPWMzC-E6D4tQMGTlGoaEMNSk01i_YpTvBtHeX5YGrst8Me6zaDjfRRBxAApdl58xatp9rA/4TgVXlRut_So52-7HpUNkwMvofBtwl4JLDQUvRTcFtQ","width":486,"height":750},"full":{"url":"https://v5.airtableusercontent.com/v3/u/49/49/1768197600000/ZfufvX3MPcDKkzImQjPc3w/-f0GcfRIrQyrcZ60AtkJyA2oVEO-4lxqum-HADhDcDkwKWmzAASOrpLYE5XK6PJedGqN5p973IyX4ct5U_Snf5jQ_2ZOEEQYEpk9rYJ2kYuQx61NCiIQL-AWglPdh7edG_tFN-h2PSmkqs9IJS_9YQ/Y1nF8SMNxD67tOjn3ubWQJy7Zk6KYhmSRHs4LX4IMBc","width":3000,"height":3000}}}],"Authors":"K.S. Villoso","Series":"Chronicles of the Bitch Queen","Series Number":1,"Readings":["rec4vy2qMfD8XGSUQ"],"Date Added":"2020-05-25","ISBN13":"9780316532662","Genres":["fantasy"],"Author Background":["by-people-of-color","by-women"],"Number of Pages":496},"Rating":2,"Read In Year":"2021","Page Count":[496]},{"Id":"Mon 09-20-2021 to Mon 09-27-2021","Started On":"2021-09-20","Finished On":"2021-09-27","Book":{"Title":"Magic Strikes","Cover":[{"id":"attpqJe0GIopYnQvK","width":294,"height":475,"url":"https://v5.airtableusercontent.com/v3/u/49/49/1768197600000/4gowYxRuplpapiygtANzig/znhwEIDOxtOCUNtmd5ylPYx0iEwpz1V6sBj-3Bi7fUgQbQG_QKdtLk3ff87k_iiN50SzpKsOTqgHHKOvrkObN-zhAbUvB_gxRLoeWw4W1i7MIgavs8-fq5yIRY28ZiTtQ6ZXsPnUd4CN7uM_Cpe2Dg/kZCnS8kbDryprd5INFDfXfqCarg1Y7B5U5dZ6uv0IE8","filename":"4345498._X0_.jpg","size":284322,"type":"image/jpeg","thumbnails":{"small":{"url":"https://v5.airtableusercontent.com/v3/u/49/49/1768197600000/JmRHQ9TpSbyBFWcIg30SZw/kQ81i6R2jWzR34DF-VaLDHqOhCcHndVJL4QK0YYc6nOO8xMFY-_C4e8BSwPVI-StbKnLrHMqloU6yGwZ0wdx-ZBP8hbS65I1lHXb821m0WXBpu9sNSwfFYXs4VsMoNGXkF3NbQlSIh0oPpUCw0Hw1Q/0H_svpVO_MsIlWIjM9PQVB427j9fNfIdk5H3r5vTm-E","width":22,"height":36},"large":{"url":"https://v5.airtableusercontent.com/v3/u/49/49/1768197600000/-c0TXwuvFW2eWv4JE6M0yQ/AQbCL_C8HTVN-k5F2oCkCwhdP6jIPS1mmEG3s3fltpEQX2Xyi2xB2rmJMyYNIWNY-kg6NsHM4N8pwO_TL34XzntP843bZkJUixiuoF7FQrPhLnWrB5GiTi-v3i2LKo8iYb38luwHtDI39z67u-9kVQ/3y5NAY5cyULwq5_6Otdufj70eXudLNDUg7LUAOwkahw","width":294,"height":475},"full":{"url":"https://v5.airtableusercontent.com/v3/u/49/49/1768197600000/FIRTLHzJjsq2T_XTgn0r3w/VEdQUTBZkppvcDZ7Z12NdTgoHtKmxNuDtyXFRsqltfEb5XowqQJ5J82eb8Y2sX_uKbmpr8GqkTKtb2FvONEKnlj0miZqgKKUGOnWv99zD-nGRRLODlkxHEHXlCPY9r-sBqE2WmgkzpHqL3cptNPRXw/GCfIlT35dCPTlUHoAqqW_u1zQVwjOi_K4W_245dqU2g","width":3000,"height":3000}}}],"Authors":"Ilona Andrews","Series":"Kate Daniels","Series Number":3,"Readings":["rec4x1IJsAOg5HHkW"],"Date Added":"2021-09-25","ISBN13":"9780441017027","Genres":["fantasy"],"Author Background":["by-men","by-women"],"Number of Pages":310},"Rating":4,"Read In Year":"2021","Page Count":[310]},{"Id":"Wed 08-25-2021 to Mon 08-30-2021","Started On":"2021-08-25","Finished On":"2021-08-30","Book":{"Title":"Shadows of Self","Cover":[{"id":"att1SIKzbd9HL5Hlm","width":199,"height":300,"url":"https://v5.airtableusercontent.com/v3/u/49/49/1768197600000/0ZVKudJrH6qactUo5EwNtA/L5E6MUTjyTM3uRl7lV0gGWqMC6gMSaLueUiiuFy67t5ZHiyP54h_4wWFDNmCuc6joMN_BYzlrwxxAV58L7AKuEfQu6PeFw3qtCeHZTKHRGa9ymnYzb-gbtCAJE4zSMOOCQFg7g5s6TsmYp8oxqDyDQ/cqyFWcquiPnPlHc7OhO8oYRIBvAhoZju0-p1HcGIM6Y","filename":"16065004._SY300_.jpg","size":17625,"type":"image/jpeg","thumbnails":{"small":{"url":"https://v5.airtableusercontent.com/v3/u/49/49/1768197600000/4Mtx3l-1AYgVxUdEClLlOA/PFk3Ogua7VHdYxNin4JEleRK5ZfWHlp7b8xv2f81yd3UyrrlP50WxSBxlxZAdRkzRVHmclrI7BauRSmWTXtfaMeCHTrAfeg3FBRuKIxzErN3HUaN9CkQjK0LGtY7dp_j0yTJX1WXphZY3zEQtODHoA/F-I9-vDVkx8IYaJKCVpT7dVqj0iXFfSkKz7TM6_bQL0","width":24,"height":36},"large":{"url":"https://v5.airtableusercontent.com/v3/u/49/49/1768197600000/XlXuolrr45SNbswaWl4Gdw/aIwWKxeMDf78GT8FPSJhVhWocSmREUjf2Car4CdGSf5Jl-44AJVlE6myhreood1ABGD8rp6GELewLAVZ8OWTXC8mKC2k8-puT04Sx2m8sXJ-A4TPI_Tfw4qX0LCS3D4MrCPgW3AJM76zj-dfI3jhGQ/NzGpnFV6uChZI3DlOWJuWUaa8SEs1kZsAWt83DYs9oU","width":199,"height":300},"full":{"url":"https://v5.airtableusercontent.com/v3/u/49/49/1768197600000/gvoChi6A9AXw-zc7m4LxHg/IzQnkI5XQiYkXV1nbxauMNY1bIfxEIu5GGlIqiaPFHU7HDjjvQugrrwQHlI6ZqWl1iJ8ZzFiXlnjIvESghRC2nz0akaGfDH0WO-8kaYX5QFewwbNX5KmKfrrrgjYcwyXQ9wEFFjQqa3LQ0KGU7XE1Q/QrXqdTemMgF8XEV_eagpcyeosAJyFcXU28kNMITtNdM","width":3000,"height":3000}}}],"Authors":"Brandon Sanderson","Series":"Mistborn","Series Number":5,"Readings":["recwxl4qisdnWKuJU","rec5COeNzKipaBlYT"],"Date Added":"2020-01-19","ISBN":"0765378558","ISBN13":"9780765378552","Genres":["fantasy"],"Author Background":["by-men"],"Number of Pages":383},"Rating":4,"Read In Year":"2021","Page Count":[383]},{"Id":"Sun 08-15-2021 to Sun 08-22-2021","Started On":"2021-08-15","Finished On":"2021-08-22","Book":{"Title":"The Hero of Ages","Cover":[{"id":"attkO0mcCQaWOjRgb","width":197,"height":300,"url":"https://v5.airtableusercontent.com/v3/u/49/49/1768197600000/vm0yG1rrmDv8lfliaQd9kQ/9nJGscf94Tf1C0AqVQkB_AX_fYxuDDCOjnII3AkMqqT2c3kvnAE1Ic7krxAU0i4c_RHGEMdXi-JRDP9J1w_QyBlRl99fJmjY2cQyHUbD6NnHBtw4I_-fJlXgixnTXftRFT2FZQRlmz5XoY-oQKOawg/DFLzPEB7TehsKtld6R-yi3A_3hcrURCp-OHXKVfUw3A","filename":"2767793._SY300_.jpg","size":20653,"type":"image/jpeg","thumbnails":{"small":{"url":"https://v5.airtableusercontent.com/v3/u/49/49/1768197600000/SV0kuNb2XpUqpRCD8bR2HQ/sygoDDgvihBqs2rBcdJy3kr0-JimMT9z04vMCR5S-PDJbJbpXEECQVTADImUj5VXLFPx4F_F9kx049x6SNHHpuj1QJnwQz72QqdZ4XRyC-gkKQUqyv4wmZ4iaQVAz7d08vvVuFr2q1nDc1b20E1hDw/ksWkCpMgQJOF-AqSeQsx3O7nL9usnmdktEWJuyWNEJg","width":24,"height":36},"large":{"url":"https://v5.airtableusercontent.com/v3/u/49/49/1768197600000/yFVXO1VqZOXXRa8Eua0VeA/c8NGRqe2Hd3r_gyz4c3ZfQ6dPk3xtT791mugSBGTwkQRFg5bV9qLx6q84m765zBcsxhLY657uhcsUFTWrDlqJl_SNREtC0vwyLyeoPfE_bsihe1oUtXU2MA6FREBD0OU4_Y8VlCKxbcYkOF_TqpXJg/sCnWoXqK0--4JX9vDhtG__FeCPxs9OCqM4uGwp2_vJE","width":197,"height":300},"full":{"url":"https://v5.airtableusercontent.com/v3/u/49/49/1768197600000/rI83H2MuN297fwDyw1FIrQ/w1msOWOWYLFAAOClzp3OosJukzZaUWMCNhXiRY6r53NAZtKZO-I8ERM-p0n4ZLw0x-cH4FgdtQ79HtDyogwwpdz0qLYbdw_0Fcq0K-ouCk0rj9bwBnmFeoJc2nG-PmOUrdadVeMcyM3YFSMP3yfQsg/2WOFG7_IHqco6CaiQ80aycZ4hLG9jbAaKWu2wtiBFU0","width":3000,"height":3000}}}],"Authors":"Brandon Sanderson","Series":"Mistborn","Series Number":3,"Readings":["recpKQJPHccwuBpsR","rec77N46HEUkhtzS2"],"Date Added":"2020-01-19","ISBN":"0765316897","ISBN13":"9780765316899","Genres":["fantasy"],"Author Background":["by-men"],"Number of Pages":572},"Rating":5,"Read In Year":"2021","Page Count":[572]},{"Id":"Mon 09-06-2021 to Sat 09-11-2021","Started On":"2021-09-06","Finished On":"2021-09-11","Book":{"Title":"Magic Bites","Cover":[{"id":"att0IoZ9YxWiGE2AF","width":300,"height":453,"url":"https://v5.airtableusercontent.com/v3/u/49/49/1768197600000/lCRevwmmXY1NXhNzCGgyaw/Tp1KQaTdlUPxgwgwnDOliqnBLlo_jMoZf3lgI2LsxnELBlPrhv9dh9fNACL5_xqpnF6RitD3juxq5TGjKwi2FwzlYXcpyio_Fv6iaW6XNApp4OSNBr1XG1x0u64C0lOKMJ0Owh1NfCSPx43NHJCYTA/9e_B5yXT-LtZbZ84tsXj9XOHxh3Ua_wtipI1m6XPU2U","filename":"15808652.jpg","size":66628,"type":"image/jpeg","thumbnails":{"small":{"url":"https://v5.airtableusercontent.com/v3/u/49/49/1768197600000/3wp0xat8KAKYaRwNc9SrFw/mTEeZpAiWr03cUy3UUl7CzYHR2Fxd32Z2Kox1PlRf9Npqyy4_s88-LuZyAqYfjjwfSa9EqM-i767eGOlA8t5OG2m-7o0pKxG6NFYMjFGRUGSisbOHJ9i0SRhqvfTWJrgfKQtxHSsfHE2qnE6jjYaLQ/fOfpzbaje4eoiAw7VjZcp_jkkYlrx1hSoQ8TIc5zxnE","width":24,"height":36},"large":{"url":"https://v5.airtableusercontent.com/v3/u/49/49/1768197600000/RIBa5CVvCTMDMEt5rchwGg/PfiiXWI0k3bva2MgjpR80mA9oox7ZJueAGzBh-kyigK6FayfVXC-V1ATPJgxoBCIJZBakwx3alFV7dqD-dcvI8Nnjba_gfO4vbL0SjjVfrYM1ZvGPLpAZDYuIqQGG64sjS1i5e6XKkRSi4UKMbFK-w/PAwZxPm9itfL_cSL52qXdUuo2tn8dO5zCPmTlXn2mms","width":300,"height":453},"full":{"url":"https://v5.airtableusercontent.com/v3/u/49/49/1768197600000/RgJv674ioBu3-xJGs8F3sg/IYJoJ5d3Ow4buq5fM5c-QwfApY95-MYlv06vqXJYlhgIIbIJQ-3Z6zZOq-n0ui1--HdLGGFssc025so4793Uh3SLhPxfGZcv6thKWmgyTkGj9VLUNUMm5OTQysM7RmRslfeR14l1WVBBf4MqlAMz2Q/Kd3bxn9DoeKGY8a-gWKPYMoCqbXq4JIAdDgavBJrpRU","width":3000,"height":3000}}}],"Authors":"Ilona Andrews","Series":"Kate Daniels","Series Number":1,"Readings":["recFOw7AJXPHtqJuR"],"Date Added":"2021-07-03","ISBN13":"9780425264201","Genres":["fantasy"],"Author Background":["by-women","by-men"],"Number of Pages":365},"Rating":3,"Read In Year":"2021","Page Count":[365]},{"Id":"Sun 03-07-2021 to Mon 03-22-2021","Started On":"2021-03-07","Finished On":"2021-03-22","Book":{"Title":"A World Without Email: Reimagining Work in an Age of Communication Overload","Cover":[{"id":"att1N8j77wtHovXHF","width":265,"height":400,"url":"https://v5.airtableusercontent.com/v3/u/49/49/1768197600000/WeZwVO3e-BxKeuKM8LKvWw/rzoS2w35hRwa8rqgr--2y7d-QnhmxbTwIqEi9Kmk-f3A8Lay0WnjymOF9YTk4GzU2zE52dW7GMNhf1cdrMW9ef_wWgM1YPSz-Nqh7xJWU8ztU8FSpUJct0JjGLcavnXLgXDGQsIu1UG3yoRv_oB2CA/Se4SFwL0G09gvQKVjxI76zf5HrgSpyIKhMP-so2ZbKc","filename":"54326146.jpg","size":78330,"type":"image/jpeg","thumbnails":{"small":{"url":"https://v5.airtableusercontent.com/v3/u/49/49/1768197600000/i3pZOqIF0dnj2WYqrrnkWg/kgLghl5XJaTZCrm9lcZwfc5PpjI-BhMXKKyY70KSnMJEZmgbhxMko3jVLcN3dlUM-wM2kd2Z2pmSZOCQzHsydYGGsxXySynJLZDLUEKsRZr0LhFcHeFMCmx62uMAMMfvW7eoStY_2fIbpdfjBsKoWQ/ZlFUvg1h9tWvcRsbrRGrO0UOKgsVdFQbyVJKrQmpohM","width":24,"height":36},"large":{"url":"https://v5.airtableusercontent.com/v3/u/49/49/1768197600000/VdzCLPUL-Og-9hhJmlz-Bg/xC-NK6_Nn2gS_p0J9soNNYatPGs_NoeMlMa6--TvGPp-pa_JDPn5w9UEAjhBhTeSEcvUf40q1m_xekgIq7DscBc_DVAYlhNIAMFsaubjPbRmz6yhz3i4jbt4oYd2rHgiDqHIjUVG8BL6GZpEds3-AA/hoZKHDWaffxrjN7ITdACXAixD_Qpnmglpx-YvMoH-Bo","width":265,"height":400},"full":{"url":"https://v5.airtableusercontent.com/v3/u/49/49/1768197600000/paCCV_6-cCrTlWmb1K3LcA/QBcKSrCF4Dr6QVuAeYPwx07VGMtG2yuaU5NmxWj1dBwDQQa9fq9cNdLp8gl8KPrXjl1JSZbp5KqD4L9g0yowA99YPUh19t6kus-fTRDgnVqFvIQ0EbRmTo8bSmLLU_GFjezC8M8EmzLv2CGV6HRPpw/ZDlbytlt-u1dvDVhdS_YXIklbtyrIC55JzyD3xX-Vrc","width":3000,"height":3000}}}],"Authors":"Cal Newport","Readings":["recIK03qsUX1kmFuH"],"Date Added":"2021-03-06","ISBN13":"9780525536550","Genres":["nonfiction"],"Author Background":["by-men"],"Number of Pages":320},"Rating":3,"Read In Year":"2021","Page Count":[320]},{"Id":"Fri 07-02-2021 to Mon 07-19-2021","Started On":"2021-07-02","Finished On":"2021-07-19","Book":{"Title":"The Red Knight","Cover":[{"id":"attmubhE0HSvU5hGX","width":312,"height":475,"url":"https://v5.airtableusercontent.com/v3/u/49/49/1768197600000/-C01SSalAOSc-Kw9bbE8SQ/zSum7eetD1k8v4LRFadnJD6kBLV2Ox3mddK_4nNnL7WDuW6IMrHwneozXlW_BE4WgvQDETZVXdHWOGhwRAIwQhQQBVEukRVXHw5cSYvSR1cHDvfJ2aiYYeizKOMShf-LRYco2sMRjeHuJPRAwzn7gg/ErCjntlm1gFUPbI4pWzKNQtzPuDgHKc55A1o2iYYYSU","filename":"13616278.jpg","size":140656,"type":"image/jpeg","thumbnails":{"small":{"url":"https://v5.airtableusercontent.com/v3/u/49/49/1768197600000/v78bGNKvxQ9Uj80nw0gS7w/WWdygdUHCLUqggYmzaR9vF6RvTbMwpDebuBxCK-dfk3CTCwTP3yNzGOUK0HO9HeoB9hHedsRPnsJm8V_37h4qoucTbHI9eWNuG0Ry_5m4Whw8JSaKULglZpyjQDD9kKYNm9tCF8YK_kid7-xxFRZug/P6KRTBlDbzXZrLEpmJNn1n9NClmfug2ykVn7GGEabKY","width":24,"height":36},"large":{"url":"https://v5.airtableusercontent.com/v3/u/49/49/1768197600000/qPOCuUwUOQ_ar-Y2N-cSdw/pTkTwq8NZzft2mYD95XdJL8V7MFAwYcgh_x5z_ePtjT6Oj7_1BXpvOpsUL_PC3BY8ZEm05MkAiyzKepAv7rfSI1i6xb2TZ3paLSUM4FVo0Ddxn3kOGFg7cx1aXY0lFMz4BCIArFV3MUSe4UvkqBUWw/e_HUCCGjbp_9j3J5NVY20qLezurJUGIspC5QjzMTyCw","width":312,"height":475},"full":{"url":"https://v5.airtableusercontent.com/v3/u/49/49/1768197600000/FiK6f5JA-tkqWiGAzV1yQA/hEBOGkET_E6GnlRoKIwH_67rgheqMqEkuUXpKaoTS79rulk9USLLAVupAONJIqmyAH4k5L8Bvxn7udxexkR5mIHPGYplQlr2edAO6u2HYmFMPtaAl05N37Up5HfF8zOhnnWWvOpZbAoTy_mGZJJRGA/pQN3l2m2p-iKl77HTCB8a48W92toa8Uj2nkAdapWAbY","width":3000,"height":3000}}}],"Authors":"Miles  Cameron","Series":"The Traitor Son Cycle","Series Number":1,"Readings":["recIuYRrs1c1oKSv9"],"Date Added":"2021-06-18","ISBN13":"9780575113299","Genres":["fantasy"],"Author Background":["by-men"],"Number of Pages":650},"Rating":3,"Read In Year":"2021","Page Count":[650]},{"Id":"Thu 12-30-2021 to Thu 12-30-2021","Started On":"2021-12-30","Finished On":"2021-12-30","Book":{"Title":"Superior Deadlift","Cover":[{"id":"attv2wT0aEIcP9WW9","width":942,"height":1430,"url":"https://v5.airtableusercontent.com/v3/u/49/49/1768197600000/efUl5CBGBjyIugRi6s2Xjw/Md0MFfX-sjQwPr9zrMh9td8mhxYmETvNFVv_PC4EQPNy6c6DNRFyzIpjpHT5UBuiTa1rEw5WzrpmaJT5f-1KlibMHN8X97o9taugtrh0nA9X2k740XcH5r6W2oL26fvDlqKIWNo8NzFvK0sVYWc7U9VQhATQonnbOBD7rTm5ag0/pNW7nwlI1Zeyk8xCh6nAtWDm-LraPJJ5SDkjI31uZss","filename":"Screen Shot 2021-12-30 at 1.48.03 PM.png","size":1088510,"type":"image/png","thumbnails":{"small":{"url":"https://v5.airtableusercontent.com/v3/u/49/49/1768197600000/uhnBPDZD77asFJm28Bg8RA/sxbUATG8hFh13ULIG60TecQVtwXGnSa1lFnInWtgeONWQoc35Kd5F_MrpqRlH5puxWcxsk2eFYlKv3oDz0DKkR0pOnCldewpi1VPGJ_SEuhp1Z0yxvvmqHic-iIMk84QX_IjkPahAhCRUcvT9oqyUg/mlTKCOUdu-5QsZ2vSPlbdKqD-e7bzvB-vchUxj3uQ2s","width":24,"height":36},"large":{"url":"https://v5.airtableusercontent.com/v3/u/49/49/1768197600000/y7V_evKhjmiQVOUbkiJzgQ/utflBb6UuZTOVxxei8Jbz5N5nmtLRAKZP7gYoS6XeHhZgdq_mD5iTIlGs30dSBl7GKn-Jzu6malscnBoJsBKf5dLgNRGNY1pIiPe68WGYaQKSXwjfIJpdyrpB9aUxujqo0ZbJOpcWDwijDiBx_aTdw/CHTpQBhbKs1dvwPKfo7p1UDz3Ic_dwpbmcYKtFcEuvM","width":512,"height":777},"full":{"url":"https://v5.airtableusercontent.com/v3/u/49/49/1768197600000/5uYxEdd4p85dazdrNi-VSg/WNxzotNc-5ohj1pxisgEGE84SwcFaVsFLAapryNd_dc9cJpKfi4zL7_dMiOQGRbBJIhZ_UUk7dLLDAWLGpLdjm_xqw8v2DLuStJMrFCUsIdbZBBDoKenAiKvDHOzpUtB3J0e7QnlERUJDvCjiNoaAQ/Bze_wiEle06FjTLxsL7UP31I5kfxMSSHwFvbiGpbJ2M","width":3000,"height":3000}}}],"Authors":"Alex Bromley","Readings":["recMMIvUPUhhTYqQb"],"Date Added":"2021-12-30","Genres":["fitness"],"Author Background":["by-men"],"Number of Pages":156},"Read In Year":"2021","Page Count":[156]},{"Id":"Mon 09-27-2021 to Thu 09-30-2021","Started On":"2021-09-27","Finished On":"2021-09-30","Book":{"Title":"Magic Bleeds","Cover":[{"id":"atttvBOQnVnpRqLWQ","width":251,"height":400,"url":"https://v5.airtableusercontent.com/v3/u/49/49/1768197600000/cfrYCpbfm_gqb9JTToagKA/m52219ll0-wLemRmEhZz4mE-pZ5rIl7_54Tv9yjbQE1MHneGfOia_hdZ2Vmz_HprgmD60KjgxUPLO5pNX0N1xDCKWfJPU1409My6vltyZWL1dr9x3puN3IXo7NLXjAiD-jibBMPDPUYH6xxRmrD0Pw/iHIbjtG2E2SDApw_ou9Zx5zFmEPdk2t7hcFSoiGd8v4","filename":"6479550._X0_.jpg","size":23388,"type":"image/jpeg","thumbnails":{"small":{"url":"https://v5.airtableusercontent.com/v3/u/49/49/1768197600000/Q5rn-kqpvXoMRZnYTXKuJg/sCQEnRzUI2WRBgm9tJ1hIfzCJqDf0lSrWgLy9Vw2bvWxLT3l6D2wUlIuj2Qjz6g85GVTX-fkBtQSpFbuO4TRa7WAjIcmGO7KgQwb-VQsqo6A9ydXSBla1I5dHxlMAuajXH7sZOeQVAtJHa3oMjjg5g/l92i8DMjMg2CHVe_dPLbprRxJWP96OPY0esppF6pdlc","width":23,"height":36},"large":{"url":"https://v5.airtableusercontent.com/v3/u/49/49/1768197600000/NqjlI9QgY7bdcn5UC9krXg/6W_mSKAIh2UkuNwan2wRMU9TO_ijIHcsuECWkgLaybCxMZehB9yt24Z47iP9PuhuEeBy5NdrBawjE8mWsoVV50FHtc64Tfbv6x3nbppF4kLiquCu1G8P0KAoEHrOJq_PEZIEaQZZf6THHDkuFTL4eA/C2BTmYADRZcO7FdMoKJRORLsICh6AA3yZZ8JFdVkjpA","width":251,"height":400},"full":{"url":"https://v5.airtableusercontent.com/v3/u/49/49/1768197600000/Dn1J2Mw7JuZvAjR2B6J4IA/ovpIX51L5gkaIRNMb54mn1bceor6GKS8lx9XrdEjY8Fknp7-tWep_wBvZELOfQqoMXaVgG7bBTK2w8x9tQ2oTTRqWrml-dJKsn0PIdcYE7MWAxGWga7CLFxO9WK7Tm9TPEyy1buzuDF9FdTMQCvdnQ/FgHyLsOAeWhfXL6iVRtOO1Q7THuz75glhNTPPUtRaGw","width":3000,"height":3000}}}],"Authors":"Ilona Andrews","Series":"Kate Daniels","Series Number":4,"Readings":["recNMLbSI2xbELJZR"],"Date Added":"2021-10-01","ISBN13":"9780441018529","Genres":["fantasy"],"Author Background":["by-men","by-women"],"Number of Pages":349},"Rating":4,"Read In Year":"2021","Page Count":[349]},{"Id":"Wed 05-26-2021 to Sat 06-12-2021","Started On":"2021-05-26","Finished On":"2021-06-12","Book":{"Title":"The House of Always","Cover":[{"id":"attv8BBbVBra14AtX","width":658,"height":1000,"url":"https://v5.airtableusercontent.com/v3/u/49/49/1768197600000/rSEMd7sGDfxMUuq92mBNMg/POhAEQAUZAubo_frixyOq08PphSWTTfZpHR7SFYWPElf5fj_SJL8bVv1ETykSpdFLPGfk2H7md-IOZkhcP7WKvwd-lJwm_53ZgplR6MVJZShPjpqFr-sY_BV_XfKJKl1tlwIm8mFfw9As4YA66Gd8g/kbdmsfYIpHGajsl-Rda3b2geqbnkZJuIA69b_LJfrHM","filename":"55077705.jpg","size":415562,"type":"image/jpeg","thumbnails":{"small":{"url":"https://v5.airtableusercontent.com/v3/u/49/49/1768197600000/QzQHlnZbIruLgek7T7T-fQ/hcfJBRBCgBSAXVAE-OobDEXf8WxI2Of3zGoOPrQStKMR0dnnh0G9tMVbE3W0LwV6Wkre861hJ05b-METanU9vYed8482M0_wkdWvguGv1YYhMRUTrDnlBptVTtFkNx2HrvaLm6gjeSp26TyjKf_H7w/FoeHrw4CtGoA7QMw5dqKzhmV2zKR6IWZ8lPY-xgyZss","width":24,"height":36},"large":{"url":"https://v5.airtableusercontent.com/v3/u/49/49/1768197600000/HhpFb8sHRYH2L6NiiFOTbw/NxOcWQs74KT12eB0e9ube-omyyykR7XJQc-3YgRMjD4auP68y4rANP47x41clj6aU8Gcptw5AOqsNmlQJCsRfvBXivrScbkzEZLU_K8IHNuMwWjOlwCod_RL7cHi8pRvPNZXWCzinVcHLn_aQxQBMA/qeh0ZxqsoDRaPdttAOHDdmM_Ev6vP0Kt0bWT3-rGwL8","width":512,"height":778},"full":{"url":"https://v5.airtableusercontent.com/v3/u/49/49/1768197600000/6SR_vUKdxnUeCdGx0ebVPA/sItHbKmqedttl4M2oJeaK3DeFYw9U7rMH_gFr8gloSzqy3MDAAsIDV5Dz8xERwusg6TJUPyqF2UcW_pvjnaz3sde730zQchaLAad1Ijm3iHsBCE-L0IpfuiSZIgLH8T11OXnIyxPmmvpHtdJuaTIfg/NS-xbQ-WDGlrM6cbHvAuMn6ynw-V8rzAJgCfLhYO8dQ","width":3000,"height":3000}}}],"Authors":"Jenn Lyons","Series":"A Chorus of Dragons","Series Number":4,"Readings":["recQG6RKwLaxyfl95"],"Date Added":"2021-04-30","ISBN13":"9781250175670","Genres":["fantasy"],"Author Background":["by-women"],"Number of Pages":544},"Rating":4,"Read In Year":"2021","Page Count":[544]},{"Id":"Sun 06-27-2021 to Sat 07-03-2021","Started On":"2021-06-27","Finished On":"2021-07-03","Book":{"Title":"Tiny Habits: The Small Changes That Change Everything","Cover":[{"id":"attCTTG4mBHDZ2xt9","width":1838,"height":2775,"url":"https://v5.airtableusercontent.com/v3/u/49/49/1768197600000/NRhx0W9ZNGM87MsWSAhF6w/DIKLKRhX7HUg7XP2t-P8B7DVm1OttRaQPFHhjWfcb7mEcP_lwzkzujjB_jOeFD8t-eAT6YiGcljApwfC9nOZF3vePiNj1zl0CcvQTX_vlYWRj7s8wgW6rYSnHDbcD0tJ0CfjE9fMtfm4sfqT9TH6Yg/v-dNy6P4aoQxnFnSaGU-9XoS-XrCW6WxoNFjzv2FkKY","filename":"43261127._X0_.jpg","size":707945,"type":"image/jpeg","thumbnails":{"small":{"url":"https://v5.airtableusercontent.com/v3/u/49/49/1768197600000/SU1Hj0DDNOEqlbamxrlY4Q/eum3fUmkY5xu4p6PQua-SdBzB5XucvkKyuI25tavuz55MgKcnITRGZl1pg4d97M6WGJVrrf0VOHtoi5ttNlI35i8BoqIIbYpy4cYMpDet3I5_oFajFyUeqlt7xVveA8whtBiGqtDR39Eyk7sdGFn5A/uqvn6rKpz6ftaU-ScM31C5dw3U8GqyAFxXrvkBMoAgg","width":24,"height":36},"large":{"url":"https://v5.airtableusercontent.com/v3/u/49/49/1768197600000/zm0GUfAH-_KmYY7T5FxOuw/pXeJhJo5LyuDyVo_DIHw2M1Hwda9XkyTzLDU4JzTrHcF2v9dY_Qi6rK84TXLXPXUqCr8UVeTIEq-CdhWBMvcpZosqkBMICZo4jWV-W5D43dwUzQ9wEMev-2-Dnz7iKLWJ5bzL9CtBvuL_3uGU6x2LQ/ivo6-bESJ4WPWNDv9GQ7L8G_NC9ppadu9pQJDPWO-To","width":512,"height":773},"full":{"url":"https://v5.airtableusercontent.com/v3/u/49/49/1768197600000/Md3XUqQpEVqB8-8Da5fUKA/MPO6Q2dRP9xoKshwZvPc6RAS2qsO-wW26HSMqdmScfvM9eerbpnCzS4KT72nSnkFyWTz8E1mLXivTN_FHeecFFN9vc0Wud-5HJsUNBGp2VAdpQNIBrj3uJt8dlR7rNMtEKFbb28XoRbxJh7WxOjYUA/jRi8-bbhpuu6Q-v3voDsO-36IE3ZFSCPRKZ9m4T5vfo","width":3000,"height":3000}}}],"Authors":"B.J.  Fogg","Readings":["recQo6l3vqEKjtao0"],"Date Added":"2021-06-12","ISBN13":"9780358003328","Genres":["nonfiction"],"Author Background":["by-men","by-lgbtq-author"],"Number of Pages":320},"Read In Year":"2021","Page Count":[320]},{"Id":"Thu 02-11-2021 to Sun 02-28-2021","Started On":"2021-02-11","Finished On":"2021-02-28","Book":{"Title":"Nophek Gloss","Cover":[{"id":"attFxDApz4YH67fnY","width":500,"height":771,"url":"https://v5.airtableusercontent.com/v3/u/49/49/1768197600000/dPOOuW0H-lKGyXw8KzBcRw/vI4zOYLi8oIlWTmQlB9mlAWL2QJCVI16OOwAh0QGwPYdz9gMCCcjF3TzZWRPUTo4FhHvsg80wvQdGFP2d0IGDHsCyEcqpC2U4OphQSPrfyqbJav4Izuutdmisu1D3SQNEKb-rqz1H3tczrlJAYo_SQ/EGm89MAnDQ2lqwSBIxo3xZ3nmgbUEBlT3Rfg2Aqnlr0","filename":"50998092.jpg","size":263890,"type":"image/jpeg","thumbnails":{"small":{"url":"https://v5.airtableusercontent.com/v3/u/49/49/1768197600000/G1wCIQlhFoBoV_8t5fdtGg/OOIPnslwsqQyADox8IPbU8Ubs-vW1liuZD4H7W-ACtLd3iZvLcfyKoZuOI0V-mSXjHBCQUvv87lMn0UfuZSfoASb9ivqkwjHD2xZI_d1Cv1qHbWbwy18vSoDn3MqGZbQHoorVMljliXMYFGVOOBUDA/AKw3Y8NLgAYi6stIw5tDyt-9ikzYlHMeRx1pQ_UZk3M","width":23,"height":36},"large":{"url":"https://v5.airtableusercontent.com/v3/u/49/49/1768197600000/FxWb0dOppeuPGDjrVtXhdw/TS2voZXD068yYpjhWWS1OoVhqjnGeAxQ7ipNlQ8bmr6wmvSNBHpt1pDsM-Bsqt-yFaUCFmB9ZPkeDrS7ZKK1ZNyTe8RXRi6Vn8xYYG7rVHnIwnwNFvVhaJotMycAL384965nmxyaZ7VGKQHxrn_VXQ/K1QjbsnxOH8eqGIgp-qGIl1AnvsEsyAky9euf70MuIQ","width":500,"height":771},"full":{"url":"https://v5.airtableusercontent.com/v3/u/49/49/1768197600000/bQPdd3Sl8hzerFPEvd-N9w/Nm0_Z1GbTArMyxKUnwMKZWjGp81wFawqYzyOzbpPCqEFsCcMvtEo3-QieR-2AMd0NJUjkukq4O1MSgo5DySAnqLSlNeiYoCXneH5wc9nufq1kK9JjiZeJFrlczH9ElXGUjWs7YUTjYeHU_6AkAFeyQ/esXqGeza-uE63J09Gr6Cwy6ef-PHZncwqaRrrPEI4iU","width":3000,"height":3000}}}],"Authors":"Essa Hansen","Series":"The Graven","Series Number":1,"Readings":["recQo79c33Gl7hTix"],"Date Added":"2021-01-10","ISBN13":"9780316430654","Genres":["sci-fi"],"Author Background":["by-women"],"Number of Pages":448},"Rating":3,"Read In Year":"2021","Page Count":[448]},{"Id":"Sun 11-21-2021 to Tue 12-07-2021","Started On":"2021-11-21","Finished On":"2021-12-07","Book":{"Title":"The Dragon's Path","Cover":[{"id":"att3D60ZK9BVSXGHG","width":300,"height":450,"url":"https://v5.airtableusercontent.com/v3/u/49/49/1768197600000/hz0wMFwjMTc92sv1z9VWkA/YAKUebxO5NaZSdOxiktFzGUo8Dxq2JuSb2dUjGCLutOJEskhSfWJaKif9khpeKLrPv3O6gw-i3gvJdg-xzJPu3aohyGIxgDnjZ8PTJlVQ34G9SpzBXMRlmnbuyjk1j11ihg6Rd93LZWLonjxyOKkTg/wBCb4avr6n-TLODJlWbmUUiKVKv6ZFP8Fjb9lFbtmcU","filename":"8752885._SX300_.jpg","size":35177,"type":"image/jpeg","thumbnails":{"small":{"url":"https://v5.airtableusercontent.com/v3/u/49/49/1768197600000/5iClT69-wX52zGFsYEXheQ/lXEFK33XdRl8f0gzEtSMVfl5BPNUkXs-y63lIEYsEJxfcifeMbq9PfdiPNWN1G-4oWqGsTs6F9mOcqmKXLVpdQzyzJQIbhTBr9J6EjBCsq3KkfUHj6DD3P7Hc7kh2lM1orYS73V1q4cMssOOiRKb9A/X4Nz3Oo8T-IlD48Mpocml9hmGhZKcowfGqmVkbWMdTA","width":24,"height":36},"large":{"url":"https://v5.airtableusercontent.com/v3/u/49/49/1768197600000/xLUMTOHSfXTihDoXZ1caDg/m5kxfx-p4peJeFf0UsXIfhwDNAQcOJ0NtOLVnhYiaMdfUSoJ_7D76b3rvMGF-P95TnW0UuIfILBRAgPJvb5VY2WfsGWPHXPwyXSOnr-4aUUevpOqwoEMiLAVDlF3TomXJGL7QN8btI8NjzrTL2ys8A/ZPdlu4esOIetA_tv_L2v22zVOY_Fg6XirrC75JvBou8","width":300,"height":450},"full":{"url":"https://v5.airtableusercontent.com/v3/u/49/49/1768197600000/ytslSM47QJDnOWNVJAozGg/MG6j15iwAAk9Yyt8emILSQOkxIzx8iL8Swy0kJc2uSpRbmyu18wEsA9r4yem6CQjfBy-pcQ4RPy0mIEY-BZIQpm7mp1-P--ys8N4jtcH839b1D5oDeIqRnnPby4JQuw1Glt1tVNb_5uJRuIZMICz2Q/oc7qyvpSbWhxlMHDdr5RFKwJfHR5W8Ejd9QgsVbz4DQ","width":3000,"height":3000}}}],"Authors":"Daniel Abraham","Series":"The Dagger and the Coin","Series Number":1,"Readings":["reclY7OvvOSBAc7Qb","recRdECiXQvHivnam"],"Date Added":"2020-01-19","ISBN":"1841498874","ISBN13":"9781841498874","Genres":["fantasy"],"Author Background":["by-men"],"Number of Pages":555},"Rating":4,"Read In Year":"2021","Page Count":[555]},{"Id":"Wed 12-08-2021 to Sun 12-19-2021","Started On":"2021-12-08","Finished On":"2021-12-19","Book":{"Title":"Magic Breaks","Cover":[{"id":"attirr6QnEB89AfR0","width":317,"height":475,"url":"https://v5.airtableusercontent.com/v3/u/49/49/1768197600000/wN8EbcqrqGBalw8pimNt3w/KJKCjnrKx_GuQCwspF3ysOETzI8wkx8_z6PumxY0XdUhJQy4x0ljp-uiV2KAhkxphab-yu3AC9lhClmfTIITK761phlIDVLDoxcJAFuG_BVuYha8hkVw8jvIjoQeKTb3v1WyFYqC7pPJsmCJyAtTsQ/kWvEs8zKfMRuAnKhnITBd9UNwkuYcxC8qRSA6w5OHaM","filename":"12119529.jpg","size":92078,"type":"image/jpeg","thumbnails":{"small":{"url":"https://v5.airtableusercontent.com/v3/u/49/49/1768197600000/e9ybMGUQGlI3LU9sCm9CjQ/9qq1R7FMD55Z80GktCTPmTkIw9dhotOQFlPHWolfTP6ingxdxwj7faFKWqntoBPL68MPOPiRPiWs-lWVzPvtUY7flatsD_JlpUbb-YojNUum_4QvrdtG4O29TpK7hi8UFPauYoNQzQD6HuxRAWa8gA/KMc7FDI9V7EcB3Wz-KiAWpCbV-0zbAV28UZXLWqLwFg","width":24,"height":36},"large":{"url":"https://v5.airtableusercontent.com/v3/u/49/49/1768197600000/mvVSDZ6kLxa9jbd89EHyPQ/D2R5wT93neltb1ipoaSR87MXXOcy9O7VIJqBXmCA4vlzzGQVzzupRurmrUlpmaEdCpGmkYF6TbWBL_N9V1c-A77Vai9cd5g2T2trtGpen16waK6LuRXyBKdQkT8fBFHD2zztdGo_MQPRXA6pUgiDwQ/lzYbm6FtECBanTP9BXSEI5j41XEIrCPQfmDnZRZ9EfQ","width":317,"height":475},"full":{"url":"https://v5.airtableusercontent.com/v3/u/49/49/1768197600000/Mz7Hgjq2p4b1EqpH42fxPg/WbmWGmtgrmzA6SFGk5JxoQ7pKMlZk2zjEjhTItjTLsUuc9CPHdL6j_2uhTcRYlIYLhZu7xeeHi-VzeBoiZM9y8AELHnGBdvl7b9-h_y05xvOgZqC9Y0cem91NG8nEbOG6VOzKGi5q91hcIx1vod2uw/u7U7Q_2o3gYpcDC6UIkQerl0GLXbjfLGCXM8Ye2aR8Y","width":3000,"height":3000}}}],"Authors":"Ilona Andrews","Series":"Kate Daniels","Series Number":7,"Readings":["recRskKb9vQFRzgf7"],"Date Added":"2021-12-09","ISBN13":"9780425256220","Genres":["fantasy"],"Author Background":["by-men","by-women"],"Number of Pages":381},"Rating":3,"Read In Year":"2021","Page Count":[381]},{"Id":"Mon 05-03-2021 to Sat 05-15-2021","Started On":"2021-05-03","Finished On":"2021-05-15","Book":{"Title":"Foundryside","Cover":[{"id":"attDZ0W4aLHV2pTQT","width":313,"height":475,"url":"https://v5.airtableusercontent.com/v3/u/49/49/1768197600000/UhF-FEdPUvk8lnYKJ9Obmw/5VCHt-yLQHFbz8L8YWuRbHJotwCS--1O7h1IfCnjwPD9YAchJWCG6XAHeQg1iU2uiUqhSqADY0gHpcTzJxTcse7ABpDkZxjo5HO3HrgWpdUYKbBcP3fl26ZUI_dkioobi8eSkcMZgRfNsgaimPjsPQ/BzC1V6q2NAsUcl97aCpcv1cLqTmEzLc9cl6_WuYfEEs","filename":"37173847._SY475_.jpg","size":73754,"type":"image/jpeg","thumbnails":{"small":{"url":"https://v5.airtableusercontent.com/v3/u/49/49/1768197600000/NcYZ1MO6L3xyAJTymVnsaQ/0_JfU_wipQdNJbkC1yN6HnCFA4Z9_egBVSIbYegbvzg_PH6tQZnEhZDi4dHY6AmabiaGWWgFMqEVjxsXY97qvxJyY3UJrYKueFB9te1Ag1mbP3zl_09ltF3zgdFIb_iZRrXd9tSSsC6V-K3_srZ5-w/6vzo637kDyWjRyf9x5dGOuld9qFiAri78znjBkh8zxA","width":24,"height":36},"large":{"url":"https://v5.airtableusercontent.com/v3/u/49/49/1768197600000/yjFgYRnXmbFLpvPHDF0O_g/wwyhZ85DJkb-kZulVaBbp4G2jLaojgPMaAUMapLuk9CRUDpz17lNF_Vgxk2lJhuUlrkh_efjE2vsYgTz-Xh0HU43eOJ0K80FFKXn58WyjCdOqiFq96kMBhN5Zs7gkumvNcR3C1TepYR82SvynYLCug/4NiZPgmFsQd5w3M6qxiF7sQa9k0gNM2HJ_x3Kf4_nyk","width":313,"height":475},"full":{"url":"https://v5.airtableusercontent.com/v3/u/49/49/1768197600000/giMOZfgov5U6-hCcpr7nCQ/MS7m-gGpQ-SEdkDKG4iTwJyLMxpU44uojnLbqthuw6_oEhuuASsIg2EylNDeiEFbE3JH_l8atdEAkB6POYcmxK8NzIctYB7DyGdrdUBD7A7r6JEiOg9uYTJ2HSI2ZxkBSH8H9nC3Gv7f6wXkJyc6NQ/v7uKgy4u2dUHIPsr-p8G-Nv_DPogsjop7i7gBd4mHtI","width":3000,"height":3000}}}],"Authors":"Robert Jackson Bennett","Series":"The Founders Trilogy","Series Number":1,"Readings":["recUlupQOe406mbp6"],"Date Added":"2020-04-17","Genres":["fantasy"],"Author Background":["by-men"],"Number of Pages":512},"Rating":4,"Read In Year":"2021","Page Count":[512]},{"Id":"Fri 11-05-2021 to Sat 11-06-2021","Started On":"2021-11-05","Finished On":"2021-11-06","Book":{"Title":"Magic Gifts","Cover":[{"id":"attQJQg9w1dP6Ed1B","width":292,"height":475,"url":"https://v5.airtableusercontent.com/v3/u/49/49/1768197600000/RnK1dsy_8Bjxq7qQXn-mBQ/-jC-xKY7613idi5FHsCwFx8SAfHbAhu3UokZmuiDnGmCuAcAQ_23L5TqlycaZL7EBXZ48VmgEstzAB_H9IRKUcDyR6lBfQPlygb5vnKVOEoaxMrF0c7S_xzWflRxXJ-feHdu34H254nL6O3b79ZSvQ/xVlHhTLLt8OVIFCAg87S7SKg6XbIaUzZMqr_a-Vx5mU","filename":"13299211.jpg","size":31193,"type":"image/jpeg","thumbnails":{"small":{"url":"https://v5.airtableusercontent.com/v3/u/49/49/1768197600000/z62IJIfZQ_LuNLhLzHfx3Q/CQwXd82vuRraQjbpSjl_Hrgg_7EBhtCuELdq-qzgpOL8ujO8I4Z51rWq9DSqhRQ5gUd_4KlKFVMBOy4ajSftKQTfE8UDWF0m-48iiJWj-m7eNrcVBmKxnYo_qvIk3zQlxasyyzHOIOaM00XN891Jgg/XRaCDeWSnib8AK-bF7nfDqcGxg1h72grZLRC6LFlR_M","width":22,"height":36},"large":{"url":"https://v5.airtableusercontent.com/v3/u/49/49/1768197600000/paep7NUog--gU3h_NRjuAA/b3t6Ko0aafsB_9aksci17fv6l2Q8W-Ft8xt8rC_oW1tLo8uBSuTDm3HCIq7rBaV0XGV6hTz9Ic6tT06X17o_DkyNz5FvYgwXEQdmDKt0f5tYZZOxLUKwzX98GDSlnmZk0ojc9YDqGeanE4-FVij90w/C9AvIzWWW-2qnIRgsorzviqUK00Rjn7hNe7vtkB381Y","width":292,"height":475},"full":{"url":"https://v5.airtableusercontent.com/v3/u/49/49/1768197600000/77b81NT16MUEXVEnkLmOJw/yj6qRZXSYb7Qoh03AI9qVnB4E9ybGQPU9S-XXrGwK_oCD_7p6bdec4-jePLx3zXbOTFiGtSzUuMiScQcSjBUDqG6lEkMON42MHxqURgdk_ccn6fnTJQZ695Uh17kmeoNx9CXb8UFks8GdjefGkzANw/EKjGTmKkSv70EjZnZKD0tZJnQWTRJQnWqELDfKm6JrE","width":3000,"height":3000}}}],"Authors":"Ilona Andrews","Series":"Kate Daniels","Readings":["recUnrtOk8rBorigN"],"Date Added":"2021-11-08","ISBN13":"9780451487896","Genres":["fantasy"],"Author Background":["by-women","by-men"],"Number of Pages":149},"Rating":3,"Read In Year":"2021","Page Count":[149]},{"Id":"Sat 01-30-2021 to Tue 02-09-2021","Started On":"2021-01-30","Finished On":"2021-02-09","Book":{"Title":"Dead Lies Dreaming","Cover":[{"id":"atteFEfBFeTVvz2I9","width":269,"height":400,"url":"https://v5.airtableusercontent.com/v3/u/49/49/1768197600000/tHbxnDIbmswYy8ZERu40mw/CJb_GTijd9OLZWNT6yUpWTafRMUk83wIkbbcw9WcjlExQ6JNsdJ4uQJdJK4q3A4qrGkLLvUHWmKUYe_yeSqkMEOKSV3unDXQEdI0PTdhl8frolLGJWTBb6Pjp0qcDedDaLophPpq_R0oWHVdJIYDdQ/jqn6xm47UTks96pdQjKvgbeD5SVkL33y4w9WgpdSk1s","filename":"49247257.jpg","size":106666,"type":"image/jpeg","thumbnails":{"small":{"url":"https://v5.airtableusercontent.com/v3/u/49/49/1768197600000/LKTpMfsfW5z6Ycqh6CffJQ/nF8bPNIALO9J7sWn2BS9IDeYkGueCHvC5EKVPctpyFThuUFdlStvaLJL1WAPLzZQTdUVfOBkNZoWKeL3H8-sV9upvqcoFMzOnP0uHP2hfc3KXq9Q26JLRma9O8Zhz-r2lxS8iTeDeukxDG2OYLHlkg/t0BKlrWK5A-SinNdtA2_Nsw1d0aOv8f4Ceke4fhLBF0","width":24,"height":36},"large":{"url":"https://v5.airtableusercontent.com/v3/u/49/49/1768197600000/GfiH773gOSflnanxLL7JmA/AkcIDZO-wAdDL1h73HhRHDHfpBu8BB0VCTqJNUTsxxuNGMGpmaRO6MmtOwAdzdn2OBmsmRUu7E1XEFcq6Hd7WbWzskdJqq7xfFLEXuhfBgGFbTB1ikYsBtkCDNFXoLU08YkbS4ccYKSgnNUGW28QaA/9cbvtINuceKMV6GYHbIq6mjo2M7mIjjvZT46dT9AybQ","width":269,"height":400},"full":{"url":"https://v5.airtableusercontent.com/v3/u/49/49/1768197600000/mQUbgdcIymXIfH5qAuFLAg/MfLrPgMDLyNAVHOAn3P4VdElahb0qkUjPLY89jZVdI-xrkkXR0AsJKlWrvZy8twUsQkge21-XupQShEnylS-PyNgCIdOoOwbhgf705Hr--_QNTIo6Lyigpli_7BeXCycn3vk_rzGQpfpgCDqENxo1g/7gTQXkANnDRYiN7A8_EFVEKJyaEBY5eeeQj4Ij_ms_4","width":3000,"height":3000}}}],"Authors":"Charles Stross","Series":"Dead Lies Dreaming","Series Number":1,"Readings":["recVvl3BBqvIrfHba"],"Date Added":"2020-10-24","ISBN13":"9781250267023","Genres":["fantasy"],"Author Background":["by-lgbtq-author","by-men"],"Number of Pages":384},"Rating":3,"Read In Year":"2021","Page Count":[384]},{"Id":"Tue 10-12-2021 to Sat 10-30-2021","Started On":"2021-10-12","Finished On":"2021-10-30","Book":{"Title":"Blood of the Chosen","Cover":[{"id":"attsHQQEcDhzSg4f4","width":1000,"height":1549,"url":"https://v5.airtableusercontent.com/v3/u/49/49/1768197600000/XjndMSaK-h-iFQiWVRS8zg/k8b6dhCD1G-y9DLp0Oz-ZqSeUM8QejoORiaMXvoK9e-jNDqg84goACyUqG26OjQtF8QvvrS6ljGTT_oAh1ZQfTJ0RCaLC9EdejIixoLbZpfjW3dC9urnWqenKiF28k6zUVr9t9oqfect_dn5DwhWhA/AvniP5f8F3NfaRXkxgo3JnXZXNheHb82GIJhJRsXuBg","filename":"57007705.jpg","size":358218,"type":"image/jpeg","thumbnails":{"small":{"url":"https://v5.airtableusercontent.com/v3/u/49/49/1768197600000/mHHF6WtJJHt04nRFToaoTQ/OxRz4VlBPeHM_EWqq1J8kuOA2BBskJ6XkbYne6xN3fajGBFqEcyQuR4M4VxHHY5jTY-Z91TKc57PBdY3o-65pfqZeRPq46_jULR6ybmtkVXc3G0EU0WfstahA_2pN-4p6tIh0nWOe_qli3MMx_iHGA/H_Xnjf38r-Hemgt7gAKPoh_s94wfMAeT9pFidGpEWGM","width":23,"height":36},"large":{"url":"https://v5.airtableusercontent.com/v3/u/49/49/1768197600000/8ldYqM_IPK7NXBIxhsClEw/kz0YieOXKiluVgt-_xdXqG-VfwxHCnRqKELw1TUzKpT7y1Eh-Pn4YnEvfD0hk5zgdNXTAew5jZTY7VJQZFjk1ddK4uvMH1vRehk8fkjzx8ZutA53FgVM06YXWjn90J6Ir0V9Q1KfiBz6gvK0oRKOww/PdpKS-Mz9L7ddKJM2sXrRuKWarf40SK-khXSQaIAhy4","width":512,"height":793},"full":{"url":"https://v5.airtableusercontent.com/v3/u/49/49/1768197600000/lENOZQHDfbozciKwNSUl0w/Lgda2_MYDCqMapMx40WX47luV49ypCTQn_ifKIxlHlKb-GGCUbrWuDtNk4Pl3RWM0c13pi3yIjhUQaVFgmQMZFrF4h9imIlGFv-ZMpvj1Ozu18hYnTGhbzHJGEZbthR02lCeNCkwSCvjOsXRh5hesQ/6fQijTmeZViyf_tRhhx0GOkiB3WGagljAZGtm6T1DXI","width":3000,"height":3000}}}],"Authors":"Django Wexler","Series":"Burningblade & Silvereye","Series Number":2,"Readings":["recXLmZKFWYppNyfh"],"Date Added":"2021-09-29","ISBN13":"9780316519625","Genres":["fantasy"],"Author Background":["by-men"],"Number of Pages":480},"Rating":4,"Read In Year":"2021","Page Count":[480]},{"Id":"Sat 05-15-2021 to Tue 05-25-2021","Started On":"2021-05-15","Finished On":"2021-05-25","Book":{"Title":"The Last Watch","Cover":[{"id":"att4nUPpAcXZTvn40","width":261,"height":400,"url":"https://v5.airtableusercontent.com/v3/u/49/49/1768197600000/8ikYcUm-yv9EfAVWdFJdmg/yUSepou_73UdfDSHtKlVgSKZ9YmJS7yUJh9YDyrSNy_WQtQdc0ZJ-a_n8HY4cte1PW1YmB3tbx0QBMOX4cY3bJ5dIxAXe9SAjjauUUZgO29I7JsZ2BCI-MLIe14MwhkPZTuJB1jqnRnU26sPvznfQQ/luAIJZTD6W7U-u0P_N1eqNYebM840pmIrVNPISFp-w4","filename":"53205794.jpg","size":68019,"type":"image/jpeg","thumbnails":{"small":{"url":"https://v5.airtableusercontent.com/v3/u/49/49/1768197600000/ag3Wj1ROgenFaEaZXSzcog/74yYoQTMFMsif0X2Pb3kjOELaXH5nQsWVB-8YIBlnBUicUnXP3E-I5KFbYg2-EI79ot6iNp2MnKYF1Ky0RvxMgmTxYFYF3SCfO2UUX5bfY9TDmyPEhAIGxfpFB4CcH3bZPfa5661loQpc5JUk-mvdA/n0P2vWwGiYtx3XP-30gr35AZIYsyoNN7lvLKPZWegHg","width":23,"height":36},"large":{"url":"https://v5.airtableusercontent.com/v3/u/49/49/1768197600000/J4TcQ7HAzc0HG9Omid1fnQ/TQkYNalqZyRXCmUYTY5HCOG4vIa7EfEetx20PdMkMQNILVQ-bDRYzLqHXw08W3atTJiytgSv7140VwCFHbjW21bGoDUa-9pf2osaqgD3NU-vzZiXG-LlYldWTQPxPn_m7wsXlXAL7xRUZtBlJoXmZg/ab2bhgGI3px575dWrV2B0BvSbZzEor8sRv_m-n_psiI","width":261,"height":400},"full":{"url":"https://v5.airtableusercontent.com/v3/u/49/49/1768197600000/4Q-sMehbzgACvHHg7UnS5g/Rnw6tVdHYiycF8f6zv6-J4Q2RAEIt-NPDS_-H79S6VF96s2UmvpeYx0CbQfslDFp1f5vJkuMDEKPCBc_kNxgVSMG5Ij9KFMdjYwE9ULRQyVmUY5F2zLWnt25eetnAjbjtk8FqqVbYx62SCQjTw03wQ/u6EXK-93B_UCes3XOowsCtYtb-8Rt43k9fBq2trInNI","width":3000,"height":3000}}}],"Authors":"J.S. Dewes","Series":"The Divide","Series Number":1,"Readings":["recXokc28XuJz9OZy"],"Date Added":"2021-04-14","ISBN13":"9781250236340","Genres":["sci-fi"],"Author Background":["by-women"],"Number of Pages":480},"Rating":4,"Read In Year":"2021","Page Count":[480]},{"Id":"Tue 01-12-2021 to Mon 01-18-2021","Started On":"2021-01-12","Finished On":"2021-01-18","Book":{"Title":"The Sin in the Steel","Cover":[{"id":"attYu20u0OgJBwBGf","width":259,"height":400,"url":"https://v5.airtableusercontent.com/v3/u/49/49/1768197600000/AGUg7mL8YKtuUu1PQnCFdQ/bWescoY-vB8lGU2MJMWPCAssSwsCqhZfyeETIrv-rAis3BBePi8frhnP7--GXKmtVAf9BdnPrRqeKb2BpJbei7cGFoo9OLsSSXIreQGH46EYkXdlUa0jPLLbjhwhRQpt8C89RwfhcU1Gtcy6KnR1Ng/PQ-Bl9UPe3AnUQNaH9U6HXrsYGDJDrfSBAuNNPvctDs","filename":"52378586.jpg","size":94722,"type":"image/jpeg","thumbnails":{"small":{"url":"https://v5.airtableusercontent.com/v3/u/49/49/1768197600000/r43AlRexqnTf4rpSWt7ufA/aG7VdCtYTbPYC15gfSDwNLOaasP-8Ps9UYSDsn0D3H1qLMBigl9v3lAw6ZJC01VrmBnWkByZGM3eCXIBXNmcThosxCt3VecfGB6fJR3-TXQcx-dlk2RK1DqetT8A5xhwUp_dtGHX9Pc7UkAxADGYlA/Z6Qoj1SbbTMRY_q7lzcGtDtvyrvGu_j3VW-y5RSe7nM","width":23,"height":36},"large":{"url":"https://v5.airtableusercontent.com/v3/u/49/49/1768197600000/hy8GJIiwOjv5wnEc6NJknQ/O-5cRRCR6TEyc4IVcourNNTtXdHjPEPi6wIopVg3Vvc84S0rT4AWqZMzlWeqNd146qLC1qB3OXc0nFDlUXI03aYHqBUa5GoMZc9exhu014QktCm5NkWGRvrfQg7xHFteKYnmdgByMRGLZDOb6HTlmA/LiNmRBu61YLRpaCaRB60hcmYh7UOOS5lZ3IUZT8CDPY","width":259,"height":400},"full":{"url":"https://v5.airtableusercontent.com/v3/u/49/49/1768197600000/bTfFNFY3jV7KpysyLorQrA/PqXk5y58YvOf4hx_NGyA0G5lfoRoK8bVkNKXe7rgK1ky2n01lbg5t9Kedrjiy-ECqTiDPMKJTp0H3V3KP3QS7J0mXFOW9n-e7qy8mjWVSWl1T26IuPrkezg-SsXk6W_8_96bJMdOf2NKJ1Pxc7fl_g/5VkkOy5LdA6Q3lAtRE5pX4-HWmFaF7IuYxFU9YgTc5E","width":3000,"height":3000}}}],"Authors":"Ryan Van Loan","Series":"The Fall of the Gods","Series Number":1,"Readings":["recbWuPXfzsFfzaGx"],"Date Added":"2020-07-23","ISBN13":"9781250222589","Genres":["fantasy"],"Author Background":["by-men"],"Number of Pages":432},"Rating":2,"Read In Year":"2021","Page Count":[432]},{"Id":"Sat 09-11-2021 to Thu 09-16-2021","Started On":"2021-09-11","Finished On":"2021-09-16","Book":{"Title":"Magic Burns","Cover":[{"id":"attUkSSjdktpca9j1","width":294,"height":475,"url":"https://v5.airtableusercontent.com/v3/u/49/49/1768197600000/3qrDYnj87KmSNcA2Thoj9A/vwCoo-EBNNWbsCHs-OHt6dTPMU94w0pbQyo3I4K_08z-lPNKl-uzebjBNK9gGBg9F5o1H4x0k_UoUkvZNS5OnqhKqjPADGKKU4lbFzAI9t8rPj5ZldZfM3yngm8TzzKCLfZw0Eh3S4KNTKN8x3IWwA/K9Spi-Z_j5jqYgUC8QS9dLBBC7f7OrMO2gvAae-SEzY","filename":"1811543.jpg","size":63176,"type":"image/jpeg","thumbnails":{"small":{"url":"https://v5.airtableusercontent.com/v3/u/49/49/1768197600000/SuoGs9OtDrwQzvBBJmwKkQ/jgRRHBPAUCNdx5C1KBm7zyBeR0wufywSmp3SoWRde2wmgcjsG7Vj4nGWfb_mA2FFJVgsyJZWl9WGEti4k1OUjR9eXPH1sszGgH_gP3HdAsJ5jlGnggmJttfZjXKClWIYlUervcEj5lM82OTVSgV5Nw/9vo0iMs2Jc_O629VQwqJaQIBympvbaCYACAtLxkDaIQ","width":22,"height":36},"large":{"url":"https://v5.airtableusercontent.com/v3/u/49/49/1768197600000/V7GIs8azSA6qYx5Zd-L9iA/pEiSM94eHI8KYoEKRFUzmZq7ynWK2VFU5lNGWNs6wSiIVT8g6zIrzvfI3xD2_Gh8nagYvBUTYnm8VP9FcjaYfzBKZWvmWiAqRCjlW3T3yjmMcJBktHilXGJXxrfeJeNvCpvfeDfAxronnEKftfxLTw/dNEuAODOBOPHv0PDptk1wbAbl7Ju-VosQTtfCaH5UWs","width":294,"height":475},"full":{"url":"https://v5.airtableusercontent.com/v3/u/49/49/1768197600000/d3R9vRM8D9rouMqrJyl41A/uAZWhoJsOEqbshvqJ6MlcEUKQp_vdv1CLdLDs9HXmObT-6aZvwOG1vt8T0W7zk0DIyLuig6r9pITonHUPva9Eqqs59ShqZT826fw_y5xGMeVN28oR0NSBRPs_XaSnQOFm9v8cdJ-iaSrSowgeAENsg/EAR0N-NCxZEFHIS-L_hkP0YUpn0MKsgQN-udvkTpwu4","width":3000,"height":3000}}}],"Authors":"Ilona Andrews","Series":"Kate Daniels","Series Number":2,"Readings":["receJahMQn0JGu45y"],"Date Added":"2021-09-11","ISBN13":"9780441015832","Genres":["fantasy"],"Author Background":["by-men","by-women"],"Number of Pages":261},"Rating":3,"Read In Year":"2021","Page Count":[261]},{"Id":"Fri 10-01-2021 to Mon 10-11-2021","Started On":"2021-10-01","Finished On":"2021-10-11","Book":{"Title":"The Blacktongue Thief","Cover":[{"id":"att0qGBvwb6YzVkw4","width":1266,"height":1913,"url":"https://v5.airtableusercontent.com/v3/u/49/49/1768197600000/zDBmW14x27oHmjdLJlGYeA/gWV1CofKaB8jmHDDmKg9_TfvC8Xa4IexNAMb1h7wf0T-lHgrVUHLapWsKhi3zqgbgQhwR_dPgEsS-wHxK0Of_efNk3mV7jYz2P8Rk1q8RZRseprO5BgPyWqroz5O6ziuvVG808ltJhpb7J30V1T37Q/F0nYyOuFoRCDvf68Xej6xItjVySvDIi_9l7W-1koirw","filename":"55077697.jpg","size":551260,"type":"image/jpeg","thumbnails":{"small":{"url":"https://v5.airtableusercontent.com/v3/u/49/49/1768197600000/usfaM_KmEYbZ8pG3LkLiAQ/jqfc3g3twwT6S3qgXsiJhfVbDO6LCLD8t_55Mbp0HFYWgP4PG_-0oXYyWJ95keunzdWBJpdZ23DGR1uHQvA0FCPk5jlnQYIxBIUPTJws7Bq8At_7lwaRr6Gi5pausfa1PAt_KEOm_F_ChX3VK60dUg/7PLAxcmrIwmoK3Zwm2pIeahVbsa7Ec9DCVFJyAUVY18","width":24,"height":36},"large":{"url":"https://v5.airtableusercontent.com/v3/u/49/49/1768197600000/HmpZm-EWtAItoD85lVUJ0w/ByMV3VHE3T5yTUx6hY9MFpRNmqb_3wsiD5ysXBtsP47O6JUYNLSIqPObwYogL17yjCAZ1RbzhhHEggdfM6MAh-FHWKdzz26oKzIjwTGTprKWw8oiZfpTDE4OuD6ZA8Lq9Ch3vqmFUJIGcn2Sa3GTRw/fgIJqZQ8lr6rwF9iPRtYo7EbjFZfZrSjFmzgHqxgB2I","width":512,"height":774},"full":{"url":"https://v5.airtableusercontent.com/v3/u/49/49/1768197600000/OE9t0xJczF-_FGZcrubL-w/xer0AEXH_pggxqnGtp81iZi6Ohsl57HCepwTvA6yF-N0nozm7MQjBST0Foy3kvncIzH_qgSLwSLT0TkdUpYpqayha2qctsfkLBK94QUkIssJD4jVD7K8QGq_mgOcOL2vfRz4AP61iiPK7cxMhOrOow/96GI-80CIPKj8dpZQf2y_qRey2FF_RfVqwylx8SMc5g","width":3000,"height":3000}}}],"Authors":"Christopher Buehlman","Series":"Blacktongue","Series Number":1,"Readings":["receMkzQGHwI6bR2h"],"Date Added":"2021-10-01","ISBN13":"9781250621191","Genres":["fantasy"],"Author Background":["by-men"],"Number of Pages":416},"Rating":4,"Read In Year":"2021","Page Count":[416]},{"Id":"Mon 08-30-2021 to Sun 09-05-2021","Started On":"2021-08-30","Finished On":"2021-09-05","Book":{"Title":"The Bands of Mourning","Cover":[{"id":"attb9lNX9FxJkYrWo","width":200,"height":300,"url":"https://v5.airtableusercontent.com/v3/u/49/49/1768197600000/NYOgIdQgUmJTgDECWZ9bfg/sCmpj56Jl1ceEsV5NjaAOtPtcrxStAgQTVZfibQClefIjpUW2LfEa3z-U5Ng9tcu3amo5z0ulveLwbs-4wpSVtELo8fqP-_Xsp6irJ4E5o2VP9ahUIUMtCU_RM86gMRLar0avlLSyx_s6ZnlbpHBUQ/1j6jNTFGRcoLySMnhpoz8mFhAdVA_SQniiAeAhtXrW4","filename":"18739426._SY300_.jpg","size":20887,"type":"image/jpeg","thumbnails":{"small":{"url":"https://v5.airtableusercontent.com/v3/u/49/49/1768197600000/jkwqVg5t-ISZaxacvcZmug/VoAii6ifDqbItaOTKbwqRFocg0hVelKbVP69YRjlLHl4a-SaBIj9Yk1EqQwSa4dvlsrrF8F_CFZhf8uoxzm193OIWE6-Q_6HhjBHAwLwLa4hSLYoL_E5e2nLV-TjfMqZNU_M7Bdh5yWE1Y-bCDXxsw/o-oEnF7GmeNl2c6lwkP47A2FXFcvs7tLtyHUXj0yaQA","width":24,"height":36},"large":{"url":"https://v5.airtableusercontent.com/v3/u/49/49/1768197600000/nYe5bAIXOr8jhOj3NbX4HQ/rJZeB0QrsI-q7-nCj3Nrv0vGYJS740LHf_zRoxQMcOL6wV19UebFXWwTcYzG3EhL2JtkOCtoCp3mkj7nTNYqaO3GU4hueKFX6pYY4B_7czfw8FF4FN9cXQidEXD6T2NWgodFQaCN10ddV5nBESuZKQ/ch-MkH3RDS0YcITzIxsob2diK4ac90EiQqwP8Qmuw7M","width":200,"height":300},"full":{"url":"https://v5.airtableusercontent.com/v3/u/49/49/1768197600000/4pBY1V3yBNiT8IHMZmJ-7g/oAnwcKidiKUnHOx7pXHrYykZe_KeITr-VRLNAJaSWY-2Ya5dhs8zOoIF_-0swZA_ktm9_zZY72kUW9oneYSb9ZbSlbLurfm-vcADEqEwGaijthXNMb3-4cwkMkplOP0Yf4SQqWybflVx80WcJIBDOQ/hR-u2S2KDPHMu3i4IFRs_2DozB76eOxk3rSWTY1sdAY","width":3000,"height":3000}}}],"Authors":"Brandon Sanderson","Series":"Mistborn","Series Number":6,"Readings":["recUU2gotC9jqkBE9","recebYMgajKDv2I9O"],"Date Added":"2020-01-19","Genres":["fantasy"],"Author Background":["by-men"],"Number of Pages":448},"Rating":3,"Read In Year":"2021","Page Count":[448]},{"Id":"Sun 11-14-2021 to Sat 11-20-2021","Started On":"2021-11-14","Finished On":"2021-11-20","Book":{"Title":"Magic Rises","Cover":[{"id":"attYIFoNuGp5cTftn","width":295,"height":475,"url":"https://v5.airtableusercontent.com/v3/u/49/49/1768197600000/yWFBVqpyuxfg99OFB-ReYA/zWUc8r8yZ-WH4TPC3zHu_8orT_DD5-Ab22XEKSHOozkMOsJOw14MwDGiNUowLz-YGeINJm1eSpyLju1VS95DjePfWMBXeL8cShBlXt8M31LffitQlugpUaZomEl5i6nTCX9O8DSADynAHGucQKVxKw/AfYCtWHtfrY039tS471Xl5vfqyNsknNDwdqrJXp-LrA","filename":"11544421.jpg","size":63903,"type":"image/jpeg","thumbnails":{"small":{"url":"https://v5.airtableusercontent.com/v3/u/49/49/1768197600000/49oxfgv76bLtNOcsb7-SaQ/TDu8ZC0mReBJZzBcs3ufRe3dXmbY82Gxf_2C6-68bRS3KY5AsREPIBJg2y8w_xU2Xxru7z0_XYjyzbbuDV8JofxN6ruki2wlpee7EkJfSORxZAHJ3U912uRZ06DIOLJ5LKTirUE2GQnEVOVmyvJgcQ/z7VUMsrHBIbk-LjrMfs384mET3uegJ2i5hbttH-iq7I","width":22,"height":36},"large":{"url":"https://v5.airtableusercontent.com/v3/u/49/49/1768197600000/Ba6yie6oe4EPJ3IFLa2akg/_daLfOVVTkRwdNDQjIEB0VcSwlHd6jetRwKMG911doZNC-WUIQtVJhFMBPpiisq67ssp8YDjWT_zxzTweJypQWjx2rf4xdcpIL3xy7n_tD2-zh6xJvnCNoyjk_FuCDzzQLzXhsy8Los_AsMkK3cAnA/RUZpP3iYb_CR3Furt_k1N9MENj3gZfHMCp9mn6cFtig","width":295,"height":475},"full":{"url":"https://v5.airtableusercontent.com/v3/u/49/49/1768197600000/MXGbjBZrDasmw0-K0frK8g/y8i0Jsy46JSksbiuuEXAg8qW90x-c2x1D0ndFBQChqv-fbBFGnoQ6sEgEUhQiMiLiqJvoZ8CRnZ58o266iyNcLe1wUUpYxznEC1QI98llr8fQ20zSC1huLGE2zpL8XLqRNh3sUeZ6Lum2RvGvJCT2A/Wk59KO68mknI8WN3wC4PSp7xYj7dpbmioKVJ8TfecZg","width":3000,"height":3000}}}],"Authors":"Ilona Andrews","Series":"Kate Daniels","Series Number":6,"Readings":["rechOLfDTmPtMUbcZ"],"Date Added":"2021-11-21","ISBN13":"9781937007584","Genres":["fantasy"],"Author Background":["by-women","by-men"],"Number of Pages":357},"Rating":3,"Read In Year":"2021","Page Count":[357]},{"Id":"Sun 06-13-2021 to Sat 06-26-2021","Started On":"2021-06-13","Finished On":"2021-06-26","Book":{"Title":"Mistborn","Cover":[{"id":"attnIVxvrzvq5Epn4","width":197,"height":300,"url":"https://v5.airtableusercontent.com/v3/u/49/49/1768197600000/DXE0tFdY2Yj8hOLa5b6IvQ/P0kfWiXDHnccnFqLrvxQt9M3BFb3GBt2loRzJKpvTJEKITMjD0c_xbckBf_1j11IThMxSYWUXahucSeS9RJ6IaMgq79vzAkc0Vn28u87ZcACKTiHFP6ta_T2X9BNM6Fg8AxGBHHFQr7BcFeY5JTXPQ/D-Mq93XX_2zA5ZhfsO6WgL7rW7-7vWmRiD6dyIOjTHM","filename":"68428._SY300_.jpg","size":22667,"type":"image/jpeg","thumbnails":{"small":{"url":"https://v5.airtableusercontent.com/v3/u/49/49/1768197600000/4doCLZkWTuJAa3-Vtl0P2w/_aasX4aAsPGrk4Vsbbix-1itubs57E6o7_k2lBwXKOBZouo78DxJDyq8hGDIE8ukl6rTYKzUpkOsXJcNkbM2pFGIRUOiNG92SNIEzJPNMPWgOACzV-qoeaU-FmwDoVkT_cFa0uUGlgci2QsgbQnU7Q/chKGxKgHtxJtmmrmLtnXhjroHs70RZpD3nIm89C4f1U","width":24,"height":36},"large":{"url":"https://v5.airtableusercontent.com/v3/u/49/49/1768197600000/I5Za0giE9PSj1L-TOtJThg/Ctpg8twyjn_oyth2OgtqkqhWP_FBHKzX_mZnOjL1sPrE5kWbrGbBs2KzbEVucjuCLrDa6sFBXOmqqQjiBTF16TiXpIAE2H-WHn5qHNLDPDLyZY7MRJNmpcpL5owfS3NANWL66NFqLDIhfIC_nCj0dA/qJcAlwX_Phb8PCMB-TehIcsfJTPjR5J91ydN57YBUqg","width":197,"height":300},"full":{"url":"https://v5.airtableusercontent.com/v3/u/49/49/1768197600000/EOHgL7NTb8SC1VREmCSbgQ/BNlzrrLRU9Rs3xtlyZleqtGWw5OCoSS6PlrzNHi_NaR0TRo1zfvzMJVBiGyIR2rJFlx3MKYRsIJSpwKAYBBetTvSrQ3PdYyk3et_YVBEWMFdf9sKeyIoTaG3CHgBgOwJywfZwLaw_l4G7eCap2aycw/w2vRoL4ujpe8vUVDYFEtkxpL-3I4PnF8sT3NIQGHpf4","width":3000,"height":3000}}}],"Authors":"Brandon Sanderson","Series":"Mistborn","Series Number":1,"Readings":["recfnalGLXFm0xyeJ","rechWHOm4f7G3mrXl"],"Date Added":"2020-01-19","ISBN":"076531178X","ISBN13":"9780765311788","Genres":["fantasy"],"Author Background":["by-men"],"Number of Pages":541},"Rating":4,"Read In Year":"2021","Page Count":[541]},{"Id":"Sun 09-05-2021 to Mon 09-06-2021","Started On":"2021-09-05","Finished On":"2021-09-06","Book":{"Title":"Mistborn: Secret History","Cover":[{"id":"attSIkc4UcvSQpy61","width":296,"height":475,"url":"https://v5.airtableusercontent.com/v3/u/49/49/1768197600000/0eGOeEkXKNsQAeoqKHFReA/MddnHPhJwOVF6u5dLn2i8VzUolGJj1zGkni5ljMqIaniP1MHX5l2a-oo98LnRakm8C_UugeM_s9751jIlSOwDmzGHtB19cH1BfcUYf7gXCxekwU_ZF4RXsTByCogMMOJpnopnqx41uPCBcY7VQgNwg/mBjAWzH2AYUzjncIN0f5mc0WGhTgEafkobcUllyrr5Q","filename":"28755792.jpg","size":34657,"type":"image/jpeg","thumbnails":{"small":{"url":"https://v5.airtableusercontent.com/v3/u/49/49/1768197600000/2J4gq4AINFUr_FQ1_lYL3A/4nxa-TzO6nNKfBv3lohEFB0JW5TRp3TpMiUFzIBxd2QH8hAXHoYyR5VweLNMtPar2zGl8uyGF0HgCupIBz03rsq7X5eD3GPs6CfdjCgkRRWFUZvzhrWvqtACdRPv0ezdLUO1hNgREFxYDkSSg4Nwkw/ltl401bO3o1owaCQft3wX6VaULL9r00fHH1oQl6I1ks","width":22,"height":36},"large":{"url":"https://v5.airtableusercontent.com/v3/u/49/49/1768197600000/LII4U9lILlWueLKo-_9DdA/BCWv3QiDvl0hgXdWovIE1klQ380IUxyAGU1f5WE-UlYbB_tUVdUtBFWoKqEcAKi8JIFmEkLhj8SIKqWeNW7WPAhzlZZRUNQ7u_fjCabZC1VtpItRYQdTneKSlYAUHldPTF0iu46HAOMylw_jaqEPXw/mjfcqfRL7eO7tP2-BDyxwnfeDnXL1uJwWDn30A4_Cbg","width":296,"height":475},"full":{"url":"https://v5.airtableusercontent.com/v3/u/49/49/1768197600000/4LDWCedEgq_1xKQjoZ7kYA/rixRCi-8fvyzNPSKqGAzjiMmKCKgSvYoM38FLrP_ROnwEm_eypLPUG1-bwVm4k9jQHGuH5C_L2LD7x47H4Hoz3n6iLozdCjaPosQNupcycTPqBDUfiNHUluYd13-LyRJ5HGIlnu1gbGFR9X73lF_tw/xiFsqSitSRep0W5h_0gvgRA0WyXsXQn6DUDLVUlaRPo","width":3000,"height":3000}}}],"Authors":"Brandon Sanderson","Readings":["rechfwR6hfHwbNcxS"],"Date Added":"2021-09-05","ISBN13":"9781938570124","Genres":["fantasy"],"Author Background":["by-men"],"Number of Pages":151},"Rating":3,"Read In Year":"2021","Page Count":[151]},{"Id":"Sat 11-06-2021 to Sat 11-13-2021","Started On":"2021-11-06","Finished On":"2021-11-13","Book":{"Title":"Gunmetal Magic","Cover":[{"id":"attvbystSI0RggNva","width":295,"height":475,"url":"https://v5.airtableusercontent.com/v3/u/49/49/1768197600000/2b2Bx4E-o1CFpmnGHO_Fqw/0Na1GbTEDZeRwJlsUaetRDAzDVagw-o9odaTwS4N0aoYxSSXlGV3KOQYyUQ9i3_VG1E3tAXEzB0MInP7p_zHp8td7-wZBHfUNGtCMaDqu3CptPNfsf_DEWQlYquCxXjFt980jiZj6EI61MrgSwq_Sg/GVa8CamcAd3rgoTqKo6nAGyVvdH3MyBiEMEGl4LJ1j4","filename":"13050840.jpg","size":49863,"type":"image/jpeg","thumbnails":{"small":{"url":"https://v5.airtableusercontent.com/v3/u/49/49/1768197600000/kQgKzCg8l21UfO0SPI6z9Q/p4xTwtbUQ33ASoo_h1LEck6QVRnJHVUHTMSCJaZQy8JbCTEZ_UtutLZatPtNRnFfbVZAXDqPxQ44dq3ROzrPfo0IacfT5DLPLsfA-FuM_dGqxfiDsRWlA2c-amakMV0hXBlUeJH2s0avkbM7nxuRNw/cQ_4aER68f_41sryHDbL2EOXF9ecQb5Wob3XP9SSX1o","width":22,"height":36},"large":{"url":"https://v5.airtableusercontent.com/v3/u/49/49/1768197600000/HAS4qJh7BacwXOltDDI8ng/1HHxHS0czmn1LMTJmsI6PbYF1UsBcZwag4DbgrcDGQMFXByPqxNeO3SMDI4zWQhQQ69LoqzbUAbjr-AadZrxlGPVwgwTv07q5Vwh7jvyzBnGncU5jGITV_6XxF7lrEY1PavGeqcOGrWoX-Jy8zVELg/T5RCmDgynINaTuiK40evsASwjHR0OfoZBjETqgoqIdE","width":295,"height":475},"full":{"url":"https://v5.airtableusercontent.com/v3/u/49/49/1768197600000/5UAQGdioJ6e8SLuZAWGgRw/kcxBVWQom9jaXhWZzNr59Wx5K3RKTbIi-aXjK6AXTHXSGW_NOMA9oo3ntHyzX8CwOBPIUYeS6YzZdKIXip6zNLSKx9BhKNlZZzp56WV_XwhUYGbmCx41bMasfHrxwaYknyRm1Q59kfliP0WIv47AoQ/fXhBcClPDhP4KcbagITf5whO4TsXRvBbUdSZsjJMaDg","width":3000,"height":3000}}}],"Authors":"Ilona Andrews","Readings":["reciu34RDxooSZRyb"],"Date Added":"2021-11-08","ISBN13":"9780425256138","Genres":["fantasy"],"Author Background":["by-men","by-women"],"Number of Pages":434},"Rating":3,"Read In Year":"2021","Page Count":[434]},{"Id":"Sat 12-26-2020 to Wed 01-06-2021","Started On":"2020-12-26","Finished On":"2021-01-06","Book":{"Title":"The Infernal Battalion","Cover":[{"id":"attcNgE50W8XWoSta","width":265,"height":400,"url":"https://v5.airtableusercontent.com/v3/u/49/49/1768197600000/BieiTKT_OF2gHkoCu5VmOg/TkXvM8cdhcv4TnRvlzf4pZKrDoQgJ-qQU7o59apl9MVZkXLeOcj3VYwm9nCGy45lu2CuQ9P9S3r5Tuzts8ZabqifY29PYUI41MxymDnOl1rgnrVboCf-DJcLMXeQbF1hV-vtzBmq5Ym3v4jnMDQ8uw/YDCmBskuTQvJ07VS3pWNXsQcEPxvrc_E3t9_hfesjZc","filename":"25845205.jpg","size":25075,"type":"image/jpeg","thumbnails":{"small":{"url":"https://v5.airtableusercontent.com/v3/u/49/49/1768197600000/8sH9JZnxdwBIpTyaq0FrkQ/GTIsq9VE_mjTL9RJHp3IJva6onVrmipfKfS3bytYC59nZzlktMnHT8W0SJz4Nj0iBdfrYjy8bdAxir9UthZPbJYqB3LaZoeQzZHeFGpk99k5ts-oev0oBC-3btSLdIkwZu_Ae2Y2HikoNPTFql4VIg/aMKV-6Wz3YEpKU2-KRcGac3MNF0Q8yYEDHN7wgCiR_Y","width":24,"height":36},"large":{"url":"https://v5.airtableusercontent.com/v3/u/49/49/1768197600000/KPYmChHjM6gFuQrQ_7YBCQ/G1je_wpv5eXf5rv6Nnh8gX_n2kmfAwhEqXsF88ivqzkz4_r1Ln8aF4f1qqL2ReQtyo4MSlgIF5D7yw236QpwCzAbvAb5J0dfbaa3FssHDwaG-bEg49hhYlVxXm_SF9ZlEJ6PBEHGrfZs-NJdoIp9Hg/ah8n6c6tEY3h-_2B9ucFJX_lzBYW53wzDaxd3_SxDZY","width":265,"height":400},"full":{"url":"https://v5.airtableusercontent.com/v3/u/49/49/1768197600000/UM3tWfP2CjFrbD9M5bI7zA/Cv7iZmTXh8M5ZBNd4PPLY89FfnNvcj8d1OBJECh9pbI-cRmHKrcCcZTjT3RWACc80d4zXPalx4bt603dsl5BDFFwLYFMXnKVOSv68ce1wAWHPKclnnBpy5fS2ziD-n6GNsfTG-r2rSaqihQ-Ib8wvg/NUJjtv7ZDrNYuWEM9-Hb_mYSNN6-NECOjzeOH_wX3HM","width":3000,"height":3000}}}],"Authors":"Django Wexler","Series":"The Shadow Campaigns","Series Number":5,"Readings":["recjBIlgn7pwFCUa3"],"Date Added":"2020-12-26","ISBN13":"9780451477347","Genres":["fantasy"],"Author Background":["by-men"],"Number of Pages":480},"Rating":4,"Read In Year":"2021","Page Count":[480]},{"Id":"Sat 07-17-2021 to Sat 07-17-2021","Started On":"2021-07-17","Finished On":"2021-07-17","Book":{"Title":"Peak Strength","Cover":[{"id":"attYFQv3sqmjVqGBE","width":1284,"height":1832,"url":"https://v5.airtableusercontent.com/v3/u/49/49/1768197600000/7p1gmI3zLG_0uh4hLI1UJg/77fDjvmDyepyyhSpDHV_uU94HqSGATKZdXMYi2MKCWxn192c7Ffvit-hf-40odJ-hwCzyU_cEwGd1MPIzftx3LY8a3U-LY4ENaAxjIZ6b0m-dQjyhaAUFar-a-Rwr0zUPebohMme6BeWgos3tRzv66A7WYOhnVYxS47FFavsbUY/s3xTzv5emkupe0T9ewLa6n1sA7d08f3jWIuHkemWU8Q","filename":"Screen Shot 2021-07-17 at 3.34.37 PM.png","size":2934654,"type":"image/png","thumbnails":{"small":{"url":"https://v5.airtableusercontent.com/v3/u/49/49/1768197600000/_9NZuvtx6CZLubdCI5ac5Q/r_laEg1wgpUj5evegEmjWe4BKcGruu5PilcbsqQtxzRn_zbJag201IycdPTYy_CvL6vqrDfyPu4krUUC8Dy2iNW-7-hvIUMB-2Y4e3USYXJ6ccuM8c5Gg5GZt_chxSQHE6sWBBUhY6BJ1fE7KMiJdQ/g8HAAX5Fr-odH-p3wm1ITSFbXZjCunCrV29xcBl8qw4","width":25,"height":36},"large":{"url":"https://v5.airtableusercontent.com/v3/u/49/49/1768197600000/DJurbAwm9JvN_4biCpkH1Q/Ez_-m6pjt5itX-q4RQ_oRUZQWeDzJ2yj4qyeFLo0NO4x4SWgWJ4Iy22uvpCJAqOp4aaXdGVqAd4HJVudViId4RTHJekUpbryEnDZxgHLqpcCyLffrEFUnxwWnzxZBgUKh6tARk8_FSe8XkIykI-pCg/xzRJPnAEVCDxCaESZLvmosguyprKn1Yaf9U9SBDaK70","width":512,"height":731},"full":{"url":"https://v5.airtableusercontent.com/v3/u/49/49/1768197600000/uFolbh6ZN9Xaxr8KORc33A/1n4GCPvPwP8TCy48xkkRqgW8h_fqhAlRTuPtauDRILxcR-n5kbDBdcKjpdnZISgXzCIpLIiVb8oVqEW09tbm6bkIFX7JOZIZA14AMMIAPwt3_6xZijs29xMNm7O--fYXFPuDMSDYnsyBYI2y7bdMQQ/wBWYU2xnTPdTurahrZzgW6d-XUk0TbiheQglS4lVNFg","width":3000,"height":3000}}}],"Authors":"Alexander Bromley","Readings":["reck9OUYTULMkqFSK"],"Date Added":"2021-07-17","Genres":["fitness"],"Author Background":["by-men"],"Number of Pages":155},"Read In Year":"2021","Page Count":[155]},{"Id":"Sat 05-22-2021 to Thu 05-27-2021","Started On":"2021-05-22","Finished On":"2021-05-27","Book":{"Title":"The Scout Mindset: Why Some People See Things Clearly and Others Don't","Cover":[{"id":"att3STvBy6C4IigvH","width":265,"height":400,"url":"https://v5.airtableusercontent.com/v3/u/49/49/1768197600000/nymcqTDfufhisy5JHtQj2A/zL77HTBSb2h8AXLr4k75kl1sQym6fIjQWBQ_p9kZLChBSQu_T518pr0yNPURKGKQQrJVLnbaqVYtFTRbZr-mPc_IXPHvHnUdfpIxiMVmUlzatz5ptvkNXdtfsHzZXy6FOwWs8O7a-4E15Pms3fhgSA/P7HHo9ddrDYyKLoAGIbKDRqTKVBiWvRmibfpQpA1j6s","filename":"42041926.jpg","size":102917,"type":"image/jpeg","thumbnails":{"small":{"url":"https://v5.airtableusercontent.com/v3/u/49/49/1768197600000/GC3FXn1zvnT-rLdT4uB6zQ/OfGFJhzlaMUqRCl1zf4yrxOlmytqzMrigQr-9biP8M_V0txf_JmZTXrdUsQ4DYmD5zhLbwz6RJRxj8_rq3ADOewgSExLrYoJGu2Ak3ZkVdI3-AJuVdpxYKj6I1caIcl_e0c1MYp1GRfByucaOT0keQ/DAhh1Q_X3ds8Wo9z4iB3JdVLlRps50LzdrkUUMubrJ0","width":24,"height":36},"large":{"url":"https://v5.airtableusercontent.com/v3/u/49/49/1768197600000/tR8I7Z5unwJbhxYnrakwiw/wIy-YkpCv6nXfizce8MOP7aH4-9Kwi244BqO0JzP_B1AGIK0EwNPHUZxrvdfLSVwY11hxfS7SYH2WLYir03861ocdnwy7RD01aJogWffzy6pCll94Fdi6Yg15MENa9kdpDAOihPdeL_88_lBSg4iiQ/CHKtm3uFWp86A77atuy_UcOVxPZkik4pstIcu1kM-5g","width":265,"height":400},"full":{"url":"https://v5.airtableusercontent.com/v3/u/49/49/1768197600000/TNgzbLKqEbJ_5PWvKBojqw/WycHpjIedSCrzBZLSETYGzrzxRkwE8cgArh36flvXiBtqGV-nPJAZpHPMQwNyizy9_VJDj82t2hg3_iE4Y9QxyA0we8GMcOPka8GocznyYxPVuEKp8a4xi4tAkzDgjZodJO566N8MVTPqQ5-YCtk6w/VGNVQnmPZ36T3ZJoMNqu0PBTJyrGcZYBpZaRwZPf9WM","width":3000,"height":3000}}}],"Authors":"Julia Galef","Readings":["reclU8Kq3W109nqnV"],"Date Added":"2021-05-05","ISBN13":"9780735217553","Genres":["nonfiction"],"Author Background":["by-women"],"Number of Pages":288},"Rating":4,"Read In Year":"2021","Page Count":[288]},{"Id":"Thu 08-19-2021 to Wed 12-29-2021","Started On":"2021-08-19","Finished On":"2021-12-29","Book":{"Title":"Practical Core Data","Cover":[{"id":"attxAKYht2tmzq0F4","width":904,"height":1287,"url":"https://v5.airtableusercontent.com/v3/u/49/49/1768197600000/6kD98IGpX8OS62eeZ__FEg/DFgfnBVfN_3lXI2Ft8c9EFmryJoGZOCehtPGzhUqU3QmGGy3JX_u0jdPPg4At9mnqtaBIjLjFgXd1fdVFJv0AtfTzGeDGf40fKs6SX4spRrjruhpMNTjGw-YsAECsspUT8FcjDwKW7tc287SWI4J8Gqua5zhTlEpVpMgSvh-zyk/-maKubQnyOwn3qHC99pUAxmlFxsh7PEknXP2BUAfZSA","filename":"Screen Shot 2021-08-17 at 10.32.18 AM.png","size":156307,"type":"image/png","thumbnails":{"small":{"url":"https://v5.airtableusercontent.com/v3/u/49/49/1768197600000/RaVhmpAABWlCqI0RM5EggQ/9rynuwRtJI9uhxNIIZI76wRculrvZsSvDd1G8rN0XBBxZvj8k4ngnunDE_HL7HsfT3AT8rKbqerwAADDGinnXJyUNad4rS9jD7VhQU4kCeZKBv1lWEzaBLisQnuheLND4icQc6X7lLZEcpb4_qt6rQ/M5i-NKa5PdMyFL4bhXimHqziVgRyQ4YLftqFdkboJGg","width":25,"height":36},"large":{"url":"https://v5.airtableusercontent.com/v3/u/49/49/1768197600000/GKTCDHGbUALF3o5iTTztvQ/-bT4d2KPMJG6AB65F2FCTXnXIFw6w3HduvCO2kUnZFwTxe6tJWz0IY_3NMRzFj3l6HIV-Rsg65JyFJKwscuO30X8rSx_L7EtwYZj4Yn8TYebwgPMgp6Kw9WA4fAZQH0qPvGLxX2xfp-iI51HVJSPfQ/Ynz3VzjIEFwvJNOPXt5-pR4wKJyWDd_wnnviw8JZRWE","width":512,"height":729},"full":{"url":"https://v5.airtableusercontent.com/v3/u/49/49/1768197600000/K0tNCMYq0UOsS4Pc0XlftQ/mes1whdMj2s6k4Jyq1ISpP_SxToJgKnF4FAb_SdjMpusn84Rg7NnrSxsTRacsmAKwa-Dvr7H0TfEqrXFSgWBuIH4dhxD00NSXJ3YgsSHjJfu8_iXZvHBrQrw8bq2XkGskkIgI6M3hNM_WYDYGwtzPw/JkTrs3jH48_ZWvTVngz6PSWFypJgVJBbAvP5HJ57iuo","width":3000,"height":3000}}}],"Authors":"Donny Wals","Readings":["recmzQo6ffQkEQ0lu"],"Date Added":"2021-08-17","Genres":["tech"],"Author Background":["by-men"],"Number of Pages":356},"Rating":4,"Read In Year":"2021","Page Count":[356]},{"Id":"Sat 10-30-2021 to Thu 11-04-2021","Started On":"2021-10-30","Finished On":"2021-11-04","Book":{"Title":"Magic Slays","Cover":[{"id":"attZ5EchRJbnOhvhc","width":294,"height":475,"url":"https://v5.airtableusercontent.com/v3/u/49/49/1768197600000/h8tBVLqPctTv7bXpw8GfLQ/3M8f5T6rbTmhdByRynvOeS9yvW8uz5Un-wGhFLd_tTiZKDeQrS1ArvXzXhryJcyrUIbW1QosCAGmxbXWfmrmnC34G9J6PCg7VqJCbDtEs0lOszCk6qgR8mhLun6Gn82Jsz104WB74E56yGEDEu6bwA/ciPfLucYZiJyAvzVFV-W2FJJUPXZZrDA87f48ndTDd4","filename":"8559047._X0_.jpg","size":40395,"type":"image/jpeg","thumbnails":{"small":{"url":"https://v5.airtableusercontent.com/v3/u/49/49/1768197600000/3DKam4C6H8t8Dn2qsPNCFA/7sOhAp4mn6l1iTKkvjoQZlbwBYrcy-5ahacFOoqCFXBtcHCDud8-NYcDesEGg2Lxo0wko39tzEgMak4m6qK29qUBQSJxCvo4hY797UrmffOdVyb3gvRsZRh8r4vLhJIldHLl5UiDmQwHQgLY3fqBNg/WVwvIEdG-YKMMmqT25lrnmHHSUTzSXzPbgXLX68FYAo","width":22,"height":36},"large":{"url":"https://v5.airtableusercontent.com/v3/u/49/49/1768197600000/RBGywNmyCe--j7uhDhGGww/mCDCI8U6P62AVWjuagMubK_TtOz-F8bi7JpYQYnl9bBXcpqu2wfaZ6kM526he7LoVKCfyJkmq3cuKApCtoqhc_M6G6EFrZed57NUEKsmLXSGFrg18Zujy_VlMtdt_UJaSuLNHiIZ_CPZhS43RF85Ww/qkEjad-Y4KXUoISQf80JCWFvFy_jaOu5p_bfH2-9LtE","width":294,"height":475},"full":{"url":"https://v5.airtableusercontent.com/v3/u/49/49/1768197600000/hOWUomreDOzb1dbPDaKmHQ/c3JPoySb3Wy4lPYI99dBa-QGqoc8p_XyqQfaNEQOr461SIwu0051evd7c1uRIMy_4vt396ISYrz-Q6GPwpGWqMBznzD5MCgLTinNfOkvYSt_dt-prwdxdz2jhVnQ60pMA19EU2EwMiTHhhWnMPqxBA/_bHXDB7DI6R3sUOuAnX0FsnqSW4cfhvtDYy2-9rgtpU","width":3000,"height":3000}}}],"Authors":"Ilona Andrews","Series":"Kate Daniels","Series Number":5,"Readings":["recnL27T6e10xuKuj"],"Date Added":"2021-10-01","ISBN13":"9780441020423","Genres":["fantasy"],"Author Background":["by-men","by-women"],"Number of Pages":308},"Rating":4,"Read In Year":"2021","Page Count":[308]},{"Id":"Sat 07-31-2021 to Sun 08-15-2021","Started On":"2021-07-31","Finished On":"2021-08-15","Book":{"Title":"The Well of Ascension","Cover":[{"id":"attAiykR35gHWeOfK","width":197,"height":300,"url":"https://v5.airtableusercontent.com/v3/u/49/49/1768197600000/Qp7oYHB7GsmSnEfOC2OegA/uVa5hJ-q8nru4FHlLw7tHcIDcKVFEbVZZU6_4Co0g5371N7QsRg5_tEIBZrvXOFxycOD_9iA-LqVG-5uLFSjT1dLtq9lIEKGvrropfupaHSqXbYqt1PdZfR4IQ8mS9F2nNR2GSrcx7AYtUfXZ5ClSg/bbwg4tHSS5XPfH9F6iyrhZgOnMPKYmc66E1AHHZvuyc","filename":"68429._SY300_.jpg","size":19919,"type":"image/jpeg","thumbnails":{"small":{"url":"https://v5.airtableusercontent.com/v3/u/49/49/1768197600000/Q0S6NeSkq904fESViiH6LA/eCOWZQoSbjUS9mRsWsPCL-k18-By1MqtUfoZVFfAC5kf-LLxmKyTEAjEEdcxfqfc-nUAPpBwPo-jROf30BG7Aj6xIy3BD0tx1ojpMxq6KqjEpqWBdU_Eo39eUN20boruO5AGnqmtKH5P4sGBZvM7mQ/DYpa4ruA69lalIo8A7ytY1gZ1heHm9xFN3Oy58oMvgY","width":24,"height":36},"large":{"url":"https://v5.airtableusercontent.com/v3/u/49/49/1768197600000/cGHCQKVWL8yP0rGD7AfPjQ/lYxSgOCJRKaA-F3rEBz7FaESyUBuk1cBTmW33t8cVtJzicrqU_v2xp30BImKpYlUNta81DF3INcvSDjN3d5TvFoHVYdSlQPL_IMXtncaPvHG_U8ZmGNTciRMEMguRjWHJvtdEpRcMvp8l4k1yRbi4w/0E4Nemq5TnHhBKYvqlaU_OXWbqOlWy1IQ9cjv1gK0R8","width":197,"height":300},"full":{"url":"https://v5.airtableusercontent.com/v3/u/49/49/1768197600000/5AB_lmlQNtj5WDBEqUMEzA/MelDRJGug0vOG77tJaZkNv1TCtdbO_g8GIpgBcb_evFXuSZ-m0oGu8Fa8heTi96rro6XDSWS1NCdAQ69dFcDnEB-GjN37VTal_b8ulRqxlZJzwr8Wdkqm16905U7gWRv75WNNkM9MWaA9ffJ1ne_hQ/LSVCRXHJUlc0BMZ-gE9vPlyAu12GmNxbzlscBb-sHMM","width":3000,"height":3000}}}],"Authors":"Brandon Sanderson","Series":"Mistborn","Series Number":2,"Readings":["recmmWlz52dRll14s","recoROSu3ZuQGV9Yx"],"Date Added":"2020-01-19","ISBN":"0765316889","ISBN13":"9780765316882","Genres":["fantasy"],"Author Background":["by-men"],"Number of Pages":590},"Rating":4,"Read In Year":"2021","Page Count":[590]},{"Id":"Sun 08-22-2021 to Wed 08-25-2021","Started On":"2021-08-22","Finished On":"2021-08-25","Book":{"Title":"The Alloy of Law","Cover":[{"id":"attFJmVyZIaDzupnd","width":193,"height":300,"url":"https://v5.airtableusercontent.com/v3/u/49/49/1768197600000/aqQLeH1gXqjq1Qjeb8UwxA/DUarDzctwIBuffxRIOURItVXC0v2WuXcXPFRwLVL0tLKkI25alFCMSAhOxJpmrEOg_VmndxjhxLw4DcXGARnxmS4NKRf3cwel49N-wIp-ThHwUHuwCx8enYBlcqEABh697IRIKCi8hZpekFQi84eQg/ffCNnPSeO0cC5gHnHtwXL2PojCaGUjmSip1_vXOH5Go","filename":"10803121._SY300_.jpg","size":17932,"type":"image/jpeg","thumbnails":{"small":{"url":"https://v5.airtableusercontent.com/v3/u/49/49/1768197600000/Sfrs-lyWCDs0GSEKMK2ZPw/1-SqJr24aEZ8IC9oyeM18HpwbhbJ9i4zcxce5LNHXxOYtVHa9j7KWpKPIDzDL5C5AcN8p7H6f6wcVs3OI4F9xwKAr1MzhgrxX6riy8gihuS9MDEM-c1nj7C8KgvcGH6fEo4NMLDLVZk9gEv5AL1N5g/XMhLFn04kbAQtpvy6NnezsssUBooo1Ai4ZKbudXFQYc","width":23,"height":36},"large":{"url":"https://v5.airtableusercontent.com/v3/u/49/49/1768197600000/oKGX-GAG2q8XKTJv6PHFRg/D9ChbdAQ3uMv6i9oXQbglutUcpyffF-jLW4-2sCcHz9c-pjrHaYCnmxn03LyuZvqD4dHs3WbGScGmq0qOMUG1KtX9a1xvZHMYJbE9CR5YyU-Dfx3UlpLndAjCWIkMYZVtl9_85D67p5FnZeegk2n8w/sBlGEFXnlJyWESR4uRBWUcBeGliPVts9IiUV1m6uhT4","width":193,"height":300},"full":{"url":"https://v5.airtableusercontent.com/v3/u/49/49/1768197600000/-K6MdJ-_vRuIysG53Y_kag/mNO6VDbYGfpFmThSPBxpNXGsrp04Fkjs3vsYFbPdUeH2MQGGqyudOncX9KT-NScex8W78xox1oAX18EnjniFpdS51Z0T9Ti0hXn8PZ3xdsUHjdbg3ZuB6-M0wst-G1MRltklgPwFIpc5ExsPBckRkA/s2-lsk_Tq3fDf-IHtAsqAhfZY2oKRLIkYKG_HZ8a4Ws","width":3000,"height":3000}}}],"Authors":"Brandon Sanderson","Series":"Mistborn","Series Number":4,"Readings":["recRZyyGCGfKnMVbX","recvtmhd8aRxiB0fY"],"Date Added":"2020-01-19","ISBN":"0765330423","ISBN13":"9780765330420","Genres":["fantasy"],"Author Background":["by-men"],"Number of Pages":332},"Rating":4,"Read In Year":"2021","Page Count":[332]},{"Id":"Sun 02-28-2021 to Wed 03-10-2021","Started On":"2021-02-28","Finished On":"2021-03-10","Book":{"Title":"Ashes of the Sun","Cover":[{"id":"att89aASYUazo1ps3","width":308,"height":475,"url":"https://v5.airtableusercontent.com/v3/u/49/49/1768197600000/0Bx_psJagweym9mEJ8CwVg/T9lqbaMA-rEthjMOeajCqstPtvc8mJ0V0F-rDhpFWpDWjiKkVyjZPSrLFWHhqgsfnJxHqzUKGDYYFYgQ3HS0BoOWYVp5HLLefgOP7ots7weJF6F4rkFFzw6RKuARmgyKrY5bKLSVOJsQJsQqF7X8efWTFAklyBM-cMvZf8BimZ8/bK5pWj4zCY06UFLg_HVIz0eRdVgsD_VVoKTBorxfIVM","filename":"52822248._X0_SY475_.jpg","size":31924,"type":"image/jpeg","thumbnails":{"small":{"url":"https://v5.airtableusercontent.com/v3/u/49/49/1768197600000/U8VR-7p5A1mHCpPGVggHbw/aFH4WDnGrKlssspZrtRv7qHaCxtnT6V77CsEgsqnq8Utb1HMDr30x2ytu84bXnWKU7Nk0nXjpNZ9--EQTZmtwQrANOBAeXFP5VaO7-4ZbnYqRnQJyKdDmydkFaw-W0BO3h6f220GN5tNtLLRzS51ig/39bWcqN0igrUmYxXE03aN8gI9tvQ_74EB6mxXOLrQGo","width":23,"height":36},"large":{"url":"https://v5.airtableusercontent.com/v3/u/49/49/1768197600000/832pjBYAAkogLGQce5hkig/Rml8ucly6KjMeCenCKb4ANJCNkzcm02P8EMxf1uFbVNuHaqbMpNByKxTZKJG0Qj-yt-sMlT-SfsMoqt_bjCZIX-N1buCuXrk2TW71lybZgTTcYtV9D1ZoNaVGegSYrtVvOm1k9He1eYx7iMavmt-pQ/JZWI9ck11OgL7CWeVoPrIuflVHuQjuRZzKtytPa4DL4","width":308,"height":475},"full":{"url":"https://v5.airtableusercontent.com/v3/u/49/49/1768197600000/21H-xtZrI76ANBkijpPKrg/2hMcAM50H5L-VOpbBXCRcjqfwy204GspkbEHan2GQNfceSYaLCG1ahWcE_Gz1Bec9veQTPacYg5Uwz9piPodu6lHrMNgvMqym3ZOlCGqebHbnZa4sOdVKJHf9FFSia43-lo4m1izwdoJfZI7srNlyg/NIsPdhAzs3AnEC2Jh881T5yahhagBzZRFg2cPP2NArY","width":3000,"height":3000}}}],"Authors":"Django Wexler","Series":"Burningblade & Silvereye","Series Number":1,"Readings":["recw2lwHS3KkGLkTd"],"Date Added":"2020-07-01","ISBN13":"9780316519540","Genres":["fantasy"],"Author Background":["by-men"],"Number of Pages":592},"Rating":4,"Read In Year":"2021","Page Count":[592]},{"Id":"Thu 03-11-2021 to Tue 03-30-2021","Started On":"2021-03-11","Finished On":"2021-03-30","Book":{"Title":"A Desolation Called Peace","Cover":[{"id":"att6EiShIoEBmOVqS","width":421,"height":650,"url":"https://v5.airtableusercontent.com/v3/u/49/49/1768197600000/fGQPwO7swKXGgjE4mB_nEg/-qGZdg6y55l0RFDmfJ3Wy6ZBM2BaM9QKcGl5TFuodrBvw0LsJNPJQ94lBpYDdQ024TxflGxkfu7DgR0F6s2M_k_4V6rfLcYOeUFLLI7RKFGoMoH5aFw_8DovbgzpagX_B6OmQ0u26OItCc_BPLepgQ/-LOKBMYAhp1hHs2hAjRrx6yuac02Fb92ZiKsHWP-Whk","filename":"45046566.jpg","size":109752,"type":"image/jpeg","thumbnails":{"small":{"url":"https://v5.airtableusercontent.com/v3/u/49/49/1768197600000/ixxYYOxabE9fmwiocPdN0Q/E5KtWZWastmIHqHQnYOXOwf29YtCEB66VbIRfzeuewoimoDxdy2OMeyZ89C-bMMdw2vWdn4mUUsieYGxrjjvjteozs-ABCYv9udxSYnCp0G5dkbvpI69GU1QIdysAb_pkVxowyRzZM05pihVhrrAYg/kR_F2IMNgVOfIiAiqLqdeGqMLSumb9oJqj3g0f3SpXI","width":23,"height":36},"large":{"url":"https://v5.airtableusercontent.com/v3/u/49/49/1768197600000/DVYkU3WQR_QKH07ZjIa_eA/yA57ahWKYxkWM3BLrGLj4IsWjc_djgZV4z6EnMvYu529BwtKrz8MMvlgJTRPtnc5aWWpJbCgOYV7J0lHcGV9e74GAsuavvHbNnerAWCsCpgwAwRLoTrHQLsc_q4o8qz6Uw8p6SV3kHtPcJhztUjj6g/cj3nUHAI46QtU8t7z8NDHphFqZi8ZZbTsIYBFsaVJbE","width":421,"height":650},"full":{"url":"https://v5.airtableusercontent.com/v3/u/49/49/1768197600000/b4rt7Txojre99tRtntsdLw/Jwj_tfKBcri6qRKeHA9X5IJ27eASledcNOY5LcQhN4z8azksB-Roomte7nMqAWIn9oA3GWVMWdLL-ZHbk8Qvj9zJRAMMsw4PTAvVoFyRZaeVIwPPy5Nfecb_INf51QffPsB9B9Bs1jLgV_xkA1HvDQ/Ks5qLlzNtfTbxM8WTa9RJCdQH78cPitTdx_V28OrjYI","width":3000,"height":3000}}}],"Authors":"Arkady Martine","Series":"Teixcalaan","Series Number":2,"Readings":["recxo7PKpBZ0xOzMB"],"Date Added":"2021-02-28","ISBN13":"9781250186461","Genres":["sci-fi"],"Author Background":["by-women","by-lgbtq-author"],"Number of Pages":496},"Rating":4,"Read In Year":"2021","Page Count":[496]},{"Id":"Thu 04-08-2021 to Sat 04-17-2021","Started On":"2021-04-08","Finished On":"2021-04-17","Book":{"Title":"The Crown Conspiracy","Cover":[{"id":"attXGID1ShywaY3GE","width":307,"height":475,"url":"https://v5.airtableusercontent.com/v3/u/49/49/1768197600000/ii7HU-uzhprSZzBvzDYUTg/RRztfzQ5o25eIH4n1UR_LsbB1n9bKlwZTycWkbB2nz1p1525ZdEiJgEusF6KxSnd2AtfKr8_GqnclDZ6zA4K15vrS6ScURaDEs665t3iRo-xFRfBGXjXAkbaml8OKyL-r1dz3roMsbmizeuYvzmGeA/oaKtyn8L6QHROgW4trjc4fh2fMwuEcfUpX4Q8Yd1cQg","filename":"4345290.jpg","size":40935,"type":"image/jpeg","thumbnails":{"small":{"url":"https://v5.airtableusercontent.com/v3/u/49/49/1768197600000/1QWu9DvsYKwPcUD1bwmnKw/6FN7rBU9Z6UVPRp_h4DqGvCobR9ECw1YR7ncGHawtQzLv_ujq_HQvxZ4Dz0drmK00fSZ5HIg1Ocvv7F_GNM3jsPwc6Otu7c3JRJIfar-dhf0G_mkaqgxoHC8L5WEHfUFBZjkn6rFx0-0IZVsFYqF1g/kJIsg2_DzH_r_A77Ala8b7IT53lB3DsOKnzsVm-MwEY","width":23,"height":36},"large":{"url":"https://v5.airtableusercontent.com/v3/u/49/49/1768197600000/fKtk0ptATpYfWZMMCfisMg/VVu4HssOHkWZmRyMZ0X-hVtI-MXCt7fxhfy-1vKiTzOt_rptLjNSp7oP64lVOD_tR0Px5fXeUwMEW2bji4yMPRI24fWG95kpv54ksZK3Lh5o9dMu6FDPOFlQ8a1S7D8HG_ACk05Jmr37sKXdPXzO4w/IwZgPVClcBuJjP6ZjHVoe4eHKvBUEa86-Gzf7r3T0TA","width":307,"height":475},"full":{"url":"https://v5.airtableusercontent.com/v3/u/49/49/1768197600000/w0oqSZy7hxBiB6goNrG6LQ/cB7gwBPCs2TMMW-sjWvUvxooUjVBcWzRptjiG2cFIfYd3i6M30atW7oLgyIMmn_KovTVAXg_lg8jpT3rtDYKBA81mz6QbRCcgAZoSox29j6V5mblY04m6ojdTNOLhtpQiBrx0-0so97CGnp0K4p6hQ/zlve_FrAVIl4swf8vQjv1Md9hpXeFVlVRHwDS_8SLlU","width":3000,"height":3000}}}],"Authors":"Michael J. Sullivan","Series":"The Riyria Revelations","Series Number":1,"Readings":["recydHN4hDXA6nI86"],"Date Added":"2021-04-17","ISBN13":"9780980003437","Genres":["fantasy"],"Author Background":["by-men"],"Number of Pages":296},"Rating":2,"Read In Year":"2021","Page Count":[296]}],"stats":{"Author Background":{"by-women":17,"by-people-of-color":1,"by-men":31,"by-lgbtq-author":3},"Genres":{"tech":2,"nonfiction":4,"fantasy":29,"fitness":2,"sci-fi":3}}}],["2020",{"readings":[{"Id":"Mon 02-03-2020 to Tue 02-11-2020","Started On":"2020-02-03","Finished On":"2020-02-11","Book":{"Title":" Procrastination: Why You Do It, What To Do About It","Cover":[{"id":"attbdy6Bwikz6JR7i","width":305,"height":475,"url":"https://v5.airtableusercontent.com/v3/u/49/49/1768197600000/SjzjC9wJlSuLLsExWDrbTg/zJLEadynIQMgVHY55hco6yXznmUNiiAj9zlNLSjd49FOY9jneHE6_r78G24l6ZI1e6aBR1jXGvWMNcmP3sRManB4JEivRMvk-XmLmd3MxSliU2_VPlqQOjQ15VB6MunKX9RDBWuRO_6vNgFUvhV6tA/zfdKDiZycrZFVEl2bLM6N1XKP4m4_QlEZgs-NH4bT4g","filename":"1141601__SY475_.jpg","size":40231,"type":"image/jpeg","thumbnails":{"small":{"url":"https://v5.airtableusercontent.com/v3/u/49/49/1768197600000/JQAA_leCgoRj2oV6JtG7Fw/njEEGy0nUOMEU_rdC8lwq97wPyCFpMP7WueCb_5J0rfZilMla4elw8s0eKsEHFGsWrFx1AS_UaLRDBxfwuPRc6oIgH_2Z2JNHM7cB0NJee7l2-m65_iconLl1-b9l_iH40hXn2AdV47kwvc4Q0yXZw/7DSjIguUNyY6ZsnOaJlbQny4mrNyVnNKl7jXu5GxRkI","width":23,"height":36},"large":{"url":"https://v5.airtableusercontent.com/v3/u/49/49/1768197600000/v3J8SZShVJHYSIv5DsqILw/rmOA08NjTwSZp6UUfpH7smOCogDkTIfUPG2xZWFPr2XQsU6jaiDNo7XTzeVE3PyITY8Hgs-GRxARYNDutoH5Bq9Tzcc7EPrB-z0A-qYPDJGfp1pvrmb9NHpdksPMojMFV3MmBKyw8c6AmHeIxAL_EA/dF1Rc_crMASeg6LYkMPDTrYuc0NM5WLBBvuRdrS5tys","width":305,"height":475},"full":{"url":"https://v5.airtableusercontent.com/v3/u/49/49/1768197600000/YIXavW-zndPO4dEFl4KJ_A/xqXH1jLdA_yPs4zOf4ngx-0LUNUk_Dy-9FD9RiYjPXCX7sbskZWXO-_ujtKsXYieSu_Q4F-k6ZboNLrGTvESvxL8eU06x5Her_T29VjxXNU59MAHEhVqO-Hq9HV2ftOplLfe6-BTHf0jeqYSw0vT6A/pHCeBhQJme3y4v2KFQfJ5I23rraIJoo0z7SylV244MY","width":3000,"height":3000}}}],"Authors":" Jane B. Burka, Lenora M. Yuen","Recommended By":"HN comment","Readings":["rec3YyWyinJPAxlr6"],"Date Added":"2020-01-23","ISBN":"0738209562","Genres":["nonfiction"],"Author Background":["by-women"],"Number of Pages":240},"Rating":3,"Read In Year":"2020","Page Count":[240]},{"Id":"Mon 06-15-2020 to Sun 06-21-2020","Started On":"2020-06-15","Finished On":"2020-06-21","Book":{"Title":"Salt, Fat, Acid, Heat: Mastering the Elements of Good Cooking","Cover":[{"id":"attLMIuz11jxTbL5a","width":300,"height":371,"url":"https://v5.airtableusercontent.com/v3/u/49/49/1768197600000/tdEiSeoZv41wUkN8r6oXDw/TcKUURC0K5cUIeorp4_1-Re7xg3kguiPBGiu-i_c_yZGUCr5Yl2x8RHj1Sr9vsRoQo9CD4RdtgVx42gk3zAP3xZ4VqqHmPx947xvDTM-z7UknAk4ccIitSz99P0MmlJZioLUZEvctzr0i3rB6DNroQ/F5FhE1qJi-gezflezCziVm6nQglOrTIU0YN4nTWsOSo","filename":"30753841._SX300_.jpg","size":26734,"type":"image/jpeg","thumbnails":{"small":{"url":"https://v5.airtableusercontent.com/v3/u/49/49/1768197600000/spfOGW8Oz5ch4lSL24-hQg/ONpp3REsS-OVLdgjnBwfWnPjpX9qPbmifq-ym1TLik8dNabzNc_K8w7kji-BYptuVSefnLaL088QxRWY_SqSCkw3yfiGymykyVCIZXeg1u48-yuqx4L9A14OFKeRZilrWTdkTpxUsgSwVxU2Drvnrw/gDCs9kR2tiPXx9eQlxnezrWG_HuGvpL1bldYBkWjWKI","width":29,"height":36},"large":{"url":"https://v5.airtableusercontent.com/v3/u/49/49/1768197600000/auJszqT8VLpoRW_lA1xK1g/luEY7JfXDYojTGuFSwyVlLPtm0XwDX6bzCl2Rf30ABZKMoJcs3CqnvMctYnogWzkDaX5PPyTjdAnql6As-xNrOejdNLw_AJgIvfUiXNU99jJG77O_AQlJWXH66pLSFriMA9Jqtl90__fl4Kv6Osslg/RmYfCVm0AnTaBO3ddXDsCVuhBphiR-NzL2SWth02E3A","width":300,"height":371},"full":{"url":"https://v5.airtableusercontent.com/v3/u/49/49/1768197600000/WxjWdRtJdxkLnOEuGGNulQ/AymLF0DaafhPf8KRkrXQytzbTLhyH8KapbHU2Fhlg7PXB-m5IbvA5ZGfDoBMawrk3SD0hoCDHeXfl0yWj25kD4oamQlnQIeUdUXN__cyISNjsdZRuHhFtmpAB2ERE7XYA4q1ondevY-ijE0mmAojMQ/PH83z3Ff7c-6yxYg3JuEDjZz8NadXnPMPP3qYzNYt-0","width":3000,"height":3000}}}],"Authors":"Samin Nosrat, Wendy MacNaughton","Readings":["rec4HyYSE1OgU4tNb"],"Date Added":"2020-01-19","ISBN":"1476753830","ISBN13":"9781476753836","Genres":["nonfiction"],"Author Background":["by-women"],"Number of Pages":480},"Rating":4,"Read In Year":"2020","Page Count":[480]},{"Id":"Sat 12-19-2020 to Sat 12-19-2020","Started On":"2020-12-19","Finished On":"2020-12-19","Book":{"Title":"BASE Strength: Program Design Blueprint","Cover":[{"id":"attSjAS9w2pDDvNbZ","width":644,"height":838,"url":"https://v5.airtableusercontent.com/v3/u/49/49/1768197600000/SGMuOBEvMha9ZiY3jftKKA/L3n1QZrZGecQvejYw2LMzC2ITrWKf83kTdXbxBRVLYIY2IRsDGOigwQd_dDNx6GuxZzP4dDqowDCEzFnMHzuHC0V86_HBH5dkTBD7-GNlxziHQpXJc5nohmiouyTbih1jl5IXLuPb-M-nqx77XQ7uG6flEsL5q3BfQCHzj0f7ok/GBKYrR5cMW0CaprIFDIa3WxoGn5y9sn1TUG-zhaEIyc","filename":"Screen Shot 2020-12-19 at 11.11.14 AM.png","size":840049,"type":"image/png","thumbnails":{"small":{"url":"https://v5.airtableusercontent.com/v3/u/49/49/1768197600000/6BJDiyIrTsL9giZgbygmTw/GpprmCU5VhCSuxahZQZg0fob-nTnn1R8Xb-x3JjwxVl6_xg1Kan_UKW6QcPyx4OPtAqQs28BqBwZmWrPjo4UwsJQledoQhQRCmlOzuQWA3oG1LQ1aOXmbxX4wFUKQR4FL_Q-vIcyJGM4MMvESwGegA/vQTKdOc15TDoRJLtyo-gQPGbbV9KayopbYfgRWkLV9I","width":28,"height":36},"large":{"url":"https://v5.airtableusercontent.com/v3/u/49/49/1768197600000/KUJd-IH4F3ErpOiKcMlp8Q/SXYPFiEfxCexX5oaTKpOqN75nc7ya-RDQAy_j4J0exv4ixOG0PaS0QJVgxx3EMpIUiMNtrnEDSAZJvLsdP1mnkNRGfqvP-AUtfqRZx-Mq4WqITIT0EG28CAdCOEDUiC0Uwtge1XPmtrUQr2QrR10ew/L6_OT1rWDG7fHoj32tLuWAqlhhYlYkUnWq-eGvtYsxQ","width":512,"height":666},"full":{"url":"https://v5.airtableusercontent.com/v3/u/49/49/1768197600000/92rD05kqWBVTyHQ9eZ_JeA/arvYslL8nm5OC-thKRGyRsLCxtSwuMde4ibqoXh8BJxA3hQx6Rh9YcOu1a95I1Nk5PnurThGsiNE5XwnjSaOeaQ6nS8hQJ0OIHGitTODWKWDvg6GaZUBYTLFJzk4j9j_bVw4kaJC2oNRy2rOyXdbIQ/I46YrgzADRxE1QDegpQHmFD7oPF9BA5MIsk9rNIzJZI","width":3000,"height":3000}}}],"Authors":"Alexander Bromley","Readings":["rec4OGHUo0dMNuMyk"],"Date Added":"2020-12-19","Genres":["fitness"],"Author Background":["by-men"],"Number of Pages":132},"Read In Year":"2020","Page Count":[132]},{"Id":"Wed 05-06-2020 to Tue 05-12-2020","Started On":"2020-05-06","Finished On":"2020-05-12","Book":{"Title":"Hammered","Cover":[{"id":"attTtyZBCCZiIqoZC","width":183,"height":300,"url":"https://v5.airtableusercontent.com/v3/u/49/49/1768197600000/NK-1SQR0ai8unf_R3JXzEA/nHXC3NAXCx59Oa-g93Pwhocncbo3SCfcFuEcKbJ9qxnXtnVHsuXM257XNqv2735nIJE_ySisp3Nc86xmkA6EFImysLHC8ewIV2H9MGMz9LDAGLv4GrUcNhrY3SNVEeZ2VKA23GlXTsZ--lWtWJsNGw/3z5mOJiHR0NKQTlo-wUHvlT3ru62uW5sNC0mqKiEmWk","filename":"185638._SY300_.jpg","size":14208,"type":"image/jpeg","thumbnails":{"small":{"url":"https://v5.airtableusercontent.com/v3/u/49/49/1768197600000/OCzDs56MMIAdmBTXIyh3PQ/Chm1U8sUDA57FAPm0z0ODCWZiOW6NkD6L2suoQQsLsqUvuH3PbkhKjFMu0WSHXA8DNetvb5ciAHWk1s7zIy9l1VvUSQ-TikZvMhGYZl7EszYgktrWE6JVufL0a57BWBVHtRAcNvai88Z56XhTqitXg/Aobas8QgbhozmXIXmDZhSUu935gV2tNqszXIgIBTeTE","width":22,"height":36},"large":{"url":"https://v5.airtableusercontent.com/v3/u/49/49/1768197600000/3a0fJ7-7yf-nEc2h2T8OtA/bnoJ2CxgpTP8Hvv7xTmFtgB-YI9rdNyPcSD50yDaKgJvXY5WCT-ORFqPgX15niwwiYClSwHeENQjmcrQJ6_q-fWI85zRLz84QlxTWs9VK82ypDE8KjATXzvVqOYqQ0bovuw9CalhThfs6dWmpxUMmQ/cvLRghP6n4gu8FSGufQ6GtYwYBkO8MgSsXHdLn-1GJI","width":183,"height":300},"full":{"url":"https://v5.airtableusercontent.com/v3/u/49/49/1768197600000/vaQ8MZOEkVHp1oIWPBsD-w/q8uNFNbPEAPnYKT7S-lsfpP7CsSNEK8yjDBEhI4TD3xS1KkST6FhuWBs89JSNNWfIY75XFwvyuRZOSwVznCTbd4fpZO-faly7iU8ZRytJ4n4hlrb3uOv1Jax3n15Z3dGAnvP1ueHfWDkip0VWePRxA/i6zs6dIcSzP0FcxOgy8IoM2fZkQ1xJ78aDbHtQoD8MQ","width":3000,"height":3000}}}],"Authors":"Elizabeth Bear","Series":"Jenny Casey","Series Number":1,"Readings":["rec5IPF5Lc4f1wxNU"],"Date Added":"2020-01-19","ISBN":"0553587501","ISBN13":"9780553587500","Genres":["sci-fi"],"Author Background":["by-women"],"Number of Pages":352},"Rating":3,"Read In Year":"2020","Page Count":[352]},{"Id":"Tue 04-07-2020 to Sun 04-26-2020","Started On":"2020-04-07","Finished On":"2020-04-26","Book":{"Title":"The Bone Ships","Cover":[{"id":"attM2hjlHf5VC4Of9","width":300,"height":472,"url":"https://v5.airtableusercontent.com/v3/u/49/49/1768197600000/KypuCSYa3b0t7DP8TfiHiQ/6NDQ41Ou51_42yVL2Zp3caQIwhlmef5uXaIseQYkOW-BrhV-_SzHeqHgOI0BSw6dIWqFjubxjJipPbXvPwa-BBGMRU4p6A-FEPMeNvQ8XH8NYH72lT1w2ASgR86xfxJgfpsx8tK1TY2kzZr1uqJLCQ/Lxql8FmdvYznttJ0djKMX2DnNDUJ5UARbZvvYrq6xFU","filename":"43521682._SX300_.jpg","size":48829,"type":"image/jpeg","thumbnails":{"small":{"url":"https://v5.airtableusercontent.com/v3/u/49/49/1768197600000/ATZ5foGUwFtP9zQL13NWMw/nmZH_X8viYF4L00adeiujJ1QusYUIr7zuKR7ZZVsDsP3qooQSF35uOQrt5Sj3EL9zcNZCSp6PJB9Y_jSZ2kxw4DjvkrXfC-SOkHU9_y8ZhoO9b0CJhMp9M7lDmEoSabdGVNC2hyAZOnAs6q99eK5fw/WRNlWBBlfRHGduWHKXNFxTJnPTablmXmeiDJHnsy3l4","width":23,"height":36},"large":{"url":"https://v5.airtableusercontent.com/v3/u/49/49/1768197600000/olczSUDHlLovoruB2Qux2w/RUgC_oiPGRWm5yHf5rnW040OAoxoVQLFX34gXiGW50uPphaEU2J3hJzyPkicxo8nWqXX4Nf8sFtVks8mKGAbXthtn2PMiQpf0hnHIrsC-WBvJjvhvHnrMqEB5jDvugrSbOUBcAVzXbp-l2jGsd8-8Q/E1Szolpywqs2_jhksJZ0gwoB2solanMaDUjeQR5BbH0","width":300,"height":472},"full":{"url":"https://v5.airtableusercontent.com/v3/u/49/49/1768197600000/SRMmitiPsad0JzFeKAFBTw/qrGNEyL2Mn9xdYuWD3xo2t3oTkWhGmktX635S9IxsPouqswJZBdGRzBgbM2YuWU6Fme2J1C56krL1uj-B-C8ufZCe84sf7uiT3x0yrPPmTY4s4NNwZRiacSSqxDEYL4DnNTIZG2JQmsncaCeSdAfkw/wlFrBrirBJ1hTi92r5XXwEEMhC_M7dIKIbgWHJGdz9k","width":3000,"height":3000}}}],"Authors":"R.J.  Barker","Series":"The Tide Child","Series Number":1,"Readings":["rec6fHUB1D82nBZ2F"],"Date Added":"2020-01-19","ISBN":"0316487961","ISBN13":"9780316487962","Genres":["fantasy"],"Author Background":["by-men"],"Number of Pages":512},"Rating":4,"Read In Year":"2020","Page Count":[512]},{"Id":"Sun 09-06-2020 to Mon 09-07-2020","Started On":"2020-09-06","Finished On":"2020-09-07","Book":{"Title":"The Next Step","Cover":[{"id":"att6lFqz6I7WeXa0X","width":1238,"height":1602,"url":"https://v5.airtableusercontent.com/v3/u/49/49/1768197600000/FwnGXb253nCgqBs_5wgYrQ/7fFqDEelaDvk2Mo4Sg7orCUQUIJsDkaW_gDs89JfGmJOdG0kumZOqzM_bFu2TchRIiwiNDVLjAnSMzckSCkxHc3xduWestulSVHdWnH59mIttqRI7ZVf0Gj-zLrLRQ_NQ6bJCgrS2BB_aq7tT_HCby9LFIRMe55e945qDHsN7iY/BSNa7BYXFWhyGVfn3w5nh79KucWJvCRbxAcGQcZsgzU","filename":"Screen Shot 2020-09-06 at 4_35_08 PM.png","size":3377490,"type":"image/png","thumbnails":{"small":{"url":"https://v5.airtableusercontent.com/v3/u/49/49/1768197600000/IN7m-sFSrK6zz_ci5njKyQ/KtDR6uCbDpOJDowxDg2dyoCbofwlxJIrOYmMZ6sq3HNGY7jSqeI430_zQHa1-SowizNxo6wIb8Z2GsHRh5I3wEbteHVTbc-uULf0noTBeiFH52LytuxSV2uZsetrbLjjiSXYT-E4e1bPzDVMjQjKkA/C2-8fOkKCJXzJ9bkvdLWvqzjMFCbVv6CMPt0qvBM2q0","width":28,"height":36},"large":{"url":"https://v5.airtableusercontent.com/v3/u/49/49/1768197600000/yC7NT7Ko2BxvrKxOyJirgw/CsFCOrs1DyK0r5wmAK6PlGwCwz67okllkT7yRIzZySpABnAd7CQwu04watniTqL3FeUeXLjSl7RYjdog1rog4ppZe_Mb2P4c143AXFhITzNJPguN4MZey_NdTdpCdWcR6W331dLaMeGMDVUlqxPBww/KhPGSnQhZrXehYtcxB5TZuhMb7aUY_r11Q7qaN5P7hA","width":512,"height":663},"full":{"url":"https://v5.airtableusercontent.com/v3/u/49/49/1768197600000/09w5jpfUSXFvzKErAKY_Tg/zT0OkxN_Wm7sEfFuaFXCM3rbZ0FR5Lj1qCUQ2TM0vtmxQlKefxEG_pW1qiSuPjwFFsOIqH8Xp8fKLLaYPe-O4A8TNhZuxXXxsXTKdwomlOSqyADw_Z-wwQZESbpuTVedFpqeZaeFHxZNu0_Ot3PI0w/jrsPn5S9SOSxY_4kNtzGguTJvq-9iZ4OzAguNhUKobw","width":3000,"height":3000}}}],"Authors":"Jujimufu","Readings":["rec792sVZskxUrSgq"],"Date Added":"2020-09-06","Genres":["fitness"],"Author Background":["by-men"],"Number of Pages":160},"Read In Year":"2020","Page Count":[160]},{"Id":"Fri 10-30-2020 to Wed 11-11-2020","Started On":"2020-10-30","Finished On":"2020-11-11","Book":{"Title":"The Memory of Souls","Cover":[{"id":"attJ33pfCBIELSKnG","width":740,"height":1124,"url":"https://v5.airtableusercontent.com/v3/u/49/49/1768197600000/UK_B4iN4gAU4PetVerLcRQ/qIuO_w8XSEHib8UhPFyoLr8jVch7jnedyzEFWoT-YFJZuJ_s9nXjcPAF8kxBzjosn71HEgLL_UadyqwEyiUn8Elq0YOcufOW6gDCXc9xHRjppZOlvjdryxx9zsZkGlNHcIxAUENPuvZs7sKKdxhSBQ/7Bv-j72ZnT0iVj9jKaXX6bY-509mqz09MWGxdGvd2aU","filename":"52378515.jpg","size":221358,"type":"image/jpeg","thumbnails":{"small":{"url":"https://v5.airtableusercontent.com/v3/u/49/49/1768197600000/I_qvoa-Ppnz8REqv3t_UCA/AVhmXNBTb_wKS49qaK4vvl9uhp5TJamC0fNr_dc5wHc2JTzIyUtZvymTwBFXdnshXkPPkCxu3SdjucBufT1VIc6AaiuHoaaQwtamvlocJ-qEwjDJFWZZ3iSLGxcked7Futc5UQd-i3QN6KYeTZcAgg/xRDVFb9Ruqvc4_He_-iAOcJ5T8eZ-L_7y6bBb5m36Po","width":24,"height":36},"large":{"url":"https://v5.airtableusercontent.com/v3/u/49/49/1768197600000/OPtimdEVxorfuHIOZdQ-3w/brsouB8WdGGqlcrHAAj6CDftoMnFfKWGSI0J09uflK9pXpyohW-IbJNiRUceDlMDd1PS2uXMIdDzaKIqpIsymgOtcJso4xAUJClINmYDGTI3R7ryGUOaJkjehs0c7b0WYJtmEmtZjNjtwoLJw42CIQ/ijHNwxX9il0fM4M6Tl6C24X04awk3_YX2QzxA_uOR_Q","width":512,"height":778},"full":{"url":"https://v5.airtableusercontent.com/v3/u/49/49/1768197600000/H2aawPY9Bnd5xZM1oxXP3A/r-V0lxf7KfawsUjNFGpQadKB6wRFqfPJk6g2Qu8srRDErx_iYrRDzrFg1T3T1p8QajqFzwmqD7AQ17cV-Go0J3E-Q_j53nlJjgNxBrHLmlNyHzvLdxHYwJ4DlesiZPYm3acxIvYThuI10P4lTRdlQQ/E6oTA7j-J7w_FeaW86n9DZG7l77ssGUyFaTW20Q6jdk","width":3000,"height":3000}}}],"Authors":"Jenn Lyons","Series":"A Chorus of Dragons","Series Number":3,"Readings":["rec7kzgC2HA6AGYcQ"],"Date Added":"2020-09-01","ISBN13":"9781250175571","Genres":["fantasy"],"Author Background":["by-women"],"Number of Pages":608},"Rating":3,"Read In Year":"2020","Page Count":[608]},{"Id":"Sun 06-07-2020 to Sat 06-13-2020","Started On":"2020-06-07","Finished On":"2020-06-13","Book":{"Title":"Cold Days","Cover":[{"id":"att1SFDZtIxG2X2hk","width":198,"height":300,"url":"https://v5.airtableusercontent.com/v3/u/49/49/1768197600000/dwNEczMvaSzvvPSbhKS2SQ/ykk8v779Tmz6CkiuQJaOV9pyI_zibDtjWI3WmNrRKBcF6g6qIWDPmQ5jeLQu2Dq8tzZudCLM458A2ekDmZFBVzabGSNxmL7eO7q9Q2mPFTW4pcIFGAXX0RFNM18Vh2Ws8vcDHbGgNq7AQiy144DE0w/y5iWIVj-nChXKheMO8PkpdazHvpQloetIte-0idHPpo","filename":"12216302._SY300_.jpg","size":20387,"type":"image/jpeg","thumbnails":{"small":{"url":"https://v5.airtableusercontent.com/v3/u/49/49/1768197600000/N5Mhsb0lxq827plgWxS6Cw/avVe8vQ4mFRFeJWeoc83o0QtZ_f7pr6Rejgxyt067lKajEJ3hJ8_-ook8cn6VsFdAF5Vf4xTaTUa7QmS6W3KwgATyWSbSitAeNgrdnnYJyZcCBAETaDN81WZ3Y4Jp-LsfViWAevf6O1gPTaGG8CQzQ/boen3Qx92H4ZaqjkxViCyp4DMpYwq9xE_DAEUcxFeNc","width":24,"height":36},"large":{"url":"https://v5.airtableusercontent.com/v3/u/49/49/1768197600000/qmlQo2MKkQjpZ_UbxbEbFw/kGSX1g2iHAgW9ZA43hMzFWTgqyK_HSmd3Btpnut1bp6g_H3LoNwnFlYDRocuiCfXOaPRY4bI4hlLzb2O8s_X907Wf88QDN9n8SvFBlGnX2G9XVlqzl6LJRgKz6m0wEGsQhb1U4Dp4MA8Dc3tiZVz2A/EJt_FPNmDCUr1UsO2OUmKv-xPTLazA146f9nFUxeWpo","width":198,"height":300},"full":{"url":"https://v5.airtableusercontent.com/v3/u/49/49/1768197600000/YSu0yd4Ao-MiVKqJbgrzbw/4rSJ5aeoW2IQqReq-m4PAuuu-f-Q01vCWOIo7eajQ0Uij-sNEb6JURyqwZcQr6WVlZEXwPiSaS0TLMhIHC71lDSb3h594YI4rped5WlcHSIJRMRwBiTXucr9wMwGr7KGUDeuMF0HY6eLr-jn8Q08cg/8NPUjU3FIL_K8eXo660wilvPgmWAVvsRTRD2_V3N_wk","width":3000,"height":3000}}}],"Authors":"Jim Butcher","Series":"The Dresden Files","Series Number":14,"Readings":["recyitEgrOetIBuXj","rec7zXpEAhsZV6PP2"],"Date Added":"2020-01-19","ISBN":"0451464400","ISBN13":"9780451464408","Genres":["fantasy"],"Author Background":["by-men"],"Number of Pages":515},"Rating":5,"Read In Year":"2020","Page Count":[515]},{"Id":"Thu 03-05-2020 to Mon 03-16-2020","Started On":"2020-03-05","Finished On":"2020-03-16","Book":{"Title":"The Autumn Republic","Cover":[{"id":"attFlMHKIjvAhugXC","width":195,"height":300,"url":"https://v5.airtableusercontent.com/v3/u/49/49/1768197600000/n3P75IzEReaLI9ishlA-Qg/-ZBOPhDQU1arAoBXm1sJCMNViLKSf83B0wsHzbDf8ASKxOmdrtnacszOzD---nKoKXqxdwAWxE7w7Lcwml0Y2Gq52h-rS_dkOWpnA0c3ScSC_u0i1IQmfOoqlKjBIJwYN-MEfoHetgREDmy_05Y2KA/_OsyNX2m9j3jpv8zt_NVtJqPL2ZoTd_NV1BpNwsu7eA","filename":"20883847._SY300_.jpg","size":22696,"type":"image/jpeg","thumbnails":{"small":{"url":"https://v5.airtableusercontent.com/v3/u/49/49/1768197600000/sET19EpzfzJNTBHPES8ySg/kKnkIOUurC37lCfqgxnwcCzros5HbajGhZ97zG9gx-zlPft7Adwv3Nnf9KpuBMHCf2lQqY2UrqB8W7A3de2CJb33NHybnNh7pyPeEOQd-y7A7xzdWI2L7pDBEpFV-fBDIV8E1G4PxPGzukoG8T551w/iV5q6EG5uRnbsTAHludnbnXQ-fmWDubtla2pzX_jF0U","width":23,"height":36},"large":{"url":"https://v5.airtableusercontent.com/v3/u/49/49/1768197600000/iQwmkiJl8LSmKzlwvTevkw/sZ-Kjg4mVjESfppoLr3U96xTsYK0yrfsSfXH6vPvsOc5OzlotV75vyzYawsQzvmsTkLUr9G_21nBG0P1YJHGJcT1ORavNCbEjSEHvWl1ZkVAVdvFcMq5Ao9x0bImt8VfWSfH24Eck9Ym6BX1MRG8UA/Pl6yK93DaOwUaAuOSUEP6mlIIxvwBaqAbAK0DixXktw","width":195,"height":300},"full":{"url":"https://v5.airtableusercontent.com/v3/u/49/49/1768197600000/MnunPb-uO_R-embJ2OBMuw/qFdlgpxo2wjXgeTv36vyoEYJ_1dERMs9SpED1BGgSAzlM-m6Ie49LfErRjDsHKELEWUsgFTtQsFXGKjEgWxDNDwbfuTzZPWBJjj4h4-priVbQyt_S3FuSD4xdXJmIw0xoJUklvZYHzVYFgpRFrladw/4xMP7YwFukPxvMqOdUTRMH4nZhZ125TDFS9hoe7tHoQ","width":3000,"height":3000}}}],"Authors":"Brian  McClellan","Series":"Powder Mage","Series Number":3,"Readings":["recF82u9vY0PnNpBM","rec9azyPNE9g4Z7f5"],"Date Added":"2020-01-19","ISBN":"0316219126","ISBN13":"9780316219129","Genres":["fantasy"],"Author Background":["by-men"],"Number of Pages":580},"Rating":4,"Read In Year":"2020","Page Count":[580]},{"Id":"Sun 08-02-2020 to Sun 08-16-2020","Started On":"2020-08-02","Finished On":"2020-08-16","Book":{"Title":"Learn Vimscript the Hard Way","Cover":[{"id":"attZ3e8pM2i3ncNLE","width":270,"height":349,"url":"https://v5.airtableusercontent.com/v3/u/49/49/1768197600000/ubHAAKaypwgQjo9iN5uHpg/YhYgc6Xm67maEBEkp4Ed4VUa78hwiSlCEHgdtDVG2Imz2NY8dKI0uxGpRIEuIaesWaUIk1GlV7ViWsjuDdEOkbtiXmfZu6cIAGA_X21evMXpRDwoBgkGlrmVQoY3-WE5ZRu-VyH4mijlIVatdhIwIg/n8WEB7C5NcxWnsJwFgWRgtuc322gDGNXgKTUDbyWHrk","filename":"17227647._SX300_.jpg","size":31808,"type":"image/jpeg","thumbnails":{"small":{"url":"https://v5.airtableusercontent.com/v3/u/49/49/1768197600000/ZogF5_P81dlpjFsF9lzvIA/BOKaqsgeIbjmmOgR1mfFtoiN7eiGjKQX3hDY9VVptEQH2qVRDKXcEOr4Wene9fAvJYvF9lyalE6meWo8Gq4Y3xMJxscoAjkw9-QclZhJ-w1y_6WA7UYqhXOUXmVlB2aFvZtlLLX1LDBzYLgPj28_Xg/M13VdybSu5k3TbMKtvlqO5ohpkd_B1PKRsYTRj32BlU","width":28,"height":36},"large":{"url":"https://v5.airtableusercontent.com/v3/u/49/49/1768197600000/i554VFrY8E9Axr-bT_sVqg/v-dmI-GaTYcax1ohq8DT08KszIFCrTVoDqnjmCfAzt-imaual0cAs6qwxod2U63bBc9iIqJgj8YcQ1-_6LK6qMVao-fx2aqjdX1gKczAtnugg3KC2YiIHNtq2-ZkPa9xyTuBqzgLRoV8RkxFZ7tt5A/1J2U5bA5sSPMmtlH9EZHNGf3BDJjmhxcKiX1LYwRNeA","width":270,"height":349},"full":{"url":"https://v5.airtableusercontent.com/v3/u/49/49/1768197600000/4jao9IsTZfNaVDFFXjyq-Q/T78T4tuyOp4WFh3YArK5PGT9NB1UaWWpk_0u7YssRQschTHlYCm-LJRwXEUX3a-XNCiaeFkP8sSd8JXtwgFTMOf7gzQIG2uUFJ4yEzDK9-Kn-3N77Hv0EknhtjGgPazWEkGEERGy3a5aWmeYvGK2CQ/pzY2E2gdlp5lp7oXEwZRC03FafobewdHi5Bvrgdr_fc","width":3000,"height":3000}}}],"Authors":"Steve Losh","Readings":["rectdKq9OSiwsR3lL","rec9s7A9WEg8ejIbS"],"Date Added":"2020-01-19","Genres":["tech"],"Author Background":["by-men"]},"Rating":5,"Read In Year":"2020"},{"Id":"Wed 08-12-2020 to Wed 08-19-2020","Started On":"2020-08-12","Finished On":"2020-08-19","Book":{"Title":"The Shadow Throne","Cover":[{"id":"attCrk8KkSt59Z1x4","width":310,"height":475,"url":"https://v5.airtableusercontent.com/v3/u/49/49/1768197600000/T8cEMGw4GGsmZya8wzs1HA/sAR5mjwHIo-fLYQjTuSOo_alVrRUlnRBCfJHX5CShI6rkOQfdfqCbBUF-ilDSrm5ZGc3SlQvOY6SsJE5Jo-wxAGfYWz76FjDRCu1U_mKFwryV8KdQjf1Gq8S2tE_qtYLmBAKR6H6b7tWuLNzytxzRA/CfeOWwfPrmWKTQ99KBhOSZjaojV7ofSPXYyPjJFbzvQ","filename":"18657632.jpg","size":40780,"type":"image/jpeg","thumbnails":{"small":{"url":"https://v5.airtableusercontent.com/v3/u/49/49/1768197600000/sG7Eg8lpSO1_3Os4AFQCLA/wKDF5xIXk0mhoRIif5nz_zCawBeAwspqE2up1pAgwEBiMEtSbqWx0VxaqcPXbjC34p4c1li1SOGlHIX7I3biqrlzkhDZM6UwGOpdz9t_G_48KUb8YjO0pCwnKqIak7XIQJaMkhiqs7Y7RFCsmTfTkw/if0uuhHcUjewna0g20Ext9xaXORYcYFocEf_9nRXoH8","width":23,"height":36},"large":{"url":"https://v5.airtableusercontent.com/v3/u/49/49/1768197600000/JSIY6s62bkGYOqMqted1GA/VT5pWdVvjdYoeH8nMIjBFlGibgE66CNHDod4Kg_uipUxtbN_NmP0dhqpWaSXO2a6rTWS7hz3tWFOBy2yxJ3-dFpBnHZikYeBmmlvD70v-MYJVbW-x3b44etTKPURmb5bLd6_I0FCTED8Vee0BMNw3w/K7zWTQ2OCEoZkw42EGDQFJQ9J6tgVRVhzI1SA3UM5V4","width":310,"height":475},"full":{"url":"https://v5.airtableusercontent.com/v3/u/49/49/1768197600000/niGM4hURaHhOJu8upxll2g/A2Y8W1jw6XWTJ8CqNbMDYW8o_fUL7xJME4B7_qIIhuV2BudMfpm6rTfgfuYDyDSfZ33ke3XSfSJgpgh8R5OCw7KpXQi4EMsY8h_1QCe2lpGYk3Ul6bHqgn0KvBhucSnb9Of0BTJIXfWihSwT0MxK8A/WkE3HnfT9fBpwF9KWQLD2dkUBKs665sSMV_-Yvo5VHg","width":3000,"height":3000}}}],"Authors":"Django Wexler","Series":"The Shadow Campaigns","Series Number":2,"Readings":["recAaY9Dv7jry5zN9"],"Date Added":"2020-08-01","ISBN13":"9780091950583","Genres":["fantasy"],"Author Background":["by-men"],"Number of Pages":512},"Rating":4,"Read In Year":"2020","Page Count":[512]},{"Id":"Mon 12-30-2019 to Sat 01-11-2020","Started On":"2019-12-30","Finished On":"2020-01-11","Book":{"Title":"Blood of Empire","Cover":[{"id":"attC5K19nLtpwkCFX","width":195,"height":300,"url":"https://v5.airtableusercontent.com/v3/u/49/49/1768197600000/hQjDQE_sG4LYp9KtbD9ZkQ/RydfIAVEb-ZqYHFRb33ZJT5h-sgEuVijSJ4O-fPf2tfShuc_kOuYX6z2PDHbtZM1bQdDrlnQzwis-QmNMuxJUs2AJM36RXlklmj5kZjXV4VBKKk0yAApzb59kgguujY-MPds8Rcbsljklo9_LCMUDw/5MhRbOSm_fAvgeuPl8ZPni0yo7JBQqemiSif7QwrVlk","filename":"28811019._SY300_.jpg","size":18814,"type":"image/jpeg","thumbnails":{"small":{"url":"https://v5.airtableusercontent.com/v3/u/49/49/1768197600000/zW2y1fC2mA9VwZx9Z5YZPg/W5mB-34qMx6kL_ZpD9Ai63uo35j3dqnsi3Bvxhwm8v8eLPS1NLeAukWN-GKgYvoWK6ZcrqQfBfGUn1nFokLVIpaJfjMqlvLgu5Fte1mpGza6D3z0YtKgA5uxvzWy9gWM3AYfJTkW865aDIvgn_wBYg/SF1DBO9hHB1Rb-D5FgieBeE1KS_c_2mRX781cdsj2bM","width":23,"height":36},"large":{"url":"https://v5.airtableusercontent.com/v3/u/49/49/1768197600000/3UryyE9F0KvXRk7BVodQ8Q/4eA5mYBr64JjuTnuYpB8mdQEiCmRFxkNJB8R2_u6uWx_dqFo1nm63VJYBVdZZ8cXccJVujW-y8EFeB3O8X2DwnofUOAsxiBHm0QbCWa22nul6wwjnmp8U3fMYl_lSHf_RjndBAHe3SoWXbS-vkYCIA/sE7sRMDtW7VVpZz3mqSt0xY5BbHvnRX5Ii5XcQNg5wM","width":195,"height":300},"full":{"url":"https://v5.airtableusercontent.com/v3/u/49/49/1768197600000/dYHjYyB2KIK4zAFtOnLdGA/xyRC6AFbeUS0QuW_U98eD-DniQYyRZrYuff0tskc7vv2YOQzI7KVBMQPHUFibnM7adEPXKFg3cuoweV15dsVw-K1LVnRrX3zHuy3J8BTBoB8GkqGbAAdgW8L7YTrwMRZ2HGHxXZxlrj_OxOPAk_9ow/g5QKBECwKK96WWvFMiHasfhOWMcP769uodL9wdIGp1U","width":3000,"height":3000}}}],"Authors":"Brian  McClellan","Series":"Gods of Blood and Powder","Series Number":3,"Readings":["recEf20Br7PHcOe1R"],"Date Added":"2020-01-19","Genres":["fantasy"],"Author Background":["by-men"],"Number of Pages":592},"Rating":4,"Read In Year":"2020","Page Count":[592]},{"Id":"Sun 05-31-2020 to Sun 06-07-2020","Started On":"2020-05-31","Finished On":"2020-06-07","Book":{"Title":"Ghost Story","Cover":[{"id":"attJCN43SPazFUN72","width":199,"height":300,"url":"https://v5.airtableusercontent.com/v3/u/49/49/1768197600000/vu1qanEY0c_GKHMp5add4Q/pRm0AmQqjdqO1pNFz-YKuUn4k_zn_C1KG7aipGbFGMmhFpBTO-N7exTpVNWzdR0z44-P96CMPDdJ1Hc-vtK8mjacXaJCE8ds9K9yGCukLGJevWwYX65XK7dr4DVtvUoqAYHZ0QftBuorf9rPTTwS1w/K9Edbe-JjFE8l-u1AmQSKguYfsZ82fqgjA6BCrSp_XA","filename":"8058301._SY300_.jpg","size":16812,"type":"image/jpeg","thumbnails":{"small":{"url":"https://v5.airtableusercontent.com/v3/u/49/49/1768197600000/cE0AyLf4C_nm3x7J30P82w/UGcmcUsObDdkrASvka_tDswpFsTIIwv5sj8QF23KtPRJcEcYWrZxHhfLP7Vzxr5XqJAqzN7kTAxSDbedBgWf0DGKafDtU2ukBFPJnzepHmK2Svg3lW90boabeuExzzo_fY7fhKSGinuCXGY-1OT1Rg/k4p-n-iK43skuB5hbPyr8lWlw_3IFs4XGQA96KnenNY","width":24,"height":36},"large":{"url":"https://v5.airtableusercontent.com/v3/u/49/49/1768197600000/Q3aK65x0IVYw7KGcRh8f6g/edzBIj2g01Nbt4PzGig7UhkvO8ftl8dP1fYkmLtm8-9ma0dtmpDrpZUoDEeJZXm95bfDkJ9tqUiVMjUxrZviMIKOiQ59rtJaifJsJ9KwyQuLZ3rq9cGoxFBdfl2NrKsAscahES-1Z75bE4ISGbq4aw/qrfAm5ExEjxKCGIV-y-plqFWOXXD2947hBc01vHbNcI","width":199,"height":300},"full":{"url":"https://v5.airtableusercontent.com/v3/u/49/49/1768197600000/NGoBs-7PO50kMnXNW_aFtw/SRXf-7CaOcUEr6QVy5NuSBf5vZmWHxDh46rCMfipwfEBse1LvnaIqIwmG-vuKqY3WswURmYdTTGtR3bjpgSVUKNpPfd5AoQbj0YriKgY_lM0MPVwscGPXCaMI_AXH11t7dEyuqXKz6PYNgtWY5sozw/WtdzQtUWXXhwcWlQ4CkCg0jSmGO-gbagAdgcn4U1qyQ","width":3000,"height":3000}}}],"Authors":"Jim Butcher","Series":"The Dresden Files","Series Number":13,"Readings":["recpDCIE5A7R8UHf4","recFgrAXH6HY0FkBF"],"Date Added":"2020-01-19","ISBN":"045146379X","ISBN13":"9780451463791","Genres":["fantasy"],"Author Background":["by-men"],"Number of Pages":481},"Rating":4,"Read In Year":"2020","Page Count":[481]},{"Id":"Mon 07-20-2020 to Thu 07-23-2020","Started On":"2020-07-20","Finished On":"2020-07-23","Book":{"Title":"The Descent of Monsters","Cover":[{"id":"att6EeStAHpObxOYF","width":184,"height":293,"url":"https://v5.airtableusercontent.com/v3/u/49/49/1768197600000/xkKGP5cRxr-nyvkROxWWQg/kosIbIh5gjSQ9N8BdipmcTEiR61hm2MNSJvaPlTPbRj6qOA_oWdlFN6290bOEsqI-tFtheE_hJnB1GLoASRKD_M3Syed5lzwLb6VPjgIEXdt1azWaZYtG08kbaGjSZYap4u5zhF0Sw1na99NQcrqSQ/dELAMG3jK-CK0VcKaV_Ewn3754RotI2CfUUc7Wvq0CA","filename":"36430596.jpg","size":13467,"type":"image/jpeg","thumbnails":{"small":{"url":"https://v5.airtableusercontent.com/v3/u/49/49/1768197600000/3MYopKr3jUmnMygvWTIKug/JhVO6r9vf7DxofiI82F-O-JzneZ99Th-nMU4Q6MxnIWQGqliyimOnXBVIJSpoMe9fmqeUDtGNixY1-8_ob4IYTqKAnvxAwQW-NW3hUFo4a08DWApU20KY7SQTgzBlC14r_Uz31R-RuZXKJl2rvapAA/RxYivACiFoXWqrCaUhEcTPG-rjE7HlDEK8SVuGxLBAY","width":23,"height":36},"large":{"url":"https://v5.airtableusercontent.com/v3/u/49/49/1768197600000/YHzAAMawm2zX4zagtdYirA/doDz-ZJeEd86reFsMG2EMHGvUJ3ZYuJYABAtnWhimaFaLifmDUe2sLSdE-7dyKkXhJuA2-D5AQj0Fz6TshYQTPhNxZUjc4d4zFgcwILRu3V4QnWlQiZB7SU_kuq4FrFDAvE8KDjl3fam02HGvZ4CUg/uRZxCp9IHNtY4pVvllOC8uMXvOEet1E8rJMiTXiwleA","width":184,"height":293},"full":{"url":"https://v5.airtableusercontent.com/v3/u/49/49/1768197600000/l5cIDv6jUKG7TJSbNG_3Ew/4hcc53ZJcMtGiEkK4cGH8Dmo7H-UGnumr7jUPPCKtmQKRNF695twHjPIh4_e0kUXqj2mTmCB2Nohk-DonbUIESFugkfOQbXIjxnvhu2t0G9ONAtOoGPtWFeLakOdrn_ogb8Tel9odZCGo-S70GISuQ/k98fLkdmCBoyGS-rj0QLAgVWiCyWTxepiei6H0BqT8Q","width":3000,"height":3000}}}],"Authors":"J.Y. Yang","Series":"Tensorate","Series Number":3,"Readings":["recJ3u4nax70xVMRT"],"Date Added":"2020-07-19","ISBN13":"9781250165855","Genres":["fantasy"],"Author Background":["by-non-binary-authors","by-lgbtq-author","by-people-of-color"],"Number of Pages":166},"Rating":3,"Read In Year":"2020","Page Count":[166]},{"Id":"Sun 06-21-2020 to Sat 06-27-2020","Started On":"2020-06-21","Finished On":"2020-06-27","Book":{"Title":"The Black Tides of Heaven","Cover":[{"id":"atteS3IUKJaR5jLCr","width":188,"height":300,"url":"https://v5.airtableusercontent.com/v3/u/49/49/1768197600000/Kl4pSPSeyH1RJgalAaYuEA/8xMuHc0w6hu_MVNzmSOg-a8mjKFLNSqjN9IkXUJ7_AWyUXw1vmZEYhslmFjpOsZ3t6s22DmbeADRFeCWWPpgrmlTTD04DycUimxIIlTzvbU9e63OmjurmOuoIiCV8EKofv8zaMqgX-14eYw5XFY9rw/CZB8LHv0g-nnyRdIWvGDf-Hd3YRt5t1HVWVEkW9raRg","filename":"33099588._SY300_.jpg","size":22799,"type":"image/jpeg","thumbnails":{"small":{"url":"https://v5.airtableusercontent.com/v3/u/49/49/1768197600000/EwUXtWGQ3mkOENMe_pyIIw/Lzcwju7BafsN2wyoMPmPZivRdjcSZ6ttCNuXBXYaEgQVuOoigYo9gO0Njzo_XWGOAes2He0hkhNqtfuCcRtrmaNc3qNkFN7z2B6QANeo_GN3EvY39ARsa70HWvo0kriMDN7bEtQ684bfsExq_-BTSw/IcBiUhSBjxVO_cdFkAq-sqCbB6NenOdT39tkGhNMUaI","width":23,"height":36},"large":{"url":"https://v5.airtableusercontent.com/v3/u/49/49/1768197600000/sD1Fue3UAZxZ5hepYIgtzQ/3gWXAwZqU3eLOlz2S3bLcCETBEmgoRjQeUdAFH1lQCEUWbR1yqklQBQsoFHCZOarvK9DFq-MiVCiAYPbXhrdIJsoTJNuureryrQX79zm8stohrjr-IZ-EqssQC06A0XZ7-USNgA2GYBwluqqGwf2Bg/1MGFHN72-BxL1hVccz3VsLCMBUoW4OGY_s1Js0WjeZM","width":188,"height":300},"full":{"url":"https://v5.airtableusercontent.com/v3/u/49/49/1768197600000/YJrAqZpJTk-OnyynesWyyA/no8DPNsVZvDNczdwwCBH8EzdztAnsyWO3xCTLNYkOhGfxQNndyHaxx6OlAnprecgeyZdtshlD-2-pTLdeGPyiAkC3BcQfIhWMA6j7gvXrKlj5PgAz0YwDqChil8bzpMpXT1DA2vblkP1K_63girnOQ/pba7DKT-tpfEwtebjVXjmt_8m6VTbYXA8kfvuTSk7Lo","width":3000,"height":3000}}}],"Authors":"J.Y.  Yang","Series":"Tensorate","Series Number":1,"Readings":["recKT8e4eoMjfISPt"],"Date Added":"2020-01-19","ISBN":"076539541X","ISBN13":"9780765395412","Genres":["fantasy"],"Author Background":["by-lgbtq-author","by-non-binary-authors","by-people-of-color"],"Number of Pages":236},"Rating":4,"Read In Year":"2020","Page Count":[236]},{"Id":"Mon 10-12-2020 to Sun 10-25-2020","Started On":"2020-10-12","Finished On":"2020-10-25","Book":{"Title":"Grit","Cover":[{"id":"attqPpdb1WjG0D1CI","width":198,"height":300,"url":"https://v5.airtableusercontent.com/v3/u/49/49/1768197600000/ZswrS7MGaszxaOvzvw0eCw/VRMzEy-8dBmiOiUy4VAHXsh1nQViV9hnd4b9QlQTxNImngteKtqMlWAc5amCxIEbHMeJm2mt700LnFdabJSLWB3LgG_w9gI8ZzBgUd7mQ-0QBqRcbFk6jVmWejGgIs41E8Ed2YP6FdexLI56VEvL7g/0xf4YpzAmn7Ysxc1fTECAnruGwd44XT3lAV61h4bVjA","filename":"27213329._SY300_.jpg","size":18262,"type":"image/jpeg","thumbnails":{"small":{"url":"https://v5.airtableusercontent.com/v3/u/49/49/1768197600000/CEL56ed0mi_ozLS0xnHd1w/_57q-tpRAFVrGcauQiMgCO4bn-Ia1TZGe1didFJClKY_duEhhh7SFcl6wE_wB4p807QwfsNlqNiyyQwia8f1e6GbxqLBjUDqAuvtAWMOOP7yLCztI7FQrhseaCV5bwhcJ2NfjVdH8xV3Twbj_SAIpQ/wE1dTMdxFqwnXcIDrErCHx4lNCKbc0Jstqrk_6kA8Ww","width":24,"height":36},"large":{"url":"https://v5.airtableusercontent.com/v3/u/49/49/1768197600000/KYc9ygMurwj9-9UXoNTHHw/vVfoeuUiayFzLLrtHsUQYohFd1mZ69re_PJPswdu-3PGXAoaP_bFHjaal1t_CC7rculgPNZVdt-m3TUdqrG3d0928NsOrk7Wt9slmkHdlv84TL8psON8onHgEKH8jC_XU-eHRs_cm04f6eDnZ5SfNQ/Tw5J8IC78IATSO9I--0a4eFkclsbk8-Xdut4rxNUGDQ","width":198,"height":300},"full":{"url":"https://v5.airtableusercontent.com/v3/u/49/49/1768197600000/iqz4lTCGOoeQak81EEig8Q/d3SuRZYnTllB5l3snBpU9Q2Lc0RxehqRprmq77rDP5XUdpj1WiPulSpnt5_LxEjGCZiXtCMYvAevh5iUj-Sfz_W3lIEMAG9wLzOaPnbsil1YS4l2woVGpoyhfy7ULU4CDZf6bBSDpWKhix_aBp8BVQ/eBp0vt6-wZ5VDk9eguXKCmycCRmWfpRBAI54BvX_QqE","width":3000,"height":3000}}}],"Authors":"Angela Duckworth","Readings":["recLNYIRQQyDpyYrQ"],"Date Added":"2020-01-19","ISBN":"1443442313","ISBN13":"9781443442312","Genres":["nonfiction"],"Author Background":["by-women"],"Number of Pages":277},"Rating":2,"Read In Year":"2020","Page Count":[277]},{"Id":"Sat 07-18-2020 to Sun 07-19-2020","Started On":"2020-07-18","Finished On":"2020-07-19","Book":{"Title":"Peace Talks","Cover":[{"id":"attBtCOg8m6zPkwuN","width":1000,"height":1510,"url":"https://v5.airtableusercontent.com/v3/u/49/49/1768197600000/84aX9FzN7Cc4wexmtkZ-7w/mpxx3_PBD0I3sOzHO7o7b1JKFfVTY8kqLpzxroz2nMYBR7YXAgjp5TxCUkttYCzpaIEcmQ8ZUcYB9tPSf36MtJUSZZrjLoqRAJcUAVPcxSLnIVRAe3TPU1CaROk7Fk-HspKawvLtTP9PqtJs1FexRw/pE8608qehgmxkmsi6NEy7F_xVcLYo4VcPekf4E4hHD8","filename":"49381341.jpg","size":341760,"type":"image/jpeg","thumbnails":{"small":{"url":"https://v5.airtableusercontent.com/v3/u/49/49/1768197600000/FSPtHbbhcnA5gKD4J999cw/_LohLV5vhPeRuaExFuYPSfXrlELZOyNECurcmDScRzHFqTEONbIeEeHtfKAo1yzw7eu4MRp4swAoeoleHt8JF3RSetnLJFdNR9VlJub9PcN1hLhADM-kL1veZARdZX3_S6d0OZqgvRbO2N5AxePJoA/Im8RTXJPv0WqnO6NySWch9xosxE1eN6KclimdJL77xM","width":24,"height":36},"large":{"url":"https://v5.airtableusercontent.com/v3/u/49/49/1768197600000/nnHdqnOVioRGVXwUQgbdCQ/VyszuO4Wim-6RY2DQ1apzDLMq_9DOUVmxL1KL2tbVzT8wR6RqtrQzyEFuleB6qDKfxuYw4-KsbGYKajiUFldfz5MYluH6ANhPBYOBhT8M1pHSt5doFUdB1tVHNd37FOTq-fmIEgBqXZTbTFORmAzAw/u71L5we2jgQjAQ2wXPpe3PYu16-NUfPCI9_bUuPmbdk","width":512,"height":773},"full":{"url":"https://v5.airtableusercontent.com/v3/u/49/49/1768197600000/h5V4Ob1gjPq1Cztd6XG6_w/2tDl2HocQba6Fqx3c0W2tvr_E5MH67gKYq4N5TQvLwAkoaWRpTA9CL4GPgVIgldpQw3jWkcsf-Tr4yNSrKxAZiVwrTHk4WvRsJeUdpBkx6pV00KW4JiakKNnzNrq1D7bF-A2ii2_M2rsx2LE7uKpUA/ciMh5C6hP-mg9K8vkQzm3HvqMNsOVxOjv8Wq9Izfqa4","width":3000,"height":3000}}}],"Authors":"Jim Butcher","Series":"The Dresden Files","Series Number":16,"Readings":["recMGXFZ7l8Z40VLk"],"Date Added":"2020-05-23","ISBN13":"9780451464415","Genres":["fantasy"],"Author Background":["by-men"],"Number of Pages":352},"Rating":5,"Read In Year":"2020","Page Count":[352]},{"Id":"Wed 07-08-2020 to Sun 07-12-2020","Started On":"2020-07-08","Finished On":"2020-07-12","Book":{"Title":"The Red Threads of Fortune","Cover":[{"id":"atti6RZ9g73KWahn6","width":297,"height":475,"url":"https://v5.airtableusercontent.com/v3/u/49/49/1768197600000/RHjudYio6otxN8KD6H-Rkg/UXqKkT3NDNN0Yhhd_CgLtxNE4AzdCpd6R-8aYOf93UJIkpYkJ6W2RMm0YzdpUq7QMRJamZG8zfGlttKNSszJas3N-R9n5tkOS43nYhod1kv870aD8svc2uJR1lXcwPS5wI1PPI2_VZ5Kpaxiox4NiA/asXGgi7B3ZQy32-m2eqlXl3j1XEUWrHxZIqSieGg88s","filename":"33099586.jpg","size":48722,"type":"image/jpeg","thumbnails":{"small":{"url":"https://v5.airtableusercontent.com/v3/u/49/49/1768197600000/mmtpVzu6qzPtPT7K-YV9Nw/yAo7sWJK6vsHJLdIuArpxTbUiUiYsb5yrDDUlgBHF--GvYxDIGGuyRaLgN64FWzmWUc_11R2jQjjCRgdHmuyCTQUoUrWzFvySyeLattx_0WeTmq0xQzaZRNdRI6oee4EO6Y3zrepnhDIe5WLybQYFw/BYc2m3zC1wzfZM3vAP4mAawfFlo5hnbTQy2uYH-2_a8","width":23,"height":36},"large":{"url":"https://v5.airtableusercontent.com/v3/u/49/49/1768197600000/XNvkiYNy5gsCynO8K-mqsQ/s8FeZh1VTx0RMuy7gxmLe-2vgBad3CO_QjvGPAg_WjUNQZxb7v78hTzhxgkutSzsvQJXCsAYXMQaLoK5ILB4rrwySUeUo0sjbie18allDWzloPejA_gNGByeWNsvqrdGOX_24CdWgxL72Edc6njAQg/B8n90iZYJJEF3PjGDcsVls5889A5JACLSZrgtAKzDgw","width":297,"height":475},"full":{"url":"https://v5.airtableusercontent.com/v3/u/49/49/1768197600000/fkZAUtL7P8n1ylwW2pFt1A/aJnfC-lhKFoDG3SccvQde6dFOi2hCbRlkF9PlCh-r1PQPxdhU98ps638-lykmD4Qu-mKv76DYyZ08ItCVI7DLpTCSr2O5pgwXUYGndxHlmEnPP5Xc_BfVlJsU-elsa6z8TxECtfENrbR9gtdtwXEEg/kKvJUdAr3P-MvsaFZPvL20XcIxjEhRbgN__KaTFdB4o","width":3000,"height":3000}}}],"Authors":"J.Y.  Yang","Series":"Tensorate","Series Number":2,"Readings":["recOVrPgr8XapKiDT"],"Date Added":"2020-06-27","ISBN13":"9780765395399","Genres":["fantasy"],"Author Background":["by-people-of-color","by-non-binary-authors","by-lgbtq-author"],"Number of Pages":213},"Rating":4,"Read In Year":"2020","Page Count":[213]},{"Id":"Sat 05-23-2020 to Sun 05-31-2020","Started On":"2020-05-23","Finished On":"2020-05-31","Book":{"Title":"Worldwired","Cover":[{"id":"attBWQ45TcAe8Rpfu","width":289,"height":475,"url":"https://v5.airtableusercontent.com/v3/u/49/49/1768197600000/R4osnLiW2tSDDrw0R_YKuA/7XVBvafEpjP0J_glPbtOYQIDBQ8sXh5_n7X5cQe-_BLhBFaae1Tr8b8B9jDY72iy6fec23Y2qprsScJ2hQg4cdPw7xaL-sUk-OrPhoUwtrUz07a5kOzRZVnvrRVqXXwFq_nQjkirsxM3romTNCQWRA/gJ_cyrhUXXmIqqbT5hSqoElTfxRUHaAzoAuAHwhZ-5w","filename":"185633.jpg","size":30977,"type":"image/jpeg","thumbnails":{"small":{"url":"https://v5.airtableusercontent.com/v3/u/49/49/1768197600000/OPR-uyWqG58rOnc-BCj2CQ/NgfOerjxomtdHOMbsam1ZiqH3CwoJ1hr5cz-OgN9ssghtAQnUyotlxt-qkEFLAhBz0YFSNuYysZDKDGc65kd5NHUMyu0YcqqM3KSgd-PID_IdE_DellRZKgs0iQCgXvrgCB9a7Dg5Vqq3gH-NFzorw/7eEbnKYKQ3BxjVhzq-lTtLYp9aggmCyAofDHBr5toi4","width":22,"height":36},"large":{"url":"https://v5.airtableusercontent.com/v3/u/49/49/1768197600000/H77ccqQ2WnAozigfJdWdlw/SxruO-djFOWcbIGSaTWeifciLMLMsmaQ5ftJliWU5P51QkwqeDTXpfJIeN1tBIuk6PFSwtyo0h59crVa905-w35fpbP369E4j8Lmun_9tMTfjBgyt9mooxelZdOtj8LHcn6Z2Zihz9Wu9gopwHVvcw/AQ6a1E_yDImCev4Toy6dvDtePTNTlibjtjhGmiEIjiU","width":289,"height":475},"full":{"url":"https://v5.airtableusercontent.com/v3/u/49/49/1768197600000/G3ucccIQglCORIWe85zo4A/cq_0teOzlEeExS580SeK7WZRKiR9SryJGnNx9cYMHZ3uv127EzksQjRM6U8YYEUyciKcZgt48VxdrlONOUwjnzNE_LfPrjhXe7-aZxYlrcTVkBHLHmkcGxi6_x226ayDQR9heAAv93zjWSkd2ITwnQ/lBUO9J69FB0BCvIcM-HphmGZJSXU1nHv40jMAh5x83w","width":3000,"height":3000}}}],"Authors":"Elizabeth Bear","Series":"Jenny Casey","Series Number":3,"Readings":["recP7adoZOSn7WLUU"],"Date Added":"2020-05-23","ISBN13":"9780553587494","Genres":["sci-fi"],"Author Background":["by-women","by-lgbtq-author"],"Number of Pages":398},"Rating":3,"Read In Year":"2020","Page Count":[398]},{"Id":"Thu 08-20-2020 to Sat 08-22-2020","Started On":"2020-08-20","Finished On":"2020-08-22","Book":{"Title":"Binti","Cover":[{"id":"attQxFp9y5JWqS89N","width":297,"height":475,"url":"https://v5.airtableusercontent.com/v3/u/49/49/1768197600000/C-_RzGiKPxlrXtqkXxh_7Q/T-O5OZywVPotboiYt7NRX0i8fN0fkcpLtc5klohV0YejfmZCYic6LnBWQDHJ8KIW2RWrzvcwAs0joFKcvDDIFRemoZtUPcTJNFPnQ-w7awBzk74hOIJQIGPEq82q_2OLUmAEEAjGj0Y4YAQo5j6-AQ/qvXucI3QssXJLQRpoKr6IrD2CDSRv1WPHWbqNkZDzyA","filename":"25667918._X0_.jpg","size":33926,"type":"image/jpeg","thumbnails":{"small":{"url":"https://v5.airtableusercontent.com/v3/u/49/49/1768197600000/ybgLRLfLvVaTsfbvZ18POA/GBpLk5twg6nWfw_e93OId79pLO6c2W97DEMp13b3qJO5CtXrIVw-R1-u9jiWGOi7fjgcpGwz6B4RgOHXcjM04FXsy_s5FZW3yZiaT-Lgnou9-QCvaVZmBPOXP16fvMxoDjPFpFhlY0DKaQc85C_vzA/Ys_5zPddRmxqge0ZgoCA30SfrVrZQ4yjZW-RU0oD758","width":23,"height":36},"large":{"url":"https://v5.airtableusercontent.com/v3/u/49/49/1768197600000/9MeUJ24EWPLIO-nA6lOMlw/aPv7eaCoyblHKOhp8L4NcGCiYNaxiUP1_pZUwoLPBjdSubGEcSizZOxQGX_f0sz6CLqJSxMk3xsKLKtKo_frP6RuWxnXw7Ebooib_N2hWWQXRECijvJFJgnkDD99dv_mzf2JC55ou_0baZ_ORJu0Hg/jpIFJjUjgKlzoFMBERudh3oCVe-GmjvTGdJQPLYZdoQ","width":297,"height":475},"full":{"url":"https://v5.airtableusercontent.com/v3/u/49/49/1768197600000/63EP8omA7fV30fvwdv_Gdg/s4LMc5lCzLRUgFqTlJYMjqm9vDIqStKFStSHlBtCaKOvKO1ijDO7cuXnMB6danH_-9qA3LEnexu6rf1JI50uLNvbPXNLKgeYWrGrIDHA1pOwwd-EzhsZsKZrm5ONB0fyUnqWZ0qDTHYt7S3VLh7-Uw/TjO2K3e9lFsaqKu4spQSXNxOKNB-dk1aNXOnHS7tnNo","width":3000,"height":3000}}}],"Authors":"Nnedi Okorafor","Series":"Binti","Series Number":1,"Readings":["recQBCijeA4XC5Ep8"],"Date Added":"2020-06-28","ISBN13":"9780765384461","Genres":["sci-fi"],"Author Background":["by-women","by-people-of-color"],"Number of Pages":96},"Rating":3,"Read In Year":"2020","Page Count":[96]},{"Id":"Tue 09-08-2020 to Fri 10-02-2020","Started On":"2020-09-08","Finished On":"2020-10-02","Book":{"Title":"The Ruin of Kings","Cover":[{"id":"attTC7G4oQsV7nM4p","width":199,"height":300,"url":"https://v5.airtableusercontent.com/v3/u/49/49/1768197600000/Rq2oDZo0TGwOdeFNsv5tPQ/wuVIkloLThl9VZnRVWJ3zkxEDVvyl3JRZbzzGe5tW2wnu-vhuyRECYdcZXP3jlXRne3eGnSUwU-HuOIzuxx9cqeZykyOgL7a3khWrTacXPI8CDHYKC9o4odWk4D8_ean_cgfDRlerhzaFyC4k1IBhQ/-GIHR4kjNnRnXbNLZvtgcDdh0jNKydinqEIgwWWZXIw","filename":"39863237._SY300_.jpg","size":13415,"type":"image/jpeg","thumbnails":{"small":{"url":"https://v5.airtableusercontent.com/v3/u/49/49/1768197600000/pjUWeXllEYjybGowgfXM6g/gjhk20RhwChSKdTuAvbpQ7AhAgKJfsGomOEUwiW0YOjClljYOYiuOAYJkTDgWPCqZue64xNHD1MKZPIbDNSAJEk3LQksuLpizvySifiW3TfmSL-2nZVDF8Ez3Bv_Fz7Py4udOj3uDmi5RCy1lkCH8w/OJbwpEO38QOx5S0iOeyJtguJec-UKJt6v9atB9KeFq4","width":24,"height":36},"large":{"url":"https://v5.airtableusercontent.com/v3/u/49/49/1768197600000/ZGUOonNY5wk_VAiiTXXdag/8e53OiuOVt_QGVdsa_IMtsYlTLvLCZQqffiwbP_SUIDg328W0bQCmocU7YotTPwupKMsjtcr2SprfZ6qY680fgC3YEsWpNY8JN4NbZF1aGtWDLDUOeaTuzKqMkR2kR9lcMp4mWIvWVohx1m1Juy4PQ/dyrVf7ElVT47v47DzdlD_VwE0q0yGBjly9Oo67NJ2yo","width":199,"height":300},"full":{"url":"https://v5.airtableusercontent.com/v3/u/49/49/1768197600000/8LNI8cU6lPsYKgDqC0Msjg/j5kEzeREzhlTNWeqiiPr82X1q587tkKyVQ9ERaUIPYqVqijyWr8fMaPS8nkDWY4reupREuLZxwt4mRqCFBzWnRFmcLv0nzgbA9cDzv-mfavAM6lyKfOfvDQ-KPIxHj87gt-QPJjn1m_Le9RY5owkdA/iAxuT5VeZ5VYBlYHY3YScHbZWmx8WapSR9WG31OqFjE","width":3000,"height":3000}}}],"Authors":"Jenn Lyons","Series":"A Chorus of Dragons","Series Number":1,"Readings":["rec2UDYHJYha7Iw5b","recRMw7aFoCIyTkEN"],"Date Added":"2020-01-19","ISBN":"1250175488","ISBN13":"9781250175489","Genres":["fantasy"],"Author Background":["by-women"],"Number of Pages":560},"Rating":4,"Read In Year":"2020","Page Count":[560]},{"Id":"Sun 06-07-2020 to Fri 06-19-2020","Started On":"2020-06-07","Finished On":"2020-06-19","Book":{"Title":"How to Be an Antiracist","Cover":[{"id":"attzA4zNQi1V9UDj0","width":265,"height":400,"url":"https://v5.airtableusercontent.com/v3/u/49/49/1768197600000/q5zogC2y5zZpCH5_oiILTQ/IuToY4vaeL6VrPg9cGepPK6q-Nd7mP5PVF3CKwyl6owmvaB8dudFkqwKayanugE8pWVr30x_XLyOpNJ3GJlvWC_1iBL-f1inrlBssuNOQliq_YO7FSUOJQk1DxqiJREPq0sJFeHBmvuK_j476gl5kA/Fjf1qeV2ukXDaAORE6R-VBEvQZULKn-fv3TghjzRLNY","filename":"40265832.jpg","size":19746,"type":"image/jpeg","thumbnails":{"small":{"url":"https://v5.airtableusercontent.com/v3/u/49/49/1768197600000/0zRY2wMAqyN9Hjw2rQzU4Q/qlxKGKB54lVTq_Jtui69vXfY2cTMF045bogF3r42fiXY6b9C5CSHnwlT3Hovk1QAcY4DLLh2Wj2uDYhTxRgxNAS9aiIZYqt_50zXhl_ry9HEUXFg0aSPTrWGa722LuTmRDqihiGKyimDyYq5dedk-A/JEA8sa_x6Mlk7wqbCWATGtXsWCzxra_A7HbZVke5Cec","width":24,"height":36},"large":{"url":"https://v5.airtableusercontent.com/v3/u/49/49/1768197600000/Wztx9LjpGS-jiK77vzt6uA/NyBWBnbE-19k9HIdPmeQ1fd8Buk_OGURPqH90UfUJEgd6m9EZl3Wsup1br_QdsXDC3UxFjzsgSZkVlkUG1C1FfdlqlWYZ2ol8DwNUunGkyPS2Y_HvwhKXbLflB89weLKVgEXCE5gudiFCzAS1E8dRA/mvbj4zv0_FFR26EodBJQq096er4d7EGhG_4XDxQ6dwc","width":265,"height":400},"full":{"url":"https://v5.airtableusercontent.com/v3/u/49/49/1768197600000/hfW57M3KUhStYe7EXew8Fg/S40UzWy-mb0FaWHf47FPIuk4bIeZhgtNxZhHXsaRin0RWvxUuGdtgP0kl8YEe4QrZJBTbKNx-_RuoW8mwat3CJlK9Gy7AnNU8DYFnDcrh64gLhnbB8P2XtUKeVJRyU4iVN7A2bnefZ2HOEqbS6rtaA/u-12XW-Zi7PQ1FPuCwkSkGdxdi8OqtoTtDqqYjI3zmI","width":3000,"height":3000}}}],"Authors":"Ibram X. Kendi","Readings":["recUD8nURPFaDpYaR"],"Date Added":"2020-05-31","ISBN13":"9780525509288","Genres":["nonfiction"],"Author Background":["by-men","by-people-of-color"],"Number of Pages":305},"Rating":5,"Read In Year":"2020","Page Count":[305]},{"Id":"Sun 06-21-2020 to Sun 06-28-2020","Started On":"2020-06-21","Finished On":"2020-06-28","Book":{"Title":"Bird by Bird: Some Instructions on Writing and Life","Cover":[{"id":"attx1zE1tW0UEenGz","width":196,"height":300,"url":"https://v5.airtableusercontent.com/v3/u/49/49/1768197600000/VtjZSwjvUhf3kqpEVVe6mg/K7vyAPQzzleJv5Q8IOkQmwQ7nDs358p2vQqdlUOMgy843v986HBYNfDjgapY15cDZclmIpdwyCopmeb2JHirpbvf0i3cAPDCj75D8VTc_PkaTLM93MlQ1glcqQ9Q6-grrXTlhd6XX0__W3DKiifMMg/aGRuWzeiFf6UpPGtQKgpXxJ9kNP_4pFb_1zULo0byvw","filename":"12543._SY300_.jpg","size":10702,"type":"image/jpeg","thumbnails":{"small":{"url":"https://v5.airtableusercontent.com/v3/u/49/49/1768197600000/9smkaaMiSf-ptAOKb8b8eQ/TF9DuhgOj5bc-JI1n1MqjX6cRWboqYgry9s8gmDAHX0ijTLSf50rFncPAaB5wyPeqfJyicenO-m5qj9ejk9WCuYRm2hu8eZWkUvYs9haCfhAGBGqeaBpeWYX5bb0MjRpARoEDmG06dQaq9hf3el9AQ/A0RWp5Idh5wlXc_v_JkpU4f9tfA9cGZ-IV5gX2ajuz0","width":24,"height":36},"large":{"url":"https://v5.airtableusercontent.com/v3/u/49/49/1768197600000/N0A69Vmdh57I9lkBoJyYgg/du3vHFlXYVXMFnaa9s6HDH5QBjaaqwInW8I27J-SXOKardFTH56RHZ_KuFk6yrTj-QtX4WSEj0QSGt2n-m5hCuNBoozK4SNMQvUjvkF64vrxjrcUdwKbThVKZAlb6fKFqN6lP48fUTZ4YmIL_nc0Ow/pHmIxA5wGdKbuZ-WId8ivQVp0PfH5ZzyMlnp_DrCD9k","width":196,"height":300},"full":{"url":"https://v5.airtableusercontent.com/v3/u/49/49/1768197600000/oUMyGTT4acPsHV2XD1am7Q/nETh3jBf7PDCh40b0kXJrgrEQXnYgscYEIgnR3zWB06XBpTLKa7h1gudfiutFuJ6n40aAG0isuJJt0aK53P1dIh95EYyyvwXN-SVzrkseODUIltojhMGIH68Eix8k6mTRrTz4WyK-NMa6M64izv_hA/zymy_4xNh1dt4HCDiVy7xh5oE0G6VgKuR2v8-epTivg","width":3000,"height":3000}}}],"Authors":"Anne Lamott","Readings":["recW6qCnzJWLkUr7w"],"Date Added":"2020-01-19","ISBN":"0385480016","ISBN13":"9780385480017","Genres":["nonfiction"],"Author Background":["by-women"],"Number of Pages":237},"Rating":3,"Read In Year":"2020","Page Count":[237]},{"Id":"Sat 10-03-2020 to Sat 10-10-2020","Started On":"2020-10-03","Finished On":"2020-10-10","Book":{"Title":"Battle Ground","Cover":[{"id":"att2o8jFv397kcCyg","width":1838,"height":2775,"url":"https://v5.airtableusercontent.com/v3/u/49/49/1768197600000/wVY61APINy_o1aMqPAtXSg/UdZiEyDFhsfbHmkLbR61_kde2WChlEeYc3qDgBRKj6ja27SoQirl89c1W7XQ1VyK8e5m-0s3tm9na0zOete-hO8hxXlEw7ee2iGmL2trsUXBQviKBjkJKwb99z2dHrt_prX-lYFCz6H5JRLQCf-Tdg/_GZv3kzzbhvnx4KaKzIaTGSJD8GiK8D1QOgHcyChE8Q","filename":"23106013.jpg","size":423704,"type":"image/jpeg","thumbnails":{"small":{"url":"https://v5.airtableusercontent.com/v3/u/49/49/1768197600000/DR15_tLeORxscDlExA1-9w/UUU3t6u5h9EWvfMGy6DUiAvB3X9Ptx4fvSIEuYdIHW3wepJ6z_7qZSSVDOkyp7O0xJh24A8tWrgThmFueE38jL9T6PkGtTbjCQ-nlZQsrFgeqTmrPR_eT-BgpXlhdacvTeeFmWmLN-VJxGgCEkOw5g/ZCLUKRzFUqgeO5IuAcC8p4ofHcM2kUMaQ8acybn4sNk","width":24,"height":36},"large":{"url":"https://v5.airtableusercontent.com/v3/u/49/49/1768197600000/ooVK8NgF2aoZ-F2W02CfQA/tWU7oubzP4hBssY_fDZfLKtT5EKST8xHkeLEIoq7z5OQav-ImYiod8PAmN2ynLzCy0PND1pKjAkpgs531PeWlrnpouKwjcmL-7ryaua7N7UaNL-UEJWl572HYCI8U3t8QCEfj7DoqXF9IPZhZla-SA/w2r47sWyQrRzF0VWxbhny6Yr3-rA5V3sCKIiC-dS2l4","width":512,"height":773},"full":{"url":"https://v5.airtableusercontent.com/v3/u/49/49/1768197600000/Sx75qCV82BogAplOfwl61Q/vHGuSZTCZNvSGiYZuB7ad_YApRUoc-NFGbf3FVg_IraChoqoAHf7aj9NGOOL3RZqJSdbfFoVbw2Xy5PirQYWDXfuRaUxRU0srN15gG_H-vQuJLQdvNMg1GcAVgARq6JtgtwqiOWp9E3aLYnwbOxGpQ/Hu7wifyuKFs34bauQuy7wIDx55RqBbIrv8sV3v5EpSA","width":3000,"height":3000}}}],"Authors":"Jim Butcher","Series":"The Dresden Files","Series Number":17,"Readings":["recWXjfCTuOcfIRBY"],"Date Added":"2020-05-23","ISBN13":"9780593199305","Genres":["fantasy"],"Author Background":["by-men"],"Number of Pages":432},"Rating":5,"Read In Year":"2020","Page Count":[432]},{"Id":"Tue 09-29-2020 to Sun 10-11-2020","Started On":"2020-09-29","Finished On":"2020-10-11","Book":{"Title":"The Shallows: What the Internet Is Doing to Our Brains","Cover":[{"id":"attewp74lbh563aek","width":267,"height":400,"url":"https://v5.airtableusercontent.com/v3/u/49/49/1768197600000/KTKs0kMPI4q6r1jZXkqBew/Y5jtj9Rni5Jchszc-sebEYDi22mcFH7jRvukjk3jsRALy4u6P70CDzRhd8Eea7CKi_mafKlsToD-FA3dVQWsyaVmIi8YyyyJ3q9fJOCi4HsXHMlZKry2v8ufh1SsYF24KWSmnN6HJGruSWXt397wqg/NNEzyqa9XqZexH4N1IVsj3nSg-speFN_3kCNfAJSZuY","filename":"9778945.jpg","size":17644,"type":"image/jpeg","thumbnails":{"small":{"url":"https://v5.airtableusercontent.com/v3/u/49/49/1768197600000/XYWGAdfTixd48zkSJpunoQ/5evGc9jzoGpY4vpGxfIY9Mt-tx3v3ucv4M18gJDBbgYYlGY_opuiOVHpCkk6IB-tdVBjMwM5KJBv08O2G9iacn-tFlosImL2RxHTMlaopU3ppWyDNB9HRNm7OSyR4xHOvRrnMol_iLH8jVsAVkaPFw/_6Xb7XsecDtU21FxP4Ht-fvdn_kmcEAQtUHuW9f9EJs","width":24,"height":36},"large":{"url":"https://v5.airtableusercontent.com/v3/u/49/49/1768197600000/Xh0uFTs6JiMGb8LnPUCSvg/YnFUpdYQNZzg7EeF3z2SucRlBR5zdeIwxrhxenwrmtyA9OaKNQ6iiUhB-0jJHxOQMoi4myjm_ktnc67dVokav2Gmx_-bzi510XXwMTjCiJ7Wvnx2gl612pKP7Pp-sAC3pEfx2jWp8Xir7nwTFYV5DA/RjJlcz0hwns6filKQ6k6FlU3D96xkqyXGXZTOXICDFo","width":267,"height":400},"full":{"url":"https://v5.airtableusercontent.com/v3/u/49/49/1768197600000/xZ6cdU8rIXAT3H33e6XOOw/deuFiinEOSAyLnd-HGdijtlYx_m4MmVtj6UGMkemPJS5z3n2_NOpo2IMDfXYTcDenO36T1vr4u11koC2K-RhA-GU0i0tqiGPn5vrieX1peODAGC8wJ2HX6r7HH3XCJP2pnen6v96bMmfTE_fQBWg_g/0O6tZoc9TgnKzaN2wd984IZjsJBjjITrcPDgtaTeA8M","width":3000,"height":3000}}}],"Authors":"Nicholas Carr","Readings":["recXPciMJRy2OACBJ"],"Date Added":"2020-07-05","ISBN13":"9780393339758","Genres":["nonfiction"],"Author Background":["by-men"],"Number of Pages":280},"Rating":4,"Read In Year":"2020","Page Count":[280]},{"Id":"Wed 11-11-2020 to Sat 11-21-2020","Started On":"2020-11-11","Finished On":"2020-11-21","Book":{"Title":"Machine","Cover":[{"id":"attJjSlvzKvlZZK2C","width":1836,"height":2773,"url":"https://v5.airtableusercontent.com/v3/u/49/49/1768197600000/52LVo8KvKkdYWEVmYX4j-A/56sQXYgEi2i7SETbfLgy7PExsqKx_zNAfH3GVwRoRHecKV5hnDyhew6dookzGCsmBEIWHTJN7gcJCn5qYtT37qhuvuf9pb0_mr3zUX03mhspZU2ljR9P86LnOz9I3-9uCTEd_HoqplL0g6Wqy6BGJA/EudgZJRWtgvF1WTU1J-YDI1sXXC2J1NMrhzLixiouBc","filename":"52527709._X0_.jpg","size":2061073,"type":"image/jpeg","thumbnails":{"small":{"url":"https://v5.airtableusercontent.com/v3/u/49/49/1768197600000/wXKUElLHTYmkP3EkXNWVsw/jRDamJxBiSxPRZrXSOX_ckPsJx2b6nNRGNjU6sB6dQMt_hR7tSr4DgCvrpcSk6x0-dlqAg-QCNKNdcJhpJSXK5fj-beFQuaEumjemD-BrkPUzfZqntu8qsEBuaVqLzVHMRACfgEe4EfjkLjKWx3q1g/Hmog1smpY0SCTtnTZHBwVbNTxsmngSYyR9QJiCsYZkU","width":24,"height":36},"large":{"url":"https://v5.airtableusercontent.com/v3/u/49/49/1768197600000/jqwH5ll4CE8BLazOemaBtw/yEOuPk1ONNsUCO-egQ4F3QSzwO-cgsamgp3OxDCDhfLhWKaaN3f6eKDmcz6U0OoZEgGO92BnYDiNXydqT2UQ3pcKsMWAN26ydVLDV_6zSfMlHfQRTOcrBg6mu4XpvshEJsftm_hkXRXOXMXIg2G-0Q/czLblIsyxPrR1JHNnAVCy595pIu_o6lKP6TL4Xkam2A","width":512,"height":773},"full":{"url":"https://v5.airtableusercontent.com/v3/u/49/49/1768197600000/rsS-L9jiVZxb1Q_pKgNZ5w/HZ-2MzuGJg_rihuzpehGAbWT5V9enuPirw_wXQ2nXKyL26xe7ozt6ivqtf79dsKjyqc6uJYeuX-cKC-GATsvJqq-1N1OH8tbxkW2N2gsEk_B3Gom3MwfZ290Sv9eFDD89378INDn6YPoarc2ly3ipQ/K-sauE7F1OyvMhvgt8_QUOOG7Bii29tvPwVxNB_mrlg","width":3000,"height":3000}}}],"Authors":"Elizabeth Bear","Series":"White Space","Series Number":2,"Readings":["recd0xf52FU8WyJOY"],"Date Added":"2020-10-03","ISBN13":"9781534403017","Genres":["sci-fi"],"Author Background":["by-women","by-lgbtq-author"],"Number of Pages":496},"Rating":4,"Read In Year":"2020","Page Count":[496]},{"Id":"Sun 07-12-2020 to Sat 07-18-2020","Started On":"2020-07-12","Finished On":"2020-07-18","Book":{"Title":"Brief Cases","Cover":[{"id":"attaCvMoKb9cbxYSY","width":198,"height":300,"url":"https://v5.airtableusercontent.com/v3/u/49/49/1768197600000/OXien9sRzxqZO_HNOleM7A/5m0LRyqReo4k6BHCWk799iz59noWNPD8P2QIPBhzIyRohBTg0xzVoCwElslB4UNG8cbIl-MJibW58MkJ9IGBkoYXvXkGfdqRLKaW5jsByNZ-sei22Ap6rEN_UO79uh88Uzc_J3Rbn56y5H1Hzxl5yA/MNNQ9i493kGh0A_0ZyCx_wMZurDs2f3opVr0mX9hRUE","filename":"12183815._SY300_.jpg","size":18473,"type":"image/jpeg","thumbnails":{"small":{"url":"https://v5.airtableusercontent.com/v3/u/49/49/1768197600000/ZhzrgKhENsGbBbGgKyzJfQ/k1yBHnzFgMxsxrAQs4cQLyHUJ9b281gRhj7_cTzT4tsE_B9ewiRacax-ssGNECDQ-FzmazZqbM2xT_Ai5mrUd5kdiWYVoh5c_8Zav2MjqkZfTHb3tEYEme1GtRKxezE6DQYAY0QlZT7pJUtFiYVOMw/0brHogcKZTBH6-7pqfTdTvBvm-kz82FUuQTXyNoa76g","width":24,"height":36},"large":{"url":"https://v5.airtableusercontent.com/v3/u/49/49/1768197600000/of8ESJGAA91mU58ZBkCgRQ/0IbYujukxd153OV5NonNixnvvMD2cseCxpYnYlRZ5ZZ1DiOumb4z2PE2ZcwTNNjfc4JNgcxssQ4h4aLYeJzSmbRDegc_XDwWmd43sF6o5eSh2YHJUXeDtVuZY0LPJ88b-2Ou16qww-fBYj-XJe12JQ/da93-QduIVlPj_fNWuAf0ZzBBNV2dtrRTQqBt4vt-Ys","width":198,"height":300},"full":{"url":"https://v5.airtableusercontent.com/v3/u/49/49/1768197600000/bm7RNNUXPba51-Uuy689Dw/Gv8EMQKdYSTgjAEbjVuygq0G-tfdKwstXukE58TygquJzB6iGqRsmNNw5mpnYCMvQv5jLX38Gk3b-SSpOqd5W2DlNtJmSKQqGBtlENvHOrG63RvfXfKAnPTqTr2CeGiUUrtQ7OGa62Pp4hMECdo7oA/gUsLN2rMuDOIYqOJYtVqOwGvebYcuB33kxxIe4qbv2Y","width":3000,"height":3000}}}],"Authors":"Jim Butcher","Readings":["receRYnTRKv513Cvk"],"Date Added":"2020-01-19","ISBN":"0451492129","ISBN13":"9780451492128","Genres":["fantasy"],"Author Background":["by-men"],"Number of Pages":516},"Rating":4,"Read In Year":"2020","Page Count":[516]},{"Id":"Sat 10-10-2020 to Fri 10-30-2020","Started On":"2020-10-10","Finished On":"2020-10-30","Book":{"Title":"The Name of All Things","Cover":[{"id":"attZkL8uNr8G33fZb","width":198,"height":300,"url":"https://v5.airtableusercontent.com/v3/u/49/49/1768197600000/-ODmS8M3Iou77kupofVGJA/c8OGuDjpwDR6M2BcnA-XexcZXTks8T-Df09gNFYQRC81SPrbBP-oGWGHEQ8jyZO18E5nE_CR985APvF7QwWiLEEcANXrN1mz0FTJ_OiATyQQTfCAS91REKFcLmIWwMX1qdORztud-RaTXfj9nT6VKw/DJKjuuYMWhaHPKhfr6Yng7sICFLsOzGRdmVjE4ko8sY","filename":"43255070._SY300_.jpg","size":14748,"type":"image/jpeg","thumbnails":{"small":{"url":"https://v5.airtableusercontent.com/v3/u/49/49/1768197600000/-PGSjIFGEOhIVSKbFzbu7Q/RUEx-c69SRieNSqShWOxg25p8OtyofxYCK7Nc44FyBLbBaQlAhGaDZkQZ-8ted936RgZiV5LNUiswwGzKcIh-uD8wewNOM4wmcSCHL0PaoXGC9QnXfqxaEGYbwUF8_NSIeQ-Sq7mmpfnE3dLaK94mQ/3z2yjcmK5jiGeBhu56JLAtI5juR4mmeikI1kAx-24Ck","width":24,"height":36},"large":{"url":"https://v5.airtableusercontent.com/v3/u/49/49/1768197600000/_5TItU01uaw4zIDj0aQeNg/jRQzjvVUgjA8e6SMZSsW-piMZtmQXLKbpwYBl5gChGKuGj71eqUpb3zXh1iofi5O_Xb8LuZ2WgrtM7X7Xj4JNYMymomHRtfu5HEgkNDSrv9f5dHfFtgSn706Hx5WVi1zHSDmHdh6oAE3TUBa3SBEew/Ng-t_plcvrIAjDLHiPvvZGBurlwDftjAfdFm21MPgIk","width":198,"height":300},"full":{"url":"https://v5.airtableusercontent.com/v3/u/49/49/1768197600000/FY13UWVpR0_UBcfh_ALwjA/PebMCG015sdYRgNO-sm7W0ocIACxVLBHu78mALdHFVnZ4ogyD1R-mA77WPSj9BRzfITjXGVcS29lLUWy0ObqEsblYB9g8obRCwwjSqK-m8IRmkk7BrbVoOcRI9ThouIriXHjus8UJxqvVlj_DDgs6Q/Q0bSoxRmKN6fQVg-Av5GeXnGH13py3G_THex25oZLEo","width":3000,"height":3000}}}],"Authors":"Jenn Lyons","Series":"A Chorus of Dragons","Series Number":2,"Readings":["recY6utnWw6Pt4siX","recetYk5bFG1d3EOs"],"Date Added":"2020-01-19","ISBN":"1250175534","ISBN13":"9781250175533","Genres":["fantasy"],"Author Background":["by-women"],"Number of Pages":589},"Rating":4,"Read In Year":"2020","Page Count":[589]},{"Id":"Sat 06-27-2020 to Sat 07-04-2020","Started On":"2020-06-27","Finished On":"2020-07-04","Book":{"Title":"Skin Game","Cover":[{"id":"attYi5BDHcuz4nFcE","width":300,"height":450,"url":"https://v5.airtableusercontent.com/v3/u/49/49/1768197600000/9tY_g_ykdyoUt57BaBeudA/5kH7cfrEPbi9x3HYEe7Bh0gZc_ett7apnJRwixAziY28ZBxs9LMUgr--b-IRDUO3QKqCs0QM5Xg_aknAmle7grC5zI-7KqJ1AKpiozUSRmAY4TBaUCzmYQTTZLVV39YEsd3edLUd-EupFPtRUJxdeA/e7meL_rJdlDMRfm3vSCpkjd2zmSKeLZy9PBdB61IxLs","filename":"19486421._SX300_.jpg","size":45132,"type":"image/jpeg","thumbnails":{"small":{"url":"https://v5.airtableusercontent.com/v3/u/49/49/1768197600000/wSIK3ba43uXKPn8b1TJrTg/Fl4Ix6oW-VwVufNbj6mBrFmiLmBHIJs_KKHXKMu8BDqycgWML4G1ifDdOQYvcjEeiFe8btuhhRngIMydrJLOv_9RcTh4TW0snkvT7dx7E2zggKCOpE1QK2GOyKaXEZw8SDuFMTHm8I2aH8BTbVfAVg/gBKhhi0sXb-phZg3oxzJbKfbFX5OIzIBka6XC9C46tQ","width":24,"height":36},"large":{"url":"https://v5.airtableusercontent.com/v3/u/49/49/1768197600000/M0hGWtAuHR7h1V_QF5K9CA/2c5gpc67Hc3k5l6o4CfnMbi3AxcauJbnDbaTdDqH391ZG2JirEsOllGMzrn4bydOREjiFpXE6K9bweg0ES8sry8lvSKpVcUR1ygj-yzrghoznuMFOc0g1UivrkgpS6HtYGlR8yUd3KujGlEAm2IN1w/-ANUEBqq8RbWHANI_hkkTLEVz9lwHCtDWPd42Nu1fVw","width":300,"height":450},"full":{"url":"https://v5.airtableusercontent.com/v3/u/49/49/1768197600000/xoaR-Llw-iAE8ElrZLYrbw/pn-8R9531UZPEHqK1hEodDWTv6AtNI0iFAAm_PAOH1JYzY6MlWu6Y2tPyDzXV3RqwUbsxf-aqbPVXCiO4EIbIZlIvuQEFS1PupkgtHgRYdIHxl1PmQlxMcQypIOXb4cZQLsOGQywlhSb0q2evzLfCQ/Gwg4i-8smWpCwXAaeTQzhXgzOKaNfChWt242dZwwRi0","width":3000,"height":3000}}}],"Authors":"Jim Butcher","Series":"The Dresden Files","Series Number":15,"Readings":["recqvJZL6RB0Hf4Wn","recev7sfLlSSvOuXN"],"Date Added":"2020-01-19","ISBN":"0451464397","ISBN13":"9780451464392","Genres":["fantasy"],"Author Background":["by-men"],"Number of Pages":454},"Rating":5,"Read In Year":"2020","Page Count":[454]},{"Id":"Tue 08-04-2020 to Wed 08-12-2020","Started On":"2020-08-04","Finished On":"2020-08-12","Book":{"Title":"Harrow the Ninth","Cover":[{"id":"attp5aForMlDwhEQU","width":304,"height":455,"url":"https://v5.airtableusercontent.com/v3/u/49/49/1768197600000/De-ui60sKdITSKOAkvUxgw/PjYSF0My6L_AeK63p5TgPVp9cA5BFft4K_WflgUzKJ5G4h_HvRjKYR8GgH_bNUen3hDIrwWOUjXBjmxF9xPHrZu4uSwxkbqxI04s1H9nJehxEcRCIj2OnbWeTsNhA-IIhymG48fVdt_YMdkbPi0qlw/Da8n_7IOy2N6dOPzGvUUd03mwX78Twx-YojFwqxpgA4","filename":"39325105.jpg","size":42519,"type":"image/jpeg","thumbnails":{"small":{"url":"https://v5.airtableusercontent.com/v3/u/49/49/1768197600000/QXOyGm_mcVA1-8l-grOdzA/dH1ZxBnBB_ai2RjQERmDrtAeXbeIzLy1wz-nJJwrMPwEAj4rhYMrWAsYi3oCbiDsACXivjIWEGTOfOBb_tYm0HkyNX3CG7j3NKDV4qpFeVLLPwMA-1GWWjSMc-BEAr7gxzp47D4bmh49kU3VQkcA7Q/KeFVazDBKlqf8R29TKBPk4LgE5om2LEM69As0TdQDdU","width":24,"height":36},"large":{"url":"https://v5.airtableusercontent.com/v3/u/49/49/1768197600000/yY6XI3Qi8L3ktcpQWLkSlw/roecnpJaD7fV_u0NtQZ-8YhjB9SJHI3dVLybdPFYljBNK2aJJimZxerwASVc_kkax-cNsJGpeJ9nT415JNQqLbbl18sJYp0Ljgbz_eyNmXb7sMK8Ngz3sneByq3i4cV77v4d9oLdOYuDyPi6aPxdUA/yHq5RyJJwonjj8cVvqO6BV7vcWj4HoHi3YkIcUyra3A","width":304,"height":455},"full":{"url":"https://v5.airtableusercontent.com/v3/u/49/49/1768197600000/2sebLH6jdi6UtlHiI1VHBg/RCZFk1XDWYJcnvzyDjC_YOVg8Zvbbg82MyLUHAaYzm3pmmZPnwe8hXvTMPycRg1BHD6aZTAB1-F3pMmqnUOTzG7F3pOB8XyTdaoa5ZiX13h_YK3mDW2RWwQLUf2V4iLhSsLQxp_Fz_EKaUIF01-Y9w/fNYemt4f_wLzHWqnfH3WMDbfBet1f0D0HSWbqgqhyrM","width":3000,"height":3000}}}],"Authors":"Tamsyn Muir","Series":"The Locked Tomb","Series Number":2,"Readings":["recf4DFqk693xBRck"],"Date Added":"2020-08-04","ISBN13":"9781250313225","Genres":["fantasy"],"Author Background":["by-women"],"Number of Pages":512},"Rating":4,"Read In Year":"2020","Page Count":[512]},{"Id":"Sun 04-26-2020 to Tue 05-05-2020","Started On":"2020-04-26","Finished On":"2020-05-05","Book":{"Title":"Stories of Your Life and Others","Cover":[{"id":"attv5CEcmfuZQuIZl","width":262,"height":400,"url":"https://v5.airtableusercontent.com/v3/u/49/49/1768197600000/HywigSqnlLJBQ2-BdMWaxw/HEeiloUqy6prS9eU21oWUGuq_Ls8IhicDaC3gTR3RpkD_zRgYTusLNS876mnKP0CPG9l2Lo0vF7gnVHpNC5p0h-C2twvcHBLyAXTvwtkyGSpLufj1WiFdTdkeHDwrYC8FC67LhHwqAZqfmt8HAMDDw/f_iPE2_x7QTSFvuHnUog_xDVq3cGmbHiEpjEHLJ7Xc8","filename":"223380.jpg","size":22485,"type":"image/jpeg","thumbnails":{"small":{"url":"https://v5.airtableusercontent.com/v3/u/49/49/1768197600000/BDFWgTQLtSt6hQUIPIhpuA/7fr5xnxw8o62TJ2pG6i9FY0c-ynDNkDWArTD2e9IjkF5UsHmOpucsBl7f7jK_1rI-he_a_tEZzS4yEaDz81mV3e2WPnwSqX20J8J3VSxpcRcWh1WoqrWHEjmBWP8bCWvIpHqpZlaYI7oVUDjPcjtzg/4K93snLHpoN5mopITIr8eSC3EmXjGbLfGKRHOjluNTA","width":24,"height":36},"large":{"url":"https://v5.airtableusercontent.com/v3/u/49/49/1768197600000/jNap13kwutESFUAaaEe-tQ/VccuEargx8mlLi8J5zgUP2YKStCa9oq1LoXgQK3DJ_qxIBPTcBPDlXRgNLlDpkUXEqyBFSd0L32C-EHWtnYu0pz5eJfqfuAVw3NKTyRP_FcsCHKQMD365Hc4HkfTtMp1rn756lNkzMV2dz5k1yOyMQ/-CcK1---8UIiRrQAfMK3xca-Ebbjc1XF-XKHyvQ5z2s","width":262,"height":400},"full":{"url":"https://v5.airtableusercontent.com/v3/u/49/49/1768197600000/sEmLOP3GWCpEBf7Z2wuoFw/yvTNn7SGZV3usM_758EjsSrD7fnCvpqVsc24_xw4oFl7Q3X4NUmP6mT-tsnezLpNGB0ftZSML8VODW2cUFxtnr9M2-rnTEkg5xd5ixvg9yARFUMf667cogh-jhS1lGXQzUVJqdEdhvWBSWrQSOL5lA/-cgz_dhfbwRhxC7CNrz64-1HiCRf-86nUBdK3Gs7gBM","width":3000,"height":3000}}}],"Authors":"Ted Chiang","Readings":["recfkdk8y6iHWrmdU"],"Date Added":"2020-04-26","Genres":["sci-fi"],"Author Background":["by-people-of-color","by-men"]},"Rating":4,"Read In Year":"2020"},{"Id":"Fri 11-27-2020 to Fri 12-18-2020","Started On":"2020-11-27","Finished On":"2020-12-18","Book":{"Title":"Rhythm of War","Cover":[{"id":"attEUvnZ52dpf4186","width":1682,"height":2560,"url":"https://v5.airtableusercontent.com/v3/u/49/49/1768197600000/26qjl_6p23iECjRR1Oh_8Q/FvT9sqzqHPIBOwblNqRcuuw7GA2l3skoPLgnltcj-dJ1QRnsFduH7cPQ5afvUpb9cmewcHQt-HBpxdzAu8S8hwPLv6_GhhfyYXoQ1L_lmYqxNNPfPUmpv-zHmDPOZhN5JmWU-XkOCZ3hlii-umhzPA/OLFWX2QZaU88IaKUDNgbAZelks-R51ccKhSAKOo-9Fg","filename":"49021976.jpg","size":767006,"type":"image/jpeg","thumbnails":{"small":{"url":"https://v5.airtableusercontent.com/v3/u/49/49/1768197600000/-ugSO0tes30yU2d1Y_hWkA/pNdn77cVfmXNeUivSgHf_aP0mzfL_T7Rrhtmy2O7qfFDh4HbxsXq6Aturl6L2NHglGKRIGY7tIIFKLZKH42F0gLSXh7qckKFVikxh0DHzCIPWHjVOUjMtbx8H4-Lvxf3PTIfOVoOV9Rn19nMC_xGjg/m3RKnbC5s5X8RfLKw0sEUBJrkhHTq_hAyE1cC-1PAqw","width":24,"height":36},"large":{"url":"https://v5.airtableusercontent.com/v3/u/49/49/1768197600000/MV9mjgtKhB95qS5RKTl8nQ/w4Kpz3h6dgDTxPLAE3nsw74GynJa9ilToKALnQLJByC8R2TDs_yuyxgwl7uIFOUobszxy_I3p8FuhbY7H_qbN4ZIfP04m9wOZecfvii0tpIg97tBZ9GB5BRdmro783MzPl_i1AWn_GoqWuzLojCwig/wN35sGYhIHvCwyzWG4dPW2ALbhZukhUDFptDCEIFfgc","width":512,"height":779},"full":{"url":"https://v5.airtableusercontent.com/v3/u/49/49/1768197600000/GoX-Ipj9YLZZUkoey5iciQ/lTQT_Plm4nbIpp3ggusTx-C7J9X-XWhI09nAXuPRNiDpGb0uRO-jY3H5eD77nRINf44KjuaO6YwTAIRUO2V9uA3C59dpCn8UcxHLmLuEeD7Jr8NPpe_qF7GOCsPg8lY7yJdIUNL1dZiXEP9BobKVSA/_eFsFStYKiP_f9nDPTo3D3nq0h_jxOsAfhoGM-fZibE","width":3000,"height":3000}}}],"Authors":"Brandon Sanderson","Series":"The Stormlight Archive","Series Number":4,"Readings":["reciRyaEuUVCPQRdc"],"Date Added":"2020-11-21","ISBN13":"9780765326386","Genres":["fantasy"],"Author Background":["by-men"],"Number of Pages":1232},"Rating":4,"Read In Year":"2020","Page Count":[1232]},{"Id":"Wed 02-12-2020 to Mon 02-17-2020","Started On":"2020-02-12","Finished On":"2020-02-17","Book":{"Title":"The Crimson Campaign","Cover":[{"id":"attMu6uMaJLM0qJPB","width":195,"height":300,"url":"https://v5.airtableusercontent.com/v3/u/49/49/1768197600000/zsVOXlDbHg_HBZMpLET_1A/XcTr-9il9wTkHBK6jVtlVpKYsJLdvlRMTKoBLvSQnndsCYP85bw2t2ghwxk25MG1YC2cwEDIp3CoRBafDGdNIXr6WxxgZ7xS1qr0d479sXTe0uEk154YHFh5YYWRudT9sHahdGc8LSqBprbGRaeBHw/bE0JTZxeqvkNF43_lTSIN-oksKg5T54tg3_XZtTe-ow","filename":"17608111._SY300_.jpg","size":19664,"type":"image/jpeg","thumbnails":{"small":{"url":"https://v5.airtableusercontent.com/v3/u/49/49/1768197600000/Y3-ihmWeaVzBiCcopapOgA/9N7NSsmfFai5Wgk2tS7UzX9oktKNUIojJ4qvzG-sfbgWd7WBhfwchBCKk2APlZ3LbRzKkoBDJFTuAobvPHNdKcbshbU8FBxcTYfGr-90GB6jHaN2-Zd1622ATPHKIumAMeE5F0mMIbXAWyaeYnVkJg/Jh_XV9qgKfzbS1nZKl5rr2_GzFgL9mCGAlIZq5SgHQw","width":23,"height":36},"large":{"url":"https://v5.airtableusercontent.com/v3/u/49/49/1768197600000/qeuVmIOObynth2T9a-fKYw/z4J80zM460M1csSFf8OFYJLfP3lc_Ndjv_iZxMmnzv9s2YFUFi1tZtCEnp6HZucJDTKsvFTAUpO8GXINlM1feDIvlaVb7jCsBKh8HImwhbtqhTr1p5nAGfklIpC2Mm93sucts4iegfgBi8FkDWhIuA/aWI65WixtjuekYYvRhoHxqVxL151cTWfKqTNZXJRLBk","width":195,"height":300},"full":{"url":"https://v5.airtableusercontent.com/v3/u/49/49/1768197600000/IcOZ8va3_fn6v_d2d7nZxA/i1cOQpBCeJJQWWbwmk6wpClIWbhkRudmuiFNFa144NMZ1NIPoehPsYfaICyTSTzDJ_WFDStnkKmIcpF7TxBCgKs0-59Dw7waTb01flwHsgS9m5jcS3p_WYJzPq2Z93Al-pgSkxPvFtNz6OgO1slq6g/OnId8JeCmmGWn9Eaomzzyx0cDTWKXJ8NGRMh1bUR23o","width":3000,"height":3000}}}],"Authors":"Brian  McClellan","Series":"Powder Mage","Series Number":2,"Readings":["recmgLk2urImdYtZ1","recjUtglXaLEQodQu"],"Date Added":"2020-01-19","ISBN":"0356502023","ISBN13":"9780356502021","Genres":["fantasy"],"Author Background":["by-men"],"Number of Pages":596},"Rating":4,"Read In Year":"2020","Page Count":[596]},{"Id":"Tue 02-18-2020 to Wed 03-04-2020","Started On":"2020-02-18","Finished On":"2020-03-04","Book":{"Title":"The Unspoken Name","Cover":[{"id":"attWQNQEe4qYeSI9t","width":197,"height":300,"url":"https://v5.airtableusercontent.com/v3/u/49/49/1768197600000/j_f0rVx4-AJkKfvdSNMwBA/_Yi140d0J3WqLNnuYHj_wFm6Iu-wzQAqLB6CGEsqzM31ZuLT3sPBAVz-dT6y-C50RfhO2Oyv4GC1THzREP4ZLtD6xiFu14EA-ZIn-yQ1zpjkuvJpDfTpQF2B9nsep90f3RcnodCxoGFajtuSQao-Gw/lud4OIt_mlsewD17OLxfmhds9aYtL_IBUOrofDsRV_A","filename":"45046552._SY300_.jpg","size":19923,"type":"image/jpeg","thumbnails":{"small":{"url":"https://v5.airtableusercontent.com/v3/u/49/49/1768197600000/pRxB0RCabanidp8JL5mFCQ/7UsVg63EMp-gemBuGefr4N6vazkYpd3tme85pBvFRyemISNBvxdmYaJGAvIN257xeo_HxYDYkTRmixqqS2imkSKs357W4Jx5GF534FTLcBMKLN2-Vqu33ouCeiV3wBo5Si4aTVWIAjcp1jKpvMGajw/-RnHMHKedyBE-ShWAZe3qutzMfLPv2TibVITq3lJVTM","width":24,"height":36},"large":{"url":"https://v5.airtableusercontent.com/v3/u/49/49/1768197600000/ZrVBkNHwTBo8GWN6sxgHhQ/17c3Hvc1VMs5XEJNk6vcBnyqPfjl24f0J8izIpQxAyzh8J025J-oX71UTZNgpnEjhOPAeIWgjmXCuGcp4vH9ixQ72eylRrHPdIKzT6uGTSc9v4irGltesl1cSC6yGpXeIiAKaVvAGYvUfvLMCU6VFg/hgul-d1brB-ryxOgfk65cLjO9bMIAOqR2KZ6i5LwtqY","width":197,"height":300},"full":{"url":"https://v5.airtableusercontent.com/v3/u/49/49/1768197600000/j6yeJStJJ56WF_crvUbUDw/eVIcSfLCbVqNPbilUQrd48C0AZyHqt9IqCbMIBc7dIsSwmvCB9cDzbPqH2np9ERcinvJ1JzNx2YDwcxQAidkgi31VFjaLKhrhZ4tMVu8h1klE2Ds8FE6rjpM8nG2IE0FCfADC2KyyHG4Uk23SEMqtg/7EcFsd63-J-wuFKHmhtGVEa4u9WkSvfT4V4iNcgvBy0","width":3000,"height":3000}}}],"Authors":"A.K. Larkwood","Series":"The Serpent Gates","Series Number":1,"Readings":["reclQPULsC6cOpU2F"],"Date Added":"2020-01-19","ISBN":"1250238900","ISBN13":"9781250238900","Genres":["fantasy"],"Author Background":["by-lgbtq-author","by-women"],"Number of Pages":464},"Rating":4,"Read In Year":"2020","Page Count":[464]},{"Id":"Mon 03-30-2020 to Mon 04-06-2020","Started On":"2020-03-30","Finished On":"2020-04-06","Book":{"Title":"Range: Why Generalists Triumph in a Specialized World","Cover":[{"id":"attMcJhmIenHpDC7n","width":200,"height":300,"url":"https://v5.airtableusercontent.com/v3/u/49/49/1768197600000/h-MA7NHk_ccjlbal6qhFjg/n2_sqo4xv8SgCi8oHZ3YYE6RK2_3VpsM91BPRrDDagL7lRC8jyZjXZ6tyccs0KxG72B2GXeJQg_dt-NXjm4xexQ6Okb8vxjNg7Sd-h3uS3V7VM2-aKLLUNDGMyo0Kdc8DGN_3bPlkRi27zBSYWFp5g/v0z_swzA6EoIDHeSROnRz1UVR6AS_O-eRIoceEC61LY","filename":"41795733._SY300_.jpg","size":12185,"type":"image/jpeg","thumbnails":{"small":{"url":"https://v5.airtableusercontent.com/v3/u/49/49/1768197600000/ZB6qI6YlRUqaQd1kjluqKA/lDIehmmv1vEA4W1pVj5inKysqmzaNZnHtA-47RVdkjahJNEIRZmGHH9axEI4TpkMilk7_qbEskd91UQjlBaPfoZ3xHpGSSR2Hw928dm6TMJwAqOO3G9vGLeqnuEv357F4IAk4PNTWSqtqZ6IReWffw/ZrTsH3nud-_HaeXFfV1SHkZkfvJtRWucPbkUe7t-b0M","width":24,"height":36},"large":{"url":"https://v5.airtableusercontent.com/v3/u/49/49/1768197600000/lKVHCp37OCNjjZ1XB1ZCIQ/Yw6JvxPNa6TBAFH6uWT0EWTpyz0-qXfh8HtD1YmHXLFLHxtdce772DrcItzroeTjA-mhBua7YQR4N8ltoM8otNwPKP0OATLNNA94PrMVw3nmr28XJQVmE-MX-qvNmD9qTXn_mTDzT8Upfrhb-r8lNw/PaNTSJuvPkdp2oC_zOeGZrNAepALhndWZfGDD99zyO8","width":200,"height":300},"full":{"url":"https://v5.airtableusercontent.com/v3/u/49/49/1768197600000/dj2ur06Oa6DXlFe-R4PPIQ/f8FBIE3uWYyP8GTEBhsScOAHU2KvmE_fNP_5yzFFej2erULpPylDbUrj3Hx_ayTYKJvfu12EI8dBcjiMjaQrAbDxZnRNI3E5yrmhDGkNnEaQr8QvNqczZDNswSJilmEeUmDMh21grzrCZATeB7L1Qg/hSzrV7rbogM4nPyREoTmMNOZnT9kAnIB9THvywYeOxU","width":3000,"height":3000}}}],"Authors":"David   Epstein","Readings":["recni8xKPyRZPGgLM"],"Date Added":"2020-01-19","ISBN":"0735214484","ISBN13":"9780735214484","Genres":["nonfiction"],"Author Background":["by-men"],"Number of Pages":352},"Rating":3,"Read In Year":"2020","Page Count":[352]},{"Id":"Mon 03-16-2020 to Sun 03-29-2020","Started On":"2020-03-16","Finished On":"2020-03-29","Book":{"Title":"The Outside","Cover":[{"id":"attjwAjFCcJ3ouIgG","width":198,"height":300,"url":"https://v5.airtableusercontent.com/v3/u/49/49/1768197600000/HUNUnsUjfLbhJmKJ--2V7Q/cIGHyDKP4X9y6Qdp6hELofTS2IyxldIaUjpQDi8e0ZdiGRUOA1z8b2T6QLP068-OEYczwRoZMDKKOuHLydBjUbDzMrjyT8FZeTgBrn8Lyr-jJo-Hr1nsoGgiQ5-0owqWI0ffY_AnN3HXiWht4jM9Og/2hxKqBZKI9dKsVD9Pq2mC0bmPE1Sn68Gh8yA9Th_gvg","filename":"40947778._SY300_.jpg","size":21063,"type":"image/jpeg","thumbnails":{"small":{"url":"https://v5.airtableusercontent.com/v3/u/49/49/1768197600000/FNlUsjs9X1LZaO5bACEN7Q/-2n0HIp2rNxnDN3z58PQX8eAPx087FFOEOTwSQIGMGqP3ggfXwY4KnE9tO4h_stv8xzxMvqeEKKhmRCKo9In8Guoy6CmP18FA6xhrHbgodaLz2T9hZmuRiuI1h-a7RG_eUTltSqwZNVOBiXlNdJ8nQ/jLx6V5qED-cblUdPk9pjlVfllT8Aqg_07Kl6bs54l3I","width":24,"height":36},"large":{"url":"https://v5.airtableusercontent.com/v3/u/49/49/1768197600000/Bvk7Ke8wxCTc4-OT9K08cg/cOIEMwSY1FS2kdl1RpUdkxZ_Mp3hOPoSijBCZj6VNf1_7fypMl8rCGMwjZSGWRQJUSeyJrMInMGP82GLQeIdZbiBUdwSudu5Jr6QDO-asXIiI8jaT3Kp4mqK7uoMuIHZ0BKJ7jHkGSxS0EuhPir7Xw/Pj5qxYXzlhkhbKa_GMEGbJt77aBHXle20HVFkTjvegg","width":198,"height":300},"full":{"url":"https://v5.airtableusercontent.com/v3/u/49/49/1768197600000/3FR-mKEfpRVeWy1ZTJ514A/fqfea6gCT-wX5ZBm62-TyqcQWEitNAL-xgYjWZ3Aaxpj5bH0S4lAFl6JDqfEfxftc9XBeHTGFsjunqJHTWmzMQopcAnnWKP-3gqvTu5TeZlMqW8EUNchuSVptzWJj9bDj5Vld0Vuou16mwgcy4ESEw/lrKZwBSqY4fzRDP67ereGoQj6c4mWUhse-jlkG93seg","width":3000,"height":3000}}}],"Authors":"Ada Hoffmann","Readings":["recor6qdYZoQ6bEdg"],"Date Added":"2020-01-19","ISBN":"0857668145","ISBN13":"9780857668141","Genres":["sci-fi"],"Author Background":["by-women","by-lgbtq-author"],"Number of Pages":401},"Rating":3,"Read In Year":"2020","Page Count":[401]},{"Id":"Sun 08-23-2020 to Mon 09-07-2020","Started On":"2020-08-23","Finished On":"2020-09-07","Book":{"Title":"The Price of Valor","Cover":[{"id":"attugoazLso9mML10","width":315,"height":475,"url":"https://v5.airtableusercontent.com/v3/u/49/49/1768197600000/wEFHXpu8o-MDbRoeoi4d7g/pbDmA1Juac5YoJtSqWm5-sICTmWZuPU-dw2qMMWiNy0Pc7lQ29zEAqQzeURh_JyWSSKFbSRUNN-2LVm6nKpFAvcZEAxiuKKrSlEwTD2XeCIkMjMrcsw7q0udSLRRFZ5LpxY_C_Q00CxZ_JoejZrlKQ/mb-2YzdBJptPViwZT52TqXlsP7aznpsy2ykv_u6mFRQ","filename":"28110103._X0_.jpg","size":44559,"type":"image/jpeg","thumbnails":{"small":{"url":"https://v5.airtableusercontent.com/v3/u/49/49/1768197600000/UFzRj5a98iPt2jUN04XTIA/xKeOQxRyIl5DDnfHLVkYWmyGLDXZKsyjBLTKl3RLRMRwQUHzOsBzLB0GZkPPFi1esn4bJLOrJo2HvL-N_baXMCF10tqllwVCMPzEg-MVgeARhx9CruC6ZA-j8Rmv6B8UcWGCnhRbCDRg9QupjM6vvw/vPma2Hq-G1DZ0NinPwK6wlFcSWnjBIeARY_Cv_-RmyU","width":24,"height":36},"large":{"url":"https://v5.airtableusercontent.com/v3/u/49/49/1768197600000/4sAOYRWWu9jHZa3W5837Og/tG-6q_RD3uSucq9rDID8SHaFQ8qMA_8pdar66ZrO0Ih8KhSKTpbsLDw7LOwPwm6HC8xOZxfuG1H-XD7e0u20jXIOPxljxyPJXL8GwlgSbOPNeGwSd77INIRQHY3U1bpZe4nTFpTvXad3seDMLAo7NA/kp8BUvIz1qeew-npb8k8Npxdx6PgyfTSkpzsPYxGcS8","width":315,"height":475},"full":{"url":"https://v5.airtableusercontent.com/v3/u/49/49/1768197600000/l9VsdjriPgwWtzvOp0tGHg/EXHMYoVLHk6qDo5cR2FnHJHYcGeYkdY81-TuXgE_64GiAqUur6Sb_9O6HlegpbN980uNWg6fUhrD7RA_iH83h3rbJ4Gl2v7iW5CsEUorA0qN1hfcO9-eofwSYomtF-bc1GLVK30Wo3KKBOjJ_lionQ/Ax0vD-oZVmlvqqrgZXtVmO1fTwHhaqJiCAx9Hmc_Ncc","width":3000,"height":3000}}}],"Authors":"Django Wexler","Series":"The Shadow Campaigns","Series Number":3,"Readings":["recrLnb8pWFS9lLDs"],"Date Added":"2020-08-20","ISBN13":"9780451418098","Genres":["fantasy"],"Author Background":["by-men"],"Number of Pages":638},"Rating":4,"Read In Year":"2020","Page Count":[638]},{"Id":"Fri 01-24-2020 to Mon 02-03-2020","Review":"Always delightful to find a book that's better on the re-read. ","Started On":"2020-01-24","Finished On":"2020-02-03","Book":{"Title":"Promise of Blood","Cover":[{"id":"attHSkwXU8T5wtMou","width":195,"height":300,"url":"https://v5.airtableusercontent.com/v3/u/49/49/1768197600000/-cZ9f8GtBZMmqTeTkeh2SQ/KJQL6vfWTO5MmzFN_E5xce4liGf3_40UfuUa35zxjBZpa1Y6AdNlTUcTwT6KTR8x8W1G_BFaE5fqf3KF2RYri3c9Mw8qmRmG2_nro7rSVQV6qDVw6c6dnEgsI5fu9wuQwrWIZJ5EEzVPtYQojJhdkA/sljYkxDXOzgY2I_FOLxEZcVfcnojX5EMEnqf-dA7GKY","filename":"15790883._SY300_.jpg","size":18068,"type":"image/jpeg","thumbnails":{"small":{"url":"https://v5.airtableusercontent.com/v3/u/49/49/1768197600000/9LGtbYEurEb_gMh2kcY8Zw/UGYpdp-HK8RLQJY5BU6zVEFhKDSVwN5D86UzB6u8wZbBlCnz2Y4K9M87a0KfIpTOc3Lui7UF3NtbsaWEWKoSXxrM_2p_YVWrIzI-6aA_z8Hb8gW_uGlrmqcR6Vn60kyqptasXwNcDq_r2UyG7dw-wQ/TJlFWHdrUeq94EK2BFDjoyBBCycqukZVjGjdbHAkDWI","width":23,"height":36},"large":{"url":"https://v5.airtableusercontent.com/v3/u/49/49/1768197600000/wJ-XC-O4Bnt32_kw9DceNQ/Q2ADkMnPb8tJQK708se34H8m4BVRNxsoEVRXT0Eoz0hLQanW5FptulfzRCCI4KX4SXl4vx3VfVqE42NqBMCmKfbCRYGcpauJzY5ENu5Kn8YVqhisG0D_2YLAPwcit_masEx2kJ4StZy0mONtyZrtnQ/OPz_aTheb3VVD_CnOCHPuD7zFq0mo9VCcCUbRUwStuA","width":195,"height":300},"full":{"url":"https://v5.airtableusercontent.com/v3/u/49/49/1768197600000/hNGhAmZngOj34Ja8TWXGUw/y1j82TYT6WiGYjZ4mjtbawZ9mP3z66GNWDTIP4yr1gjoSU9rLKgI-ZJFuYKk1FyDvWiUj6XU0WlD-enrYXSKnAs3B3TNjmX-faj9jHiMhWwdTTKDml23MFU6JECYK5yg-5arQHyoAEsPMAewY6M5Vg/bGifrQ99EBJwYSx7pQ67SI46XwDWmdkCtHGlxUxzZPo","width":3000,"height":3000}}}],"Authors":"Brian  McClellan","Series":"Powder Mage","Series Number":1,"Readings":["rec18jDLRTMP1d4Dx","recrSCzxoMH2H4EeA"],"Date Added":"2020-01-19","ISBN":"0316219037","ISBN13":"9780316219037","Genres":["fantasy"],"Author Background":["by-men"],"Number of Pages":545},"Rating":4,"Read In Year":"2020","Page Count":[545]},{"Id":"Sat 12-19-2020 to Sat 12-26-2020","Started On":"2020-12-19","Finished On":"2020-12-26","Book":{"Title":"The Guns of Empire","Cover":[{"id":"attFKx8Xkh7Hrb64G","width":315,"height":475,"url":"https://v5.airtableusercontent.com/v3/u/49/49/1768197600000/qMAQO5ka9db-p3hDqrdbiw/bjj-bwtGqZZepdIWXgKY5fXQY5MFKa0jfh3DXBxCl15qazjDQa4FxcIFqpblSrk16bEuLVsMFLK_GDWL8YzHJ4hNUI3uPIIjmE-rr8gk9GHXXEIB2wXgyFzVVwI8G_O96c5J4W_xIsB_VYayHjLEcQ/q4EQ2RFxUAvM9A6DWP31OuThNSMpcOAC3nkdVjDW8oc","filename":"27833819._X0_.jpg","size":44158,"type":"image/jpeg","thumbnails":{"small":{"url":"https://v5.airtableusercontent.com/v3/u/49/49/1768197600000/4BYbSIuENZ_QIkKyfajucA/juadUPo87QdyQjbf_DNpp-mUVpsgQQNxn6Wbv1LpjP1O-fiRj4tcYpwgTM1wuVj_q14zi_gWn6ZN_aF1QwcXBeITZD5YsvyCow9Hco_G3vWtTU3kZYh1JlPNdNKHX-N8qmGQslw4xKTD23WAS_g0Yw/5Va2Tu17l7hteFM7hGlyMmxgFFqtlPXGgEy83sfHGAs","width":24,"height":36},"large":{"url":"https://v5.airtableusercontent.com/v3/u/49/49/1768197600000/JWaqkekzVrxz1BkY4cHUdQ/8lp2OfHUp9Q2QvthQw30P9tm5vxdweYbDQeU5ivelQbdiY6bkg8e1Z3RX5z7s3oIHu_8u6Z5xzul7N8ls7MCnd76HGbhzYzC9vFrM1FnlAMb1CMDzbPTphBO5pzNoY9zihwtcsjlRleYrFvhn98G5w/tFYHrgnbLIXIRVfLQDPdAjsQJU3e8ZpPrObuyGjEN9w","width":315,"height":475},"full":{"url":"https://v5.airtableusercontent.com/v3/u/49/49/1768197600000/FWg-OWhmOf_4JhodCZWiIA/UmNeHLO9KyR3NWuhfRAexzmmSNkUFIF3isUTz4-NAf7upKG26LzHpYJOjqAKvJ8nIiVpSmSLfE--__aQVl0Vl0HFDbuTvnloruYOEZDLXsjfVehkoaP7nGwRwAGSZI2dyJMauc7kMLYDoLf5GH1eeg/JCo7-01I0-z3F7ARSzY39no0AzsvYvPhUpu7CxeZeIY","width":3000,"height":3000}}}],"Authors":"Django Wexler","Series":"The Shadow Campaigns","Series Number":4,"Readings":["recrWDkvDcqdxz62a"],"Date Added":"2020-09-07","ISBN13":"9780451477323","Genres":["fantasy"],"Author Background":["by-men"],"Number of Pages":464},"Rating":4,"Read In Year":"2020","Page Count":[464]},{"Id":"Tue 05-12-2020 to Fri 05-22-2020","Started On":"2020-05-12","Finished On":"2020-05-22","Book":{"Title":"Scardown","Cover":[{"id":"att2N4W0jwbpMzjjS","width":274,"height":450,"url":"https://v5.airtableusercontent.com/v3/u/49/49/1768197600000/GWbJpDkWxJxAtJ2Ez3r4DA/MDinMEqW41h-8FZTEmi_7HphlWhZ2_SkLfXcT7AVZCobHG3zVFusblZFbqPBa3rqSQR4IDYASkrc-dhmN4z-OcyVLORpxXXCO97Yed6jsektTz0VIcKRLBIwGUY66AhpqazRI-TmPcd59f7Vp5hO5w/6UZBqXNkqearWhfxydk86ni3vBV1G0MmiysTJY0Tn70","filename":"185634.jpg","size":38446,"type":"image/jpeg","thumbnails":{"small":{"url":"https://v5.airtableusercontent.com/v3/u/49/49/1768197600000/at99WAKC6UTXwB0pBaO2ZQ/wkseFHBqeyWOkEyMSaqsU_KwqHeKD2jKEDeJw2mLDDsB9DZs4kEhzbLBJdSA-7jeS8pBH5Q8d8j2vHvf4hopNpwSdr6uKaSZlJYWrkfY5QT6w1A8s-eYkkR45x0u1zMua6ONqGDjau_Rh93QjV9Y7w/5WPJIStgIGV3GeNhnnExTn4wTVNrEH1rX4KUFNGhSGg","width":22,"height":36},"large":{"url":"https://v5.airtableusercontent.com/v3/u/49/49/1768197600000/bD0FnePv8nGHbJy4GEK-0Q/7BwdYpxRqn1cATif_60PMQzKKPY1d5mSuHa5nZbSA-CAp80d04DCQMtYeYuwxxts00PK_N0rg1CKc9_X9qzp02PAvozW1FK2V2KQWMmK1OwINb5v5GwIxSPh-ncib5AYSa4VQucc2hdA3npG_I3LmA/tCjRmRMIypaJJLYYvd_OENcZ5MsGgC26vJmmRdiSGgg","width":274,"height":450},"full":{"url":"https://v5.airtableusercontent.com/v3/u/49/49/1768197600000/PVUp2RT-3bv_MbcPd1WcIA/wwgm9c4VCva8L9EJDPmHknRJ17zqW9Hm8N9Inzef02AggN8DVFqYy3ZjuZ7HlnqbVTukTLxHYO9VcjGcLNfjiaJHGZ46bGbSArLjXwk_r0y_pAduwkwY2hG3yL9SUZzBwcx0l0xOMIu28J-HQ9PR6A/jXJN8GYnRQ_QGWerSsVqSqgVrfERlN2SB1JF2JqTcZ4","width":3000,"height":3000}}}],"Authors":"Elizabeth Bear","Series":"Jenny Casey","Series Number":2,"Readings":["recvtFQfzlvppgvco"],"Date Added":"2020-05-13","Genres":["sci-fi"],"Author Background":["by-women","by-lgbtq-author"],"Number of Pages":368},"Rating":3,"Read In Year":"2020","Page Count":[368]},{"Id":"Sat 08-01-2020 to Mon 08-03-2020","Started On":"2020-08-01","Finished On":"2020-08-03","Book":{"Title":"The Ascent to Godhood","Cover":[{"id":"attnqVg976NerPcGE","width":297,"height":475,"url":"https://v5.airtableusercontent.com/v3/u/49/49/1768197600000/Wv6qFmaE8hQBvkYg-c7O_g/J11ymApcviscSGm_lagTP3u9DR0B2rGKXWYiW9iG-_el6kuw3B0hPh236p8HgolNtgD1bGDKBJpj3FZ_dC1ZpvP3OL59O0iKnawQDA53UsPneoTj9lwqUoGCinDuNoZYMpn5LJX6Wxe8CeL764ux9g/wU7RqIdGG-1XCzk41CCl7R2O1k_w5ptCeQptqyxp66A","filename":"36430601.jpg","size":65231,"type":"image/jpeg","thumbnails":{"small":{"url":"https://v5.airtableusercontent.com/v3/u/49/49/1768197600000/CR8W6H8XU8jeGYlaiTYskw/ye4Eh_sal4j2X3LwEYBMjEjghoURre4r2NkcexQSEFvEGlScpkVTovKhvH5dJcECa9891uwqW9soRLRrVg7U4ARNX91noQ1ZC3zV9d7iGyLFfRRF99Gz5yqsWBTTbNlXwRBp4eI0NhLKJ4MkwJB8Lw/d7N0WOuQ7jlQVgyAWOapPIZMhfT6XnDR9GiUNOtisZc","width":23,"height":36},"large":{"url":"https://v5.airtableusercontent.com/v3/u/49/49/1768197600000/2ggE6uwJZavKkFu2AkkfPQ/9n1aiqdSARFPGLzVY7ZJId9V3uhC5uyrm7CQe8Spl5LihAbAy9OYTZB47LbHdV08S3wGxAnAZVtrae0LRPwXv1aMy_6OECdjGt1n1yaWvqVqJoLsRR4LRZa_RqW5-pMbbBz6Nt7mwqNxAJd0WLJIUQ/WIG-GPvUY-zMhzBRl5pO_rcQDciIxXxIEdHXDVaLKVo","width":297,"height":475},"full":{"url":"https://v5.airtableusercontent.com/v3/u/49/49/1768197600000/hJvinspwKvHsSoaSwSm51A/x6WOoDs0eRGkiluTj51cqQiYTH2-dgMxnyqyHFH47jX82vxUU8fVIAh1z9ddDldVu_hLV7CB_27O2kcQdoVEtHBZ8NtFoc1TuqfdZtKA38_3HA-jiV7I3NwOmD2XacgYHnisOj6ddFUCcuVf6i7zWg/rT7C2CB2fokqEPLU8juniJNKWxMPWYGe74l8Gvj5z3g","width":3000,"height":3000}}}],"Authors":"J.Y. Yang","Series":"Tensorate","Series Number":4,"Readings":["recw0aKEhSk3Z0AV9"],"Date Added":"2020-08-02","ISBN13":"9781250165886","Genres":["fantasy"],"Author Background":["by-people-of-color","by-lgbtq-author","by-non-binary-authors"],"Number of Pages":122},"Rating":4,"Read In Year":"2020","Page Count":[122]},{"Id":"Sat 07-04-2020 to Tue 07-07-2020","Started On":"2020-07-04","Finished On":"2020-07-07","Book":{"Title":"Every Tool's a Hammer: Life Is What You Make It","Cover":[{"id":"atte9B9JshpI6itp9","width":199,"height":300,"url":"https://v5.airtableusercontent.com/v3/u/49/49/1768197600000/FbXMcAdap8f7w78eVRS-EQ/vqjpHJyQs245sN66hw1SYFJA7A87t-7U3-7QfWsUS4EhsGWV5IvQpnf8JO1t8jwpmqVHNZJpdlSihnGW8_PQ9EZI0-cal8pzt7cOMYEzdOOLLspdi080AwdUlY8_NpV7fqerEpFXsypJnxQTexbNcw/H0ld990jCS1JTMUFrnI712yFAKZfYfG4oOr7NJ1Y6qc","filename":"43319933._SY300_.jpg","size":18040,"type":"image/jpeg","thumbnails":{"small":{"url":"https://v5.airtableusercontent.com/v3/u/49/49/1768197600000/g1wCb9Z33_FJTMUT-chCcQ/Kn8vP0duJJmS7SfegN_Olc-Uh4ZJS1GcBSTCZ7L5SoOzbrXymOOXNpFKymmHeIzwCAfc4AvnPkVnfBZM2VBBgIIw_gWH-LjEACYDhguRgzG-_dKq2IY_JuP8dho3eaS80jiiRv2nfxLF8Pn6bUvaKg/Uhd6r3Tl8FJBJ_sOzZoZBz8zh9o-6ZDSfudtB-sFVSk","width":24,"height":36},"large":{"url":"https://v5.airtableusercontent.com/v3/u/49/49/1768197600000/bNgPvTapWfSk4pxrt4RWTw/F8fEP121002GZoqFBFWS34vXHSZrBV6-p5sBd9EsM-p-jdFUk5bPY1ZetgoDJjrb8esJWFKycGRl9BTtYI3RH8Om1c3z18FpM-WktjsvKNMfIPmdy2ffaj47VxPrGP7mBJpDJs38YoYMMSOOh9y9NQ/aMLmVD2bTNHtlIZfBYqP0jPN4HLS76dGJ1bdj7pwq6c","width":199,"height":300},"full":{"url":"https://v5.airtableusercontent.com/v3/u/49/49/1768197600000/yS7hB0-NpFPjsahVgNjFLw/qLpCZSV7sfeYLNu6NiOXrY0M1gURlPc-0ejNEn3N0axMFYoON4USaub8vCIndzz3zKXVVdybp9kQTk3GhCsC6pwRVZ9hz9VuKEDjnIPYFACBwYY60Ym_UZS4_ma3L8gT2cGA1zN4klC4Dldwq9ZX_Q/7QEDz4utW8tA9DFVB_86gn7QPrC8HWsW9bckzeaUgWA","width":3000,"height":3000}}}],"Authors":"Adam Savage","Readings":["recyDNjSGrXNEV8rA"],"Date Added":"2020-01-19","ISBN":"1982113499","ISBN13":"9781982113490","Genres":["nonfiction"],"Author Background":["by-men"],"Number of Pages":320},"Rating":5,"Read In Year":"2020","Page Count":[320]},{"Id":"Fri 07-24-2020 to Sat 08-01-2020","Started On":"2020-07-24","Finished On":"2020-08-01","Book":{"Title":"The Thousand Names","Cover":[{"id":"attjAOAYh9nToSlCE","width":198,"height":300,"url":"https://v5.airtableusercontent.com/v3/u/49/49/1768197600000/3vxJr2xCHnRL6LXd3oveyQ/vyRU_AAsgpkSD-m5JLtt0EMKQjztE8T4cMnVZdv91YSy5_CO73PNJhHwqftr87fn1ejyK_oMLVo-t8Jfa4NcYQnyLkFDKnaALyXhX4jzApAfE3VTz6iD6-aEgGxCdh-88zrf2sS4BJj_0GRxj5xcrQ/RFWDoRL5PGMHEnKYGR-bIxJFyaRnUWTshrBC6BCIBFY","filename":"15810910._SY300_.jpg","size":18898,"type":"image/jpeg","thumbnails":{"small":{"url":"https://v5.airtableusercontent.com/v3/u/49/49/1768197600000/b_4ypO_PjaV-TWuh0I-Fag/TmUKt16uf0oVBAg_y5oo9JKhJkG-9uE4Q3mmoPNJYvk8QpS-7qwZTJiBmhEhJx-5Mi0wxs03oOziEI3oeENnyzvyvsgRBrNm3TOahQwlC-i9t8MpF46WBVzJ44viy20SKUGN6Q0VSX3H5E4x5XZfhQ/R2UtQHozUgFent3kr47tdSF8pwSYkrg47K1_w7SN8Fg","width":24,"height":36},"large":{"url":"https://v5.airtableusercontent.com/v3/u/49/49/1768197600000/eCi1ypcsS7PyrV4V6Zk9Iw/eALErJZ0WKk9FPLFbJ4gDQhYhXZN2K83rENIqZUIuFLRgoI9D1a55sNVbUlWTKlS8pL5COsdzY9s7opji-7hDK69qlEySOBS8_KWB_x6w3xzY5hwtzqqa5GznJSc7pjbVUqzk-6ChPTN3v-BHZVF8Q/ipxYsPukUTtf7ePPQ5dH4qPJaKCueVKXCpo5RLULjEI","width":198,"height":300},"full":{"url":"https://v5.airtableusercontent.com/v3/u/49/49/1768197600000/ZopQcH6KqYzuwCGxJlYwhQ/xjG7mIvnRTgs05Ie7hRFEM2rI-Is0Cv9xg-9bBRhcWY-sKTfU6eQl2odksmtfrH62C3asXVDimG50xfPS7Ry-XrST8CXGJk816OlrmvylppZhDdy0AZyeFMnn4duighb9il-pMTGCJPPrTAMyUL2-Q/5kofTlhuGRyXzdsssH5H89EQc9TtnHpk4qOJmEBDJQQ","width":3000,"height":3000}}}],"Authors":"Django Wexler","Series":"The Shadow Campaigns","Series Number":1,"Readings":["rechwsFeVHUdglqbN","reczkZnJOyTZCVNEa"],"Date Added":"2020-01-19","ISBN":"0451465105","ISBN13":"9780451465108","Genres":["fantasy"],"Author Background":["by-men"],"Number of Pages":513},"Rating":3,"Read In Year":"2020","Page Count":[513]},{"Id":"Fri 01-17-2020 to Fri 01-24-2020","Started On":"2020-01-17","Finished On":"2020-01-24","Book":{"Title":"Shrouded Loyalties","Cover":[{"id":"att7cpxh4rejaWLzi","width":198,"height":300,"url":"https://v5.airtableusercontent.com/v3/u/49/49/1768197600000/T83KN3inpbNtNvQrTLYP5A/ixwDF6S2JlPFH_ZZp2lmJl5qIdlgO2YNbOqSg6S34F0AYFfW87Mn9fGR4IyLDTFmzx8DxoiVJUxzj2h2w6Km-lnb6k9nktBXe7ymDzrVXjDlC5IT2EkhLe9i_KqWuetaQpNjRK1nb2LjRGWTazU5Eg/heptlMxIoCN4RH5E6hH1QklfCcfSRmUmhKsTJhtE3bA","filename":"42873308._SY300_.jpg","size":19898,"type":"image/jpeg","thumbnails":{"small":{"url":"https://v5.airtableusercontent.com/v3/u/49/49/1768197600000/RCcitadI1jnfdMryyv4ocw/paoiO9s6T9WVM-WS3IcjlMtR9Mf6daRqq56-t2F1Hw4F8ZHFIz9EIElK6QxMn0j0KxyT5QwI3yZ1es1VpZlT0p_2CxP51YzVhHZWVTZuJ7ZxrzNV_QNwrHQhfPif_zffmoIXmjFyRcjYveZRzusHIw/Mg4yfHlrODz2sb8RmUTr4cEYxullca7Zhs5BikdXagY","width":24,"height":36},"large":{"url":"https://v5.airtableusercontent.com/v3/u/49/49/1768197600000/sMmL8UV4DMt6ITW7gpjn_w/xeQ9xRlFh-wjMJDkaj0hZiAfRks1u-MDEM1hO3nt-6-BxEQ-hmvDidokCjV2SoqTbk2Rtp4MVt5K85g12q8d1oPEweiSIED7BoUmygypuhYXj1YislWBxLa0jcU7hNfUbU0fXumpHoAPVBtxCtbZOg/ooETrrmMSahjXs-8XIp8v22THooXLBank98FkBDIiJU","width":198,"height":300},"full":{"url":"https://v5.airtableusercontent.com/v3/u/49/49/1768197600000/NNeBiQRej09UVDP2NJ5ajQ/KyvZN5RXO2pW6qxi_0W8DgedjghORFFDflOxBI5VE7sLagnRZBKYdYVjk6Gcx6MWHrTZuqDgO9ZRmy-PFXdtoOn8kjcCGWwlF93OvQwugIWCLxqdK4ROixMJagSvpRizxbP1SpYdatdYbtZAhyKa6Q/X39jiXQ8zrURBtgXebdXb6JGR9jFoIbXWujYmNL8hlo","width":3000,"height":3000}}}],"Authors":"Reese Hogan","Readings":["reczsSHCzfRkWEoMB"],"Date Added":"2020-01-19","ISBN":"0857668293","ISBN13":"9780857668295","Genres":["sci-fi"],"Author Background":["by-women"],"Number of Pages":320},"Rating":3,"Read In Year":"2020","Page Count":[320]}],"stats":{"Author Background":{"by-women":16,"by-men":24,"by-non-binary-authors":4,"by-lgbtq-author":9,"by-people-of-color":7},"Genres":{"nonfiction":8,"fitness":2,"sci-fi":8,"fantasy":25,"tech":1}}}],["2019",{"readings":[{"Id":"Fri 03-08-2019 to Tue 03-19-2019","Started On":"2019-03-08","Finished On":"2019-03-19","Book":{"Title":"Ancestral Night","Cover":[{"id":"attNDT415PnvftR0i","width":198,"height":300,"url":"https://v5.airtableusercontent.com/v3/u/49/49/1768197600000/1K0nMPYVw3JT3Smupw35rA/hSIdFSuSYYwzdwjvDD4bm7CqBgIMOOXXma4DC7KGHu3SwkBh1XuN7n9pjIV4aiHC66CK4dh-ACzzAKUb7d9fyRSlqWb9wPD_8x0XV1Tpoi8lBGCRvOmkgfzhnYxZfJN218ZE-0L0Sx0oYxLZrDto1A/ldqskffE2VPpllm98ODTJDW-iSF_VXMLiGPD95wroqY","filename":"26159745._SY300_.jpg","size":11862,"type":"image/jpeg","thumbnails":{"small":{"url":"https://v5.airtableusercontent.com/v3/u/49/49/1768197600000/PQktP6V_kD81GzXOd7dVQg/PrfHSxgFMAZbcE57QI0WbxTOsHtRIdvN8w5ihBA8innGyUCQUsgajp07clubMN5ZD0da37arxV0357Ws3Sg6V4R0UII-P0xHDUCgHXtknVzBCUnTc_cpfYXkAldfFrJmixmPOvrvAG-TuhnrjVOPmQ/nBWP_y79KFDZEnAr4KZo7fX3Y9q3yUdfs9J2ToAe1n8","width":24,"height":36},"large":{"url":"https://v5.airtableusercontent.com/v3/u/49/49/1768197600000/9MgYbqcTMVIZJ4Xk2UzyXA/Wy20nMZUHWx-vV6oi6s-ZCSPVv-PwQ6JO8mrMuiAMLU7uoyFiM6craKefciI2NMzkJk4_-ZFmtlUkn11kiHcQS7pnnd6XJGMkGM8zIxV_R0cTxe-X1kLwo2znO8MExzGsbVffYforTUou-VXpWYSOw/11nPUDY6wZAmDDER1hMG2wn6d5a8W36JMSHoK-mI0gk","width":198,"height":300},"full":{"url":"https://v5.airtableusercontent.com/v3/u/49/49/1768197600000/zrg_tZDuzCtHqarDhFCROQ/uHn_z80F6V7KSTgTRCz42gmoohRnUbzLMM6MJtCu4gazLxuEPMISBlN5Q1P9NNtsQ6NnCM6ClVpN1F0i4M8Cz-mTN586QN7BRD7ZgUQBGNMDatKm7MX_k4BffRkW6QsWaSaR7RjU4J3A2vHGqMq0ig/p_F_ggT3iQGugbsYkH7Qg-5PMebS9vie0CwWtIwTmWs","width":3000,"height":3000}}}],"Authors":"Elizabeth Bear","Series":"White Space","Series Number":1,"Readings":["rec0knx4hFg1z0vIs"],"Date Added":"2020-01-19","ISBN":"1473208742","ISBN13":"9781473208742","Genres":["sci-fi"],"Author Background":["by-women","by-lgbtq-author"],"Number of Pages":502},"Rating":5,"Read In Year":"2019","Page Count":[502]},{"Id":"Sat 02-09-2019 to Wed 02-20-2019","Started On":"2019-02-09","Finished On":"2019-02-20","Book":{"Title":"The Ruin of Kings","Cover":[{"id":"attTC7G4oQsV7nM4p","width":199,"height":300,"url":"https://v5.airtableusercontent.com/v3/u/49/49/1768197600000/Rq2oDZo0TGwOdeFNsv5tPQ/wuVIkloLThl9VZnRVWJ3zkxEDVvyl3JRZbzzGe5tW2wnu-vhuyRECYdcZXP3jlXRne3eGnSUwU-HuOIzuxx9cqeZykyOgL7a3khWrTacXPI8CDHYKC9o4odWk4D8_ean_cgfDRlerhzaFyC4k1IBhQ/-GIHR4kjNnRnXbNLZvtgcDdh0jNKydinqEIgwWWZXIw","filename":"39863237._SY300_.jpg","size":13415,"type":"image/jpeg","thumbnails":{"small":{"url":"https://v5.airtableusercontent.com/v3/u/49/49/1768197600000/pjUWeXllEYjybGowgfXM6g/gjhk20RhwChSKdTuAvbpQ7AhAgKJfsGomOEUwiW0YOjClljYOYiuOAYJkTDgWPCqZue64xNHD1MKZPIbDNSAJEk3LQksuLpizvySifiW3TfmSL-2nZVDF8Ez3Bv_Fz7Py4udOj3uDmi5RCy1lkCH8w/OJbwpEO38QOx5S0iOeyJtguJec-UKJt6v9atB9KeFq4","width":24,"height":36},"large":{"url":"https://v5.airtableusercontent.com/v3/u/49/49/1768197600000/ZGUOonNY5wk_VAiiTXXdag/8e53OiuOVt_QGVdsa_IMtsYlTLvLCZQqffiwbP_SUIDg328W0bQCmocU7YotTPwupKMsjtcr2SprfZ6qY680fgC3YEsWpNY8JN4NbZF1aGtWDLDUOeaTuzKqMkR2kR9lcMp4mWIvWVohx1m1Juy4PQ/dyrVf7ElVT47v47DzdlD_VwE0q0yGBjly9Oo67NJ2yo","width":199,"height":300},"full":{"url":"https://v5.airtableusercontent.com/v3/u/49/49/1768197600000/8LNI8cU6lPsYKgDqC0Msjg/j5kEzeREzhlTNWeqiiPr82X1q587tkKyVQ9ERaUIPYqVqijyWr8fMaPS8nkDWY4reupREuLZxwt4mRqCFBzWnRFmcLv0nzgbA9cDzv-mfavAM6lyKfOfvDQ-KPIxHj87gt-QPJjn1m_Le9RY5owkdA/iAxuT5VeZ5VYBlYHY3YScHbZWmx8WapSR9WG31OqFjE","width":3000,"height":3000}}}],"Authors":"Jenn Lyons","Series":"A Chorus of Dragons","Series Number":1,"Readings":["rec2UDYHJYha7Iw5b","recRMw7aFoCIyTkEN"],"Date Added":"2020-01-19","ISBN":"1250175488","ISBN13":"9781250175489","Genres":["fantasy"],"Author Background":["by-women"],"Number of Pages":560},"Rating":5,"Read In Year":"2019","Page Count":[560]},{"Id":"Thu 09-20-2018 to Fri 12-27-2019","Started On":"2018-09-20","Finished On":"2019-12-27","Book":{"Title":"The Rust Programming Language","Cover":[{"id":"attFm2MmgU0luuErB","width":300,"height":397,"url":"https://v5.airtableusercontent.com/v3/u/49/49/1768197600000/L2cp-i0VzMLUkgcSSck7mg/OWs1l2zXSlKFDC41Tkhz4Usd1YbGgWCINbuEVnEqCjf5Y-RDJg-Rl9dB72gAAU-sDeIcjQ5DP1pjbv3oicNGZj6qrr2wTE22XjrNKboQY4fwHwx1XTYJkCD7ex2QWyOJ5W3jWeUs_G71Te5nZcl99Q/1zxf_4rU_aWjs4UmS7qssMyQ-A29gG1y8rFOFtNX3H8","filename":"35382044._SX300_.jpg","size":34499,"type":"image/jpeg","thumbnails":{"small":{"url":"https://v5.airtableusercontent.com/v3/u/49/49/1768197600000/Ytvx_H_n4bGqILgJhqfAPA/tJgjedu-xcwxHDrO22sZ2LfPkCUusLJ_vqW9ftKHzwXEYkD_vijGf47jPXKB0nAFdwye-8nWlDrJWPga3LOzgfEps8Q_jPQv-2LrjvvZOfBP71ES6EEJiopcA_CvLvttXbF0P2ModugXbHMMI9QnNw/z624mcNcuo6Kw0QfKWgaJX2Me7BUYKvF6Z91SvvsRvw","width":27,"height":36},"large":{"url":"https://v5.airtableusercontent.com/v3/u/49/49/1768197600000/AXHBxM20zBHIoRg1MdOljA/eCOf89UkgGF2uOLCgZkpYaFqPLVghtPPLLdpo4UghrwwlCHU_8cHGrrZyPez-3H_DXBw1CdkR4bYDPinr9jSj1yOceVgGRobJoJxI5ZQMqja2p8c4eQk2Fedee9A-H7RWVHw0s-XWoc1SLBkWJOYXQ/iVIdCrMpvRU0YIYeR-SL-yKsnOGXXTRbhdIX3nKo50k","width":300,"height":397},"full":{"url":"https://v5.airtableusercontent.com/v3/u/49/49/1768197600000/w21sRgskL2DgFDnkJ8dcUg/bkBHJcQKlsCTfwV__axqD7zAszAA7VVOL6f9iz3KLFh9edJI06zhGwHewF83bHN71U7t02NS-lbScCNcnbz_90sfH7380Dp7UfxDjLI3bqxDi0DrPdOvK-BvqxZ8Q0UHQv8HKgbwYwelwKzz0zr-bg/GJ4ZGX2ZV7Uibr0omLiHoaO3s-xp_L2oKCEG-YCFPb8","width":3000,"height":3000}}}],"Authors":"Steve Klabnik, Carol Nichols","Readings":["rec54RGyRGbBTqoMr"],"Date Added":"2020-01-19","Genres":["tech"],"Author Background":["by-men","by-women"],"Number of Pages":552},"Rating":5,"Read In Year":"2019","Page Count":[552]},{"Id":"Wed 08-14-2019 to Sun 09-01-2019","Started On":"2019-08-14","Finished On":"2019-09-01","Book":{"Title":"Empress of Forever","Cover":[{"id":"attKtY9SHXCLRwh1Q","width":199,"height":300,"url":"https://v5.airtableusercontent.com/v3/u/49/49/1768197600000/-N4aTYlGAUOgdJRbOt3l7Q/4eedVuvzLILR14ynCGzMVAdmahuryAnJi_AQBXqt7gs_9gcsuEjMNPOO6yrs6b3h7U0o8azqelK8vxMILfADrCgAHL8EeGY3ZYt09VKUc3GQRqsvfyK6FGBwyPrXmtlhkbzWOg-kmebZfX9xBkZMDw/EFqITCZrdvtK_-mbus5sEwTXzCuVHcMRhjgN-BQt6uE","filename":"40380954._SY300_.jpg","size":19489,"type":"image/jpeg","thumbnails":{"small":{"url":"https://v5.airtableusercontent.com/v3/u/49/49/1768197600000/6wspaDWXsPJbaL6wIx_DdQ/khvCjCd6B5WF5RSUGjAGOj6UbmevxD1c-JHxwZXocegM9c9AH3HSZUHVTgu-DZW6E3LRovaH58HymAHhS-Tkw6IeRCCD2dsf_eKTx6J5zT73xDiOmbc4yIHPr6L3dZcNvsQEunVu_TWxr9UuOlERbQ/t_b1k_9lLJlnzYyTYYUQZHG9NblY4MaRx5rXgBHWErg","width":24,"height":36},"large":{"url":"https://v5.airtableusercontent.com/v3/u/49/49/1768197600000/nysNLjUSnB1tnCbd44J0lQ/8pRavCp7A-FYbR0IWvuX3OnDsxDBu0wkNb5l8FxKyuR72FjHgPpJ406-rhZvcdAOlaJToSO9OlAqbdagq07O9rfBxSiyXNf8CDiTvGKvaJvCHqEIz15-0ez_2bfyJpGvpC_KMqxkzITc69moVAXtyw/ixa7slo1vSXC7wSl3laThdxuzNNIzUheA7CcrkwjemM","width":199,"height":300},"full":{"url":"https://v5.airtableusercontent.com/v3/u/49/49/1768197600000/BWRiLT6M85Z1fT89F5HR8Q/3RwAOWj7k0JhJyQXDGB0Vz047APMlPKi_wSxg8TtL4DEEtBIF3uMzQZaDboXA2H53zz-7KkkWwfxeDUSrAY_ElN8aG45vU2wDBh6ieLuOjC1Pak360rWy1Nt_PCKLpvthwBszhg0S6XH9UN6yp0oiA/6NRDN3GtR3HghUIPdwSylB7Rpx4EbZK0aiW5NoN7wvM","width":3000,"height":3000}}}],"Authors":"Max Gladstone","Readings":["rec6g7JOFUsQzLbCL"],"Date Added":"2020-01-19","ISBN":"0765395819","ISBN13":"9780765395818","Genres":["sci-fi"],"Author Background":["by-men"],"Number of Pages":480},"Rating":5,"Read In Year":"2019","Page Count":[480]},{"Id":"Fri 05-17-2019 to Wed 06-05-2019","Started On":"2019-05-17","Finished On":"2019-06-05","Book":{"Title":"A Memory Called Empire","Cover":[{"id":"att1qgjh9hpL4t7ha","width":194,"height":300,"url":"https://v5.airtableusercontent.com/v3/u/49/49/1768197600000/_-1X35pT7U3v471YuuPwXw/3fXQQPQjpzhxa4Ufm6EZ-EJExrCYJeU7xC9-jPzG6RikUCSX36gZmbwUPG5vcgnlAbD4v3LYewUDYUru-fsN0vonVmcvhI5UKlVz2rMVAOQZzdsyu3eIPQl0GTNy7FLJvL1V2GoDVtyWbYszJKpjcw/JC4CAx2bSgpcFf0zAEXD9gRtjmO4P9AQD8pZmUOPQd4","filename":"37794149._SY300_.jpg","size":17939,"type":"image/jpeg","thumbnails":{"small":{"url":"https://v5.airtableusercontent.com/v3/u/49/49/1768197600000/LMYplKXOxdpR0zZOTVatWQ/JoxnGgq-_o5Ae6RXPD8WIUGj7feEA0cvSnicfiGADXNTaDTRaqbG1X2cQDoeUEc_LxJCi2fPVUu_6xZftGOx95uaDoZOQoIUmZEVULvPzPUkZsOIk1qWIMiHbgfzffmvlW7CDBOOUigoyi4EaMb4DA/HyMxbwfPENpbWl-MEA_eFVUrv2KApISDawhz_v5eQa4","width":23,"height":36},"large":{"url":"https://v5.airtableusercontent.com/v3/u/49/49/1768197600000/JfPEupdx_n-saI_kHBi2HA/aDMvjh1dRmX2HkNeYEXJKs-ozqt6P3TjND8KChP2ccW_5RM8MVvWG75y1bSi4m_d4eoqtOmZIC749Z8n7uBRBf479pcvyQjQhzCdzlk9-IFQk8PxphhjQnY_sE28kIVvoigvlCuPFC5sFcV5x4gq3w/i0XamAWk3LhE0shvEe9-eEmga2sisJpTwc1bvvFrQyY","width":194,"height":300},"full":{"url":"https://v5.airtableusercontent.com/v3/u/49/49/1768197600000/4HqInLR3dAGWe8Oln1De6A/UrLWL54zI6ciFMMs81G9owX-IyQkRP-SwuUqp4I0T4O1z5epEAQgnwAEJo8gsABdZiWxzCQwiZu5SA4OOxy-Iz_t6mnJQ0Y8Emm950DtsrPzt-sGJ-4Sb5PA0kGGe8IQVn2YRIoIyc3OouwzPACHag/nQC1W2IvS5y0b1MyNXpZfnlBI1CcWbp8Oc78vcU54Mg","width":3000,"height":3000}}}],"Authors":"Arkady Martine","Series":"Teixcalaan","Series Number":1,"Readings":["rec6uVD1UDUJVclWR"],"Date Added":"2020-01-19","ISBN13":"9781529001587","Genres":["sci-fi"],"Author Background":["by-women","by-lgbtq-author"],"Number of Pages":462},"Rating":5,"Read In Year":"2019","Page Count":[462]},{"Id":"Tue 08-06-2019 to Tue 08-13-2019","Started On":"2019-08-06","Finished On":"2019-08-13","Book":{"Title":"A Big Ship at the Edge of the Universe","Cover":[{"id":"att2BoWxGN13NyGhP","width":188,"height":300,"url":"https://v5.airtableusercontent.com/v3/u/49/49/1768197600000/ZvKiAhdWdTaXaj7v_q0Xaw/Z3YLhPt9JDgFdDIZGIoQ3WE3SVlZNoFjAmDEnWFsFHMay-cf_-xkTryMZF3KpG6gNEDKOYPyz2X-BlxbCmRg_78F0dW6yn0yEjRyT6LnFhTZKvWdDap_lYohrHDUc0tnHIICHQa_XLmYfmqrN1jlhQ/-8o25LzjT1-gX1P0RhXcPFndwtU4snFElNps-YQIdH4","filename":"35520564._SY300_.jpg","size":14792,"type":"image/jpeg","thumbnails":{"small":{"url":"https://v5.airtableusercontent.com/v3/u/49/49/1768197600000/39xibts2vDBbQKIcU0wdgQ/3kkAdR-q72NXDuw_Ya3pm7pQCblikEr-JlsmL-z3xSTZPaMzSciDsZsMaVGpc_1zzI8up7IhpFA-TJDegLdYWwrKk5f_buTFtO46kOWoaNG3YgAUJ993nEqrVLkD2nGs2uS2FD-6jBdq3Wpu7d0tNA/xQYI9HmWLMuhiMxVhphwDHucqgJVCakTzUMDpDUGiAo","width":23,"height":36},"large":{"url":"https://v5.airtableusercontent.com/v3/u/49/49/1768197600000/4a3EGt8XMRxnfEL7vcziQQ/haajyvIUng2oNAgKKXEol1JSeTd8KOdpOrTjE1WzBclfMC6Lv3XR-dU6PYEKfTeQ2WWbI2JP62givJU4366V9mAUJ4gGtNvAAAXlUO6jcisKAbsWFAKVyhatoI986VsJRRKG5unbZUtgvayZEtk9xA/fg7P6sF8DjiJrFCwgW-AyawETbKpk9cscbARw-7TiXs","width":188,"height":300},"full":{"url":"https://v5.airtableusercontent.com/v3/u/49/49/1768197600000/r0-_2xsqUHWRsEx0MrAECQ/mmrLCbEUQSpFVpMCdjGRcnZrnxRD5XRrkBC1Fa8QBtrBtIordFutWZOOpMmaqdi0yDzCkkseUSJg5bFZFmqyUAj1zc3gVwvZvq1UbTwlwtCMvNAW6zvtuaOlDU4CeJL01EFljjnkw3ICwCsif7dSrw/w5xSWQKW9raVHQgwFPbVFl6PUiEd5_gUySrKjwa7nsc","width":3000,"height":3000}}}],"Authors":"Alex White","Series":"The Salvagers","Series Number":1,"Readings":["rec7QpLP6MYnOliZI"],"Date Added":"2020-01-19","Genres":["sci-fi"],"Author Background":["by-non-binary-authors"],"Number of Pages":480},"Rating":3,"Read In Year":"2019","Page Count":[480]},{"Id":"Wed 12-04-2019 to Wed 12-11-2019","Started On":"2019-12-04","Finished On":"2019-12-11","Book":{"Title":"Raven Stratagem","Cover":[{"id":"att7vlvV6ZFy3sVti","width":196,"height":300,"url":"https://v5.airtableusercontent.com/v3/u/49/49/1768197600000/s-5HjsP5jK7NJbxxI_maCQ/nlJty2yITC9De6_Q59EMu4rbyFB2PNjjdhD8gW-bbnf0e4T3qbDl8fz7T7lR7bFK7z-0fHWCeoPGa5evTJk72wr1U_k9zc1eizeL5aGu0Wire4L0HGfRZD1oHZ50jO_q8_j1PRukp2yOvvHyu0wJXg/O3YRHiIMbcdC4uFAkkxGBcmtPpLsn4g-q0qTl50m1Ss","filename":"32927239._SY300_.jpg","size":20837,"type":"image/jpeg","thumbnails":{"small":{"url":"https://v5.airtableusercontent.com/v3/u/49/49/1768197600000/NyGdQ-UpOVUFAu1jIjMTCA/-2TDEQjt-Qse1_ATcw-x1F2GB2UsHFp_VvXW_SXH6OYaF7bbuIqcI53AB3gNZFs9RiAwfqOi8HZEdIEkeqEyseLlcFRtE5F1-cy3UzV9E9dzaMKjoMTYAeSXJnrv19gRGCo7BW4Kj6SbnqbO3SDfsQ/DunCOmkYlSEZMJhpk6GrIkEaeUcQJLe9Q4VTu412gRk","width":24,"height":36},"large":{"url":"https://v5.airtableusercontent.com/v3/u/49/49/1768197600000/x_EwPxdmmFpG2nJ-_iTW8Q/Lx9MQZ1NyO7dqwNRmj6N30LLHVHmnzCh2_qWuyxRMpjjleN58tAQoM5jpMkjgus4ug4ILFLszmDoFhkop6oivmVph9XyZvQchFf1ws-yXShmJnEFMNynqtr5iPLYJiHxeWIQ-gY2gDrHR4DOtjVx8Q/sLw6Jjuodop7LZA2N_phVdIj5NUDH88ZNbNDjCMMWqo","width":196,"height":300},"full":{"url":"https://v5.airtableusercontent.com/v3/u/49/49/1768197600000/yDIye1YDOeS0HKpkxBMoPg/gRAzUv13u7tDxjq_5Lb9BDwvrhsStyY4tsQ60n84eLhiwrJlWZQHrQhBnq3Af5YyEiBmvq_lWl7zHhJ5Gr_jyPS51jQlpVlta1Z782nXk9khzcrBO7ztm6PxetsaJafDHBXZQVJsFGP_6YDpQ-OfYg/8mE72T2OKA-uBy_hKSRZH9bFykSbITMN-0Z4AXcyoYk","width":3000,"height":3000}}}],"Authors":"Yoon Ha Lee","Series":"The Machineries of Empire","Series Number":2,"Readings":["rec7n7ZxGweyiYxoQ"],"Date Added":"2020-01-19","ISBN":"1781085374","ISBN13":"9781781085370","Genres":["sci-fi"],"Author Background":["by-men","by-lgbtq-author","by-people-of-color"],"Number of Pages":355},"Rating":4,"Read In Year":"2019","Page Count":[355]},{"Id":"Sun 03-31-2019 to Sat 04-13-2019","Started On":"2019-03-31","Finished On":"2019-04-13","Book":{"Title":"Persepolis Rising","Cover":[{"id":"attBy9DgPlhgp1cpz","width":194,"height":300,"url":"https://v5.airtableusercontent.com/v3/u/49/49/1768197600000/n0FWGO3UsNoZFV-Jh0sMfg/pIZ3FP_CtxPcSVIgFOebC_TND2q_Zj_MhZryjkem-VUsipkQDj7vcGHj1E4E2jbHEG7XeK1w5cC3YWvBj7KvToJ9Ps_ryfAdSnRJCKfwAgOeQVCd9Vls8RALZvPLyXUfI3wwab7Oboh5zGdviWPOcA/WTlh8QR7Dn37Yt-tUKzzxDp0HKaMdHt7yKHzqOQYGeA","filename":"28335696._SY300_.jpg","size":25895,"type":"image/jpeg","thumbnails":{"small":{"url":"https://v5.airtableusercontent.com/v3/u/49/49/1768197600000/Fe5lvEKpZP9JyMVACrMIig/vvBcTlTqsyaT3yhkcZ6ChTTeBx1ipsB9F46vbMF66bl3nUh6bnL8oIbFsn_iue86qFEnx3FQMOlu8lyQJvJAIGsRifK2dHZAX0SDk8KJ8aTkCVIMvwEXA0x3eGLv4g9T9Lec3xyDyd0tiEhCwa3yvw/n7S7jYtE1vbNERRZtAfjkRoNANcNxRXjLAwFTVWIDro","width":23,"height":36},"large":{"url":"https://v5.airtableusercontent.com/v3/u/49/49/1768197600000/VD7t1MmJNKLt9wOxPNWa-w/PmixDH7U9z9UNSSZV_QQ2ctg4Ydwvi3NoNxV1XdXBVBgtGHOY2SUzxlkXLkpzaD2Hqi-y3LGVv8GhVuf6Pjwp0JRm0wRYFtOfABLz2E_iQ_mobbCcpQZ8RBTNSrouE_JeqEksWM3Ag7mLR4j9HrKew/q0IT2Woi6B5qUYjp8bnTGBi39_DGPmBlwCt2hET81VU","width":194,"height":300},"full":{"url":"https://v5.airtableusercontent.com/v3/u/49/49/1768197600000/aKJ9p-qCVC26I5i3-PxcDQ/M1zgHBNYX6rpIAXJ_kR9oD9EsUquLlQfD-G3d01uzEJIo5AIjQ7Mnq_KbdnlVaKfJQavPmVPFCqrC74Pwq-EeqXr00OElAjz5mlG1yPDWYvdk0rRWRBmXsWo4jGyy7fRRfy4Ao_2WlOBfPRbxSqyOQ/UQuvA85FhNoQC3mTlG-A5anz5yE0_ieZBkTisFGmoBQ","width":3000,"height":3000}}}],"Authors":"James S.A. Corey","Series":"The Expanse","Series Number":7,"Readings":["rec8MLkumtro0C042"],"Date Added":"2020-01-19","ISBN":"0316332828","ISBN13":"9780316332828","Genres":["sci-fi"],"Author Background":["by-men"],"Number of Pages":608},"Rating":5,"Read In Year":"2019","Page Count":[608]},{"Id":"Sat 05-18-2019 to Sat 05-18-2019","Started On":"2019-05-18","Finished On":"2019-05-18","Book":{"Title":"Minicut Manual","Cover":[{"id":"attG3HQAuOfxdWmHl","width":300,"height":389,"url":"https://v5.airtableusercontent.com/v3/u/49/49/1768197600000/ijvWupMI-fsY1vRbB2YRUQ/qf6OgfOkg2noVASYC8b6oUCC43YFiBhtpoy6onYjLlzruqRaZU-pLssXJ41zVMebBc-zsHKtGtAnQY1jo5NSbMqvelgNeoDjiZrDwhBoPN01yDDVNAdYcPouR_G3gOxPdr7h8vB9ZCPygqcAg4JSHA/Atxerpbv3MzpEezoHa5c9deWqpk4aDDvNouoEnxzOvk","filename":"40522685._SX300_.jpg","size":11024,"type":"image/jpeg","thumbnails":{"small":{"url":"https://v5.airtableusercontent.com/v3/u/49/49/1768197600000/cUHv7cZ7uz_qSq1E7-KyWg/iIYttmv10i-5zUNz_bLVew_xKQmc0tL6goeDm8zpRkWmSkUmzfMxsTKiJVvm8LijaizUkyC_Unlx9MK3eSdGeHfZpXT-uDqXEv7vKqzAnc4y1JSuw2L8iDDtVMmAc12dRV6EkwpYK2nttEPjlxbMNw/dX6Y899-DU7PmCO10bbMJFPc_LS8qVq0VpV5HfMrl8Y","width":28,"height":36},"large":{"url":"https://v5.airtableusercontent.com/v3/u/49/49/1768197600000/ISk8lLF6RNSOVfA4wha1mg/83dTayj980ILkUo-B61Nzm6-ge1gy6acuyYz-swH8MzOX9H_fXv0C0yu9tCI9Ou5hHgu7F4N7KCgr3mKT9KiB-OaC2FglHo8l0Ax0T-2DFJCocVayLrbdxd4YeboxvMCId0Hwg_h3Gz40_NjW53oLA/RRaHdNjxtiDKOUjN3ykcrvxsKhL7hAVg0Et6_fe9L-Q","width":300,"height":389},"full":{"url":"https://v5.airtableusercontent.com/v3/u/49/49/1768197600000/7m00dKZ6mTQjlpKqK5dhqw/-Ne1Ia_Y7HPAe6gNVzDr7kSkaWSbWAKbpus9XAe3O8aOh8a-ERKIrJtfz8C7C7dsTcLxyk7cAiyr8COO1fIJpiSHkbcN-HhccLVeqMj-qneCgW6zamZFONaKEkrHTrsLyzvHUq77c6C8sudEZ0wGhw/wIyAirJa_aL5Ehe3KOEXgBvGj_Aq1r-uq48Qddwa-bI","width":3000,"height":3000}}}],"Authors":"Mike Israetel, Jared Feather","Readings":["recBiklfL8wGvlR0G"],"Date Added":"2020-01-19","Genres":["fitness"],"Author Background":["by-men"],"Number of Pages":42},"Read In Year":"2019","Page Count":[42]},{"Id":"Fri 12-13-2019 to Sun 12-22-2019","Started On":"2019-12-13","Finished On":"2019-12-22","Book":{"Title":"Revenant Gun","Cover":[{"id":"attwpRS225fEws2Dm","width":196,"height":300,"url":"https://v5.airtableusercontent.com/v3/u/49/49/1768197600000/YTR4hv4cLACh6YzxXR8HrA/QFUG1OiFEKXhWXg2Zugov8lxdAirgr3zzk1AttIJeWlSipYpByNw5ZV_PgVgYe728bkgLxzfwxYvE92Szt_xguA1GLR17eY81JYJU4F4ZtJrbi99x3gGWSazE1tf0vshRsy2YAA2HhpRxNNRX78XSQ/3lSFIOD4FFEbSLLtFPD-ggLKbeW6AGYft8r_Wf8aUcI","filename":"36373688._SY300_.jpg","size":19502,"type":"image/jpeg","thumbnails":{"small":{"url":"https://v5.airtableusercontent.com/v3/u/49/49/1768197600000/HVUJe33VrXLYM2KOVKAzLQ/33xR2-u07-aTfT5G05G6a5Gi6_I04hw4T-Srsfz51aM_vBB0zss3VisPrAelUmv0LNJmUe1N7Xi9E3OTCzjZuRSDfr_Xo0ipc3QNzyxA_-RIcOBKfrbFFwKG9rUgIfFlqQAUFvXft2yP8-B8qbehkA/K8SlOmm5KolBRzNnBfYPHfhmJ7cWoyD9cqCfcZ9QhHw","width":24,"height":36},"large":{"url":"https://v5.airtableusercontent.com/v3/u/49/49/1768197600000/FbAiRiDYnKiFoYUvIH8Qdw/MZ1XaX8gPd_dAbKBghaIoIvBRb0xpv6pfjhte6xfkBbASY0tnM006WmkQisSrtEZGRsK2PGeHQ9csE561qVDqAFblM0kj8Cls7tr9lgpdqaT0RXUcvkg55WeKRas7caLuHg6BKtkFpSORbJpb-ldNw/T7eOYEbYmey1KU9UA360FdrML2o2EtGvlWgCZXQvp4k","width":196,"height":300},"full":{"url":"https://v5.airtableusercontent.com/v3/u/49/49/1768197600000/An-uqZyw82fB-AcLluZQbA/85HAZKeAhrOfwWKcdvDMeP-TwqECHXju0JPncTyS5Px5RMBjBtnt-K1JZQJJMuvVoqFbAk-Mq5O5lUPRttqOQ_O2TEnaB-FspNYAcPA49Pw10jmbn7fNTfwXhZGtHRSzDxja1BT2LbvSzucjNNvnUA/E_0b9dlp3NY3lPo5L7N96mLHDCzfvXVEesy-jZOqYVw","width":3000,"height":3000}}}],"Authors":"Yoon Ha Lee","Series":"The Machineries of Empire","Series Number":3,"Readings":["recCnNxQgoqjmT58Y"],"Date Added":"2020-01-19","ISBN":"1781086079","ISBN13":"9781781086070","Genres":["sci-fi"],"Author Background":["by-men","by-lgbtq-author","by-people-of-color"],"Number of Pages":427},"Rating":4,"Read In Year":"2019","Page Count":[427]},{"Id":"Mon 09-02-2019 to Fri 09-06-2019","Started On":"2019-09-02","Finished On":"2019-09-06","Book":{"Title":"Meet Me in the Future: Stories","Cover":[{"id":"atthIBm7RH7NY2blh","width":194,"height":300,"url":"https://v5.airtableusercontent.com/v3/u/49/49/1768197600000/V8qkbzo8g9MYN1BPs3y7NQ/STgkSwrcvBFcv638xP7NM7B9LuTkdB3caytP1XTbqa2WTGCg3YpKObODndb05rK627OMnD20jD8WlOao362mHq3alG-hYoRDyO4Q9cK3MndgRRshAFIsQrqDB_XnZS7NLrEd-VSWe7IUEbBHcMlN_A/CEV3MykGeb0DBbP1gpkOpOsFqqV-zsdu30dJBx73Yo4","filename":"43801821._SY300_.jpg","size":20924,"type":"image/jpeg","thumbnails":{"small":{"url":"https://v5.airtableusercontent.com/v3/u/49/49/1768197600000/HTqguEL6SmbGMG9ioEGA9g/RvrMLYFCpKlskSXCbSGLZ-fpwQnBiuaLUmaFPYW927SDIzHYzx1tFszU9zMxq10KuqA3c9DGZAbt-CoDZw4x5jpatn_-04qUarYAmx4cYOqAg9drkfzGD39wWSgZW0-tWQnMdgxmPNCkhA6yAJpzCw/8MvxuZjmGONDsLEje6-UrDb3zW2jEJ8v3XKMPlwSHLY","width":23,"height":36},"large":{"url":"https://v5.airtableusercontent.com/v3/u/49/49/1768197600000/v75tDjYNIiWLWW95ASAsvQ/Hz-qrA_FFbKcqgaGOvLUKEKPABThUxj8YdIcL3O2RBg9FYEiFbxDWAWIRFiYq0mZegQKonYR7U-_HSIR14JjjJWmEjFh0ruNYZuxhecI3p8UPyL-4P5KO5Hv0y_8v-c8N3le7sSzoaBtxVy2o--B3g/o7BMittzmj9eBmj21p_FRBGVchBwuapL7GzoooT4KKg","width":194,"height":300},"full":{"url":"https://v5.airtableusercontent.com/v3/u/49/49/1768197600000/0NtArrXQ5ECP8j7d3MQFbQ/09Z5XG-iKr6iTNmb4ju1A9xcSzbg1kaOABJYaB9QrU3u2k_Mu5Yx9nUJRiAKTKdMkcXfN5sDFkX35mnpmwJcgJWn8F_kpK1ep6sRVKZAYDhrctu9k5Jzzi3PdsN7HwL9cEWPp5neLpR_dL0rW3NYKw/gGH1ZnYlz1ICJp9VKAqbVEscdarn8tC7fJ3-eEIIUzI","width":3000,"height":3000}}}],"Authors":"Kameron Hurley","Readings":["recHYGTBPz6x1ybi2"],"Date Added":"2020-01-19","ISBN":"1616962968","ISBN13":"9781616962968","Genres":["sci-fi"],"Author Background":["by-women","by-lgbtq-author"],"Number of Pages":332},"Rating":4,"Read In Year":"2019","Page Count":[332]},{"Id":"Thu 01-24-2019 to Mon 02-04-2019","Started On":"2019-01-24","Finished On":"2019-02-04","Book":{"Title":"Cold Iron","Cover":[{"id":"attWPBxGrbO2Bu3ND","width":198,"height":300,"url":"https://v5.airtableusercontent.com/v3/u/49/49/1768197600000/mCj0v4qKIsnhWFboMx1J_A/UwUOJXSgitlGpLDPUagtJHN6sOl-Ps99FdaEzm1qvfhzYqu4u5QgxbTNOJo4AAPfSbQPd6Ce9d_r4_4Kz9Ic_UZYV_x_UNH1H7ftOCA8q_tgA6Y2bbywJQv6RwJHIo1o0RnnK0F5jG4bIYSm_t8rvQ/qxXI8V_gz4l635L6fJU1DqcIk3Q4TgzYRpw3dINkjtE","filename":"23309742._SY300_.jpg","size":20328,"type":"image/jpeg","thumbnails":{"small":{"url":"https://v5.airtableusercontent.com/v3/u/49/49/1768197600000/sLiyCDEjno1E8igKcikqJQ/wRTbEl6mybVzmcAl8wIoAW1cmX2PxkEB4nTj0R-IUNgZ70iSnqhtJ7xp0zm6mzvLXjkXUMWHjMCxWGjnFcrN8c3_Qxs0Nca0brwohpp3krm8PEwaIahPr9raFww7RRsIFHeNmfyez_CRHMPAbYOspw/oDwdrl2SeL9R8N5MK_-tDPoa2BC2yuMIDKlwpL3FiWc","width":24,"height":36},"large":{"url":"https://v5.airtableusercontent.com/v3/u/49/49/1768197600000/dv9_etBbFLQRmTtsNTarQg/7O_3zwzqb2N-LrWhrM2i0iqtttwNxR55Xxz5-yWFI_11ux_KosOKnVSGh0I5eG_UDIsESdyapruuPTVGqyD3gcdCQwmp7Q1HhP70p8IHXVCqv389VMDh3cZvw0iG4QYVAXJFawbM3SXA6MZMK2CyXQ/i245tN0qZ_fZplWEB4Z6LU4ifsPKT05FAL_I1JVkqKQ","width":198,"height":300},"full":{"url":"https://v5.airtableusercontent.com/v3/u/49/49/1768197600000/ZZ_Z4QYQbbMD-UIa4VXHaw/TqdpaO91guDiyjR2zvoAMkRv_FnPI2RKCFIKwPBGFFpAgU5_Ti9R7xWfAMBtoCiqWRivOF5KiaGg9xeboF5oFNJfnZJ_kjXfGHXDFHm_I0UhmzS5lor9Jmad4sHuK5QWVpmTDVGmEUA_rQ99haYrDA/At33MxWQCj6iF62BVIHA6KYpizQbkNQS0bbs8GmVlqM","width":3000,"height":3000}}}],"Authors":"Stina Leicht","Readings":["recIz2BHPzYTYZjy4"],"Date Added":"2020-01-19","ISBN":"1481442554","ISBN13":"9781481442558","Genres":["fantasy"],"Author Background":["by-women"],"Number of Pages":672},"Rating":3,"Read In Year":"2019","Page Count":[672]},{"Id":"Wed 01-16-2019 to Wed 01-23-2019","Started On":"2019-01-16","Finished On":"2019-01-23","Book":{"Title":"A Red Peace","Cover":[{"id":"attBWkajIfvQPdByd","width":188,"height":300,"url":"https://v5.airtableusercontent.com/v3/u/49/49/1768197600000/bhi5MCei7QlJ1e8baD7cuw/pNl7a--129YGVltzFBij3fv2bVfrNAo4aMRbOJFrMCemnFGWRpFjbO8E2cjXZJgD5UFHwRdXmkIdF91W_jnPFMJpmlbgNBKqyd3V5QegGstKw30VTPk5gm3Mt6Sbpm4LpfYD6Wi0S2tfprXW6GaKzQ/57jw52hVtHsM1r3BZmR7PFAMCpqDG7OxlV0zrJF9eM0","filename":"33383059._SY300_.jpg","size":19064,"type":"image/jpeg","thumbnails":{"small":{"url":"https://v5.airtableusercontent.com/v3/u/49/49/1768197600000/xYRf5_txfn7MH9xxoAmVdQ/113jffg09WBJs9Ch1Kb0mKnimaUjabPPEpc730RpTdh9sF45PbxhNtV0dF3gU4xUT5rNUkWyOjwJ1oFL3n7P1L-015AidwUFaB04p9e1V_PEQHWk9GS8obHjw9fu87ukeI1CKWQ4Z0cbERm1oCEHmg/euRuT7HDgs_Izrkp8bDPTPCg3DCacc1KOtP5i9vSmtg","width":23,"height":36},"large":{"url":"https://v5.airtableusercontent.com/v3/u/49/49/1768197600000/dFBHijdUnJx9VWMXlsUXRA/VqnhHtWZCaA0DMxYGSoHcc0SaDPGpRb2l7LRXzDulNJteQVgXWSH27-4uThjd5KO8vwlxIlV9vGqwpYDzZirvU8fue05bDq0Wp4HzETRivi1xRxME9MrwMrlqwipmJFuy_0UNSNumWTra0DLKdBP3w/iD0w0_wFYQ0IAP-NSJXjkUkIKZAkTq5IkQuMENTnC50","width":188,"height":300},"full":{"url":"https://v5.airtableusercontent.com/v3/u/49/49/1768197600000/vdiSE0j8GsrM1_donxfO7g/qdudZ1q6G6lRPf9HnZCeQuv6ZN16r9-Ua01grr6DmF82DDhyDavXUxio2CNFPxLfEA6Z7fNHsT4U8-Ss1Fc_9ybPiMMTEt2SYNb5EMbo5pm8_GgnpxnU6KgKQfYaQZsH_E0Lux4vLitEOhKL2umavQ/_imKx-kBzQlcgytqCJySAN78pbFV56gFk3Tcwoir6sI","width":3000,"height":3000}}}],"Authors":"Spencer Ellsworth","Series":"Starfire","Series Number":1,"Readings":["recN42Ik48qM3M6f3"],"Date Added":"2020-01-19","Genres":["sci-fi"],"Author Background":["by-men"],"Number of Pages":210},"Rating":4,"Read In Year":"2019","Page Count":[210]},{"Id":"Mon 09-30-2019 to Wed 10-09-2019","Started On":"2019-09-30","Finished On":"2019-10-09","Book":{"Title":"Bloody Rose","Cover":[{"id":"attnd3CogLeEt7FnJ","width":195,"height":300,"url":"https://v5.airtableusercontent.com/v3/u/49/49/1768197600000/IIE9vk4JITwpYNKNFfv-HA/7BtCuP6Dy510DYf4G6lZcnxNds2fLmx0p5DRXFofOwgQdbtkE2-gyo2ID08fgrRNksOSt8-dP2AbY6tNjeDYsX-suyQwReiQ7xlkUnDstM4xQ6cpGY3zJL3DPqRmMnbdrx1dJ7l7na0VFsLk49USxQ/3mpRHYfCoU_8z-R9-dxkktuC7550TMV5Z_ZSZ9V7rpU","filename":"35052265._SY300_.jpg","size":23067,"type":"image/jpeg","thumbnails":{"small":{"url":"https://v5.airtableusercontent.com/v3/u/49/49/1768197600000/2t0KKT035tUg5WhNrQRLYg/1WGVyoXyB8Fw_sb2ePs91AWHjQwCR3H_Vki9TSSZ_65opYqvzh3QQUEAfu3VPyaf9dQo2YQ8FFSNRW_C-r6BgrXi57jTNfqUjKJOdReskO3KSyPiR34dpXcSawfq_4xVzbYW1QoxfQXw9yldm--rkw/_pwWzsXLDjarP13O0p8uXlOS_-6nA28DwV0FK2qFbPg","width":23,"height":36},"large":{"url":"https://v5.airtableusercontent.com/v3/u/49/49/1768197600000/9FT4NxMkyXp08UERUXqfqw/cUYCk6s1wXKVZjDYP8hx0zyUWGVaiF4CceYsOqRlhu-iKJ3jK6FM0ELhPSkxw0F0rCAdX3fgHmnSijYbW0rl-pg79saQVvB7fsbjDxEHz5mrh4_hyVqnLV7mb7bBgJzRpraCnkIv1KQbu3PxZSLdDw/Db000T4fbXMyai0PYqi2hvmnBrq8qR0M9XbUMWduCas","width":195,"height":300},"full":{"url":"https://v5.airtableusercontent.com/v3/u/49/49/1768197600000/Ev0kzSnD5OnVMyxmDkDP2w/hpnGKtLFCNCFIsAUb8w-pWotuV1kzp2QWaqXc4DxmjrhzKJQwaGDtbt3bbWAVZgcbX_0Je3UzgP3mQsb9Gpv50Cnkp5EV47jROsIFoT3uC64jbCvVbmPgUHJb00qTxpvRk-anYXfSbg97akCegD0xg/IQSj1vDbJf1rxFB73Mesm0QKskujDsDvt9EsKS3jVjM","width":3000,"height":3000}}}],"Authors":"Nicholas Eames","Series":"The Band","Series Number":2,"Readings":["recP3PCVDmxBrhoi8"],"Date Added":"2020-01-19","ISBN":"0356509044","ISBN13":"9780356509044","Genres":["fantasy"],"Author Background":["by-men"],"Number of Pages":544},"Rating":4,"Read In Year":"2019","Page Count":[544]},{"Id":"Sat 06-22-2019 to Tue 07-02-2019","Started On":"2019-06-22","Finished On":"2019-07-02","Book":{"Title":"Kings of the Wyld","Cover":[{"id":"attZK0CzUM5zX2eDE","width":195,"height":300,"url":"https://v5.airtableusercontent.com/v3/u/49/49/1768197600000/aSIML4sGhTclI1LakVN8Pw/56yRR9zoqc34-PPPn0pSpCk-HUDnue11pl_Xb-4lbAUpPqonxzUUWSAqA6WlWYxaWYLH2c3u8cixPPSizaN7G5ajAXwUA4ohNtY0DZo-ajRIX8WKNJ32-h6w6-smEHfFlb04wnzDymMJyj_wCcsm3g/_DUuPq0qmyD19FfqBNF5KzVkM06tklat8qd5tSF-yjE","filename":"30841984._SY300_.jpg","size":19794,"type":"image/jpeg","thumbnails":{"small":{"url":"https://v5.airtableusercontent.com/v3/u/49/49/1768197600000/u3A5nyd43ymUIlKS6Y7-LA/Ab0rayKpYJ05YLtRLn96XbBsb995moXaR-1FSEX7NgaHi5B09319OgNLYPYqRjxU2z86x0Cuy9jJL5lmgtzE1NbnUuS1u2i3iJcJO58LnnOLX7XSTdq-s4fa7e9qRcKXV8pg7pHns_0eqPVN4-iEGw/7PZsbhJ1THjR78_87y1t4cUgEwgOxANNnubM3PqLAgg","width":23,"height":36},"large":{"url":"https://v5.airtableusercontent.com/v3/u/49/49/1768197600000/l3ONAtJyZv4dJNHehZMngg/ufTvL20QqT2NCViLQ3bZVnFrylbwBxUtjsDd8OwCoWstX4RC9Rrg_vqfNiK39YamGs7zyQI3kEi1Obp_WOe1lL5Y0YPDYzePeHP6E2TwvAoVmt7NU9B6rlj6vujLvTNIzo3LHq6p2jKkGWPpG5_f4w/57-7nPMWSKOsb_xt4voi2invVj6W3KSW0PobGb9XhwE","width":195,"height":300},"full":{"url":"https://v5.airtableusercontent.com/v3/u/49/49/1768197600000/O6vNFStgeocDduv_0dBnCA/EDfKdYa4zcnsLavZkx_FFqTPZnb0Gxwf2vV4HFpSLNp1qhRzcriCqkY1DifUVJ5zpfW5i1Cx94JQ0Sn3Ps9BwROB-wa-z4HuuhMP-T3gCMbdo4kmLFnBHVMN3w9GVp0zkHwepvuAsgRh1nlBkMSnow/zAg-h-SWNELISaDpVoveKQjsiGj3PM_JP0X-uIP_cTc","width":3000,"height":3000}}}],"Authors":"Nicholas Eames","Series":"The Band","Series Number":1,"Readings":["recSv96sIy8yG9tFb"],"Date Added":"2020-01-19","ISBN":"0316362476","ISBN13":"9780316362474","Genres":["fantasy"],"Author Background":["by-men"],"Number of Pages":502},"Rating":4,"Read In Year":"2019","Page Count":[502]},{"Id":"Sun 01-06-2019 to Fri 01-11-2019","Review":" \tA core of really good ideas here, though I think even this short book could have been a quarter of the length and not lost much. Essentially:\n\n1. When taking notes, don't organize them in top-down categoriesinstead, link them to each other and allow structure to emerge organically.\n2. Rephrase research material in your own words to test your understanding, soon after reading it.\n3. Use the act of note taking and your archive of linked notes as an external brainnot for remembering facts, but for making connections between existing ideas and generating new ones.\n\nMostly pitched at students and academics, but I can see the approach here working for many classes of knowledge workers. I'll certainly be trying it out for a bit.","Started On":"2019-01-06","Finished On":"2019-01-11","Book":{"Title":"How to Take Smart Notes","Cover":[{"id":"attU5Sh8lnnM9M9vd","width":297,"height":475,"url":"https://v5.airtableusercontent.com/v3/u/49/49/1768197600000/JP_ihwY2A_CgXfwNevEXZA/UFoB1FTdA6SlzCBRGwGdxTdENFv8f-uZkZaJq0HRBQk_msXqr8X3eMiiSOB723aSinLS3z24G5OiwhQGqxuKR2j1KXc1o8NYQMl-TZBVtnJ38W-M0TkxeLiecgHrsoALYkZX6Vs_BNP-IIos0qDMCA/ZwDwXcoVwTKy7sB735EiqFE6Zw4L_fORm6bnM5KhdDw","filename":"34507927._SY475_.jpg","size":24858,"type":"image/jpeg","thumbnails":{"small":{"url":"https://v5.airtableusercontent.com/v3/u/49/49/1768197600000/d1dYqLwUS4f7VvIBfbrB9Q/ueyRfgOrP9Fl0-48yIN-egCrJZGE7CNbc_EA3Qm7vIawopyquq9gMsNfFXOOa-WQiNF2av4jRoQBRzkDEKWWhM0NmDm0IFKcvdqXl4q_NwELfJcLXIYTeDuTUr4FJb2sED1F7mcY1s2YAohdTnT6PA/YuFyodaTJzce0aef2HbXKX5mERwSLWijz_kSL4FzJsY","width":23,"height":36},"large":{"url":"https://v5.airtableusercontent.com/v3/u/49/49/1768197600000/iFd-qqJ-yZVBVGjdTzuEkQ/OPcPbijsBBPoww7f6hVky7DGB4YrwQEJaQRvHxbCmhewkiwn43W3LtpdeOIpAmKCjX_d9bKDYbFSDndEWNDRTf9rl6ihFFNNKDxmMZc76H1ASdG07C7n971lGtZLRa2m7QbKJtwih_9AIa73oGOAig/S-01hIXgi3gUyPgyDZ63bTHcjkku9mSoXoIdE0buayU","width":297,"height":475},"full":{"url":"https://v5.airtableusercontent.com/v3/u/49/49/1768197600000/qoOC5RSzrjA9XIknFd2pWw/ntwGgUxHoOwRT9Dx7iC4eY7nHm4ucs1jAP7iDsg4_aTcRZQUL4H-CTrKgNPrXu0kMiTnAwhr-R3Oqpru12Xi--eASiJ1qHlrjYYBKiTg-S99qwqK8cctia21ZGwb25zeSVg6I5qibsDiuBJeRiLNmQ/2RQrKZOq4hKuKbIxLQuHAUfw7nF3HjiwC0Nm_nd70TA","width":3000,"height":3000}}}],"Authors":"Snke Ahrens","Readings":["recT659MUGAzLVD3r"],"Date Added":"2020-01-20","Genres":["nonfiction"],"Author Background":["by-men"],"Number of Pages":178},"Read In Year":"2019","Page Count":[178]},{"Id":"Thu 06-06-2019 to Sat 06-22-2019","Started On":"2019-06-06","Finished On":"2019-06-22","Book":{"Title":"The Red-Stained Wings","Cover":[{"id":"attPjlWqmRhvvZkAX","width":198,"height":300,"url":"https://v5.airtableusercontent.com/v3/u/49/49/1768197600000/r6KDX8DrS7hBLJxl0QsEAw/RXrz9w_ugugIl4DjVtbrUa7x_-bsbWFYGlFJVmATrRaQlvZRAHY91TPKkdQUp6AlI_2BHjWxfzIJgsUAC00FEDkM7PxaMrGgi2YeOzElyp9q2uZT5nNlAdqXv4R3tTszIgq_v2-agPhEq5U45d56hg/38WQ2Pyw-O9-KhIL6KC6ublUUAZZVpFzy_m7PN8U7HE","filename":"41555952._SY300_.jpg","size":17724,"type":"image/jpeg","thumbnails":{"small":{"url":"https://v5.airtableusercontent.com/v3/u/49/49/1768197600000/5Hzoh7WlSUo4reBLXkQDCA/JW1PMnWk8BXObLBxJ-jlVdJpoqTpGYE1RLz8cDmE1JtGlGWKjpNyRDPk1H1nFtqthJq3f3amWbAzxy2-1Xqeo3HJVBkRwIzYS8X-2xmTE2_MbB9z8P6qbape-UOV68TTh8x8OqjG5GeV8YIMEfQS3w/O2Upl3rTcT74CfjR3qCpEll6RGLUDLqiH3pGBknoK7c","width":24,"height":36},"large":{"url":"https://v5.airtableusercontent.com/v3/u/49/49/1768197600000/wxDO60vyXvoq3I58kSbLxw/WkgbQxsNztCQFkrH0a9w-m9Bcm2Wn8cyuKIOaCPFwzYnzm_r0Z7lmg_qaVrdnulAtxbIuAAZD5Mae5UExzFnZ8BP4ShtwuSX1n4zf7KuYkozUGrhbAHoHIox6BcIaZVkPsoOWJD6LXq7KUX309dzjA/V6XNVMRnp2447lLBvrqIMn1gW4-yZfmaFOtEx5bJPGk","width":198,"height":300},"full":{"url":"https://v5.airtableusercontent.com/v3/u/49/49/1768197600000/qFEYZ9_g99GLT5yM0BhX5Q/57TYRbAQEhfxOo46ob5a4yWDWqwjkBf_OwxFBMZ-9bCyxlmG7c0nqoT5Qu5T-q8nW9eTYWjsycF1CujQMIugOXdEQ7iuYQekUQVL8xpCahUeDzTiAWulfbsIcac3NH9J8KXbLMgbWxZJ9Lt4TJnmuw/AgpcRlTnN4ELkN0qEUQktKmaw9PfI8W8wwTOhNNQUis","width":3000,"height":3000}}}],"Authors":"Elizabeth Bear","Series":"Lotus Kingdoms","Series Number":2,"Readings":["recTDCRcf7l7ZMMYj","recP3BO4FBxOCrGUW"],"Date Added":"2020-01-19","ISBN":"0765380153","ISBN13":"9780765380159","Genres":["fantasy"],"Author Background":["by-women","by-lgbtq-author"],"Number of Pages":384},"Rating":4,"Read In Year":"2019","Page Count":[384]},{"Id":"Tue 07-02-2019 to Fri 07-12-2019","Started On":"2019-07-02","Finished On":"2019-07-12","Book":{"Title":"Tiamat's Wrath","Cover":[{"id":"attUmCDeGKHFEBEhF","width":200,"height":300,"url":"https://v5.airtableusercontent.com/v3/u/49/49/1768197600000/HtTK6ZNlFylzx9KWHd5UUA/CjHT8y2DXtgg1bn5SQn8F6lIMI66HtVsknJoaZSerO96lHlB7ikaBOqNd-meupvvjxHvtgRBHtUE15M1e_Gpueau-cBzdjvkFxGSWvS1U1ogPH9O38zWcuXE1aD_r7tRGti-rGJDBh4V0YIMMCbsKw/fiQm5ZrIsw-LwFNdDztO9sVF5U1WULfJUFDtDtQ6QDI","filename":"28335698._SY300_.jpg","size":21618,"type":"image/jpeg","thumbnails":{"small":{"url":"https://v5.airtableusercontent.com/v3/u/49/49/1768197600000/WTXJzAYPyAVFQn2UeM3LAQ/nprilWgfeXcDBRmxW4QcOzkvypm-v5S79d0cPkCHy_belztNVuJUE7dyHfyT1PmY7yLerz4CK2cRr8isw5_mRdxEyu1XVUbeolN0TY63ZWwpTzOIhTZOSCz6Fyb6oNFFS8C-rbKTs8GLEYMBNvVvcw/WE5pnKLRTBxQCPpeYZ4KEq46RAqERRKJ3BdX80a_m2w","width":24,"height":36},"large":{"url":"https://v5.airtableusercontent.com/v3/u/49/49/1768197600000/gyX5zuKXIeNhfjcjSvPgug/aw1vyWJgnUIWlrf8W1fK3luvF1mYt8KP84-f9a0_Qsb30_t8-bNdxRfxEAvlvS0OE7vEfslM4QXp-TxnQPE1foSuns3gtTJnsXw_9M2PtgXixjRKVElbvblrxUPa2vs5BXMg60zDUprFmpjFq0fadA/_6w_PqtLFTHoKj944pZwpDH13b9oBx5rgjKwKoJZwzU","width":200,"height":300},"full":{"url":"https://v5.airtableusercontent.com/v3/u/49/49/1768197600000/LRqaVtJLKisCQO6e72bAWg/_PnYd-Wibv49tzoNU2Xk4Pdyd5MV0k6ZMtbSEfA0v8hlps9Eeqtr7-mtA0po9hlEYjJea85M0mr26QddxaiPhik-W6pP9dTUjsox0F1NGUabkFZMRnYm4K6TY2IcJ8WrtN-XYTAiLglWG2RuaH-1eA/h-76Psot5N2R_TZvFvoQihwOSZWbeNl5bqr2IgUz79k","width":3000,"height":3000}}}],"Authors":"James S.A. Corey","Series":"The Expanse","Series Number":8,"Readings":["recXFi0LgFjz62uO3"],"Date Added":"2020-01-19","ISBN":"0316332879","ISBN13":"9780316332873","Genres":["sci-fi"],"Author Background":["by-men"],"Number of Pages":534},"Rating":5,"Read In Year":"2019","Page Count":[534]},{"Id":"Thu 11-07-2019 to Sat 11-23-2019","Started On":"2019-11-07","Finished On":"2019-11-23","Book":{"Title":"The Name of All Things","Cover":[{"id":"attZkL8uNr8G33fZb","width":198,"height":300,"url":"https://v5.airtableusercontent.com/v3/u/49/49/1768197600000/-ODmS8M3Iou77kupofVGJA/c8OGuDjpwDR6M2BcnA-XexcZXTks8T-Df09gNFYQRC81SPrbBP-oGWGHEQ8jyZO18E5nE_CR985APvF7QwWiLEEcANXrN1mz0FTJ_OiATyQQTfCAS91REKFcLmIWwMX1qdORztud-RaTXfj9nT6VKw/DJKjuuYMWhaHPKhfr6Yng7sICFLsOzGRdmVjE4ko8sY","filename":"43255070._SY300_.jpg","size":14748,"type":"image/jpeg","thumbnails":{"small":{"url":"https://v5.airtableusercontent.com/v3/u/49/49/1768197600000/-PGSjIFGEOhIVSKbFzbu7Q/RUEx-c69SRieNSqShWOxg25p8OtyofxYCK7Nc44FyBLbBaQlAhGaDZkQZ-8ted936RgZiV5LNUiswwGzKcIh-uD8wewNOM4wmcSCHL0PaoXGC9QnXfqxaEGYbwUF8_NSIeQ-Sq7mmpfnE3dLaK94mQ/3z2yjcmK5jiGeBhu56JLAtI5juR4mmeikI1kAx-24Ck","width":24,"height":36},"large":{"url":"https://v5.airtableusercontent.com/v3/u/49/49/1768197600000/_5TItU01uaw4zIDj0aQeNg/jRQzjvVUgjA8e6SMZSsW-piMZtmQXLKbpwYBl5gChGKuGj71eqUpb3zXh1iofi5O_Xb8LuZ2WgrtM7X7Xj4JNYMymomHRtfu5HEgkNDSrv9f5dHfFtgSn706Hx5WVi1zHSDmHdh6oAE3TUBa3SBEew/Ng-t_plcvrIAjDLHiPvvZGBurlwDftjAfdFm21MPgIk","width":198,"height":300},"full":{"url":"https://v5.airtableusercontent.com/v3/u/49/49/1768197600000/FY13UWVpR0_UBcfh_ALwjA/PebMCG015sdYRgNO-sm7W0ocIACxVLBHu78mALdHFVnZ4ogyD1R-mA77WPSj9BRzfITjXGVcS29lLUWy0ObqEsblYB9g8obRCwwjSqK-m8IRmkk7BrbVoOcRI9ThouIriXHjus8UJxqvVlj_DDgs6Q/Q0bSoxRmKN6fQVg-Av5GeXnGH13py3G_THex25oZLEo","width":3000,"height":3000}}}],"Authors":"Jenn Lyons","Series":"A Chorus of Dragons","Series Number":2,"Readings":["recY6utnWw6Pt4siX","recetYk5bFG1d3EOs"],"Date Added":"2020-01-19","ISBN":"1250175534","ISBN13":"9781250175533","Genres":["fantasy"],"Author Background":["by-women"],"Number of Pages":589},"Rating":4,"Read In Year":"2019","Page Count":[589]},{"Id":"Sun 07-21-2019 to Mon 07-22-2019","Started On":"2019-07-21","Finished On":"2019-07-22","Book":{"Title":"The Haunting of Tram Car 015","Cover":[{"id":"attHanK80W1V3OXqz","width":188,"height":300,"url":"https://v5.airtableusercontent.com/v3/u/49/49/1768197600000/PJqachlQ3MSz8x9Swqi70w/JAPPBk3L6XJgLgMbNfxjwDnOlsg1TrE7oKncV-Vp6Y6yc4akwYuPJO1LElhxR131biZ2v1B1O__nrlpbcdimEJ7gM765cjjCQe-QsOT_Xcej9uiA_ROSBVHaCQfqQd_s9CmT58eeFWa25QTkhXEuNA/F_zMQs3VQyFbNb6wsa6_6I6VcPLpHRCW_zUcv7XCamM","filename":"36546128._SY300_.jpg","size":15306,"type":"image/jpeg","thumbnails":{"small":{"url":"https://v5.airtableusercontent.com/v3/u/49/49/1768197600000/7NKqUX723yo_SOIl7AYh-g/89W0eMZzn_XYe8FDZqIxVHv632-fwZxgm9OcNRVPC9pQ0ulpn_XFGsplE2HYFw2oOFQMO1furkgJ3fZic1GEkkJzYTapqj1NANEOrmTH9JdGA6bS-QYuqvsjuVCns79WU8u5HIyS94EfWTrg8AK_Gw/TH1600OBp9aZ6CZ7XbqilpA2PFJbRjeZkK3oHUTe7ms","width":23,"height":36},"large":{"url":"https://v5.airtableusercontent.com/v3/u/49/49/1768197600000/dViOwHAgtgsVslS3aDcNCg/Ip7wjxDZsyMiwGu50VuWMSvZC2l3RFow5QBAMr4UPvKtDLHweI2s6Vs0sa1g4_8mYsC5c0RC2ZUp6xxhnpWeM_FHWpqbhCDKiBR5iLmrW9nYLiRLfQ2Wl5B3O3ZWHpTCrM0fGEAsBCq-E73N1LuhGA/ob6k484mP2gGL5CWwG3u_3EtxNUC5eSIVTq9kKETfo4","width":188,"height":300},"full":{"url":"https://v5.airtableusercontent.com/v3/u/49/49/1768197600000/qsBWh8pApDQ-SbAhIjtmHw/ob38pAVgYrsIhHAxhiB3Yf7yJ3ZUAQ3OYxF_nvQs6zNYsVFUTMTD2WgmfU8YwwJ_iB15Uh7C-is-UKIVKwGAWRL7P_nKxpY6WwMUqba0w3za3_oXCJcEF-ScuPGsBWFADtgglBr--BDK-AhbsvAQCA/oF-G1kNctoQPM3n5TkL6c4-3PYouhQS3fV2ei_xYZrc","width":3000,"height":3000}}}],"Authors":"P. Djl Clark","Readings":["recZb5eK5fitRK3ko"],"Date Added":"2020-01-19","ISBN":"1250294800","ISBN13":"9781250294807","Genres":["fantasy"],"Author Background":["by-men","by-people-of-color"],"Number of Pages":144},"Rating":3,"Read In Year":"2019","Page Count":[144]},{"Id":"Mon 03-25-2019 to Sat 03-30-2019","Started On":"2019-03-25","Finished On":"2019-03-30","Book":{"Title":"The Light Brigade","Cover":[{"id":"attmWsXNBYh2nC4JV","width":199,"height":300,"url":"https://v5.airtableusercontent.com/v3/u/49/49/1768197600000/S3dHbDtreHIUyING6F8IAg/X4ZD7i8cHcqN3tTizNGLNZV8DQDPxWHYGlyqIW-v54JB0s4dylZuhsOCtaKt3UYGKJ9g1czUcmpxPvLdwJTfHTpv8Uh7t3wdi2uxP1hMl4y9_YZ5yEPHVSydBwLsURJkd-6_fI9Is1RomLq_mxD2Uw/O2x-vf3jWPfvpBtjBaWbXNZWfJ7rRl2wS4XIalQ85LI","filename":"40523931._SY300_.jpg","size":16777,"type":"image/jpeg","thumbnails":{"small":{"url":"https://v5.airtableusercontent.com/v3/u/49/49/1768197600000/fPk4lagLvNJd73ym8kAMjQ/mMZPXND_KvjZwx8bWR_o98w56TFxN9GDxBaBkUA3tB0IQEnK6XnYQiqKN7EmjI7cwVl8znxslwDjUthqdfW0zmHhACf7RMJlts4NWOkrjKii0i_bIMOsbeDNZ-VdUWeJCUyQo2eawSuWnFVTc7JP8Q/YjJr07mg-0BTQTgsYZpQO65dPZl1ikRCN_0E7pPVDzM","width":24,"height":36},"large":{"url":"https://v5.airtableusercontent.com/v3/u/49/49/1768197600000/60wrMFG7HTdShh8E059KTw/DUJOmtIzXyV4nyWGLHc_OzNoKXS5_4xt_BUQyPsIHug8R17kF_GB5ONELWKL2L5xOefJwcadWV48mEs71MWck9aBtA95kIdzDfdP5krQtkMtOhvq0a5-LciypjemjzNSf1k3vyz5_TBQopvC3W_LXw/1JlPinpiKYZKQwKIUTBorfqiq8BWEmEpFnLBIXruiR0","width":199,"height":300},"full":{"url":"https://v5.airtableusercontent.com/v3/u/49/49/1768197600000/RB2FgjRUZNEGYf6SY4sQXg/rZP6iRFt2xFvuWAlki87fDQPtMwhzgTiVs7cZOFyzZmTdZYPVrA46XA13bodFOHZPDgfu_fjU7e6ZlUnfvSK5QCO1YYZrItbtFyl_RcJEZ81ao9tsqTXQb2wzLJfLrJl1lC4xHD-zl6cJPck1BsXEQ/QRp_1FKJZDJBt-W2yQm7MzoIzuJQXbbWrTSsfHhog9Q","width":3000,"height":3000}}}],"Authors":"Kameron Hurley","Readings":["recZx91Ie7mKO79zF"],"Date Added":"2020-01-19","ISBN":"1481447963","ISBN13":"9781481447966","Genres":["sci-fi"],"Author Background":["by-lgbtq-author","by-women"],"Number of Pages":356},"Rating":4,"Read In Year":"2019","Page Count":[356]},{"Id":"Mon 11-25-2019 to Wed 12-11-2019","Started On":"2019-11-25","Finished On":"2019-12-11","Book":{"Title":"Ninefox Gambit","Cover":[{"id":"attzn7sPTYuKaagi2","width":181,"height":278,"url":"https://v5.airtableusercontent.com/v3/u/49/49/1768197600000/yd097_qDIENbYr2Znh2JWg/9RM4nRDPwYi8FDTteOiQQ_TlAajhlnf9m7jrP0tZ1QEC8cnRERnge7hEuInMhrR9BX11z0ObLP9JSwFBVYF187vw9dCqHaIrzA2XmIGjp859TBiXQ7c4TQwqfqIb2NYFuX_elBWBaSvOogm0mi5Pyw/9M7AqnRjpozA4hwDrho49AVfoWn0MElzoFGnx_KsoUo","filename":"29503206._SY300_.jpg","size":13682,"type":"image/jpeg","thumbnails":{"small":{"url":"https://v5.airtableusercontent.com/v3/u/49/49/1768197600000/XIVh9eAwqnCefmXRawV-OQ/HmrsaW05_f671D49WpSLTa9T_J5-E-wXTxRpqdE4RClcRa0Fl7a8smFOhnnYdv7C18IWrgOSazBVqAb_e9QJR_SEgoWJEgeMzdhPBiXCGjuqmdg57Gq0rJnu0_1NqpBU5MSZTKZtp7AULYIXlVEHkw/7EXbXl1eV_hE19wTTa6gjopLQylTFZOfCzF72gqYscM","width":23,"height":36},"large":{"url":"https://v5.airtableusercontent.com/v3/u/49/49/1768197600000/vF0DGi3Gwqbgidf5Xy5Exg/QwXMaSGGYofvMl3xAHqpIL0CKrRSaG2mkDJIimaiYQ7FNqaCex581TnikMxirDTiiu7e4Kfa_KT2kh0f9Qgz_Ut6kMhwQ_P2_kJfhwxyX2x2Gyfrj2Gd0-qjCdxHSqmA7i4bW5yieBisgMsRsd41Fw/C-onsR_tcSmtP-Ij0vChM7Bdwkrm7EIvqKJrUx9ULZk","width":181,"height":278},"full":{"url":"https://v5.airtableusercontent.com/v3/u/49/49/1768197600000/0UxCdcVzDotzW9yDhtRZCw/tDN9zMk9aGYGol41NlBQQH4XdP-TrRg9NdNFDsbd209gx-R8GZ3bqBZ9hR7moJM_F3b-P0jjkLwYMCi6Ew38Dl2CuOdEPGAytGNVQ-QzsfKX38bMuaIqMKzLT_3ni2FyjsTd_qtGRyAnEFf1d3ki-Q/7ADrNvkuf-0D_GuPgi0gLsYbw4I5uZwIM6hJHJjAtks","width":3000,"height":3000}}}],"Authors":"Yoon Ha Lee","Series":"The Machineries of Empire","Series Number":1,"Readings":["recdvDBG19lIrzJrp"],"Date Added":"2020-01-19","Genres":["sci-fi"],"Author Background":["by-men"],"Number of Pages":384},"Rating":4,"Read In Year":"2019","Page Count":[384]},{"Id":"Thu 02-21-2019 to Sun 02-24-2019","Started On":"2019-02-21","Finished On":"2019-02-24","Book":{"Title":"Dauntless","Cover":[{"id":"attkNFhuk2aBrs39R","width":185,"height":300,"url":"https://v5.airtableusercontent.com/v3/u/49/49/1768197600000/TkNJiemmK3Xj_80-Fk04kg/YjNL2tKO90DYVYI0CFoSFuKG0IY_rZLPV2jcjnwO7zBda2AK7AQeCiBH5AnA34Gk05Xz7Cg3b1__cU0V3nGRij3-YrR9hhlZPfXdoyg8vVImhXaZN15--_bwE031qSZIfgvYPpVX0qT2S8G37K8jYA/DxK-psPPCA-bWi4vbOFSCb2DfQs6rs8SpxrFPbbABHE","filename":"112292._SY300_.jpg","size":15940,"type":"image/jpeg","thumbnails":{"small":{"url":"https://v5.airtableusercontent.com/v3/u/49/49/1768197600000/UKKyTnGb_z8WiNJJknotow/04OTbvFlnz4Zqzk8mI8LBeaa95Z6Hx96b1OAnS4NPO9GwccNLJ_4hR0kgFKOxKjfvwAv-axXZoRuLlnWgjPE8qAfpRZat-aD9Ct1VAb7sEs2ub8oJHmNobWQGEPfIAqe03mfvX3gUuuT96iEL8jo-g/5q1J_5y1veIsMwtfyR2B6bWmVmh229_sD2dP9OKdDc8","width":22,"height":36},"large":{"url":"https://v5.airtableusercontent.com/v3/u/49/49/1768197600000/U2GaLuaD_roWwOYnUZOgGQ/Zsh2l0kQv0OFw-eduWFuGMAXCAsNMF4IlhVaxVBhR93h4YQMedMyynqU6AgujQGYfAM2odUlJ89oM97DmSvn5ylgGKAe3Dk42vo5ekif87M-wUbnK-p34xBCnAMcf8NenuKfWED0E9jcfxOc6-pKig/OTJnbxJ_4T2_CFL2xmbuxpv-JbkvT5DRJ9a0tiJWTD8","width":185,"height":300},"full":{"url":"https://v5.airtableusercontent.com/v3/u/49/49/1768197600000/RJDRGsS_tWVwepe6xpK9dw/5oGVcpMMs1Aact7TtzVCvhvhpq-phJjlyRKAcC3ZrqzMPWDHiClLX3-BjOohnQaw3BFwZg5ZGNrhNNcUlHSmeY_ggR-QhArSjTkNCY87G0H8bYQDxBWr-RzSOPicjtOgG_caEvsvWAVCuvzun8oV9A/VJcHaSSqP3xikHVTM7cSpqRnlrgfs_fJHqByvMkNUjA","width":3000,"height":3000}}}],"Authors":"Jack Campbell","Series":"The Lost Fleet","Series Number":1,"Readings":["receVjgP1Hea7iiCy"],"Date Added":"2020-01-19","ISBN":"0441014186","ISBN13":"9780441014187","Genres":["sci-fi"],"Author Background":["by-men"],"Number of Pages":293},"Rating":3,"Read In Year":"2019","Page Count":[293]},{"Id":"Mon 02-25-2019 to Thu 03-07-2019","Started On":"2019-02-25","Finished On":"2019-03-07","Book":{"Title":"The Rage of Dragons","Cover":[{"id":"att6AteepZ3p1Ictj","width":198,"height":300,"url":"https://v5.airtableusercontent.com/v3/u/49/49/1768197600000/vCz-PoN8u4M0auyI6KGeMg/R1kU2RIpEoEOWDtI2gcdyqIHVmC_6ZbCqOd_x8DTPGRDMbQAgwsZRw6z4uuNYWVdGnaBNn7GNaBtvhJUZhK43ME0BPW03wFZTGF1HMH9rdwZ2RBy3pWgvW8ON13juF6Ce8DZY8mmT545CzUi9yxcvg/npqobs-dQIn9RTpmuCVyRySC7jILMu-E2eZNz9TmGcY","filename":"41952489._SY300_.jpg","size":21382,"type":"image/jpeg","thumbnails":{"small":{"url":"https://v5.airtableusercontent.com/v3/u/49/49/1768197600000/wC49H_tuBF8T7drwYXl58Q/CrkskLJ3KcQ_STa00WVDeYyPmf7maheMVqCAmNPVFBy45HcPfZj9BkOeSleQ3CKlxpbxeg75xZtRuWJv85xdngef4ntVYVEAFbcqe-c0A0xoS4u32LqO-qltrYuaqt4Kh9p8t0WfAaDqq8n3KsfrIQ/P8WCIixQBnO_nQsd_Y9R56Znl6AMppa9DhSvNKnUFiE","width":24,"height":36},"large":{"url":"https://v5.airtableusercontent.com/v3/u/49/49/1768197600000/vm3HYZX8Bwpd0z_FMdhC4Q/wgy3wxH0HIqX_h0REvAdI4hv4JSTMpMXNu-gI6-K0GneOxj-DDK3UlztMCKuiZAFc8oFJlkB-qWvyo5Pr5T8gbE5POE4lKqNiwrIynGe8e_NRfWF95hEImr0zy__LakP_9NfcSxr7MqFCTbUFW92AA/7DrisCHhbzesfj5amYrSvkwlgtTHdm6GxhuhM5rqOd0","width":198,"height":300},"full":{"url":"https://v5.airtableusercontent.com/v3/u/49/49/1768197600000/gGGsMscVukBOD7sstsTJQw/WR0DSNuKI1Q8CRTntCTZyMpSC6LgTBVu-HMF39YtKaHxGDSJhAm7145Gq4JdUZjmuOzBfcxI8ePKixCMJIWboZZesTPQVLYpG6-ixXNgiyG5oCZ-RdfBKwOsBqeWCLMapzTBV2Req45Os8WOvMnhQA/TkpCpeu9S-B1gErkSHQKOuYGFTQX9C25i2pPFuurfPI","width":3000,"height":3000}}}],"Authors":"Evan Winter","Series":"The Burning","Series Number":1,"Readings":["recgcgZBCGl6PYOcP"],"Date Added":"2020-01-19","ISBN":"031648976X","ISBN13":"9780316489768","Genres":["fantasy"],"Author Background":["by-men","by-people-of-color"],"Number of Pages":544},"Rating":4,"Read In Year":"2019","Page Count":[544]},{"Id":"Sat 07-13-2019 to Fri 07-19-2019","Started On":"2019-07-13","Finished On":"2019-07-19","Book":{"Title":"Writing to Persuade: How to Bring People Over to Your Side","Cover":[{"id":"attqmQq2aBWcapzUX","width":197,"height":300,"url":"https://v5.airtableusercontent.com/v3/u/49/49/1768197600000/X_r-QoHKF555FH-xj_qJyA/rHMffnErLLOBvHkDLt9aQ5HJN8wvq5E0IEc9y_5OjQlV18cj3KXRueU54GEA2ee5m3YV4mzx1HwRlZ7hGjQiOlJzWCBW1tU9ZRVZjNaFlGANNK-hMG5xMJyreX6073XeXp2JlbezcdnScEDYz3s9qA/gFvGf-gY_UAOdx9tPYMcmEuU0UnI8kYTvWbrYbiJgeU","filename":"41817516._SY300_.jpg","size":7799,"type":"image/jpeg","thumbnails":{"small":{"url":"https://v5.airtableusercontent.com/v3/u/49/49/1768197600000/R4rYv_g_wd3cKYrVwe77FQ/0NybSzVJN0b_qKlZ7FQw4Nv8Y9f2uae24ahfXSUZWmJYzKbfaAUCbNppeWSsigLfoZhlCnwSayqyxosgvcPCtIPo0QrqjY77ccPNE92lBC2EbQfQnpyAXhtpmd7cGi5JNmn0P1NjzpjDcgp1uw-P9Q/LQrqb80tPvouN12Jx0TfJhqBLR7pyWxzGoUKPGBegFI","width":24,"height":36},"large":{"url":"https://v5.airtableusercontent.com/v3/u/49/49/1768197600000/mMB5AybYXs3nLXSxmSPBLw/xEArCeR9fy8CIqe6_n2X0ZUblWS-F3uqe7vpnDiLr92-3tZ3cfPyyeAucObIv1HNvHq4TyePhrbmDf2G9_-UazkGg2_0q7UzWlM2ToefMmjxSClwTps0qzWOBCuXP4nlZN5Cy6f-o_FNA6r5xYsZhw/sqwsFPWf4alSSZJfnls67nwTLmdkYTUqv8DleZG48nY","width":197,"height":300},"full":{"url":"https://v5.airtableusercontent.com/v3/u/49/49/1768197600000/OzuDMBuLspmiwZ1jKf0PIA/NEqgoC5VhqYWOyWT7Xk4G27lxoooa5eMHV4e-GhkFYLTMVskWAfL-m0WtxybYTb3AAk-ZW-xXvTGKg5FKQFvapU3IW-e9GWm5aSpQ-hjoASkc1_G0ecaRSaZRx0-IrbKWgACe__ESL4uzMvYXjfMKg/shJxwF_46PIlxR3aFDYfXRmEEGSgTE9kl1cbRq1wepk","width":3000,"height":3000}}}],"Authors":"Trish Hall","Readings":["rechIkbLZujy7s8C9"],"Date Added":"2020-01-19","ISBN":"1631493051","ISBN13":"9781631493058","Genres":["nonfiction"],"Author Background":["by-women"],"Number of Pages":224},"Rating":2,"Read In Year":"2019","Page Count":[224]},{"Id":"Tue 07-23-2019 to Mon 08-05-2019","Started On":"2019-07-23","Finished On":"2019-08-05","Book":{"Title":"Children of Ruin","Cover":[{"id":"att5HU3dNkYJMgtZe","width":195,"height":300,"url":"https://v5.airtableusercontent.com/v3/u/49/49/1768197600000/n_1PESfvCVXsEHBpugrsPw/FKaHi5YHV3emdg_5JTVq3CDAwz6t0IMP5RjOI4z-XshGQdKrGDPZgd6U0mIThxsxwQpB7Po6Wsm0ykO-EzTLaspuOoGAUloXpcV7CKiRM8jkrm4NsWPD0TOfAjJtzsBPlKuOHcqGZokQ6NVsHAEi_w/gcnwGqEVaVt-Qv1-yOsbDN8XNJKIBF3ln4prdkEquGg","filename":"41721879._SY300_.jpg","size":19849,"type":"image/jpeg","thumbnails":{"small":{"url":"https://v5.airtableusercontent.com/v3/u/49/49/1768197600000/v59egr-Ul-iCKqIAPD4ozQ/spzuck6yiWg5TkdpWZe38hcPp5PrRZKuUa4crYW2Nk4RKMDSfhN9AS9sqv5xjiu8nRKqLVlGVKJtdBATrr0u5keHq7Js_vzyDDiGuv5hr90g0K629WfXgj8dzDk3AuAtHgpequ4GRedOOMJ5V6vQyQ/voaEpPvIR42sNt861Wyehd-UzDzbcQabiZtReUfC_uY","width":23,"height":36},"large":{"url":"https://v5.airtableusercontent.com/v3/u/49/49/1768197600000/D0xD_d_JzrEQ7ilK7lh4eg/Gq-d-nvcbj4NCb-maAbHqh9tzmY6RRBeS9ysWkMhJ7ERdw0CcgxeW_I3oafz42bsPh2K5uJ2gKS9uj_Ddiq9cxN7nPq-DjwnsbweTLS8n1SkiFmyQSRW7C5bq0EKpnMwYRYf5rQ7BtTTRZ7PWjmEEg/4nTLOo6gKGrsv38KTKcA-lN1NcLVHDkIW20G7xcbreE","width":195,"height":300},"full":{"url":"https://v5.airtableusercontent.com/v3/u/49/49/1768197600000/74E2QaXr3VmnTnXDuYzwfQ/xJ-kbYjdO-Yq5-GrVptJyb38IaD1N-fACajyXt9-kMLIH_0r_qyPAXAUEOo5ZWpwHoM0_epx2aK1uowNQOnQGJKb0Msdn4HOgvcLyfMa7co0je0PntfLfrlpFmB2GRLXkh8Ey3mZBjVXkQaKq7BwEA/fAYeXYNQtVDCv8zdbdFR8EBGQMNgaLXuPl7MnunBFWU","width":3000,"height":3000}}}],"Authors":"Adrian Tchaikovsky","Series":"Children of Time","Series Number":2,"Readings":["rechcTdqbnSoRYKCW"],"Date Added":"2020-01-19","Genres":["sci-fi"],"Author Background":["by-men"],"Number of Pages":496},"Rating":5,"Read In Year":"2019","Page Count":[496]},{"Id":"Fri 09-27-2019 to Sun 09-29-2019","Started On":"2019-09-27","Finished On":"2019-09-29","Book":{"Title":"Indistractable: How to Control Your Attention and Choose Your Life","Cover":[{"id":"att4ZyPU2h7G9nyFn","width":300,"height":450,"url":"https://v5.airtableusercontent.com/v3/u/49/49/1768197600000/SuDQ1m43v2qdSEYCAcrnFA/JdNX8I4yhuZl8SQ9jAgFbCX_smECCvele2mPWaFdzGGBSyMjsBwzcFunN0EmBXLonzdPWk-oAUOEMCS0-hYm9taOoCx5WCY3Av3cMAGiNTLoIrwT1mJ54w2MJKphvFz6wbQFRAb9m7XqgaBj2mplcg/bL9NfbJYiVJRDPhw2D4pLYfv_ywVZIDhAP4Fnyq0T1k","filename":"44595007._SX300_.jpg","size":15137,"type":"image/jpeg","thumbnails":{"small":{"url":"https://v5.airtableusercontent.com/v3/u/49/49/1768197600000/cWaVt6ZWZBCIHO3Oa7fbWQ/Cw5gKCGKSMTXxlY29LsJNTzBx07FPELIbvyx0bP78HwJVKGsNki6IS-4ScWlzbNw_W8ubi_I6JiU4i8iWz2Ud_8qBPti_BC159OJIbP1_p7gcqeL2idyxfkQPlXoLqrmSneeqEk8uMBskjzRhRy1MQ/MpjCHBSULOYmTkrtymxlrkGiGeDd8A0orHqxhkh2M94","width":24,"height":36},"large":{"url":"https://v5.airtableusercontent.com/v3/u/49/49/1768197600000/jBEtNbvS6OiM0zy8kb3AYQ/6emg9P_Kwh5MFgjvZg8rO1NP9q3gXieIUkUSLRNoOQwTcMOtHdVkpx7ch0VnpyeXgh2AmeF-HpSt93653b9XkUbp0AgjtpUDoap6L6-6IcYMKuDgorVKMc3FPZ6FrSsanhEnNH9-aWd1JVcVF1-x6A/ceYExQz-OH8Z1wMpJUrg-FmRI0gB92K1VVygF7OdUKA","width":300,"height":450},"full":{"url":"https://v5.airtableusercontent.com/v3/u/49/49/1768197600000/2TQHoeuMpyaxCC7abORCsA/__F0vwQgG6bcNReMb1GDsuTx08QN1aTonjgRGCwJRiUmIDPzGki8UKz81Ry6MGukyASq6tXBEe8nRmVzFnPWCpxeNzqZs7bsMeO4lLMSNlFdf6FVtCdcQJ6aoyOs9dsrEeOdOTopV6HvJIaegFhIqg/fVeGBXWf-GyzTTlbEjZFi9AfUpj8Au0CsyvTzmeE078","width":3000,"height":3000}}}],"Authors":"Nir   Eyal, Julie Li","Readings":["reckllVXQnpMJIEZw"],"Date Added":"2020-01-19","ISBN":"194883653X","ISBN13":"9781948836531","Genres":["nonfiction"],"Author Background":["by-men"],"Number of Pages":273},"Read In Year":"2019","Page Count":[273]},{"Id":"Wed 03-20-2019 to Sun 03-24-2019","Started On":"2019-03-20","Finished On":"2019-03-24","Book":{"Title":"Stand Out of Our Light: Freedom and Resistance in the Attention Economy","Cover":[{"id":"attJf29H0UqEWIUGa","width":199,"height":300,"url":"https://v5.airtableusercontent.com/v3/u/49/49/1768197600000/PyGmc3hmo8SOtMnDCMoWeQ/44S9eKbV6gV2CVVJxBcjcU-5JYUK9XP3Wuos7QKyhvQIJxKGtd6-KhLA722OnTVNFWUNEbp2aDnC4Qe_Jig-In0pgOWG_Z56dLFC92O--bSMXMH_SjaSg2yVk3Tw0h5qOUDsuPQCJpmRtLVrCW7WIQ/ven2mwOaac0Og2YW1UpZm_HGayEKts56_je2yLPdVgw","filename":"38364667._SY300_.jpg","size":16211,"type":"image/jpeg","thumbnails":{"small":{"url":"https://v5.airtableusercontent.com/v3/u/49/49/1768197600000/c-CkJOl7irWmdVStrlJ_uA/IT33n67HOoKTQx-i_0VI6uSMFtrTvk36o0A8JFjJ8cHjjjlWkoPuVaJq_z0OteOzrUSoMDBv1BOkZNS2mIHU4ebR8sLYiP52-Czlj9TyaZwq20TRSNO__bZbj50BCwvHiymEzrkP4h1GlATIK-zpFw/2dg6i_GjKgoBUMlpowEBavk-PRy2OOYBskXtluxuLMM","width":24,"height":36},"large":{"url":"https://v5.airtableusercontent.com/v3/u/49/49/1768197600000/T_UcjltqIK_Sy4dSABpOoQ/fSqL3sJGjOrKgu6dARsAP_HcyYVhlAee7eiIzefBxKOVQSNpLHWRO56PEbPqgJWoKIn1ZUjo8wWBNmC_SO2_F9mChSmCpyfB3zlki1DW9SE0ul7EtBNv9MUBtDDA2Q2HtuLH18hoRa772ciXltdwJQ/tyoh6D0uZHYRPmlTykvlvF1c1hgW89jTikSVTxi0K9Y","width":199,"height":300},"full":{"url":"https://v5.airtableusercontent.com/v3/u/49/49/1768197600000/mXHNHtEZyI8lbtHjAqRHkA/sfqxbADXEP9kOPdm-BsSj3ZMmXiqWZFpiDiQZyb06LO3ASmjiOLoLBkzo3wvq8aQzHR1dfYlVXiGJ9WZ4AOp3j2yQ_o0vHu87mdKBERI3grOVbHsvE-VnMDWurP71MfgtAawADqA2pG1lMDX2qy64Q/iBhSCOs9ikQMq1LuN5HYfN4zn8iw85zGhNFr0v1Sq1s","width":3000,"height":3000}}}],"Authors":"James Williams","Readings":["reclLAkYqS8BCVZy3"],"Date Added":"2020-01-19","ISBN":"110845299X","ISBN13":"9781108452991","Genres":["tech"],"Author Background":["by-men"],"Number of Pages":144},"Rating":4,"Read In Year":"2019","Page Count":[144]},{"Id":"Thu 04-25-2019 to Wed 05-15-2019","Started On":"2019-04-25","Finished On":"2019-05-15","Book":{"Title":"Lotus Blue","Cover":[{"id":"attFEILOCy3VABf3X","width":300,"height":450,"url":"https://v5.airtableusercontent.com/v3/u/49/49/1768197600000/b-I91ahm0Gf2d-Li7e6AFQ/Vh6Gl5FszbIeTEWolP9Y0rdm2KaJK-_QVRDws2hK1cZyv0wVrW0e3e3ZEyeGzKLoUoNzu7o3DwG9xEArhCDpSJvLX67Lp53JKVo9jAv0ri7UXL3QprhDUzQE6v7BQ8VmzBMKVe04hFnh_Qtt9Dxb-Q/rk27eMaIsPlpsUljxX9E8LKjx_f5PZmMRq7wQIIh2kE","filename":"28695584._SX300_.jpg","size":24829,"type":"image/jpeg","thumbnails":{"small":{"url":"https://v5.airtableusercontent.com/v3/u/49/49/1768197600000/_UBVUOYRI-RgS3KGnHDiQQ/9qDiHlnlCoUpLwipNzdxXZNmOcHvrz07udsyr9XJflbCdDrUJPysIFyyjB1AYLgRuqcssvtisuAJhbKqRkutif2Q9F-RZ78L6PSHoktMgJDXViJFzXiZmxiRl2OV5lWQW-iMU0WF-ZNm1yqllWF0Gg/JDOhxZfhCmNpiv4Zq-TEXAYIfJkuI6NYdVPLE3RnFMw","width":24,"height":36},"large":{"url":"https://v5.airtableusercontent.com/v3/u/49/49/1768197600000/fatA0FcUNl5GLbKGU1a4CA/cQCxxfHOlXC8tiGhjnuI4hLBiD8oWrLY2DMl_vCjGEYVbH7w8RQvSERLSqvfS0fqEsJ20LrSNa3N0stBxWN0AG087tT4psaRu48cXZ8z8YGDOHEQ-Xlz2PBFYnGzUZ1dl6KbwllbVkCtKwhB3MZkGA/D7caRFgjMQC-q8qzSUtjsO1O9y8bPBbuztdbBmyY9Qo","width":300,"height":450},"full":{"url":"https://v5.airtableusercontent.com/v3/u/49/49/1768197600000/Iq7v0BI5tMz8cJOaEJgZ8g/U45ZwISP-aoHleZchi3sCU9kH_zqy4wA17Be7x4tdFPIOaZHFuN2cBPySdWgBGm-OCwVK8s2mAHp8TUt0TWusBl0GXHrMCUGB-cqXGrgqGxIGxvrLitb_0ChMO8niaJcFJpKuZgu-4as7ny2wH0soA/QQl2n0yLxowo4nQzIE26vu6JdMOpL5no_0xgo2TArC8","width":3000,"height":3000}}}],"Authors":"Cat Sparks","Readings":["recoEZY1j2u7K2gtc"],"Date Added":"2020-01-19","ISBN":"1940456703","ISBN13":"9781940456706","Genres":["sci-fi"],"Author Background":["by-women"],"Number of Pages":377},"Rating":3,"Read In Year":"2019","Page Count":[377]},{"Id":"Sun 09-08-2019 to Fri 09-13-2019","Started On":"2019-09-08","Finished On":"2019-09-13","Book":{"Title":"The Calculating Stars","Cover":[{"id":"attuIortF2toFQXEi","width":195,"height":300,"url":"https://v5.airtableusercontent.com/v3/u/49/49/1768197600000/VUMBquPIWeRZzoGURaSnzQ/UKxSoAuMSuow-Y9MdV5-Cwu244rzXjF8ge5s4GaylsEXmFi2ydp_stpCNYFN8s-6sICr9TBPL8oVUbrM1qO9yAKQ2fJZAK5V5jM2fF4vw9uHiJ73Wd-vEh2hGLs2qAFsOqM2KBexj291oEEiQ3Bk8Q/Q4TOxJn1BFBS4xjZRtmKWYCI3ZGqdGGECsOtT7VCEu8","filename":"33080122._SY300_.jpg","size":17216,"type":"image/jpeg","thumbnails":{"small":{"url":"https://v5.airtableusercontent.com/v3/u/49/49/1768197600000/7mXwO8ZYQ5swMShsXFR6gw/GmcqyIidn6oL0T0EHK7jKfREFgwC9zhXH_wPfkD4rqroxpVo79vEJSak8SgH6YQ4LC1VwFWWu8DLVeBMhoDi5a_WjkVplfERRV4lLtLintnsdVb1QKx1FmlvXBCWDMiEwKR2stjVH1_ON3u1imJQFQ/wgv5gbkISh9omsQcW8fnbCpjMtmtbillwRYg0UutH_E","width":23,"height":36},"large":{"url":"https://v5.airtableusercontent.com/v3/u/49/49/1768197600000/NzBMZVnEi0hCqBbrnx6E9g/pqQYQOZ9tqvNYB3Ci1EBkI2G3e6PS894rvcaq0HkTjjl_b6sOtVdlJUVgUIPo4qX9EszG-epId92jbmmt7Aa_EX76AswGK2d3ttSXMYv1B50ROcb8HWJz8eFJwQJyyySpNkNYQ7m1sknN2dJRphHYw/Q4O_Ru6f4tRTUTEg9kNGiiXrmzNNDsVk0xbIwKn_fWk","width":195,"height":300},"full":{"url":"https://v5.airtableusercontent.com/v3/u/49/49/1768197600000/S3OxzAGJZwLCYKwGrH-xhg/IrP5H7w0nLXx3TR3CiwllGEkWCKxIHw7YjYuq_KBAr7zdL-tly_5L9Ma0EBfeMhtAtS2wmhvmAMv9Vcjg84vLTlA56cWXLpLIBI5IepG2i5dcLX5cC9KU7o9lWKY6g5olp00P-VdpmclFK7Wf6YkDA/UbBlswh-JxYvLM1Mx-fy-4ZMVmAHzD0DUax_ljbe11w","width":3000,"height":3000}}}],"Authors":"Mary Robinette Kowal","Series":"Lady Astronaut","Series Number":1,"Readings":["recq86S8Gorz7IFk6"],"Date Added":"2020-01-19","Genres":["sci-fi"],"Author Background":["by-women"],"Number of Pages":431},"Rating":4,"Read In Year":"2019","Page Count":[431]},{"Id":"Fri 09-13-2019 to Tue 09-24-2019","Started On":"2019-09-13","Finished On":"2019-09-24","Book":{"Title":"Gideon the Ninth","Cover":[{"id":"attl7WZIQO9upbzkl","width":194,"height":300,"url":"https://v5.airtableusercontent.com/v3/u/49/49/1768197600000/7dYuF5quL59KOcGIVeE78g/Hg6dJJO4Gyx9cs1t5zQX-t1YhAJBBbrjxZ7B9R5MnxmuXhyaViPwX6pyp0jeKgAF0s_Wgq6lKGwvqzFjRPd2lqWTM_PZpsD-BcwrAU_xVji0-wC4e16IhhLmGjogUZmGxwjEHoxyQ4oasD6pdofsJg/rpvJWorDM1eqfDDWEOXSe4AeKSWwT7bL4sXOMIoCmxw","filename":"42036538._SY300_.jpg","size":16821,"type":"image/jpeg","thumbnails":{"small":{"url":"https://v5.airtableusercontent.com/v3/u/49/49/1768197600000/AaZH_DWzMfoeFnEGse6AMA/b9hAVOVNodKdOcU1b31vU424qFHnF_hR8cRbn37v3fh-cH3_TPHqMKWsS6zMY1FgNXM1dUQgMUTUXWtVWqzge_mLz_iSYSlyrOezjyIwUucCHVMVfq6ZhZhA1T32vYUcm8DLz-G0zeyRqM4MPxUU2w/4L9T9co5mnOrFB7qsPhdQ5T7TakRoEd3df49nPVzeLY","width":23,"height":36},"large":{"url":"https://v5.airtableusercontent.com/v3/u/49/49/1768197600000/o51kEfM9fxqrMLZyIc-dmA/q5DjKKEgI1Xg53uBOB-qn3JMbKjGjYuyDTsH7yxqKFZIhXSNr2D-TaMJ0fKkXPgJebKWhrQoQMDORHiHAgbvELwgijFwCYQXn_8ieqyshUJraKyXBhJezd3-ualWenCsyMQcbcnxOHbG4MjMq31jwQ/0iiYFo0J4sZDcP_9cRiWZb0z9Zf67YQg0rOmaB1-JZ0","width":194,"height":300},"full":{"url":"https://v5.airtableusercontent.com/v3/u/49/49/1768197600000/EbyFsHkbpgjAkEighQlrGw/XNq9WlIVqOeG7e3VbGadtbevARAtJOxyYst377gUeeavcC3BbsXpYAU5KitV7DZlUpcnSfZe4_KdkPlup1AiZGIdAP_xzJhfKCB8BH802VNoCS2ZW0aCvzKORGFO1qlbTCiuvyzhnkaKyfGQTU0l0Q/P2WJfn8xKSL8dBv7vBlGtBQ9hw-acPa8tp1urdf3xpA","width":3000,"height":3000}}}],"Authors":"Tamsyn Muir","Series":"The Locked Tomb","Series Number":1,"Readings":["recqJ9PA2SUNcPtUd"],"Date Added":"2020-01-19","ISBN":"1250313198","ISBN13":"9781250313195","Genres":["fantasy"],"Author Background":["by-women"],"Number of Pages":448},"Rating":4,"Read In Year":"2019","Page Count":[448]},{"Id":"Tue 12-25-2018 to Sun 12-29-2019","Started On":"2018-12-25","Finished On":"2019-12-29","Book":{"Title":"This Is How You Lose the Time War","Cover":[{"id":"att19kwXEy9qTxlBw","width":300,"height":448,"url":"https://v5.airtableusercontent.com/v3/u/49/49/1768197600000/7GRis3vULipxc15HRzsOkA/CqMihxxKLNvb1vaD1aVjXdFQudMOvGLVHjf-8C4evWhsiQR8Blb2bIIYKQaTSVtdVvWpYC2eMRNaIukE2fBmpaWHds2bssUjTN8tXDMeEmDlHM3xv3hKrVTsl-oKfszyXZmyvPq_JUMPWK1HisEOQA/Cfu6Th6YkvUS7o-FOIIbI5FmNu9vbQJPvyrpAT9PWgk","filename":"36516585._SX300_.jpg","size":23391,"type":"image/jpeg","thumbnails":{"small":{"url":"https://v5.airtableusercontent.com/v3/u/49/49/1768197600000/eKY08ITEIRyJd9HIJ882LQ/ovtbSMl8ZwioJcYQUaJPQ5W1QVHHkXHmnPz-fO1f8EhxdYenIPg7UrojYLpMH9Utdc4vxEaRzMnwqEj33c0j7EFKKMAqsnxWL3v4_lS92hN9CHf2o67DnkGEab-QdVvYp7h_HCdX8Vfgn_QUdz9EUg/cCvyuJPcPHBX1XKUoNKl7hIU3Y_aZCyF7yaoxDJvNIA","width":24,"height":36},"large":{"url":"https://v5.airtableusercontent.com/v3/u/49/49/1768197600000/zZ_9uCNmbGsy2AGBt5k56g/E0a7MM8guWYHqVSo_ghEpYHvxwNdy0f3VnQEaO8WFay9tPxPJgd1zkxtp2gPEK5V2j-U15BL5EyQoBxu5uonDVdEgKXZTIT_jBL2ty2pytIA_o7oYFeX8jW4XjZbvy_BQ-3GCODeG6cFQuLtZjREOg/_4uICAhsYQMac03aJqwZih802crFfNNQqvizWu97wvs","width":300,"height":448},"full":{"url":"https://v5.airtableusercontent.com/v3/u/49/49/1768197600000/8NBrC98X6rX6GFCzkTaZLg/4issN1xcjVr8ZyLfhok94iswa5TMOnkK5AMcEWRTXnliy1YUfuO3BVnosXlwL3K-6Z5VvEf2aBwH1cCI3zxmbCBlNDir7k9Ek4MkdujGdWVr1VE9Rhj9JhWi4wJdqH3bZkCSYqKFdXgfAfUgU3ofsg/sOfMDkrzZbGCLGNgvHpKe7U0odiKav7OE_CT1OoQNLg","width":3000,"height":3000}}}],"Authors":"Amal El-Mohtar, Max Gladstone","Readings":["recqgHuwpFnk6sy5u"],"Date Added":"2020-01-19","Genres":["sci-fi"],"Author Background":["by-men","by-women","by-people-of-color"],"Number of Pages":208},"Rating":4,"Read In Year":"2019","Page Count":[208]},{"Id":"Thu 10-10-2019 to Fri 10-25-2019","Started On":"2019-10-10","Finished On":"2019-10-25","Book":{"Title":"Because Internet: Understanding the New Rules of Language","Cover":[{"id":"attBsNcrZW5g66yMV","width":199,"height":300,"url":"https://v5.airtableusercontent.com/v3/u/49/49/1768197600000/IMiXaLl6q1aTsFZ6LYxN-A/acbn9rdoSYr1qp4-y6AiHkU0lKi5Ifhi_oEC_X9jeJHgEnrD8mDloPRRDI3rIsVsWOE6af37wxPXtlZaKR1h8AaIu5Oy1nAJwNxeXkKHxuxEhiT9tGqfHxuToxQHnJLUCgG32zxdxuBzLoY1g9cUtQ/1jMARevI8mffk6MlJqtGFM8JBoQv8ZApmulnh0j8U5w","filename":"36739320._SY300_.jpg","size":15369,"type":"image/jpeg","thumbnails":{"small":{"url":"https://v5.airtableusercontent.com/v3/u/49/49/1768197600000/HHvsYwDKzxNYApyr2NrH1w/f8ga6_hoBPrUWA2jJhcCuLxQ9ZFxet7ooc2UwGC2vc52ooeUPJs5QNMoFU8DxAYB3tg6yeLBkYfaAFF2hseWjJnyrBlDvlr51eKLNkRlUQtjGAq5tjmDw8zOyTZeMJtbGUMZbs3yOKYqXptYg-2Tqg/DFg_7T05pvpSiedRtI_VqBnWVRSDOAKDynMEHRZmwIc","width":24,"height":36},"large":{"url":"https://v5.airtableusercontent.com/v3/u/49/49/1768197600000/yMOVjy3AjImcL0XMCVBUlA/wVAcBGCEt_ZR4U2PFmjG4fzF-8RRr4KmsV18a0dBKFcQtRr9XoRrU3c-nFKHArFmFTmItfHtMDLS9cKmdL0ruX7_r8x1oN7RbEj9SgUXpcnk-sc8WXcW8VA1XFNt5l7VHIcJi0jcZ33Us3Js5ZSIYw/BEobOznqlU5YXAPu6S2Lq9B3o3dOeQKx4kqPYNd9ZCQ","width":199,"height":300},"full":{"url":"https://v5.airtableusercontent.com/v3/u/49/49/1768197600000/qapQvYH8pEm1ish6hOVVvA/-4lrbuMjUyGItJeq1Er2V5eEAS1gkz3pYB3nbpAIgvPzBq5j0ev1u0r8oQ_TAFCdeezeqThja-lpLo48z0bAl1jZMBcWc8bVqVA6mmITG51ZFZl3fr87236skSOct-uqYaEE_7nvHbA10knSc_BGQA/uhJKfWzkVweQ73txHNkMOuwMxY_6Ql2s89BwLFBgt5g","width":3000,"height":3000}}}],"Authors":"Gretchen McCulloch","Readings":["recsQMXJmQQmgyRbr"],"Date Added":"2020-01-19","ISBN":"0735210934","ISBN13":"9780735210936","Genres":["nonfiction"],"Author Background":["by-women"],"Number of Pages":336},"Rating":4,"Read In Year":"2019","Page Count":[336]},{"Id":"Wed 12-25-2019 to Wed 12-25-2019","Started On":"2019-12-25","Finished On":"2019-12-25","Book":{"Title":"How Not to Kill Your Houseplant: Survival Tips for the Horticulturally Challenged","Cover":[{"id":"atthI2gWVQ4EtPqRE","width":300,"height":386,"url":"https://v5.airtableusercontent.com/v3/u/49/49/1768197600000/Sz0Mt1ByaeiHNjOV75s8Cw/oA2jeks6-3zMw3DMsd7WC6d_nxbsl2fg4MbVHtmRiZalhlhkq1wzG-HMQTsofQbJDzNupSxcubjffCwiXV5-F3Y_GLDjxwJfZHKAS_Vg-VlAprX50ON6Y62UI3RzHJ0XofkvN3qr1JuVBiVL-LgCdQ/zApBUBP01TsKJsqSjdbSZ-HzsCEOS5yUHiL8AGSl6AI","filename":"33346824._SX300_.jpg","size":32118,"type":"image/jpeg","thumbnails":{"small":{"url":"https://v5.airtableusercontent.com/v3/u/49/49/1768197600000/B3E4OwLuurU53Uz8VXvmvg/sFCqvtwdGURJDCUp_gIS18-1z3MgwmyPHR6vwwwfB9nGdNwqxsqzT4hvo3nNaHo1FoU7U3V1wJ_cq1CieUTDLZn3YKavoxmgDMFw-c5DaXJy7JLUF0ocZk065hAInhHtpEvNey6nZD5i5TOZTV0rpQ/lRpGDgLQPZBwN_qJTMHNFtmQQjykBsNyx60QO0c2OK0","width":28,"height":36},"large":{"url":"https://v5.airtableusercontent.com/v3/u/49/49/1768197600000/TbvfZC554QKXXOVIfdr7gQ/oKAmkmnhjvg6iIvvdoFNQoX0mSIcuiihz4aU7qht___FIB3QhLFNPbF7GSB5DDaBYzuKHiMOzQY7ot5xxaW3OxoMZtD50n-IwLCh8PSVNQi2YvkDNNgOYMbRc5UiEjB7xQYx6xV3JiPVfZuFXdRyNQ/FpJQbhirzO3gid_YknOrYUfXeOE5LGCgrVdmFT2qyn0","width":300,"height":386},"full":{"url":"https://v5.airtableusercontent.com/v3/u/49/49/1768197600000/nVvAg3tRr8_zq9NssD25rg/7NUorR9KzEfWVbJ9phkH6O11wqcZnEEUAwJCqeIoMRvwt0XVoxNhtVGVA65Ux0Vnp9bQUs5VjC-mhcscMwQa1wXCgK7tFxxrp1RqWrmWQ17zhBBGEdGU_4hmrr3tAao0izkifWP23U565CIDug4Zrw/jxDbRbgOFrcxfFaS4ZxBAb2SDAmzxgo5u4rppgOQdG8","width":3000,"height":3000}}}],"Authors":"Veronica Peerless","Readings":["rectDnYnRUnoEBv2T"],"Date Added":"2020-01-19","ISBN":"1465463305","ISBN13":"9781465463302","Genres":["nonfiction"],"Author Background":["by-women"],"Number of Pages":144},"Read In Year":"2019","Page Count":[144]},{"Id":"Sat 03-23-2019 to Sat 03-23-2019","Started On":"2019-03-23","Finished On":"2019-03-23","Book":{"Title":"Tactical Barbell: Mass Protocol","Cover":[{"id":"attt86kSmWtP7Nz8i","width":300,"height":428,"url":"https://v5.airtableusercontent.com/v3/u/49/49/1768197600000/0MlQLmuo_8xYrkn8Ect2mw/UZeHBv3kKWFrKwDTPsokbZ-Il6GTskK0-9WQ8s4_3RhmxKZkSQ_JjVbrHOhfnskbiqF7CaQPqp10PB4raEEevL4KWXFOtz7aKsN3-T92J3ZWnvwED5z-dBRSkyeWdKNsrwSrAdTtGR-GaGI54z-dXQ/vSiAD04yyxFcBtrHy5HlaskvCpN2iNWaCxy_2KBIoYg","filename":"43194863._SX300_.jpg","size":25497,"type":"image/jpeg","thumbnails":{"small":{"url":"https://v5.airtableusercontent.com/v3/u/49/49/1768197600000/uIpXHxYRjsqWHgXx0f04SA/JN9DWFm2nZesGcuk4Gn77gU4pe2_3ym9uRbrvmy-lMJ1PwdQ8r15GLpCVkAIpJ54hGk9rBSHmu-LZunbV8xDBfMF8uLwUIsWucMs19ZGg8CY1WZijMdEiuAdQShWcjkjfCMGr7LBKy2VC-bpZzk-vA/SS11jqlpsjLTcCDaz7CiACjAAr25BtXMfTvDWb4cIPk","width":25,"height":36},"large":{"url":"https://v5.airtableusercontent.com/v3/u/49/49/1768197600000/WE4QV14kPNnqYwF_zKqkIA/lVxY24vbmOA9odwi4ZX56Qxyzn2YYQhMeLFLRNH87rBousP0oaabV2iFtiOxXcat77Di4L-hkAMDolbYTh01PJoC_3fd7V9nBFPID8wubhw0GOSVXJWptzSnFZX99NVr2z0q9WeW_4oUjoov4e9JSA/BT82YBpQvElzQDLOPlhnMGObpp2R1jApQOfl60eKQ7w","width":300,"height":428},"full":{"url":"https://v5.airtableusercontent.com/v3/u/49/49/1768197600000/3bNIQyXtMwXrZaMxIj-FpQ/_bP0aW5nqOEFE-amA6R4USuUxMEvomlPAeEjS_fR4P2Cj8WOpMugbDuLd1oWwfG1C39x9t6uq-4_RLf5RnksQBJThcXePCF4ts0XU-PMrMWPsykjdg5wXkI0Y84AB5BbAMQXK-CnBnZ0TRS1XI1VAA/fqdUcmQS2rD0BRlN6TFnyIEtsIURX3diODO-Jt7OPWE","width":3000,"height":3000}}}],"Authors":"K Black","Readings":["recthX4terFcoyFU1"],"Date Added":"2020-01-19","ISBN":"1999559312","ISBN13":"9781999559311","Genres":["fitness"],"Author Background":["by-men"],"Number of Pages":162},"Read In Year":"2019","Page Count":[162]},{"Id":"Tue 04-16-2019 to Thu 04-18-2019","Started On":"2019-04-16","Finished On":"2019-04-18","Book":{"Title":"The Subtle Art of Not Giving a F*ck: A Counterintuitive Approach to Living a Good Life","Cover":[{"id":"att2ofXFwnBDOFc2u","width":267,"height":400,"url":"https://v5.airtableusercontent.com/v3/u/49/49/1768197600000/04iUsmLP6CxycOUCfdG6zQ/gFQKqGuXx731pfvbYUUNH7UfmaX0w0YhZWd-Ap55VrzbrYrAy0kGugO3QXolPOxccwzIPLBPHmYB5hS0_C-16o-HK9DZPrUXwhDzTLz6kdZdgKA9_uIsLzeswqDgdiKdeKEVWINgraj-fT2KLwFS8w/1skx1C3TrZc3fq9tCxEInPpjG_ggumyWrn0GJTq8y5Y","filename":"28257707._SX300_.jpg","size":16986,"type":"image/jpeg","thumbnails":{"small":{"url":"https://v5.airtableusercontent.com/v3/u/49/49/1768197600000/OX9v4axv4YTWB5jhTvGoDg/feq9yGIEi8kQzRltBNEbEgAKtgTY8y5IGkBQZxhVddHD0KhCqgI2LrRO6rq5E-EUB8yWKEAqbPllqZcb7717w46t8euseJ0dj0kzZvxaDeMJxZ1pwlnfJt621_IZsAcczvHAuMhuPRiMJkScJUn68w/Gbw_0BNuQpyPdLqYAhLAUKr_fCxt59QRtW7AxLgFmrc","width":24,"height":36},"large":{"url":"https://v5.airtableusercontent.com/v3/u/49/49/1768197600000/Z3ZJPzIGNPdcsAQTXc2TzQ/rPKTRwCa9soqiTgvV66Z_OOv9beXEw7zmFPo4GRWWs9SdQoMOVdGI0JL8zMhy-g0ebR7z1kevZ7iMjhXvuOmSzrYqZx0CiF_NHJF4JiIL9PVkvUk9_Bn1hI3esd8opaJUEJZouSyI7Huudc2NKCFAw/sxvqZw4TQVYzL-ud8T0i1Jt4pigjnwADZ1C5k2oe32g","width":267,"height":400},"full":{"url":"https://v5.airtableusercontent.com/v3/u/49/49/1768197600000/WL_PkcpHGqVDfVSQawjd7Q/ipd56fKRqG9BNgT-L-wBbrsfTgmk7A93EOW998_131CgLWtA6MVnbu8N6LgK3ybqcQdLmABTLQh7KVsCxCSTmd5qz5-XKjS7MpzbTu1a4dC143LhgW3zOkR-8NTPiYIOJV4xk5agzin_fQ0hLiwRVQ/b1nnwKDJW5qs4Vb6sFcqrLhcrb5OS818AHHkIJdPXwI","width":3000,"height":3000}}}],"Authors":"Mark Manson","Readings":["recvH7j7M0c5oWIZZ"],"Date Added":"2020-01-19","Genres":["nonfiction"],"Author Background":["by-men"],"Number of Pages":224},"Rating":2,"Read In Year":"2019","Page Count":[224]},{"Id":"Sun 12-22-2019 to Mon 12-23-2019","Started On":"2019-12-22","Finished On":"2019-12-23","Book":{"Title":"War Cry","Cover":[{"id":"attv4ikj0mQmSZ9rQ","width":188,"height":300,"url":"https://v5.airtableusercontent.com/v3/u/49/49/1768197600000/66k3MFbJ8J1jRdv0wt2CIA/P6MalR-UYCeTSl0XAwn6PMVHuUupR4WGBnOKXcRlXsLeq19NBCk19_-IqdoN-DtQHbB5gMHn5v2yl4-Ne44z9pH-Nn1rbPJdy75Zf3rihYj2jv5cdp_Cua3TOpDfIOKipR8BHIgC5SXkmo5wpxK4DA/qgyWiIu7s7KDxT3FRq_rbKTFNNMa4_ExZ-hKeeLJYTc","filename":"34730465._SY300_.jpg","size":16966,"type":"image/jpeg","thumbnails":{"small":{"url":"https://v5.airtableusercontent.com/v3/u/49/49/1768197600000/Iqhr9uQQeAHxr3uV66sTOw/Il01gM3M9NJ7u3qA83jjrOpm9VUyo4vSOSnPtBTq_W9Viy5S8VP8ho85J38TyIftBF3pzuRjNYPC6f9kHzdAAn9Vue8th92nXqX0GzQokEbQAQSw7ND-cpJRGiTv9F0Go-W_PXrx7DnNCm7IzvpJrg/Hi5BCEksG_T6BpL9KtZgS37R47RtqZnk9RYSOtaKBbA","width":23,"height":36},"large":{"url":"https://v5.airtableusercontent.com/v3/u/49/49/1768197600000/kpTTCVERt6W0I3bndpu4eg/n1E2lA_j2lVTeFdx7Vz4zW0LTERSfE4kwCqizisNDh3CAXMSmNgeM-sHdNTL7YHKlK_RWy7ONsXtl4bEgK2khKhBmMIsLZkKYZhe3YFJVnKNrJlgyFAyExX-5pCAGlxgobl4Kf4yGIijnrai5TkllQ/6u0RU8BvzB-9CzoGtoVJFdCCYCTa5FmGOl2xWXlXCZk","width":188,"height":300},"full":{"url":"https://v5.airtableusercontent.com/v3/u/49/49/1768197600000/RCVJBVDtU4oWfwOTqMYkqA/B5FI3FWqaGNPwgJ9GYozVZ4xadLR2TPVbDkU8W1uu_EVjU7LcMQRluroojFNw29LBYEtviRh4xlrXWohDrIVAVKatg8Ray2YcvDVdR3h-ud5TRoNKwN1BN8z3hDpSrUn1dHUmQ_1eB_oy84GpxsP_Q/GaV-mfxTNs8DXRJXPPZx3Q-Z0CCORhe9SsO85ZzReQs","width":3000,"height":3000}}}],"Authors":"Brian  McClellan","Readings":["recxQ8k4afozWnPDj"],"Date Added":"2020-01-19","Genres":["fantasy"],"Author Background":["by-men"],"Number of Pages":112},"Rating":3,"Read In Year":"2019","Page Count":[112]},{"Id":"Mon 10-28-2019 to Wed 11-06-2019","Started On":"2019-10-28","Finished On":"2019-11-06","Book":{"Title":"Guns of the Dawn","Cover":[{"id":"attLaunc0fxs8G8wL","width":196,"height":300,"url":"https://v5.airtableusercontent.com/v3/u/49/49/1768197600000/73DcqLW9doWeG6mLUlSUAg/28iAA2Hqj9kGgpdbRB7_XOfY9lY1_Dt6QAd22lZJi522PYDA3RlcrNRe_Y2dU6cydCRFbtIab9C4lWcVsp0998EGCXpVfqV9myOfQwP44zWgSKPgaNKWp7yiksmrUxLSKilff578UUYNvuH-3iRaeA/-AkneMH0q9UMNlHkvK-B4KON42yoZ_1pUVFBSoV62F4","filename":"23524779._SY300_.jpg","size":23043,"type":"image/jpeg","thumbnails":{"small":{"url":"https://v5.airtableusercontent.com/v3/u/49/49/1768197600000/fy-U0peUmwZk9q9qF2OAbw/t4zcnwL_OZc6DOFspkajTm9tmxi1tdZsWlWi5d8CsBI_AhCcWbK5yDDCMeeuRIUCW_kVcPbNT-kaqI4bbo5rRGVsnzaF94W1AtH1n9pWtLIVbJCFgi10wFLMPHnxrFH_cI2yE3TdWYUET9keGBLJTQ/x6I3SgjnCyypqTaMpMmdDvNQHUbQ9EQmIk3bCuDreeo","width":24,"height":36},"large":{"url":"https://v5.airtableusercontent.com/v3/u/49/49/1768197600000/I72TYHW_OZm1vul2TsHMFA/bkyn79z_RCE0w_-xeStxuw-bPJUelVmSvECQXGgkxVvqj_9AUGAm5XYJjARmlQ-QDVMeWWIQjDAXQ7EtcFxMR1vRGa23YAYa804kRpezwjn16yYDUHYQraw1YXMv65dNR3Qq48c1DOi_64GTgaCImA/QmNyun8kcAonuxosce9Zo-KPu470ABtGvvdjYl8urKE","width":196,"height":300},"full":{"url":"https://v5.airtableusercontent.com/v3/u/49/49/1768197600000/IAoWBciJTUAl6wtn-UTAGw/gcnBTlrHgFssOd6haKdDAu7kxqx9tANC62S1rd03e3AJC3ru1V09DaH7tX2r3_hHHKKRyFMlJRl6mGwn63N9CrQVH-rDLFcY0xjFqnqwTGSMaqcCHRi3-AOIpUKwP1cqC5wHowjdY3R3c2rgEPxL9Q/rYPhh5UoD_iUgjJQrf_bpUFw22YQPOKxST8akWYl270","width":3000,"height":3000}}}],"Authors":"Adrian Tchaikovsky","Readings":["recxhdc0hgAg5OdFK"],"Date Added":"2020-01-19","ISBN":"1447272676","ISBN13":"9780230770034","Genres":["fantasy"],"Author Background":["by-men"],"Number of Pages":658},"Rating":5,"Read In Year":"2019","Page Count":[658]},{"Id":"Tue 02-05-2019 to Fri 02-08-2019","Review":"I found the ideas here compelling without necessarily finding Newports arguments for them convincing. Particularly, he leans on anecdotes and quotes about historical figures that come across as just-so stories and paints technology companies as a bit more mustache-twirling villains than is really going on.<br/><br/>All that said: the ideas and a great many of his suggested practices resonated very strongly with my lived experience. The message of the book is at its core about finding ways to live deliberately and leverage technology with intent, rather than letting it passively soak up your time and opportunity. I'll definitely be implementing a lot of this in my daily life. <br/>","Started On":"2019-02-05","Finished On":"2019-02-08","Book":{"Title":"Digital Minimalism: Choosing a Focused Life in a Noisy World","Cover":[{"id":"attnpeYk50Vzo4bHG","width":198,"height":300,"url":"https://v5.airtableusercontent.com/v3/u/49/49/1768197600000/9Dm8L78s8fezBFU-gwb9IQ/r2qJfMFVUnJMGhjX_zkmLYVd65SJT7T8cjFCdyWxHEzY_jknsSFfjEys6zH1O7lLwWRyW0B4C_UD-vqd8SSXma7qr9xAORQy0eI28MuT4muBG2xQoirR5shfVmFv28fu4YcTM7Ufy0E_g8zNAPGKPA/WZ2ah2vtJzS2PsGFRlAOpWwDLYvnFlQvt2-6pzxwx6w","filename":"40672036._SY300_.jpg","size":20345,"type":"image/jpeg","thumbnails":{"small":{"url":"https://v5.airtableusercontent.com/v3/u/49/49/1768197600000/1FWnP6pO40PsAmTduxHuvw/fZ4CvZT4lgzHj7zNXJ3Hi25FMYoHbKiRZ6E6b5SF0WVF_xNXi7QpM9DdixHuaXF3c-Ow2tujlE8rBeIKNfhgsRCd-eip2zfkfVzz3gbZ2DVQqW3XDAps6ERSi5Z-KHjSojysO5203FKw0hYniJ6AbQ/dtlZkAunWgqpCOdXqxji6cupUi5HRtjQE4xDVzeJG34","width":24,"height":36},"large":{"url":"https://v5.airtableusercontent.com/v3/u/49/49/1768197600000/-8AkFALn_L-2TOsx5jB9Mg/Ct4ZDR8b2DFhmq-p98JIg-xNTaIKgAyXdlSZB1GiKjVDu5b8pgHUoh1tfN-5cyqEmE8vJSu832al5ADqUBb2bePdCKi1DXXNmHkWyJx1miDwGcQne-yxcXYfujkZqASWgD5X7t1kfUyehOwQpqvu4g/N-5LHV9NXIt_BBaxmr08olIb0jttDcPTJ30AQ7TxreU","width":198,"height":300},"full":{"url":"https://v5.airtableusercontent.com/v3/u/49/49/1768197600000/6nbLCJZuUr1vJG1mbbrGJA/JjQWZNqjH_B858sV_ChLc_uar8HdYdU2pVokjcbHMgaQILHZLzKj1j72wJs7uc5BXLQKY-lPYDHnO6M5kOy5c9VaqL3wMVnpPjkTtSBLnrI_88TJ0fn2IPwm0TB7y4LpGFx4wlnhNGdCXIhvtVxlzA/RJsUcEnjK3qVVBgvPI59ftxPx-_YplH_d6XdHYhK1B8","width":3000,"height":3000}}}],"Authors":"Cal Newport","Readings":["reczQ45HLLgNullTc"],"Date Added":"2020-01-19","Genres":["nonfiction"],"Author Background":["by-men"],"Number of Pages":302},"Rating":4,"Read In Year":"2019","Page Count":[302]},{"Id":"Mon 12-31-2018 to Sat 01-05-2019","Started On":"2018-12-31","Finished On":"2019-01-05","Book":{"Title":"The Labyrinth Index","Cover":[{"id":"atttAMEmFNOOlTmJA","width":198,"height":300,"url":"https://v5.airtableusercontent.com/v3/u/49/49/1768197600000/66RKKexy5sXyx603o6ZR9A/OwMaicgLNJCVdXzJmYi1N80ymGpt2jxeBm_55gMo1rrKHJmgR2buC0tsDcHm8T4vcwUpPEWUX_9Yx9PjtoMOUmBLgQ1SWsd0mdaZlACLxj-ouLBUPe0cUK9V306XF0aSVgshNx4dIZBXfTII4tLgfA/2MCJfT09PhUsQLYjaz7VLgJKBD7abdoQdLPY90eijsw","filename":"36053406._SY300_.jpg","size":18461,"type":"image/jpeg","thumbnails":{"small":{"url":"https://v5.airtableusercontent.com/v3/u/49/49/1768197600000/cwN5C4srt1yUwhWn1mAtHw/LgsfeabFMCydS7UhAE98FbvJfzOnlzhcj9MtLb0_oqyN2VIVqD7zmWer4j9SVjpGrlW6SOEgXfWnljtapharu1tAp8Mkjq3Wer49qhlI1b8dlFLi-gmJ8FxKmOxZyZJHU5S1qwmFAtEzBgi7neTmIA/HTJiiKb0QAtlUNTeKP1oRNvbXRNjouWODIBeVdVMP-k","width":24,"height":36},"large":{"url":"https://v5.airtableusercontent.com/v3/u/49/49/1768197600000/LHK7DGAJ4pNwtsGTd6abeg/bfQeT_Os1du4pH4OzpdvDoAGRTgG7ZjbUGud07q7lRJCne7t1bRvj89QG1M2ur42TqvrUjv6AI0-JB2A2Ou0qV6XEVp57x7NWjjyA6BF7RAXsHZJS5B739crTeqyJKR_mo1jlv2QqYXvRNYWLSXlfw/9PgAzmS40xjTq9WVBOqPMyRXK2dD0vcPUxEJuklz0Qw","width":198,"height":300},"full":{"url":"https://v5.airtableusercontent.com/v3/u/49/49/1768197600000/hxOrYZ8Mm0lIiu5N4hd51w/PRQenPJJSHrVZG5Qg1EhvXTeNEP7eDBK-rm98UlzyDaKH7tcXGN2-paGtzraGiJ5pHDJh6AR0WWLlp_MAMeZtouQ_FX3x_cibunrKosKXKZG4A29RM4yYqy9rRHmkqc0ynrwu0-rvbnYhBOye9mnCg/u5q_7JsgSksJJJ3KLYBBPLhZ2Un6Y60P9eYZ2rzNb-g","width":3000,"height":3000}}}],"Authors":"Charles Stross","Series":"Laundry Files","Series Number":9,"Readings":["reczwL2zmcJ7NUap2"],"Date Added":"2020-01-19","Genres":["sci-fi"],"Author Background":["by-lgbtq-author","by-men"],"Number of Pages":384},"Rating":4,"Read In Year":"2019","Page Count":[384]}],"stats":{"Author Background":{"by-women":16,"by-lgbtq-author":8,"by-men":25,"by-non-binary-authors":1,"by-people-of-color":5},"Genres":{"sci-fi":18,"fantasy":11,"tech":2,"fitness":2,"nonfiction":7}}}],["2018",{"readings":[{"Id":"Thu 03-08-2018 to Sat 03-10-2018","Started On":"2018-03-08","Finished On":"2018-03-10","Book":{"Title":"The Muscle & Strength Pyramid - Nutrition","Cover":[{"id":"att2h0auROez7wiS9","width":300,"height":388,"url":"https://v5.airtableusercontent.com/v3/u/49/49/1768197600000/WUcBEOtEN5Y1XOX4_A-TKg/LkReD1cZDWpfd877fiZKTPBmRlgY42PEkWUUi-wE6bcnsLNGkB0RxAyNQxgyxm-MlWPWlPAEMtqhy4qBGGs7KhUSzMoJUatMojcXYBa6D5DNYNx7f5U9yCaLVJ8lgXZLomV0NYC_J6rjsxbc5qUp5Q/UqdCiVXwWitSqOhEeaZT43qGc4fLi0G7MOFs0XulOX8","filename":"28431669._SX300_.jpg","size":17773,"type":"image/jpeg","thumbnails":{"small":{"url":"https://v5.airtableusercontent.com/v3/u/49/49/1768197600000/KlSA64TSDm12mP1G71oryg/LbUZp1gsTq0JjSjgL3NITsoNm4H9aF10gL0idnroIog6TGQvZnxk7eOgnVjBH4gN0l38zPSUfiP2Cmv84fUQZ5aXy_wCcu_Cy1xmtiDtVJ8D_j8Vc8JJJ2zDXNiuYQfDRVAZpSsFpstECHo9D7VEbw/AMKR5ZRWCvCdeEk6GS4ktdNxSmNYLRzJverjVhVsA6A","width":28,"height":36},"large":{"url":"https://v5.airtableusercontent.com/v3/u/49/49/1768197600000/bIU0yirPeSKXTamvl5aaBQ/71saDu-3Rr4miykrJgqOZ2Ol5i3PeDdM_SAzoYy0bD2Md1Buerjbroddr_mxZR6cdUy6x9o5Q0Wqw1DLdioF1BH3cEnpY0cToaI4rpMg3QNlcyuYnFgo0FTLeyDAO97tWyssvOo5IRWMIpaVtEb3lA/_roPKvUYybdNNbRqlzo3VnvxkLNP6AW9wz71L8nsJlA","width":300,"height":388},"full":{"url":"https://v5.airtableusercontent.com/v3/u/49/49/1768197600000/m-wskNr0TqIHaKMjiHy2kw/Yr1QtfM7U3gMF2a43BCfDpTKC9h8gU7-vXzcJ1dRumQVyXQ5--ExKO6uueYAwDeA5Tg1IZcyQ4cuXL45ei61nDw7jbtQ0SNjd4_yqMBIpIu7KjsBlTFlj0t1LYsGJBVj59-xJH6dx25162HKKQoe6A/wvEKw77M6G5nxOVGQIwKJlC1OtueRRCr2p6qjnfXgGo","width":3000,"height":3000}}}],"Authors":"Eric Helms, Andrea Valdez, Andy Morgan","Readings":["rec1b7s9ZDKNQu5Qe"],"Date Added":"2020-01-19","Genres":["fitness"],"Author Background":["by-men","by-women"],"Number of Pages":126},"Read In Year":"2018","Page Count":[126]},{"Id":"Sun 08-12-2018 to Fri 08-17-2018","Started On":"2018-08-12","Finished On":"2018-08-17","Book":{"Title":"How Much Should I Train?","Cover":[{"id":"attHGLvs4nh9qkyag","width":300,"height":388,"url":"https://v5.airtableusercontent.com/v3/u/49/49/1768197600000/dopt92u4GK_FdXrSd4YtWw/jl6iK2g0NEbbzmMbdt52qi_1PwMn-lX79qxpX7vD8lN5PUBzmA8I394Zk2lHzhmSWqCOrYhlYl84QrejgarH8dNsHg_UUgZem6-HzlvWn54ldGnVZBlukiJWgEEPq11XUFSghtMYdNHsElrZfkWQBg/sHwLaA_Te07nWCGiXiZofuYOhgxZX2Svk9VFzVglmoM","filename":"36497381._SX300_.jpg","size":23981,"type":"image/jpeg","thumbnails":{"small":{"url":"https://v5.airtableusercontent.com/v3/u/49/49/1768197600000/hO43GP2jMus0kIltBk6xCg/xpixmuWQm3KIlNyH4TEuVBAg8nplA8K7pf2Y02J9tYTCl1yJmmThRPyDR5r7edmRkvTuWvVYbSWbqrctgLElssrvi5tqe-i90Ib1eEcpgMsAlKXEll4ycs23eSFt-5djfKFKyPJI04pApZZBcrEigg/OyVOWkH-Bx2Jk_9Wp-LXYf8aCqbZ2wfxHL2cKy4lonA","width":28,"height":36},"large":{"url":"https://v5.airtableusercontent.com/v3/u/49/49/1768197600000/tIwF7bW2f3IsMBP9HzTxxw/dyZl6EivJ57BS-yM8hJUuuPMNQyUU6Lui9ncmC85VWE-bd4kuYv82DM6d3-qBUU3dFRvRuqg8vJA0yeqFAIfIQK_7k4z5BElCcCrPBIgzaLHeWN_-sW-7DCmrkd86F9sJGhiSGxgbfgRYaeF-FECUA/GF2HcBkNXuXgCrVmcdF_VhTqGvDDX0vWXRMxj_iWAXQ","width":300,"height":388},"full":{"url":"https://v5.airtableusercontent.com/v3/u/49/49/1768197600000/ENFaOPGK8mPZB255Gdft5g/EFQ1TrH_nDIZWUFpIvIn39kcucQq_URXC-FNEPKTTXolzHL1bg_KEfd7xTwABf7cvdImoBKesvYMxGDM_llKIhf_GUk4_MW_ZrZuI8BapvR_SQViQcpHPAXFKStqs0XK6OoTxkUYFSKefEeZ4gvQbw/XaZ-XLoxoeaUO9kSMQHelMs17cNp-26ZF8WIfsOXGpI","width":3000,"height":3000}}}],"Authors":"Mike Israetel, James Hoffmann","Readings":["rec1ok5SqtAL7biBH"],"Date Added":"2020-01-19","Genres":["fitness"],"Author Background":["by-men"],"Number of Pages":113},"Read In Year":"2018","Page Count":[113]},{"Id":"Tue 01-02-2018 to Fri 01-12-2018","Started On":"2018-01-02","Finished On":"2018-01-12","Book":{"Title":"The Gathering Storm","Cover":[{"id":"attwBjNGIEOKTwuW4","width":200,"height":300,"url":"https://v5.airtableusercontent.com/v3/u/49/49/1768197600000/x3WH1AB9IJa6hJ-IBtqz0A/RN62ln0UYChEGqt415OZjODveMzJYVyl1qsGTOAeGnkAV1AmYLjGwN8bOI8BhJYVGS4Uqsi0NytPsnigaXnHq8fSVyBB7G_uZO2g_MGXKVeUWp3jBPQ2DHnbZfWbY4jMorZsNbI1Dv1knw57oGLaJQ/bEjqSRXy9AemdAixKeFXE6WuqRnOvSyCJ9NLnQhKHuc","filename":"1166599._SY300_.jpg","size":21620,"type":"image/jpeg","thumbnails":{"small":{"url":"https://v5.airtableusercontent.com/v3/u/49/49/1768197600000/tuRhjVIlsUYr3q_Yc1IjxA/WdEffNG9RGPFjZvII6biCXlvUzeMeKz4TUDuZB7mZM6pPvLCsU8G2MifGEWOmLnfwSpwjkQKX2bXjRYGgpiTNV31vc_WopGeqkYBRL53Dtoh5-URUsgIKssyJCr7Ki4pY0e85bPy_5CadZGWjyMEDQ/7ImdEICBER4oA9FoEAe7tNub7lPMQXUUksFIK8GgWic","width":24,"height":36},"large":{"url":"https://v5.airtableusercontent.com/v3/u/49/49/1768197600000/iV3sYTWHGShJoFiQEj-wmA/g0j2ciKfmRgpu1xhdUYui56QE6AQ4VXfT0S1ysMqZ_Khi2N5aT_-AnK2bMInZG8v6ZsXh5hDNUiyJ60On6NrRMIyvKBgY3dF9m7Fhcmjh6Ouf99Z7I8ArAn3JIK6CIdWVF6g2vC5y2YU4B2fWUzyHA/PaX_NRDPPDS5-XJaBBMlPHZULJpJeGbs9MSwNS8b0B8","width":200,"height":300},"full":{"url":"https://v5.airtableusercontent.com/v3/u/49/49/1768197600000/nxODaog0EmiQfFDIjroKRQ/jed7ommvINpUYC_AOZJwTSGaFzo8OCfBfHE_n4uLAsmjEOLao_UkvX0E8hljfzsc9tzEhguFfuXTBRlBlaOMYNL3t8uFxsTmVErLO9p5Ng8ppGAhTb3JUHFQtG3gKIDb57hoUmN40Lj0t8i1UU04hA/g2ZEv-lUjaq5ChZeWqxHT46uhrnzbM67bfP5O-lvYpk","width":3000,"height":3000}}}],"Authors":"Robert Jordan, Brandon Sanderson","Series":"Wheel of Time","Series Number":12,"Readings":["rec2xCDFMzzS5TdF2"],"Date Added":"2020-01-19","ISBN":"0765302306","ISBN13":"9780765302304","Genres":["fantasy"],"Author Background":["by-men"],"Number of Pages":783},"Rating":4,"Read In Year":"2018","Page Count":[783]},{"Id":"Thu 05-24-2018 to Fri 06-08-2018","Started On":"2018-05-24","Finished On":"2018-06-08","Book":{"Title":"Wrath of Empire","Cover":[{"id":"attpFhAgu3JkCPJcZ","width":195,"height":300,"url":"https://v5.airtableusercontent.com/v3/u/49/49/1768197600000/hJo1ccYP9T3QhP9Kru0tHQ/NuJX6zn2fU1C4I-9qFRjHPakbadti9erQeuuy5RwCgGU4dXwniD6P_P2c-ZItv314Ue6nlaVnFJ5-xPW739A7MEU4NLWytseG26NfSoj57n-hD_g4MhOpJAPahWPaPH5_l2KPdBcNe_mPB_tSpMTwA/ARRXDI4j2BevdxWN-xHZUj1ZmEOcbONIwKkHxv6vWWQ","filename":"28811018._SY300_.jpg","size":19530,"type":"image/jpeg","thumbnails":{"small":{"url":"https://v5.airtableusercontent.com/v3/u/49/49/1768197600000/VdOBEvtQIAnQAIl59IQ0VA/YHyWGvohfh7o-Or9bJ2Ok2by22a0qOGK5VS6SBArkxhjKxl3r3-L-p9UoL4wfieRI_sIewYczsXgGL1pxNo3ebCjU_mPcPBwq8N0X_3vi_AB5ZT1c-vVxGelmkt9JxOJliL7tYE0fZEpPnAubevDfA/ULKTFgByhTI_ibGh19-0zZb0qZyCvmYnWLtdhSgLHvQ","width":23,"height":36},"large":{"url":"https://v5.airtableusercontent.com/v3/u/49/49/1768197600000/wNyV8VcTdO-E1x9BuODU1A/JZqeDCu6-d9VMTaDpC43fue79OhS0hk0VdHkoFgQ0yZ05PscWUV7MGpoqN9pxXuvoNoW4-N11aOo5VNrukTf8OUOV5SEta7Dnw8qTpUnKDGzB1HmzwrhE0FQrsKU4CMO6knKzBb_C89nthgX46BtkA/dPpNRzBIFkEW8yMTLz0BN2dLFRVwAsOwh1D503oJW98","width":195,"height":300},"full":{"url":"https://v5.airtableusercontent.com/v3/u/49/49/1768197600000/RXauaFdmS1m3J4ef_HwN0w/15dHlmyIfV8X_viA3MLBvWHFULD54WMCR7QzClIDdVftrz33IiIlTeES_rRNw57jNS85pd5qwxAbclzdYusvzLIkEF3DLuV4nWgl5wfLoIeX5N4bGSxPYG9Ht1j2UMIFTaM1cWyrwwhAdNBwrdAdkg/TMte0dU0b_ebawFyhW_5uEJTKU7AuU4nh6Cz-dhdjBc","width":3000,"height":3000}}}],"Authors":"Brian  McClellan","Series":"Gods of Blood and Powder","Series Number":2,"Readings":["recA0cSQYxmKGRUlK"],"Date Added":"2020-01-19","ISBN":"0356509311","ISBN13":"9780356509310","Genres":["fantasy"],"Author Background":["by-men"],"Number of Pages":639},"Rating":4,"Read In Year":"2018","Page Count":[639]},{"Id":"Sun 06-24-2018 to Sun 07-29-2018","Started On":"2018-06-24","Finished On":"2018-07-29","Book":{"Title":"Why We Sleep: Unlocking the Power of Sleep and Dreams","Cover":[{"id":"attQWCg36CmGCiDcd","width":197,"height":300,"url":"https://v5.airtableusercontent.com/v3/u/49/49/1768197600000/izRXPPiV7_5EQvbIc3T4Hw/OHE1PyBVS2DWVc0DgaLno42EWizxmqZ2GJ9AnnZyDbOQWo2JI3i_zAzuezTyNMDYYMCFk9XS83q-Javm4oMdyzQQ0z_1j2bB1kmWtxPq0yuMlsk9QfQW6h9mpR3WAb-GpEp7Ijsb6uwEz-v9krF4aw/AcaOAx79hioUjVHQTTttpZraImcbCC_ssy6DLx4mUGQ","filename":"34466963._SY300_.jpg","size":18625,"type":"image/jpeg","thumbnails":{"small":{"url":"https://v5.airtableusercontent.com/v3/u/49/49/1768197600000/cGEiMD-8uNBK5ckCuq-Z1A/0Q3etGyv-BY0X8QlKEBK6YR4MbPDWK7PaZvgZBeRLq0BHdg-p352avvnvaOCad7X4JOH4bUbPw0yAoaxwBVVSQ3cyarHNvzF57Ljqfa2FbFir69nf04fD_OQiscEW9bfONj4-n4gsA6IuKU9FnA2bA/--B4mSRz4iS1Zoq59NZt_9i0OPgv824WQwMU_ydpCuM","width":24,"height":36},"large":{"url":"https://v5.airtableusercontent.com/v3/u/49/49/1768197600000/JwSpj4sSEBZX7u-ZHwRIxw/DneFdqEhUps7OH2SVh4fTblegIbBmAug_c98ZwxbnoufiVkjApcqzZQU_BfCvPGBPIit4EK1TkA_dhl11ONQ7-jGYLVdMm6u2FTgMpQxiZhdIiN0lWMrj85xlEV8K7r-1HV-epKNM5h0n-_--D-YSg/blr-QE8imOvgvcu9Av6MU_5VtF_js34hT7aTNWOapSA","width":197,"height":300},"full":{"url":"https://v5.airtableusercontent.com/v3/u/49/49/1768197600000/jNXg-ZuElE5BIDLdNMMOSQ/0pojXAzxiJplgSfXpxyVPvt4z-bnqlvPqm99A_o15INF83lpCaRGwwcslX3mw-UUG5zPXVgd65goC8IMWuiDG_n-Pl7dXxTrrCirtL9r6rjZhvkmD60Y4VGSO9XhjvjLEkBEaj3roLgZdIAv-HGW-A/0Gve4jeU2SpSsJdkcbyQ3OnlwRSYoiW5EFEglicdwQk","width":3000,"height":3000}}}],"Authors":"Matthew Walker","Readings":["recCDuNsFQGyp0f6v"],"Date Added":"2020-01-19","Genres":["nonfiction"],"Author Background":["by-men"],"Number of Pages":368},"Rating":4,"Read In Year":"2018","Page Count":[368]},{"Id":"Fri 01-26-2018 to Fri 02-09-2018","Started On":"2018-01-26","Finished On":"2018-02-09","Book":{"Title":"A Memory of Light","Cover":[{"id":"attO8wCyEQp12cjou","width":300,"height":415,"url":"https://v5.airtableusercontent.com/v3/u/49/49/1768197600000/zCxgxFtYSvUTY0HY7yQnKg/xuo4fpTs9Fw-M2Sj_l4xhkjHqwq5gDaK-P7yGSuYkYMLZ2GSRf8RtkYOnR6-r7bz-fudAu_7whze_j8UkT8AELHY4v9VT_WaRdtv2Vx_TmOwi8jGyCYtzOOdc0m3jfabwwVvNM6WbzJklQkFwh1Y9g/Gf2cOzdQjCFSsaVhWI8rsqy8Vf4DsQbu6T8nRMojJsk","filename":"7743175._SX300_.jpg","size":38374,"type":"image/jpeg","thumbnails":{"small":{"url":"https://v5.airtableusercontent.com/v3/u/49/49/1768197600000/5fETpKOmHSfoamrh1zODZQ/iJNSbGCFm4M_5A2WcZr2wKy8CjIKW3nw_Mf45s_yFVna5EaAeSPBy7evtrBDV-dSkycYE_Koo5lRa324wqF1oZjspfA-fd-a3mBHIpopq5tDWWJ9HPaAiRgENlwBcBz81lk4An59aBGpFj0gqi_O-w/z94e3M6qOVkwpUFeZdtaSShmIC76qjBYl2ZxYHZNeIo","width":26,"height":36},"large":{"url":"https://v5.airtableusercontent.com/v3/u/49/49/1768197600000/9kN1pclKeLl_Z0kvVAw6RQ/8tQP9x4SBCAg4RrQ67lPHFCz5i-iqYIrmJTem6DVrmZfiWLpk3itPWXcxUAiyx0EuZPYUZ6rLSElSgDyffIl4ev7NpmLLN9SVBVgmlIW5MJ6iz1IssMWVYGPAD-i2F1X98zl595xvIcptMWhmCVFcA/bkgnYe2crUrggMaY9DLI490VFBc53BJfFluxFVWmC_Q","width":300,"height":415},"full":{"url":"https://v5.airtableusercontent.com/v3/u/49/49/1768197600000/Um_FfwEWkKi5hg98k7JWMg/CN7A_o9KvycQVTlB9RUBJKhR8N3ZEV12Ihtk3bXPqX-uJMyJRvHDf2_1CXian0LJg-cB6ZxhXWQ-7YdsTbsQpWcY__Kjr-69j0eRHIWWQAUWPn2QIT2_6brfQxa7wRqWXjcgyJhCzdJUDwejKXrJDA/J0cWgRSiLzBVAzR7W11p8XXsk6OIZi7aTdNYdAppcE4","width":3000,"height":3000}}}],"Authors":"Robert Jordan, Brandon Sanderson","Series":"Wheel of Time","Series Number":14,"Readings":["recCn36VBuEioKToE"],"Date Added":"2020-01-19","ISBN":"0765325950","ISBN13":"9780765325952","Genres":["fantasy"],"Author Background":["by-men"],"Number of Pages":909},"Rating":5,"Read In Year":"2018","Page Count":[909]},{"Id":"Sun 03-04-2018 to Thu 03-08-2018","Started On":"2018-03-04","Finished On":"2018-03-08","Book":{"Title":"The Muscle & Strength Pyramid - Training","Cover":[{"id":"attc4MGyKVcCRwsPJ","width":300,"height":388,"url":"https://v5.airtableusercontent.com/v3/u/49/49/1768197600000/n2o40AMEFFuntZuDFNwjpg/0Yd9SA8Ot4XTnB9uSiMChX5rjlRBPvtWVTe0hC5aCBR1v0DYnlABjTKdfDj-QLXQkDtSQlU5i3PjI8mximhWQYwMZyzVGcdZWgLWYi4JlhM7ACutqh2kqRS4MlJ_l_ezHLt4TTdHoYj1g5tMtvCVWA/vNom5axcSqSKnAojhEjV19HpyhQExaj4MSxmOEvctgE","filename":"28431633._SX300_.jpg","size":17046,"type":"image/jpeg","thumbnails":{"small":{"url":"https://v5.airtableusercontent.com/v3/u/49/49/1768197600000/vdWTn_diWCIdkd-1bP5KaA/kEWUCM_LtHn-xm5YqCUV3X0GiGn9BaTgjwsLXEcG93dVgj5p-OvnpkT4VGXsKt3SPwEEUXi3SJYWJ-VfcvlrhjpteZVUauA-qfyaOeMQy1XiSCeRCa5RX6qVrEzpcL6Vu9ccaUgWfD5LQzphL_YdvA/b5CdI4VBEzjyirlkq8wi4V79dJiPmm55dLUnSk-GJAs","width":28,"height":36},"large":{"url":"https://v5.airtableusercontent.com/v3/u/49/49/1768197600000/3GuyzjbLkQIbqpfVsB0BWg/XMviYj7JOCA-uiUmp0B7ykKBJwklNbCzj_bf8lOjzfnGwYVyWoj9cNBkAgRKokUcVHZXOCyvD7rpnqFvfG577fTT35zUGkdBfIFLkqQ-Y0Of-HyOsfV3UtV7-2A1HKMAQJf-MAKSGcqYbv08TOBOMQ/XcSIdWjwWHtmyGbZSYYwOz5qlrmNPPii6q-dgfLnXAQ","width":300,"height":388},"full":{"url":"https://v5.airtableusercontent.com/v3/u/49/49/1768197600000/uAoDLe7hd84lyOHFlwb95Q/u3Kcg5Fenh0eJnZrH7dRDskVxQ7F9eqhLheqd3IKU7BnMfin0PDQGABBoMLyvRsky_7LAfBmCv887bKoZZeYx3Y_kuZzSju8tJ3qTBVyE18_G9zhVJTclBr-0b5-_r19au48eFQQE2__e-Qi_3TXsQ/ZQtscyK0TcehsNXqG-nWRGyidnV0z5YvkA8I7JUzHA4","width":3000,"height":3000}}}],"Authors":"Eric Helms, Andrea Valdez, Andy Morgan","Readings":["recErXg128IHiJnPg"],"Date Added":"2020-01-19","Genres":["fitness"],"Author Background":["by-men","by-women"],"Number of Pages":176},"Read In Year":"2018","Page Count":[176]},{"Id":"Wed 05-02-2018 to Sat 05-19-2018","Started On":"2018-05-02","Finished On":"2018-05-19","Book":{"Title":"The Poppy War","Cover":[{"id":"attFayppaeAmLjaWt","width":200,"height":300,"url":"https://v5.airtableusercontent.com/v3/u/49/49/1768197600000/AJgXr9VCIWIwZf6iHJ16rA/2QEc6ZneJpKXxttKKkHs65_67rpzlIafD1CapMKITrPI7CtRFX5zAURxTcosLOOmDvREXRNpZpvFeAdsYiEn0jn2tFbrigd0lwAHPvER-Ie_QKcaJkQKbQFvbJIO79mNNJhgv1H-rIuGy1v7wVding/_Wuk5inFo2OhPkhl9OdnjwnRIeAyKrDDaNI2MrRM84o","filename":"35068705._SY300_.jpg","size":14794,"type":"image/jpeg","thumbnails":{"small":{"url":"https://v5.airtableusercontent.com/v3/u/49/49/1768197600000/K7bLzxs-CXnbXXtKwzRg0g/dMQ0igcataB9LZuOPCKoqkJ9e1f9kh0EbLLrcEAjE6SERvEqvG-4Jaju410KY0mZhBRw8yzF9R7bScXbTOshdyTFSOl_868lPKiq6f9TZaoB3MaWc9kNueFe3WrYNcOYO8LBILpHTp3F_Aq1s0prAw/dpjhHJ3msvx2tq2cU9wXpXP8N9fNkZCEX8bf77Wg_-A","width":24,"height":36},"large":{"url":"https://v5.airtableusercontent.com/v3/u/49/49/1768197600000/yQRRXEQjuo49WzksJY3s9w/lz13vRV6oPOb9GnrJfkDq15Xre2BcHPqECqnPqY5bt0u-4tz_M0pFu9vzSAu9cUAO5cLRSu9dn-L9gTiazYDhUcdePQ2EOh7kEeZmQikRXD3MnJGUqrzoMjAjXhul24kTq-V0Pi44VZEKEFDzoRAVg/5rTIxLnh425_3b5gQOCmOfBdAIBk5hALldz5w2qLYTE","width":200,"height":300},"full":{"url":"https://v5.airtableusercontent.com/v3/u/49/49/1768197600000/hPxaLeOhfkZ_zDsRlaAfYA/qMb7TFGfhCHVDGQeBF1IKrEbZY6YUpoRtZlGK9NeGfaAIe_jCzoPkNfoGENbTQJnbJf8-HF6A1wkOueuf38tSjsq2mykbejbGKDnSiQvFkLs3IAx3Xfei7dmNrQHJYuEfARoLy-ExPJxGgc7S9FjzA/jke1hZROHvqyFQu_XFPbZBtVHQe814MpQJy442eM1pE","width":3000,"height":3000}}}],"Authors":"R.F. Kuang","Series":"The Poppy War","Series Number":1,"Readings":["recIuqdnjIpt3hYYK"],"Date Added":"2020-01-19","ISBN":"0062662597","ISBN13":"9780062662590","Genres":["fantasy"],"Author Background":["by-people-of-color","by-women"],"Number of Pages":544},"Rating":3,"Read In Year":"2018","Page Count":[544]},{"Id":"Fri 12-15-2017 to Mon 01-01-2018","Started On":"2017-12-15","Finished On":"2018-01-01","Book":{"Title":"Knife of Dreams","Cover":[{"id":"attmGi9Q74480MxSw","width":198,"height":300,"url":"https://v5.airtableusercontent.com/v3/u/49/49/1768197600000/Q28LNOQVcPqvm6v-EaCw7w/I3UnPJVnR9Qqvnc_SpkP00XQSzpy_2GsFp1UZERgCTsjg63DBtf9AjkRoUNfutht5UvTOq3oiaSIaRHFp1o_6WTz_Enahyebwr8ikqNRYhlJ3QS1wqMbB2ec_RLNAXHPZ8xqHxMGM-y7TgdFBxYodw/p9cThgkaLIIjP242Drpd5D-7b3HYHT1ZCp4vfcRYs5c","filename":"13888._SY300_.jpg","size":23350,"type":"image/jpeg","thumbnails":{"small":{"url":"https://v5.airtableusercontent.com/v3/u/49/49/1768197600000/gCGsgP1vEMiaDo8GHAFYEQ/zYMHpybJwBJdZWMQSDOceZvgbaEcsi7_nDf1GcsFR7a-qTwDFZyf3g4owoQ-kQThAEYAEzGA_xLKFajvO4qGza8LGwDBJxoPQMv7a3X1oIFBixMB2GeQ99jacN6qG5WNaDJPB9RUfQLKULNGbAj0WQ/tGTAMwS__uwyECn3UUrmc3J6Movc8fp84_IW9m4mwlc","width":24,"height":36},"large":{"url":"https://v5.airtableusercontent.com/v3/u/49/49/1768197600000/9_ly3wYJEtT5Wi3GUSblOw/XIdtkeb3GTC42tb_wGOJfSIYjyhbl0yIGoQ1Wcb-hZ3ymHeLa6hm7oZiRJN6vAlI8tPSMap8wL7dP5QtcOp7-B8o1EcEpAyiexTQOwygntTKmsA225zjsM3aUTjYwDNWvlGX01zHYYMWi9yV6L2ADg/xMViypmhARjAnmPPsW5e46pRvgBcZwZ3Dv5Lq07eB0s","width":198,"height":300},"full":{"url":"https://v5.airtableusercontent.com/v3/u/49/49/1768197600000/3YjYACB8mwumM3VX0gysgg/Rc-xdmWC5E89hCXGH6QrBRPo7np1Gv8bzupNskc7eldIj4SN4-_XsZVW0Y9WzM7AnlsQkdHBhxKE3Rlh1Asjbu39Mlcbj1zoHo9cBWGT2kqnOjtlsjGW-2AYCgHmpKOqjC4fg7q4XVrywthACvGSOw/V2446EaW9bDJ25boaZkwhlpYitwi2CavyMDiLQpe_1s","width":3000,"height":3000}}}],"Authors":"Robert Jordan","Series":"Wheel of Time","Series Number":11,"Readings":["recJJhOp00Pf89HMK"],"Date Added":"2020-01-19","ISBN":"0812577566","ISBN13":"9780812577563","Genres":["fantasy"],"Author Background":["by-men"],"Number of Pages":860},"Rating":3,"Read In Year":"2018","Page Count":[860]},{"Id":"Fri 12-21-2018 to Fri 12-28-2018","Started On":"2018-12-21","Finished On":"2018-12-28","Book":{"Title":"Archivist Wasp","Cover":[{"id":"attD2XmxrzK2QbEkW","width":197,"height":300,"url":"https://v5.airtableusercontent.com/v3/u/49/49/1768197600000/-hA2eoCR06BCuH-9FDFUZA/jjf8LNIJh01QAzRJ2bTI6nbX6WYGHyh0Q4R3K_tXL3eYnlLz665a8d29LTu-hut9qpTMI65ZW-U7wl9zdZWDgZPAVO6ng76g7cKGGGCX80r1ooy4DlsGNleFLZ6gI1WBP7aso-o6ibiL3oC54aepow/MuKFSuEkcHKUG8458KbxvRVo9EO_IqcxBCPb6dA-Y-s","filename":"23282249._SY300_.jpg","size":14648,"type":"image/jpeg","thumbnails":{"small":{"url":"https://v5.airtableusercontent.com/v3/u/49/49/1768197600000/GIWeZ0BL2c0IRHTdoGDpVw/mDqdwPTlkSGudLAE18v1cw9JfTQhj_pvt7SbOhJXIxeqv1z70kxFFEDH2B5ChwTihm722pfU2Q7cwRUWZAfsZIfvnagrCplV9xg5b0OAbm6nhaKqEJrmHXGWwAbelOVjKsQUa3tMhIv9X8yqeuilRA/tljsxAWt2O6HAGFEwy7dI8ORMAnpLv3IqETDRExC-IM","width":24,"height":36},"large":{"url":"https://v5.airtableusercontent.com/v3/u/49/49/1768197600000/woxDvR0vs2o1a6QE2SN-iQ/t7V4VAjKcF92-TLaMt_WMhWBUuVS5mo-nAgbYLDaBNbghOYBkTl-1bLByObnF7hLBpGPi2bqHSSXrVwVr16ZGysoNonQ6XRKnCuoC_saXO1022Bq9pmKR6BUgWJNXjqcKXlbGsyzyiyhPR8WKD3jfg/Mn8RkIe8e2v-aH2XVlCZfuo8_3cb9s3LErHY0i5y5uo","width":197,"height":300},"full":{"url":"https://v5.airtableusercontent.com/v3/u/49/49/1768197600000/9mE3R7k8cHPrYUPzCAXk-A/a4zp0Kh_zHgMYWu0SBx38SQcZrsTvAhlLzfqTMLH2bpX8W0h7R5KSjQRidzPH1J-QKRbum1h_ZxLNvbOsj9D6dyLMUQNO5hj9AslyVjm0BLImU6QWRSGLKnTIVykGuNIM2aYxggeXMtb4j_RHdTlGQ/hEJRThzChZmgZH5oWV8gUkOUhhJcXYgOUtLgdhmjh9g","width":3000,"height":3000}}}],"Authors":"Nicole Kornher-Stace","Series":"Archivist Wasp Saga","Series Number":1,"Readings":["recLALVpUMa9u7h8k"],"Date Added":"2020-01-19","ISBN":"1618730975","ISBN13":"9781618730978","Genres":["fantasy"],"Author Background":["by-women"],"Number of Pages":268},"Rating":4,"Read In Year":"2018","Page Count":[268]},{"Id":"Tue 07-31-2018 to Sun 09-02-2018","Started On":"2018-07-31","Finished On":"2018-09-02","Book":{"Title":"Words of Radiance","Cover":[{"id":"attVAWyjzhBusKaeN","width":194,"height":300,"url":"https://v5.airtableusercontent.com/v3/u/49/49/1768197600000/hAmqvu_hMkbIu9uPlcoRKw/x6kJDXQcOUQrPpybE-c58xR06SQC3nnKq8xtLe3TvUzo8CPHO6LZxJgBEwmrc8UPmnoRpNklGd1Gbq5ozNciwpghKrUHTIOic33TvkH1Zn-MO0nFfzmbMGpycrfnDnBHyqLOpBTGVvkSmQJqt_FG1A/JCVocXQFNiAEXSnVoMhxUG2_BYXZjAreO_t7B2d1dgM","filename":"11543195._SY300_.jpg","size":20344,"type":"image/jpeg","thumbnails":{"small":{"url":"https://v5.airtableusercontent.com/v3/u/49/49/1768197600000/Ic6GTIF4ZpNeXrOnekMJRg/WCs7HkLFoaSDHvYQOcJROunLhBbR_9VdMbZipXmKLx0_m869VS3tePKVazWzBJ7NA7GmHU1yH1vH82Av5TsEKSSEt6JrztIX4pVjjjmk2m1LFkX_0_QKvYqbFNowxNwPT8hYtM9U-VNhlVjKYNYn6g/9YbjE8VFESnRcHUE5tbl6WzwuYE0jzslz450RmEbMNY","width":23,"height":36},"large":{"url":"https://v5.airtableusercontent.com/v3/u/49/49/1768197600000/1uO_OV1nvH2jbKsLr8KOPQ/XCef7gfcK9WkVZJZU_Q56EPXreoUgpggrqvCNi6aYZV1RxxlRAN2gziwa-hh9tw_1YXDwpi6dSUTYXhekaZMN67e9y5G9IyZpjgWJhHQEMIyufMNBpL33E4sRvoPS90NVbPqAPKzgaHUUcA1YS3b6A/M5_FGDXry-ay8eUqkHEeItWbf5c_WvI3wOEBdPrHb5A","width":194,"height":300},"full":{"url":"https://v5.airtableusercontent.com/v3/u/49/49/1768197600000/gXV-E5uVjL66dsLkjkeCXA/R1JWGjX5FMVcG8tptOb9kvospMd5JxbxPFOiPJEk3qMClIQysui_KEcGkomCygGlt34TSYZDKfcqr5Dfaq78IWexYPVuGcVsFFQ7EawU5_za8Da7-xoK1sNKdFle4NZ1TYvl00HF8qdASZid8-nwog/AhpXYPhmYwDcQnvFtHvnz_x63DLxvGN0HElQ_rGZQ_Y","width":3000,"height":3000}}}],"Authors":"Brandon Sanderson","Series":"The Stormlight Archive","Series Number":2,"Readings":["recglMHjOERkARHAl","recNbFSuiFYNR6dq1"],"Date Added":"2020-01-19","ISBN":"0575097396","ISBN13":"9780575097391","Genres":["fantasy"],"Author Background":["by-men"],"Number of Pages":1088},"Rating":5,"Read In Year":"2018","Page Count":[1088]},{"Id":"Thu 05-03-2018 to Thu 05-03-2018","Started On":"2018-05-03","Finished On":"2018-05-03","Book":{"Title":"ASPCA Complete Dog Care Manual","Cover":[{"id":"attquabSRwPScBVVK","width":300,"height":399,"url":"https://v5.airtableusercontent.com/v3/u/49/49/1768197600000/MNpNCd6Y2zlGLUM3DUCdsQ/Mqrs_JnDKvpjG9XHJkr_IrxVFnPxLtLXACeg6eYqzRyLJk8beZDSvoYdfrXYwE2gy47HGal8a9Rb6G94EOjWJzKq3LwJLuKbrwC7e25mmijtzxfsZixfJyRX-8MR3Pkxxc7d07qa2nlebthVj-qrMA/Gi1QYdp6YK1mu88_QVVmj20_yvCHOgXpm3szdv2ovxQ","filename":"459035._SX300_.jpg","size":31449,"type":"image/jpeg","thumbnails":{"small":{"url":"https://v5.airtableusercontent.com/v3/u/49/49/1768197600000/fXglMl-nlkOctSy0tiCkig/J2FU84CegFXjsxZQt1ej0nMfQ8ad3QR9Zs30HbTefKFmcPV9soeG8SsWvUBsI-Ywv5a44lbHACdYWNskZ10IA30BACCiQY7q_FsheKg-Tqt80hCFVBhwKtiM_3qoKkkbaJb6t5nRGFy1U3GqE4O2rw/fgAWSl5r6tMkLDNX6ZpdClKCCnnwd1ufNbduKKcuTPo","width":27,"height":36},"large":{"url":"https://v5.airtableusercontent.com/v3/u/49/49/1768197600000/SPSsrw0Zu8D4Q5x9pDeXpw/ofSEtqArAMV3_KKFnB3sVIknJE_0IATz49cKOs7Wb7Vq7wZ0wuKWKX6IPY0AOJl-yVzpl3W7oOMOtlCpG5BAszWgh-xRD_wqHX9iYhu9sjs289fbSV__lu6gnnQA3Mebft_1mYLddUpxikQpzSxPOA/5rY6euIesFsmz4JAGs9-8Fk2-zF7pwXNSc1JbZBNs2c","width":300,"height":399},"full":{"url":"https://v5.airtableusercontent.com/v3/u/49/49/1768197600000/_Ih9sGxqDrYGR7H49sX7Rw/ifFMPPFDzpWO59x5mPg2nr1TY_PGKgwLVwpjR2waSwEVieS3f-S2Y-FWJokIm4LGSNhTR9-yJAN5oxEUgrivGe6nR5L2HvVoVO82A8RJA65YtbbN-8jpY46QoXeODohoUid-J_U1suUe8h5JSomKfg/8tR_rzQ8CH6Jj2rZpmjuD5s1lCVnbwBHkhajBqkm0To","width":3000,"height":3000}}}],"Authors":"Bruce Fogle","Readings":["recOR7nfmspZAIovb"],"Date Added":"2020-01-19","ISBN":"1564581683","ISBN13":"9781564581686","Genres":["nonfiction"],"Author Background":["by-men"],"Number of Pages":192},"Read In Year":"2018","Page Count":[192]},{"Id":"Fri 10-12-2018 to Sun 10-21-2018","Started On":"2018-10-12","Finished On":"2018-10-21","Book":{"Title":"Trail of Lightning","Cover":[{"id":"attnqCXkqfkTYzOtw","width":199,"height":300,"url":"https://v5.airtableusercontent.com/v3/u/49/49/1768197600000/bnzp1fuT9iwsdZpeakDk5A/XLLA1r31J68YwfU6bpFORBXaPYM1V2Eoe5ZwrP1xd4iIIlf4d_p2V2p3kO8FZToYjtcU935eXAEAqzgY451YE1_fMFiebobCP9bdAlR9X-BVTtOAI1j6nGVqMIrfHXOkM6MJltNoNeetwUBn3uQZfQ/thREmjXD0bZB_3g7p4yhxFGyshpTWmngRuYLkOqcl8I","filename":"36373298._SY300_.jpg","size":16844,"type":"image/jpeg","thumbnails":{"small":{"url":"https://v5.airtableusercontent.com/v3/u/49/49/1768197600000/n9xFJ6E9E2nm_n8LfJZSvg/XaqxkizUlYPz2dlEjLHfNIB9sldj8J3hi6QyxflRKjmpjNw_S-Y58oRsOQFAqq7HLXUqEOOmy7K6rm-VXJGYpgsTsExr66uvh3iuzduQhlwjVTdQun2NMjZ08zsuyp3UFKrCntwB1jhzhJofnabMug/xJ51WTLEmX8BTxbhp9aErMfvF-MUN4OKYIGYV2adzrg","width":24,"height":36},"large":{"url":"https://v5.airtableusercontent.com/v3/u/49/49/1768197600000/r4740PraRjIgiKQKGyPCpA/Fx1MCBVFoFmcpR4LYLHQW0BIfFC3cAcfz3jzsCuzPLBeth2LAxQtqOldJ-ak_fhKLtMbGUrouviF0yVqG_-9aG8nE1m9cIAnZbIYBtgS8R0Z_JR4JFJ-sghlzD5yMwCwLmOf7G6MjfcPiKvl6j_4qg/VjuPGBMvJspssZbuapDzxjBspv9ziKFKE6FWeLRHhuk","width":199,"height":300},"full":{"url":"https://v5.airtableusercontent.com/v3/u/49/49/1768197600000/-qrhZ_dRixx9fq_hkBsWXQ/eOkoBOIyoFuTbmRb3gY1urZABNxCQqd_gOmu5tcJZwJTCDl-6M6a4ZUkfylQfyRF3t33BYC0PzB3ex-vdbar1gi4qqtSP8FRte_cMlQaYk2VNoJGzTENnC30Pq8melHygH4w5viuO13ahE0gXEddig/uBGHBmMOlrSp4vyvTQzrwdmYNHb8wMl3rRBnSn3-s5E","width":3000,"height":3000}}}],"Authors":"Rebecca Roanhorse","Series":"The Sixth World","Series Number":1,"Readings":["recPAQe7KgL32JT89"],"Date Added":"2020-01-19","Genres":["fantasy"],"Author Background":["by-women","by-people-of-color"],"Number of Pages":287},"Rating":3,"Read In Year":"2018","Page Count":[287]},{"Id":"Thu 06-14-2018 to Mon 07-30-2018","Review":"Re-read  summer 2018 in preparation for reading Oathbringer. Still darn good. <br/><br/>---<br/><br/>I went into <i>The Way of Kings</i> expecting great world-building from the author of <i>Mistborn</i>, and was not disappointed.  Roshar is a fascinating place and Sanderson has populated it with characters that feel human, even while acting as larger-than-life fantasy heroes. While the plot is rather slow to build and the book could use some judicious editing at more than 1200 pages, it picks up speed in the last half and has quite a payoff at the end. Looking forward to reading the next one.","Started On":"2018-06-14","Finished On":"2018-07-30","Book":{"Title":"The Way of Kings","Cover":[{"id":"attpKoPmNAg9DYSIQ","width":198,"height":300,"url":"https://v5.airtableusercontent.com/v3/u/49/49/1768197600000/q3xjeJsZ6qwfM-aCf7Ay1Q/_K7tc5VNYhHsD0RW_QY6nvwu_9M_NyTI0vPFQNIL8FWbTEhiVLIo0hQKJSVNFwuqlOVse0HzR2Ljog4ZB0KxJm6-UwAdaXoxhThtlEYnMKhT263ixsKt5PvMDtLM_UE3jMthsWljx9ZqCI6xWreTcQ/uZMqK2VKtaJztlNmhzTc1TGtcZShXe6CzPV-HGuA2po","filename":"7235533._SY300_.jpg","size":19449,"type":"image/jpeg","thumbnails":{"small":{"url":"https://v5.airtableusercontent.com/v3/u/49/49/1768197600000/o3c22RAkU3SLHdz6cjHBZg/Xw5QkmBFxofex3uLAk1fRv4CxEKBwn4itvXHM919XmyqaYwjUmrlNWiiiNHjyLcmoBPeBWtTpih1ekLUB1Ou0kGYjwvW5tg68lqxdqRuuGEB3c_2xzTgrGe9bHV9zqfD32P3bWW7q2TJyLw_k0Bhyg/T52XQq4EeisgAAL9pFZLTtV3iQaxMjvJ3OdGG42lnGw","width":24,"height":36},"large":{"url":"https://v5.airtableusercontent.com/v3/u/49/49/1768197600000/gElSIP6DI3uDztH6FZVe1A/2Ck3iotLoAsEhy20YwEZlGBbbG2v8vEtItzZzSoMny1hq7e-qwbRFjgTKlWP9rT-WgPwPCj_9Zn6fROGtg3cWPnKl6zgprZe200TWM0IsZnNkcDSyuBCa1Ux6Ts6LJLd9GjLSVaNL6TW6FDedlC2fg/fgYOV00cb3jgUupDD2dZoeOuGODr39Ry6iWiNcw-8Qg","width":198,"height":300},"full":{"url":"https://v5.airtableusercontent.com/v3/u/49/49/1768197600000/44oBL8Gi-Wqp3gH4yv0emw/DNV36yJtsW_CHnfnTLeWg1TZ_FTWV6M4ehLWp-umX5AN8vENffIre6DfXj8cJmENi8q4tVpANm77XbdjEDZxEfl_fqycQe5sqG_z52DnNGYEzP_ANBzTeG0uQovnl8bR93nV-_k37nCCfXR1HQlvDQ/F_AdOsVHix2ixsL03t52QBOKzZibDAaYkGGKG5Y8xEU","width":3000,"height":3000}}}],"Authors":"Brandon Sanderson","Series":"The Stormlight Archive","Series Number":1,"Readings":["recXF57a8Qf2Dj60X","recUf2iQM4wQlFEB1"],"Date Added":"2020-01-19","ISBN":"0765326353","ISBN13":"9780765326355","Genres":["fantasy"],"Author Background":["by-men"],"Number of Pages":1007},"Rating":4,"Read In Year":"2018","Page Count":[1007]},{"Id":"Sat 06-16-2018 to Sat 06-16-2018","Started On":"2018-06-16","Finished On":"2018-06-16","Book":{"Title":"The Dip: A Little Book That Teaches You When to Quit (and When to Stick)","Authors":"Seth Godin","Readings":["recZU9Cu6gIIzM4Qh"],"Date Added":"2020-01-19","ISBN":"1591841666","ISBN13":"9781591841661","Genres":["nonfiction"],"Author Background":["by-men"],"Number of Pages":80},"Read In Year":"2018","Page Count":[80]},{"Id":"Sun 11-25-2018 to Tue 11-27-2018","Started On":"2018-11-25","Finished On":"2018-11-27","Book":{"Title":"The Powerlifting Program Design Manual","Cover":[{"id":"attWuq3B7d7PRwNQT","width":198,"height":300,"url":"https://v5.airtableusercontent.com/v3/u/49/49/1768197600000/ydMkFqQK4oHDcH_I9O-3pA/o7P8pLXnSGSniSo6N0o6R0jAL5wh9MDdgvap9fDCLucMqsAyeAXKGdzP7vB4xKSpRL0ZRsmcRUjXieaGwUGaBtxXz4zrAjMaZKRN0mzQwV_Xpt5u5HTm9omnW0VxpSHnQ8ux3MJ8NUaalB09WcAwyA/ZsG-aMVBj_eG2cnZE8kgpbgkESSUYF6EBut3uG9bQEI","filename":"42982598._SY300_.jpg","size":8818,"type":"image/jpeg","thumbnails":{"small":{"url":"https://v5.airtableusercontent.com/v3/u/49/49/1768197600000/U7rA1SJdpr4fI6qxrC7EYA/-omLMr3rNB8bIB2eTegq2Xtcc2m16TCgj8XQlaescZPqXqoSiRzTUSFfEh4BaRecH6bkqqKpikhHaAmVNFU80kpEDuUCKusJarMLJp9l0RKuKtn9Y9rsV04-ocQc2QVrHV050g5ux4E96KMj0V6qHw/sQQLmZ4aayRVEZlQhVfPE-Zjm2dAG_wSXqI7kEWqXTQ","width":24,"height":36},"large":{"url":"https://v5.airtableusercontent.com/v3/u/49/49/1768197600000/f2psup3bws7PhbhqYOtppg/aKkYGbMhOFi-mmJ4G2sug1Q04lMrobBu5ojW64ltxbOylZHjxZ1qNNFHYNFrICUhD6dX4sBijPT0j1jhnZvbk4Z1X33X4x1GjRVXL4W0NuqFOAqvQ0Z7-KKdPhPgBF81oqtfEVOsSosVuGlF1yRNnw/nlQ3NwbNY2c0ltxhjAHSegdhnpJJTmktuCJJY7iFyzs","width":198,"height":300},"full":{"url":"https://v5.airtableusercontent.com/v3/u/49/49/1768197600000/XXrJ_i9wMBwsrM_EM-PzWA/H4p6d-IgD_bi_dM9Q-4Krkv7Biwfb3AuOO9sHcyPeZ4U4Zd983vJCAflE3hM9fMBWLf4zZSXVxlu5kCtsZT5Ypo3i56sZdrDmc2yp1mmJZuby1arBML4TO4q--KRLS9Ll_vV13ilL9qxnrlDg2nkaQ/lDaBqXikTB2Ql_PGlFDqoie-VccO55rLcBUrma_Digk","width":3000,"height":3000}}}],"Authors":"Chad Wesley Smith","Readings":["recaH94xFL7yaeyy7"],"Date Added":"2020-01-19","Genres":["fitness"],"Author Background":["by-men"],"Number of Pages":218},"Read In Year":"2018","Page Count":[218]},{"Id":"Sun 09-30-2018 to Sun 10-14-2018","Started On":"2018-09-30","Finished On":"2018-10-14","Book":{"Title":"Thinking in Bets: Making Smarter Decisions When You Don't Have All the Facts","Cover":[{"id":"att6nlvtbZy7ayI7v","width":199,"height":300,"url":"https://v5.airtableusercontent.com/v3/u/49/49/1768197600000/cAp_JBY4QgKqUOcQsuM99w/zc_3eEQo8AGFB1L4foZ4te3SBGVQNmcG1AFG6AevRRWLCKxO2nLaHUlqDjq7KktvVjovFLZLU44dUMYdnLex0WuiPZhRy9DxdY21DVjKMX0Ua6QbU5vbsp46OrDLpXX5LNEdeAChQ-nNwVji6pvK7Q/Y38Olf2Z_j3BN_6yKsY_w0fzm-KE_nZmIXNFErYbT8U","filename":"35957157._SY300_.jpg","size":12689,"type":"image/jpeg","thumbnails":{"small":{"url":"https://v5.airtableusercontent.com/v3/u/49/49/1768197600000/Um5Su3y6tvSqLcuT417VrQ/MG3dncy-pW4mvzWIFSwqq-GHdqdncA5forp42JJ6v7RGJzj8dd835dIK4-zRPkkW9o_WD2P9ok9XW9ewVr-JroYga_PKHHIfBhN6pUYxkHHN7Oy_l9AdqXYoq8mxO70MNUFO8jnAZK4G4H_FEjPIsw/jbF6tLdrmZ94uvdpiFOc9p0jcnfvJ-rvwJ9BYBAtZLY","width":24,"height":36},"large":{"url":"https://v5.airtableusercontent.com/v3/u/49/49/1768197600000/HNoMTSBlVRMPvyHE6fVcqg/-y3hwOyUlau29tbcRJzMzBoWhb85WCFa-lUsi0rPj5v4_UQKFwGB-Ap3h4x_AcjQGI9SOtfxEy-hcjJpevbwNo1oo58mC7M1wGORN80ENnBNI6si8Am1BGQ_lp3HwNeFQ0UzTQXnf5m-lDOj5J11EQ/oGsg9RvgvgKZDzys_YVu-0nfcMKumL0kvv9F6tozggM","width":199,"height":300},"full":{"url":"https://v5.airtableusercontent.com/v3/u/49/49/1768197600000/_JkFY-iEfHENpjs2YDDo0Q/fPbDVZ7xtSgSlg3PwVj2eRUjDFblrxLg7yqO72xtYV3b3iLo6HS8LNUeLA8vYkw28rY1uSy1AgDefQ3MBPYdbqqkU5uGeC-aYVY6WRcogWVs48qwiv9Lm4SDJJ8r6X9UicMRfXyYkLt_g-RsDR74GQ/QayGNZ75XCIZTSA7WtXCWF7Rfd8_1w9NL27JinEJ0-s","width":3000,"height":3000}}}],"Authors":"Annie Duke","Readings":["recf2s0MRvLpGqAZk"],"Date Added":"2020-01-19","ISBN":"0735216355","ISBN13":"9780735216358","Genres":["nonfiction"],"Author Background":["by-women"],"Number of Pages":288},"Rating":4,"Read In Year":"2018","Page Count":[288]},{"Id":"Sun 11-04-2018 to Sat 11-10-2018","Started On":"2018-11-04","Finished On":"2018-11-10","Book":{"Title":"The Bullet Journal Method: Track the Past, Order the Present, Design the Future","Cover":[{"id":"attgJWrbPnZH0W5RE","width":300,"height":436,"url":"https://v5.airtableusercontent.com/v3/u/49/49/1768197600000/qpTKVZLkFuTSe67bPxolCQ/Pz5FMSzs4-I46riJryaN8SyCS5GmB4TFoWiaJPLiwyUeq3iiBiHHfIMXfxJ9es8Dr4iY35iOzI__TDELrz3fi_pL7kqgpW9wQ_m2GHScZPSHb-EmbNNtMKhpIC4K73p1iQswURFcbhx8JwWD1Tbw5Q/nRRn90gqvvbRtEK1keYEQT9Re5ZWNrFtr4fBNRfo6uE","filename":"39071691._SX300_.jpg","size":48953,"type":"image/jpeg","thumbnails":{"small":{"url":"https://v5.airtableusercontent.com/v3/u/49/49/1768197600000/XXoUrv4kVJpZfSrUxPi1aQ/vHgk8ny0wFIXNrKTkiMNjf_W8L82KxHgJs3reieVlLNFawsZ2-twIs_AWGyxrBlJRagWPqK85RRrk4_BTMRg70nu0Kc1ejbkwYn6cO5jiESOc8_KLeLRqzXs_Jrv98zYMTxz44KG253lfBBd2VWlXw/tc_QIVhktFVSm3tLztuECTHw34pp-5qFbZ2cgAtgrjM","width":25,"height":36},"large":{"url":"https://v5.airtableusercontent.com/v3/u/49/49/1768197600000/g2pw_H1rDNDyXrxEmqOzRw/NQRSQJF6uiKu4fBvAu5vx7cpW-63quUeDEqYPEpZ5bG78jkfUObVmJ8fqtHJsppg79UbFkEY769PdLGp-JMVpFWGAYA0IfO_CmSrSy6KVcUbEy1hwYY6XfyoGEYO6zZdOmrXN-sWCSiTpgE5CQ40Kg/Ee8EXlq21puNFBSXItjhmbjyP4j_nbzYigi51Z_zww0","width":300,"height":436},"full":{"url":"https://v5.airtableusercontent.com/v3/u/49/49/1768197600000/pMH3_Yr8KGOGvzYL67xVZQ/28rf15GBOei11dN2uWo3EZZHNVAxKZ9eS26BStxRhLfwMa0d4nEEGojjrIQfiUSd8wD73uz1VerhJ2PlI23V3yNtyxiqNKFW84cAqc-VM-vcMfkmSkYIDQtS00WtZ5o1S1yAUnufNIXinxUNMDYVjQ/Luw-b05lvBhy8LnXBbnEoqT-zCGaGSutsBfYpTEbf1k","width":3000,"height":3000}}}],"Authors":"Ryder Carroll","Readings":["recgtPAxdgc2T269B"],"Date Added":"2020-01-19","Genres":["nonfiction"],"Author Background":["by-men"],"Number of Pages":336},"Read In Year":"2018","Page Count":[336]},{"Id":"Sun 04-29-2018 to Tue 05-01-2018","Started On":"2018-04-29","Finished On":"2018-05-01","Book":{"Title":"The Lamb Will Slaughter the Lion","Cover":[{"id":"attR4cRgNVFLL9nKW","width":188,"height":300,"url":"https://v5.airtableusercontent.com/v3/u/49/49/1768197600000/o-u3ez9Y7YR164ZdV6tf7Q/feY_OO3gKTQeSRUX4irIuktEWeZIluKqoz83-eRf8-sOGEpmCTQjwuLMtF2wpc71FOeEsQtb1s0U-dN0yOlje3Jyuvc4-r11pkuTw2zxWF55srZ8V4EdKTJrw39Rh3kErIQ4Lp-nEzZ9EguSlfLdPw/xeS7t4Ib3g-CSPxLXKGUos0fuqdzqXF2HrJMeuLUutw","filename":"32606889._SY300_.jpg","size":13348,"type":"image/jpeg","thumbnails":{"small":{"url":"https://v5.airtableusercontent.com/v3/u/49/49/1768197600000/ZtyZxep_FbRHA3ZSkjPt_Q/l4BdS5_BAQbzwxotFk9VLRSAPAknNaB4vxyBIbCzHwUedNKKTtv5qfQ7ui1EjZAyR0SoaQZubZAWoTH6EANocHun0UGtMzVLxQkMzG5BcsEct65gDMZ1HFzEvpgfHnQNTL0uD5u2iqbMJeP3MNkR_Q/vCRJJiuvqOiojnkPmH1-izXncTmpcSFnBV5tPOWAGeM","width":23,"height":36},"large":{"url":"https://v5.airtableusercontent.com/v3/u/49/49/1768197600000/MjQ50dnV-n4mm9pHDZHiSw/w-_ppXc-CdUetIAxEFHTQrxbFTjdriwoA9FImP0rI2Greh0wJqtmgiGRpk6LrbTdKlPl6tsBzW5UpomFZLxV4LUZAzp7vr6h9pg5XkB1TlO8NQMEyeYnSf8vHF2CG517clmHo_HQ720C7rG0Jp1xrw/cu67bs_5RvbX6Wr4ewrNIvkBOJVZBBFV_vUP1VrjNCM","width":188,"height":300},"full":{"url":"https://v5.airtableusercontent.com/v3/u/49/49/1768197600000/wcAxoFoXCQVljY8D3Uimag/X_1Zx3fIpDWuks7nJRs5B7PoS7ND2QSF04RrFpEpJokGHL8Mr1gQRJSNTo8mRYFKZ-gOz0FJ4snWyEBkVTDymzKv2wSURVQL800cuM-P7tBtvZSGYgGmtPdpjMpqqI7oInqhRlrt3acrXFgPbMqjPA/XJs0F0lkkxXe7C1GT30W-oaZ3LePMPiiPR3SiweLLiY","width":3000,"height":3000}}}],"Authors":"Margaret Killjoy","Series":"Danielle Cain","Series Number":1,"Readings":["rechhJgg0zx9HE1hE"],"Date Added":"2020-01-19","Genres":["fantasy"],"Author Background":["by-women","by-lgbtq-author"],"Number of Pages":130},"Rating":3,"Read In Year":"2018","Page Count":[130]},{"Id":"Missing Start Date to Wed 12-19-2018","Finished On":"2018-12-19","Book":{"Title":"Thin Air","Cover":[{"id":"att2eaGZZGw7bE9p5","width":197,"height":300,"url":"https://v5.airtableusercontent.com/v3/u/49/49/1768197600000/Cl9xAVkxhB9M3M1cpm2LyQ/TxUyvMA5ZrkhBRhBOskeBwJtLAIog8KD4NzBDl5GLBI5iG7sYvwWTc1BaUcrOMaMhEG_2Mu4mA2LbxEJ_7NHlOps4yeY98TCnNAIa2BwZdoFWmC9acfKXNxyfeuoPwZSzfSmv0wM0l8kVCpdRdja_Q/SaCXQbn6pIqUBXPQtZGMOCAi1gO6Eugw4NilalIX6Zg","filename":"25835917._SY300_.jpg","size":18176,"type":"image/jpeg","thumbnails":{"small":{"url":"https://v5.airtableusercontent.com/v3/u/49/49/1768197600000/Fp_PSBNbiMUkU_HQvXmcFQ/YIHUphi0Jh_1DpHoF6owbC5Pd8Ye1LgO9ffj2JyOr6r4N4u2t5ZpbkYxsKJnm6CrdwJ5txjVEhA2lK4CjAurSekq8IE_2dleSQvTJssTlLAFnJCef3UabkD7h87e6eC0tw_SC0BFuTgV3rhYarXVcA/AVKxGAKcm0vbaSolGhuAWyqdg1aDIMPfPOVptHiBWQQ","width":24,"height":36},"large":{"url":"https://v5.airtableusercontent.com/v3/u/49/49/1768197600000/38AlAYQPNaIbOiVmTOhH0A/wudk4n4xTWrqy1UNjSHIQfjaT_xOdM3lI1LcZyriGKawXFtuWCITU859ZbFZi0jlODmDkkrvXxOWjKa92FCTR-4tnKggfRjW7xOIsU6a_ZyDHJEZ47bMz1u5eOxfsMO8Zy5FgfVrT4X6TvqP0hFCog/Av-BqhbMc4q3b1nb4W1xl6oum0deZF9lIByZmsXsV6A","width":197,"height":300},"full":{"url":"https://v5.airtableusercontent.com/v3/u/49/49/1768197600000/_SA99i5qxmG2SK-fYyBREA/tiWwDRrzHna5tIb6mcbaeIddwrq3lQeOfpJqvSTPcAesD2gijD5ggHP2APeES-Vz4UMH2-6AP8ElQTzf37jcoamcQefyuIuiqGSvPdg7CnqUkC3AomA6BYH_EIJSxLbPXRH_V9i93WxgUKeAmGY8uw/i1BmQAXHnAfWAaBe4SaRrEnTeLUTK5zlOLbprWhv2mE","width":3000,"height":3000}}}],"Authors":"Richard K. Morgan","Readings":["recjapSEWFmiLle4a"],"Date Added":"2020-01-19","ISBN":"0575075147","ISBN13":"9780575075146","Genres":["sci-fi"],"Author Background":["by-men"],"Number of Pages":400},"Rating":4,"Read In Year":"2018","Page Count":[400]},{"Id":"Mon 10-29-2018 to Fri 11-30-2018","Started On":"2018-10-29","Finished On":"2018-11-30","Book":{"Title":"Jade City","Cover":[{"id":"attyEgyCeXxsxEoi6","width":193,"height":300,"url":"https://v5.airtableusercontent.com/v3/u/49/49/1768197600000/tBkZlfcfR5KkGPXKyLu1yA/E4eGo0VcXz4GOrv8cbxcn7Vm5k5DA73IdFWFG8NjqQ_WzBsoUmi8tuBo5aQzH_BDpc6XEcG2n7wOjEbv8Wp90gSDowV3P3q4ehmjsJDxHYBGzXi0fp4rFKJkAcjGssJU003Jm7xTvj7R3sQ9jIIQYQ/gAN7smRXzf2YFiBfB8Dof3PiZHcY-dkFDSUEWfh4avw","filename":"34606064._SY300_.jpg","size":16433,"type":"image/jpeg","thumbnails":{"small":{"url":"https://v5.airtableusercontent.com/v3/u/49/49/1768197600000/L7ijGRfbT9TkfvgD7I6bZQ/Sr_vBw3m40_A9msIK3Xr71crxnOj9ftJl6Ow9t3_xYzVPyGFxxzO8ile4Jk7A03p_V4svOOyu6rvVobOF_tjVXXsZDn2Xa_fNUEAJNBvAa8K93xRwCVkKd2ao1whVprxgTH8nzhPs2yUOOj95W_uaw/mYn8S9JBWY_B2yZewJL830MjRmIqgQHy2t56ki3rG5k","width":23,"height":36},"large":{"url":"https://v5.airtableusercontent.com/v3/u/49/49/1768197600000/tiofrKlSjdtUYdBwYISHtg/as1hD0FpECHbA_-wXN11CVqCy3PFFDbh8h2kHiygZiCrluLNYoEgS0jpvDR1rPSPWb2vWpPzuLA4wrxdZYF6CFJUVFxHZD9OZqRSODHEjYaNNYDLrh6SyDq3Ji4wDfVXA3pZstm4WsgL1PNfQccI-g/0ga25z3X-UvyKCVKeBjBmHnR7uiWXCGeE2nIH3WaMTw","width":193,"height":300},"full":{"url":"https://v5.airtableusercontent.com/v3/u/49/49/1768197600000/ztatBdGPrrzRZQfISXLy0w/DX_MDQZVPTuU530EbJB8xOh3pxVCT4-C_TQV3owY4Howg-4LXfMsfuCI28WfIVQjmWV8eICqdUpbcrkGILVO52Mk4b17E8bwUIopNeZmVz4qyjxJ_5K3O9NFBzaX5T4VKm_TrpDXRU8Ed6VYZGUAZw/rE_Y-Q8AkMAeAsiWO_lz2xOKBynM_3ie5X7R1xHR7TQ","width":3000,"height":3000}}}],"Authors":"Fonda Lee","Series":"The Green Bone Saga","Series Number":1,"Readings":["recks5flQDRBQnosm"],"Date Added":"2020-01-19","ISBN":"0316440868","ISBN13":"9780316440868","Genres":["fantasy"],"Author Background":["by-women","by-people-of-color"],"Number of Pages":498},"Rating":4,"Read In Year":"2018","Page Count":[498]},{"Id":"Fri 01-12-2018 to Thu 01-25-2018","Started On":"2018-01-12","Finished On":"2018-01-25","Book":{"Title":"Towers of Midnight","Cover":[{"id":"attIcq9jX0OiQW5RM","width":198,"height":300,"url":"https://v5.airtableusercontent.com/v3/u/49/49/1768197600000/NcOz39sIl6HMtm_X9Snpig/47R84DKdcjEn030iZWCzU408DJvlkYoqDgl7dnEnq4oqckKX9m7TADsWzG2-Q3e3gUAuzOW3hezgBfG8YUKg0YA9ze3RMd-UB3VTBfRniINQQ7RmdYU4UCIY_2hN1pnsui7TKaHrGKsK3Qd1RVP59w/dve18TMYLvOmtOUPJnEEqYft-5zibbDFKUG8lodWvPg","filename":"8253920._SY300_.jpg","size":24494,"type":"image/jpeg","thumbnails":{"small":{"url":"https://v5.airtableusercontent.com/v3/u/49/49/1768197600000/aBdVWSKq14g93n4LkKj95w/szKJJQD-8KHkIZgpBvumlki69h1YAdffuc8SaGLs1gJ2C_bBf_MTgZaa3c3v0a0zi_PjyX9kfUZPrcQ3YtmqwmcFLeUpZJ7ekmacDL19s1lufpG8BFWYWhpKMn-pj43rZY5TQn-2iX7wADnbHeI_PQ/RYRgnjTf1MyHkmlN9QEhBLtcxtBrM5pzGpIcNL_q0Fs","width":24,"height":36},"large":{"url":"https://v5.airtableusercontent.com/v3/u/49/49/1768197600000/xJQ5gYqJPFVNgpu96CqMxA/D16JYb4dg_JX7tHo86UusmOTuwuDKLOt_277DWI7Skqz19ctanbHrOR3ls1zc2dbwysv7NYXYp2sja00Daq58DOGVbRuk8bpbZnVKgX0CV8KVnU11MwbK97L08uL8WXFPXM0sx8TkMgLML8NCckakw/KBUMWYU6JOoACcvd8KsBq2W6Hi__tMR9xvEZkfqUAFk","width":198,"height":300},"full":{"url":"https://v5.airtableusercontent.com/v3/u/49/49/1768197600000/Q2gUGpaRrG-hb3-LVvoz7w/y8IFAHxk27w2O9oaDTxW6Gzk0f89GBdTBJcZYs3jYu83lcfr2X9fHpnvORSNvp_Xo0NKblm3o2_OoymKpNYS_s0tjxNdKXwveI_2m70oa2-OrQIaAojNF1XOrdKXmc3c3he-rFW9s2GA-QmLU8O3uA/ctD67QZA80zmSuVSHrhF9LsyQwSxyqycuAScWuC6jZo","width":3000,"height":3000}}}],"Authors":"Robert Jordan, Brandon Sanderson","Series":"Wheel of Time","Series Number":13,"Readings":["recm2bZcJHmtHwok0"],"Date Added":"2020-01-19","ISBN":"0765325942","ISBN13":"9780765325945","Genres":["fantasy"],"Author Background":["by-men"],"Number of Pages":863},"Rating":4,"Read In Year":"2018","Page Count":[863]},{"Id":"Sun 10-07-2018 to Fri 10-12-2018","Started On":"2018-10-07","Finished On":"2018-10-12","Book":{"Title":"Stone Mad","Cover":[{"id":"att5PV7gSlDg7MExQ","width":188,"height":300,"url":"https://v5.airtableusercontent.com/v3/u/49/49/1768197600000/GoHSiHwSlWCx5VbZi88tiw/n0Nm7_aKODMis57Zr4z32ymFwdqddMxK3YEESAf4540c80QYcHntOrNnkX21BWC9_Uw_SK6TErbPE7kMD5XMUHlcdC5hL3gNCnwMb2B31ZWXzUmAgIA8fDykWj15xFvM3o9yhxTPtzlkhtGoJtBC1A/hvLNbe43X7--qbfag0PHgum393cF2DTkRDVGGiIFlT4","filename":"34405622._SY300_.jpg","size":15074,"type":"image/jpeg","thumbnails":{"small":{"url":"https://v5.airtableusercontent.com/v3/u/49/49/1768197600000/JCfxzWvD-X1HG7rsAa5X1Q/IrXyip7NC2OPIq1Ni_JiLi04GXn6uBesBT_ujQt2JRU25QDDjvlHx4kQTv2tX_Cp8elp3OzJCpu3Mv7P0G6bvloexDs2_Jmmx-H8CiFQtBwRJA4qafTgdN0x8cXCYumI-cMfdT99N7T7L0QP6CFwFQ/e2w94keoFE1TZMCE8zcpL3aCdK8XqUbbkugdN8pp300","width":23,"height":36},"large":{"url":"https://v5.airtableusercontent.com/v3/u/49/49/1768197600000/7G7HA92U-fkwXGfS5QzEzQ/XSbcJv1W-jt9Wp7vPWckA5Sbg2OFGXVsPFGbuYLHkvzMQTq_YlOXv9piVOCSIVFPbRUwpSd2ZSJb4Az0kTw63aOn2v3SW8QKnjWgv7q5QZxtJw-oh-7bptjpti5k9Cg72Y51fINEi9Q6NWbqtbq7OQ/wkggkIapJbajPQUnBAnyeIdRcAv7_Fpp5AgCl6WWuzk","width":188,"height":300},"full":{"url":"https://v5.airtableusercontent.com/v3/u/49/49/1768197600000/T_dTpEhJdJmG-kHNBws89w/oqyY4RUu2l68Em-xGsy8GwVie8VEjQmwvHvwaEie_FohksGjyIyW8W5qOs6LJdI2Hs9OzS6mZEDLAQ0W69U3Dirn22rySfaDFPKMVq9eHem0Cco4bY4H074YbHrFhtEj6ABaCGfZsudoQ8qOrFXfRw/OaykJyfkvh46r1anQ0Tyd_SXwHyfa8zXvbFmeLPAEVI","width":3000,"height":3000}}}],"Authors":"Elizabeth Bear","Series":"Karen Memory","Series Number":2,"Readings":["recnVysMi8AIIeAqg"],"Date Added":"2020-01-19","ISBN":"1250163838","ISBN13":"9781250163837","Genres":["fantasy"],"Author Background":["by-lgbtq-author","by-women"],"Number of Pages":192},"Rating":3,"Read In Year":"2018","Page Count":[192]},{"Id":"Mon 10-22-2018 to Sat 10-27-2018","Started On":"2018-10-22","Finished On":"2018-10-27","Book":{"Title":"Atomic Habits: An Easy & Proven Way to Build Good Habits & Break Bad Ones","Cover":[{"id":"attwZPR175iuUpzCO","width":199,"height":300,"url":"https://v5.airtableusercontent.com/v3/u/49/49/1768197600000/2PAwuFh3Ar1nHxbuZcxoig/2eH-IRmah4Q9b02l9XlhQKYJsopO63RppgNnJUE4Pp2yN_xToc_A8UQhZrzvbf4zqGgjoYFeG30wvhimJjgGp8gtAKaCJcMX7FzxRhW7u4yqDqjFL9MK1tml-Q4oMUs5csOm51VZx7igNnFg9VPPpw/FUbBWTDkv-CmODwL1XePwa15fNkvHGyyPbxQKQRNwK0","filename":"40244063._SY300_.jpg","size":14816,"type":"image/jpeg","thumbnails":{"small":{"url":"https://v5.airtableusercontent.com/v3/u/49/49/1768197600000/JYQVCY2anvJ8jA6WiFifng/skb6epxHNC5HKtkLpY-t7VMI3E8h3WtWqQryNVqhCtXpwxWjXIjgk6LRsgp7f-H-DNhVU0mX1OPIvZX6V4LjQ4OhCduWKRkpe9y2mWuiS8kbZkj6XJJUiSNWWEKi5JADG8pUg19xl6KRQzdCPITXNA/1mkLKm_B-TlyE-wNrHVoJJwJV-EZFBdWGqlomR8xdlE","width":24,"height":36},"large":{"url":"https://v5.airtableusercontent.com/v3/u/49/49/1768197600000/sPVH5jmwD51x0JO1HM2IYQ/ZVITkA0ruJSy5VYmvMFcctG_l1IYhs45G5B1P-1s3-wTNd0jr8RrpjNA23P72GnCpK2t0iHivGA5MLyz9e2CubrUewGT9BxLLdOLmcnOu5zAHxIj2ygTk35lWByhtrx0zK2O78jVp-KIatZXLK1ezQ/Na6OezFJsQJgTvafOn5-H6N8tIgO2fWfHCBsRAziCbE","width":199,"height":300},"full":{"url":"https://v5.airtableusercontent.com/v3/u/49/49/1768197600000/Dsu_2vwkazrDuwWY-bQA8g/grPUmizWU8YK4FCgpcqdRrbrU6b3QKcOrA83tby_fUWXWir3Euo5X2ApoAEwX8KfKxwcOVplO3nfcKzUfn80UnH0oQu8pufg6TAfEn51u1vfEG7I_6dokZ4aZzezrv-Ih2JWlZ4aQ2pqa49J0RfPdw/SNQ_53HehlWlTNF0r5ih-M1DezlTu1UK-qIwmVrAYHQ","width":3000,"height":3000}}}],"Authors":"James Clear","Readings":["reco0Ssw3KLeIRwcd","recCoLSFgULOXFV93"],"Date Added":"2020-01-19","ISBN":"0735211299","ISBN13":"9780735211292","Genres":["nonfiction"],"Author Background":["by-men"],"Number of Pages":320},"Rating":3,"Read In Year":"2018","Page Count":[320]},{"Id":"Sun 02-11-2018 to Sat 02-17-2018","Started On":"2018-02-11","Finished On":"2018-02-17","Book":{"Title":"Autonomous","Cover":[{"id":"atttL8tIk40WXU4V3","width":198,"height":300,"url":"https://v5.airtableusercontent.com/v3/u/49/49/1768197600000/KqWJAlfWTF2Eqt6bIMSMHA/Ehy8GSMN08J9VjpZKJpIKKkecpzT7H--S0zMd1Ov-H58MeJkPsCBEDF-vyOSSDBwvcORFIJEdBcVR6Z78_4mfx9jxQDhiZd-UFpBtxnt8I81N9dQENkRP1zKsZ1oWv-RW01d9nzalZr9zcFt91D2Sw/xSDgk1YOdJ4GPBMmnj5i1llbIkdF2i5Fj6zi3Q9zTUg","filename":"28209634._SY300_.jpg","size":9497,"type":"image/jpeg","thumbnails":{"small":{"url":"https://v5.airtableusercontent.com/v3/u/49/49/1768197600000/iwr2SUKGL176TXEOmpx56Q/mvE7NzG4VPTz9DNWSL5aoW8rr3RIVqum7VOL7D22MNxVmuPHYzqB0Hn8ImcZ2l4gs4pKHkw6HMI4PlwZEc9nY2OgmXTc5hGHIDjjx4n5zJpdKCLjJDEqEO7AC12iGh_6Xew53vLYr4jry99p-VNZZw/evr0ATCz2M5IC8UHMGppNUABXsrlR3yEgVoIw7xF04U","width":24,"height":36},"large":{"url":"https://v5.airtableusercontent.com/v3/u/49/49/1768197600000/vzP_-KXkG8cYfevxf4TV1g/_c0UeUvklOoefEYVXbYmw9eSOgiv23oY-_rxNaTxRMBNAEaiHeUCY1l5MduQfcZpsq7M7lwhF8QuwCZt8ImwbcAuVkBCBhlDdYbQ-RAOXp4csd0gRjTkCc0xXNmSn7DW2DlLYRvP2qFNjQPBJ-lVQw/02XxdnawpwuXoTIzqY0Cmyv5obRmuMwchhKzAuJEggM","width":198,"height":300},"full":{"url":"https://v5.airtableusercontent.com/v3/u/49/49/1768197600000/rva8Qibt1N9yOC8i8KMp7w/7BL29KF93NUsEp4-XiSDi35Lj4qwIm1ABweYJnC4v3Alcl4RcB-URDTKs_Gutw1EfqDNOROmgGhfhDylfcFbpxIYGZzeIRQUx1tUiB06dxm-B29j8AqMLlfSYIPWx2VM_-CDbxrRTfK9vtdhwkbPFQ/bYPh2ORZ0wMMzrxCb7rnV1jFlUscw86fmgJ6EMxUzRc","width":3000,"height":3000}}}],"Authors":"Annalee Newitz","Readings":["recohHWozeSfeJjlr"],"Date Added":"2020-01-19","ISBN":"0765392070","ISBN13":"9780765392077","Genres":["sci-fi"],"Author Background":["by-women"],"Number of Pages":303},"Rating":3,"Read In Year":"2018","Page Count":[303]},{"Id":"Sat 02-17-2018 to Thu 03-15-2018","Started On":"2018-02-17","Finished On":"2018-03-15","Book":{"Title":"The Stone in the Skull","Cover":[{"id":"attNcGeJIVIFA0cEY","width":198,"height":300,"url":"https://v5.airtableusercontent.com/v3/u/49/49/1768197600000/w8OGp42SI5F7cpcXo74ODQ/NJhCy0LPgnFzUoqC2gBVjNSMbpqdaYm984s8NDJ8CLViD9nDzyCZOx7yIRYhtkLt74YYL3NQ4sr1dxbrfaqQQ5leZ73Wf_tmCnTPwYWxqZfqhkAe29G7tdg9HHt-kRIynmxonGXLhzPereNu6KmV8g/HxArZI0HUUTFX6RS1KT0y8_r4qCiD7nvnTweKXRbH_I","filename":"33517549._SY300_.jpg","size":16621,"type":"image/jpeg","thumbnails":{"small":{"url":"https://v5.airtableusercontent.com/v3/u/49/49/1768197600000/RywTZQ8KjaojXmIaB4jBWw/Or2l0BSBGR3X4I0k2XXewFYOehe9snpzmAXLbtgclDRDYH-PTRVZT4p9vNRqpQGpGK8SyRNM77Ru0d9gX-kPnhUZzUL344_zDJADiZFK4cRQ0ZwR4hL9igIn5t96J9cFLoCxDuJl2nBX8Dy0Ij7xBg/8aTomAInJ547XxgkafsTtYfDTrQ1xwmlv2z0WXOwHys","width":24,"height":36},"large":{"url":"https://v5.airtableusercontent.com/v3/u/49/49/1768197600000/LunqR9gugw1zToH0PHEZbQ/8e2VpabKwEoojNpXUVCN_4fOGZKcvEqfgNkHxFiTWZ1DLzNfeH6cquZc5zq9WZ1U9s8mYNpAbada-gpGL0GbedkJlhp152JnuMaf4Z17rvRPCk-lN-jRfhlJ6nSB7HFrj_uN9SI1sfjwXx2VmvpCUg/ROq3aGYWesRVmpHfJfbHdPePags88UsQdc2yUvbm_QA","width":198,"height":300},"full":{"url":"https://v5.airtableusercontent.com/v3/u/49/49/1768197600000/iIlOUpgWiHuhMe8YwWijPg/NNxXqhpOZ46lwq24-TuYCm5JtbqCc2aJ63SqYx7zRo0bjBOdJoJKKWXb-4ZSW_--7rBl5Zuy2aCSh0Ts5MKN9jdhjkB8UWynhHSZOZKowJt4H4MfjzrlgB84n1inb1cWu8OQ9-Ek5_Nu8dC0NNmyiw/sKXHEj2uczfI0Em10dX2TzAgJ3VTBMgrLEbla3D4faA","width":3000,"height":3000}}}],"Authors":"Elizabeth Bear","Series":"Lotus Kingdoms","Series Number":1,"Readings":["recqYqo380ZPJij5a","receW2r7bVqo1mH9X"],"Date Added":"2020-01-19","ISBN":"0765380137","ISBN13":"9780765380135","Genres":["fantasy"],"Author Background":["by-women","by-lgbtq-author"],"Number of Pages":367},"Rating":4,"Read In Year":"2018","Page Count":[367]},{"Id":"Tue 09-04-2018 to Thu 10-04-2018","Started On":"2018-09-04","Finished On":"2018-10-04","Book":{"Title":"Oathbringer","Cover":[{"id":"atto9gK2RV3xZt23a","width":196,"height":300,"url":"https://v5.airtableusercontent.com/v3/u/49/49/1768197600000/q164tkBoaN-qeiQZahNElA/7v5Wq5X2yJHFbFHKQnatluU_e_aSlmR2cUgNrnt-ugbkxJDeZg6y9sGvq53C72zCPssDEPQD0mEOz5oQTRB26enC0lIh3e3DMWKR6s_CwfO8tfvCs_6GtZLs2g2hshXfCSQM_lIHJpwOSupmolfbWw/ezxN0FxO7myxYR5SUuUghlWZQkfw6ylVIjsH8VbPoBc","filename":"34002132._SY300_.jpg","size":23982,"type":"image/jpeg","thumbnails":{"small":{"url":"https://v5.airtableusercontent.com/v3/u/49/49/1768197600000/iPlIAdA65lkPFidIxAVwrw/mImcJDLwqZW_yas43JqsvrGJFlhWbLSLCfLLIHWdrhODZbwDnkgvnUx3u-tu0FnEQTybIls1bhW9y9Z8fqsq8h7d2_PnOLaTgfIf9-mh5ioNP2XSJCWGx7NmwOB9VezHxEYNQ1E1uzsVJx8Bq0V5JQ/lGUiEagB3YOUJc_CwLAVo0ojgoHmsqzEdhAJfwwn8d0","width":24,"height":36},"large":{"url":"https://v5.airtableusercontent.com/v3/u/49/49/1768197600000/SckIEUVnEFWaiab5MyCjuw/BW5m614Ew70kXvNuOPoZCn8iP5_QhTwqwdDPd557v5JBYDpnE-y6xPYNI-U7SULgfK3KrqPtZzWGxt1BZqS7AbFYBMrkeB9FfbP4cbwM_vrGUPlAQW4KmDJtRtwqH_mEQpw3opmnM7rSi7-Te43MgQ/p8rPfdjtmkb5nSqR_b2E74vS_dS8DQtFn9NGs4xh0iw","width":196,"height":300},"full":{"url":"https://v5.airtableusercontent.com/v3/u/49/49/1768197600000/jufkky9QYfGfeELpluXPYQ/6llxTkJZ4C9oemCNO7b1nakc-xCyO-zcUN61IVfHRyfpQnymq6up-Fj3dTXt-4qwDSp1bnnH9iSYykifACDP1kXrh7c10PBxWfpOmvXus4gpGxLnl4SYhngykXS8bMQM2LIi_87xUX9xHRBokptdZw/qFRlOTtUrD80Rymiy7hUrmmiz1D6GtfnHAzwMlNtm64","width":3000,"height":3000}}}],"Authors":"Brandon Sanderson","Series":"The Stormlight Archive","Series Number":3,"Readings":["rectngJJfwShzTYw3"],"Date Added":"2020-01-19","ISBN":"076532637X","ISBN13":"9780765326379","Genres":["fantasy"],"Author Background":["by-men"],"Number of Pages":1248},"Rating":4,"Read In Year":"2018","Page Count":[1248]},{"Id":"Fri 03-16-2018 to Sun 04-29-2018","Started On":"2018-03-16","Finished On":"2018-04-29","Book":{"Title":"The Will to Battle","Cover":[{"id":"att3qouZC2Dn3HJOG","width":197,"height":300,"url":"https://v5.airtableusercontent.com/v3/u/49/49/1768197600000/VzqRLBDdL54du-lCqRqTLA/ib8CguViz1iIvZSvpugc2llhFvG65QoR7G0EI5mkHx2KZBkJptVJNuvr1qCri6zz7w17nTgWCH6CgVfiO5-VcdZXZ_yupllugKuArU8YW0WLHqATGNJPYTjapV7jDJvV063UNXgad9nC8oVPIOJIfA/8JjrRSTKmESpXidvzKrdgu_JInYuqgK7u2iRp7O-5wk","filename":"33517544._SY300_.jpg","size":14231,"type":"image/jpeg","thumbnails":{"small":{"url":"https://v5.airtableusercontent.com/v3/u/49/49/1768197600000/pVxAoNg76CE3P10A2vLhAA/iiTcuD0g-3FXCPcwtEu5QSwtoBS_MBhsST3UF5Sdv0AooO3nSh0I83f3iADy54uskIEkhgXj9J_CB6jPaIIRyf7fNCzK-DldxdlnYDxl8oGQxpBFyYFq2sR1leG4M1dRpU9i2RuzlN7lLgN7Mkq9Gw/2zPuKjyx3crd90SjrMbzGFv6Vu3pF5HcAerrLji6P6E","width":24,"height":36},"large":{"url":"https://v5.airtableusercontent.com/v3/u/49/49/1768197600000/q6g_ygQndTeMx5TbD7VXpw/QoyuhU_bTDkqEBMbmWnuEOFRmTlnWz2Cm_ukSsFsiIxZ40WaiEEwiLg7LtaHLs69YDB6jp1k6JHy5RScmM-ccS4_OVkfsMFxDze7nb-xwx2hOVc8v3DnMOW5itjNNYgfaaHVby_qw9NyYtZ3qAf4AQ/zmknfz9Kmaqht2-4p2xn6Ojt-Bu7WSyNGqUQ0APlQyQ","width":197,"height":300},"full":{"url":"https://v5.airtableusercontent.com/v3/u/49/49/1768197600000/IpiQe1rWJjPjYPE9KdZ-Fg/_uvT1ro_atXbcyEeief_h7csy7Bd3npaczLI8KBx3jiWikFJzsZm_YefBhJl1dBv_DADy_yxgQtmuYH3MpheSyvRZ-lpA7rHqM52Aew9ZL0C1jLyYMtkwukncXqWM4s08Z14YT8b_2UGY1eG_LMrmA/qxdD4o3wbqUh2HRY1uoXbn4Oi80vFGhF3IWvum3OsqA","width":3000,"height":3000}}}],"Authors":"Ada Palmer","Series":"Terra Ignota","Series Number":3,"Readings":["recu2qbvwW5auv0xz"],"Date Added":"2020-01-19","ISBN":"0765378043","ISBN13":"9780765378040","Genres":["sci-fi"],"Author Background":["by-women"],"Number of Pages":368},"Rating":4,"Read In Year":"2018","Page Count":[368]},{"Id":"Thu 10-04-2018 to Sun 10-07-2018","Started On":"2018-10-04","Finished On":"2018-10-07","Book":{"Title":"Artificial Condition","Cover":[{"id":"att8ibNaH1wo1RiWG","width":199,"height":300,"url":"https://v5.airtableusercontent.com/v3/u/49/49/1768197600000/HfJApLgqhR_klq9q0m_Ieg/sp5Dvu0ESy85Jc7yNwjX4mSCNMe0l6ZYv8dT5wvb23-AQlwnhnYOrFew7UhMBWDSWrckoxnqeetyrthhDrt5MLHFPhOpBh6NZ9bT7S1cTBYhlCXzmbRwmNDCIEsblyAq3zFTWlAupi-eLHgvpIrK8g/4Vbh_vGJ8MQD_GhNik0YqpQc9tE_FoNQ-BqGvjqI9is","filename":"36223860._SY300_.jpg","size":11895,"type":"image/jpeg","thumbnails":{"small":{"url":"https://v5.airtableusercontent.com/v3/u/49/49/1768197600000/1DXILfvz8OuJtST6Z_tlBQ/i1kpgXioI5JKpjTrr1GjM9PXW0HC1KQ6MkFv_1oviLTCKrMPi2uZ1xh-LHJrwiXfEshS3X1vApREHyb3B8h9SSHTTkZHgN_kj5h-W2hx4gs7iTqu_JFpau9MKtbxccyRasuskeRxnPTEoEad_XcbUA/J94_ryy6UHPeQlwKO3XxeE8a-OkkT5gUSlVfejGUFFs","width":24,"height":36},"large":{"url":"https://v5.airtableusercontent.com/v3/u/49/49/1768197600000/T986vi4O4vDh1vlVIccd8Q/lnlFjpyABGX-X9Ns3ciO1yGuEYwxg2M6_vDAovsaxala_Gt8gjXfwUBoTgkNKXdWtgDM96_KkvhPwjaSllE6j9SFYw0QV48x_VOVL1jVD_BPIpyyH1g3IDbwPQWL4_xDoTaVLRLrdAZ0greH9qDyWg/pkAaajRWHsTCHogslZB2j-3Z2viDIl0dUUeXwLEhMTA","width":199,"height":300},"full":{"url":"https://v5.airtableusercontent.com/v3/u/49/49/1768197600000/WiJgvEmMK2Mcex52htazdg/21MDb_9mglvsjqqGEkyu-y01-H7IhwpztDWLFnG6I4Zas1HfqyqWpzLU7UXH5IO9au5oN0CGi0E_iu0BGuCW8NNOmIQv28H_HAsxQ5WEduaV46gf9yUBVUBA3GbldkJmzoc2g9gs5C99ksaaqs8_iQ/PobpBQG4OXsPyH8BhemtxY_vkhYvUJ-_43MZxx5hGXk","width":3000,"height":3000}}}],"Authors":"Martha Wells","Series":"The Murderbot Diaries","Series Number":2,"Readings":["recwUIuV38bA0b040"],"Date Added":"2020-01-19","ISBN":"1250186927","ISBN13":"9781250186928","Genres":["sci-fi"],"Author Background":["by-women"],"Number of Pages":158},"Rating":3,"Read In Year":"2018","Page Count":[158]},{"Id":"Tue 01-16-2018 to Sun 02-11-2018","Started On":"2018-01-16","Finished On":"2018-02-11","Book":{"Title":"Me, Myself, and Us: The Science of Personality and the Art of Well-Being","Cover":[{"id":"attYlt7zNsugzlHjW","width":188,"height":300,"url":"https://v5.airtableusercontent.com/v3/u/49/49/1768197600000/PGJdz_JMZWNiMIYWAnlQhg/cUCWkiCmn3611r7k33Y78Ui2XAL56-EGgruwDs-FjsebceMi7HPAvMUMUxPXuiv-jsP0FmQX18WVvh4Ye3CcCxrZeSZfh8ty_f8ui4kCRYeWYfa_KnTBKaECG8XBwtNnjxBVlJ5VcQn28pY5yGQr-g/RovS19udjAQ12nHfSJDCg0xIW7TNxANeVmiK6a8JrsY","filename":"22512853._SY300_.jpg","size":13702,"type":"image/jpeg","thumbnails":{"small":{"url":"https://v5.airtableusercontent.com/v3/u/49/49/1768197600000/8g6EC6YydO-IqNbXHo4YPg/mDq2TgX6HiRk1-cfkGESJo-uWeYfXcAdTQcnBVUQwVDsTMy2E0W4J-wQQZiFXxFO-NLNApjAgtn556a-ec20qq0Nn0Q6C_iTBmgqHRsjVe7b1GM2mb4LqOCgmsgJuTBDnGBfKyyHLjit6x8oaDo39w/D3sSGCkR2yJ9k4x6QlrTrQY6h0e7oj3Qj7cEky8d-dg","width":23,"height":36},"large":{"url":"https://v5.airtableusercontent.com/v3/u/49/49/1768197600000/UBNvIP6YnjdNqFD9bNbijg/xYEq-7YxIoYruuo8vr3F0t2m71FJEh5yc0hdV3xgcxfv5qa024ERDZ79hJy5IXQIbJgmntpLhsg1ji-R2lKwbKNHk4rEHSY91cCGs6ADmP-8d4qzMWnXSQ5Phd9WPJJh-DTtAHMKMnC8i0a1oMhUVw/rhoFkTZhIq6jhS6WF1TrsfjjWdDxoqZ3mqKDSD0OH0M","width":188,"height":300},"full":{"url":"https://v5.airtableusercontent.com/v3/u/49/49/1768197600000/1C5wO7MuAHqNoCTGRP_F6Q/wTcTgAOwWRWitV-om9sU5eEWBfwIEJzQDlpnRW_yWb9oq2N5-_dfPYuQ0iyTtowNEizWHzkGL-4a5y2yncaUA3IRQRcOinnf_qBd3VM_bx6psWFO3qWA5sxUAMcMZVossQVgsy2_ygNF0q6ml-UTPQ/0Avz5HUSb1f46J_eXt1sghwL2-Jdmmsqb1VPyuqFWG8","width":3000,"height":3000}}}],"Authors":"Brian Little","Readings":["recwo9au7B49BtwqK"],"Date Added":"2020-01-19","ISBN":"149155181X","ISBN13":"9781491551813","Genres":["nonfiction"],"Author Background":["by-men"],"Number of Pages":288},"Rating":3,"Read In Year":"2018","Page Count":[288]},{"Id":"Sat 06-09-2018 to Wed 06-13-2018","Started On":"2018-06-09","Finished On":"2018-06-13","Book":{"Title":"Gods, Monsters, and the Lucky Peach","Cover":[{"id":"attfPREf5IvG2SvUi","width":188,"height":300,"url":"https://v5.airtableusercontent.com/v3/u/49/49/1768197600000/4FZcXq9o2n3VliF17Bzl6g/n3sGJW13BllrO6DFr-JLamAmZVaskH6BctOwYAzYZmcTIjmFrz0xKukHG-W8Rk6RJRnJ1496dmMRgW6cObj7n2KVOln5dQ2kwoBkVlgWdEaZxdmuwYVsIXTzJMTgZMpIOTbQb6oK4ALNm6r8rmMtUQ/zrwDiHde5jHsY-_i1dFrFS7I9bvlzKcbla-sv5lVejg","filename":"36187158._SY300_.jpg","size":18871,"type":"image/jpeg","thumbnails":{"small":{"url":"https://v5.airtableusercontent.com/v3/u/49/49/1768197600000/5-YHQtqoSEWg-yp8fOZnFw/jlqWualQc71Dy7YylRtKy6sysrHZssxXwwb8NAY-FnW2j7fqgmjb1h-fm93FxHw5OV73uZwfO1tTAprORl03S6ZQLjMG5JIeqzxEun-iWHXzJ2vAWJHWo4EqYh--PzBkRQiP0waYKh6KQW7Uzpik_A/eYlIffIn1VRKipTcQxBMjmWzxIqSEYSyeYheEyZrGHQ","width":23,"height":36},"large":{"url":"https://v5.airtableusercontent.com/v3/u/49/49/1768197600000/j8hwBC3oTJgTOTX6GTXiZg/R1ckoZoMhdS6yxhGV26582iVXtJuvHEFEr8IlIX6XQyEINAGHb3LNrvgU0xpQxxCzNT4IRuswiE2TER8yGdZnyoqCVqYZUO6ZhxHSoncZOnR75f19O9Rhi-kQLNIe_NgArq7UnTe6RrRUl-ZsN9FYw/FfQxRHWy-5Vt9hItoiaHvewt7rlPeKAS21k1RFlujXc","width":188,"height":300},"full":{"url":"https://v5.airtableusercontent.com/v3/u/49/49/1768197600000/Epa77_H5wletjDIgfPFXjg/J2hCosn3_nxziLzfq_KBEZi65sTm5VfIpNiYtQnjRkA5dZz6CgEW3nPvc_mC-2NJ4JqN_L7Oa0bZ1Jm8BF_Aa5ICriumbxQpkZFe9KxWp8uJXHOehUu8tUv9Ikh2qxoZfUDw6tZIQR7_Zf2bjpeXwA/zE-sN-FxJVjMJBe9wd2VmJqfWbHNcC2aLpVGdnvXXvs","width":3000,"height":3000}}}],"Authors":"Kelly Robson","Readings":["reczqvQW8y2bKhcka"],"Date Added":"2020-01-19","Genres":["sci-fi"],"Author Background":["by-women","by-lgbtq-author"],"Number of Pages":233},"Rating":4,"Read In Year":"2018","Page Count":[233]}],"stats":{"Author Background":{"by-men":19,"by-women":14,"by-people-of-color":3,"by-lgbtq-author":4},"Genres":{"fitness":4,"fantasy":15,"nonfiction":7,"sci-fi":5}}}],["2017",{"readings":[{"Id":"Sat 11-25-2017 to Thu 11-30-2017","Started On":"2017-11-25","Finished On":"2017-11-30","Book":{"Title":"Winter's Heart","Cover":[{"id":"att4UHnlR2NacRm2G","width":200,"height":300,"url":"https://v5.airtableusercontent.com/v3/u/49/49/1768197600000/3yj690EUPN6jCMZzYdr7-Q/xDKufdwFukbqW-V-mtGkK430paatQBQdnZf2P4BZIctxCmUi76SN31Zd1U3v7Aea--vT1STCFSClHgvS9y3IKmkwK2inWmBQfZUo1CvGqEqA-Fr5ioHqOQgENBVOBSamhgwsp4KL2ec5nhJ4tvhbvQ/OJTJ7PHD-GmEgjS168GvaIGGCx0nQZuT_S8G8-9ZvXY","filename":"13891._SY300_.jpg","size":19939,"type":"image/jpeg","thumbnails":{"small":{"url":"https://v5.airtableusercontent.com/v3/u/49/49/1768197600000/Ezq7tgRTK07xOmBq-JdrgA/jWf8T9VFmcnA77EskKeh0LpJHTgaZvtQff6EPdhBK76vzuWNyAPijOwlaB2FZhYA8kYTK-GxcaX0kPL43rLgw2MFdAqCs6jf9ELdrXFx9KAWBnNCNuvYAKpJEXA_emFS4UNSUwpXiJU99MWRt2EUUQ/FUGG73flp4A72mlXQTbJpVyxUqZUgT7GpxjHuGr15E4","width":24,"height":36},"large":{"url":"https://v5.airtableusercontent.com/v3/u/49/49/1768197600000/wNlbrKf9UASGCQfNwyQrPw/ZcBU5eRk5aP_bQHFtAarfw21w740j-tGn2JRkhXNLF8mWBmhta6RavMQoJCzzVxyzHckOPFzgNgzfpVCPHaiYUn1TU4Z4rdpC3ma51ZSZo4J9ComblGwTa3kT3jQZzgPQqSsdUhOqh8-9_RswRcPuA/JicfH4qyKHwFTN3w8UFnu1wqhYhpJy-1N3p0a_aRiqg","width":200,"height":300},"full":{"url":"https://v5.airtableusercontent.com/v3/u/49/49/1768197600000/zwlF1HgbMfhx_tsYL2pK2A/LT-jdUXRNsnGQ3VDkcRlCsycmB8sueKTy5tNvLb3wjz_zLNCazN30dPvS3FLPQEj7IdOguLv1Kz4I-IQ0GhweAv1sSJC2NmWGCEaJYTQdSZCdqmaMI4LfBRowx0p1pY5zywMLxvqPzVCgeRKCWVmdw/eB1m8_E7NlgezQrbukpJWNVGXFhaLkILE-l_v15GnD0","width":3000,"height":3000}}}],"Authors":"Robert Jordan","Series":"Wheel of Time","Series Number":9,"Readings":["rec1cPTJUlKp3RlAl"],"Date Added":"2020-01-19","ISBN":"081257558X","ISBN13":"9780812575583","Genres":["fantasy"],"Author Background":["by-men"],"Number of Pages":780},"Rating":3,"Read In Year":"2017","Page Count":[780]},{"Id":"Tue 04-25-2017 to Wed 04-26-2017","Started On":"2017-04-25","Finished On":"2017-04-26","Book":{"Title":"Legendary Flexibility","Cover":[{"id":"attizcGY8b2wQ146b","width":300,"height":376,"url":"https://v5.airtableusercontent.com/v3/u/49/49/1768197600000/wTG9iR6UZP4uYl8nzOVIqg/xdu9pGYS-Xs4HU2uK4ln4r8wjVJ55PrBF1ZxibxBxjR9QXynkPvUdvBI9VwsFZ_Y8GrOapc5-e0rPf1fIbpgrX9yWivE4OStbi9NPwOefULGousSPWGDesP4k3V22RyKbZrRcoC_YCnzQzwb7znqHw/5WwQoze1whAxTaA-jPEo8m7STLyAnNAXYda6XqtQ8vA","filename":"34995041._SX300_.jpg","size":25685,"type":"image/jpeg","thumbnails":{"small":{"url":"https://v5.airtableusercontent.com/v3/u/49/49/1768197600000/LOncR8fkM9ETALgAZC28nw/jnGzrwh8OozbZootQtVV0k6vtFpGGP2nVqdixpfM5seixEMmxTVR9wgFeXhxkNl_W0r1Zc5GFbDtmSr1CEYqBFdKR_qKLCLLACErRuRoRMUE3IBNO1r27xy86PKxW8EDr4xEDq4HaLQFRuBwDQSaLg/f3KUPwswfnQEjXR9Hyea0sy8WN9ShJVfSMUHyGEdCbg","width":29,"height":36},"large":{"url":"https://v5.airtableusercontent.com/v3/u/49/49/1768197600000/P_AzIZVoYvMa6B11CmV_Eg/X35S2P3YReRMFuG69Go9TSmbtCIFTWTIKwdStLMiJLg0POTTSi2Qnc-EsGiBPDBH4p9ww9GDDPYz1VdDuuhbqtdbR4646df1o6JsqvQ5WTOCvDkqSoz1AqpE-VInoHSLcKyaj7CCua5f9HAZP2blEw/p7iu01py8CD7Qxsn5KV5epVc5toUJmVV6MJyjj0z0bM","width":300,"height":376},"full":{"url":"https://v5.airtableusercontent.com/v3/u/49/49/1768197600000/gw0fGlMjEHg9rH1cpWPHYQ/bQlgfyCHjOg94MzdPXJ_DiuhPfw9YaEVFUcGdCNfZl6KUSV80W1Tbo1t4V5ko7XTKLiyFr2OtmSDZHFbbALcRx-wT-KWAg5i9QgmEw9Sr8_OzRsQ62f2zQ-DRIubn055sSC1EpNyYTyQAS-eQC77Sg/DCgGt9NZLpsdm3vxnzNk6_3z1Z-7yn3eA8wsHPU2dEM","width":3000,"height":3000}}}],"Authors":"Jujimufu","Readings":["rec2dNyDPZET7GF3a"],"Date Added":"2020-01-19","Genres":["fitness"],"Author Background":["by-men"],"Number of Pages":225},"Read In Year":"2017","Page Count":[225]},{"Id":"Tue 04-04-2017 to Tue 04-11-2017","Review":"This is a wonderful book that I'm certain I'll be recommending to colleagues over and over in the coming years. If you're an engineer with no desire to be a full-time people manager, don't be put off by the title  this is a book about leadership, organizations and culture. There's clear, cogent advice here on everything from how to work well with your manager as an individual contributor, to effectively being a mentor to others, all the way up to strategies for working effectively at the VP and CTO level. ","Started On":"2017-04-04","Finished On":"2017-04-11","Book":{"Title":"The Manager's Path: A Guide for Tech Leaders Navigating Growth and Change","Cover":[{"id":"attVdDIl3LlYcD9W5","width":200,"height":300,"url":"https://v5.airtableusercontent.com/v3/u/49/49/1768197600000/rKvo3oAmrzCApJrWQMF61A/eeEw_AHYvQeIDCAvsrc6pmzUpjIlCMMGl5yltd1KJ3ZSvxTOc0lDh8e4HT83kG0vZLTXBndhr0jB9JMe5aJYeXrCPpTKMYoQlZXTQsDh4h3d7J6iXTpQRXuNFLJKLBtUuTESkEkAZF-3iQqMFjAD0g/aeLZfogqNELpClQSUezASPPsV3RErkEORAeUyTjEZPw","filename":"34616805._SY300_.jpg","size":17744,"type":"image/jpeg","thumbnails":{"small":{"url":"https://v5.airtableusercontent.com/v3/u/49/49/1768197600000/tUOtMVn06OrDTMbehkmPTw/xLFZK5996WN8NFu9qvhDgvWK0_j-JsHNXhWGpxVlyN5sr_P_viJo7AbLmNdqsB6g5bPxrJRfUV35-BXFeUCDgO2Y1EsNkmiAgGNoCJT2LMqLU8N4O0cRUHt0AXL1KM9fTZ_cUycKS75Y0wYAjnORgg/26uNIv5ePxf2QDYaScSf_ILezkoAdoGEHIMMQxEDL10","width":24,"height":36},"large":{"url":"https://v5.airtableusercontent.com/v3/u/49/49/1768197600000/RkGjwFzG5SNTYMdVsg6x3A/BgAZUT3cyLbztQbMBoQUVpEcV5AhWm0l9suGNjdCATU8b_TJHn0cIZUse8sOIeKtsFYV-m5T5P_tSZKXquKFmZ8D25GavowRXYnQWvSwAUfTyvv6h5o4L7oS7FZWjv-cAeEZRAvG_plYYu_QiM4dgw/ySwElMHTAQ7S6UWlcEv5r56gLvP5-doGzIZMou8912M","width":200,"height":300},"full":{"url":"https://v5.airtableusercontent.com/v3/u/49/49/1768197600000/xrFwfKuSecHk5khn6i4Lcg/Ts9gDnoMKzfuW_2GAyNTKKfAoqiP4bhHIEGNQ6vB0hE5q9hq8MyVkvFBqN1aMqQJwafCsYE00LnFqLz2jJAGDv5fbo5G1sZvp3VHRB2ig2pJm1GhxOPuGnA6iCgOE8HDSeSNrYrMI4srHsp9zB3MYw/pY7ah45R2kKoAnNtLj_fA6MmOqEGjUMYaLkIAj2A1P8","width":3000,"height":3000}}}],"Authors":"Camille Fournier","Readings":["recD6JlhFxUllwhE7"],"Date Added":"2020-01-19","Genres":["tech"],"Author Background":["by-women"],"Number of Pages":244},"Rating":5,"Read In Year":"2017","Page Count":[244]},{"Id":"Tue 02-28-2017 to Wed 03-01-2017","Started On":"2017-02-28","Finished On":"2017-03-01","Book":{"Title":"Zen to Done","Cover":[{"id":"attfKWqQRwJDqQCe3","width":300,"height":436,"url":"https://v5.airtableusercontent.com/v3/u/49/49/1768197600000/QI7bqXXfBin2N6gwtCZtgQ/kWhkVfuodSrX_xSsxgoP-ZekOaDpvM2-hmTaP9SD7gg1ANfviMqFgYXn3rGgTUVTYWYIqKpnrLfqFknofNGs9jATDt2e_delqy17_gTRbiXcMvY2wkatV_Mw3l1pNcxY3q_Xbw3HFSxfEjxOyDjsXQ/agibPoXCScmqoiTBosobQzT4T5zw4cxrZqLUcp6EcnM","filename":"2372284._SX300_.jpg","size":9720,"type":"image/jpeg","thumbnails":{"small":{"url":"https://v5.airtableusercontent.com/v3/u/49/49/1768197600000/QgGp_3ow6yph6p7ah4G54Q/Msp0E8bb5koc4BoJ8jlFtC9BbOh8ZuxAl27JpE-nqgQYdjfmJ52s8ctIMBmGJzkLbn5YCy97LKT6h1y3T_Wj96LFplLqtEis3eV-vQIdllsTKBdTfd1rHQMuEo7tCQckEevUcUWAxwIyxeGK9JtUQA/PVwADo9eV9QbmGNTjpbGLeFEHUClkbzcQP2dUvBoAvM","width":25,"height":36},"large":{"url":"https://v5.airtableusercontent.com/v3/u/49/49/1768197600000/-6jKtLbH9480A0PjXP0kJA/mhoYsOylVocd7kVp3nLvD-_2zQhe9_sZ8cD9fkPpQHA_I8PXnPxwpGnf7iJE1Z8_X4DF4RhBAAoMXlmdWUOKpIxSvoYjdrUN99rVx4N-Lc3_BZddilLgL55r9IxENLQ9_7OSv9UYjUq4WYOchCMUAQ/fmC890PHYEkjbI22RbJIyAlkHWof5SmSdXM31nqg2oo","width":300,"height":436},"full":{"url":"https://v5.airtableusercontent.com/v3/u/49/49/1768197600000/s_v2AFztNpCb6nHLZupAiQ/n-8a7mQ42PVEpBO835VX3znWKaC2DPzuB38wmQe_epSQ9Rju1cn4DFvg6D9_CUKERqJemGBqaYUpA-k2XySSvdD16yW0Z0LMyhcFF7Ka9AlWBdnZzVeoRHz3uWEyJ_qO0ZugIXqCNI6qr8oTJTAsgg/o0ywNrxHl8NrC2uHDGxd51Wzs6yfv5K4ryUxUgtXWvg","width":3000,"height":3000}}}],"Authors":"Leo Babauta","Readings":["recEBxxHSYvmfprnz"],"Date Added":"2020-01-19","Genres":["nonfiction"],"Author Background":["by-men"],"Number of Pages":83},"Read In Year":"2017","Page Count":[83]},{"Id":"Mon 11-13-2017 to Fri 12-08-2017","Started On":"2017-11-13","Finished On":"2017-12-08","Book":{"Title":"The Culture Clash","Cover":[{"id":"attq9VgfhaToDvooG","width":194,"height":300,"url":"https://v5.airtableusercontent.com/v3/u/49/49/1768197600000/DOWtClMU_4UjcMga5_PWBQ/B9HMa01w_5zn9HrjKBmS_bCq0X3s1Z5DsAO8S0Ibabr6UK6QPvEDjpchZk5eo_604t4OivqfiyDOP5oCDzFrrkIxM8F9NZ3A31aOYOs3vsmNXI5hXvryBA471a1J7_uatZwlxmChqCIrLmEEMQe7IA/qW3Ssqy7Wpg4R7l-UBkWVFdCSfI4Gh01-H8_vnrlvEg","filename":"159896._SY300_.jpg","size":12714,"type":"image/jpeg","thumbnails":{"small":{"url":"https://v5.airtableusercontent.com/v3/u/49/49/1768197600000/f1s_IqmQvBifb6LTbH1N2w/uRxFllTmrydys8Dz-CX_2o2DAgOq_dPMQw-kLbo_kICBR61j6BrC-AgThnNj7Z39xu78fzlM8biC5tZsu1ZP799q7_fS4A5sY4mJXWIc2NLpo5Nd46cfHpsZutolvVM3bc_xJJ6ho3Qi1srwVhDm5w/QxtZvYrry2fPG8pRpIb0CbA0IgH5OYNbYxL3dml8Rkw","width":23,"height":36},"large":{"url":"https://v5.airtableusercontent.com/v3/u/49/49/1768197600000/Or5v0pmnZGnw72DMbAGNyA/1_s0OOTDzDglfo9im9h1g3zS2rpJySXxPKkR6iMLjKJj4WOFe1Nr-TWa_NOa5QXvZKkta9erLfiRhRk9WiUVBOmmH5BJGEQaa-p2_9KF-LmRUwEe3fVBRE1tguoFUHGgxwmoYr7NJnLCvAihpONhkA/27BNsLKo7lz_OyXiz3UZE5dBejnbBjrHadWP_1cdwJw","width":194,"height":300},"full":{"url":"https://v5.airtableusercontent.com/v3/u/49/49/1768197600000/pRfyxyP5W8kD15R0cAthMA/NUga71vzxU_qAsbdJaU3x64M1RGuqu4ViZarWR6TCL1RarvHbt0sHRN7TpIh62ZJuIZOvSLSKU1y80svWcVCzHpeev4tJVdmawdLuASNcYFCxVc4e5FPM0TVRHfOUmEhbl4EU5JmTGnrLABgpDiWLg/Xk-YzIwkDEAtqa4LsvUpSGdXMmmsEsmFsQaZWObtkA0","width":3000,"height":3000}}}],"Authors":"Jean Donaldson, Ian Dunbar","Readings":["recEqjSAxldg31QrB"],"Date Added":"2020-01-19","ISBN":"1888047054","ISBN13":"9781888047059","Genres":["nonfiction"],"Author Background":["by-women"],"Number of Pages":222},"Read In Year":"2017","Page Count":[222]},{"Id":"Mon 06-12-2017 to Mon 06-26-2017","Review":"Wound up being a disappointingly shallow survey of a bunch of topics I'd mostly read about elsewhere in more detail. Might be a useful read for someone who hasn't run across a lot of these ideas before.","Started On":"2017-06-12","Finished On":"2017-06-26","Book":{"Title":"Peak Performance: Elevate Your Game, Avoid Burnout, and Thrive with the New Science of Success","Cover":[{"id":"attNcvq8H9cy1qpXq","width":300,"height":448,"url":"https://v5.airtableusercontent.com/v3/u/49/49/1768197600000/-aigHxJCWGm9rUGKQ3WiHQ/atK2svv12zzngtOnpwPB04T_eWeabMCxXXjnY9aRqArknlDHL_jWmei_28BrsTI-7snGc3662w-Uih9uwxjD1xHl_4H7YOoE8404rMUEe8lVgTr-3xa8f1DtqTFanNBquvQhiFiuSfOztOJRBHOhRg/o0OlETsH6buAeeCxTNZbaU844_jK91LhlpwCKbwnrvI","filename":"31450959._SX300_.jpg","size":20436,"type":"image/jpeg","thumbnails":{"small":{"url":"https://v5.airtableusercontent.com/v3/u/49/49/1768197600000/DneAObR3AO65QtNgMrdGfA/hbqLepQSO7t4im-D00KMNaWRuIVYJvj0R-rHMD9YbhRwyg9hu4caSheQJXgA1IMXcr3LAWSFsLUweNxRsTm6Yg5tX6XiBO5huGxGgPEBilshvSHTnlt4e7qMPEu6jdPPfppHIr7VigiyZbCLw-zKsA/MARvhmKwdx4kOygWIwDUSrmcwkUvGiAnyQP7ZF425zg","width":24,"height":36},"large":{"url":"https://v5.airtableusercontent.com/v3/u/49/49/1768197600000/VgZBatrEEv-DqdTXlm_pTA/W5VpzxR5zuNa8DwuKo2_ZnTIN3vQMNVHG7LDJkB9hhssMBlK9SDMZrlUAVjZfqk9hpsnvtpV_NbqPq67wZhn10yGsOWhAm_zw_lWrNgaQ3Z3W01XNVpBhyn6L3Vewg0q0NleDzYM7I_6V_I-yehMDA/wfpW0DVUk-PPyIGOqj6DLS8apTwp2ETyRoUO_XCr-WM","width":300,"height":448},"full":{"url":"https://v5.airtableusercontent.com/v3/u/49/49/1768197600000/ZI8GK2RrTfMpknnPLU06xw/mgLUdjO9bmtiox2xIMmhU8Oh8_ZCiNEqxFmMhGb-nDRY5QtqntwYMw6SxJr7wqVtfYOYBJNAqZbF_aqttbi0mtZne6NLu2MUcp59N9gn_BZb5ryNVsMfbLKqBCDgvc7sJ6uqSYsTzXagVkiVY6BrtQ/68TLne_B9tn0AgaqbttPGMUmxgD6XHDn1B9yDMx7cZQ","width":3000,"height":3000}}}],"Authors":"Brad Stulberg, Steve Magness","Readings":["recGv2OArFLDcPbkd"],"Date Added":"2020-01-19","ISBN":"162336793X","ISBN13":"9781623367930","Genres":["nonfiction"],"Author Background":["by-men"],"Number of Pages":272},"Rating":2,"Read In Year":"2017","Page Count":[272]},{"Id":"Tue 11-07-2017 to Sun 11-12-2017","Started On":"2017-11-07","Finished On":"2017-11-12","Book":{"Title":"Perfect Puppy in 7 Days: How to Start Your Puppy Off Right","Cover":[{"id":"attY74eyGqyXegQXa","width":300,"height":390,"url":"https://v5.airtableusercontent.com/v3/u/49/49/1768197600000/geU-u0LeqJQsmOcwSKKr0A/vuC-Lkmix7z_4oAniLfWamgKYoj3WrJC_ZRqiryXieNz_s3uPoViBUZtZOEpaaQ4dLkqqGyVWGJWNGuNMS3NHUDk78BaCQSbqEA8flLON7HhdyjS3N6BqCGA1ZDHrcyS9rVYjOgqq1Y0gXeVc3aPdg/mD5Qjfh-e86ZtHcg1lSs1cqU7FszDkBohwWLQOYnBcQ","filename":"12570489._SX300_.jpg","size":22046,"type":"image/jpeg","thumbnails":{"small":{"url":"https://v5.airtableusercontent.com/v3/u/49/49/1768197600000/arTDp-NJARcH-fhQODrVpg/GlEZMWzHaPggP9Totbzgl1UJo0NDhcTffyqGYwbnU-qH8QGpPCGADY115XBI_ofZqHb-2anM4QGFW3P2qyBbAyiZEFMu0RsdW2h1mBWX8Atzt8-oIJPk9sObWZo5aNeBSWLmExvvW3LZcpT_seaKSw/Pq6jgesWFnvUvzVDgGL_M3DtmraNFfjD_xssAIUzGow","width":28,"height":36},"large":{"url":"https://v5.airtableusercontent.com/v3/u/49/49/1768197600000/Dp7yN2ghxlZckdTn3_mDcg/SShAvIl0LWTAhS8paiQClRukuGEJNdj7DA6dcSLVQjZ-2S_LpAYfnh-EgpJf4dQMHDaiEJa-TpBky_41qni2iOCwoCzqZ-efc7GSnSOawfM93lyosQe7Y_mH3LLRrHroVRRqQW9qtBc8Gn3tolusuA/snTM4WieQCPLOtbZVxPAInBhzOPO8blPaJa07S0XtKY","width":300,"height":390},"full":{"url":"https://v5.airtableusercontent.com/v3/u/49/49/1768197600000/XTB79878L2uRVEyhVOWV5A/XGiUSeUJzhwf_ej0jH8U3Tt0AfvUONn0Uufb86E-2irvgwuHCAc_fHzj4miJWplJQNsrpnz6S-54KcRzVGjef9YKRV3emozy3PFBmqiXiT7Ii5oA-vzT13krnKeixeC1i7uzhUrejuAuI2rLiPAhbw/Mwul8qeh8NiA_ZHi7t9DkxsYn0xs9f7tftY4vGDoMbY","width":3000,"height":3000}}}],"Authors":"Sophia Yin","Readings":["recGzNIl2IyPxIVOf"],"Date Added":"2020-01-19","ISBN":"0964151863","Genres":["nonfiction"],"Author Background":["by-women"]},"Read In Year":"2017"},{"Id":"Wed 03-29-2017 to Mon 04-03-2017","Started On":"2017-03-29","Finished On":"2017-04-03","Book":{"Title":"Turn Coat","Cover":[{"id":"attFAyOTq4A4GlMo9","width":198,"height":300,"url":"https://v5.airtableusercontent.com/v3/u/49/49/1768197600000/EltpudxhCrdKabMFKgt8lQ/o0inxMOXOj4kADtFdtQrg7PggTiehhM4FS9x0aYcyUUKsbY-ScbIXxUIEuovU81faDS1FFYCSG7EpULyqUfFAtiFKqYDmzl05eYn1MMN3HftQJ43ZpXM1lnVw3ZRwJrQyLgkeonjWG-2rZKqNaC36Q/ToWKEIyAxbH3wogmCNVUeF-eMDDDT50ykRe4LeEnUuI","filename":"3475161._SY300_.jpg","size":18185,"type":"image/jpeg","thumbnails":{"small":{"url":"https://v5.airtableusercontent.com/v3/u/49/49/1768197600000/F7g1UTsfDqzRDu2BkionnA/T6642o3TtlFgNW1GdLDCf0xrCLyVVzDIVILa7wsy56IqfPTxzHRdnPEQM2jmFCVKfKk2pyOp_5jDN4r3UkuNyjn8RRCwzIoal1W63vL8ypLGDdWME-D9STe0CBO2M9DlIbFkPMVgszV0AhMZLXBwXg/t6dtBVBlRRIFMQR7WPqjvK21XMX9eyVAqXQPOblWDNg","width":24,"height":36},"large":{"url":"https://v5.airtableusercontent.com/v3/u/49/49/1768197600000/GelqWRsPvHw64Wa08pIDoA/5vmNQNf4nx46ZR7pVZBAKB09R_5SOl-XKDPiKT0J9TzezWtni1OUGH0CqUOn0gpTAcwTT8S7yV6eT77vPhzEW-aYJvHASVIBv7qZidelcZGRShwteK6bNpcu8hrkf8bmtqzA4AYipgm1GFpHFLP1yg/9C2x2_AN707BWJC4d3vKvF_I-ahI48PfL2MOwgw6L5M","width":198,"height":300},"full":{"url":"https://v5.airtableusercontent.com/v3/u/49/49/1768197600000/hWSJ3ctS2OF3Jar0wor0GQ/9wdbSweEAvE_qDbsFtWcY0PdchbUaDRq4rsqRKEtdX5UkVa0Vl-1GM09PWtoe-RewRgpnmcwVa6vPQDTKzqnRsBelircxfB7Jp7EsP0HXha3y0Liv4laQxYBdSnf7UbDVI3pQ5EiKMthHsN7kX_kRA/dk0KzLXbs83m5NhjEJVuzRIeP6bctIXmwjjqtHdVHIE","width":3000,"height":3000}}}],"Authors":"Jim Butcher","Series":"The Dresden Files","Series Number":11,"Readings":["recHdOH4LHrl0rkRu","recWZYI3c87cuiJCf"],"Date Added":"2020-01-19","ISBN":"0451462564","ISBN13":"9780451462565","Genres":["fantasy"],"Author Background":["by-men"],"Number of Pages":420},"Rating":4,"Read In Year":"2017","Page Count":[420]},{"Id":"Mon 07-31-2017 to Wed 08-09-2017","Started On":"2017-07-31","Finished On":"2017-08-09","Book":{"Title":"Assassin's Apprentice","Cover":[{"id":"attJyVMr7ZKseGSVz","width":183,"height":300,"url":"https://v5.airtableusercontent.com/v3/u/49/49/1768197600000/y44tESbIHYd7qLhvFOSWKg/VY9HtL_kC3WeM_nvv6s3F6Cehcpqv_tLcj9RX1WtnBXQVwbAbiMmfQ0XvFeiifqLM6uFnNsscTT9dr3-bkzNVGGtJazAv8VO7u4AGN482RUOf_CJpEysj33syG_HW-ErADUXUXL3sIn0UQO0p5xozQ/xS80MRm0AQzcGZgtFRKgGgnQoYQAJXhorzPlVu0Ix9c","filename":"77197._SY300_.jpg","size":18361,"type":"image/jpeg","thumbnails":{"small":{"url":"https://v5.airtableusercontent.com/v3/u/49/49/1768197600000/gCKCjPuE7ZqkGEdOnKgq7g/bce4lN-g8Bq9E1RSp2zcjSvpYk7ptOGfMmUx85TjYsh70_VmImGDlpQwdEBXkGtUn4NGpmlagbHSkINu8E0VMiYctxtHfbZ0xObSH3uordBdK7vEYCuDTM6mYDOriA99NhNXPKGr0SpYw3drX81d9A/uS6vrcqJc4K7HtErck_eGsR8P3vs_dkLKIf-CS1yUo8","width":22,"height":36},"large":{"url":"https://v5.airtableusercontent.com/v3/u/49/49/1768197600000/DzIotrM-UnNmAF9SI7chqQ/ENknpw1cr5rJJixfdOtUcMYKy1jmC4lySgEJX4IpznDZsdGiSBcAnBDcEQ2fa0RygHOi7XP7l0-4ARIZo_UPUjgAHUzFMihYqmjAY4U2u3sPEVk37-ruu1cJplxEpA-zoew0DxY8110zaXSQ-kRiGQ/9mD6bKaLZnwr7QkuHK9ci6qz225Uy7tKq12RivChQJc","width":183,"height":300},"full":{"url":"https://v5.airtableusercontent.com/v3/u/49/49/1768197600000/-YX1Z8MvWxKwTweEQkW5hg/LRdkaJiRANrmW7NTaZbmBmIMHGrrd5E6bp3B47nI-ho9CYgfB1AAt0phfy2DDUW8tZ5m-6kD5H2jlHzyVO3WkbAPF9Q_E2iXPITwf573Alie0XMpLvQHIMwbOqV3cAkiyceDfwMxO4kxuYTLnP0amw/YfXwTDSA-_WaoUBFnR1a5TDAvmBARcTRm3T8F-U6GUo","width":3000,"height":3000}}}],"Authors":"Robin Hobb","Series":"Farseer Trilogy","Series Number":1,"Readings":["recItQMVBwINENwTa"],"Date Added":"2020-01-19","ISBN":"055357339X","ISBN13":"9780553573398","Genres":["fantasy"],"Author Background":["by-women"],"Number of Pages":435},"Rating":3,"Read In Year":"2017","Page Count":[435]},{"Id":"Thu 10-12-2017 to Sun 10-29-2017","Started On":"2017-10-12","Finished On":"2017-10-29","Book":{"Title":"Lord of Chaos","Cover":[{"id":"attO048A7gBQxh2ZR","width":177,"height":300,"url":"https://v5.airtableusercontent.com/v3/u/49/49/1768197600000/CvX523ScrBpKgBLBmGYmiA/d4wpixJgUwkTgxYbjA6l9Cm1Wf6aI4zZqtJnFl4OfJAPknZ_EfzS-4cOVkZq1Hoix8kXqywb6CpaIFHTXUyCmGcA5bVI-VWtU9Y0QPm7lScjzz0frJ0F0mpFm-c_4oSfNVgdhw-ZT8SQfI0o4D0nBA/PgLTKX5nVeJBG2ff7lOfmdtj-qfIggQkiDMRTv3dPyk","filename":"35231._SY300_.jpg","size":18474,"type":"image/jpeg","thumbnails":{"small":{"url":"https://v5.airtableusercontent.com/v3/u/49/49/1768197600000/PUKfCeSLrJcVxG7YrTUWOQ/txQjvCYntLybBRQ2Tso1KykUunml_20usy1ASNn9nL-59IXqtnKBHcTjCPfUaUrTV053uKGW4ATXQ7Oi8REeZfkjkI3YiJIgki929DMWHg3cr4mrsI4Ex1mj1iGxFbH9WGDf2FlcvuWMxwszD5HJBg/-stGjrmKaD49gYRpe--kgsfXpV6DC4hSEtnC-C1Nq9g","width":21,"height":36},"large":{"url":"https://v5.airtableusercontent.com/v3/u/49/49/1768197600000/Df823k_cxlW9gqgKRHPyWw/QXAjcOUKFRQ1ErpgCstkg-VA8dCxH-bKRlX-tUB2EQoclp2-30BlXT1yPIGWs0TS1_qRr9x354OT9ahZxC9qoJ3VpT0HKVq87r3Lhs08CB5pEma4Jm_py47fl6sg5tlja2eZfWAOg_KE9Rn7e7x35g/Ij_aMgvLCFaztjurZr6LOgNh54fD_sSYkRA1gSztkMQ","width":177,"height":300},"full":{"url":"https://v5.airtableusercontent.com/v3/u/49/49/1768197600000/pEmStbOun9UAuEIT3HkvXw/FEuDRwsSkL1jKzbLs8JO7O7pqw7HWls-RxDOqVrYO_DYZl6Zf1kv-GRkvWs8q7Ay3eXfy6tzss1WR4SQNS5ZhGLWZ3AKu052MeHrbICKfvlmqt1eAvulMEaNrVAHiCotPodOzBV0lN2qQZsQJtFwBw/v0Uzz5ubw6oflFwXTfSdqzVdt1hSovLSiUphXyGps5E","width":3000,"height":3000}}}],"Authors":"Robert Jordan","Series":"Wheel of Time","Series Number":6,"Readings":["recLTfrrzuuF7TFNz"],"Date Added":"2020-01-19","ISBN":"0812513754","ISBN13":"9780812513752","Genres":["fantasy"],"Author Background":["by-men"],"Number of Pages":1011},"Rating":4,"Read In Year":"2017","Page Count":[1011]},{"Id":"Mon 05-22-2017 to Sat 06-03-2017","Started On":"2017-05-22","Finished On":"2017-06-03","Book":{"Title":"The Dragon Reborn","Cover":[{"id":"attJc6Fikci9cXRKz","width":300,"height":445,"url":"https://v5.airtableusercontent.com/v3/u/49/49/1768197600000/neNS8EimXmctqdVvVDuSYg/MQWuYvMpnU7SrLA9b_xWgXREoKbuVjIX6tFULnoBY1YkUAMyLedhEQws7uchI2DG810qMsHfe2j_b9vyc_o-eRfUzOm8NDgVxleZDF1anGPuaBDdLmi7KpyFt8KulRBwqvVOrcR7asrCdoehELUE2Q/tFtfjVqWD8Pw5NtPTecKHYNEFvHUNgNxy8FuLuKkQto","filename":"34897._SX300_.jpg","size":44626,"type":"image/jpeg","thumbnails":{"small":{"url":"https://v5.airtableusercontent.com/v3/u/49/49/1768197600000/O19dBEYQ2qTMzgqnS7fSTQ/xZ-eDlqNqNtGoJAOZdt9v1sOFuAn6qKGqLcs1yE3QPElyhhlLlF4vU3erPXVtegG05rROcAxeuGfkGNduV80CWhNDJtSyYy6nSteKZV4zPJw2NpJQ_Ln3xrFRcF6TZ0775vRlATb-zdjpPZXCFTP_g/AWNOpq7kHDad8-kTAzBXBVkg09tdRm36pcKIdOb-PWQ","width":24,"height":36},"large":{"url":"https://v5.airtableusercontent.com/v3/u/49/49/1768197600000/T7DZUiXNtSvEezNqAHrqOw/pyBy8uY3qxoA-ADtokZ-SVfeC28Q8HplcKntCzFkI766g3Ahleb0KvEA1Ev11S9YH7PgNRkgAno427IWiLHd4_Mu8eKq6BJbh6VKpP81ICbiq9xCWMk4Pxmxp1vd18bM5n7zHibSwogtZGhgl9jRXw/Wkq-Y2hJdFlUcz7jRyPyrQzSkD7snQ21tMwf6PR5tv8","width":300,"height":445},"full":{"url":"https://v5.airtableusercontent.com/v3/u/49/49/1768197600000/NeC9a3GRkL4uugPtqEFPAA/nSKZ0blOt3LuVuiWeX9HxALnmzzDwpMw42vHtsq3muBpxp7cfooOlkraHaaXgDw36NTVyqj8ZhS8LqiR311sNVRtie107a2BdTCTqo_upEoMzbodNbsmKEZ6BjkvQhmpRcbmIrRYh8ZTMTAOTUmouA/Ap1jBXAaK6aIdUzqjfvrOxrfoQvk7_XKU-1iV7OleUA","width":3000,"height":3000}}}],"Authors":"Robert Jordan","Series":"Wheel of Time","Series Number":3,"Readings":["recMh6u7WtoH3xdvc"],"Date Added":"2020-01-19","ISBN":"0765305119","ISBN13":"9780765305114","Genres":["fantasy"],"Author Background":["by-men"],"Number of Pages":624},"Rating":4,"Read In Year":"2017","Page Count":[624]},{"Id":"Sat 04-15-2017 to Sun 04-30-2017","Started On":"2017-04-15","Finished On":"2017-04-30","Book":{"Title":"Hillbilly Elegy: A Memoir of a Family and Culture in Crisis","Cover":[{"id":"atta1uU6bKfpkTrFf","width":198,"height":300,"url":"https://v5.airtableusercontent.com/v3/u/49/49/1768197600000/osUgH1vUcHKaNf_yC9uQJA/RhMJyTotMtFUvWYol6P0Drev_hUNxdci_zJCTmnaEGYEA4JbYlZOqujFSigLOAcbOevtKE-dMXsdVq5AQ-d3QdWJg4HRxX63e9IqjYu98HdCq1XihDKbMjrECMQpjwxwIwbK33QeiIoJee5HQteB0A/kMIWuwVwHXVPB0Rbz58KDic5eMh_5Ls-baOOtfwML28","filename":"27161156._SY300_.jpg","size":12824,"type":"image/jpeg","thumbnails":{"small":{"url":"https://v5.airtableusercontent.com/v3/u/49/49/1768197600000/9InXtCtPPTUIRF4MzGfxgQ/QyEBm0B_WRAPlGUmtnR6k0wOf4fQRm7Kwapil_0n-u01EcmNwftH5HJMViPiKmwdIT1z1mgtCJNukE9t1SRFuAUq7vaN77ZUdjTsEjOfQHJ7_1DpVoLSFjjAyqrrrCzQEkag4X4g4YgK3lfvuF2jFQ/LXUVe8-cksLb0Fd1LItEkJuTeWIFaL4zhSlg6TLj7hE","width":24,"height":36},"large":{"url":"https://v5.airtableusercontent.com/v3/u/49/49/1768197600000/rBVl7cScLLBp1L02jGsvsg/H2WpzaCp4PkAzf2ZTJpFPvoAVAgNorm2GWjAhiawCPRiWAmwd2Ry-zvUV49thAAVVWQfjX9hAu4nR_METORcySNxUOxV8PExeRkz7X77-aWxJ_CP6alm-N274IFc_t9g7FlXHH0DTRL_sU2y7REsMw/PdS6Jb2gmxBVSQKnsgWuHICXwT63BRJE_-oEsd9EdeQ","width":198,"height":300},"full":{"url":"https://v5.airtableusercontent.com/v3/u/49/49/1768197600000/B1yVF7SfHvWxpQrDUo0YhQ/BeaHJx8N5AM4Cy4N2VsE33504WZ26m8AfE9dBXpukmkug2Rx_KIFIX4RMv1TvJRDrLoBwDyeV1MsILPmLPP8tMt_wVnlrzQg-gtPZvmp9UQxZy5ImOneENH12fVoT2ANbOv7uKnVlX41yTq17c_hnA/V3Rkugovb_xKmarl69XKVSxkI3_BqCMBzYA1_ScGO7Y","width":3000,"height":3000}}}],"Authors":"J.D. Vance","Readings":["recN3vV8L7H4kwMmN"],"Date Added":"2020-01-19","ISBN":"0062300547","ISBN13":"9780062300546","Genres":["nonfiction"],"Author Background":["by-men"],"Number of Pages":257},"Rating":4,"Read In Year":"2017","Page Count":[257]},{"Id":"Sun 07-23-2017 to Thu 07-27-2017","Review":"Easily the best installment in the series so far.","Started On":"2017-07-23","Finished On":"2017-07-27","Book":{"Title":"The Delirium Brief","Cover":[{"id":"attMDiTdeILwHqdXI","width":198,"height":300,"url":"https://v5.airtableusercontent.com/v3/u/49/49/1768197600000/1FOD4rtNole9U0YMVXFrPQ/KW3o598TvdU4_lJfysohTUmBNOkextmPWVLlIek0jnKdVgOaBbMuX48LqJ_U2QnzfJNOZupXKfnhmOqMrXG2csbot6UwZD7Gx9BV1eTGIRBNDg5PrsaNk2j0GS7KFVIp3Z4XiSvJALoEcWFSa2eV7A/KblclCazRtODFaDheSMxMpPHD5IVq3QlzNG-NTEzftI","filename":"31450774._SY300_.jpg","size":18037,"type":"image/jpeg","thumbnails":{"small":{"url":"https://v5.airtableusercontent.com/v3/u/49/49/1768197600000/r6waRJc469KaYphldxij7w/Jc3jogItfw3Cw7q0Hmuq8BK7L8kS82vKMiv2jqtNoXkbkMoaFQxpdEGRbbgeuAHyZsO6WOrrIkPTYPbSVKGwKCeqXYhAfw9EGR1E2oPIis25sD-nVEFgVn7u4wo6r3SbZx60vrGbGnpycJSzv7Cc1g/-DfCzlB425Y1e5d5vzg9zlq0R932dxOksz38bSEaL7g","width":24,"height":36},"large":{"url":"https://v5.airtableusercontent.com/v3/u/49/49/1768197600000/alp_4dosp2PCI4_3RNZv_g/5_Mes3_mryPVudFHDkDermwMsvoaIfoS7TVil4hpl3JJkMq7s-ySle4fx-Jq1YZoZvdnvXtKEoNg1PXOsRNKLu0Pibh7BoezzMjbimLX0VJCsYFS1YxWfvRjqBdIZvch0L1gwFT37vo4Dg70f_RRyA/0EQjAHafYMbz9SmaRNQAj3ntJpjFUuPIYeVrOXQweus","width":198,"height":300},"full":{"url":"https://v5.airtableusercontent.com/v3/u/49/49/1768197600000/D2xDCnAp3VBjyji29vj7Yw/d3ni2gODSChEjGldmeq2XyfUoxJk35ZrzrJx5MrvZ522Tg-Sr-zE0y1i5m-Q7hydHOcf2OJWasBeNu6f6T7xPwmT3t-AhAtlYhu5JVAesCWuMJVcc3Aajz9_JH4-HRUV1lo69tCB4ixyPmUmY8jMvw/8-mS7WT6_1i4K_txD5QEeuK68YXu8Ng3NgV0LLFTFG4","width":3000,"height":3000}}}],"Authors":"Charles Stross","Series":"Laundry Files","Series Number":8,"Readings":["recN6xwNQPJ8OHVew"],"Date Added":"2020-01-19","ISBN":"0765394669","ISBN13":"9780765394668","Genres":["fantasy"],"Author Background":["by-men"],"Number of Pages":368},"Rating":5,"Read In Year":"2017","Page Count":[368]},{"Id":"Wed 04-12-2017 to Wed 04-19-2017","Review":"I read the whole Wheel of Time a couple times as a teenager (at least, what had been published by then) and was pleasantly surprised to find that the Suck Fairy hadn't visited in the interim. But this felt enough like visiting old friends that there's no way my rating should no way taken as objective.","Started On":"2017-04-12","Finished On":"2017-04-19","Book":{"Title":"The Eye of the World","Cover":[{"id":"attbUsK3d6XdmEeqa","width":187,"height":300,"url":"https://v5.airtableusercontent.com/v3/u/49/49/1768197600000/4QgNZvg5fg6spH9XhIVmSw/6_cVbF_XrRAeDCqBJTIkkwx7qR2t5hULMgDyk8mixqL8dqLK0oSltmWKeGsQbrvlt7Z8Cb3a2e1SpHCqG3h8Xu_JvRgc-P7pM7Q_1lOGO756r4_d26VNac5qk8PzQvQ2plu7YxZdCx-ABULsinJCVw/2LZffEghmQ5fWYft3TwfZxNbNMLONyqVe2LAmPIbk5E","filename":"228665._SY300_.jpg","size":24286,"type":"image/jpeg","thumbnails":{"small":{"url":"https://v5.airtableusercontent.com/v3/u/49/49/1768197600000/Qp8K3k9fuA288KaYlX-86A/aSFtcWx2-Kn-zg3LqinmJvbMrdsUibDvQFd5KB41wSILB61J2ZVKFrO5Kf1hXW13HI2qsP_MRIlNg55FPXDdyR-JdOo70nzP0pS2hPPPDtBVCa4A-eS6NoA9ayX4CgTQqr0KD4sxWX8JykkNHBF7ZQ/78g3RX-LKRbLgZxpo23FsCMilLo_MM4RE02sY_aEotQ","width":22,"height":36},"large":{"url":"https://v5.airtableusercontent.com/v3/u/49/49/1768197600000/-sijG7ZEyXpKyvvWwM0Q9A/nuAnRJnDXaEGJEVbhnLl_e3OBhnGwK-VDLvzBAGceJl9UcZbjiyYU5DUkKX-sgp585p_bSQz98JyhHlpwjyrbmANBDfCjEigoz7TTx4eotluWHIKXyCvGzx2F0xN1s9cSomtNP4p0JyuzStXEM-CfA/r9G0gJ4hW-OQZ36YhSKfyQS8H6rHMTN4T6WcD93yM10","width":187,"height":300},"full":{"url":"https://v5.airtableusercontent.com/v3/u/49/49/1768197600000/EYhedRCiiKqZkWhquN5YAQ/shUkzDPVeQUhF6ESIdKnt--0ZNQFvFiloMxRI7PQar1DIlosiozX9X8fWRrhuJAFhKRxxQ50ki-NxdqEpocJC2KyUD7Qcxdp-E-86ZRq6eyXtPwn_38qr6uw3PWX3KYv5Ue8ysCVb16N7uNBSZg6Pw/dDVfubPlCwNmzc-SHaMt9sL0R1exuzd26NiW3P49FyI","width":3000,"height":3000}}}],"Authors":"Robert Jordan","Series":"The Wheel of Time","Series Number":1,"Readings":["recOCS4WnpI8ww5t3"],"Date Added":"2020-01-19","ISBN":"0812511816","ISBN13":"9780812511819","Genres":["fantasy"],"Author Background":["by-men"],"Number of Pages":814},"Rating":4,"Read In Year":"2017","Page Count":[814]},{"Id":"Fri 04-28-2017 to Sun 05-07-2017","Started On":"2017-04-28","Finished On":"2017-05-07","Book":{"Title":"A Mind for Numbers: How to Excel at Math and Science (Even If You Flunked Algebra)","Authors":"Barbara Oakley","Readings":["recPN6zpKSaoq5rcZ"],"Date Added":"2020-01-19","ISBN":"039916524X","ISBN13":"9780399165245","Genres":["nonfiction"],"Author Background":["by-women"],"Number of Pages":322},"Read In Year":"2017","Page Count":[322]},{"Id":"Tue 01-17-2017 to Wed 01-25-2017","Started On":"2017-01-17","Finished On":"2017-01-25","Book":{"Title":"Weapons of Math Destruction: How Big Data Increases Inequality and Threatens Democracy","Cover":[{"id":"attCQ0IjFoOP1ML3G","width":267,"height":400,"url":"https://v5.airtableusercontent.com/v3/u/49/49/1768197600000/qVCgeO21c6PYnTXB1ur-nw/Y7AjtLa4nq7rcLBP18Bz5WQkK_52mmcTxBNOVgPSISRy-HVyt2qewGRrbuyBvPc13Mk12Fo6b9KYxTYhDwAm0v8X3uPkNj5wH2dkMFtfdkingZJTYRhbmnh4HRpmCduijtsk8hJTA4Q_oWqCoDuw6w/7WydJ5y1PlPGOnZ7zO4YkRz6fWoYNwmJW7Myf0racCU","filename":"28186015._SX300_.jpg","size":17723,"type":"image/jpeg","thumbnails":{"small":{"url":"https://v5.airtableusercontent.com/v3/u/49/49/1768197600000/_bVT64jOzkkgqBJnWqmRfA/mZw6EdCYaRYR473Cq6euKNzxoPZDEMAiVfJqI58zEJ4XxJW5VCRODt_WO2tcQVRbTohHWhYpBE4j79O23iouRl9ZXlsjMzqV35RLfPRkUSwiUNZajYSefF1ShoGUyHsQ51lNOPktQwlSUSsZyj8oVg/ZRsNMOFaxt8knPzeHvvqmMaGyFV78eaYk1Yu1RO3oc0","width":24,"height":36},"large":{"url":"https://v5.airtableusercontent.com/v3/u/49/49/1768197600000/9xJAHr7eNT0EBXdZ0b-mOg/da7I-OFnTEvk4TYX4aPID8I10R-ZPiOeTRVXLdeG8IBpLEK3NeAlG7_-QcwXlepOdBjrAJa6fstOe5WJURmr33k7tdBGfaSEgXgTS7r0NJFOMAzge8DLvgju9czRLD0ItTkABvrgUpa-69b-a9ht-w/GVRlX9qE4NCroFFIlsQalGpFWlJzUmXrc1aW1KKm8Tg","width":267,"height":400},"full":{"url":"https://v5.airtableusercontent.com/v3/u/49/49/1768197600000/SrNRlWsWGLKiaWbP-Z9jEw/cPjiRLopr0dm3OlW4LgHUVtQric-m_Tq32O-2Jy72cgrX9lSWAHR7I_Qxn8vTgoClE14S6ARR4lRufKpKGppJ2RUkIB1f62NmMOWY1OugPq0dxLLqCER2nDxCGw6t7z7UspSbMstlSwPLOAMXdSdOg/e43xPF4WnJdSkpRO9dphwTayOWCbSOUoCHUf6Ym2bbU","width":3000,"height":3000}}}],"Authors":"Cathy O'Neil","Readings":["recPyU3nL2UJi7x3t"],"Date Added":"2020-01-19","ISBN":"0553418815","ISBN13":"9780553418811","Genres":["tech"],"Author Background":["by-women"],"Number of Pages":259},"Rating":4,"Read In Year":"2017","Page Count":[259]},{"Id":"Fri 11-03-2017 to Fri 11-10-2017","Started On":"2017-11-03","Finished On":"2017-11-10","Book":{"Title":"A Crown of Swords","Cover":[{"id":"attBaNNyeietUJBhi","width":181,"height":300,"url":"https://v5.airtableusercontent.com/v3/u/49/49/1768197600000/QpHQM-p7eZFVnSuSTZ0nzw/rnqPNRQv_Vcbuou-Itj_wqDjoFHkoSN7L8Sm7P88rluMtKp8J10AaD1FvV3NlSVJ-SrJq8fdpGqVsS9ITVQWugHyAVo5fWM65W_rVvhvuqV_CCD4XugDbqp3gCr0n8pZx9gUJOkmjX2sdo7bQbUTkg/rzmhsy76sD21bqTzji0XvuTT3maXmXIsf1_6JcqIEfU","filename":"13890._SY300_.jpg","size":23642,"type":"image/jpeg","thumbnails":{"small":{"url":"https://v5.airtableusercontent.com/v3/u/49/49/1768197600000/PGXIjDoqO1xVqixGImbfgg/-aDhHBMMr1oA6-e7x9PZVIqbpSJ7uyWSKKNrSJY5CWg-maw4G7_AxXHI7Orx4-3Ekv5YWi_Zqk3zje_sKvWnEcWuj0wo008ycoGYtGyyHbJbGExU5Hv5S6HMxby3wfSxcAkLvc1dH8_O1KF_dKjM8A/p7J1xdDTNbU917mgsnG3pWPM4w1qTchUyAsxcXGSEEU","width":22,"height":36},"large":{"url":"https://v5.airtableusercontent.com/v3/u/49/49/1768197600000/XCrMg4BmQeb3RuE7spNRGQ/eP-xfxuq49fW7qBlD-VpvYFpnOI73cQe7v6SiOmGyb6C5ccXxao0_t4rY01FEGX-qYWVJeInuU0CpXUwIdks5jWEYNc1uRUsddiTLVZ8_YlSmsNoTRf-fc1Q8Wa4AXq0TrVB6hJu1zq1Q0dXpkSLrA/vwVej5jBzjnUxXJH-9OQpi4hz-Jk5FbLG6-ocJc2lRY","width":181,"height":300},"full":{"url":"https://v5.airtableusercontent.com/v3/u/49/49/1768197600000/6WrwXVUsnU9GhsHElOM09A/u8K2Dauj4MIeHT35qGyrKghVLHduVqG2I9llgiJO4wo-yjaH2vsSqplc3eGH_4Tqs5sMnnr3xpFO3Wrwc5ZfvGx--z2Y85pDB_yt6d9xxz4nAKFqCCaaztUI8Po39g4Xiv37dj67hf4CP-0bMd1dSw/0zUszkpBaOxnkEgSyDa5Rk05leNo3V4-nsN0a-dVxVI","width":3000,"height":3000}}}],"Authors":"Robert Jordan","Series":"Wheel of Time","Series Number":7,"Readings":["recQnhDsHR0QT1XfB"],"Date Added":"2020-01-19","ISBN":"0812550285","ISBN13":"9780812550283","Genres":["fantasy"],"Author Background":["by-men"],"Number of Pages":880},"Rating":3,"Read In Year":"2017","Page Count":[880]},{"Id":"Fri 11-17-2017 to Fri 11-24-2017","Started On":"2017-11-17","Finished On":"2017-11-24","Book":{"Title":"The Path of Daggers","Cover":[{"id":"attZPefsLTO30u34T","width":300,"height":437,"url":"https://v5.airtableusercontent.com/v3/u/49/49/1768197600000/VQBASKaS89m162Vjg8R4dQ/-p1Irlz3yigJkeUClrmRchFDAnyMBWlLzdjznF7krPoiFWEucqXgykww0aZ0x0GOIpNx3Ctvpg2NGQDlZ019T6Ed7AUnzQiS1IwO1fmnCM_fFWuRbs5MVSvKfEfQbZ5HAjpbUWw2_CleoatP_PRBsQ/KxDrzY2-BtP1xDp5HKM5kKo_dIooJMTjMACKtv9WmKc","filename":"140974._SX300_.jpg","size":46427,"type":"image/jpeg","thumbnails":{"small":{"url":"https://v5.airtableusercontent.com/v3/u/49/49/1768197600000/1iPP9rQZ3jMAO7ULOKS8-g/ZWzADYRHn1OxIhK7xpsYkQOMkODilK0AFfoCpv2EltecnQ1BjCH0ODhExU0W3OnV1YfX9vkypLS63IvnjDyBu6529L4jmZ0Cr3s5p4HLB_rwg-8Ru5lMOXZqMJJs6zDDY31CJBqpP6_L_RkYb-emjg/UU_VWfXhLq2Ef1P-gYLhKqmqDwV9QZd98yyqaL9GPVI","width":25,"height":36},"large":{"url":"https://v5.airtableusercontent.com/v3/u/49/49/1768197600000/SN1Unl75n7sS0puZCI71xQ/1AvVN2Iy8aOYXpc_QI_ggrKyCytSCkYACXCZx7BKd-GOCZV4CQsRou4sWx1SaMW8dwgyaBa0wMDm86Lwz-rbfgqUZQMLL0gWJ81tdZuQcpFKjUpKnzZo1Ij07eE5NjpVYAehDOBq1hcZpwT3TInuoQ/uCT7BM8MSwaKoQLYKt3Giuu9DD0Y_GVb7D2sRpPDkUc","width":300,"height":437},"full":{"url":"https://v5.airtableusercontent.com/v3/u/49/49/1768197600000/O_HPLgPDthUff0R94fLzTg/VCopjoDt1E8slR36qWx5INDi_NMF5o1-oNIY_dwO1iYGY32or7AYpFyRnBbrSURw9LenUnIuxUGIDIbi3XtK9xF_Z3araPnEJxb9dJoXBQ-tvb_pajG6QYFiPwKzkI1Oy3580yqKVA44AR3FxY-gaQ/oqKCXTYw1Ge_51yC12Gz2woUGTLfBmjxsAJ6TAXCS2M","width":3000,"height":3000}}}],"Authors":"Robert Jordan","Series":"Wheel of Time","Series Number":8,"Readings":["recRMyV2nkjdKAsEm"],"Date Added":"2020-01-19","ISBN":"0812550293","ISBN13":"9780812550290","Genres":["fantasy"],"Author Background":["by-men"],"Number of Pages":685},"Rating":3,"Read In Year":"2017","Page Count":[685]},{"Id":"Fri 07-14-2017 to Sun 07-23-2017","Started On":"2017-07-14","Finished On":"2017-07-23","Book":{"Title":"The House of Shattered Wings","Cover":[{"id":"attRr0kqX6cLwrePr","width":186,"height":300,"url":"https://v5.airtableusercontent.com/v3/u/49/49/1768197600000/zuaY-C7kgrrc2NIZEpSeCA/ddvFnY26esa2MXp1Oqg7NuNR-ZLT_dK1mpJ-eASUnXs6qONvhkCx7QSiiB1J9IR731Dhbqgupxe_av0UD3g34juA3NJmuV0pszLF3snrZ11xWB2yRaAy-wRxJNd3TI1FYGloBXy8mbcBYfA5hvzRyQ/TJp8s0x11gzy6bG5jAJu37GQ4pbnKsM65-ViO2o8f50","filename":"23601046._SY300_.jpg","size":17514,"type":"image/jpeg","thumbnails":{"small":{"url":"https://v5.airtableusercontent.com/v3/u/49/49/1768197600000/QbeRBCZgZbv-VHk2u73UWQ/lxGBm_HQ_bbcXYxlcs8aCw0eTZCjYxJ3JHMnJFWvanvqbRAeFZa-aH8gXlPpIQgVbAcxcWBE9WK8z_xAAxqf0yBUSJxMPivUIF9ODFLj5kK05-kOytQrTCpNAcs2ZLsqSuvdRjUYLbFqiDRo7k_KDw/hBWfFI5YBReviwOTffiUHqxv68GJoFFisEa4jZj8N_4","width":22,"height":36},"large":{"url":"https://v5.airtableusercontent.com/v3/u/49/49/1768197600000/vz_2wRDpAae6xNrqgJGzpQ/POPqP5cZSrbWarA9hgVysPMLFXF8QX5pelzNy3qs-hdGnwjoXjUO5cVHclgdDZjSZ8e2urO3WlcDy4lj6Mtn48r9xGFM_XRqImKuueAxPgxv6i992HbSNaKE7V0LkbPlp0nMKo5pizpICHo4ydHhWQ/f-5Q2CQS_eJp5fMfPo4k8_lmhJytYqXrFAtY-zkU080","width":186,"height":300},"full":{"url":"https://v5.airtableusercontent.com/v3/u/49/49/1768197600000/-2hqIXc7fOW7gPTM2FIxTw/IK-RqGqF9BiIBJqSUy9Nm6d80sXbajH6UX5WcR9avF3vXg8vWlY1EmUFc3ujcXEsu5xyUA7EYKrCm5MgnA6KHqgbHBUbfPHyo4KjW20hHWVta6Gzutbikp6za4gW6r9_ggdxxKXj2yChUpZHPi1lNw/RFx6NsDQ45VXbMzvhPHwqdwqArD92LZth_FrlPM9_UU","width":3000,"height":3000}}}],"Authors":"Aliette de Bodard","Series":"Dominion of the Fallen","Series Number":1,"Readings":["recRbl04H1epQhPfQ"],"Date Added":"2020-01-19","ISBN":"1473212553","ISBN13":"9781473212558","Genres":["fantasy"],"Author Background":["by-women"],"Number of Pages":402},"Rating":3,"Read In Year":"2017","Page Count":[402]},{"Id":"Sat 05-20-2017 to Sun 05-21-2017","Started On":"2017-05-20","Finished On":"2017-05-21","Book":{"Title":"All Systems Red","Cover":[{"id":"attqlwedOGstZZqXh","width":188,"height":300,"url":"https://v5.airtableusercontent.com/v3/u/49/49/1768197600000/GKV-QrwlJV97j2zJbBSBVg/iLU-RjkOrpDWrSsMYlIYQkUjrin_fHfK083WJlCNpP0ufnsIPuFaRqVmS59pTX7EGAN6HzF6x5Bff6AexW58ua9kb-_EdoIMySx57EVS_s16DUtU5Ce8WT8n5-l-cp9PQllpBxXGoGqOeGjcbP2xJA/ZtH6vEhjHd6AJ_pKiU-wtpr1piqMiRX01oWV48nwTfE","filename":"32758901._SY300_.jpg","size":10812,"type":"image/jpeg","thumbnails":{"small":{"url":"https://v5.airtableusercontent.com/v3/u/49/49/1768197600000/CEdVPObHGX1Ey4c63yvsNw/N4T5-HVWSF119fxGPZqJSdixi4hYunhsfdrYUZW5BGkRLsRHB51E4ITLeVjTo-BOz-ih2CtGgTgbRE8qrUNt3MqrKeWsOfCv9FRGFFbdY9MBqk52CIOry2J4G3vhdaHEfvXE-O_94FmY6ikzEfRJcw/msMOd1Hj2Scq9CbyU-cAlaV1RfIb0eQ9Hlqay-U2Jd4","width":23,"height":36},"large":{"url":"https://v5.airtableusercontent.com/v3/u/49/49/1768197600000/dz-7vx7STZJgrqvrew0KWw/ldUzKTsoYPDXl1ul2PAI1a6JjRqS0Jz3-3GFmIv0ri-HdH9S1R4MiBrQa6aK3hBIrWftZvxFuacCA2PovHz62B92JNcQiArgxljPMJKX3oL9skQ1cVMNwZaxHR8t0PT185S4UFNoSj4KWXbcXE1UyA/S7y_Enu0vru03fFVdKrXy82owny5N5mlnRbpyCfVaqM","width":188,"height":300},"full":{"url":"https://v5.airtableusercontent.com/v3/u/49/49/1768197600000/nX_wsDtQeyXO1o8RFuKIHg/T_SgFk5Kd9yYG74-vs7H9RcIS2bjvHcASy7ScHNi6K0HTQBLER-xG9vV_dRC_lUlPu8sYmJvixgahJb6Dp9-qfv3bhs78N3zkzjqe8Qno-W6zg-3A0vmXaIHLDPyhilJ-_cm6452Nn0nE9rRCZekzQ/E40LLxUJYRRIpcbe5gBTFzF4Ji0dm1aztvaS4UtLQso","width":3000,"height":3000}}}],"Authors":"Martha Wells","Series":"The Murderbot Diaries","Series Number":1,"Readings":["recSUa1fvpDI0YRyj"],"Date Added":"2020-01-19","ISBN13":"9780765397522","Genres":["sci-fi"],"Author Background":["by-women"],"Number of Pages":144},"Rating":4,"Read In Year":"2017","Page Count":[144]},{"Id":"Fri 03-17-2017 to Wed 03-29-2017","Started On":"2017-03-17","Finished On":"2017-03-29","Book":{"Title":"Seven Surrenders","Cover":[{"id":"attaL8Ubsej6NNlcv","width":198,"height":300,"url":"https://v5.airtableusercontent.com/v3/u/49/49/1768197600000/FHf_xHmVICy-_9RXE_cY1A/CHir6npoC-Ycl4Avst1xjmw5aO5nwQVDdn6oAoGYKoPavAso1rzyHMIOjlAfUrquDzX9hEUF0xUNJFUQnxxwjPitke4n642WrSh-Or5OFn_ttQHIhNk7cst2A8aCoyW7m0xGSX-04rFzVBhSYFPuxQ/5R-hx-cPmZ_bdMpJixGDPMNEEuztfr9oMMxNYJLa2vA","filename":"28220647._SY300_.jpg","size":10095,"type":"image/jpeg","thumbnails":{"small":{"url":"https://v5.airtableusercontent.com/v3/u/49/49/1768197600000/bvT1aQB97qeTnVenIjX8Tw/HYBUYt70IWYX4_HcNU97OdiYlX4CMTP3jphChb7QnyQz1zXDTQiUHbr1UPp1QKZsSPHhDjNtcWnNv2lt7GT24SbzqaOOrPT_3NIqbAEfrBZY1iO7pX4YLwz9QATcHXVATjJIfPnt9dc1LDrq6h-D0g/g38eX5Hx3Y3otWA4BYpvzXs5wfSoqor3pxLqDg_OZ7k","width":24,"height":36},"large":{"url":"https://v5.airtableusercontent.com/v3/u/49/49/1768197600000/qNTZqvT_GD1YxI57_gd-gQ/-WTLjzDtjS2efJqYNhWpTHLHlM5-FbAYJ_mUBFIGlMw9W5Cn6H26rNwcsuMjGOmE65ZYWokdftEtDB-BGDkz6tJ00-6l_20Xpy5wmT5h8-iB6tf5HBeTWu1-6ZqpVRuDW-8faAItS9ASHz7IaHhYiA/WxazxNrzKNTO8yhUWLsaiyRRhqFAhGiNN5pQ--y9nqI","width":198,"height":300},"full":{"url":"https://v5.airtableusercontent.com/v3/u/49/49/1768197600000/o1gYgUakLVqQtKJlARniAA/J088DsGl0iLD52QU8gb8HqelA-Tz-EFol2phWPo9MSEsbD36lQK-1oXBZbSI428QgCugHG2bqUf0ftpEQVXBk2CUmiafbPPvIGKhM6Qb4_GGGYphzWzgtRmFZlnk8mAPTEgXYdRgP72GN1ctF4mU9w/0Re-hwEinWwrfAiL8YsILJrj3fXUNHv3cwc8cehmjWo","width":3000,"height":3000}}}],"Authors":"Ada Palmer","Series":"Terra Ignota","Series Number":2,"Readings":["recVymPNpjhGEtE2v"],"Date Added":"2020-01-19","ISBN":"0765378027","ISBN13":"9780765378026","Genres":["sci-fi"],"Author Background":["by-women"],"Number of Pages":365},"Rating":5,"Read In Year":"2017","Page Count":[365]},{"Id":"Fri 06-09-2017 to Mon 06-12-2017","Started On":"2017-06-09","Finished On":"2017-06-12","Book":{"Title":"Hammers on Bone","Cover":[{"id":"attxbIDkEBBx3P5mu","width":188,"height":300,"url":"https://v5.airtableusercontent.com/v3/u/49/49/1768197600000/gYaZ8312AhXv-IM_y2ehRw/ooZwXoI-2yF1lWi-r1yeOLanxnRCu1mfR0cqfs8ZVp4iLBpg-TlTSuWSpCLfVd-OhX9Px9erkzXWZq9Exsf7wZ9goNpbXTStko0N1otNjbsqqnqafCdEbYEvUK7Ut6oUfi3hfIbRVP70vNvDZsKyBQ/2Ajx5IWMrzdbqQRywaKzNHIFlYLQm4dAOu9NXcwD6Mo","filename":"30199328._SY300_.jpg","size":18567,"type":"image/jpeg","thumbnails":{"small":{"url":"https://v5.airtableusercontent.com/v3/u/49/49/1768197600000/Gg6Iyr3sG2LMkBUO8k-yQQ/-cNr_K1iwCkuBviluhh5fx-sAfNa_SzIeVI9wcMiwMSbwOgrxT-nwL8r63-rI0I81QI6cATIkUVAdXlbcgKznyVB_SPuJuUBnsIBYdQussOlY5JkceqiChCDNIsrDbmGPsacmLH85ZoH1e9mMCz-_w/VUIubdoFgd1MEcVS0Q_uH4XMBBHYqCPWfnA74vSrDOM","width":23,"height":36},"large":{"url":"https://v5.airtableusercontent.com/v3/u/49/49/1768197600000/WTjdZEi8ta3IyjurQhPDgw/wmsG3ldN5fXizhazGQsokiaU2WcvXeGSDw4TQ8xVRQzasC8ncDM95WVs6rEURNpnM4BwI0qB5houSBL3DUtXlamXCe8htB5E769LfbEVT3KxH4O1i_GaTCRHpKlfJ8ymJ2lcRwMhJlvMVl6Hkow54w/V9veAEptSyvrEzH7P4CnFslfXXthwNtMAb0eZvTWMU8","width":188,"height":300},"full":{"url":"https://v5.airtableusercontent.com/v3/u/49/49/1768197600000/m9xBOj3d4AinGjv1oDx8uw/kt23cC1-io7I_TbsR5d-t5aacOlRoJUSTjqdRvfI6Dum0AuKG_TWlhJNtV_5vwWgSF4BeI5LJUTVmk1InzGM-kAcqUThYttEF94XZaDD8Nsnc7SKMVOlFD5b9wWeZC-hg_ihhYfdZzf3ZkAH5rDDew/2b6ctGw0_9aPIjhfHZqAE-wHjpSaxu2vsjtBeYFU3VA","width":3000,"height":3000}}}],"Authors":"Cassandra Khaw","Series":"Persons Non Grata","Series Number":1,"Readings":["recXxEQu0uzWKTaNI"],"Date Added":"2020-01-19","ISBN":"0765392704","ISBN13":"9780765392701","Genres":["fantasy"],"Author Background":["by-women"],"Number of Pages":68},"Rating":4,"Read In Year":"2017","Page Count":[68]},{"Id":"Sat 11-25-2017 to Sat 12-02-2017","Started On":"2017-11-25","Finished On":"2017-12-02","Book":{"Title":"Technically Wrong: Sexist Apps, Biased Algorithms, and Other Threats of Toxic Tech","Cover":[{"id":"attQS7s9apTT3Hqgz","width":200,"height":300,"url":"https://v5.airtableusercontent.com/v3/u/49/49/1768197600000/jKs5DeHNyzVGCHKNdWdalg/dHCTJvA86Ja0gIgtAlTWzzVbHpXokOkzg6utd_44ZKT9V91kCNOVOKfJ2b0ZpuRH6pQYVMkE4ox4N2RbVmWoQ6cInXwH1kRegH-fyz3NA4peK_a-RS7oC8VRgKs7Xr7TPRYv3wMIlIe9M4UobrSsNQ/Vt7YgVZXoneO5pu2lB_Rhkb7mWfCT26JHNIF3u--ZL0","filename":"34068533._SY300_.jpg","size":11712,"type":"image/jpeg","thumbnails":{"small":{"url":"https://v5.airtableusercontent.com/v3/u/49/49/1768197600000/gYMy7Gjxib8edpfGMdOBnA/reuiO5U-VLHg6Ku_8RpcqYQj7vMu7tVPFJGqeSFXRCh5DKYAl1WN9yNSKZq564fx0PjXWnqEqyP0MKiAqapYqna5XT-ImKw-7QwdUZ7q3yfAqEdl4XE6xNV61ek8Y2Rt94cXSrOxnRu7zwCl0NQAzw/OhDVHlDuns5dsKfHeYwIlk430uTsJqZv5480eeF1TcI","width":24,"height":36},"large":{"url":"https://v5.airtableusercontent.com/v3/u/49/49/1768197600000/uh-QUasjD-flVkazCepkcw/L3-dBDXbogxOjsgtrvuWl3hgwP1_EXXJRg4dty08XP7i5R8tJXf7xzaezuSQL9Hs19Ejxum-PXK8OLmaauCqstAl2PtN0Svcnrhj0dV_NeX1nCmTVzKeaMbRy-_TMcsEeJKdVWQ3D6_2dkwFQ3v-7Q/O3OIlPRZk03yU_CQnnH30gTueCKIX8WvSivhdS4XYBk","width":200,"height":300},"full":{"url":"https://v5.airtableusercontent.com/v3/u/49/49/1768197600000/e8dfCeB15E0wEiCc-jjm-g/f9XtduO-LfYENOPPKQPEQHTvBg7s60xHfNGNbItzDLwmZ9yPovc-VclXOe63Fzst98Bu0tvMw6wvl4zxVt4JZh1r6Kkbk3nQkLDK4_ME0vJyWTI5QHT3EqPy03SWpRtdyqwunzY5tv4qlwl3D8oI4g/kvWDnzHckpl388NsBRV_AuN5Av_Own8HshODTtx0-_4","width":3000,"height":3000}}}],"Authors":"Sara Wachter-Boettcher","Readings":["recZW4B09Bg002R9s"],"Date Added":"2020-01-19","ISBN":"0393634639","ISBN13":"9780393634631","Genres":["tech"],"Author Background":["by-women"],"Number of Pages":240},"Rating":4,"Read In Year":"2017","Page Count":[240]},{"Id":"Tue 03-07-2017 to Fri 03-17-2017","Started On":"2017-03-07","Finished On":"2017-03-17","Book":{"Title":"Sins of Empire","Cover":[{"id":"attpkAsFJrlHuoCow","width":198,"height":300,"url":"https://v5.airtableusercontent.com/v3/u/49/49/1768197600000/xhWFbqL-ie8KEuvBnPgG1A/33n_a91NIf7jR_pbfybzm5YyY5PfcejasK81CefaTgRcY1Qq73r4TCfvQSuc1v1axv3xdgDzV7zA7NfwMe8FtOpJeSdMRTwoQwGQQuysYejY70haVDhO9Qejoo-aBccNW-Uzrlbjta1E9ocBVCaX2g/krV9Us3oKoIA8Ji_qznsAG023slCAJJjn8Id-CyXDCg","filename":"28811016._SY300_.jpg","size":21601,"type":"image/jpeg","thumbnails":{"small":{"url":"https://v5.airtableusercontent.com/v3/u/49/49/1768197600000/R1hLGy4whLkZClVA4Jb_lg/fq6IqCsZvaYzgu7j2ScP6s7SRyIcFxVNuf7KiToiiRFpvoxsQN2joKDkJqgJhMhzNeQvdpoLSGkWAmeL0MRxtxYbMjWIcRmJ2EeiTKhcLksKW56g14NEhPLOSas4Jzx0RFWdJHhcZ3LRXQ21caElfA/SdGZiFUkm7W29f5BpyYpNoY7EB3oX-nSJ9uloNOZ2Kw","width":24,"height":36},"large":{"url":"https://v5.airtableusercontent.com/v3/u/49/49/1768197600000/nJj3-tpC7X8tiuwjks3QRw/9MGFfwVIsvP-HeGrnCb9NPj1uo4IzXcaVX-q44GzLpzzYZpK6Jtnpog8hWh7SNhVHvNBWHvBrN4GLHyhCDJK1ZADHzyOGQQ0fuqOK0_P91tGmiQYt7HjNVsp2qmJlGOIPa7KgJdCn-vWDzH0Sn9oVQ/6VXk_sbm3SRwPCT3ZCfFigfDYmnwLgzV0MI-mys2IiQ","width":198,"height":300},"full":{"url":"https://v5.airtableusercontent.com/v3/u/49/49/1768197600000/KfgLsFdHHHNgdJNYsbXRYQ/mDdnuXPX9llE1uZ_ZhxLb7F1mngqOZV5r6fGPU7NdzoTSwTBdDG7mhpoons9c43F3EtsG8rEA1dMzaYUpAWDac9ee8XUv7SrOsQvwHg4MUI6cH0mB_loLlWkD5bshcfn7atK46qq1jVMOV8ICSuVmw/vWQYKYjuv2sXxH-yGpni-_ReKxYH0_JfUt3Pg3v273s","width":3000,"height":3000}}}],"Authors":"Brian  McClellan","Series":"Gods of Blood and Powder","Series Number":1,"Readings":["recZlWICpJEkJ1Erw"],"Date Added":"2020-01-19","ISBN":"0316407216","ISBN13":"9780316407212","Genres":["fantasy"],"Author Background":["by-men"],"Number of Pages":624},"Rating":4,"Read In Year":"2017","Page Count":[624]},{"Id":"Sat 02-11-2017 to Tue 02-21-2017","Started On":"2017-02-11","Finished On":"2017-02-21","Book":{"Title":"The Stars Are Legion","Cover":[{"id":"atteloxMlPHD93Kmj","width":198,"height":300,"url":"https://v5.airtableusercontent.com/v3/u/49/49/1768197600000/mT11f-CeC0IQtyqII7wvzQ/G4c-Wl-MTSgvM3K0Zn5OqKCXHLlu_Nqn8Zn_SQYKD-JSMNdDjKoYRBCQm5SjOtxL9S8ltKe0zVdEdWKyAbDyB5tOOBgrdtHM2dgEELULbr75RLXaDEYw-8iGsc_sEVQ0d4sj9sDPcvpqtTg6OjhyHA/LSXZWaR2JsusoYUuguwOwUtrzZmQFTJGwl3sCfLXanc","filename":"29090844._SY300_.jpg","size":16810,"type":"image/jpeg","thumbnails":{"small":{"url":"https://v5.airtableusercontent.com/v3/u/49/49/1768197600000/wJ-1RlSToDzu1doi-YFG1A/4Oei_CILMi90u5wgTciQss39NMW5f1pBPCCZpSq7aIOcLXrNcrpM3DAStoIMGqi6hHa6hceIcST2zUzmT7P8B8o1dUh0w_tupp7RyfITWWYo51zuGw1Vxdif6J1ErMtvd6UjU5koxKXSrh4mIvSlyQ/sFXEWyPuZYnIz1Eo180eV67oPzi1B4iKDmNBhfFlnoU","width":24,"height":36},"large":{"url":"https://v5.airtableusercontent.com/v3/u/49/49/1768197600000/zEUBMkEZfAqj-SysNo-YOg/nPawKROlaRSunlCVPfWzPaM6luSUNRp0HqX7zojex1JY0XQio5C1hJnVu4lZb09rhPCKC7dG8YnYslgcAZ8maGtINnqQTcpeijMEzpzAYLagvcdcGn5ftJVDkbCRG1DkiCtl3lqB9Z7lAhzbW05QbA/aeXYFB167fWJsWkwEuOynMxGM4Ae1bW_oaqSH7KE3CQ","width":198,"height":300},"full":{"url":"https://v5.airtableusercontent.com/v3/u/49/49/1768197600000/A8BefubjDpZ5qChGZCSDVA/Tc9WirAEteRItfQ9S2bx5T4j8Fa0Z8ZhQwKgf06537ZiRKG24i8lL4MUMIlZFPbnvWrWUTUlUjr9fP5iD6tuTYXk3Mfg-G3r4hiPxeFhirdUxnnKKD3klVMS2CDi_LBEyzMBiNX3gyYYPr6nvgHWxw/ERsd8CF7aTz7OW3qLHt3FRAbqgFaGnbNpA0Sguumtzw","width":3000,"height":3000}}}],"Authors":"Kameron Hurley","Readings":["recanx4OLMwNMFaps"],"Date Added":"2020-01-19","Genres":["sci-fi"],"Author Background":["by-women"],"Number of Pages":400},"Rating":4,"Read In Year":"2017","Page Count":[400]},{"Id":"Wed 05-03-2017 to Wed 05-17-2017","Started On":"2017-05-03","Finished On":"2017-05-17","Book":{"Title":"The Great Hunt","Cover":[{"id":"attBQ9cBUg1G4qBtD","width":184,"height":300,"url":"https://v5.airtableusercontent.com/v3/u/49/49/1768197600000/hXJ7dPSbkQV9R3wM1Hylcw/KYFb-7nidNjpYDByTXnxpGMJ-9nt7dogP1QQQMNdS54Rt2wmc5UWmbi6FUxF-b2kqdZKOHnhcsykvkus4q4ztUH2ne9cpiZALgfAUJlpcG5qi7lDnBSy7dai_cDUpVFd9SotuVU46besp49WXuMJQQ/Al-gljNiNujzzr9gfKnkyXYObvaq6UH8A0C_qEV0U8U","filename":"233649._SY300_.jpg","size":20980,"type":"image/jpeg","thumbnails":{"small":{"url":"https://v5.airtableusercontent.com/v3/u/49/49/1768197600000/h5sOTD5Dk8jobROFyJ2XTA/hzDL8a17V5_mc2osUIZXMFPXwssEfXRvEkEmjAsu9WjP-xO1MVCqaSISF6AErIVT807VxQYIVUpV0VRL8haOKNhWEHH7VgqRr4azmNCknXGpe6X5Gey9B7_omiocgjgPKKL-b_1RUk-8Ei2CT-_1bg/Nn5XaAZSKKU8GlX3A9ehFkpABSmHXVLkE918IoQ_ets","width":22,"height":36},"large":{"url":"https://v5.airtableusercontent.com/v3/u/49/49/1768197600000/L6ugnwV--0fM46yMeFhLSA/prRCP_X8u6Dm-A5TTnpSJAgxqqXJ4qCBiDRkFdy2wod6pzhi6vr4s4vHkImEbg662r2LZC_tPtzDJfBMrCkjHWjEfjuADdP9s_aFfSeQdARwK_NU2e-k7IXpzwlosM267AZwi-AVvIx07TkcZlCsnQ/uIFaRLIHHxzb8raqV1WQcAfAaXtsQJ7BUp_oAtu3ZP0","width":184,"height":300},"full":{"url":"https://v5.airtableusercontent.com/v3/u/49/49/1768197600000/nWVxgKDWOAxBBca6IfeBCA/BgOLj-BaqRvr_4YidU9bTMcjbviIY4pzsgBCY6kIjVU0fTzAFywtSNNylZejSwuCM6AqIRyKcum20XO7Gv0gteogo06x9lKstmP0bZjtzBj6l05TeR5DAsKccLwLzZttFi-02BNvRrYjzR5zZw62dg/UgS_5VBh97dWlqPUPJ2rAfO-0LzSM2jwH_Yj95nFZeU","width":3000,"height":3000}}}],"Authors":"Robert Jordan","Series":"Wheel of Time","Series Number":2,"Readings":["recarj0bSfG6luSDr"],"Date Added":"2020-01-19","ISBN":"0812517725","ISBN13":"9780812517729","Genres":["fantasy"],"Author Background":["by-men"],"Number of Pages":705},"Rating":4,"Read In Year":"2017","Page Count":[705]},{"Id":"Thu 09-07-2017 to Tue 09-19-2017","Started On":"2017-09-07","Finished On":"2017-09-19","Book":{"Title":"The Fires of Heaven","Cover":[{"id":"attAglkrE0bRUHOeG","width":184,"height":300,"url":"https://v5.airtableusercontent.com/v3/u/49/49/1768197600000/0d5ligcWNX_0oR6j1ht-lw/CBKrq2dsqgHQmfKZoGiiLhNcbujv1y8xmV4zlzkuOtEHqhhwv6GlsGrST0EUj0YjMymvbTRFT5CO2EA7qfYhaEIMj7KwQsymmiTr4AlPoBEsJFvRwgHTOXr_9HcOMSNGfeLhOPb2RcNKFZ-YEKdSdg/wSNwhDdI_aGHeMdly4KgYClfDJ-b8ZDIOFo3cO1r-p8","filename":"140975._SY300_.jpg","size":20257,"type":"image/jpeg","thumbnails":{"small":{"url":"https://v5.airtableusercontent.com/v3/u/49/49/1768197600000/pAxt62X_1r1k50TF-b4zLA/fati0N4ohVvjD7NpOswAcgiz4s3xOKERBmSvFb8ZI4Qh-3dbA7mbwmjMjfEKPQRjgEL5NH-kYEDdeWYFPq6YqlcwsntapRc1gxZWMq7QCOl9WlYjw